tcpdump: listening on en0, link-type EN10MB (Ethernet), snapshot length 96 bytes
09:04:55.122330 IP (tos 0x0, ttl 64, id 0, offset 0, flags [DF], proto TCP (6), length 64)
    172.25.176.249.60835 > 172.253.115.95.443: Flags [S], cksum 0xcc69 (correct), seq 1821831125, win 65535, options [mss 1460,nop,wscale 6,nop,nop,TS val 6332663 ecr 0,sackOK,eol], length 0
09:04:55.133549 IP (tos 0x0, ttl 118, id 0, offset 0, flags [DF], proto TCP (6), length 60)
    172.253.115.95.443 > 172.25.176.249.60835: Flags [S.], cksum 0x7cc5 (correct), seq 3525826584, ack 1821831126, win 65535, options [mss 1386,sackOK,TS val 1249995806 ecr 6332663,nop,wscale 8], length 0
09:04:55.133600 IP (tos 0x0, ttl 64, id 0, offset 0, flags [DF], proto TCP (6), length 52)
    172.25.176.249.60835 > 172.253.115.95.443: Flags [.], cksum 0xa331 (correct), ack 1, win 2061, options [nop,nop,TS val 6332673 ecr 1249995806], length 0
09:04:55.134068 IP (tos 0x0, ttl 64, id 0, offset 0, flags [DF], proto TCP (6), length 1426)
    172.25.176.249.60835 > 172.253.115.95.443: Flags [.], seq 1:1375, ack 1, win 2061, options [nop,nop,TS val 6332675 ecr 1249995806], length 1374
09:04:55.134072 IP (tos 0x0, ttl 64, id 0, offset 0, flags [DF], proto TCP (6), length 1008)
    172.25.176.249.60835 > 172.253.115.95.443: Flags [P.], seq 1375:2331, ack 1, win 2061, options [nop,nop,TS val 6332675 ecr 1249995806], length 956
09:04:55.146591 IP (tos 0x0, ttl 118, id 62707, offset 0, flags [none], proto TCP (6), length 52)
    172.253.115.95.443 > 172.25.176.249.60835: Flags [.], cksum 0x9e04 (correct), ack 2331, win 1041, options [nop,nop,TS val 1249995819 ecr 6332675], length 0
09:04:55.146870 IP (tos 0x0, ttl 118, id 62708, offset 0, flags [none], proto TCP (6), length 1426)
    172.253.115.95.443 > 172.25.176.249.60835: Flags [.], seq 1:1375, ack 2331, win 1041, options [nop,nop,TS val 1249995819 ecr 6332675], length 1374
09:04:55.146896 IP (tos 0x0, ttl 64, id 0, offset 0, flags [DF], proto TCP (6), length 52)
    172.25.176.249.60835 > 172.253.115.95.443: Flags [.], cksum 0x94b3 (correct), ack 1375, win 2040, options [nop,nop,TS val 6332687 ecr 1249995819], length 0
09:04:55.147134 IP (tos 0x0, ttl 118, id 62709, offset 0, flags [none], proto TCP (6), length 169)
    172.253.115.95.443 > 172.25.176.249.60835: Flags [P.], seq 1375:1492, ack 2331, win 1041, options [nop,nop,TS val 1249995819 ecr 6332675], length 117
09:04:55.147149 IP (tos 0x0, ttl 64, id 0, offset 0, flags [DF], proto TCP (6), length 52)
    172.25.176.249.60835 > 172.253.115.95.443: Flags [.], cksum 0x9437 (correct), ack 1492, win 2047, options [nop,nop,TS val 6332687 ecr 1249995819], length 0
09:04:55.147288 IP (tos 0x0, ttl 64, id 0, offset 0, flags [DF], proto TCP (6), length 142)
    172.25.176.249.60835 > 172.253.115.95.443: Flags [P.], seq 2331:2421, ack 1492, win 2048, options [nop,nop,TS val 6332687 ecr 1249995819], length 90
09:04:55.147436 IP (tos 0x0, ttl 64, id 0, offset 0, flags [DF], proto TCP (6), length 144)
    172.25.176.249.60835 > 172.253.115.95.443: Flags [P.], seq 2421:2513, ack 1492, win 2048, options [nop,nop,TS val 6332687 ecr 1249995819], length 92
09:04:55.147622 IP (tos 0x0, ttl 64, id 0, offset 0, flags [DF], proto TCP (6), length 494)
    172.25.176.249.60835 > 172.253.115.95.443: Flags [P.], seq 2513:2955, ack 1492, win 2048, options [nop,nop,TS val 6332688 ecr 1249995819], length 442
09:04:55.159322 IP (tos 0x0, ttl 118, id 62710, offset 0, flags [none], proto TCP (6), length 1066)
    172.253.115.95.443 > 172.25.176.249.60835: Flags [P.], seq 1492:2506, ack 2513, win 1041, options [nop,nop,TS val 1249995831 ecr 6332687], length 1014
09:04:55.159328 IP (tos 0x0, ttl 118, id 62711, offset 0, flags [none], proto TCP (6), length 83)
    172.253.115.95.443 > 172.25.176.249.60835: Flags [P.], seq 2506:2537, ack 2513, win 1041, options [nop,nop,TS val 1249995831 ecr 6332687], length 31
09:04:55.159486 IP (tos 0x0, ttl 64, id 0, offset 0, flags [DF], proto TCP (6), length 52)
    172.25.176.249.60835 > 172.253.115.95.443: Flags [.], cksum 0x8da8 (correct), ack 2537, win 2032, options [nop,nop,TS val 6332700 ecr 1249995831], length 0
09:04:55.159799 IP (tos 0x0, ttl 64, id 0, offset 0, flags [DF], proto TCP (6), length 83)
    172.25.176.249.60835 > 172.253.115.95.443: Flags [P.], seq 2955:2986, ack 2537, win 2048, options [nop,nop,TS val 6332700 ecr 1249995831], length 31
09:04:55.162297 IP (tos 0x0, ttl 118, id 62712, offset 0, flags [none], proto TCP (6), length 459)
    172.253.115.95.443 > 172.25.176.249.60835: Flags [P.], seq 2537:2944, ack 2955, win 1040, options [nop,nop,TS val 1249995835 ecr 6332688], length 407
09:04:55.162298 IP (tos 0x0, ttl 118, id 62713, offset 0, flags [none], proto TCP (6), length 83)
    172.253.115.95.443 > 172.25.176.249.60835: Flags [P.], seq 2944:2975, ack 2955, win 1040, options [nop,nop,TS val 1249995835 ecr 6332688], length 31
09:04:55.162316 IP (tos 0x0, ttl 64, id 0, offset 0, flags [DF], proto TCP (6), length 52)
    172.25.176.249.60835 > 172.253.115.95.443: Flags [.], cksum 0x8bc2 (correct), ack 2975, win 2042, options [nop,nop,TS val 6332703 ecr 1249995835], length 0
09:04:55.162874 IP (tos 0x0, ttl 118, id 62714, offset 0, flags [none], proto TCP (6), length 91)
    172.253.115.95.443 > 172.25.176.249.60835: Flags [P.], seq 2975:3014, ack 2955, win 1040, options [nop,nop,TS val 1249995835 ecr 6332688], length 39
09:04:55.162897 IP (tos 0x0, ttl 64, id 0, offset 0, flags [DF], proto TCP (6), length 52)
    172.25.176.249.60835 > 172.253.115.95.443: Flags [.], cksum 0x8b95 (correct), ack 3014, win 2048, options [nop,nop,TS val 6332703 ecr 1249995835], length 0
09:04:55.162978 IP (tos 0x0, ttl 64, id 0, offset 0, flags [DF], proto TCP (6), length 91)
    172.25.176.249.60835 > 172.253.115.95.443: Flags [P.], seq 2986:3025, ack 3014, win 2048, options [nop,nop,TS val 6332703 ecr 1249995835], length 39
09:04:55.174234 IP (tos 0x0, ttl 118, id 62715, offset 0, flags [none], proto TCP (6), length 52)
    172.253.115.95.443 > 172.25.176.249.60835: Flags [.], cksum 0x8f55 (correct), ack 3025, win 1040, options [nop,nop,TS val 1249995847 ecr 6332700], length 0
09:04:58.786481 IP (tos 0x0, ttl 64, id 0, offset 0, flags [DF], proto TCP (6), length 64)
    172.25.176.249.60836 > 172.253.115.101.443: Flags [S], cksum 0xc1de (correct), seq 1607299954, win 65535, options [mss 1460,nop,wscale 6,nop,nop,TS val 2958918826 ecr 0,sackOK,eol], length 0
09:04:58.798605 IP (tos 0x0, ttl 118, id 0, offset 0, flags [DF], proto TCP (6), length 60)
    172.253.115.101.443 > 172.25.176.249.60836: Flags [S.], cksum 0x3290 (correct), seq 2078971372, ack 1607299955, win 65535, options [mss 1386,sackOK,TS val 398423796 ecr 2958918826,nop,wscale 8], length 0
09:04:58.798657 IP (tos 0x0, ttl 64, id 0, offset 0, flags [DF], proto TCP (6), length 52)
    172.25.176.249.60836 > 172.253.115.101.443: Flags [.], cksum 0x58fa (correct), ack 1, win 2061, options [nop,nop,TS val 2958918838 ecr 398423796], length 0
09:04:58.798779 IP (tos 0x0, ttl 64, id 0, offset 0, flags [DF], proto TCP (6), length 1426)
    172.25.176.249.60836 > 172.253.115.101.443: Flags [.], seq 1:1375, ack 1, win 2061, options [nop,nop,TS val 2958918838 ecr 398423796], length 1374
09:04:58.798782 IP (tos 0x0, ttl 64, id 0, offset 0, flags [DF], proto TCP (6), length 501)
    172.25.176.249.60836 > 172.253.115.101.443: Flags [P.], seq 1375:1824, ack 1, win 2061, options [nop,nop,TS val 2958918838 ecr 398423796], length 449
09:04:58.814561 IP (tos 0x0, ttl 118, id 49528, offset 0, flags [none], proto TCP (6), length 52)
    172.253.115.101.443 > 172.25.176.249.60836: Flags [.], cksum 0x5787 (correct), ack 1375, win 1045, options [nop,nop,TS val 398423809 ecr 2958918838], length 0
09:04:58.814564 IP (tos 0x0, ttl 118, id 49529, offset 0, flags [none], proto TCP (6), length 52)
    172.253.115.101.443 > 172.25.176.249.60836: Flags [.], cksum 0x55c7 (correct), ack 1824, win 1044, options [nop,nop,TS val 398423809 ecr 2958918838], length 0
09:04:58.817227 IP (tos 0x0, ttl 118, id 49530, offset 0, flags [none], proto TCP (6), length 1426)
    172.253.115.101.443 > 172.25.176.249.60836: Flags [.], seq 1:1375, ack 1824, win 1044, options [nop,nop,TS val 398423810 ecr 2958918838], length 1374
09:04:58.817228 IP (tos 0x0, ttl 118, id 49531, offset 0, flags [none], proto TCP (6), length 1426)
    172.253.115.101.443 > 172.25.176.249.60836: Flags [P.], seq 1375:2749, ack 1824, win 1044, options [nop,nop,TS val 398423810 ecr 2958918838], length 1374
09:04:58.817228 IP (tos 0x0, ttl 118, id 49532, offset 0, flags [none], proto TCP (6), length 1426)
    172.253.115.101.443 > 172.25.176.249.60836: Flags [.], seq 2749:4123, ack 1824, win 1044, options [nop,nop,TS val 398423810 ecr 2958918838], length 1374
09:04:58.817230 IP (tos 0x0, ttl 118, id 49533, offset 0, flags [none], proto TCP (6), length 1426)
    172.253.115.101.443 > 172.25.176.249.60836: Flags [P.], seq 4123:5497, ack 1824, win 1044, options [nop,nop,TS val 398423810 ecr 2958918838], length 1374
09:04:58.817230 IP (tos 0x0, ttl 118, id 49534, offset 0, flags [none], proto TCP (6), length 1426)
    172.253.115.101.443 > 172.25.176.249.60836: Flags [.], seq 5497:6871, ack 1824, win 1044, options [nop,nop,TS val 398423811 ecr 2958918838], length 1374
09:04:58.817231 IP (tos 0x0, ttl 118, id 49535, offset 0, flags [none], proto TCP (6), length 1082)
    172.253.115.101.443 > 172.25.176.249.60836: Flags [P.], seq 6871:7901, ack 1824, win 1044, options [nop,nop,TS val 398423811 ecr 2958918838], length 1030
09:04:58.817305 IP (tos 0x0, ttl 64, id 0, offset 0, flags [DF], proto TCP (6), length 52)
    172.25.176.249.60836 > 172.253.115.101.443: Flags [.], cksum 0x3358 (correct), ack 7901, win 1938, options [nop,nop,TS val 2958918857 ecr 398423811], length 0
09:04:58.817335 IP (tos 0x0, ttl 64, id 0, offset 0, flags [DF], proto TCP (6), length 52)
    172.25.176.249.60836 > 172.253.115.101.443: Flags [.], cksum 0x32ea (correct), ack 7901, win 2048, options [nop,nop,TS val 2958918857 ecr 398423811], length 0
09:04:58.818000 IP (tos 0x0, ttl 64, id 0, offset 0, flags [DF], proto TCP (6), length 126)
    172.25.176.249.60836 > 172.253.115.101.443: Flags [P.], seq 1824:1898, ack 7901, win 2048, options [nop,nop,TS val 2958918857 ecr 398423811], length 74
09:04:58.818111 IP (tos 0x0, ttl 64, id 0, offset 0, flags [DF], proto TCP (6), length 144)
    172.25.176.249.60836 > 172.253.115.101.443: Flags [P.], seq 1898:1990, ack 7901, win 2048, options [nop,nop,TS val 2958918857 ecr 398423811], length 92
09:04:58.818150 IP (tos 0x0, ttl 64, id 0, offset 0, flags [DF], proto TCP (6), length 1426)
    172.25.176.249.60836 > 172.253.115.101.443: Flags [.], seq 1990:3364, ack 7901, win 2048, options [nop,nop,TS val 2958918857 ecr 398423811], length 1374
09:04:58.818151 IP (tos 0x0, ttl 64, id 1, offset 0, flags [DF], proto TCP (6), length 1426)
    172.25.176.249.60836 > 172.253.115.101.443: Flags [.], seq 3364:4738, ack 7901, win 2048, options [nop,nop,TS val 2958918857 ecr 398423811], length 1374
09:04:58.818153 IP (tos 0x0, ttl 64, id 0, offset 0, flags [DF], proto TCP (6), length 375)
    172.25.176.249.60836 > 172.253.115.101.443: Flags [P.], seq 4738:5061, ack 7901, win 2048, options [nop,nop,TS val 2958918857 ecr 398423811], length 323
09:04:58.831007 IP (tos 0x0, ttl 118, id 49536, offset 0, flags [none], proto TCP (6), length 52)
    172.253.115.101.443 > 172.25.176.249.60836: Flags [.], cksum 0x30c6 (correct), ack 3364, win 1038, options [nop,nop,TS val 398423829 ecr 2958918857], length 0
09:04:58.831009 IP (tos 0x0, ttl 118, id 49537, offset 0, flags [none], proto TCP (6), length 64)
    172.253.115.101.443 > 172.25.176.249.60836: Flags [.], cksum 0x2de8 (correct), ack 3364, win 1038, options [nop,nop,TS val 398423829 ecr 2958918857,nop,nop,sack 1 {4738:5061}], length 0
09:04:58.831010 IP (tos 0x0, ttl 118, id 49538, offset 0, flags [none], proto TCP (6), length 52)
    172.253.115.101.443 > 172.25.176.249.60836: Flags [.], cksum 0x2a2b (correct), ack 5061, win 1032, options [nop,nop,TS val 398423829 ecr 2958918857], length 0
09:04:58.831074 IP (tos 0x0, ttl 64, id 0, offset 0, flags [DF], proto TCP (6), length 1426)
    172.25.176.249.60836 > 172.253.115.101.443: Flags [.], seq 3364:4738, ack 7901, win 2048, options [nop,nop,TS val 2958918871 ecr 398423829], length 1374
09:04:58.831183 IP (tos 0x0, ttl 118, id 49539, offset 0, flags [none], proto TCP (6), length 1016)
    172.253.115.101.443 > 172.25.176.249.60836: Flags [P.], seq 7901:8865, ack 5061, win 1032, options [nop,nop,TS val 398423829 ecr 2958918857], length 964
09:04:58.831205 IP (tos 0x0, ttl 64, id 0, offset 0, flags [DF], proto TCP (6), length 52)
    172.25.176.249.60836 > 172.253.115.101.443: Flags [.], cksum 0x2270 (correct), ack 8865, win 2033, options [nop,nop,TS val 2958918871 ecr 398423829], length 0
09:04:58.831294 IP (tos 0x0, ttl 64, id 0, offset 0, flags [DF], proto TCP (6), length 83)
    172.25.176.249.60836 > 172.253.115.101.443: Flags [P.], seq 5061:5092, ack 8865, win 2048, options [nop,nop,TS val 2958918871 ecr 398423829], length 31
09:04:58.831692 IP (tos 0x0, ttl 118, id 49540, offset 0, flags [none], proto TCP (6), length 83)
    172.253.115.101.443 > 172.25.176.249.60836: Flags [P.], seq 8865:8896, ack 5061, win 1032, options [nop,nop,TS val 398423829 ecr 2958918857], length 31
09:04:58.831714 IP (tos 0x0, ttl 64, id 0, offset 0, flags [DF], proto TCP (6), length 52)
    172.25.176.249.60836 > 172.253.115.101.443: Flags [.], cksum 0x2223 (correct), ack 8896, win 2048, options [nop,nop,TS val 2958918871 ecr 398423829], length 0
09:04:58.841966 IP (tos 0x0, ttl 118, id 49541, offset 0, flags [none], proto TCP (6), length 64)
    172.253.115.101.443 > 172.25.176.249.60836: Flags [.], cksum 0x2a00 (correct), ack 5061, win 1032, options [nop,nop,TS val 398423840 ecr 2958918857,nop,nop,sack 1 {3364:4738}], length 0
09:04:58.844281 IP (tos 0x0, ttl 118, id 49542, offset 0, flags [none], proto TCP (6), length 52)
    172.253.115.101.443 > 172.25.176.249.60836: Flags [.], cksum 0x260e (correct), ack 5092, win 1032, options [nop,nop,TS val 398423842 ecr 2958918871], length 0
09:04:58.896457 IP (tos 0x0, ttl 118, id 49543, offset 0, flags [none], proto TCP (6), length 1426)
    172.253.115.101.443 > 172.25.176.249.60836: Flags [P.], seq 8896:10270, ack 5092, win 1032, options [nop,nop,TS val 398423894 ecr 2958918871], length 1374
09:04:58.896462 IP (tos 0x0, ttl 118, id 49544, offset 0, flags [none], proto TCP (6), length 1426)
    172.253.115.101.443 > 172.25.176.249.60836: Flags [P.], seq 10270:11644, ack 5092, win 1032, options [nop,nop,TS val 398423894 ecr 2958918871], length 1374
09:04:58.896465 IP (tos 0x0, ttl 118, id 49545, offset 0, flags [none], proto TCP (6), length 1426)
    172.253.115.101.443 > 172.25.176.249.60836: Flags [.], seq 11644:13018, ack 5092, win 1032, options [nop,nop,TS val 398423895 ecr 2958918871], length 1374
09:04:58.896589 IP (tos 0x0, ttl 64, id 0, offset 0, flags [DF], proto TCP (6), length 52)
    172.25.176.249.60836 > 172.253.115.101.443: Flags [.], cksum 0x11c6 (correct), ack 13018, win 1984, options [nop,nop,TS val 2958918936 ecr 398423895], length 0
09:04:58.896691 IP (tos 0x0, ttl 64, id 0, offset 0, flags [DF], proto TCP (6), length 52)
    172.25.176.249.60836 > 172.253.115.101.443: Flags [.], cksum 0x1186 (correct), ack 13018, win 2048, options [nop,nop,TS val 2958918936 ecr 398423895], length 0
09:04:58.896959 IP (tos 0x0, ttl 118, id 49546, offset 0, flags [none], proto TCP (6), length 1426)
    172.253.115.101.443 > 172.25.176.249.60836: Flags [P.], seq 13018:14392, ack 5092, win 1032, options [nop,nop,TS val 398423895 ecr 2958918871], length 1374
09:04:58.896962 IP (tos 0x0, ttl 118, id 49547, offset 0, flags [none], proto TCP (6), length 1426)
    172.253.115.101.443 > 172.25.176.249.60836: Flags [.], seq 14392:15766, ack 5092, win 1032, options [nop,nop,TS val 398423895 ecr 2958918871], length 1374
09:04:58.897009 IP (tos 0x0, ttl 64, id 0, offset 0, flags [DF], proto TCP (6), length 52)
    172.25.176.249.60836 > 172.253.115.101.443: Flags [.], cksum 0x06f4 (correct), ack 15766, win 2006, options [nop,nop,TS val 2958918936 ecr 398423895], length 0
09:04:58.897718 IP (tos 0x0, ttl 118, id 49548, offset 0, flags [none], proto TCP (6), length 1426)
    172.253.115.101.443 > 172.25.176.249.60836: Flags [.], seq 15766:17140, ack 5092, win 1032, options [nop,nop,TS val 398423895 ecr 2958918871], length 1374
09:04:58.897720 IP (tos 0x0, ttl 118, id 49549, offset 0, flags [none], proto TCP (6), length 1137)
    172.253.115.101.443 > 172.25.176.249.60836: Flags [P.], seq 17140:18225, ack 5092, win 1032, options [nop,nop,TS val 398423895 ecr 2958918871], length 1085
09:04:58.897745 IP (tos 0x0, ttl 64, id 0, offset 0, flags [DF], proto TCP (6), length 52)
    172.25.176.249.60836 > 172.253.115.101.443: Flags [.], cksum 0xfd53 (correct), ack 18225, win 2010, options [nop,nop,TS val 2958918937 ecr 398423895], length 0
09:04:58.898336 IP (tos 0x0, ttl 118, id 49550, offset 0, flags [none], proto TCP (6), length 1426)
    172.253.115.101.443 > 172.25.176.249.60836: Flags [.], seq 18225:19599, ack 5092, win 1032, options [nop,nop,TS val 398423896 ecr 2958918871], length 1374
09:04:58.898338 IP (tos 0x0, ttl 118, id 49551, offset 0, flags [none], proto TCP (6), length 1426)
    172.253.115.101.443 > 172.25.176.249.60836: Flags [.], seq 19599:20973, ack 5092, win 1032, options [nop,nop,TS val 398423896 ecr 2958918871], length 1374
09:04:58.898368 IP (tos 0x0, ttl 64, id 0, offset 0, flags [DF], proto TCP (6), length 52)
    172.25.176.249.60836 > 172.253.115.101.443: Flags [.], cksum 0xf29a (correct), ack 20973, win 2006, options [nop,nop,TS val 2958918937 ecr 398423896], length 0
09:04:58.899316 IP (tos 0x0, ttl 118, id 49552, offset 0, flags [none], proto TCP (6), length 1426)
    172.253.115.101.443 > 172.25.176.249.60836: Flags [P.], seq 20973:22347, ack 5092, win 1032, options [nop,nop,TS val 398423896 ecr 2958918871], length 1374
09:04:58.899317 IP (tos 0x0, ttl 118, id 49553, offset 0, flags [none], proto TCP (6), length 1426)
    172.253.115.101.443 > 172.25.176.249.60836: Flags [.], seq 22347:23721, ack 5092, win 1032, options [nop,nop,TS val 398423897 ecr 2958918871], length 1374
09:04:58.899319 IP (tos 0x0, ttl 118, id 49554, offset 0, flags [none], proto TCP (6), length 1426)
    172.253.115.101.443 > 172.25.176.249.60836: Flags [.], seq 23721:25095, ack 5092, win 1032, options [nop,nop,TS val 398423897 ecr 2958918871], length 1374
09:04:58.899345 IP (tos 0x0, ttl 64, id 0, offset 0, flags [DF], proto TCP (6), length 52)
    172.25.176.249.60836 > 172.253.115.101.443: Flags [.], cksum 0xe293 (correct), ack 25095, win 1984, options [nop,nop,TS val 2958918939 ecr 398423897], length 0
09:04:58.899430 IP (tos 0x0, ttl 64, id 0, offset 0, flags [DF], proto TCP (6), length 52)
    172.25.176.249.60836 > 172.253.115.101.443: Flags [.], cksum 0xe253 (correct), ack 25095, win 2048, options [nop,nop,TS val 2958918939 ecr 398423897], length 0
09:04:58.900228 IP (tos 0x0, ttl 118, id 49555, offset 0, flags [none], proto TCP (6), length 1426)
    172.253.115.101.443 > 172.25.176.249.60836: Flags [P.], seq 25095:26469, ack 5092, win 1032, options [nop,nop,TS val 398423897 ecr 2958918871], length 1374
09:04:58.900229 IP (tos 0x0, ttl 118, id 49556, offset 0, flags [none], proto TCP (6), length 1426)
    172.253.115.101.443 > 172.25.176.249.60836: Flags [.], seq 26469:27843, ack 5092, win 1032, options [nop,nop,TS val 398423898 ecr 2958918871], length 1374
09:04:58.900230 IP (tos 0x0, ttl 118, id 49557, offset 0, flags [none], proto TCP (6), length 1426)
    172.253.115.101.443 > 172.25.176.249.60836: Flags [.], seq 27843:29217, ack 5092, win 1032, options [nop,nop,TS val 398423898 ecr 2958918871], length 1374
09:04:58.900252 IP (tos 0x0, ttl 64, id 0, offset 0, flags [DF], proto TCP (6), length 52)
    172.25.176.249.60836 > 172.253.115.101.443: Flags [.], cksum 0xd278 (correct), ack 29217, win 1984, options [nop,nop,TS val 2958918939 ecr 398423898], length 0
09:04:58.900278 IP (tos 0x0, ttl 64, id 0, offset 0, flags [DF], proto TCP (6), length 52)
    172.25.176.249.60836 > 172.253.115.101.443: Flags [.], cksum 0xd238 (correct), ack 29217, win 2048, options [nop,nop,TS val 2958918939 ecr 398423898], length 0
09:04:58.901613 IP (tos 0x0, ttl 118, id 49558, offset 0, flags [none], proto TCP (6), length 1426)
    172.253.115.101.443 > 172.25.176.249.60836: Flags [P.], seq 29217:30591, ack 5092, win 1032, options [nop,nop,TS val 398423898 ecr 2958918871], length 1374
09:04:58.901614 IP (tos 0x0, ttl 118, id 49559, offset 0, flags [none], proto TCP (6), length 1426)
    172.253.115.101.443 > 172.25.176.249.60836: Flags [.], seq 30591:31965, ack 5092, win 1032, options [nop,nop,TS val 398423899 ecr 2958918871], length 1374
09:04:58.901629 IP (tos 0x0, ttl 64, id 0, offset 0, flags [DF], proto TCP (6), length 52)
    172.25.176.249.60836 > 172.253.115.101.443: Flags [.], cksum 0xc7a3 (correct), ack 31965, win 2006, options [nop,nop,TS val 2958918941 ecr 398423899], length 0
09:04:58.903724 IP (tos 0x0, ttl 118, id 49560, offset 0, flags [none], proto TCP (6), length 1426)
    172.253.115.101.443 > 172.25.176.249.60836: Flags [.], seq 31965:33339, ack 5092, win 1032, options [nop,nop,TS val 398423899 ecr 2958918871], length 1374
09:04:58.903726 IP (tos 0x0, ttl 118, id 49561, offset 0, flags [none], proto TCP (6), length 1426)
    172.253.115.101.443 > 172.25.176.249.60836: Flags [P.], seq 33339:34713, ack 5092, win 1032, options [nop,nop,TS val 398423899 ecr 2958918871], length 1374
09:04:58.903727 IP (tos 0x0, ttl 118, id 49562, offset 0, flags [none], proto TCP (6), length 1426)
    172.253.115.101.443 > 172.25.176.249.60836: Flags [.], seq 34713:36087, ack 5092, win 1032, options [nop,nop,TS val 398423900 ecr 2958918871], length 1374
09:04:58.903728 IP (tos 0x0, ttl 118, id 49563, offset 0, flags [none], proto TCP (6), length 1426)
    172.253.115.101.443 > 172.25.176.249.60836: Flags [.], seq 36087:37461, ack 5092, win 1032, options [nop,nop,TS val 398423900 ecr 2958918871], length 1374
09:04:58.903729 IP (tos 0x0, ttl 118, id 49564, offset 0, flags [none], proto TCP (6), length 1426)
    172.253.115.101.443 > 172.25.176.249.60836: Flags [P.], seq 37461:38835, ack 5092, win 1032, options [nop,nop,TS val 398423900 ecr 2958918871], length 1374
09:04:58.903776 IP (tos 0x0, ttl 64, id 0, offset 0, flags [DF], proto TCP (6), length 52)
    172.25.176.249.60836 > 172.253.115.101.443: Flags [.], cksum 0xad0b (correct), ack 38835, win 1941, options [nop,nop,TS val 2958918943 ecr 398423900], length 0
09:04:58.903830 IP (tos 0x0, ttl 64, id 0, offset 0, flags [DF], proto TCP (6), length 52)
    172.25.176.249.60836 > 172.253.115.101.443: Flags [.], cksum 0xaca0 (correct), ack 38835, win 2048, options [nop,nop,TS val 2958918943 ecr 398423900], length 0
09:04:58.908001 IP (tos 0x0, ttl 118, id 49565, offset 0, flags [none], proto TCP (6), length 1426)
    172.253.115.101.443 > 172.25.176.249.60836: Flags [.], seq 38835:40209, ack 5092, win 1032, options [nop,nop,TS val 398423906 ecr 2958918936], length 1374
09:04:58.908038 IP (tos 0x0, ttl 64, id 0, offset 0, flags [DF], proto TCP (6), length 52)
    172.25.176.249.60836 > 172.253.115.101.443: Flags [.], cksum 0xa74d (correct), ack 40209, win 2027, options [nop,nop,TS val 2958918947 ecr 398423906], length 0
09:04:58.910175 IP (tos 0x0, ttl 118, id 49566, offset 0, flags [none], proto TCP (6), length 1426)
    172.253.115.101.443 > 172.25.176.249.60836: Flags [.], seq 40209:41583, ack 5092, win 1032, options [nop,nop,TS val 398423906 ecr 2958918936], length 1374
09:04:58.910177 IP (tos 0x0, ttl 118, id 49567, offset 0, flags [none], proto TCP (6), length 1426)
    172.253.115.101.443 > 172.25.176.249.60836: Flags [P.], seq 41583:42957, ack 5092, win 1032, options [nop,nop,TS val 398423906 ecr 2958918936], length 1374
09:04:58.910178 IP (tos 0x0, ttl 118, id 49568, offset 0, flags [none], proto TCP (6), length 1426)
    172.253.115.101.443 > 172.25.176.249.60836: Flags [.], seq 42957:44331, ack 5092, win 1032, options [nop,nop,TS val 398423906 ecr 2958918936], length 1374
09:04:58.910178 IP (tos 0x0, ttl 118, id 49569, offset 0, flags [none], proto TCP (6), length 1426)
    172.253.115.101.443 > 172.25.176.249.60836: Flags [.], seq 44331:45705, ack 5092, win 1032, options [nop,nop,TS val 398423906 ecr 2958918936], length 1374
09:04:58.910179 IP (tos 0x0, ttl 118, id 49570, offset 0, flags [none], proto TCP (6), length 1426)
    172.253.115.101.443 > 172.25.176.249.60836: Flags [P.], seq 45705:47079, ack 5092, win 1032, options [nop,nop,TS val 398423906 ecr 2958918936], length 1374
09:04:58.910180 IP (tos 0x0, ttl 118, id 49571, offset 0, flags [none], proto TCP (6), length 1426)
    172.253.115.101.443 > 172.25.176.249.60836: Flags [.], seq 47079:48453, ack 5092, win 1032, options [nop,nop,TS val 398423907 ecr 2958918936], length 1374
09:04:58.910181 IP (tos 0x0, ttl 118, id 49572, offset 0, flags [none], proto TCP (6), length 1426)
    172.253.115.101.443 > 172.25.176.249.60836: Flags [.], seq 48453:49827, ack 5092, win 1032, options [nop,nop,TS val 398423907 ecr 2958918936], length 1374
09:04:58.910218 IP (tos 0x0, ttl 64, id 0, offset 0, flags [DF], proto TCP (6), length 52)
    172.25.176.249.60836 > 172.253.115.101.443: Flags [.], cksum 0x8238 (correct), ack 49827, win 1898, options [nop,nop,TS val 2958918950 ecr 398423907], length 0
09:04:58.910254 IP (tos 0x0, ttl 64, id 0, offset 0, flags [DF], proto TCP (6), length 52)
    172.25.176.249.60836 > 172.253.115.101.443: Flags [.], cksum 0x81a2 (correct), ack 49827, win 2048, options [nop,nop,TS val 2958918950 ecr 398423907], length 0
09:04:58.910758 IP (tos 0x0, ttl 118, id 49573, offset 0, flags [none], proto TCP (6), length 1426)
    172.253.115.101.443 > 172.25.176.249.60836: Flags [P.], seq 49827:51201, ack 5092, win 1032, options [nop,nop,TS val 398423907 ecr 2958918936], length 1374
09:04:58.910759 IP (tos 0x0, ttl 118, id 49574, offset 0, flags [none], proto TCP (6), length 1426)
    172.253.115.101.443 > 172.25.176.249.60836: Flags [.], seq 51201:52575, ack 5092, win 1032, options [nop,nop,TS val 398423908 ecr 2958918937], length 1374
09:04:58.910760 IP (tos 0x0, ttl 118, id 49575, offset 0, flags [none], proto TCP (6), length 1426)
    172.253.115.101.443 > 172.25.176.249.60836: Flags [.], seq 52575:53949, ack 5092, win 1032, options [nop,nop,TS val 398423908 ecr 2958918937], length 1374
09:04:58.910780 IP (tos 0x0, ttl 64, id 0, offset 0, flags [DF], proto TCP (6), length 52)
    172.25.176.249.60836 > 172.253.115.101.443: Flags [.], cksum 0x71c7 (correct), ack 53949, win 1984, options [nop,nop,TS val 2958918950 ecr 398423908], length 0
09:04:58.910800 IP (tos 0x0, ttl 64, id 0, offset 0, flags [DF], proto TCP (6), length 52)
    172.25.176.249.60836 > 172.253.115.101.443: Flags [.], cksum 0x7187 (correct), ack 53949, win 2048, options [nop,nop,TS val 2958918950 ecr 398423908], length 0
09:04:58.911017 IP (tos 0x0, ttl 118, id 49576, offset 0, flags [none], proto TCP (6), length 1426)
    172.253.115.101.443 > 172.25.176.249.60836: Flags [P.], seq 53949:55323, ack 5092, win 1032, options [nop,nop,TS val 398423908 ecr 2958918937], length 1374
09:04:58.911018 IP (tos 0x0, ttl 118, id 49577, offset 0, flags [none], proto TCP (6), length 1426)
    172.253.115.101.443 > 172.25.176.249.60836: Flags [.], seq 55323:56697, ack 5092, win 1032, options [nop,nop,TS val 398423909 ecr 2958918937], length 1374
09:04:58.911019 IP (tos 0x0, ttl 118, id 49578, offset 0, flags [none], proto TCP (6), length 1426)
    172.253.115.101.443 > 172.25.176.249.60836: Flags [.], seq 56697:58071, ack 5092, win 1032, options [nop,nop,TS val 398423909 ecr 2958918937], length 1374
09:04:58.911030 IP (tos 0x0, ttl 64, id 0, offset 0, flags [DF], proto TCP (6), length 52)
    172.25.176.249.60836 > 172.253.115.101.443: Flags [.], cksum 0x61ac (correct), ack 58071, win 1984, options [nop,nop,TS val 2958918950 ecr 398423909], length 0
09:04:58.911042 IP (tos 0x0, ttl 64, id 0, offset 0, flags [DF], proto TCP (6), length 52)
    172.25.176.249.60836 > 172.253.115.101.443: Flags [.], cksum 0x616c (correct), ack 58071, win 2048, options [nop,nop,TS val 2958918950 ecr 398423909], length 0
09:04:58.911279 IP (tos 0x0, ttl 118, id 49579, offset 0, flags [none], proto TCP (6), length 1426)
    172.253.115.101.443 > 172.25.176.249.60836: Flags [P.], seq 58071:59445, ack 5092, win 1032, options [nop,nop,TS val 398423909 ecr 2958918937], length 1374
09:04:58.911302 IP (tos 0x0, ttl 64, id 0, offset 0, flags [DF], proto TCP (6), length 52)
    172.25.176.249.60836 > 172.253.115.101.443: Flags [.], cksum 0x5c0d (correct), ack 59445, win 2048, options [nop,nop,TS val 2958918951 ecr 398423909], length 0
09:04:58.911860 IP (tos 0x0, ttl 118, id 49580, offset 0, flags [none], proto TCP (6), length 1426)
    172.253.115.101.443 > 172.25.176.249.60836: Flags [.], seq 59445:60819, ack 5092, win 1032, options [nop,nop,TS val 398423910 ecr 2958918937], length 1374
09:04:58.913574 IP (tos 0x0, ttl 118, id 49581, offset 0, flags [none], proto TCP (6), length 1426)
    172.253.115.101.443 > 172.25.176.249.60836: Flags [.], seq 60819:62193, ack 5092, win 1032, options [nop,nop,TS val 398423910 ecr 2958918937], length 1374
09:04:58.913575 IP (tos 0x0, ttl 118, id 49582, offset 0, flags [none], proto TCP (6), length 1426)
    172.253.115.101.443 > 172.25.176.249.60836: Flags [P.], seq 62193:63567, ack 5092, win 1032, options [nop,nop,TS val 398423910 ecr 2958918937], length 1374
09:04:58.913587 IP (tos 0x0, ttl 64, id 0, offset 0, flags [DF], proto TCP (6), length 52)
    172.25.176.249.60836 > 172.253.115.101.443: Flags [.], cksum 0x4c1a (correct), ack 63567, win 2006, options [nop,nop,TS val 2958918953 ecr 398423910], length 0
09:04:58.915470 IP (tos 0x0, ttl 118, id 49583, offset 0, flags [none], proto TCP (6), length 1426)
    172.253.115.101.443 > 172.25.176.249.60836: Flags [.], seq 63567:64941, ack 5092, win 1032, options [nop,nop,TS val 398423911 ecr 2958918939], length 1374
09:04:58.915472 IP (tos 0x0, ttl 118, id 49584, offset 0, flags [none], proto TCP (6), length 1426)
    172.253.115.101.443 > 172.25.176.249.60836: Flags [.], seq 64941:66315, ack 5092, win 1032, options [nop,nop,TS val 398423911 ecr 2958918939], length 1374
09:04:58.915473 IP (tos 0x0, ttl 118, id 49585, offset 0, flags [none], proto TCP (6), length 1426)
    172.253.115.101.443 > 172.25.176.249.60836: Flags [P.], seq 66315:67689, ack 5092, win 1032, options [nop,nop,TS val 398423911 ecr 2958918939], length 1374
09:04:58.915475 IP (tos 0x0, ttl 118, id 49586, offset 0, flags [none], proto TCP (6), length 1426)
    172.253.115.101.443 > 172.25.176.249.60836: Flags [.], seq 67689:69063, ack 5092, win 1032, options [nop,nop,TS val 398423912 ecr 2958918939], length 1374
09:04:58.915476 IP (tos 0x0, ttl 118, id 49587, offset 0, flags [none], proto TCP (6), length 1426)
    172.253.115.101.443 > 172.25.176.249.60836: Flags [.], seq 69063:70437, ack 5092, win 1032, options [nop,nop,TS val 398423912 ecr 2958918939], length 1374
09:04:58.915478 IP (tos 0x0, ttl 118, id 49588, offset 0, flags [none], proto TCP (6), length 1426)
    172.253.115.101.443 > 172.25.176.249.60836: Flags [P.], seq 70437:71811, ack 5092, win 1032, options [nop,nop,TS val 398423912 ecr 2958918939], length 1374
09:04:58.915479 IP (tos 0x0, ttl 118, id 49589, offset 0, flags [none], proto TCP (6), length 1426)
    172.253.115.101.443 > 172.25.176.249.60836: Flags [.], seq 71811:73185, ack 5092, win 1032, options [nop,nop,TS val 398423912 ecr 2958918939], length 1374
09:04:58.915480 IP (tos 0x0, ttl 118, id 49590, offset 0, flags [none], proto TCP (6), length 1426)
    172.253.115.101.443 > 172.25.176.249.60836: Flags [.], seq 73185:74559, ack 5092, win 1032, options [nop,nop,TS val 398423912 ecr 2958918939], length 1374
09:04:58.915482 IP (tos 0x0, ttl 118, id 49591, offset 0, flags [none], proto TCP (6), length 1426)
    172.253.115.101.443 > 172.25.176.249.60836: Flags [P.], seq 74559:75933, ack 5092, win 1032, options [nop,nop,TS val 398423912 ecr 2958918939], length 1374
09:04:58.915514 IP (tos 0x0, ttl 64, id 0, offset 0, flags [DF], proto TCP (6), length 52)
    172.25.176.249.60836 > 172.253.115.101.443: Flags [.], cksum 0x1c5f (correct), ack 75933, win 1855, options [nop,nop,TS val 2958918955 ecr 398423912], length 0
09:04:58.915550 IP (tos 0x0, ttl 64, id 0, offset 0, flags [DF], proto TCP (6), length 52)
    172.25.176.249.60836 > 172.253.115.101.443: Flags [.], cksum 0x1b9e (correct), ack 75933, win 2048, options [nop,nop,TS val 2958918955 ecr 398423912], length 0
09:04:58.915741 IP (tos 0x0, ttl 118, id 49592, offset 0, flags [none], proto TCP (6), length 1426)
    172.253.115.101.443 > 172.25.176.249.60836: Flags [.], seq 75933:77307, ack 5092, win 1032, options [nop,nop,TS val 398423913 ecr 2958918941], length 1374
09:04:58.915743 IP (tos 0x0, ttl 118, id 49593, offset 0, flags [none], proto TCP (6), length 1426)
    172.253.115.101.443 > 172.25.176.249.60836: Flags [.], seq 77307:78681, ack 5092, win 1032, options [nop,nop,TS val 398423913 ecr 2958918941], length 1374
09:04:58.915764 IP (tos 0x0, ttl 64, id 0, offset 0, flags [DF], proto TCP (6), length 52)
    172.25.176.249.60836 > 172.253.115.101.443: Flags [.], cksum 0x110b (correct), ack 78681, win 2006, options [nop,nop,TS val 2958918955 ecr 398423913], length 0
09:04:58.916685 IP (tos 0x0, ttl 118, id 49594, offset 0, flags [none], proto TCP (6), length 1426)
    172.253.115.101.443 > 172.25.176.249.60836: Flags [P.], seq 78681:80055, ack 5092, win 1032, options [nop,nop,TS val 398423913 ecr 2958918941], length 1374
09:04:58.916689 IP (tos 0x0, ttl 118, id 49595, offset 0, flags [none], proto TCP (6), length 1426)
    172.253.115.101.443 > 172.25.176.249.60836: Flags [.], seq 80055:81429, ack 5092, win 1032, options [nop,nop,TS val 398423914 ecr 2958918941], length 1374
09:04:58.916692 IP (tos 0x0, ttl 118, id 49596, offset 0, flags [none], proto TCP (6), length 1426)
    172.253.115.101.443 > 172.25.176.249.60836: Flags [.], seq 81429:82803, ack 5092, win 1032, options [nop,nop,TS val 398423914 ecr 2958918941], length 1374
09:04:58.916694 IP (tos 0x0, ttl 118, id 49597, offset 0, flags [none], proto TCP (6), length 1426)
    172.253.115.101.443 > 172.25.176.249.60836: Flags [P.], seq 82803:84177, ack 5092, win 1032, options [nop,nop,TS val 398423914 ecr 2958918941], length 1374
09:04:58.916725 IP (tos 0x0, ttl 64, id 0, offset 0, flags [DF], proto TCP (6), length 52)
    172.25.176.249.60836 > 172.253.115.101.443: Flags [.], cksum 0xfbbb (correct), ack 84177, win 1963, options [nop,nop,TS val 2958918956 ecr 398423914], length 0
09:04:58.916787 IP (tos 0x0, ttl 64, id 0, offset 0, flags [DF], proto TCP (6), length 52)
    172.25.176.249.60836 > 172.253.115.101.443: Flags [.], cksum 0xfb66 (correct), ack 84177, win 2048, options [nop,nop,TS val 2958918956 ecr 398423914], length 0
09:04:58.917724 IP (tos 0x0, ttl 118, id 49598, offset 0, flags [none], proto TCP (6), length 1426)
    172.253.115.101.443 > 172.25.176.249.60836: Flags [.], seq 84177:85551, ack 5092, win 1032, options [nop,nop,TS val 398423915 ecr 2958918943], length 1374
09:04:58.918030 IP (tos 0x0, ttl 118, id 49599, offset 0, flags [none], proto TCP (6), length 1426)
    172.253.115.101.443 > 172.25.176.249.60836: Flags [.], seq 85551:86925, ack 5092, win 1032, options [nop,nop,TS val 398423915 ecr 2958918943], length 1374
09:04:58.918032 IP (tos 0x0, ttl 118, id 49600, offset 0, flags [none], proto TCP (6), length 1426)
    172.253.115.101.443 > 172.25.176.249.60836: Flags [P.], seq 86925:88299, ack 5092, win 1032, options [nop,nop,TS val 398423915 ecr 2958918943], length 1374
09:04:58.918055 IP (tos 0x0, ttl 64, id 0, offset 0, flags [DF], proto TCP (6), length 52)
    172.25.176.249.60836 > 172.253.115.101.443: Flags [.], cksum 0xeb74 (correct), ack 88299, win 2006, options [nop,nop,TS val 2958918957 ecr 398423915], length 0
09:04:58.918559 IP (tos 0x0, ttl 118, id 49601, offset 0, flags [none], proto TCP (6), length 1426)
    172.253.115.101.443 > 172.25.176.249.60836: Flags [.], seq 88299:89673, ack 5092, win 1032, options [nop,nop,TS val 398423916 ecr 2958918943], length 1374
09:04:58.918562 IP (tos 0x0, ttl 118, id 49602, offset 0, flags [none], proto TCP (6), length 1426)
    172.253.115.101.443 > 172.25.176.249.60836: Flags [.], seq 89673:91047, ack 5092, win 1032, options [nop,nop,TS val 398423916 ecr 2958918943], length 1374
09:04:58.918601 IP (tos 0x0, ttl 64, id 0, offset 0, flags [DF], proto TCP (6), length 52)
    172.25.176.249.60836 > 172.253.115.101.443: Flags [.], cksum 0xe0b7 (correct), ack 91047, win 2006, options [nop,nop,TS val 2958918957 ecr 398423916], length 0
09:04:58.919337 IP (tos 0x0, ttl 118, id 49603, offset 0, flags [none], proto TCP (6), length 1426)
    172.253.115.101.443 > 172.25.176.249.60836: Flags [P.], seq 91047:92421, ack 5092, win 1032, options [nop,nop,TS val 398423916 ecr 2958918943], length 1374
09:04:58.919340 IP (tos 0x0, ttl 118, id 49604, offset 0, flags [none], proto TCP (6), length 1426)
    172.253.115.101.443 > 172.25.176.249.60836: Flags [.], seq 92421:93795, ack 5092, win 1032, options [nop,nop,TS val 398423917 ecr 2958918943], length 1374
09:04:58.919343 IP (tos 0x0, ttl 118, id 49605, offset 0, flags [none], proto TCP (6), length 1426)
    172.253.115.101.443 > 172.25.176.249.60836: Flags [.], seq 93795:95169, ack 5092, win 1032, options [nop,nop,TS val 398423917 ecr 2958918943], length 1374
09:04:58.919379 IP (tos 0x0, ttl 64, id 0, offset 0, flags [DF], proto TCP (6), length 52)
    172.25.176.249.60836 > 172.253.115.101.443: Flags [.], cksum 0xd0b0 (correct), ack 95169, win 1984, options [nop,nop,TS val 2958918959 ecr 398423917], length 0
09:04:58.919434 IP (tos 0x0, ttl 64, id 0, offset 0, flags [DF], proto TCP (6), length 52)
    172.25.176.249.60836 > 172.253.115.101.443: Flags [.], cksum 0xd070 (correct), ack 95169, win 2048, options [nop,nop,TS val 2958918959 ecr 398423917], length 0
09:04:58.919562 IP (tos 0x0, ttl 118, id 49606, offset 0, flags [none], proto TCP (6), length 1426)
    172.253.115.101.443 > 172.25.176.249.60836: Flags [P.], seq 95169:96543, ack 5092, win 1032, options [nop,nop,TS val 398423917 ecr 2958918943], length 1374
09:04:58.919589 IP (tos 0x0, ttl 64, id 0, offset 0, flags [DF], proto TCP (6), length 52)
    172.25.176.249.60836 > 172.253.115.101.443: Flags [.], cksum 0xcb12 (correct), ack 96543, win 2048, options [nop,nop,TS val 2958918959 ecr 398423917], length 0
09:04:58.920396 IP (tos 0x0, ttl 118, id 49607, offset 0, flags [none], proto TCP (6), length 1426)
    172.253.115.101.443 > 172.25.176.249.60836: Flags [.], seq 96543:97917, ack 5092, win 1032, options [nop,nop,TS val 398423918 ecr 2958918947], length 1374
09:04:58.920449 IP (tos 0x0, ttl 64, id 0, offset 0, flags [DF], proto TCP (6), length 52)
    172.25.176.249.60836 > 172.253.115.101.443: Flags [.], cksum 0xbfbd (correct), ack 97917, win 3573, options [nop,nop,TS val 2958918960 ecr 398423918], length 0
09:04:58.920843 IP (tos 0x0, ttl 118, id 49608, offset 0, flags [none], proto TCP (6), length 1426)
    172.253.115.101.443 > 172.25.176.249.60836: Flags [.], seq 97917:99291, ack 5092, win 1032, options [nop,nop,TS val 398423918 ecr 2958918947], length 1374
09:04:58.920845 IP (tos 0x0, ttl 118, id 49609, offset 0, flags [none], proto TCP (6), length 1426)
    172.253.115.101.443 > 172.25.176.249.60836: Flags [.], seq 99291:100665, ack 5092, win 1032, options [nop,nop,TS val 398423918 ecr 2958918947], length 1374
09:04:58.920882 IP (tos 0x0, ttl 64, id 0, offset 0, flags [DF], proto TCP (6), length 52)
    172.25.176.249.60836 > 172.253.115.101.443: Flags [.], cksum 0xb4ec (correct), ack 100665, win 3594, options [nop,nop,TS val 2958918960 ecr 398423918], length 0
