tcpdump: listening on en0, link-type EN10MB (Ethernet), snapshot length 96 bytes
13:27:47.374135 IP (tos 0x0, ttl 64, id 0, offset 0, flags [DF], proto TCP (6), length 1426)
    172.25.176.249.63669 > 172.64.155.209.443: Flags [.], seq 963134987:963136361, ack 682816104, win 2285, options [nop,nop,TS val 2196510241 ecr 2891001515], length 1374
13:27:47.374139 IP (tos 0x0, ttl 64, id 1, offset 0, flags [DF], proto TCP (6), length 1426)
    172.25.176.249.63669 > 172.64.155.209.443: Flags [.], seq 1374:2748, ack 1, win 2285, options [nop,nop,TS val 2196510241 ecr 2891001515], length 1374
13:27:47.374141 IP (tos 0x0, ttl 64, id 2, offset 0, flags [DF], proto TCP (6), length 1426)
    172.25.176.249.63669 > 172.64.155.209.443: Flags [.], seq 2748:4122, ack 1, win 2285, options [nop,nop,TS val 2196510241 ecr 2891001515], length 1374
13:27:47.374167 IP (tos 0x0, ttl 64, id 0, offset 0, flags [DF], proto TCP (6), length 1214)
    172.25.176.249.63669 > 172.64.155.209.443: Flags [P.], seq 4122:5284, ack 1, win 2285, options [nop,nop,TS val 2196510241 ecr 2891001515], length 1162
13:27:47.374192 IP (tos 0x0, ttl 64, id 0, offset 0, flags [DF], proto TCP (6), length 91)
    172.25.176.249.63669 > 172.64.155.209.443: Flags [P.], seq 5284:5323, ack 1, win 2285, options [nop,nop,TS val 2196510241 ecr 2891001515], length 39
13:27:47.374206 IP (tos 0x0, ttl 64, id 0, offset 0, flags [DF], proto TCP (6), length 1426)
    172.25.176.249.63669 > 172.64.155.209.443: Flags [.], seq 5323:6697, ack 1, win 2285, options [nop,nop,TS val 2196510241 ecr 2891001515], length 1374
13:27:47.374209 IP (tos 0x0, ttl 64, id 0, offset 0, flags [DF], proto TCP (6), length 208)
    172.25.176.249.63669 > 172.64.155.209.443: Flags [P.], seq 6697:6853, ack 1, win 2285, options [nop,nop,TS val 2196510241 ecr 2891001515], length 156
13:27:47.381772 IP (tos 0x0, ttl 54, id 18017, offset 0, flags [DF], proto TCP (6), length 64)
    172.64.155.209.443 > 172.25.176.249.63669: Flags [.], cksum 0xfd6f (correct), ack 5323, win 43, options [nop,nop,TS val 2891021031 ecr 2196510241,nop,nop,sack 1 {6697:6853}], length 0
13:27:47.382862 IP (tos 0x0, ttl 54, id 18018, offset 0, flags [DF], proto TCP (6), length 52)
    172.64.155.209.443 > 172.25.176.249.63669: Flags [.], cksum 0x6162 (correct), ack 6853, win 43, options [nop,nop,TS val 2891021031 ecr 2196510241], length 0
13:27:47.382866 IP (tos 0x0, ttl 54, id 18019, offset 0, flags [DF], proto TCP (6), length 91)
    172.64.155.209.443 > 172.25.176.249.63669: Flags [P.], seq 1:40, ack 6853, win 43, options [nop,nop,TS val 2891021031 ecr 2196510241], length 39
13:27:47.382991 IP (tos 0x0, ttl 64, id 0, offset 0, flags [DF], proto TCP (6), length 52)
    172.25.176.249.63669 > 172.64.155.209.443: Flags [.], cksum 0x5870 (correct), ack 40, win 2285, options [nop,nop,TS val 2196510250 ecr 2891021031], length 0
13:27:47.442802 IP (tos 0x0, ttl 54, id 18020, offset 0, flags [DF], proto TCP (6), length 371)
    172.64.155.209.443 > 172.25.176.249.63669: Flags [P.], seq 40:359, ack 6853, win 43, options [nop,nop,TS val 2891021092 ecr 2196510250], length 319
13:27:47.442807 IP (tos 0x0, ttl 54, id 18021, offset 0, flags [DF], proto TCP (6), length 99)
    172.64.155.209.443 > 172.25.176.249.63669: Flags [P.], seq 359:406, ack 6853, win 43, options [nop,nop,TS val 2891021092 ecr 2196510250], length 47
13:27:47.442967 IP (tos 0x0, ttl 64, id 0, offset 0, flags [DF], proto TCP (6), length 52)
    172.25.176.249.63669 > 172.64.155.209.443: Flags [.], cksum 0x568e (correct), ack 406, win 2280, options [nop,nop,TS val 2196510310 ecr 2891021092], length 0
13:27:47.443501 IP (tos 0x0, ttl 54, id 18022, offset 0, flags [DF], proto TCP (6), length 83)
    172.64.155.209.443 > 172.25.176.249.63669: Flags [P.], seq 406:437, ack 6853, win 43, options [nop,nop,TS val 2891021092 ecr 2196510250], length 31
13:27:47.443571 IP (tos 0x0, ttl 64, id 0, offset 0, flags [DF], proto TCP (6), length 52)
    172.25.176.249.63669 > 172.64.155.209.443: Flags [.], cksum 0x566b (correct), ack 437, win 2284, options [nop,nop,TS val 2196510310 ecr 2891021092], length 0
13:27:47.444044 IP (tos 0x0, ttl 64, id 0, offset 0, flags [DF], proto TCP (6), length 87)
    172.25.176.249.63669 > 172.64.155.209.443: Flags [P.], seq 6853:6888, ack 437, win 2285, options [nop,nop,TS val 2196510311 ecr 2891021092], length 35
13:27:47.490234 IP (tos 0x0, ttl 54, id 18023, offset 0, flags [DF], proto TCP (6), length 52)
    172.64.155.209.443 > 172.25.176.249.63669: Flags [.], cksum 0x5ed8 (correct), ack 6888, win 43, options [nop,nop,TS val 2891021140 ecr 2196510311], length 0
13:27:48.621822 IP (tos 0x0, ttl 64, id 0, offset 0, flags [DF], proto TCP (6), length 1426)
    172.25.176.249.63669 > 172.64.155.209.443: Flags [.], seq 6888:8262, ack 437, win 2285, options [nop,nop,TS val 2196511488 ecr 2891021140], length 1374
13:27:48.621831 IP (tos 0x0, ttl 64, id 1, offset 0, flags [DF], proto TCP (6), length 1426)
    172.25.176.249.63669 > 172.64.155.209.443: Flags [.], seq 8262:9636, ack 437, win 2285, options [nop,nop,TS val 2196511488 ecr 2891021140], length 1374
13:27:48.621833 IP (tos 0x0, ttl 64, id 2, offset 0, flags [DF], proto TCP (6), length 1426)
    172.25.176.249.63669 > 172.64.155.209.443: Flags [.], seq 9636:11010, ack 437, win 2285, options [nop,nop,TS val 2196511488 ecr 2891021140], length 1374
13:27:48.621835 IP (tos 0x0, ttl 64, id 3, offset 0, flags [DF], proto TCP (6), length 1426)
    172.25.176.249.63669 > 172.64.155.209.443: Flags [.], seq 11010:12384, ack 437, win 2285, options [nop,nop,TS val 2196511488 ecr 2891021140], length 1374
13:27:48.621837 IP (tos 0x0, ttl 64, id 4, offset 0, flags [DF], proto TCP (6), length 1426)
    172.25.176.249.63669 > 172.64.155.209.443: Flags [.], seq 12384:13758, ack 437, win 2285, options [nop,nop,TS val 2196511488 ecr 2891021140], length 1374
13:27:48.621879 IP (tos 0x0, ttl 64, id 0, offset 0, flags [DF], proto TCP (6), length 131)
    172.25.176.249.63669 > 172.64.155.209.443: Flags [P.], seq 13758:13837, ack 437, win 2285, options [nop,nop,TS val 2196511488 ecr 2891021140], length 79
13:27:48.621960 IP (tos 0x0, ttl 64, id 0, offset 0, flags [DF], proto TCP (6), length 491)
    172.25.176.249.63669 > 172.64.155.209.443: Flags [P.], seq 13837:14276, ack 437, win 2285, options [nop,nop,TS val 2196511488 ecr 2891021140], length 439
13:27:48.628110 IP (tos 0x0, ttl 54, id 18024, offset 0, flags [DF], proto TCP (6), length 52)
    172.64.155.209.443 > 172.25.176.249.63669: Flags [.], cksum 0x5070 (correct), ack 8262, win 43, options [nop,nop,TS val 2891022277 ecr 2196511488], length 0
13:27:48.628115 IP (tos 0x0, ttl 54, id 18025, offset 0, flags [DF], proto TCP (6), length 52)
    172.64.155.209.443 > 172.25.176.249.63669: Flags [.], cksum 0x4b12 (correct), ack 9636, win 43, options [nop,nop,TS val 2891022277 ecr 2196511488], length 0
13:27:48.628117 IP (tos 0x0, ttl 54, id 18026, offset 0, flags [DF], proto TCP (6), length 52)
    172.64.155.209.443 > 172.25.176.249.63669: Flags [.], cksum 0x45b4 (correct), ack 11010, win 43, options [nop,nop,TS val 2891022277 ecr 2196511488], length 0
13:27:48.628119 IP (tos 0x0, ttl 54, id 18027, offset 0, flags [DF], proto TCP (6), length 52)
    172.64.155.209.443 > 172.25.176.249.63669: Flags [.], cksum 0x4056 (correct), ack 12384, win 43, options [nop,nop,TS val 2891022277 ecr 2196511488], length 0
13:27:48.628260 IP (tos 0x0, ttl 54, id 18028, offset 0, flags [DF], proto TCP (6), length 64)
    172.64.155.209.443 > 172.25.176.249.63669: Flags [.], cksum 0x9f8c (correct), ack 12384, win 43, options [nop,nop,TS val 2891022277 ecr 2196511488,nop,nop,sack 1 {13758:13837}], length 0
13:27:48.628262 IP (tos 0x0, ttl 54, id 18029, offset 0, flags [DF], proto TCP (6), length 52)
    172.64.155.209.443 > 172.25.176.249.63669: Flags [.], cksum 0x3aa9 (correct), ack 13837, win 43, options [nop,nop,TS val 2891022277 ecr 2196511488], length 0
13:27:48.628531 IP (tos 0x0, ttl 54, id 18030, offset 0, flags [DF], proto TCP (6), length 52)
    172.64.155.209.443 > 172.25.176.249.63669: Flags [.], cksum 0x38f2 (correct), ack 14276, win 43, options [nop,nop,TS val 2891022277 ecr 2196511488], length 0
13:27:48.766575 IP (tos 0x0, ttl 54, id 18031, offset 0, flags [DF], proto TCP (6), length 393)
    172.64.155.209.443 > 172.25.176.249.63669: Flags [P.], seq 437:778, ack 14276, win 43, options [nop,nop,TS val 2891022416 ecr 2196511488], length 341
13:27:48.766581 IP (tos 0x0, ttl 54, id 18032, offset 0, flags [DF], proto TCP (6), length 361)
    172.64.155.209.443 > 172.25.176.249.63669: Flags [P.], seq 778:1087, ack 14276, win 43, options [nop,nop,TS val 2891022416 ecr 2196511488], length 309
13:27:48.766719 IP (tos 0x0, ttl 54, id 18033, offset 0, flags [DF], proto TCP (6), length 83)
    172.64.155.209.443 > 172.25.176.249.63669: Flags [P.], seq 1087:1118, ack 14276, win 43, options [nop,nop,TS val 2891022416 ecr 2196511488], length 31
13:27:48.766733 IP (tos 0x0, ttl 64, id 0, offset 0, flags [DF], proto TCP (6), length 52)
    172.25.176.249.63669 > 172.64.155.209.443: Flags [.], cksum 0x2c94 (correct), ack 1087, win 2275, options [nop,nop,TS val 2196511633 ecr 2891022416], length 0
13:27:48.766802 IP (tos 0x0, ttl 64, id 0, offset 0, flags [DF], proto TCP (6), length 52)
    172.25.176.249.63669 > 172.64.155.209.443: Flags [.], cksum 0x2c75 (correct), ack 1118, win 2275, options [nop,nop,TS val 2196511633 ecr 2891022416], length 0
13:27:49.635646 IP (tos 0x0, ttl 64, id 0, offset 0, flags [DF], proto TCP (6), length 1426)
    172.25.176.249.63669 > 172.64.155.209.443: Flags [.], seq 14276:15650, ack 1118, win 2285, options [nop,nop,TS val 2196512502 ecr 2891022416], length 1374
13:27:49.635655 IP (tos 0x0, ttl 64, id 1, offset 0, flags [DF], proto TCP (6), length 1426)
    172.25.176.249.63669 > 172.64.155.209.443: Flags [.], seq 15650:17024, ack 1118, win 2285, options [nop,nop,TS val 2196512502 ecr 2891022416], length 1374
13:27:49.635658 IP (tos 0x0, ttl 64, id 2, offset 0, flags [DF], proto TCP (6), length 1426)
    172.25.176.249.63669 > 172.64.155.209.443: Flags [.], seq 17024:18398, ack 1118, win 2285, options [nop,nop,TS val 2196512502 ecr 2891022416], length 1374
13:27:49.635705 IP (tos 0x0, ttl 64, id 0, offset 0, flags [DF], proto TCP (6), length 1325)
    172.25.176.249.63669 > 172.64.155.209.443: Flags [P.], seq 18398:19671, ack 1118, win 2285, options [nop,nop,TS val 2196512502 ecr 2891022416], length 1273
13:27:49.635810 IP (tos 0x0, ttl 64, id 0, offset 0, flags [DF], proto TCP (6), length 1426)
    172.25.176.249.63669 > 172.64.155.209.443: Flags [.], seq 19671:21045, ack 1118, win 2285, options [nop,nop,TS val 2196512502 ecr 2891022416], length 1374
13:27:49.635822 IP (tos 0x0, ttl 64, id 0, offset 0, flags [DF], proto TCP (6), length 183)
    172.25.176.249.63669 > 172.64.155.209.443: Flags [P.], seq 21045:21176, ack 1118, win 2285, options [nop,nop,TS val 2196512502 ecr 2891022416], length 131
13:27:49.644899 IP (tos 0x0, ttl 54, id 18034, offset 0, flags [DF], proto TCP (6), length 52)
    172.64.155.209.443 > 172.25.176.249.63669: Flags [.], cksum 0x28fc (correct), ack 15650, win 43, options [nop,nop,TS val 2891023294 ecr 2196512502], length 0
13:27:49.644904 IP (tos 0x0, ttl 54, id 18035, offset 0, flags [DF], proto TCP (6), length 52)
    172.64.155.209.443 > 172.25.176.249.63669: Flags [.], cksum 0x1e40 (correct), ack 18398, win 43, options [nop,nop,TS val 2891023294 ecr 2196512502], length 0
13:27:49.644905 IP (tos 0x0, ttl 54, id 18036, offset 0, flags [DF], proto TCP (6), length 52)
    172.64.155.209.443 > 172.25.176.249.63669: Flags [.], cksum 0x1947 (correct), ack 19671, win 43, options [nop,nop,TS val 2891023294 ecr 2196512502], length 0
13:27:49.644976 IP (tos 0x0, ttl 54, id 18037, offset 0, flags [DF], proto TCP (6), length 64)
    172.64.155.209.443 > 172.25.176.249.63669: Flags [.], cksum 0x3f5b (correct), ack 19671, win 43, options [nop,nop,TS val 2891023294 ecr 2196512502,nop,nop,sack 1 {21045:21176}], length 0
13:27:49.645256 IP (tos 0x0, ttl 54, id 18038, offset 0, flags [DF], proto TCP (6), length 52)
    172.64.155.209.443 > 172.25.176.249.63669: Flags [.], cksum 0x1366 (correct), ack 21176, win 43, options [nop,nop,TS val 2891023294 ecr 2196512502], length 0
13:27:49.704877 IP (tos 0x0, ttl 54, id 18039, offset 0, flags [DF], proto TCP (6), length 534)
    172.64.155.209.443 > 172.25.176.249.63669: Flags [P.], seq 1118:1600, ack 21176, win 43, options [nop,nop,TS val 2891023354 ecr 2196512502], length 482
13:27:49.704883 IP (tos 0x0, ttl 54, id 18040, offset 0, flags [DF], proto TCP (6), length 99)
    172.64.155.209.443 > 172.25.176.249.63669: Flags [P.], seq 1600:1647, ack 21176, win 43, options [nop,nop,TS val 2891023354 ecr 2196512502], length 47
13:27:49.704986 IP (tos 0x0, ttl 54, id 18041, offset 0, flags [DF], proto TCP (6), length 83)
    172.64.155.209.443 > 172.25.176.249.63669: Flags [P.], seq 1647:1678, ack 21176, win 43, options [nop,nop,TS val 2891023354 ecr 2196512502], length 31
13:27:49.705035 IP (tos 0x0, ttl 64, id 0, offset 0, flags [DF], proto TCP (6), length 52)
    172.25.176.249.63669 > 172.64.155.209.443: Flags [.], cksum 0x0819 (correct), ack 1647, win 2277, options [nop,nop,TS val 2196512572 ecr 2891023354], length 0
13:27:49.705102 IP (tos 0x0, ttl 64, id 0, offset 0, flags [DF], proto TCP (6), length 52)
    172.25.176.249.63669 > 172.64.155.209.443: Flags [.], cksum 0x07fa (correct), ack 1678, win 2277, options [nop,nop,TS val 2196512572 ecr 2891023354], length 0
13:27:53.624832 IP (tos 0x0, ttl 64, id 0, offset 0, flags [DF], proto TCP (6), length 1426)
    172.25.176.249.63669 > 172.64.155.209.443: Flags [.], seq 21176:22550, ack 1678, win 2285, options [nop,nop,TS val 2196516492 ecr 2891023354], length 1374
13:27:53.624840 IP (tos 0x0, ttl 64, id 1, offset 0, flags [DF], proto TCP (6), length 1426)
    172.25.176.249.63669 > 172.64.155.209.443: Flags [.], seq 22550:23924, ack 1678, win 2285, options [nop,nop,TS val 2196516492 ecr 2891023354], length 1374
13:27:53.624842 IP (tos 0x0, ttl 64, id 2, offset 0, flags [DF], proto TCP (6), length 1426)
    172.25.176.249.63669 > 172.64.155.209.443: Flags [.], seq 23924:25298, ack 1678, win 2285, options [nop,nop,TS val 2196516492 ecr 2891023354], length 1374
13:27:53.624845 IP (tos 0x0, ttl 64, id 3, offset 0, flags [DF], proto TCP (6), length 1426)
    172.25.176.249.63669 > 172.64.155.209.443: Flags [.], seq 25298:26672, ack 1678, win 2285, options [nop,nop,TS val 2196516492 ecr 2891023354], length 1374
13:27:53.624846 IP (tos 0x0, ttl 64, id 4, offset 0, flags [DF], proto TCP (6), length 1426)
    172.25.176.249.63669 > 172.64.155.209.443: Flags [.], seq 26672:28046, ack 1678, win 2285, options [nop,nop,TS val 2196516492 ecr 2891023354], length 1374
13:27:53.624878 IP (tos 0x0, ttl 64, id 0, offset 0, flags [DF], proto TCP (6), length 131)
    172.25.176.249.63669 > 172.64.155.209.443: Flags [P.], seq 28046:28125, ack 1678, win 2285, options [nop,nop,TS val 2196516492 ecr 2891023354], length 79
13:27:53.624936 IP (tos 0x0, ttl 64, id 0, offset 0, flags [DF], proto TCP (6), length 491)
    172.25.176.249.63669 > 172.64.155.209.443: Flags [P.], seq 28125:28564, ack 1678, win 2285, options [nop,nop,TS val 2196516492 ecr 2891023354], length 439
13:27:53.633068 IP (tos 0x0, ttl 54, id 18042, offset 0, flags [DF], proto TCP (6), length 52)
    172.64.155.209.443 > 172.25.176.249.63669: Flags [.], cksum 0xecad (correct), ack 22550, win 43, options [nop,nop,TS val 2891027282 ecr 2196516492], length 0
13:27:53.633072 IP (tos 0x0, ttl 54, id 18043, offset 0, flags [DF], proto TCP (6), length 52)
    172.64.155.209.443 > 172.25.176.249.63669: Flags [.], cksum 0xe74f (correct), ack 23924, win 43, options [nop,nop,TS val 2891027282 ecr 2196516492], length 0
13:27:53.633073 IP (tos 0x0, ttl 54, id 18044, offset 0, flags [DF], proto TCP (6), length 52)
    172.64.155.209.443 > 172.25.176.249.63669: Flags [.], cksum 0xdc92 (correct), ack 26672, win 43, options [nop,nop,TS val 2891027283 ecr 2196516492], length 0
13:27:53.633820 IP (tos 0x0, ttl 54, id 18045, offset 0, flags [DF], proto TCP (6), length 64)
    172.64.155.209.443 > 172.25.176.249.63669: Flags [.], cksum 0xcc28 (correct), ack 26672, win 43, options [nop,nop,TS val 2891027283 ecr 2196516492,nop,nop,sack 1 {28046:28125}], length 0
13:27:53.633822 IP (tos 0x0, ttl 54, id 18046, offset 0, flags [DF], proto TCP (6), length 52)
    172.64.155.209.443 > 172.25.176.249.63669: Flags [.], cksum 0xd6e5 (correct), ack 28125, win 43, options [nop,nop,TS val 2891027283 ecr 2196516492], length 0
13:27:53.633824 IP (tos 0x0, ttl 54, id 18047, offset 0, flags [DF], proto TCP (6), length 52)
    172.64.155.209.443 > 172.25.176.249.63669: Flags [.], cksum 0xd52e (correct), ack 28564, win 43, options [nop,nop,TS val 2891027283 ecr 2196516492], length 0
13:27:53.747616 IP (tos 0x0, ttl 54, id 18048, offset 0, flags [DF], proto TCP (6), length 514)
    172.64.155.209.443 > 172.25.176.249.63669: Flags [P.], seq 1678:2140, ack 28564, win 43, options [nop,nop,TS val 2891027397 ecr 2196516492], length 462
13:27:53.747754 IP (tos 0x0, ttl 64, id 0, offset 0, flags [DF], proto TCP (6), length 52)
    172.25.176.249.63669 > 172.64.155.209.443: Flags [.], cksum 0xc9b9 (correct), ack 2140, win 2278, options [nop,nop,TS val 2196516614 ecr 2891027397], length 0
13:27:53.748152 IP (tos 0x0, ttl 54, id 18049, offset 0, flags [DF], proto TCP (6), length 85)
    172.64.155.209.443 > 172.25.176.249.63669: Flags [P.], seq 2140:2173, ack 28564, win 43, options [nop,nop,TS val 2891027397 ecr 2196516492], length 33
13:27:53.748219 IP (tos 0x0, ttl 64, id 0, offset 0, flags [DF], proto TCP (6), length 52)
    172.25.176.249.63669 > 172.64.155.209.443: Flags [.], cksum 0xc992 (correct), ack 2173, win 2284, options [nop,nop,TS val 2196516614 ecr 2891027397], length 0
13:27:53.749895 IP (tos 0x0, ttl 64, id 0, offset 0, flags [DF], proto TCP (6), length 87)
    172.25.176.249.63669 > 172.64.155.209.443: Flags [P.], seq 28564:28599, ack 2173, win 2285, options [nop,nop,TS val 2196516617 ecr 2891027397], length 35
13:27:53.751003 IP (tos 0x0, ttl 54, id 18050, offset 0, flags [DF], proto TCP (6), length 357)
    172.64.155.209.443 > 172.25.176.249.63669: Flags [P.], seq 2173:2478, ack 28564, win 43, options [nop,nop,TS val 2891027400 ecr 2196516492], length 305
13:27:53.751007 IP (tos 0x0, ttl 54, id 18051, offset 0, flags [DF], proto TCP (6), length 83)
    172.64.155.209.443 > 172.25.176.249.63669: Flags [P.], seq 2478:2509, ack 28564, win 43, options [nop,nop,TS val 2891027400 ecr 2196516492], length 31
13:27:53.751158 IP (tos 0x0, ttl 64, id 0, offset 0, flags [DF], proto TCP (6), length 52)
    172.25.176.249.63669 > 172.64.155.209.443: Flags [.], cksum 0xc81c (correct), ack 2509, win 2280, options [nop,nop,TS val 2196516618 ecr 2891027400], length 0
13:27:53.755868 IP (tos 0x0, ttl 54, id 18052, offset 0, flags [DF], proto TCP (6), length 52)
    172.64.155.209.443 > 172.25.176.249.63669: Flags [.], cksum 0xd0d5 (correct), ack 28599, win 43, options [nop,nop,TS val 2891027405 ecr 2196516617], length 0
13:27:56.503787 IP (tos 0x0, ttl 64, id 0, offset 0, flags [DF], proto TCP (6), length 231)
    172.25.176.249.63672 > 172.64.155.209.443: Flags [P.], seq 4070171467:4070171646, ack 626586009, win 2048, options [nop,nop,TS val 1661366131 ecr 4010936140], length 179
13:27:56.503856 IP (tos 0x0, ttl 64, id 0, offset 0, flags [DF], proto TCP (6), length 91)
    172.25.176.249.63672 > 172.64.155.209.443: Flags [P.], seq 179:218, ack 1, win 2048, options [nop,nop,TS val 1661366131 ecr 4010936140], length 39
13:27:56.503875 IP (tos 0x0, ttl 64, id 0, offset 0, flags [DF], proto TCP (6), length 924)
    172.25.176.249.63672 > 172.64.155.209.443: Flags [P.], seq 218:1090, ack 1, win 2048, options [nop,nop,TS val 1661366131 ecr 4010936140], length 872
13:27:56.509987 IP (tos 0x0, ttl 54, id 14207, offset 0, flags [DF], proto TCP (6), length 52)
    172.64.155.209.443 > 172.25.176.249.63672: Flags [.], cksum 0xd2f4 (correct), ack 179, win 18, options [nop,nop,TS val 4010956038 ecr 1661366131], length 0
13:27:56.509990 IP (tos 0x0, ttl 54, id 14208, offset 0, flags [DF], proto TCP (6), length 52)
    172.64.155.209.443 > 172.25.176.249.63672: Flags [.], cksum 0xd2cd (correct), ack 218, win 18, options [nop,nop,TS val 4010956038 ecr 1661366131], length 0
13:27:56.509993 IP (tos 0x0, ttl 54, id 14209, offset 0, flags [DF], proto TCP (6), length 52)
    172.64.155.209.443 > 172.25.176.249.63672: Flags [.], cksum 0xcf65 (correct), ack 1090, win 18, options [nop,nop,TS val 4010956038 ecr 1661366131], length 0
13:27:56.510683 IP (tos 0x0, ttl 54, id 14210, offset 0, flags [DF], proto TCP (6), length 91)
    172.64.155.209.443 > 172.25.176.249.63672: Flags [P.], seq 1:40, ack 1090, win 18, options [nop,nop,TS val 4010956038 ecr 1661366131], length 39
13:27:56.510729 IP (tos 0x0, ttl 64, id 0, offset 0, flags [DF], proto TCP (6), length 52)
    172.25.176.249.63672 > 172.64.155.209.443: Flags [.], cksum 0xc749 (correct), ack 40, win 2048, options [nop,nop,TS val 1661366138 ecr 4010956038], length 0
13:27:56.549402 IP (tos 0x0, ttl 54, id 14211, offset 0, flags [DF], proto TCP (6), length 603)
    172.64.155.209.443 > 172.25.176.249.63672: Flags [P.], seq 40:591, ack 1090, win 18, options [nop,nop,TS val 4010956077 ecr 1661366138], length 551
13:27:56.549408 IP (tos 0x0, ttl 54, id 14212, offset 0, flags [DF], proto TCP (6), length 99)
    172.64.155.209.443 > 172.25.176.249.63672: Flags [P.], seq 591:638, ack 1090, win 18, options [nop,nop,TS val 4010956077 ecr 1661366138], length 47
13:27:56.549519 IP (tos 0x0, ttl 64, id 0, offset 0, flags [DF], proto TCP (6), length 52)
    172.25.176.249.63672 > 172.64.155.209.443: Flags [.], cksum 0xc4ae (correct), ack 638, win 2039, options [nop,nop,TS val 1661366177 ecr 4010956077], length 0
13:27:56.549584 IP (tos 0x0, ttl 54, id 14213, offset 0, flags [DF], proto TCP (6), length 83)
    172.64.155.209.443 > 172.25.176.249.63672: Flags [P.], seq 638:669, ack 1090, win 18, options [nop,nop,TS val 4010956077 ecr 1661366138], length 31
13:27:56.549647 IP (tos 0x0, ttl 64, id 0, offset 0, flags [DF], proto TCP (6), length 52)
    172.25.176.249.63672 > 172.64.155.209.443: Flags [.], cksum 0xc48f (correct), ack 669, win 2039, options [nop,nop,TS val 1661366177 ecr 4010956077], length 0
13:27:56.550665 IP (tos 0x0, ttl 64, id 0, offset 0, flags [DF], proto TCP (6), length 87)
    172.25.176.249.63672 > 172.64.155.209.443: Flags [P.], seq 1090:1125, ack 669, win 2048, options [nop,nop,TS val 1661366178 ecr 4010956077], length 35
13:27:56.596545 IP (tos 0x0, ttl 54, id 14214, offset 0, flags [DF], proto TCP (6), length 52)
    172.64.155.209.443 > 172.25.176.249.63672: Flags [.], cksum 0xcc20 (correct), ack 1125, win 18, options [nop,nop,TS val 4010956125 ecr 1661366178], length 0
13:27:58.694579 IP (tos 0x0, ttl 64, id 0, offset 0, flags [DF], proto TCP (6), length 1426)
    172.25.176.249.63669 > 172.64.155.209.443: Flags [.], seq 28599:29973, ack 2509, win 2285, options [nop,nop,TS val 2196521561 ecr 2891027405], length 1374
13:27:58.694587 IP (tos 0x0, ttl 64, id 1, offset 0, flags [DF], proto TCP (6), length 1426)
    172.25.176.249.63669 > 172.64.155.209.443: Flags [.], seq 29973:31347, ack 2509, win 2285, options [nop,nop,TS val 2196521561 ecr 2891027405], length 1374
13:27:58.694589 IP (tos 0x0, ttl 64, id 2, offset 0, flags [DF], proto TCP (6), length 1426)
    172.25.176.249.63669 > 172.64.155.209.443: Flags [.], seq 31347:32721, ack 2509, win 2285, options [nop,nop,TS val 2196521561 ecr 2891027405], length 1374
13:27:58.694591 IP (tos 0x0, ttl 64, id 3, offset 0, flags [DF], proto TCP (6), length 1426)
    172.25.176.249.63669 > 172.64.155.209.443: Flags [.], seq 32721:34095, ack 2509, win 2285, options [nop,nop,TS val 2196521561 ecr 2891027405], length 1374
13:27:58.694592 IP (tos 0x0, ttl 64, id 4, offset 0, flags [DF], proto TCP (6), length 1426)
    172.25.176.249.63669 > 172.64.155.209.443: Flags [.], seq 34095:35469, ack 2509, win 2285, options [nop,nop,TS val 2196521561 ecr 2891027405], length 1374
13:27:58.694633 IP (tos 0x0, ttl 64, id 0, offset 0, flags [DF], proto TCP (6), length 129)
    172.25.176.249.63669 > 172.64.155.209.443: Flags [P.], seq 35469:35546, ack 2509, win 2285, options [nop,nop,TS val 2196521561 ecr 2891027405], length 77
13:27:58.694777 IP (tos 0x0, ttl 64, id 0, offset 0, flags [DF], proto TCP (6), length 491)
    172.25.176.249.63669 > 172.64.155.209.443: Flags [P.], seq 35546:35985, ack 2509, win 2285, options [nop,nop,TS val 2196521561 ecr 2891027405], length 439
13:27:58.700806 IP (tos 0x0, ttl 54, id 18053, offset 0, flags [DF], proto TCP (6), length 52)
    172.64.155.209.443 > 172.25.176.249.63669: Flags [.], cksum 0xa4d6 (correct), ack 29973, win 43, options [nop,nop,TS val 2891032350 ecr 2196521561], length 0
13:27:58.700810 IP (tos 0x0, ttl 54, id 18054, offset 0, flags [DF], proto TCP (6), length 52)
    172.64.155.209.443 > 172.25.176.249.63669: Flags [.], cksum 0x9a1a (correct), ack 32721, win 43, options [nop,nop,TS val 2891032350 ecr 2196521561], length 0
13:27:58.701524 IP (tos 0x0, ttl 54, id 18055, offset 0, flags [DF], proto TCP (6), length 52)
    172.64.155.209.443 > 172.25.176.249.63669: Flags [.], cksum 0x94bc (correct), ack 34095, win 43, options [nop,nop,TS val 2891032350 ecr 2196521561], length 0
13:27:58.701527 IP (tos 0x0, ttl 54, id 18056, offset 0, flags [DF], proto TCP (6), length 64)
    172.64.155.209.443 > 172.25.176.249.63669: Flags [.], cksum 0x4a56 (correct), ack 34095, win 43, options [nop,nop,TS val 2891032350 ecr 2196521561,nop,nop,sack 1 {35469:35546}], length 0
13:27:58.702058 IP (tos 0x0, ttl 54, id 18057, offset 0, flags [DF], proto TCP (6), length 52)
    172.64.155.209.443 > 172.25.176.249.63669: Flags [.], cksum 0x8f11 (correct), ack 35546, win 43, options [nop,nop,TS val 2891032350 ecr 2196521561], length 0
13:27:58.702060 IP (tos 0x0, ttl 54, id 18058, offset 0, flags [DF], proto TCP (6), length 52)
    172.64.155.209.443 > 172.25.176.249.63669: Flags [.], cksum 0x8d59 (correct), ack 35985, win 43, options [nop,nop,TS val 2891032351 ecr 2196521561], length 0
13:27:58.863916 IP (tos 0x0, ttl 54, id 18059, offset 0, flags [DF], proto TCP (6), length 381)
    172.64.155.209.443 > 172.25.176.249.63669: Flags [P.], seq 2509:2838, ack 35985, win 43, options [nop,nop,TS val 2891032513 ecr 2196521561], length 329
13:27:58.863920 IP (tos 0x0, ttl 54, id 18060, offset 0, flags [DF], proto TCP (6), length 361)
    172.64.155.209.443 > 172.25.176.249.63669: Flags [P.], seq 2838:3147, ack 35985, win 43, options [nop,nop,TS val 2891032513 ecr 2196521561], length 309
13:27:58.863924 IP (tos 0x0, ttl 54, id 18061, offset 0, flags [DF], proto TCP (6), length 83)
    172.64.155.209.443 > 172.25.176.249.63669: Flags [P.], seq 3147:3178, ack 35985, win 43, options [nop,nop,TS val 2891032513 ecr 2196521561], length 31
13:27:58.864063 IP (tos 0x0, ttl 64, id 0, offset 0, flags [DF], proto TCP (6), length 52)
    172.25.176.249.63669 > 172.64.155.209.443: Flags [.], cksum 0x80b8 (correct), ack 3178, win 2275, options [nop,nop,TS val 2196521731 ecr 2891032513], length 0
13:27:58.865635 IP (tos 0x0, ttl 64, id 0, offset 0, flags [DF], proto TCP (6), length 87)
    172.25.176.249.63669 > 172.64.155.209.443: Flags [P.], seq 35985:36020, ack 3178, win 2285, options [nop,nop,TS val 2196521732 ecr 2891032513], length 35
13:27:58.871411 IP (tos 0x0, ttl 54, id 18062, offset 0, flags [DF], proto TCP (6), length 52)
    172.64.155.209.443 > 172.25.176.249.63669: Flags [.], cksum 0x8944 (correct), ack 36020, win 43, options [nop,nop,TS val 2891032521 ecr 2196521732], length 0
13:27:58.938590 IP (tos 0x0, ttl 64, id 0, offset 0, flags [DF], proto TCP (6), length 1426)
    172.25.176.249.63669 > 172.64.155.209.443: Flags [.], seq 36020:37394, ack 3178, win 2285, options [nop,nop,TS val 2196521805 ecr 2891032521], length 1374
13:27:58.938598 IP (tos 0x0, ttl 64, id 1, offset 0, flags [DF], proto TCP (6), length 1426)
    172.25.176.249.63669 > 172.64.155.209.443: Flags [.], seq 37394:38768, ack 3178, win 2285, options [nop,nop,TS val 2196521805 ecr 2891032521], length 1374
13:27:58.938600 IP (tos 0x0, ttl 64, id 2, offset 0, flags [DF], proto TCP (6), length 1426)
    172.25.176.249.63669 > 172.64.155.209.443: Flags [.], seq 38768:40142, ack 3178, win 2285, options [nop,nop,TS val 2196521805 ecr 2891032521], length 1374
13:27:58.938601 IP (tos 0x0, ttl 64, id 3, offset 0, flags [DF], proto TCP (6), length 1426)
    172.25.176.249.63669 > 172.64.155.209.443: Flags [.], seq 40142:41516, ack 3178, win 2285, options [nop,nop,TS val 2196521805 ecr 2891032521], length 1374
13:27:58.938603 IP (tos 0x0, ttl 64, id 4, offset 0, flags [DF], proto TCP (6), length 1426)
    172.25.176.249.63669 > 172.64.155.209.443: Flags [.], seq 41516:42890, ack 3178, win 2285, options [nop,nop,TS val 2196521805 ecr 2891032521], length 1374
13:27:58.938604 IP (tos 0x0, ttl 64, id 5, offset 0, flags [DF], proto TCP (6), length 1426)
    172.25.176.249.63669 > 172.64.155.209.443: Flags [.], seq 42890:44264, ack 3178, win 2285, options [nop,nop,TS val 2196521805 ecr 2891032521], length 1374
13:27:58.938605 IP (tos 0x0, ttl 64, id 6, offset 0, flags [DF], proto TCP (6), length 1426)
    172.25.176.249.63669 > 172.64.155.209.443: Flags [.], seq 44264:45638, ack 3178, win 2285, options [nop,nop,TS val 2196521805 ecr 2891032521], length 1374
13:27:58.938606 IP (tos 0x0, ttl 64, id 7, offset 0, flags [DF], proto TCP (6), length 1426)
    172.25.176.249.63669 > 172.64.155.209.443: Flags [.], seq 45638:47012, ack 3178, win 2285, options [nop,nop,TS val 2196521805 ecr 2891032521], length 1374
13:27:58.938651 IP (tos 0x0, ttl 64, id 0, offset 0, flags [DF], proto TCP (6), length 1406)
    172.25.176.249.63669 > 172.64.155.209.443: Flags [P.], seq 47012:48366, ack 3178, win 2285, options [nop,nop,TS val 2196521805 ecr 2891032521], length 1354
13:27:58.938719 IP (tos 0x0, ttl 64, id 0, offset 0, flags [DF], proto TCP (6), length 1075)
    172.25.176.249.63669 > 172.64.155.209.443: Flags [P.], seq 48366:49389, ack 3178, win 2285, options [nop,nop,TS val 2196521805 ecr 2891032521], length 1023
13:27:58.945762 IP (tos 0x0, ttl 54, id 18063, offset 0, flags [DF], proto TCP (6), length 52)
    172.64.155.209.443 > 172.25.176.249.63669: Flags [.], cksum 0x8353 (correct), ack 37394, win 43, options [nop,nop,TS val 2891032595 ecr 2196521805], length 0
13:27:58.945764 IP (tos 0x0, ttl 54, id 18064, offset 0, flags [DF], proto TCP (6), length 52)
    172.64.155.209.443 > 172.25.176.249.63669: Flags [.], cksum 0x7897 (correct), ack 40142, win 43, options [nop,nop,TS val 2891032595 ecr 2196521805], length 0
13:27:58.947681 IP (tos 0x0, ttl 54, id 18065, offset 0, flags [DF], proto TCP (6), length 52)
    172.64.155.209.443 > 172.25.176.249.63669: Flags [.], cksum 0x6ddb (correct), ack 42890, win 43, options [nop,nop,TS val 2891032595 ecr 2196521805], length 0
13:27:58.947683 IP (tos 0x0, ttl 54, id 18066, offset 0, flags [DF], proto TCP (6), length 52)
    172.64.155.209.443 > 172.25.176.249.63669: Flags [.], cksum 0x631f (correct), ack 45638, win 43, options [nop,nop,TS val 2891032595 ecr 2196521805], length 0
13:27:58.947685 IP (tos 0x0, ttl 54, id 18067, offset 0, flags [DF], proto TCP (6), length 52)
    172.64.155.209.443 > 172.25.176.249.63669: Flags [.], cksum 0x5dc1 (correct), ack 47012, win 43, options [nop,nop,TS val 2891032595 ecr 2196521805], length 0
13:27:58.947686 IP (tos 0x0, ttl 54, id 18068, offset 0, flags [DF], proto TCP (6), length 52)
    172.64.155.209.443 > 172.25.176.249.63669: Flags [.], cksum 0x5877 (correct), ack 48366, win 43, options [nop,nop,TS val 2891032595 ecr 2196521805], length 0
13:27:58.947689 IP (tos 0x0, ttl 54, id 18069, offset 0, flags [DF], proto TCP (6), length 52)
    172.64.155.209.443 > 172.25.176.249.63669: Flags [.], cksum 0x5478 (correct), ack 49389, win 43, options [nop,nop,TS val 2891032595 ecr 2196521805], length 0
13:27:58.969980 IP (tos 0x0, ttl 64, id 0, offset 0, flags [DF], proto TCP (6), length 1426)
    172.25.176.249.63669 > 172.64.155.209.443: Flags [.], seq 49389:50763, ack 3178, win 2285, options [nop,nop,TS val 2196521837 ecr 2891032595], length 1374
13:27:58.969983 IP (tos 0x0, ttl 64, id 1, offset 0, flags [DF], proto TCP (6), length 1426)
    172.25.176.249.63669 > 172.64.155.209.443: Flags [.], seq 50763:52137, ack 3178, win 2285, options [nop,nop,TS val 2196521837 ecr 2891032595], length 1374
13:27:58.969983 IP (tos 0x0, ttl 64, id 2, offset 0, flags [DF], proto TCP (6), length 1426)
    172.25.176.249.63669 > 172.64.155.209.443: Flags [.], seq 52137:53511, ack 3178, win 2285, options [nop,nop,TS val 2196521837 ecr 2891032595], length 1374
13:27:58.969998 IP (tos 0x0, ttl 64, id 0, offset 0, flags [DF], proto TCP (6), length 1213)
    172.25.176.249.63669 > 172.64.155.209.443: Flags [P.], seq 53511:54672, ack 3178, win 2285, options [nop,nop,TS val 2196521837 ecr 2891032595], length 1161
13:27:58.970018 IP (tos 0x0, ttl 64, id 0, offset 0, flags [DF], proto TCP (6), length 1426)
    172.25.176.249.63669 > 172.64.155.209.443: Flags [.], seq 54672:56046, ack 3178, win 2285, options [nop,nop,TS val 2196521837 ecr 2891032595], length 1374
13:27:58.970020 IP (tos 0x0, ttl 64, id 0, offset 0, flags [DF], proto TCP (6), length 243)
    172.25.176.249.63669 > 172.64.155.209.443: Flags [P.], seq 56046:56237, ack 3178, win 2285, options [nop,nop,TS val 2196521837 ecr 2891032595], length 191
13:27:58.975991 IP (tos 0x0, ttl 54, id 18070, offset 0, flags [DF], proto TCP (6), length 52)
    172.64.155.209.443 > 172.25.176.249.63669: Flags [.], cksum 0x4edc (correct), ack 50763, win 43, options [nop,nop,TS val 2891032625 ecr 2196521837], length 0
13:27:58.976533 IP (tos 0x0, ttl 54, id 18071, offset 0, flags [DF], proto TCP (6), length 52)
    172.64.155.209.443 > 172.25.176.249.63669: Flags [.], cksum 0x4420 (correct), ack 53511, win 43, options [nop,nop,TS val 2891032625 ecr 2196521837], length 0
13:27:58.976534 IP (tos 0x0, ttl 54, id 18072, offset 0, flags [DF], proto TCP (6), length 52)
    172.64.155.209.443 > 172.25.176.249.63669: Flags [.], cksum 0x3f97 (correct), ack 54672, win 43, options [nop,nop,TS val 2891032625 ecr 2196521837], length 0
13:27:58.976535 IP (tos 0x0, ttl 54, id 18073, offset 0, flags [DF], proto TCP (6), length 64)
    172.64.155.209.443 > 172.25.176.249.63669: Flags [.], cksum 0x53fc (correct), ack 54672, win 43, options [nop,nop,TS val 2891032625 ecr 2196521837,nop,nop,sack 1 {56046:56237}], length 0
13:27:58.978886 IP (tos 0x0, ttl 54, id 18074, offset 0, flags [DF], proto TCP (6), length 52)
    172.64.155.209.443 > 172.25.176.249.63669: Flags [.], cksum 0x397a (correct), ack 56237, win 43, options [nop,nop,TS val 2891032625 ecr 2196521837], length 0
13:27:59.036348 IP (tos 0x0, ttl 54, id 18075, offset 0, flags [DF], proto TCP (6), length 369)
    172.64.155.209.443 > 172.25.176.249.63669: Flags [P.], seq 3178:3495, ack 56237, win 43, options [nop,nop,TS val 2891032685 ecr 2196521837], length 317
13:27:59.036476 IP (tos 0x0, ttl 64, id 0, offset 0, flags [DF], proto TCP (6), length 52)
    172.25.176.249.63669 > 172.64.155.209.443: Flags [.], cksum 0x2f01 (correct), ack 3495, win 2281, options [nop,nop,TS val 2196521903 ecr 2891032685], length 0
13:27:59.078047 IP (tos 0x0, ttl 54, id 18076, offset 0, flags [DF], proto TCP (6), length 99)
    172.64.155.209.443 > 172.25.176.249.63669: Flags [P.], seq 3495:3542, ack 56237, win 43, options [nop,nop,TS val 2891032727 ecr 2196521903], length 47
13:27:59.078171 IP (tos 0x0, ttl 64, id 0, offset 0, flags [DF], proto TCP (6), length 52)
    172.25.176.249.63669 > 172.64.155.209.443: Flags [.], cksum 0x2e7b (correct), ack 3542, win 2284, options [nop,nop,TS val 2196521945 ecr 2891032727], length 0
13:27:59.079527 IP (tos 0x0, ttl 54, id 18077, offset 0, flags [DF], proto TCP (6), length 83)
    172.64.155.209.443 > 172.25.176.249.63669: Flags [P.], seq 3542:3573, ack 56237, win 43, options [nop,nop,TS val 2891032727 ecr 2196521903], length 31
13:27:59.079579 IP (tos 0x0, ttl 64, id 0, offset 0, flags [DF], proto TCP (6), length 52)
    172.25.176.249.63669 > 172.64.155.209.443: Flags [.], cksum 0x2e5b (correct), ack 3573, win 2284, options [nop,nop,TS val 2196521946 ecr 2891032727], length 0
13:27:59.593843 IP (tos 0x0, ttl 54, id 18078, offset 0, flags [DF], proto TCP (6), length 1426)
    172.64.155.209.443 > 172.25.176.249.63669: Flags [.], seq 3573:4947, ack 56237, win 43, options [nop,nop,TS val 2891033243 ecr 2196521946], length 1374
13:27:59.593848 IP (tos 0x0, ttl 54, id 18079, offset 0, flags [DF], proto TCP (6), length 221)
    172.64.155.209.443 > 172.25.176.249.63669: Flags [P.], seq 4947:5116, ack 56237, win 43, options [nop,nop,TS val 2891033243 ecr 2196521946], length 169
13:27:59.594006 IP (tos 0x0, ttl 64, id 0, offset 0, flags [DF], proto TCP (6), length 52)
    172.25.176.249.63669 > 172.64.155.209.443: Flags [.], cksum 0x2464 (correct), ack 5116, win 2261, options [nop,nop,TS val 2196522461 ecr 2891033243], length 0
13:27:59.594320 IP (tos 0x0, ttl 54, id 18080, offset 0, flags [DF], proto TCP (6), length 117)
    172.64.155.209.443 > 172.25.176.249.63669: Flags [P.], seq 5116:5181, ack 56237, win 43, options [nop,nop,TS val 2891033243 ecr 2196521946], length 65
13:27:59.594411 IP (tos 0x0, ttl 64, id 0, offset 0, flags [DF], proto TCP (6), length 52)
    172.25.176.249.63669 > 172.64.155.209.443: Flags [.], cksum 0x240c (correct), ack 5181, win 2284, options [nop,nop,TS val 2196522461 ecr 2891033243], length 0
13:27:59.595599 IP (tos 0x0, ttl 54, id 18081, offset 0, flags [DF], proto TCP (6), length 491)
    172.64.155.209.443 > 172.25.176.249.63669: Flags [P.], seq 5181:5620, ack 56237, win 43, options [nop,nop,TS val 2891033245 ecr 2196521946], length 439
13:27:59.595689 IP (tos 0x0, ttl 64, id 0, offset 0, flags [DF], proto TCP (6), length 52)
    172.25.176.249.63669 > 172.64.155.209.443: Flags [.], cksum 0x2258 (correct), ack 5620, win 2278, options [nop,nop,TS val 2196522462 ecr 2891033245], length 0
13:27:59.603638 IP (tos 0x0, ttl 64, id 0, offset 0, flags [DF], proto TCP (6), length 1426)
    172.25.176.249.63669 > 172.64.155.209.443: Flags [.], seq 56237:57611, ack 5620, win 2285, options [nop,nop,TS val 2196522470 ecr 2891033245], length 1374
13:27:59.603644 IP (tos 0x0, ttl 64, id 1, offset 0, flags [DF], proto TCP (6), length 1426)
    172.25.176.249.63669 > 172.64.155.209.443: Flags [.], seq 57611:58985, ack 5620, win 2285, options [nop,nop,TS val 2196522470 ecr 2891033245], length 1374
13:27:59.603646 IP (tos 0x0, ttl 64, id 2, offset 0, flags [DF], proto TCP (6), length 1426)
    172.25.176.249.63669 > 172.64.155.209.443: Flags [.], seq 58985:60359, ack 5620, win 2285, options [nop,nop,TS val 2196522470 ecr 2891033245], length 1374
13:27:59.603684 IP (tos 0x0, ttl 64, id 0, offset 0, flags [DF], proto TCP (6), length 1208)
    172.25.176.249.63669 > 172.64.155.209.443: Flags [P.], seq 60359:61515, ack 5620, win 2285, options [nop,nop,TS val 2196522470 ecr 2891033245], length 1156
13:27:59.603746 IP (tos 0x0, ttl 64, id 0, offset 0, flags [DF], proto TCP (6), length 1426)
    172.25.176.249.63669 > 172.64.155.209.443: Flags [.], seq 61515:62889, ack 5620, win 2285, options [nop,nop,TS val 2196522470 ecr 2891033245], length 1374
13:27:59.603755 IP (tos 0x0, ttl 64, id 0, offset 0, flags [DF], proto TCP (6), length 746)
    172.25.176.249.63669 > 172.64.155.209.443: Flags [P.], seq 62889:63583, ack 5620, win 2285, options [nop,nop,TS val 2196522470 ecr 2891033245], length 694
13:27:59.609789 IP (tos 0x0, ttl 54, id 18082, offset 0, flags [DF], proto TCP (6), length 52)
    172.64.155.209.443 > 172.25.176.249.63669: Flags [.], cksum 0x259f (correct), ack 57611, win 43, options [nop,nop,TS val 2891033259 ecr 2196522470], length 0
