tcpdump: data link type PKTAP
tcpdump: WARNING: snaplen raised from 96 to 524288
tcpdump: listening on pktap, link-type PKTAP (Apple DLT_PKTAP), snapshot length 524288 bytes
12:33:19.981420 IP (tos 0x0, ttl 64, id 0, offset 0, flags [DF], proto TCP (6), length 1422)
    172.25.101.53.57077 > 172.253.115.100.443: Flags [.], cksum 0x9a9e (correct), seq 2641177648:2641179018, ack 506942169, win 3847, options [nop,nop,TS val 705567045 ecr 1976709681], length 1370
12:33:19.981422 IP (tos 0x0, ttl 64, id 1, offset 0, flags [DF], proto TCP (6), length 1422)
    172.25.101.53.57077 > 172.253.115.100.443: Flags [.], cksum 0x8ee1 (correct), seq 1370:2740, ack 1, win 3847, options [nop,nop,TS val 705567045 ecr 1976709681], length 1370
12:33:19.981457 IP (tos 0x0, ttl 64, id 0, offset 0, flags [DF], proto TCP (6), length 736)
    172.25.101.53.57077 > 172.253.115.100.443: Flags [P.], cksum 0x659f (correct), seq 2740:3424, ack 1, win 3847, options [nop,nop,TS val 705567045 ecr 1976709681], length 684
12:33:19.981480 IP (tos 0x0, ttl 64, id 0, offset 0, flags [DF], proto TCP (6), length 91)
    172.25.101.53.57077 > 172.253.115.100.443: Flags [P.], cksum 0xb81f (correct), seq 3424:3463, ack 1, win 3847, options [nop,nop,TS val 705567045 ecr 1976709681], length 39
12:33:19.981489 IP (tos 0x0, ttl 64, id 0, offset 0, flags [DF], proto TCP (6), length 250)
    172.25.101.53.57077 > 172.253.115.100.443: Flags [P.], cksum 0x8162 (correct), seq 3463:3661, ack 1, win 3847, options [nop,nop,TS val 705567045 ecr 1976709681], length 198
12:33:19.985766 IP (tos 0x0, ttl 64, id 0, offset 0, flags [DF], proto TCP (6), length 1422)
    172.25.101.53.57077 > 172.253.115.100.443: Flags [.], cksum 0xc5c5 (correct), seq 3661:5031, ack 1, win 3847, options [nop,nop,TS val 705567050 ecr 1976709681], length 1370
12:33:19.985767 IP (tos 0x0, ttl 64, id 1, offset 0, flags [DF], proto TCP (6), length 1422)
    172.25.101.53.57077 > 172.253.115.100.443: Flags [.], cksum 0x525c (correct), seq 5031:6401, ack 1, win 3847, options [nop,nop,TS val 705567050 ecr 1976709681], length 1370
12:33:19.985779 IP (tos 0x0, ttl 64, id 0, offset 0, flags [DF], proto TCP (6), length 799)
    172.25.101.53.57077 > 172.253.115.100.443: Flags [P.], cksum 0xe5a5 (correct), seq 6401:7148, ack 1, win 3847, options [nop,nop,TS val 705567050 ecr 1976709681], length 747
12:33:19.985798 IP (tos 0x0, ttl 64, id 0, offset 0, flags [DF], proto TCP (6), length 1422)
    172.25.101.53.57077 > 172.253.115.100.443: Flags [.], cksum 0x0729 (correct), seq 7148:8518, ack 1, win 3847, options [nop,nop,TS val 705567050 ecr 1976709681], length 1370
12:33:19.994323 IP (tos 0x0, ttl 118, id 12803, offset 0, flags [none], proto TCP (6), length 52)
    172.253.115.100.443 > 172.25.101.53.57077: Flags [.], cksum 0xec70 (correct), ack 1370, win 2013, options [nop,nop,TS val 1976727264 ecr 705567045], length 0
12:33:19.994324 IP (tos 0x0, ttl 118, id 12804, offset 0, flags [none], proto TCP (6), length 52)
    172.253.115.100.443 > 172.25.101.53.57077: Flags [.], cksum 0xe70b (correct), ack 2740, win 2024, options [nop,nop,TS val 1976727264 ecr 705567045], length 0
12:33:19.994324 IP (tos 0x0, ttl 118, id 12805, offset 0, flags [none], proto TCP (6), length 52)
    172.253.115.100.443 > 172.25.101.53.57077: Flags [.], cksum 0xe455 (correct), ack 3424, win 2034, options [nop,nop,TS val 1976727264 ecr 705567045], length 0
12:33:19.994324 IP (tos 0x0, ttl 118, id 12806, offset 0, flags [none], proto TCP (6), length 52)
    172.253.115.100.443 > 172.25.101.53.57077: Flags [.], cksum 0xe368 (correct), ack 3661, win 2034, options [nop,nop,TS val 1976727264 ecr 705567045], length 0
12:33:19.994325 IP (tos 0x0, ttl 118, id 12807, offset 0, flags [none], proto TCP (6), length 91)
    172.253.115.100.443 > 172.25.101.53.57077: Flags [P.], cksum 0x80cf (correct), seq 1:40, ack 3661, win 2034, options [nop,nop,TS val 1976727265 ecr 705567045], length 39
12:33:19.994398 IP (tos 0x0, ttl 64, id 0, offset 0, flags [DF], proto TCP (6), length 1262)
    172.25.101.53.57077 > 172.253.115.100.443: Flags [P.], cksum 0xa281 (correct), seq 8518:9728, ack 1, win 3847, options [nop,nop,TS val 705567058 ecr 1976727264], length 1210
12:33:19.994453 IP (tos 0x0, ttl 64, id 0, offset 0, flags [DF], proto TCP (6), length 52)
    172.25.101.53.57077 > 172.253.115.100.443: Flags [.], cksum 0xc46b (correct), ack 40, win 3847, options [nop,nop,TS val 705567058 ecr 1976727265], length 0
12:33:19.998166 IP (tos 0x0, ttl 118, id 12809, offset 0, flags [none], proto TCP (6), length 52)
    172.253.115.100.443 > 172.25.101.53.57077: Flags [.], cksum 0xd012 (correct), ack 8518, win 2078, options [nop,nop,TS val 1976727269 ecr 705567050], length 0
12:33:19.998167 IP (tos 0x0, ttl 118, id 12808, offset 0, flags [none], proto TCP (6), length 52)
    172.253.115.100.443 > 172.25.101.53.57077: Flags [.], cksum 0xd86d (correct), ack 6401, win 2056, options [nop,nop,TS val 1976727269 ecr 705567050], length 0
12:33:20.012046 IP (tos 0x0, ttl 118, id 12810, offset 0, flags [none], proto TCP (6), length 52)
    172.253.115.100.443 > 172.25.101.53.57077: Flags [.], cksum 0xcb40 (correct), ack 9728, win 2089, options [nop,nop,TS val 1976727282 ecr 705567050], length 0
12:33:20.061900 IP (tos 0x0, ttl 118, id 12811, offset 0, flags [none], proto TCP (6), length 638)
    172.253.115.100.443 > 172.25.101.53.57077: Flags [P.], cksum 0x719c (correct), seq 40:626, ack 9728, win 2089, options [nop,nop,TS val 1976727332 ecr 705567050], length 586
12:33:20.061901 IP (tos 0x0, ttl 118, id 12812, offset 0, flags [none], proto TCP (6), length 219)
    172.253.115.100.443 > 172.25.101.53.57077: Flags [P.], cksum 0xf8a4 (correct), seq 626:793, ack 9728, win 2089, options [nop,nop,TS val 1976727332 ecr 705567050], length 167
12:33:20.061901 IP (tos 0x0, ttl 118, id 12813, offset 0, flags [none], proto TCP (6), length 163)
    172.253.115.100.443 > 172.25.101.53.57077: Flags [P.], cksum 0x0ae9 (correct), seq 793:904, ack 9728, win 2089, options [nop,nop,TS val 1976727332 ecr 705567050], length 111
12:33:20.061902 IP (tos 0x0, ttl 118, id 12814, offset 0, flags [none], proto TCP (6), length 83)
    172.253.115.100.443 > 172.25.101.53.57077: Flags [P.], cksum 0x115d (correct), seq 904:935, ack 9728, win 2089, options [nop,nop,TS val 1976727332 ecr 705567050], length 31
12:33:20.061902 IP (tos 0x0, ttl 118, id 12815, offset 0, flags [none], proto TCP (6), length 91)
    172.253.115.100.443 > 172.25.101.53.57077: Flags [P.], cksum 0x0b9e (correct), seq 935:974, ack 9728, win 2089, options [nop,nop,TS val 1976727332 ecr 705567050], length 39
12:33:20.061979 IP (tos 0x0, ttl 64, id 0, offset 0, flags [DF], proto TCP (6), length 52)
    172.25.101.53.57077 > 172.253.115.100.443: Flags [.], cksum 0xc04c (correct), ack 974, win 3833, options [nop,nop,TS val 705567126 ecr 1976727332], length 0
12:33:20.062598 IP (tos 0x0, ttl 64, id 0, offset 0, flags [DF], proto TCP (6), length 87)
    172.25.101.53.57077 > 172.253.115.100.443: Flags [P.], cksum 0xb0a3 (correct), seq 9728:9763, ack 974, win 3847, options [nop,nop,TS val 705567126 ecr 1976727332], length 35
12:33:20.062609 IP (tos 0x0, ttl 64, id 0, offset 0, flags [DF], proto TCP (6), length 91)
    172.25.101.53.57077 > 172.253.115.100.443: Flags [P.], cksum 0xda4e (correct), seq 9763:9802, ack 974, win 3847, options [nop,nop,TS val 705567126 ecr 1976727332], length 39
12:33:20.074365 IP (tos 0x0, ttl 118, id 12816, offset 0, flags [none], proto TCP (6), length 52)
    172.253.115.100.443 > 172.25.101.53.57077: Flags [.], cksum 0xc6eb (correct), ack 9763, win 2089, options [nop,nop,TS val 1976727346 ecr 705567126], length 0
12:33:20.074366 IP (tos 0x0, ttl 118, id 12817, offset 0, flags [none], proto TCP (6), length 52)
    172.253.115.100.443 > 172.25.101.53.57077: Flags [.], cksum 0xc6c4 (correct), ack 9802, win 2089, options [nop,nop,TS val 1976727346 ecr 705567126], length 0
12:33:20.090053 IP (tos 0x0, ttl 118, id 12818, offset 0, flags [none], proto TCP (6), length 574)
    172.253.115.100.443 > 172.25.101.53.57077: Flags [P.], cksum 0x29a0 (correct), seq 974:1496, ack 9802, win 2089, options [nop,nop,TS val 1976727361 ecr 705567126], length 522
12:33:20.090054 IP (tos 0x0, ttl 118, id 12819, offset 0, flags [none], proto TCP (6), length 471)
    172.253.115.100.443 > 172.25.101.53.57077: Flags [P.], cksum 0x0090 (correct), seq 1496:1915, ack 9802, win 2089, options [nop,nop,TS val 1976727361 ecr 705567126], length 419
12:33:20.090108 IP (tos 0x0, ttl 64, id 0, offset 0, flags [DF], proto TCP (6), length 52)
    172.25.101.53.57077 > 172.253.115.100.443: Flags [.], cksum 0xbc1c (correct), ack 1915, win 3833, options [nop,nop,TS val 705567154 ecr 1976727361], length 0
12:33:20.098239 IP (tos 0x0, ttl 64, id 0, offset 0, flags [DF], proto TCP (6), length 1422)
    172.25.101.53.57077 > 172.253.115.100.443: Flags [.], cksum 0x1b49 (correct), seq 9802:11172, ack 1915, win 3847, options [nop,nop,TS val 705567162 ecr 1976727361], length 1370
12:33:20.098240 IP (tos 0x0, ttl 64, id 1, offset 0, flags [DF], proto TCP (6), length 1422)
    172.25.101.53.57077 > 172.253.115.100.443: Flags [.], cksum 0x6835 (correct), seq 11172:12542, ack 1915, win 3847, options [nop,nop,TS val 705567162 ecr 1976727361], length 1370
12:33:20.098248 IP (tos 0x0, ttl 64, id 0, offset 0, flags [DF], proto TCP (6), length 508)
    172.25.101.53.57077 > 172.253.115.100.443: Flags [P.], cksum 0xa324 (correct), seq 12542:12998, ack 1915, win 3847, options [nop,nop,TS val 705567162 ecr 1976727361], length 456
12:33:20.098258 IP (tos 0x0, ttl 64, id 0, offset 0, flags [DF], proto TCP (6), length 1422)
    172.25.101.53.57077 > 172.253.115.100.443: Flags [.], cksum 0x12a0 (correct), seq 12998:14368, ack 1915, win 3847, options [nop,nop,TS val 705567162 ecr 1976727361], length 1370
12:33:20.098259 IP (tos 0x0, ttl 64, id 1, offset 0, flags [DF], proto TCP (6), length 1422)
    172.25.101.53.57077 > 172.253.115.100.443: Flags [.], cksum 0x9f33 (correct), seq 14368:15738, ack 1915, win 3847, options [nop,nop,TS val 705567162 ecr 1976727361], length 1370
12:33:20.098261 IP (tos 0x0, ttl 64, id 0, offset 0, flags [DF], proto TCP (6), length 1261)
    172.25.101.53.57077 > 172.253.115.100.443: Flags [P.], cksum 0x5473 (correct), seq 15738:16947, ack 1915, win 3847, options [nop,nop,TS val 705567162 ecr 1976727361], length 1209
12:33:20.101732 IP (tos 0x0, ttl 64, id 0, offset 0, flags [DF], proto TCP (6), length 1422)
    172.25.101.53.57077 > 172.253.115.100.443: Flags [.], cksum 0x9416 (correct), seq 16947:18317, ack 1915, win 3847, options [nop,nop,TS val 705567165 ecr 1976727361], length 1370
12:33:20.101732 IP (tos 0x0, ttl 64, id 1, offset 0, flags [DF], proto TCP (6), length 1422)
    172.25.101.53.57077 > 172.253.115.100.443: Flags [.], cksum 0x9342 (correct), seq 18317:19687, ack 1915, win 3847, options [nop,nop,TS val 705567165 ecr 1976727361], length 1370
12:33:20.101746 IP (tos 0x0, ttl 64, id 0, offset 0, flags [DF], proto TCP (6), length 738)
    172.25.101.53.57077 > 172.253.115.100.443: Flags [P.], cksum 0x1df9 (correct), seq 19687:20373, ack 1915, win 3847, options [nop,nop,TS val 705567165 ecr 1976727361], length 686
12:33:20.101756 IP (tos 0x0, ttl 64, id 0, offset 0, flags [DF], proto TCP (6), length 236)
    172.25.101.53.57077 > 172.253.115.100.443: Flags [P.], cksum 0x1b51 (correct), seq 20373:20557, ack 1915, win 3847, options [nop,nop,TS val 705567165 ecr 1976727361], length 184
12:33:20.111830 IP (tos 0x0, ttl 118, id 12820, offset 0, flags [none], proto TCP (6), length 64)
    172.253.115.100.443 > 172.25.101.53.57077: Flags [.], cksum 0x9049 (correct), ack 11172, win 2111, options [nop,nop,TS val 1976727381 ecr 705567162,nop,nop,sack 1 {12542:12998}], length 0
12:33:20.111832 IP (tos 0x0, ttl 118, id 12821, offset 0, flags [none], proto TCP (6), length 52)
    172.253.115.100.443 > 172.25.101.53.57077: Flags [.], cksum 0xb633 (correct), ack 12998, win 2122, options [nop,nop,TS val 1976727381 ecr 705567162], length 0
12:33:20.111832 IP (tos 0x0, ttl 118, id 12822, offset 0, flags [none], proto TCP (6), length 52)
    172.253.115.100.443 > 172.25.101.53.57077: Flags [.], cksum 0xab6a (correct), ack 15738, win 2143, options [nop,nop,TS val 1976727381 ecr 705567162], length 0
12:33:20.114058 IP (tos 0x0, ttl 118, id 12823, offset 0, flags [none], proto TCP (6), length 52)
    172.253.115.100.443 > 172.25.101.53.57077: Flags [.], cksum 0xa13d (correct), ack 18317, win 2165, options [nop,nop,TS val 1976727385 ecr 705567162], length 0
12:33:20.114058 IP (tos 0x0, ttl 118, id 12824, offset 0, flags [none], proto TCP (6), length 52)
    172.253.115.100.443 > 172.25.101.53.57077: Flags [.], cksum 0x991c (correct), ack 20373, win 2187, options [nop,nop,TS val 1976727385 ecr 705567165], length 0
12:33:20.119040 IP (tos 0x0, ttl 118, id 12825, offset 0, flags [none], proto TCP (6), length 52)
    172.253.115.100.443 > 172.25.101.53.57077: Flags [.], cksum 0x985f (correct), ack 20557, win 2187, options [nop,nop,TS val 1976727390 ecr 705567165], length 0
12:33:20.141612 IP (tos 0x0, ttl 118, id 12826, offset 0, flags [none], proto TCP (6), length 849)
    172.253.115.100.443 > 172.25.101.53.57077: Flags [P.], cksum 0x54ad (correct), seq 1915:2712, ack 20557, win 2187, options [nop,nop,TS val 1976727410 ecr 705567165], length 797
12:33:20.141613 IP (tos 0x0, ttl 118, id 12827, offset 0, flags [none], proto TCP (6), length 83)
    172.253.115.100.443 > 172.25.101.53.57077: Flags [P.], cksum 0xf2bd (correct), seq 2712:2743, ack 20557, win 2187, options [nop,nop,TS val 1976727410 ecr 705567165], length 31
12:33:20.141614 IP (tos 0x0, ttl 118, id 12828, offset 0, flags [none], proto TCP (6), length 91)
    172.253.115.100.443 > 172.25.101.53.57077: Flags [P.], cksum 0x6efd (correct), seq 2743:2782, ack 20557, win 2187, options [nop,nop,TS val 1976727411 ecr 705567165], length 39
12:33:20.141744 IP (tos 0x0, ttl 64, id 0, offset 0, flags [DF], proto TCP (6), length 52)
    172.25.101.53.57077 > 172.253.115.100.443: Flags [.], cksum 0x8e50 (correct), ack 2782, win 3834, options [nop,nop,TS val 705567205 ecr 1976727411], length 0
12:33:20.142268 IP (tos 0x0, ttl 64, id 0, offset 0, flags [DF], proto TCP (6), length 91)
    172.25.101.53.57077 > 172.253.115.100.443: Flags [P.], cksum 0xf2f3 (correct), seq 20557:20596, ack 2782, win 3847, options [nop,nop,TS val 705567205 ecr 1976727411], length 39
12:33:20.158683 IP (tos 0x0, ttl 118, id 12829, offset 0, flags [none], proto TCP (6), length 52)
    172.253.115.100.443 > 172.25.101.53.57077: Flags [.], cksum 0x9485 (correct), ack 20596, win 2187, options [nop,nop,TS val 1976727430 ecr 705567205], length 0
12:33:20.387878 IP (tos 0x0, ttl 118, id 12830, offset 0, flags [none], proto TCP (6), length 812)
    172.253.115.100.443 > 172.25.101.53.57077: Flags [P.], cksum 0xcd8f (correct), seq 2782:3542, ack 20596, win 2187, options [nop,nop,TS val 1976727658 ecr 705567205], length 760
12:33:20.387879 IP (tos 0x0, ttl 118, id 12831, offset 0, flags [none], proto TCP (6), length 376)
    172.253.115.100.443 > 172.25.101.53.57077: Flags [P.], cksum 0x9f84 (correct), seq 3542:3866, ack 20596, win 2187, options [nop,nop,TS val 1976727658 ecr 705567205], length 324
12:33:20.387879 IP (tos 0x0, ttl 118, id 12832, offset 0, flags [none], proto TCP (6), length 306)
    172.253.115.100.443 > 172.25.101.53.57077: Flags [P.], cksum 0x5205 (correct), seq 3866:4120, ack 20596, win 2187, options [nop,nop,TS val 1976727658 ecr 705567205], length 254
12:33:20.387880 IP (tos 0x0, ttl 118, id 12833, offset 0, flags [none], proto TCP (6), length 257)
    172.253.115.100.443 > 172.25.101.53.57077: Flags [P.], cksum 0xeb85 (correct), seq 4120:4325, ack 20596, win 2187, options [nop,nop,TS val 1976727658 ecr 705567205], length 205
12:33:20.387880 IP (tos 0x0, ttl 118, id 12834, offset 0, flags [none], proto TCP (6), length 83)
    172.253.115.100.443 > 172.25.101.53.57077: Flags [P.], cksum 0x4513 (correct), seq 4325:4356, ack 20596, win 2187, options [nop,nop,TS val 1976727658 ecr 705567205], length 31
12:33:20.387880 IP (tos 0x0, ttl 118, id 12835, offset 0, flags [none], proto TCP (6), length 91)
    172.253.115.100.443 > 172.25.101.53.57077: Flags [P.], cksum 0xde00 (correct), seq 4356:4395, ack 20596, win 2187, options [nop,nop,TS val 1976727658 ecr 705567205], length 39
12:33:20.387948 IP (tos 0x0, ttl 64, id 0, offset 0, flags [DF], proto TCP (6), length 52)
    172.25.101.53.57077 > 172.253.115.100.443: Flags [.], cksum 0x85fa (correct), ack 4395, win 3822, options [nop,nop,TS val 705567452 ecr 1976727658], length 0
12:33:20.388572 IP (tos 0x0, ttl 64, id 0, offset 0, flags [DF], proto TCP (6), length 91)
    172.25.101.53.57077 > 172.253.115.100.443: Flags [P.], cksum 0x2933 (correct), seq 20596:20635, ack 4395, win 3847, options [nop,nop,TS val 705567452 ecr 1976727658], length 39
12:33:20.400334 IP (tos 0x0, ttl 118, id 12836, offset 0, flags [none], proto TCP (6), length 52)
    172.253.115.100.443 > 172.25.101.53.57077: Flags [.], cksum 0x8c28 (correct), ack 20635, win 2187, options [nop,nop,TS val 1976727672 ecr 705567452], length 0
12:33:21.111553 IP (tos 0x0, ttl 118, id 12837, offset 0, flags [none], proto TCP (6), length 747)
    172.253.115.100.443 > 172.25.101.53.57077: Flags [P.], cksum 0xe90e (correct), seq 4395:5090, ack 20635, win 2187, options [nop,nop,TS val 1976728383 ecr 705567452], length 695
12:33:21.111596 IP (tos 0x0, ttl 64, id 0, offset 0, flags [DF], proto TCP (6), length 52)
    172.25.101.53.57077 > 172.253.115.100.443: Flags [.], cksum 0x7d65 (correct), ack 5090, win 3837, options [nop,nop,TS val 705568175 ecr 1976728383], length 0
12:33:21.142234 IP (tos 0x0, ttl 118, id 12838, offset 0, flags [none], proto TCP (6), length 207)
    172.253.115.100.443 > 172.25.101.53.57077: Flags [P.], cksum 0xf415 (correct), seq 5090:5245, ack 20635, win 2187, options [nop,nop,TS val 1976728414 ecr 705568175], length 155
12:33:21.142281 IP (tos 0x0, ttl 64, id 0, offset 0, flags [DF], proto TCP (6), length 52)
    172.25.101.53.57077 > 172.253.115.100.443: Flags [.], cksum 0x7c85 (correct), ack 5245, win 3844, options [nop,nop,TS val 705568206 ecr 1976728414], length 0
12:33:21.160402 IP (tos 0x0, ttl 118, id 12839, offset 0, flags [none], proto TCP (6), length 341)
    172.253.115.100.443 > 172.25.101.53.57077: Flags [P.], cksum 0x8e9b (correct), seq 5245:5534, ack 20635, win 2187, options [nop,nop,TS val 1976728432 ecr 705568206], length 289
12:33:21.160446 IP (tos 0x0, ttl 64, id 0, offset 0, flags [DF], proto TCP (6), length 52)
    172.25.101.53.57077 > 172.253.115.100.443: Flags [.], cksum 0x7b42 (correct), ack 5534, win 3842, options [nop,nop,TS val 705568224 ecr 1976728432], length 0
12:33:21.231354 IP (tos 0x0, ttl 118, id 12840, offset 0, flags [none], proto TCP (6), length 203)
    172.253.115.100.443 > 172.25.101.53.57077: Flags [P.], cksum 0xce62 (correct), seq 5534:5685, ack 20635, win 2187, options [nop,nop,TS val 1976728503 ecr 705568224], length 151
12:33:21.231441 IP (tos 0x0, ttl 64, id 0, offset 0, flags [DF], proto TCP (6), length 52)
    172.25.101.53.57077 > 172.253.115.100.443: Flags [.], cksum 0x7a1b (correct), ack 5685, win 3844, options [nop,nop,TS val 705568295 ecr 1976728503], length 0
12:33:21.318388 IP (tos 0x0, ttl 118, id 12841, offset 0, flags [none], proto TCP (6), length 235)
    172.253.115.100.443 > 172.25.101.53.57077: Flags [P.], cksum 0x546a (correct), seq 5685:5868, ack 20635, win 2187, options [nop,nop,TS val 1976728590 ecr 705568295], length 183
12:33:21.318491 IP (tos 0x0, ttl 64, id 0, offset 0, flags [DF], proto TCP (6), length 52)
    172.25.101.53.57077 > 172.253.115.100.443: Flags [.], cksum 0x78b6 (correct), ack 5868, win 3844, options [nop,nop,TS val 705568382 ecr 1976728590], length 0
12:33:21.364762 IP (tos 0x0, ttl 118, id 12842, offset 0, flags [none], proto TCP (6), length 389)
    172.253.115.100.443 > 172.25.101.53.57077: Flags [P.], cksum 0x8960 (correct), seq 5868:6205, ack 20635, win 2187, options [nop,nop,TS val 1976728635 ecr 705568382], length 337
12:33:21.364869 IP (tos 0x0, ttl 64, id 0, offset 0, flags [DF], proto TCP (6), length 52)
    172.25.101.53.57077 > 172.253.115.100.443: Flags [.], cksum 0x770c (correct), ack 6205, win 3841, options [nop,nop,TS val 705568429 ecr 1976728635], length 0
12:33:21.397626 IP (tos 0x0, ttl 118, id 12843, offset 0, flags [none], proto TCP (6), length 279)
    172.253.115.100.443 > 172.25.101.53.57077: Flags [P.], cksum 0x9d9a (correct), seq 6205:6432, ack 20635, win 2187, options [nop,nop,TS val 1976728668 ecr 705568429], length 227
12:33:21.397760 IP (tos 0x0, ttl 64, id 0, offset 0, flags [DF], proto TCP (6), length 52)
    172.25.101.53.57077 > 172.253.115.100.443: Flags [.], cksum 0x75e6 (correct), ack 6432, win 3843, options [nop,nop,TS val 705568461 ecr 1976728668], length 0
12:33:21.441602 IP (tos 0x0, ttl 118, id 12844, offset 0, flags [none], proto TCP (6), length 319)
    172.253.115.100.443 > 172.25.101.53.57077: Flags [P.], cksum 0xd4eb (correct), seq 6432:6699, ack 20635, win 2187, options [nop,nop,TS val 1976728710 ecr 705568461], length 267
12:33:21.441729 IP (tos 0x0, ttl 64, id 0, offset 0, flags [DF], proto TCP (6), length 52)
    172.25.101.53.57077 > 172.253.115.100.443: Flags [.], cksum 0x7486 (correct), ack 6699, win 3842, options [nop,nop,TS val 705568505 ecr 1976728710], length 0
12:33:21.477163 IP (tos 0x0, ttl 118, id 12845, offset 0, flags [none], proto TCP (6), length 372)
    172.253.115.100.443 > 172.25.101.53.57077: Flags [P.], cksum 0x930d (correct), seq 6699:7019, ack 20635, win 2187, options [nop,nop,TS val 1976728748 ecr 705568505], length 320
12:33:21.477229 IP (tos 0x0, ttl 64, id 0, offset 0, flags [DF], proto TCP (6), length 52)
    172.25.101.53.57077 > 172.253.115.100.443: Flags [.], cksum 0x72fc (correct), ack 7019, win 3842, options [nop,nop,TS val 705568541 ecr 1976728748], length 0
12:33:21.548031 IP (tos 0x0, ttl 118, id 12846, offset 0, flags [none], proto TCP (6), length 236)
    172.253.115.100.443 > 172.25.101.53.57077: Flags [P.], cksum 0x2280 (correct), seq 7019:7203, ack 20635, win 2187, options [nop,nop,TS val 1976728819 ecr 705568541], length 184
12:33:21.548090 IP (tos 0x0, ttl 64, id 0, offset 0, flags [DF], proto TCP (6), length 52)
    172.25.101.53.57077 > 172.253.115.100.443: Flags [.], cksum 0x71b4 (correct), ack 7203, win 3844, options [nop,nop,TS val 705568612 ecr 1976728819], length 0
12:33:21.575547 IP (tos 0x0, ttl 118, id 12847, offset 0, flags [none], proto TCP (6), length 292)
    172.253.115.100.443 > 172.25.101.53.57077: Flags [P.], cksum 0xfa3a (correct), seq 7203:7443, ack 20635, win 2187, options [nop,nop,TS val 1976728846 ecr 705568612], length 240
12:33:21.575647 IP (tos 0x0, ttl 64, id 0, offset 0, flags [DF], proto TCP (6), length 52)
    172.25.101.53.57077 > 172.253.115.100.443: Flags [.], cksum 0x708f (correct), ack 7443, win 3843, options [nop,nop,TS val 705568639 ecr 1976728846], length 0
12:33:21.639809 IP (tos 0x0, ttl 118, id 12848, offset 0, flags [none], proto TCP (6), length 151)
    172.253.115.100.443 > 172.25.101.53.57077: Flags [P.], cksum 0x4fa0 (correct), seq 7443:7542, ack 20635, win 2187, options [nop,nop,TS val 1976728910 ecr 705568639], length 99
12:33:21.639912 IP (tos 0x0, ttl 64, id 0, offset 0, flags [DF], proto TCP (6), length 52)
    172.25.101.53.57077 > 172.253.115.100.443: Flags [.], cksum 0x6fa9 (correct), ack 7542, win 3845, options [nop,nop,TS val 705568704 ecr 1976728910], length 0
12:33:21.692968 IP (tos 0x0, ttl 118, id 12849, offset 0, flags [none], proto TCP (6), length 233)
    172.253.115.100.443 > 172.25.101.53.57077: Flags [P.], cksum 0x72e8 (correct), seq 7542:7723, ack 20635, win 2187, options [nop,nop,TS val 1976728963 ecr 705568704], length 181
12:33:21.693111 IP (tos 0x0, ttl 64, id 0, offset 0, flags [DF], proto TCP (6), length 52)
    172.25.101.53.57077 > 172.253.115.100.443: Flags [.], cksum 0x6e88 (correct), ack 7723, win 3847, options [nop,nop,TS val 705568757 ecr 1976728963], length 0
12:33:21.756896 IP (tos 0x0, ttl 118, id 12850, offset 0, flags [none], proto TCP (6), length 357)
    172.253.115.100.443 > 172.25.101.53.57077: Flags [P.], cksum 0xb376 (correct), seq 7723:8028, ack 20635, win 2187, options [nop,nop,TS val 1976729028 ecr 705568757], length 305
12:33:21.757097 IP (tos 0x0, ttl 64, id 0, offset 0, flags [DF], proto TCP (6), length 52)
    172.25.101.53.57077 > 172.253.115.100.443: Flags [.], cksum 0x6cd6 (correct), ack 8028, win 3847, options [nop,nop,TS val 705568821 ecr 1976729028], length 0
12:33:21.798582 IP (tos 0x0, ttl 118, id 12851, offset 0, flags [none], proto TCP (6), length 288)
    172.253.115.100.443 > 172.25.101.53.57077: Flags [P.], cksum 0xf6c8 (correct), seq 8028:8264, ack 20635, win 2187, options [nop,nop,TS val 1976729070 ecr 705568821], length 236
12:33:21.798807 IP (tos 0x0, ttl 64, id 0, offset 0, flags [DF], proto TCP (6), length 52)
    172.25.101.53.57077 > 172.253.115.100.443: Flags [.], cksum 0x6b97 (correct), ack 8264, win 3847, options [nop,nop,TS val 705568862 ecr 1976729070], length 0
12:33:21.843579 IP (tos 0x0, ttl 118, id 12852, offset 0, flags [none], proto TCP (6), length 402)
    172.253.115.100.443 > 172.25.101.53.57077: Flags [P.], cksum 0x4c01 (correct), seq 8264:8614, ack 20635, win 2187, options [nop,nop,TS val 1976729115 ecr 705568862], length 350
12:33:21.843653 IP (tos 0x0, ttl 64, id 0, offset 0, flags [DF], proto TCP (6), length 52)
    172.25.101.53.57077 > 172.253.115.100.443: Flags [.], cksum 0x69df (correct), ack 8614, win 3847, options [nop,nop,TS val 705568907 ecr 1976729115], length 0
12:33:21.884138 IP (tos 0x0, ttl 118, id 12853, offset 0, flags [none], proto TCP (6), length 381)
    172.253.115.100.443 > 172.25.101.53.57077: Flags [P.], cksum 0x8217 (correct), seq 8614:8943, ack 20635, win 2187, options [nop,nop,TS val 1976729154 ecr 705568907], length 329
12:33:21.884304 IP (tos 0x0, ttl 64, id 0, offset 0, flags [DF], proto TCP (6), length 52)
    172.25.101.53.57077 > 172.253.115.100.443: Flags [.], cksum 0x6846 (correct), ack 8943, win 3847, options [nop,nop,TS val 705568948 ecr 1976729154], length 0
12:33:22.004164 IP (tos 0x0, ttl 118, id 12854, offset 0, flags [none], proto TCP (6), length 467)
    172.253.115.100.443 > 172.25.101.53.57077: Flags [P.], cksum 0x6ade (correct), seq 8943:9358, ack 20635, win 2187, options [nop,nop,TS val 1976729275 ecr 705568948], length 415
12:33:22.004235 IP (tos 0x0, ttl 64, id 0, offset 0, flags [DF], proto TCP (6), length 52)
    172.25.101.53.57077 > 172.253.115.100.443: Flags [.], cksum 0x65b7 (correct), ack 9358, win 3847, options [nop,nop,TS val 705569067 ecr 1976729275], length 0
12:33:22.143735 IP (tos 0x0, ttl 118, id 12855, offset 0, flags [none], proto TCP (6), length 220)
    172.253.115.100.443 > 172.25.101.53.57077: Flags [P.], cksum 0x0f76 (correct), seq 9358:9526, ack 20635, win 2187, options [nop,nop,TS val 1976729415 ecr 705569067], length 168
12:33:22.143831 IP (tos 0x0, ttl 64, id 0, offset 0, flags [DF], proto TCP (6), length 52)
    172.25.101.53.57077 > 172.253.115.100.443: Flags [.], cksum 0x63f6 (correct), ack 9526, win 3847, options [nop,nop,TS val 705569208 ecr 1976729415], length 0
12:33:22.339759 IP (tos 0x0, ttl 118, id 12856, offset 0, flags [none], proto TCP (6), length 241)
    172.253.115.100.443 > 172.25.101.53.57077: Flags [P.], cksum 0xd180 (correct), seq 9526:9715, ack 20635, win 2187, options [nop,nop,TS val 1976729610 ecr 705569208], length 189
12:33:22.339943 IP (tos 0x0, ttl 64, id 0, offset 0, flags [DF], proto TCP (6), length 52)
    172.25.101.53.57077 > 172.253.115.100.443: Flags [.], cksum 0x61b2 (correct), ack 9715, win 3847, options [nop,nop,TS val 705569404 ecr 1976729610], length 0
12:33:22.511936 IP (tos 0x0, ttl 118, id 12857, offset 0, flags [none], proto TCP (6), length 257)
    172.253.115.100.443 > 172.25.101.53.57077: Flags [P.], cksum 0xbd56 (correct), seq 9715:9920, ack 20635, win 2187, options [nop,nop,TS val 1976729783 ecr 705569404], length 205
12:33:22.512132 IP (tos 0x0, ttl 64, id 0, offset 0, flags [DF], proto TCP (6), length 52)
    172.25.101.53.57077 > 172.253.115.100.443: Flags [.], cksum 0x5f8c (correct), ack 9920, win 3847, options [nop,nop,TS val 705569576 ecr 1976729783], length 0
12:33:22.658085 IP (tos 0x0, ttl 118, id 12858, offset 0, flags [none], proto TCP (6), length 270)
    172.253.115.100.443 > 172.25.101.53.57077: Flags [P.], cksum 0x217b (correct), seq 9920:10138, ack 20635, win 2187, options [nop,nop,TS val 1976729929 ecr 705569576], length 218
12:33:22.658269 IP (tos 0x0, ttl 64, id 0, offset 0, flags [DF], proto TCP (6), length 52)
    172.25.101.53.57077 > 172.253.115.100.443: Flags [.], cksum 0x5d8e (correct), ack 10138, win 3847, options [nop,nop,TS val 705569722 ecr 1976729929], length 0
12:33:22.796640 IP (tos 0x0, ttl 118, id 12859, offset 0, flags [none], proto TCP (6), length 407)
    172.253.115.100.443 > 172.25.101.53.57077: Flags [P.], cksum 0x32f8 (correct), seq 10138:10493, ack 20635, win 2187, options [nop,nop,TS val 1976730068 ecr 705569722], length 355
12:33:22.796810 IP (tos 0x0, ttl 64, id 0, offset 0, flags [DF], proto TCP (6), length 52)
    172.25.101.53.57077 > 172.253.115.100.443: Flags [.], cksum 0x5b16 (correct), ack 10493, win 3847, options [nop,nop,TS val 705569860 ecr 1976730068], length 0
12:33:22.941743 IP (tos 0x0, ttl 118, id 12860, offset 0, flags [none], proto TCP (6), length 342)
    172.253.115.100.443 > 172.25.101.53.57077: Flags [P.], cksum 0x159c (correct), seq 10493:10783, ack 20635, win 2187, options [nop,nop,TS val 1976730213 ecr 705569860], length 290
12:33:22.941935 IP (tos 0x0, ttl 64, id 0, offset 0, flags [DF], proto TCP (6), length 52)
    172.25.101.53.57077 > 172.253.115.100.443: Flags [.], cksum 0x58d1 (correct), ack 10783, win 3847, options [nop,nop,TS val 705570006 ecr 1976730213], length 0
12:33:23.093048 IP (tos 0x0, ttl 118, id 12861, offset 0, flags [none], proto TCP (6), length 378)
    172.253.115.100.443 > 172.25.101.53.57077: Flags [P.], cksum 0x6c60 (correct), seq 10783:11109, ack 20635, win 2187, options [nop,nop,TS val 1976730364 ecr 705570006], length 326
12:33:23.093409 IP (tos 0x0, ttl 64, id 0, offset 0, flags [DF], proto TCP (6), length 52)
    172.25.101.53.57077 > 172.253.115.100.443: Flags [.], cksum 0x565d (correct), ack 11109, win 3847, options [nop,nop,TS val 705570157 ecr 1976730364], length 0
12:33:23.210706 IP (tos 0x0, ttl 118, id 12862, offset 0, flags [none], proto TCP (6), length 349)
    172.253.115.100.443 > 172.25.101.53.57077: Flags [P.], cksum 0x09bc (correct), seq 11109:11406, ack 20635, win 2187, options [nop,nop,TS val 1976730482 ecr 705570157], length 297
12:33:23.210878 IP (tos 0x0, ttl 64, id 0, offset 0, flags [DF], proto TCP (6), length 52)
    172.25.101.53.57077 > 172.253.115.100.443: Flags [.], cksum 0x5449 (correct), ack 11406, win 3847, options [nop,nop,TS val 705570274 ecr 1976730482], length 0
12:33:23.385536 IP (tos 0x0, ttl 118, id 12863, offset 0, flags [none], proto TCP (6), length 392)
    172.253.115.100.443 > 172.25.101.53.57077: Flags [P.], cksum 0x2583 (correct), seq 11406:11746, ack 20635, win 2187, options [nop,nop,TS val 1976730656 ecr 705570274], length 340
12:33:23.385724 IP (tos 0x0, ttl 64, id 0, offset 0, flags [DF], proto TCP (6), length 52)
    172.25.101.53.57077 > 172.253.115.100.443: Flags [.], cksum 0x5198 (correct), ack 11746, win 3847, options [nop,nop,TS val 705570449 ecr 1976730656], length 0
12:33:23.541278 IP (tos 0x0, ttl 118, id 12864, offset 0, flags [none], proto TCP (6), length 313)
    172.253.115.100.443 > 172.25.101.53.57077: Flags [P.], cksum 0x6147 (correct), seq 11746:12007, ack 20635, win 2187, options [nop,nop,TS val 1976730812 ecr 705570449], length 261
12:33:23.541479 IP (tos 0x0, ttl 64, id 0, offset 0, flags [DF], proto TCP (6), length 52)
    172.25.101.53.57077 > 172.253.115.100.443: Flags [.], cksum 0x4f5b (correct), ack 12007, win 3847, options [nop,nop,TS val 705570605 ecr 1976730812], length 0
12:33:23.694221 IP (tos 0x0, ttl 118, id 12865, offset 0, flags [none], proto TCP (6), length 244)
    172.253.115.100.443 > 172.25.101.53.57077: Flags [P.], cksum 0xfe80 (correct), seq 12007:12199, ack 20635, win 2187, options [nop,nop,TS val 1976730966 ecr 705570605], length 192
12:33:23.694337 IP (tos 0x0, ttl 64, id 0, offset 0, flags [DF], proto TCP (6), length 52)
    172.25.101.53.57077 > 172.253.115.100.443: Flags [.], cksum 0x4d68 (correct), ack 12199, win 3847, options [nop,nop,TS val 705570758 ecr 1976730966], length 0
12:33:23.855753 IP (tos 0x0, ttl 118, id 12866, offset 0, flags [none], proto TCP (6), length 207)
    172.253.115.100.443 > 172.25.101.53.57077: Flags [P.], cksum 0x2052 (correct), seq 12199:12354, ack 20635, win 2187, options [nop,nop,TS val 1976731127 ecr 705570758], length 155
12:33:23.855954 IP (tos 0x0, ttl 64, id 0, offset 0, flags [DF], proto TCP (6), length 52)
    172.25.101.53.57077 > 172.253.115.100.443: Flags [.], cksum 0x4b8a (correct), ack 12354, win 3847, options [nop,nop,TS val 705570920 ecr 1976731127], length 0
12:33:24.061351 IP (tos 0x0, ttl 118, id 12867, offset 0, flags [none], proto TCP (6), length 421)
    172.253.115.100.443 > 172.25.101.53.57077: Flags [P.], cksum 0x71a5 (correct), seq 12354:12723, ack 20635, win 2187, options [nop,nop,TS val 1976731331 ecr 705570920], length 369
12:33:24.061628 IP (tos 0x0, ttl 64, id 0, offset 0, flags [DF], proto TCP (6), length 52)
    172.25.101.53.57077 > 172.253.115.100.443: Flags [.], cksum 0x4880 (correct), ack 12723, win 3847, options [nop,nop,TS val 705571125 ecr 1976731331], length 0
12:33:24.187650 IP (tos 0x0, ttl 118, id 12868, offset 0, flags [none], proto TCP (6), length 284)
    172.253.115.100.443 > 172.25.101.53.57077: Flags [P.], cksum 0x49f7 (correct), seq 12723:12955, ack 20635, win 2187, options [nop,nop,TS val 1976731459 ecr 705571125], length 232
12:33:24.187834 IP (tos 0x0, ttl 64, id 0, offset 0, flags [DF], proto TCP (6), length 52)
    172.25.101.53.57077 > 172.253.115.100.443: Flags [.], cksum 0x469a (correct), ack 12955, win 3847, options [nop,nop,TS val 705571251 ecr 1976731459], length 0
12:33:24.303883 IP (tos 0x0, ttl 118, id 12869, offset 0, flags [none], proto TCP (6), length 234)
    172.253.115.100.443 > 172.25.101.53.57077: Flags [P.], cksum 0x2643 (correct), seq 12955:13137, ack 20635, win 2187, options [nop,nop,TS val 1976731575 ecr 705571251], length 182
12:33:24.304104 IP (tos 0x0, ttl 64, id 0, offset 0, flags [DF], proto TCP (6), length 52)
    172.25.101.53.57077 > 172.253.115.100.443: Flags [.], cksum 0x44fb (correct), ack 13137, win 3847, options [nop,nop,TS val 705571368 ecr 1976731575], length 0
12:33:24.488634 IP (tos 0x0, ttl 118, id 12870, offset 0, flags [none], proto TCP (6), length 259)
    172.253.115.100.443 > 172.25.101.53.57077: Flags [P.], cksum 0xbe02 (correct), seq 13137:13344, ack 20635, win 2187, options [nop,nop,TS val 1976731759 ecr 705571368], length 207
12:33:24.488846 IP (tos 0x0, ttl 64, id 0, offset 0, flags [DF], proto TCP (6), length 52)
    172.25.101.53.57077 > 172.253.115.100.443: Flags [.], cksum 0x42bc (correct), ack 13344, win 3847, options [nop,nop,TS val 705571552 ecr 1976731759], length 0
12:33:24.620410 IP (tos 0x0, ttl 118, id 12871, offset 0, flags [none], proto TCP (6), length 244)
    172.253.115.100.443 > 172.25.101.53.57077: Flags [P.], cksum 0xa644 (correct), seq 13344:13536, ack 20635, win 2187, options [nop,nop,TS val 1976731892 ecr 705571552], length 192
12:33:24.620622 IP (tos 0x0, ttl 64, id 0, offset 0, flags [DF], proto TCP (6), length 52)
    172.25.101.53.57077 > 172.253.115.100.443: Flags [.], cksum 0x40f3 (correct), ack 13536, win 3847, options [nop,nop,TS val 705571684 ecr 1976731892], length 0
12:33:24.781403 IP (tos 0x0, ttl 118, id 12872, offset 0, flags [none], proto TCP (6), length 416)
    172.253.115.100.443 > 172.25.101.53.57077: Flags [P.], cksum 0x9d62 (correct), seq 13536:13900, ack 20635, win 2187, options [nop,nop,TS val 1976732053 ecr 705571684], length 364
12:33:24.781608 IP (tos 0x0, ttl 64, id 0, offset 0, flags [DF], proto TCP (6), length 52)
    172.25.101.53.57077 > 172.253.115.100.443: Flags [.], cksum 0x3e45 (correct), ack 13900, win 3847, options [nop,nop,TS val 705571845 ecr 1976732053], length 0
12:33:24.952553 IP (tos 0x0, ttl 118, id 12873, offset 0, flags [none], proto TCP (6), length 359)
    172.253.115.100.443 > 172.25.101.53.57077: Flags [P.], cksum 0xe706 (correct), seq 13900:14207, ack 20635, win 2187, options [nop,nop,TS val 1976732224 ecr 705571845], length 307
12:33:24.952765 IP (tos 0x0, ttl 64, id 0, offset 0, flags [DF], proto TCP (6), length 52)
    172.25.101.53.57077 > 172.253.115.100.443: Flags [.], cksum 0x3bbc (correct), ack 14207, win 3847, options [nop,nop,TS val 705572016 ecr 1976732224], length 0
12:33:25.190113 IP (tos 0x0, ttl 118, id 12874, offset 0, flags [none], proto TCP (6), length 471)
    172.253.115.100.443 > 172.25.101.53.57077: Flags [P.], cksum 0xd30c (correct), seq 14207:14626, ack 20635, win 2187, options [nop,nop,TS val 1976732461 ecr 705572016], length 419
12:33:25.190297 IP (tos 0x0, ttl 64, id 0, offset 0, flags [DF], proto TCP (6), length 52)
    172.25.101.53.57077 > 172.253.115.100.443: Flags [.], cksum 0x383e (correct), ack 14626, win 3847, options [nop,nop,TS val 705572254 ecr 1976732461], length 0
12:33:25.190486 IP (tos 0x0, ttl 64, id 0, offset 0, flags [DF], proto TCP (6), length 87)
    172.25.101.53.57077 > 172.253.115.100.443: Flags [P.], cksum 0xfbf7 (correct), seq 20635:20670, ack 14626, win 3847, options [nop,nop,TS val 705572254 ecr 1976732461], length 35
12:33:25.190530 IP (tos 0x0, ttl 64, id 0, offset 0, flags [DF], proto TCP (6), length 87)
    172.25.101.53.57077 > 172.253.115.100.443: Flags [P.], cksum 0xfd37 (correct), seq 20670:20705, ack 14626, win 3847, options [nop,nop,TS val 705572254 ecr 1976732461], length 35
12:33:25.203217 IP (tos 0x0, ttl 118, id 12875, offset 0, flags [none], proto TCP (6), length 52)
    172.253.115.100.443 > 172.25.101.53.57077: Flags [.], cksum 0x3e8a (correct), ack 20670, win 2187, options [nop,nop,TS val 1976732474 ecr 705572254], length 0
12:33:25.203218 IP (tos 0x0, ttl 118, id 12876, offset 0, flags [none], proto TCP (6), length 52)
    172.253.115.100.443 > 172.25.101.53.57077: Flags [.], cksum 0x3e67 (correct), ack 20705, win 2187, options [nop,nop,TS val 1976732474 ecr 705572254], length 0
12:33:25.328967 IP (tos 0x0, ttl 118, id 12877, offset 0, flags [none], proto TCP (6), length 337)
    172.253.115.100.443 > 172.25.101.53.57077: Flags [P.], cksum 0xc7c5 (correct), seq 14626:14911, ack 20705, win 2187, options [nop,nop,TS val 1976732600 ecr 705572254], length 285
12:33:25.329162 IP (tos 0x0, ttl 64, id 0, offset 0, flags [DF], proto TCP (6), length 52)
    172.25.101.53.57077 > 172.253.115.100.443: Flags [.], cksum 0x35c5 (correct), ack 14911, win 3847, options [nop,nop,TS val 705572393 ecr 1976732600], length 0
12:33:25.472350 IP (tos 0x0, ttl 118, id 12878, offset 0, flags [none], proto TCP (6), length 282)
    172.253.115.100.443 > 172.25.101.53.57077: Flags [P.], cksum 0x34d5 (correct), seq 14911:15141, ack 20705, win 2187, options [nop,nop,TS val 1976732743 ecr 705572393], length 230
12:33:25.472534 IP (tos 0x0, ttl 64, id 0, offset 0, flags [DF], proto TCP (6), length 52)
    172.25.101.53.57077 > 172.253.115.100.443: Flags [.], cksum 0x33c1 (correct), ack 15141, win 3847, options [nop,nop,TS val 705572536 ecr 1976732743], length 0
12:33:25.621059 IP (tos 0x0, ttl 118, id 12879, offset 0, flags [none], proto TCP (6), length 324)
    172.253.115.100.443 > 172.25.101.53.57077: Flags [P.], cksum 0xe17e (correct), seq 15141:15413, ack 20705, win 2187, options [nop,nop,TS val 1976732892 ecr 705572536], length 272
12:33:25.621262 IP (tos 0x0, ttl 64, id 0, offset 0, flags [DF], proto TCP (6), length 52)
