tcpdump: data link type PKTAP
tcpdump: WARNING: snaplen raised from 96 to 524288
tcpdump: listening on pktap, link-type PKTAP (Apple DLT_PKTAP), snapshot length 524288 bytes
08:41:31.435381 IP (tos 0x0, ttl 64, id 0, offset 0, flags [DF], proto TCP (6), length 1426)
    172.25.186.179.55229 > 172.253.115.113.443: Flags [.], cksum 0x25ef (correct), seq 3371282326:3371283700, ack 4002593969, win 3680, options [nop,nop,TS val 2506015932 ecr 285356629], length 1374
08:41:31.435383 IP (tos 0x0, ttl 64, id 1, offset 0, flags [DF], proto TCP (6), length 1426)
    172.25.186.179.55229 > 172.253.115.113.443: Flags [.], cksum 0x02fc (correct), seq 1374:2748, ack 1, win 3680, options [nop,nop,TS val 2506015932 ecr 285356629], length 1374
08:41:31.435428 IP (tos 0x0, ttl 64, id 0, offset 0, flags [DF], proto TCP (6), length 540)
    172.25.186.179.55229 > 172.253.115.113.443: Flags [P.], cksum 0xd656 (correct), seq 2748:3236, ack 1, win 3680, options [nop,nop,TS val 2506015932 ecr 285356629], length 488
08:41:31.435458 IP (tos 0x0, ttl 64, id 0, offset 0, flags [DF], proto TCP (6), length 91)
    172.25.186.179.55229 > 172.253.115.113.443: Flags [P.], cksum 0x0661 (correct), seq 3236:3275, ack 1, win 3680, options [nop,nop,TS val 2506015932 ecr 285356629], length 39
08:41:31.435474 IP (tos 0x0, ttl 64, id 0, offset 0, flags [DF], proto TCP (6), length 250)
    172.25.186.179.55229 > 172.253.115.113.443: Flags [P.], cksum 0xde3b (correct), seq 3275:3473, ack 1, win 3680, options [nop,nop,TS val 2506015932 ecr 285356629], length 198
08:41:31.441063 IP (tos 0x0, ttl 64, id 0, offset 0, flags [DF], proto TCP (6), length 1426)
    172.25.186.179.55229 > 172.253.115.113.443: Flags [.], cksum 0x605f (correct), seq 3473:4847, ack 1, win 3680, options [nop,nop,TS val 2506015937 ecr 285356629], length 1374
08:41:31.441065 IP (tos 0x0, ttl 64, id 1, offset 0, flags [DF], proto TCP (6), length 1426)
    172.25.186.179.55229 > 172.253.115.113.443: Flags [.], cksum 0x38d5 (correct), seq 4847:6221, ack 1, win 3680, options [nop,nop,TS val 2506015937 ecr 285356629], length 1374
08:41:31.441099 IP (tos 0x0, ttl 64, id 0, offset 0, flags [DF], proto TCP (6), length 546)
    172.25.186.179.55229 > 172.253.115.113.443: Flags [P.], cksum 0x2847 (correct), seq 6221:6715, ack 1, win 3680, options [nop,nop,TS val 2506015937 ecr 285356629], length 494
08:41:31.441129 IP (tos 0x0, ttl 64, id 0, offset 0, flags [DF], proto TCP (6), length 1426)
    172.25.186.179.55229 > 172.253.115.113.443: Flags [.], cksum 0x49f7 (correct), seq 6715:8089, ack 1, win 3680, options [nop,nop,TS val 2506015937 ecr 285356629], length 1374
08:41:31.441135 IP (tos 0x0, ttl 64, id 0, offset 0, flags [DF], proto TCP (6), length 1297)
    172.25.186.179.55229 > 172.253.115.113.443: Flags [P.], cksum 0x8543 (correct), seq 8089:9334, ack 1, win 3680, options [nop,nop,TS val 2506015937 ecr 285356629], length 1245
08:41:31.449911 IP (tos 0x80, ttl 119, id 43457, offset 0, flags [none], proto TCP (6), length 52)
    172.253.115.113.443 > 172.25.186.179.55229: Flags [.], cksum 0xf4c9 (correct), ack 2748, win 1011, options [nop,nop,TS val 285377445 ecr 2506015932], length 0
08:41:31.449912 IP (tos 0x80, ttl 119, id 43458, offset 0, flags [none], proto TCP (6), length 52)
    172.253.115.113.443 > 172.25.186.179.55229: Flags [.], cksum 0xf2e2 (correct), ack 3236, win 1010, options [nop,nop,TS val 285377445 ecr 2506015932], length 0
08:41:31.449912 IP (tos 0x80, ttl 119, id 43459, offset 0, flags [none], proto TCP (6), length 52)
    172.253.115.113.443 > 172.25.186.179.55229: Flags [.], cksum 0xf2bb (correct), ack 3275, win 1010, options [nop,nop,TS val 285377445 ecr 2506015932], length 0
08:41:31.449913 IP (tos 0x80, ttl 119, id 43460, offset 0, flags [none], proto TCP (6), length 52)
    172.253.115.113.443 > 172.25.186.179.55229: Flags [.], cksum 0xf1f5 (correct), ack 3473, win 1010, options [nop,nop,TS val 285377445 ecr 2506015932], length 0
08:41:31.449913 IP (tos 0x60, ttl 119, id 43461, offset 0, flags [none], proto TCP (6), length 91)
    172.253.115.113.443 > 172.25.186.179.55229: Flags [P.], cksum 0xf952 (correct), seq 1:40, ack 3473, win 1020, options [nop,nop,TS val 285377446 ecr 2506015932], length 39
08:41:31.449998 IP (tos 0x0, ttl 64, id 0, offset 0, flags [DF], proto TCP (6), length 52)
    172.25.186.179.55229 > 172.253.115.113.443: Flags [.], cksum 0xd06c (correct), ack 40, win 3680, options [nop,nop,TS val 2506015946 ecr 285377446], length 0
08:41:31.452063 IP (tos 0x60, ttl 119, id 43462, offset 0, flags [none], proto TCP (6), length 52)
    172.253.115.113.443 > 172.25.186.179.55229: Flags [.], cksum 0xe707 (correct), ack 6221, win 1011, options [nop,nop,TS val 285377450 ecr 2506015937], length 0
08:41:31.452063 IP (tos 0x60, ttl 119, id 43463, offset 0, flags [none], proto TCP (6), length 52)
    172.253.115.113.443 > 172.25.186.179.55229: Flags [.], cksum 0xdfc2 (correct), ack 8089, win 1004, options [nop,nop,TS val 285377450 ecr 2506015937], length 0
08:41:31.458070 IP (tos 0x60, ttl 119, id 43464, offset 0, flags [none], proto TCP (6), length 52)
    172.253.115.113.443 > 172.25.186.179.55229: Flags [.], cksum 0xdacf (correct), ack 9334, win 1020, options [nop,nop,TS val 285377456 ecr 2506015937], length 0
08:41:31.547224 IP (tos 0x0, ttl 64, id 0, offset 0, flags [DF], proto TCP (6), length 1426)
    172.25.186.179.55229 > 172.253.115.113.443: Flags [.], cksum 0xa575 (correct), seq 9334:10708, ack 40, win 3680, options [nop,nop,TS val 2506016043 ecr 285377456], length 1374
08:41:31.547225 IP (tos 0x0, ttl 64, id 1, offset 0, flags [DF], proto TCP (6), length 1426)
    172.25.186.179.55229 > 172.253.115.113.443: Flags [.], cksum 0x284c (correct), seq 10708:12082, ack 40, win 3680, options [nop,nop,TS val 2506016043 ecr 285377456], length 1374
08:41:31.547239 IP (tos 0x0, ttl 64, id 0, offset 0, flags [DF], proto TCP (6), length 310)
    172.25.186.179.55229 > 172.253.115.113.443: Flags [P.], cksum 0xfc96 (correct), seq 12082:12340, ack 40, win 3680, options [nop,nop,TS val 2506016043 ecr 285377456], length 258
08:41:31.547252 IP (tos 0x0, ttl 64, id 0, offset 0, flags [DF], proto TCP (6), length 1426)
    172.25.186.179.55229 > 172.253.115.113.443: Flags [.], cksum 0x9f65 (correct), seq 12340:13714, ack 40, win 3680, options [nop,nop,TS val 2506016043 ecr 285377456], length 1374
08:41:31.547253 IP (tos 0x0, ttl 64, id 1, offset 0, flags [DF], proto TCP (6), length 1426)
    172.25.186.179.55229 > 172.253.115.113.443: Flags [.], cksum 0x3e2a (correct), seq 13714:15088, ack 40, win 3680, options [nop,nop,TS val 2506016043 ecr 285377456], length 1374
08:41:31.547257 IP (tos 0x0, ttl 64, id 0, offset 0, flags [DF], proto TCP (6), length 1250)
    172.25.186.179.55229 > 172.253.115.113.443: Flags [P.], cksum 0x6a6a (correct), seq 15088:16286, ack 40, win 3680, options [nop,nop,TS val 2506016043 ecr 285377456], length 1198
08:41:31.592086 IP (tos 0x60, ttl 119, id 43465, offset 0, flags [none], proto TCP (6), length 587)
    172.253.115.113.443 > 172.25.186.179.55229: Flags [P.], cksum 0xd3b9 (correct), seq 40:575, ack 9334, win 1020, options [nop,nop,TS val 285377503 ecr 2506015946], length 535
08:41:31.592088 IP (tos 0x60, ttl 119, id 43466, offset 0, flags [none], proto TCP (6), length 378)
    172.253.115.113.443 > 172.25.186.179.55229: Flags [P.], cksum 0x5221 (correct), seq 575:901, ack 9334, win 1020, options [nop,nop,TS val 285377503 ecr 2506015946], length 326
08:41:31.592230 IP (tos 0x0, ttl 64, id 0, offset 0, flags [DF], proto TCP (6), length 52)
    172.25.186.179.55229 > 172.253.115.113.443: Flags [.], cksum 0xb12d (correct), ack 901, win 3667, options [nop,nop,TS val 2506016088 ecr 285377503], length 0
08:41:31.592823 IP (tos 0x0, ttl 64, id 0, offset 0, flags [DF], proto TCP (6), length 87)
    172.25.186.179.55229 > 172.253.115.113.443: Flags [P.], cksum 0x960a (correct), seq 16286:16321, ack 901, win 3680, options [nop,nop,TS val 2506016088 ecr 285377503], length 35
08:41:31.593954 IP (tos 0x60, ttl 119, id 43467, offset 0, flags [none], proto TCP (6), length 282)
    172.253.115.113.443 > 172.25.186.179.55229: Flags [P.], cksum 0x08b1 (correct), seq 901:1131, ack 9334, win 1020, options [nop,nop,TS val 285377503 ecr 2506015946], length 230
08:41:31.593954 IP (tos 0x60, ttl 119, id 43468, offset 0, flags [none], proto TCP (6), length 264)
    172.253.115.113.443 > 172.25.186.179.55229: Flags [P.], cksum 0x8fa5 (correct), seq 1131:1343, ack 9334, win 1020, options [nop,nop,TS val 285377504 ecr 2506015946], length 212
08:41:31.593954 IP (tos 0x60, ttl 119, id 43469, offset 0, flags [none], proto TCP (6), length 83)
    172.253.115.113.443 > 172.25.186.179.55229: Flags [P.], cksum 0xcf68 (correct), seq 1343:1374, ack 9334, win 1020, options [nop,nop,TS val 285377504 ecr 2506015946], length 31
08:41:31.593954 IP (tos 0x60, ttl 119, id 43470, offset 0, flags [none], proto TCP (6), length 91)
    172.253.115.113.443 > 172.25.186.179.55229: Flags [P.], cksum 0xe456 (correct), seq 1374:1413, ack 9334, win 1020, options [nop,nop,TS val 285377504 ecr 2506015946], length 39
08:41:31.593955 IP (tos 0x60, ttl 119, id 43471, offset 0, flags [none], proto TCP (6), length 585)
    172.253.115.113.443 > 172.25.186.179.55229: Flags [P.], cksum 0x2787 (correct), seq 1413:1946, ack 9334, win 1020, options [nop,nop,TS val 285377523 ecr 2506015946], length 533
08:41:31.593955 IP (tos 0x60, ttl 119, id 43472, offset 0, flags [none], proto TCP (6), length 314)
    172.253.115.113.443 > 172.25.186.179.55229: Flags [P.], cksum 0x8d9e (correct), seq 1946:2208, ack 9334, win 1020, options [nop,nop,TS val 285377523 ecr 2506015946], length 262
08:41:31.593994 IP (tos 0x0, ttl 64, id 0, offset 0, flags [DF], proto TCP (6), length 52)
    172.25.186.179.55229 > 172.253.115.113.443: Flags [.], cksum 0xabe0 (correct), ack 2208, win 3660, options [nop,nop,TS val 2506016090 ecr 285377523], length 0
08:41:31.594631 IP (tos 0x0, ttl 64, id 0, offset 0, flags [DF], proto TCP (6), length 91)
    172.25.186.179.55229 > 172.253.115.113.443: Flags [P.], cksum 0x42df (correct), seq 16321:16360, ack 2208, win 3680, options [nop,nop,TS val 2506016090 ecr 285377523], length 39
08:41:31.599537 IP (tos 0x0, ttl 64, id 0, offset 0, flags [DF], proto TCP (6), length 1426)
    172.25.186.179.55229 > 172.253.115.113.443: Flags [.], cksum 0x0db3 (correct), seq 16360:17734, ack 2208, win 3680, options [nop,nop,TS val 2506016096 ecr 285377523], length 1374
08:41:31.599538 IP (tos 0x0, ttl 64, id 1, offset 0, flags [DF], proto TCP (6), length 1426)
    172.25.186.179.55229 > 172.253.115.113.443: Flags [.], cksum 0xdf87 (correct), seq 17734:19108, ack 2208, win 3680, options [nop,nop,TS val 2506016096 ecr 285377523], length 1374
08:41:31.599551 IP (tos 0x0, ttl 64, id 0, offset 0, flags [DF], proto TCP (6), length 540)
    172.25.186.179.55229 > 172.253.115.113.443: Flags [P.], cksum 0x60ef (correct), seq 19108:19596, ack 2208, win 3680, options [nop,nop,TS val 2506016096 ecr 285377523], length 488
08:41:31.599565 IP (tos 0x0, ttl 64, id 0, offset 0, flags [DF], proto TCP (6), length 236)
    172.25.186.179.55229 > 172.253.115.113.443: Flags [P.], cksum 0x0806 (correct), seq 19596:19780, ack 2208, win 3680, options [nop,nop,TS val 2506016096 ecr 285377523], length 184
08:41:31.605029 IP (tos 0x60, ttl 119, id 43473, offset 0, flags [none], proto TCP (6), length 52)
    172.253.115.113.443 > 172.25.186.179.55229: Flags [.], cksum 0xcc03 (correct), ack 10708, win 1015, options [nop,nop,TS val 285377601 ecr 2506016043], length 0
08:41:31.605029 IP (tos 0x60, ttl 119, id 43474, offset 0, flags [none], proto TCP (6), length 64)
    172.253.115.113.443 > 172.25.186.179.55229: Flags [.], cksum 0x4575 (correct), ack 10708, win 1015, options [nop,nop,TS val 285377601 ecr 2506016043,nop,nop,sack 1 {12082:12340}], length 0
08:41:31.605030 IP (tos 0x60, ttl 119, id 43475, offset 0, flags [none], proto TCP (6), length 52)
    172.253.115.113.443 > 172.25.186.179.55229: Flags [.], cksum 0xc5a9 (correct), ack 12340, win 1009, options [nop,nop,TS val 285377601 ecr 2506016043], length 0
08:41:31.605030 IP (tos 0x60, ttl 119, id 43476, offset 0, flags [none], proto TCP (6), length 52)
    172.253.115.113.443 > 172.25.186.179.55229: Flags [.], cksum 0xc050 (correct), ack 13714, win 1004, options [nop,nop,TS val 285377601 ecr 2506016043], length 0
08:41:31.605031 IP (tos 0x60, ttl 119, id 43477, offset 0, flags [none], proto TCP (6), length 52)
    172.253.115.113.443 > 172.25.186.179.55229: Flags [.], cksum 0xbaf7 (correct), ack 15088, win 999, options [nop,nop,TS val 285377601 ecr 2506016043], length 0
08:41:31.605031 IP (tos 0x60, ttl 119, id 43478, offset 0, flags [none], proto TCP (6), length 52)
    172.253.115.113.443 > 172.25.186.179.55229: Flags [.], cksum 0xb64d (correct), ack 16286, win 995, options [nop,nop,TS val 285377601 ecr 2506016043], length 0
08:41:31.605031 IP (tos 0x60, ttl 119, id 43479, offset 0, flags [none], proto TCP (6), length 52)
    172.253.115.113.443 > 172.25.186.179.55229: Flags [.], cksum 0xb5e7 (correct), ack 16321, win 1015, options [nop,nop,TS val 285377603 ecr 2506016088], length 0
08:41:31.606401 IP (tos 0x60, ttl 119, id 43480, offset 0, flags [none], proto TCP (6), length 52)
    172.253.115.113.443 > 172.25.186.179.55229: Flags [.], cksum 0xb5bc (correct), ack 16360, win 1015, options [nop,nop,TS val 285377605 ecr 2506016090], length 0
08:41:31.612671 IP (tos 0x60, ttl 119, id 43481, offset 0, flags [none], proto TCP (6), length 52)
    172.253.115.113.443 > 172.25.186.179.55229: Flags [.], cksum 0xb054 (correct), ack 17734, win 1015, options [nop,nop,TS val 285377609 ecr 2506016096], length 0
08:41:31.612672 IP (tos 0x60, ttl 119, id 43482, offset 0, flags [none], proto TCP (6), length 52)
    172.253.115.113.443 > 172.25.186.179.55229: Flags [.], cksum 0xa912 (correct), ack 19596, win 1011, options [nop,nop,TS val 285377609 ecr 2506016096], length 0
08:41:31.614253 IP (tos 0x60, ttl 119, id 43483, offset 0, flags [none], proto TCP (6), length 52)
    172.253.115.113.443 > 172.25.186.179.55229: Flags [.], cksum 0xa850 (correct), ack 19780, win 1020, options [nop,nop,TS val 285377610 ecr 2506016096], length 0
08:41:31.617622 IP (tos 0x60, ttl 119, id 43484, offset 0, flags [none], proto TCP (6), length 286)
    172.253.115.113.443 > 172.25.186.179.55229: Flags [P.], cksum 0x3589 (correct), seq 2208:2442, ack 19780, win 1020, options [nop,nop,TS val 285377616 ecr 2506016096], length 234
08:41:31.617623 IP (tos 0x60, ttl 119, id 43485, offset 0, flags [none], proto TCP (6), length 83)
    172.253.115.113.443 > 172.25.186.179.55229: Flags [P.], cksum 0xf947 (correct), seq 2442:2473, ack 19780, win 1020, options [nop,nop,TS val 285377616 ecr 2506016096], length 31
08:41:31.617624 IP (tos 0x60, ttl 119, id 43486, offset 0, flags [none], proto TCP (6), length 91)
    172.253.115.113.443 > 172.25.186.179.55229: Flags [P.], cksum 0x9837 (correct), seq 2473:2512, ack 19780, win 1020, options [nop,nop,TS val 285377616 ecr 2506016096], length 39
08:41:31.617678 IP (tos 0x0, ttl 64, id 0, offset 0, flags [DF], proto TCP (6), length 52)
    172.25.186.179.55229 > 172.253.115.113.443: Flags [.], cksum 0x9ca8 (correct), ack 2512, win 3676, options [nop,nop,TS val 2506016114 ecr 285377616], length 0
08:41:31.618161 IP (tos 0x0, ttl 64, id 0, offset 0, flags [DF], proto TCP (6), length 91)
    172.25.186.179.55229 > 172.253.115.113.443: Flags [P.], cksum 0x8287 (correct), seq 19780:19819, ack 2512, win 3680, options [nop,nop,TS val 2506016114 ecr 285377616], length 39
08:41:31.638148 IP (tos 0x60, ttl 119, id 43487, offset 0, flags [none], proto TCP (6), length 52)
    172.253.115.113.443 > 172.25.186.179.55229: Flags [.], cksum 0xa6d0 (correct), ack 19819, win 1020, options [nop,nop,TS val 285377633 ecr 2506016114], length 0
08:41:31.843964 IP (tos 0x60, ttl 119, id 43488, offset 0, flags [none], proto TCP (6), length 585)
    172.253.115.113.443 > 172.25.186.179.55229: Flags [P.], cksum 0x3b0e (correct), seq 2512:3045, ack 19819, win 1020, options [nop,nop,TS val 285377840 ecr 2506016114], length 533
08:41:31.843964 IP (tos 0x60, ttl 119, id 43489, offset 0, flags [none], proto TCP (6), length 264)
    172.253.115.113.443 > 172.25.186.179.55229: Flags [P.], cksum 0x64c1 (correct), seq 3045:3257, ack 19819, win 1020, options [nop,nop,TS val 285377840 ecr 2506016114], length 212
08:41:31.843965 IP (tos 0x60, ttl 119, id 43490, offset 0, flags [none], proto TCP (6), length 350)
    172.253.115.113.443 > 172.25.186.179.55229: Flags [P.], cksum 0x0d4b (correct), seq 3257:3555, ack 19819, win 1020, options [nop,nop,TS val 285377840 ecr 2506016114], length 298
08:41:31.843965 IP (tos 0x60, ttl 119, id 43491, offset 0, flags [none], proto TCP (6), length 83)
    172.253.115.113.443 > 172.25.186.179.55229: Flags [P.], cksum 0xb9d2 (correct), seq 3555:3586, ack 19819, win 1020, options [nop,nop,TS val 285377840 ecr 2506016114], length 31
08:41:31.843965 IP (tos 0x60, ttl 119, id 43492, offset 0, flags [none], proto TCP (6), length 91)
    172.253.115.113.443 > 172.25.186.179.55229: Flags [P.], cksum 0xce7e (correct), seq 3586:3625, ack 19819, win 1020, options [nop,nop,TS val 285377840 ecr 2506016114], length 39
08:41:31.844013 IP (tos 0x0, ttl 64, id 0, offset 0, flags [DF], proto TCP (6), length 52)
    172.25.186.179.55229 > 172.253.115.113.443: Flags [.], cksum 0x9673 (correct), ack 3625, win 3663, options [nop,nop,TS val 2506016340 ecr 285377840], length 0
08:41:31.845244 IP (tos 0x0, ttl 64, id 0, offset 0, flags [DF], proto TCP (6), length 91)
    172.25.186.179.55229 > 172.253.115.113.443: Flags [P.], cksum 0x2b79 (correct), seq 19819:19858, ack 3625, win 3680, options [nop,nop,TS val 2506016341 ecr 285377840], length 39
08:41:31.856766 IP (tos 0x60, ttl 119, id 43493, offset 0, flags [none], proto TCP (6), length 52)
    172.253.115.113.443 > 172.25.186.179.55229: Flags [.], cksum 0xa090 (correct), ack 19858, win 1020, options [nop,nop,TS val 285377854 ecr 2506016341], length 0
08:41:35.659176 IP (tos 0x80, ttl 119, id 43498, offset 0, flags [none], proto TCP (6), length 91)
    172.253.115.113.443 > 172.25.186.179.55229: Flags [P.], cksum 0x5910 (correct), seq 4181:4220, ack 19858, win 1020, options [nop,nop,TS val 285381630 ecr 2506016341], length 39
08:41:35.659177 IP (tos 0x60, ttl 119, id 43494, offset 0, flags [none], proto TCP (6), length 301)
    172.253.115.113.443 > 172.25.186.179.55229: Flags [P.], cksum 0x3e65 (correct), seq 3625:3874, ack 19858, win 1020, options [nop,nop,TS val 285381629 ecr 2506016341], length 249
08:41:35.659177 IP (tos 0x60, ttl 119, id 43495, offset 0, flags [none], proto TCP (6), length 165)
    172.253.115.113.443 > 172.25.186.179.55229: Flags [P.], cksum 0x760a (correct), seq 3874:3987, ack 19858, win 1020, options [nop,nop,TS val 285381629 ecr 2506016341], length 113
08:41:35.659178 IP (tos 0x60, ttl 119, id 43496, offset 0, flags [none], proto TCP (6), length 215)
    172.253.115.113.443 > 172.25.186.179.55229: Flags [P.], cksum 0x2045 (correct), seq 3987:4150, ack 19858, win 1020, options [nop,nop,TS val 285381629 ecr 2506016341], length 163
08:41:35.659178 IP (tos 0x60, ttl 119, id 43497, offset 0, flags [none], proto TCP (6), length 83)
    172.253.115.113.443 > 172.25.186.179.55229: Flags [P.], cksum 0xace0 (correct), seq 4150:4181, ack 19858, win 1020, options [nop,nop,TS val 285381629 ecr 2506016341], length 31
08:41:35.659298 IP (tos 0x0, ttl 64, id 0, offset 0, flags [DF], proto TCP (6), length 64)
    172.25.186.179.55229 > 172.253.115.113.443: Flags [.], cksum 0xd9d6 (correct), ack 3625, win 3680, options [nop,nop,TS val 2506020155 ecr 285377854,nop,nop,sack 1 {4181:4220}], length 0
08:41:35.659365 IP (tos 0x0, ttl 64, id 0, offset 0, flags [DF], proto TCP (6), length 52)
    172.25.186.179.55229 > 172.253.115.113.443: Flags [.], cksum 0x763d (correct), ack 4220, win 3671, options [nop,nop,TS val 2506020155 ecr 285381629], length 0
08:41:35.660326 IP (tos 0x0, ttl 64, id 0, offset 0, flags [DF], proto TCP (6), length 91)
    172.25.186.179.55229 > 172.253.115.113.443: Flags [P.], cksum 0x93f3 (correct), seq 19858:19897, ack 4220, win 3680, options [nop,nop,TS val 2506020156 ecr 285381629], length 39
08:41:35.672135 IP (tos 0x80, ttl 119, id 43499, offset 0, flags [none], proto TCP (6), length 52)
    172.253.115.113.443 > 172.25.186.179.55229: Flags [.], cksum 0x8047 (correct), ack 19897, win 1020, options [nop,nop,TS val 285381670 ecr 2506020156], length 0
08:41:41.961879 IP (tos 0x0, ttl 64, id 0, offset 0, flags [DF], proto TCP (6), length 1426)
    172.25.186.179.55229 > 172.253.115.113.443: Flags [.], cksum 0x281e (correct), seq 19897:21271, ack 4220, win 3680, options [nop,nop,TS val 2506026458 ecr 285381670], length 1374
08:41:41.961882 IP (tos 0x0, ttl 64, id 1, offset 0, flags [DF], proto TCP (6), length 1426)
    172.25.186.179.55229 > 172.253.115.113.443: Flags [.], cksum 0x5619 (correct), seq 21271:22645, ack 4220, win 3680, options [nop,nop,TS val 2506026458 ecr 285381670], length 1374
08:41:41.961945 IP (tos 0x0, ttl 64, id 0, offset 0, flags [DF], proto TCP (6), length 540)
    172.25.186.179.55229 > 172.253.115.113.443: Flags [P.], cksum 0x4ca4 (correct), seq 22645:23133, ack 4220, win 3680, options [nop,nop,TS val 2506026458 ecr 285381670], length 488
08:41:41.962025 IP (tos 0x0, ttl 64, id 0, offset 0, flags [DF], proto TCP (6), length 250)
    172.25.186.179.55229 > 172.253.115.113.443: Flags [P.], cksum 0xa666 (correct), seq 23133:23331, ack 4220, win 3680, options [nop,nop,TS val 2506026458 ecr 285381670], length 198
08:41:41.967394 IP (tos 0x0, ttl 64, id 0, offset 0, flags [DF], proto TCP (6), length 1426)
    172.25.186.179.55229 > 172.253.115.113.443: Flags [.], cksum 0x08de (correct), seq 23331:24705, ack 4220, win 3680, options [nop,nop,TS val 2506026463 ecr 285381670], length 1374
08:41:41.967396 IP (tos 0x0, ttl 64, id 1, offset 0, flags [DF], proto TCP (6), length 1426)
    172.25.186.179.55229 > 172.253.115.113.443: Flags [.], cksum 0xb17f (correct), seq 24705:26079, ack 4220, win 3680, options [nop,nop,TS val 2506026463 ecr 285381670], length 1374
08:41:41.967443 IP (tos 0x0, ttl 64, id 0, offset 0, flags [DF], proto TCP (6), length 547)
    172.25.186.179.55229 > 172.253.115.113.443: Flags [P.], cksum 0x1f9f (correct), seq 26079:26574, ack 4220, win 3680, options [nop,nop,TS val 2506026463 ecr 285381670], length 495
08:41:41.967476 IP (tos 0x0, ttl 64, id 0, offset 0, flags [DF], proto TCP (6), length 1426)
    172.25.186.179.55229 > 172.253.115.113.443: Flags [.], cksum 0xf2e3 (correct), seq 26574:27948, ack 4220, win 3680, options [nop,nop,TS val 2506026463 ecr 285381670], length 1374
08:41:41.967482 IP (tos 0x0, ttl 64, id 0, offset 0, flags [DF], proto TCP (6), length 1294)
    172.25.186.179.55229 > 172.253.115.113.443: Flags [P.], cksum 0x0437 (correct), seq 27948:29190, ack 4220, win 3680, options [nop,nop,TS val 2506026463 ecr 285381670], length 1242
08:41:41.975204 IP (tos 0x80, ttl 119, id 43500, offset 0, flags [none], proto TCP (6), length 52)
    172.253.115.113.443 > 172.25.186.179.55229: Flags [.], cksum 0x49b3 (correct), ack 21271, win 1015, options [nop,nop,TS val 285387971 ecr 2506026458], length 0
08:41:41.975205 IP (tos 0x80, ttl 119, id 43501, offset 0, flags [none], proto TCP (6), length 52)
    172.253.115.113.443 > 172.25.186.179.55229: Flags [.], cksum 0x4455 (correct), ack 22645, win 1015, options [nop,nop,TS val 285387971 ecr 2506026458], length 0
08:41:41.975206 IP (tos 0x80, ttl 119, id 43502, offset 0, flags [none], proto TCP (6), length 52)
    172.253.115.113.443 > 172.25.186.179.55229: Flags [.], cksum 0x426d (correct), ack 23133, win 1015, options [nop,nop,TS val 285387971 ecr 2506026458], length 0
08:41:41.975206 IP (tos 0x80, ttl 119, id 43503, offset 0, flags [none], proto TCP (6), length 52)
    172.253.115.113.443 > 172.25.186.179.55229: Flags [.], cksum 0x41a7 (correct), ack 23331, win 1015, options [nop,nop,TS val 285387971 ecr 2506026458], length 0
08:41:41.980728 IP (tos 0x60, ttl 119, id 43504, offset 0, flags [none], proto TCP (6), length 52)
    172.253.115.113.443 > 172.25.186.179.55229: Flags [.], cksum 0x3c3e (correct), ack 24705, win 1015, options [nop,nop,TS val 285387977 ecr 2506026463], length 0
08:41:41.980729 IP (tos 0x60, ttl 119, id 43505, offset 0, flags [none], proto TCP (6), length 52)
    172.253.115.113.443 > 172.25.186.179.55229: Flags [.], cksum 0x36e4 (correct), ack 26079, win 1011, options [nop,nop,TS val 285387977 ecr 2506026463], length 0
08:41:41.980729 IP (tos 0x60, ttl 119, id 43506, offset 0, flags [none], proto TCP (6), length 52)
    172.253.115.113.443 > 172.25.186.179.55229: Flags [.], cksum 0x34f1 (correct), ack 26574, win 1015, options [nop,nop,TS val 285387977 ecr 2506026463], length 0
08:41:41.980730 IP (tos 0x60, ttl 119, id 43507, offset 0, flags [none], proto TCP (6), length 52)
    172.253.115.113.443 > 172.25.186.179.55229: Flags [.], cksum 0x2ac1 (correct), ack 29190, win 1007, options [nop,nop,TS val 285387977 ecr 2506026463], length 0
08:41:42.070643 IP (tos 0x0, ttl 64, id 0, offset 0, flags [DF], proto TCP (6), length 1426)
    172.25.186.179.55229 > 172.253.115.113.443: Flags [.], cksum 0xb3b0 (correct), seq 29190:30564, ack 4220, win 3680, options [nop,nop,TS val 2506026567 ecr 285387977], length 1374
08:41:42.070644 IP (tos 0x0, ttl 64, id 1, offset 0, flags [DF], proto TCP (6), length 1426)
    172.25.186.179.55229 > 172.253.115.113.443: Flags [.], cksum 0xaaa1 (correct), seq 30564:31938, ack 4220, win 3680, options [nop,nop,TS val 2506026567 ecr 285387977], length 1374
08:41:42.070664 IP (tos 0x0, ttl 64, id 0, offset 0, flags [DF], proto TCP (6), length 312)
    172.25.186.179.55229 > 172.253.115.113.443: Flags [P.], cksum 0xdd96 (correct), seq 31938:32198, ack 4220, win 3680, options [nop,nop,TS val 2506026567 ecr 285387977], length 260
08:41:42.070679 IP (tos 0x0, ttl 64, id 0, offset 0, flags [DF], proto TCP (6), length 1426)
    172.25.186.179.55229 > 172.253.115.113.443: Flags [.], cksum 0xf7cd (correct), seq 32198:33572, ack 4220, win 3680, options [nop,nop,TS val 2506026567 ecr 285387977], length 1374
08:41:42.070679 IP (tos 0x0, ttl 64, id 1, offset 0, flags [DF], proto TCP (6), length 1426)
    172.25.186.179.55229 > 172.253.115.113.443: Flags [.], cksum 0xec8c (correct), seq 33572:34946, ack 4220, win 3680, options [nop,nop,TS val 2506026567 ecr 285387977], length 1374
08:41:42.070683 IP (tos 0x0, ttl 64, id 0, offset 0, flags [DF], proto TCP (6), length 1250)
    172.25.186.179.55229 > 172.253.115.113.443: Flags [P.], cksum 0xc57e (correct), seq 34946:36144, ack 4220, win 3680, options [nop,nop,TS val 2506026567 ecr 285387977], length 1198
08:41:42.077583 IP (tos 0x60, ttl 119, id 43508, offset 0, flags [none], proto TCP (6), length 589)
    172.253.115.113.443 > 172.25.186.179.55229: Flags [P.], cksum 0x8dc6 (correct), seq 4220:4757, ack 29190, win 1020, options [nop,nop,TS val 285388018 ecr 2506026463], length 537
08:41:42.077584 IP (tos 0x60, ttl 119, id 43509, offset 0, flags [none], proto TCP (6), length 227)
    172.253.115.113.443 > 172.25.186.179.55229: Flags [P.], cksum 0xcb59 (correct), seq 4757:4932, ack 29190, win 1020, options [nop,nop,TS val 285388018 ecr 2506026463], length 175
08:41:42.077674 IP (tos 0x0, ttl 64, id 0, offset 0, flags [DF], proto TCP (6), length 52)
    172.25.186.179.55229 > 172.253.115.113.443: Flags [.], cksum 0x01d2 (correct), ack 4932, win 3669, options [nop,nop,TS val 2506026573 ecr 285388018], length 0
08:41:42.078441 IP (tos 0x0, ttl 64, id 0, offset 0, flags [DF], proto TCP (6), length 87)
    172.25.186.179.55229 > 172.253.115.113.443: Flags [P.], cksum 0x89a1 (correct), seq 36144:36179, ack 4932, win 3680, options [nop,nop,TS val 2506026574 ecr 285388018], length 35
08:41:42.079866 IP (tos 0x60, ttl 119, id 43510, offset 0, flags [none], proto TCP (6), length 198)
    172.253.115.113.443 > 172.25.186.179.55229: Flags [P.], cksum 0x561f (correct), seq 4932:5078, ack 29190, win 1020, options [nop,nop,TS val 285388018 ecr 2506026463], length 146
08:41:42.079866 IP (tos 0x60, ttl 119, id 43511, offset 0, flags [none], proto TCP (6), length 122)
    172.253.115.113.443 > 172.25.186.179.55229: Flags [P.], cksum 0xf63a (correct), seq 5078:5148, ack 29190, win 1020, options [nop,nop,TS val 285388018 ecr 2506026463], length 70
08:41:42.079867 IP (tos 0x60, ttl 119, id 43512, offset 0, flags [none], proto TCP (6), length 591)
    172.253.115.113.443 > 172.25.186.179.55229: Flags [P.], cksum 0x57a3 (correct), seq 5148:5687, ack 29190, win 1020, options [nop,nop,TS val 285388030 ecr 2506026463], length 539
08:41:42.079867 IP (tos 0x60, ttl 119, id 43513, offset 0, flags [none], proto TCP (6), length 485)
    172.253.115.113.443 > 172.25.186.179.55229: Flags [P.], cksum 0xec43 (correct), seq 5687:6120, ack 29190, win 1020, options [nop,nop,TS val 285388030 ecr 2506026463], length 433
08:41:42.079921 IP (tos 0x0, ttl 64, id 0, offset 0, flags [DF], proto TCP (6), length 52)
    172.25.186.179.55229 > 172.253.115.113.443: Flags [.], cksum 0xfd02 (correct), ack 6120, win 3662, options [nop,nop,TS val 2506026576 ecr 285388030], length 0
08:41:42.080468 IP (tos 0x0, ttl 64, id 0, offset 0, flags [DF], proto TCP (6), length 91)
    172.25.186.179.55229 > 172.253.115.113.443: Flags [P.], cksum 0x67e1 (correct), seq 36179:36218, ack 6120, win 3680, options [nop,nop,TS val 2506026576 ecr 285388030], length 39
08:41:42.084324 IP (tos 0x0, ttl 64, id 0, offset 0, flags [DF], proto TCP (6), length 1426)
    172.25.186.179.55229 > 172.253.115.113.443: Flags [.], cksum 0x5608 (correct), seq 36218:37592, ack 6120, win 3680, options [nop,nop,TS val 2506026580 ecr 285388030], length 1374
08:41:42.084325 IP (tos 0x0, ttl 64, id 1, offset 0, flags [DF], proto TCP (6), length 1426)
    172.25.186.179.55229 > 172.253.115.113.443: Flags [.], cksum 0x1e28 (correct), seq 37592:38966, ack 6120, win 3680, options [nop,nop,TS val 2506026580 ecr 285388030], length 1374
08:41:42.084337 IP (tos 0x0, ttl 64, id 0, offset 0, flags [DF], proto TCP (6), length 540)
    172.25.186.179.55229 > 172.253.115.113.443: Flags [P.], cksum 0x66aa (correct), seq 38966:39454, ack 6120, win 3680, options [nop,nop,TS val 2506026580 ecr 285388030], length 488
08:41:42.084347 IP (tos 0x0, ttl 64, id 0, offset 0, flags [DF], proto TCP (6), length 236)
    172.25.186.179.55229 > 172.253.115.113.443: Flags [P.], cksum 0x55a4 (correct), seq 39454:39638, ack 6120, win 3680, options [nop,nop,TS val 2506026580 ecr 285388030], length 184
08:41:42.088497 IP (tos 0x60, ttl 119, id 43514, offset 0, flags [none], proto TCP (6), length 52)
    172.253.115.113.443 > 172.25.186.179.55229: Flags [.], cksum 0x1d1a (correct), ack 30564, win 1015, options [nop,nop,TS val 285388086 ecr 2506026567], length 0
08:41:42.088498 IP (tos 0x60, ttl 119, id 43515, offset 0, flags [none], proto TCP (6), length 64)
    172.253.115.113.443 > 172.25.186.179.55229: Flags [.], cksum 0xfb67 (correct), ack 30564, win 1015, options [nop,nop,TS val 285388087 ecr 2506026567,nop,nop,sack 1 {31938:32198}], length 0
08:41:42.093212 IP (tos 0x60, ttl 119, id 43516, offset 0, flags [none], proto TCP (6), length 52)
    172.253.115.113.443 > 172.25.186.179.55229: Flags [.], cksum 0x16bb (correct), ack 32198, win 1011, options [nop,nop,TS val 285388087 ecr 2506026567], length 0
08:41:42.093212 IP (tos 0x60, ttl 119, id 43517, offset 0, flags [none], proto TCP (6), length 52)
    172.253.115.113.443 > 172.25.186.179.55229: Flags [.], cksum 0x1161 (correct), ack 33572, win 1007, options [nop,nop,TS val 285388087 ecr 2506026567], length 0
08:41:42.093213 IP (tos 0x60, ttl 119, id 43518, offset 0, flags [none], proto TCP (6), length 52)
    172.253.115.113.443 > 172.25.186.179.55229: Flags [.], cksum 0x0bfb (correct), ack 34946, win 1015, options [nop,nop,TS val 285388087 ecr 2506026567], length 0
08:41:42.093213 IP (tos 0x60, ttl 119, id 43519, offset 0, flags [none], proto TCP (6), length 52)
    172.253.115.113.443 > 172.25.186.179.55229: Flags [.], cksum 0x0751 (correct), ack 36144, win 1011, options [nop,nop,TS val 285388087 ecr 2506026567], length 0
08:41:42.093213 IP (tos 0x60, ttl 119, id 43520, offset 0, flags [none], proto TCP (6), length 52)
    172.253.115.113.443 > 172.25.186.179.55229: Flags [.], cksum 0x0722 (correct), ack 36179, win 1015, options [nop,nop,TS val 285388088 ecr 2506026574], length 0
08:41:42.093214 IP (tos 0x60, ttl 119, id 43521, offset 0, flags [none], proto TCP (6), length 52)
    172.253.115.113.443 > 172.25.186.179.55229: Flags [.], cksum 0x06f7 (correct), ack 36218, win 1015, options [nop,nop,TS val 285388090 ecr 2506026576], length 0
08:41:42.095626 IP (tos 0x60, ttl 119, id 43522, offset 0, flags [none], proto TCP (6), length 52)
    172.253.115.113.443 > 172.25.186.179.55229: Flags [.], cksum 0xfc36 (correct), ack 38966, win 1011, options [nop,nop,TS val 285388094 ecr 2506026580], length 0
08:41:42.095867 IP (tos 0x60, ttl 119, id 43523, offset 0, flags [none], proto TCP (6), length 52)
    172.253.115.113.443 > 172.25.186.179.55229: Flags [.], cksum 0xfa45 (correct), ack 39454, win 1020, options [nop,nop,TS val 285388094 ecr 2506026580], length 0
08:41:42.099628 IP (tos 0x60, ttl 119, id 43524, offset 0, flags [none], proto TCP (6), length 52)
    172.253.115.113.443 > 172.25.186.179.55229: Flags [.], cksum 0xf98c (correct), ack 39638, win 1020, options [nop,nop,TS val 285388095 ecr 2506026580], length 0
08:41:42.105620 IP (tos 0x60, ttl 119, id 43525, offset 0, flags [none], proto TCP (6), length 922)
    172.253.115.113.443 > 172.25.186.179.55229: Flags [P.], cksum 0xbefd (correct), seq 6120:6990, ack 39638, win 1020, options [nop,nop,TS val 285388103 ecr 2506026580], length 870
08:41:42.105621 IP (tos 0x60, ttl 119, id 43526, offset 0, flags [none], proto TCP (6), length 83)
    172.253.115.113.443 > 172.25.186.179.55229: Flags [P.], cksum 0xdc9b (correct), seq 6990:7021, ack 39638, win 1020, options [nop,nop,TS val 285388103 ecr 2506026580], length 31
08:41:42.105622 IP (tos 0x60, ttl 119, id 43527, offset 0, flags [none], proto TCP (6), length 91)
    172.253.115.113.443 > 172.25.186.179.55229: Flags [P.], cksum 0xfce7 (correct), seq 7021:7060, ack 39638, win 1020, options [nop,nop,TS val 285388103 ecr 2506026580], length 39
08:41:42.105719 IP (tos 0x0, ttl 64, id 0, offset 0, flags [DF], proto TCP (6), length 52)
    172.25.186.179.55229 > 172.253.115.113.443: Flags [.], cksum 0xeb6c (correct), ack 7060, win 3666, options [nop,nop,TS val 2506026602 ecr 285388103], length 0
08:41:42.106192 IP (tos 0x0, ttl 64, id 0, offset 0, flags [DF], proto TCP (6), length 91)
    172.25.186.179.55229 > 172.253.115.113.443: Flags [P.], cksum 0xa5a9 (correct), seq 39638:39677, ack 7060, win 3680, options [nop,nop,TS val 2506026602 ecr 285388103], length 39
08:41:42.123617 IP (tos 0x60, ttl 119, id 43528, offset 0, flags [none], proto TCP (6), length 52)
    172.253.115.113.443 > 172.25.186.179.55229: Flags [.], cksum 0xf589 (correct), ack 39677, win 1020, options [nop,nop,TS val 285388121 ecr 2506026602], length 0
08:41:42.314349 IP (tos 0x60, ttl 119, id 43529, offset 0, flags [none], proto TCP (6), length 657)
    172.253.115.113.443 > 172.25.186.179.55229: Flags [P.], cksum 0xbf6e (correct), seq 7060:7665, ack 39677, win 1020, options [nop,nop,TS val 285388310 ecr 2506026602], length 605
08:41:42.314355 IP (tos 0x60, ttl 119, id 43530, offset 0, flags [none], proto TCP (6), length 237)
    172.253.115.113.443 > 172.25.186.179.55229: Flags [P.], cksum 0x2ac3 (correct), seq 7665:7850, ack 39677, win 1020, options [nop,nop,TS val 285388310 ecr 2506026602], length 185
08:41:42.314356 IP (tos 0x60, ttl 119, id 43531, offset 0, flags [none], proto TCP (6), length 177)
    172.253.115.113.443 > 172.25.186.179.55229: Flags [P.], cksum 0x68d5 (correct), seq 7850:7975, ack 39677, win 1020, options [nop,nop,TS val 285388310 ecr 2506026602], length 125
08:41:42.314356 IP (tos 0x60, ttl 119, id 43532, offset 0, flags [none], proto TCP (6), length 308)
    172.253.115.113.443 > 172.25.186.179.55229: Flags [P.], cksum 0xc143 (correct), seq 7975:8231, ack 39677, win 1020, options [nop,nop,TS val 285388310 ecr 2506026602], length 256
08:41:42.314467 IP (tos 0x0, ttl 64, id 0, offset 0, flags [DF], proto TCP (6), length 52)
    172.25.186.179.55229 > 172.253.115.113.443: Flags [.], cksum 0xe517 (correct), ack 8231, win 3662, options [nop,nop,TS val 2506026810 ecr 285388310], length 0
08:41:42.315244 IP (tos 0x0, ttl 64, id 0, offset 0, flags [DF], proto TCP (6), length 91)
    172.25.186.179.55229 > 172.253.115.113.443: Flags [P.], cksum 0x3e04 (correct), seq 39677:39716, ack 8231, win 3680, options [nop,nop,TS val 2506026810 ecr 285388310], length 39
08:41:42.327508 IP (tos 0x60, ttl 119, id 43533, offset 0, flags [none], proto TCP (6), length 52)
    172.253.115.113.443 > 172.25.186.179.55229: Flags [.], cksum 0xef33 (correct), ack 39716, win 1020, options [nop,nop,TS val 285388325 ecr 2506026810], length 0
08:41:52.153878 IP (tos 0x0, ttl 64, id 0, offset 0, flags [DF], proto TCP (6), length 1426)
    172.25.186.179.55229 > 172.253.115.113.443: Flags [.], cksum 0x1ab7 (correct), seq 39716:41090, ack 8231, win 3680, options [nop,nop,TS val 2506036649 ecr 285388325], length 1374
08:41:52.153881 IP (tos 0x0, ttl 64, id 1, offset 0, flags [DF], proto TCP (6), length 1426)
    172.25.186.179.55229 > 172.253.115.113.443: Flags [.], cksum 0xc624 (correct), seq 41090:42464, ack 8231, win 3680, options [nop,nop,TS val 2506036649 ecr 285388325], length 1374
08:41:52.153951 IP (tos 0x0, ttl 64, id 0, offset 0, flags [DF], proto TCP (6), length 539)
    172.25.186.179.55229 > 172.253.115.113.443: Flags [P.], cksum 0x3459 (correct), seq 42464:42951, ack 8231, win 3680, options [nop,nop,TS val 2506036649 ecr 285388325], length 487
08:41:52.154023 IP (tos 0x0, ttl 64, id 0, offset 0, flags [DF], proto TCP (6), length 250)
    172.25.186.179.55229 > 172.253.115.113.443: Flags [P.], cksum 0x25af (correct), seq 42951:43149, ack 8231, win 3680, options [nop,nop,TS val 2506036649 ecr 285388325], length 198
08:41:52.167304 IP (tos 0x60, ttl 119, id 43534, offset 0, flags [none], proto TCP (6), length 52)
    172.253.115.113.443 > 172.25.186.179.55229: Flags [.], cksum 0x9cfd (correct), ack 41090, win 1015, options [nop,nop,TS val 285398163 ecr 2506036649], length 0
08:41:52.167305 IP (tos 0x60, ttl 119, id 43535, offset 0, flags [none], proto TCP (6), length 52)
    172.253.115.113.443 > 172.25.186.179.55229: Flags [.], cksum 0x97a3 (correct), ack 42464, win 1011, options [nop,nop,TS val 285398163 ecr 2506036649], length 0
08:41:52.167305 IP (tos 0x60, ttl 119, id 43536, offset 0, flags [none], proto TCP (6), length 52)
    172.253.115.113.443 > 172.25.186.179.55229: Flags [.], cksum 0x95b8 (correct), ack 42951, win 1015, options [nop,nop,TS val 285398163 ecr 2506036649], length 0
08:41:52.167306 IP (tos 0x60, ttl 119, id 43537, offset 0, flags [none], proto TCP (6), length 52)
    172.253.115.113.443 > 172.25.186.179.55229: Flags [.], cksum 0x94f2 (correct), ack 43149, win 1015, options [nop,nop,TS val 285398163 ecr 2506036649], length 0
08:41:52.222029 IP (tos 0x60, ttl 119, id 43538, offset 0, flags [none], proto TCP (6), length 576)
    172.253.115.113.443 > 172.25.186.179.55229: Flags [P.], cksum 0xdeeb (correct), seq 8231:8755, ack 43149, win 1020, options [nop,nop,TS val 285398218 ecr 2506036649], length 524
08:41:52.222030 IP (tos 0x60, ttl 119, id 43539, offset 0, flags [none], proto TCP (6), length 348)
    172.253.115.113.443 > 172.25.186.179.55229: Flags [P.], cksum 0x101a (correct), seq 8755:9051, ack 43149, win 1020, options [nop,nop,TS val 285398218 ecr 2506036649], length 296
08:41:52.222030 IP (tos 0x60, ttl 119, id 43540, offset 0, flags [none], proto TCP (6), length 246)
