tcpdump: data link type PKTAP
tcpdump: WARNING: snaplen raised from 96 to 524288
tcpdump: listening on pktap, link-type PKTAP (Apple DLT_PKTAP), snapshot length 524288 bytes
16:12:16.997563 IP (tos 0x0, ttl 64, id 0, offset 0, flags [DF], proto TCP (6), length 1422)
    172.25.101.53.58102 > 142.251.16.100.443: Flags [.], cksum 0x1f37 (correct), seq 185210506:185211876, ack 2212660162, win 2048, options [nop,nop,TS val 892144088 ecr 1661953153], length 1370
16:12:16.997566 IP (tos 0x0, ttl 64, id 1, offset 0, flags [DF], proto TCP (6), length 1422)
    172.25.101.53.58102 > 142.251.16.100.443: Flags [.], cksum 0xbd8d (correct), seq 1370:2740, ack 1, win 2048, options [nop,nop,TS val 892144088 ecr 1661953153], length 1370
16:12:16.997606 IP (tos 0x0, ttl 64, id 0, offset 0, flags [DF], proto TCP (6), length 354)
    172.25.101.53.58102 > 142.251.16.100.443: Flags [P.], cksum 0xe1cb (correct), seq 2740:3042, ack 1, win 2048, options [nop,nop,TS val 892144088 ecr 1661953153], length 302
16:12:16.997642 IP (tos 0x0, ttl 64, id 0, offset 0, flags [DF], proto TCP (6), length 91)
    172.25.101.53.58102 > 142.251.16.100.443: Flags [P.], cksum 0xfcf9 (correct), seq 3042:3081, ack 1, win 2048, options [nop,nop,TS val 892144088 ecr 1661953153], length 39
16:12:16.997658 IP (tos 0x0, ttl 64, id 0, offset 0, flags [DF], proto TCP (6), length 557)
    172.25.101.53.58102 > 142.251.16.100.443: Flags [P.], cksum 0xca37 (correct), seq 3081:3586, ack 1, win 2048, options [nop,nop,TS val 892144088 ecr 1661953153], length 505
16:12:17.008645 IP (tos 0x0, ttl 118, id 20700, offset 0, flags [none], proto TCP (6), length 64)
    142.251.16.100.443 > 172.25.101.53.58102: Flags [.], cksum 0xce2e (correct), ack 1370, win 731, options [nop,nop,TS val 1661972438 ecr 892144088,nop,nop,sack 1 {2740:3042}], length 0
16:12:17.008646 IP (tos 0x0, ttl 118, id 20701, offset 0, flags [none], proto TCP (6), length 52)
    142.251.16.100.443 > 172.25.101.53.58102: Flags [.], cksum 0x5782 (correct), ack 3042, win 725, options [nop,nop,TS val 1661972438 ecr 892144088], length 0
16:12:17.008646 IP (tos 0x0, ttl 118, id 20702, offset 0, flags [none], proto TCP (6), length 52)
    142.251.16.100.443 > 172.25.101.53.58102: Flags [.], cksum 0x5557 (correct), ack 3586, win 736, options [nop,nop,TS val 1661972438 ecr 892144088], length 0
16:12:17.008647 IP (tos 0x0, ttl 118, id 20703, offset 0, flags [none], proto TCP (6), length 91)
    142.251.16.100.443 > 172.25.101.53.58102: Flags [P.], cksum 0x2d5f (correct), seq 1:40, ack 3586, win 736, options [nop,nop,TS val 1661972438 ecr 892144088], length 39
16:12:17.008746 IP (tos 0x0, ttl 64, id 0, offset 0, flags [DF], proto TCP (6), length 52)
    172.25.101.53.58102 > 142.251.16.100.443: Flags [.], cksum 0x5005 (correct), ack 40, win 2048, options [nop,nop,TS val 892144099 ecr 1661972438], length 0
16:12:17.028028 IP (tos 0x0, ttl 118, id 20704, offset 0, flags [none], proto TCP (6), length 593)
    142.251.16.100.443 > 172.25.101.53.58102: Flags [P.], cksum 0x88b6 (correct), seq 40:581, ack 3586, win 736, options [nop,nop,TS val 1661972456 ecr 892144099], length 541
16:12:17.028030 IP (tos 0x0, ttl 118, id 20705, offset 0, flags [none], proto TCP (6), length 309)
    142.251.16.100.443 > 172.25.101.53.58102: Flags [P.], cksum 0x6de0 (correct), seq 581:838, ack 3586, win 736, options [nop,nop,TS val 1661972456 ecr 892144099], length 257
16:12:17.028030 IP (tos 0x0, ttl 118, id 20706, offset 0, flags [none], proto TCP (6), length 83)
    142.251.16.100.443 > 172.25.101.53.58102: Flags [P.], cksum 0xcae4 (correct), seq 838:869, ack 3586, win 736, options [nop,nop,TS val 1661972456 ecr 892144099], length 31
16:12:17.028031 IP (tos 0x0, ttl 118, id 20707, offset 0, flags [none], proto TCP (6), length 91)
    142.251.16.100.443 > 172.25.101.53.58102: Flags [P.], cksum 0xf721 (correct), seq 869:908, ack 3586, win 736, options [nop,nop,TS val 1661972456 ecr 892144099], length 39
16:12:17.028125 IP (tos 0x0, ttl 64, id 0, offset 0, flags [DF], proto TCP (6), length 52)
    172.25.101.53.58102 > 142.251.16.100.443: Flags [.], cksum 0x4c89 (correct), ack 908, win 2035, options [nop,nop,TS val 892144118 ecr 1661972456], length 0
16:12:17.029991 IP (tos 0x0, ttl 64, id 0, offset 0, flags [DF], proto TCP (6), length 87)
    172.25.101.53.58102 > 142.251.16.100.443: Flags [P.], cksum 0xf222 (correct), seq 3586:3621, ack 908, win 2048, options [nop,nop,TS val 892144120 ecr 1661972456], length 35
16:12:17.030083 IP (tos 0x0, ttl 64, id 0, offset 0, flags [DF], proto TCP (6), length 91)
    172.25.101.53.58102 > 142.251.16.100.443: Flags [P.], cksum 0x55fc (correct), seq 3621:3660, ack 908, win 2048, options [nop,nop,TS val 892144120 ecr 1661972456], length 39
16:12:17.041961 IP (tos 0x0, ttl 118, id 20708, offset 0, flags [none], proto TCP (6), length 52)
    142.251.16.100.443 > 172.25.101.53.58102: Flags [.], cksum 0x5141 (correct), ack 3660, win 736, options [nop,nop,TS val 1661972471 ecr 892144120], length 0
16:12:26.195184 IP (tos 0x0, ttl 64, id 0, offset 0, flags [DF], proto TCP (6), length 1422)
    172.25.101.53.58102 > 142.251.16.100.443: Flags [.], cksum 0x20a6 (correct), seq 3660:5030, ack 908, win 2048, options [nop,nop,TS val 892153285 ecr 1661972471], length 1370
16:12:26.195186 IP (tos 0x0, ttl 64, id 1, offset 0, flags [DF], proto TCP (6), length 1422)
    172.25.101.53.58102 > 142.251.16.100.443: Flags [.], cksum 0xd240 (correct), seq 5030:6400, ack 908, win 2048, options [nop,nop,TS val 892153285 ecr 1661972471], length 1370
16:12:26.195234 IP (tos 0x0, ttl 64, id 0, offset 0, flags [DF], proto TCP (6), length 95)
    172.25.101.53.58102 > 142.251.16.100.443: Flags [P.], cksum 0xa3de (correct), seq 6400:6443, ack 908, win 2048, options [nop,nop,TS val 892153285 ecr 1661972471], length 43
16:12:26.195294 IP (tos 0x0, ttl 64, id 0, offset 0, flags [DF], proto TCP (6), length 1422)
    172.25.101.53.58102 > 142.251.16.100.443: Flags [.], cksum 0x25e0 (correct), seq 6443:7813, ack 908, win 2048, options [nop,nop,TS val 892153285 ecr 1661972471], length 1370
16:12:26.195307 IP (tos 0x0, ttl 64, id 0, offset 0, flags [DF], proto TCP (6), length 301)
    172.25.101.53.58102 > 142.251.16.100.443: Flags [P.], cksum 0x448e (correct), seq 7813:8062, ack 908, win 2048, options [nop,nop,TS val 892153285 ecr 1661972471], length 249
16:12:26.210503 IP (tos 0x0, ttl 118, id 20709, offset 0, flags [none], proto TCP (6), length 64)
    142.251.16.100.443 > 172.25.101.53.58102: Flags [.], cksum 0x58e6 (correct), ack 5030, win 731, options [nop,nop,TS val 1661981637 ecr 892153285,nop,nop,sack 1 {6400:6443}], length 0
16:12:26.210504 IP (tos 0x0, ttl 118, id 20710, offset 0, flags [none], proto TCP (6), length 52)
    142.251.16.100.443 > 172.25.101.53.58102: Flags [.], cksum 0xfed0 (correct), ack 6443, win 726, options [nop,nop,TS val 1661981637 ecr 892153285], length 0
16:12:26.210504 IP (tos 0x0, ttl 118, id 20711, offset 0, flags [none], proto TCP (6), length 64)
    142.251.16.100.443 > 172.25.101.53.58102: Flags [.], cksum 0x478a (correct), ack 6443, win 730, options [nop,nop,TS val 1661981637 ecr 892153285,nop,nop,sack 1 {7813:8062}], length 0
16:12:26.210505 IP (tos 0x0, ttl 118, id 20712, offset 0, flags [none], proto TCP (6), length 52)
    142.251.16.100.443 > 172.25.101.53.58102: Flags [.], cksum 0xf87d (correct), ack 8062, win 726, options [nop,nop,TS val 1661981637 ecr 892153285], length 0
16:12:26.227770 IP (tos 0x0, ttl 118, id 20713, offset 0, flags [none], proto TCP (6), length 597)
    142.251.16.100.443 > 172.25.101.53.58102: Flags [P.], cksum 0x90b5 (correct), seq 908:1453, ack 8062, win 736, options [nop,nop,TS val 1661981655 ecr 892153285], length 545
16:12:26.227771 IP (tos 0x0, ttl 118, id 20714, offset 0, flags [none], proto TCP (6), length 305)
    142.251.16.100.443 > 172.25.101.53.58102: Flags [P.], cksum 0x75f6 (correct), seq 1453:1706, ack 8062, win 736, options [nop,nop,TS val 1661981655 ecr 892153285], length 253
16:12:26.227772 IP (tos 0x0, ttl 118, id 20715, offset 0, flags [none], proto TCP (6), length 83)
    142.251.16.100.443 > 172.25.101.53.58102: Flags [P.], cksum 0x1b22 (correct), seq 1706:1737, ack 8062, win 736, options [nop,nop,TS val 1661981655 ecr 892153285], length 31
16:12:26.227773 IP (tos 0x0, ttl 118, id 20716, offset 0, flags [none], proto TCP (6), length 91)
    142.251.16.100.443 > 172.25.101.53.58102: Flags [P.], cksum 0xcbc3 (correct), seq 1737:1776, ack 8062, win 736, options [nop,nop,TS val 1661981655 ecr 892153285], length 39
16:12:26.227858 IP (tos 0x0, ttl 64, id 0, offset 0, flags [DF], proto TCP (6), length 52)
    172.25.101.53.58102 > 142.251.16.100.443: Flags [.], cksum 0xefc9 (correct), ack 1776, win 2035, options [nop,nop,TS val 892153318 ecr 1661981655], length 0
16:12:26.229449 IP (tos 0x0, ttl 64, id 0, offset 0, flags [DF], proto TCP (6), length 87)
    172.25.101.53.58102 > 142.251.16.100.443: Flags [P.], cksum 0xcefc (correct), seq 8062:8097, ack 1776, win 2048, options [nop,nop,TS val 892153319 ecr 1661981655], length 35
16:12:26.229541 IP (tos 0x0, ttl 64, id 0, offset 0, flags [DF], proto TCP (6), length 91)
    172.25.101.53.58102 > 142.251.16.100.443: Flags [P.], cksum 0x51d0 (correct), seq 8097:8136, ack 1776, win 2048, options [nop,nop,TS val 892153319 ecr 1661981655], length 39
16:12:26.241469 IP (tos 0x0, ttl 118, id 20717, offset 0, flags [none], proto TCP (6), length 52)
    142.251.16.100.443 > 172.25.101.53.58102: Flags [.], cksum 0xf481 (correct), ack 8136, win 736, options [nop,nop,TS val 1661981671 ecr 892153319], length 0
16:12:30.310442 IP (tos 0x0, ttl 64, id 0, offset 0, flags [DF], proto TCP (6), length 1422)
    172.25.101.53.58102 > 142.251.16.100.443: Flags [.], cksum 0x90d7 (correct), seq 8136:9506, ack 1776, win 2048, options [nop,nop,TS val 892157400 ecr 1661981671], length 1370
16:12:30.310445 IP (tos 0x0, ttl 64, id 1, offset 0, flags [DF], proto TCP (6), length 1422)
    172.25.101.53.58102 > 142.251.16.100.443: Flags [.], cksum 0xba03 (correct), seq 9506:10876, ack 1776, win 2048, options [nop,nop,TS val 892157400 ecr 1661981671], length 1370
16:12:30.310502 IP (tos 0x0, ttl 64, id 0, offset 0, flags [DF], proto TCP (6), length 951)
    172.25.101.53.58102 > 142.251.16.100.443: Flags [P.], cksum 0x1e0d (correct), seq 10876:11775, ack 1776, win 2048, options [nop,nop,TS val 892157400 ecr 1661981671], length 899
16:12:30.310546 IP (tos 0x0, ttl 64, id 0, offset 0, flags [DF], proto TCP (6), length 250)
    172.25.101.53.58102 > 142.251.16.100.443: Flags [P.], cksum 0x333e (correct), seq 11775:11973, ack 1776, win 2048, options [nop,nop,TS val 892157400 ecr 1661981671], length 198
16:12:30.316163 IP (tos 0x0, ttl 64, id 0, offset 0, flags [DF], proto TCP (6), length 1422)
    172.25.101.53.58102 > 142.251.16.100.443: Flags [.], cksum 0x1108 (correct), seq 11973:13343, ack 1776, win 2048, options [nop,nop,TS val 892157406 ecr 1661981671], length 1370
16:12:30.316166 IP (tos 0x0, ttl 64, id 1, offset 0, flags [DF], proto TCP (6), length 1422)
    172.25.101.53.58102 > 142.251.16.100.443: Flags [.], cksum 0xa3b9 (correct), seq 13343:14713, ack 1776, win 2048, options [nop,nop,TS val 892157406 ecr 1661981671], length 1370
16:12:30.316204 IP (tos 0x0, ttl 64, id 0, offset 0, flags [DF], proto TCP (6), length 1015)
    172.25.101.53.58102 > 142.251.16.100.443: Flags [P.], cksum 0x3220 (correct), seq 14713:15676, ack 1776, win 2048, options [nop,nop,TS val 892157406 ecr 1661981671], length 963
16:12:30.316239 IP (tos 0x0, ttl 64, id 0, offset 0, flags [DF], proto TCP (6), length 1422)
    172.25.101.53.58102 > 142.251.16.100.443: Flags [.], cksum 0xc828 (correct), seq 15676:17046, ack 1776, win 2048, options [nop,nop,TS val 892157406 ecr 1661981671], length 1370
16:12:30.316240 IP (tos 0x0, ttl 64, id 1, offset 0, flags [DF], proto TCP (6), length 1422)
    172.25.101.53.58102 > 142.251.16.100.443: Flags [.], cksum 0x14b7 (correct), seq 17046:18416, ack 1776, win 2048, options [nop,nop,TS val 892157406 ecr 1661981671], length 1370
16:12:30.316247 IP (tos 0x0, ttl 64, id 0, offset 0, flags [DF], proto TCP (6), length 138)
    172.25.101.53.58102 > 142.251.16.100.443: Flags [P.], cksum 0xd475 (correct), seq 18416:18502, ack 1776, win 2048, options [nop,nop,TS val 892157406 ecr 1661981671], length 86
16:12:30.319564 IP (tos 0x0, ttl 64, id 0, offset 0, flags [DF], proto TCP (6), length 1422)
    172.25.101.53.58102 > 142.251.16.100.443: Flags [.], cksum 0xce07 (correct), seq 18502:19872, ack 1776, win 2048, options [nop,nop,TS val 892157410 ecr 1661981671], length 1370
16:12:30.319566 IP (tos 0x0, ttl 64, id 1, offset 0, flags [DF], proto TCP (6), length 1422)
    172.25.101.53.58102 > 142.251.16.100.443: Flags [.], cksum 0x3aa8 (correct), seq 19872:21242, ack 1776, win 2048, options [nop,nop,TS val 892157410 ecr 1661981671], length 1370
16:12:30.319589 IP (tos 0x0, ttl 64, id 0, offset 0, flags [DF], proto TCP (6), length 343)
    172.25.101.53.58102 > 142.251.16.100.443: Flags [P.], cksum 0x0f43 (correct), seq 21242:21533, ack 1776, win 2048, options [nop,nop,TS val 892157410 ecr 1661981671], length 291
16:12:30.319612 IP (tos 0x0, ttl 64, id 0, offset 0, flags [DF], proto TCP (6), length 1079)
    172.25.101.53.58102 > 142.251.16.100.443: Flags [P.], cksum 0x4fbb (correct), seq 21533:22560, ack 1776, win 2048, options [nop,nop,TS val 892157410 ecr 1661981671], length 1027
16:12:30.328223 IP (tos 0x0, ttl 118, id 20718, offset 0, flags [none], proto TCP (6), length 52)
    142.251.16.100.443 > 172.25.101.53.58102: Flags [.], cksum 0xc9ed (correct), ack 10876, win 730, options [nop,nop,TS val 1661985756 ecr 892157400], length 0
16:12:30.328223 IP (tos 0x0, ttl 118, id 20719, offset 0, flags [none], proto TCP (6), length 52)
    142.251.16.100.443 > 172.25.101.53.58102: Flags [.], cksum 0xc59e (correct), ack 11973, win 736, options [nop,nop,TS val 1661985756 ecr 892157400], length 0
16:12:30.330131 IP (tos 0x0, ttl 118, id 20720, offset 0, flags [none], proto TCP (6), length 52)
    142.251.16.100.443 > 172.25.101.53.58102: Flags [.], cksum 0xbaec (correct), ack 14713, win 726, options [nop,nop,TS val 1661985758 ecr 892157406], length 0
16:12:30.330132 IP (tos 0x0, ttl 118, id 20721, offset 0, flags [none], proto TCP (6), length 52)
    142.251.16.100.443 > 172.25.101.53.58102: Flags [.], cksum 0xb1d7 (correct), ack 17046, win 718, options [nop,nop,TS val 1661985758 ecr 892157406], length 0
16:12:30.330132 IP (tos 0x0, ttl 118, id 20722, offset 0, flags [none], proto TCP (6), length 64)
    142.251.16.100.443 > 172.25.101.53.58102: Flags [.], cksum 0xa861 (correct), ack 17046, win 718, options [nop,nop,TS val 1661985758 ecr 892157406,nop,nop,sack 1 {18416:18502}], length 0
16:12:30.330132 IP (tos 0x0, ttl 118, id 20723, offset 0, flags [none], proto TCP (6), length 52)
    142.251.16.100.443 > 172.25.101.53.58102: Flags [.], cksum 0xac2c (correct), ack 18502, win 713, options [nop,nop,TS val 1661985758 ecr 892157406], length 0
16:12:30.331493 IP (tos 0x0, ttl 118, id 20724, offset 0, flags [none], proto TCP (6), length 64)
    142.251.16.100.443 > 172.25.101.53.58102: Flags [.], cksum 0x8669 (correct), ack 19872, win 725, options [nop,nop,TS val 1661985760 ecr 892157410,nop,nop,sack 1 {21242:21533}], length 0
16:12:30.331493 IP (tos 0x0, ttl 118, id 20725, offset 0, flags [none], proto TCP (6), length 52)
    142.251.16.100.443 > 172.25.101.53.58102: Flags [.], cksum 0xa046 (correct), ack 21533, win 722, options [nop,nop,TS val 1661985760 ecr 892157410], length 0
16:12:30.336629 IP (tos 0x0, ttl 118, id 20726, offset 0, flags [none], proto TCP (6), length 52)
    142.251.16.100.443 > 172.25.101.53.58102: Flags [.], cksum 0x9c30 (correct), ack 22560, win 736, options [nop,nop,TS val 1661985765 ecr 892157410], length 0
16:12:30.352334 IP (tos 0x0, ttl 118, id 20727, offset 0, flags [none], proto TCP (6), length 601)
    142.251.16.100.443 > 172.25.101.53.58102: Flags [P.], cksum 0xc66c (correct), seq 1776:2325, ack 22560, win 736, options [nop,nop,TS val 1661985780 ecr 892157410], length 549
16:12:30.352335 IP (tos 0x0, ttl 118, id 20728, offset 0, flags [none], proto TCP (6), length 456)
    142.251.16.100.443 > 172.25.101.53.58102: Flags [P.], cksum 0xeca0 (correct), seq 2325:2729, ack 22560, win 736, options [nop,nop,TS val 1661985780 ecr 892157410], length 404
16:12:30.352335 IP (tos 0x0, ttl 118, id 20729, offset 0, flags [none], proto TCP (6), length 83)
    142.251.16.100.443 > 172.25.101.53.58102: Flags [P.], cksum 0xe4dd (correct), seq 2729:2760, ack 22560, win 736, options [nop,nop,TS val 1661985780 ecr 892157410], length 31
16:12:30.352336 IP (tos 0x0, ttl 118, id 20730, offset 0, flags [none], proto TCP (6), length 91)
    142.251.16.100.443 > 172.25.101.53.58102: Flags [P.], cksum 0x6235 (correct), seq 2760:2799, ack 22560, win 736, options [nop,nop,TS val 1661985780 ecr 892157410], length 39
16:12:30.352383 IP (tos 0x0, ttl 64, id 0, offset 0, flags [DF], proto TCP (6), length 52)
    172.25.101.53.58102 > 142.251.16.100.443: Flags [.], cksum 0x92f1 (correct), ack 2799, win 2033, options [nop,nop,TS val 892157442 ecr 1661985780], length 0
16:12:30.352887 IP (tos 0x0, ttl 64, id 0, offset 0, flags [DF], proto TCP (6), length 91)
    172.25.101.53.58102 > 142.251.16.100.443: Flags [P.], cksum 0x0947 (correct), seq 22560:22599, ack 2799, win 2048, options [nop,nop,TS val 892157442 ecr 1661985780], length 39
16:12:30.369475 IP (tos 0x0, ttl 118, id 20731, offset 0, flags [none], proto TCP (6), length 52)
    142.251.16.100.443 > 172.25.101.53.58102: Flags [.], cksum 0x97c9 (correct), ack 22599, win 736, options [nop,nop,TS val 1661985798 ecr 892157442], length 0
16:12:30.399322 IP (tos 0x0, ttl 118, id 20732, offset 0, flags [none], proto TCP (6), length 573)
    142.251.16.100.443 > 172.25.101.53.58102: Flags [P.], cksum 0x8e53 (correct), seq 2799:3320, ack 22599, win 736, options [nop,nop,TS val 1661985827 ecr 892157442], length 521
16:12:30.399324 IP (tos 0x0, ttl 118, id 20733, offset 0, flags [none], proto TCP (6), length 350)
    142.251.16.100.443 > 172.25.101.53.58102: Flags [P.], cksum 0x8c96 (correct), seq 3320:3618, ack 22599, win 736, options [nop,nop,TS val 1661985827 ecr 892157442], length 298
16:12:30.399324 IP (tos 0x0, ttl 118, id 20734, offset 0, flags [none], proto TCP (6), length 138)
    142.251.16.100.443 > 172.25.101.53.58102: Flags [P.], cksum 0x3edc (correct), seq 3618:3704, ack 22599, win 736, options [nop,nop,TS val 1661985827 ecr 892157442], length 86
16:12:30.399325 IP (tos 0x0, ttl 118, id 20735, offset 0, flags [none], proto TCP (6), length 268)
    142.251.16.100.443 > 172.25.101.53.58102: Flags [P.], cksum 0x5287 (correct), seq 3704:3920, ack 22599, win 736, options [nop,nop,TS val 1661985827 ecr 892157442], length 216
16:12:30.399325 IP (tos 0x0, ttl 118, id 20736, offset 0, flags [none], proto TCP (6), length 83)
    142.251.16.100.443 > 172.25.101.53.58102: Flags [P.], cksum 0xf4f4 (correct), seq 3920:3951, ack 22599, win 736, options [nop,nop,TS val 1661985827 ecr 892157442], length 31
16:12:30.399326 IP (tos 0x0, ttl 118, id 20737, offset 0, flags [none], proto TCP (6), length 91)
    142.251.16.100.443 > 172.25.101.53.58102: Flags [P.], cksum 0x8363 (correct), seq 3951:3990, ack 22599, win 736, options [nop,nop,TS val 1661985827 ecr 892157442], length 39
16:12:30.399326 IP (tos 0x0, ttl 118, id 20738, offset 0, flags [none], proto TCP (6), length 574)
    142.251.16.100.443 > 172.25.101.53.58102: Flags [P.], cksum 0xfb0e (correct), seq 3990:4512, ack 22599, win 736, options [nop,nop,TS val 1661985827 ecr 892157442], length 522
16:12:30.399327 IP (tos 0x0, ttl 118, id 20739, offset 0, flags [none], proto TCP (6), length 344)
    142.251.16.100.443 > 172.25.101.53.58102: Flags [P.], cksum 0x8c5f (correct), seq 4512:4804, ack 22599, win 736, options [nop,nop,TS val 1661985827 ecr 892157442], length 292
16:12:30.399416 IP (tos 0x0, ttl 64, id 0, offset 0, flags [DF], proto TCP (6), length 52)
    172.25.101.53.58102 > 142.251.16.100.443: Flags [.], cksum 0x8aa7 (correct), ack 4804, win 2017, options [nop,nop,TS val 892157489 ecr 1661985827], length 0
16:12:30.400446 IP (tos 0x0, ttl 64, id 0, offset 0, flags [DF], proto TCP (6), length 91)
    172.25.101.53.58102 > 142.251.16.100.443: Flags [P.], cksum 0x1a9e (correct), seq 22599:22638, ack 4804, win 2048, options [nop,nop,TS val 892157490 ecr 1661985827], length 39
16:12:30.416262 IP (tos 0x0, ttl 118, id 20740, offset 0, flags [none], proto TCP (6), length 52)
    142.251.16.100.443 > 172.25.101.53.58102: Flags [.], cksum 0x8f6e (correct), ack 22638, win 736, options [nop,nop,TS val 1661985845 ecr 892157490], length 0
16:12:30.424900 IP (tos 0x0, ttl 64, id 0, offset 0, flags [DF], proto TCP (6), length 1422)
    172.25.101.53.58102 > 142.251.16.100.443: Flags [.], cksum 0xc648 (correct), seq 22638:24008, ack 4804, win 2048, options [nop,nop,TS val 892157514 ecr 1661985845], length 1370
16:12:30.424901 IP (tos 0x0, ttl 64, id 1, offset 0, flags [DF], proto TCP (6), length 1422)
    172.25.101.53.58102 > 142.251.16.100.443: Flags [.], cksum 0x2858 (correct), seq 24008:25378, ack 4804, win 2048, options [nop,nop,TS val 892157514 ecr 1661985845], length 1370
16:12:30.424910 IP (tos 0x0, ttl 64, id 0, offset 0, flags [DF], proto TCP (6), length 725)
    172.25.101.53.58102 > 142.251.16.100.443: Flags [P.], cksum 0xa2c7 (correct), seq 25378:26051, ack 4804, win 2048, options [nop,nop,TS val 892157514 ecr 1661985845], length 673
16:12:30.424920 IP (tos 0x0, ttl 64, id 0, offset 0, flags [DF], proto TCP (6), length 1422)
    172.25.101.53.58102 > 142.251.16.100.443: Flags [.], cksum 0xf8f3 (correct), seq 26051:27421, ack 4804, win 2048, options [nop,nop,TS val 892157514 ecr 1661985845], length 1370
16:12:30.424920 IP (tos 0x0, ttl 64, id 1, offset 0, flags [DF], proto TCP (6), length 1422)
    172.25.101.53.58102 > 142.251.16.100.443: Flags [.], cksum 0xefa3 (correct), seq 27421:28791, ack 4804, win 2048, options [nop,nop,TS val 892157514 ecr 1661985845], length 1370
16:12:30.424923 IP (tos 0x0, ttl 64, id 0, offset 0, flags [DF], proto TCP (6), length 1250)
    172.25.101.53.58102 > 142.251.16.100.443: Flags [P.], cksum 0xec41 (correct), seq 28791:29989, ack 4804, win 2048, options [nop,nop,TS val 892157514 ecr 1661985845], length 1198
16:12:30.428732 IP (tos 0x0, ttl 64, id 0, offset 0, flags [DF], proto TCP (6), length 1422)
    172.25.101.53.58102 > 142.251.16.100.443: Flags [.], cksum 0xbd69 (correct), seq 29989:31359, ack 4804, win 2048, options [nop,nop,TS val 892157519 ecr 1661985845], length 1370
16:12:30.428732 IP (tos 0x0, ttl 64, id 1, offset 0, flags [DF], proto TCP (6), length 1422)
    172.25.101.53.58102 > 142.251.16.100.443: Flags [.], cksum 0x93f2 (correct), seq 31359:32729, ack 4804, win 2048, options [nop,nop,TS val 892157519 ecr 1661985845], length 1370
16:12:30.428745 IP (tos 0x0, ttl 64, id 0, offset 0, flags [DF], proto TCP (6), length 954)
    172.25.101.53.58102 > 142.251.16.100.443: Flags [P.], cksum 0x195a (correct), seq 32729:33631, ack 4804, win 2048, options [nop,nop,TS val 892157519 ecr 1661985845], length 902
16:12:30.428755 IP (tos 0x0, ttl 64, id 0, offset 0, flags [DF], proto TCP (6), length 236)
    172.25.101.53.58102 > 142.251.16.100.443: Flags [P.], cksum 0x81dd (correct), seq 33631:33815, ack 4804, win 2048, options [nop,nop,TS val 892157519 ecr 1661985845], length 184
16:12:30.435933 IP (tos 0x0, ttl 118, id 20741, offset 0, flags [none], proto TCP (6), length 52)
    142.251.16.100.443 > 172.25.101.53.58102: Flags [.], cksum 0x89ed (correct), ack 24008, win 731, options [nop,nop,TS val 1661985865 ecr 892157514], length 0
16:12:30.436998 IP (tos 0x0, ttl 118, id 20742, offset 0, flags [none], proto TCP (6), length 52)
    142.251.16.100.443 > 172.25.101.53.58102: Flags [.], cksum 0x81f9 (correct), ack 26051, win 724, options [nop,nop,TS val 1661985865 ecr 892157514], length 0
16:12:30.436998 IP (tos 0x0, ttl 118, id 20743, offset 0, flags [none], proto TCP (6), length 52)
    142.251.16.100.443 > 172.25.101.53.58102: Flags [.], cksum 0x7c99 (correct), ack 27421, win 730, options [nop,nop,TS val 1661985865 ecr 892157514], length 0
16:12:30.436998 IP (tos 0x0, ttl 118, id 20744, offset 0, flags [none], proto TCP (6), length 52)
    142.251.16.100.443 > 172.25.101.53.58102: Flags [.], cksum 0x7743 (correct), ack 28791, win 726, options [nop,nop,TS val 1661985865 ecr 892157514], length 0
16:12:30.436999 IP (tos 0x0, ttl 118, id 20745, offset 0, flags [none], proto TCP (6), length 52)
    142.251.16.100.443 > 172.25.101.53.58102: Flags [.], cksum 0x7299 (correct), ack 29989, win 722, options [nop,nop,TS val 1661985865 ecr 892157514], length 0
16:12:30.439630 IP (tos 0x0, ttl 118, id 20746, offset 0, flags [none], proto TCP (6), length 52)
    142.251.16.100.443 > 172.25.101.53.58102: Flags [.], cksum 0x67d4 (correct), ack 32729, win 730, options [nop,nop,TS val 1661985869 ecr 892157519], length 0
16:12:30.439630 IP (tos 0x0, ttl 118, id 20747, offset 0, flags [none], proto TCP (6), length 52)
    142.251.16.100.443 > 172.25.101.53.58102: Flags [.], cksum 0x6390 (correct), ack 33815, win 736, options [nop,nop,TS val 1661985869 ecr 892157519], length 0
16:12:30.450706 IP (tos 0x0, ttl 118, id 20748, offset 0, flags [none], proto TCP (6), length 291)
    142.251.16.100.443 > 172.25.101.53.58102: Flags [P.], cksum 0x5f66 (correct), seq 4804:5043, ack 33815, win 736, options [nop,nop,TS val 1661985879 ecr 892157519], length 239
16:12:30.450707 IP (tos 0x0, ttl 118, id 20749, offset 0, flags [none], proto TCP (6), length 83)
    142.251.16.100.443 > 172.25.101.53.58102: Flags [P.], cksum 0x1e59 (correct), seq 5043:5074, ack 33815, win 736, options [nop,nop,TS val 1661985880 ecr 892157519], length 31
16:12:30.450708 IP (tos 0x0, ttl 118, id 20750, offset 0, flags [none], proto TCP (6), length 91)
    142.251.16.100.443 > 172.25.101.53.58102: Flags [P.], cksum 0xb6d2 (correct), seq 5074:5113, ack 33815, win 736, options [nop,nop,TS val 1661985880 ecr 892157519], length 39
16:12:30.450823 IP (tos 0x0, ttl 64, id 0, offset 0, flags [DF], proto TCP (6), length 52)
    172.25.101.53.58102 > 142.251.16.100.443: Flags [.], cksum 0x5d1e (correct), ack 5113, win 2044, options [nop,nop,TS val 892157541 ecr 1661985880], length 0
16:12:30.451417 IP (tos 0x0, ttl 64, id 0, offset 0, flags [DF], proto TCP (6), length 91)
    172.25.101.53.58102 > 142.251.16.100.443: Flags [P.], cksum 0xf92f (correct), seq 33815:33854, ack 5113, win 2048, options [nop,nop,TS val 892157541 ecr 1661985880], length 39
16:12:30.468814 IP (tos 0x0, ttl 118, id 20751, offset 0, flags [none], proto TCP (6), length 52)
    142.251.16.100.443 > 172.25.101.53.58102: Flags [.], cksum 0x6202 (correct), ack 33854, win 736, options [nop,nop,TS val 1661985897 ecr 892157541], length 0
16:12:30.737553 IP (tos 0x0, ttl 118, id 20752, offset 0, flags [none], proto TCP (6), length 588)
    142.251.16.100.443 > 172.25.101.53.58102: Flags [P.], cksum 0x18ec (correct), seq 5113:5649, ack 33854, win 736, options [nop,nop,TS val 1661986165 ecr 892157541], length 536
16:12:30.737554 IP (tos 0x0, ttl 118, id 20753, offset 0, flags [none], proto TCP (6), length 407)
    142.251.16.100.443 > 172.25.101.53.58102: Flags [P.], cksum 0x4272 (correct), seq 5649:6004, ack 33854, win 736, options [nop,nop,TS val 1661986165 ecr 892157541], length 355
16:12:30.737555 IP (tos 0x0, ttl 118, id 20754, offset 0, flags [none], proto TCP (6), length 175)
    142.251.16.100.443 > 172.25.101.53.58102: Flags [P.], cksum 0xf2cf (correct), seq 6004:6127, ack 33854, win 736, options [nop,nop,TS val 1661986165 ecr 892157541], length 123
16:12:30.737556 IP (tos 0x0, ttl 118, id 20755, offset 0, flags [none], proto TCP (6), length 131)
    142.251.16.100.443 > 172.25.101.53.58102: Flags [P.], cksum 0x9e37 (correct), seq 6127:6206, ack 33854, win 736, options [nop,nop,TS val 1661986165 ecr 892157541], length 79
16:12:30.737556 IP (tos 0x0, ttl 118, id 20756, offset 0, flags [none], proto TCP (6), length 83)
    142.251.16.100.443 > 172.25.101.53.58102: Flags [P.], cksum 0x7016 (correct), seq 6206:6237, ack 33854, win 736, options [nop,nop,TS val 1661986165 ecr 892157541], length 31
16:12:30.737556 IP (tos 0x0, ttl 118, id 20757, offset 0, flags [none], proto TCP (6), length 91)
    142.251.16.100.443 > 172.25.101.53.58102: Flags [P.], cksum 0xb6f3 (correct), seq 6237:6276, ack 33854, win 736, options [nop,nop,TS val 1661986165 ecr 892157541], length 39
16:12:30.737666 IP (tos 0x0, ttl 64, id 0, offset 0, flags [DF], proto TCP (6), length 52)
    172.25.101.53.58102 > 142.251.16.100.443: Flags [.], cksum 0x563e (correct), ack 6276, win 2030, options [nop,nop,TS val 892157828 ecr 1661986165], length 0
16:12:30.739562 IP (tos 0x0, ttl 64, id 0, offset 0, flags [DF], proto TCP (6), length 91)
    172.25.101.53.58102 > 142.251.16.100.443: Flags [P.], cksum 0x3711 (correct), seq 33854:33893, ack 6276, win 2048, options [nop,nop,TS val 892157829 ecr 1661986165], length 39
16:12:30.751202 IP (tos 0x0, ttl 118, id 20758, offset 0, flags [none], proto TCP (6), length 52)
    142.251.16.100.443 > 172.25.101.53.58102: Flags [.], cksum 0x5b15 (correct), ack 33893, win 736, options [nop,nop,TS val 1661986180 ecr 892157829], length 0
16:12:31.084852 IP (tos 0x0, ttl 118, id 20759, offset 0, flags [none], proto TCP (6), length 436)
    142.251.16.100.443 > 172.25.101.53.58102: Flags [P.], cksum 0x9d1c (correct), seq 6276:6660, ack 33893, win 736, options [nop,nop,TS val 1661986455 ecr 892157829], length 384
16:12:31.084958 IP (tos 0x0, ttl 64, id 0, offset 0, flags [DF], proto TCP (6), length 52)
    172.25.101.53.58102 > 142.251.16.100.443: Flags [.], cksum 0x520e (correct), ack 6660, win 2042, options [nop,nop,TS val 892158175 ecr 1661986455], length 0
16:12:31.602643 IP (tos 0x0, ttl 64, id 0, offset 0, flags [DF], proto TCP (6), length 1422)
    172.25.101.53.58102 > 142.251.16.100.443: Flags [.], cksum 0x8e75 (correct), seq 33893:35263, ack 6660, win 2048, options [nop,nop,TS val 892158693 ecr 1661986455], length 1370
16:12:31.602647 IP (tos 0x0, ttl 64, id 1, offset 0, flags [DF], proto TCP (6), length 1422)
    172.25.101.53.58102 > 142.251.16.100.443: Flags [.], cksum 0xb518 (correct), seq 35263:36633, ack 6660, win 2048, options [nop,nop,TS val 892158693 ecr 1661986455], length 1370
16:12:31.602699 IP (tos 0x0, ttl 64, id 0, offset 0, flags [DF], proto TCP (6), length 962)
    172.25.101.53.58102 > 142.251.16.100.443: Flags [P.], cksum 0xfdc4 (correct), seq 36633:37543, ack 6660, win 2048, options [nop,nop,TS val 892158693 ecr 1661986455], length 910
16:12:31.602823 IP (tos 0x0, ttl 64, id 0, offset 0, flags [DF], proto TCP (6), length 206)
    172.25.101.53.58102 > 142.251.16.100.443: Flags [P.], cksum 0x7f0b (correct), seq 37543:37697, ack 6660, win 2048, options [nop,nop,TS val 892158693 ecr 1661986455], length 154
16:12:31.613779 IP (tos 0x0, ttl 118, id 20760, offset 0, flags [none], proto TCP (6), length 52)
    142.251.16.100.443 > 172.25.101.53.58102: Flags [.], cksum 0x4d81 (correct), ack 35263, win 731, options [nop,nop,TS val 1661987043 ecr 892158693], length 0
16:12:31.613780 IP (tos 0x0, ttl 118, id 20761, offset 0, flags [none], proto TCP (6), length 52)
    142.251.16.100.443 > 172.25.101.53.58102: Flags [.], cksum 0x4828 (correct), ack 36633, win 730, options [nop,nop,TS val 1661987043 ecr 892158693], length 0
16:12:31.613781 IP (tos 0x0, ttl 118, id 20762, offset 0, flags [none], proto TCP (6), length 52)
    142.251.16.100.443 > 172.25.101.53.58102: Flags [.], cksum 0x449d (correct), ack 37543, win 727, options [nop,nop,TS val 1661987043 ecr 892158693], length 0
16:12:31.614754 IP (tos 0x0, ttl 118, id 20763, offset 0, flags [none], proto TCP (6), length 52)
    142.251.16.100.443 > 172.25.101.53.58102: Flags [.], cksum 0x43ff (correct), ack 37697, win 730, options [nop,nop,TS val 1661987044 ecr 892158693], length 0
16:12:31.761212 IP (tos 0x0, ttl 118, id 20764, offset 0, flags [none], proto TCP (6), length 590)
    142.251.16.100.443 > 172.25.101.53.58102: Flags [P.], cksum 0x4850 (correct), seq 6660:7198, ack 37697, win 736, options [nop,nop,TS val 1661987146 ecr 892158693], length 538
16:12:31.761214 IP (tos 0x0, ttl 118, id 20765, offset 0, flags [none], proto TCP (6), length 327)
    142.251.16.100.443 > 172.25.101.53.58102: Flags [P.], cksum 0x1108 (correct), seq 7198:7473, ack 37697, win 736, options [nop,nop,TS val 1661987146 ecr 892158693], length 275
16:12:31.761214 IP (tos 0x0, ttl 118, id 20766, offset 0, flags [none], proto TCP (6), length 178)
    142.251.16.100.443 > 172.25.101.53.58102: Flags [P.], cksum 0x1c34 (correct), seq 7473:7599, ack 37697, win 736, options [nop,nop,TS val 1661987146 ecr 892158693], length 126
16:12:31.761215 IP (tos 0x0, ttl 118, id 20767, offset 0, flags [none], proto TCP (6), length 239)
    142.251.16.100.443 > 172.25.101.53.58102: Flags [P.], cksum 0x95fb (correct), seq 7599:7786, ack 37697, win 736, options [nop,nop,TS val 1661987146 ecr 892158693], length 187
16:12:31.761215 IP (tos 0x0, ttl 118, id 20768, offset 0, flags [none], proto TCP (6), length 83)
    142.251.16.100.443 > 172.25.101.53.58102: Flags [P.], cksum 0xb1a8 (correct), seq 7786:7817, ack 37697, win 736, options [nop,nop,TS val 1661987146 ecr 892158693], length 31
16:12:31.761215 IP (tos 0x0, ttl 118, id 20769, offset 0, flags [none], proto TCP (6), length 91)
    142.251.16.100.443 > 172.25.101.53.58102: Flags [P.], cksum 0x014f (correct), seq 7817:7856, ack 37697, win 736, options [nop,nop,TS val 1661987146 ecr 892158693], length 39
16:12:31.761215 IP (tos 0x0, ttl 118, id 20770, offset 0, flags [none], proto TCP (6), length 91)
    142.251.16.100.443 > 172.25.101.53.58102: Flags [P.], cksum 0x0125 (correct), seq 7817:7856, ack 37697, win 736, options [nop,nop,TS val 1661987188 ecr 892158693], length 39
16:12:31.761331 IP (tos 0x0, ttl 64, id 0, offset 0, flags [DF], proto TCP (6), length 52)
    172.25.101.53.58102 > 142.251.16.100.443: Flags [.], cksum 0x393b (correct), ack 7856, win 2030, options [nop,nop,TS val 892158851 ecr 1661987146], length 0
16:12:31.761425 IP (tos 0x0, ttl 64, id 0, offset 0, flags [DF], proto TCP (6), length 64)
    172.25.101.53.58102 > 142.251.16.100.443: Flags [.], cksum 0xb678 (correct), ack 7856, win 2030, options [nop,nop,TS val 892158851 ecr 1661987188,nop,nop,sack 1 {7817:7856}], length 0
16:12:31.763154 IP (tos 0x0, ttl 64, id 0, offset 0, flags [DF], proto TCP (6), length 87)
    172.25.101.53.58102 > 142.251.16.100.443: Flags [P.], cksum 0xd209 (correct), seq 37697:37732, ack 7856, win 2048, options [nop,nop,TS val 892158853 ecr 1661987188], length 35
16:12:31.763253 IP (tos 0x0, ttl 64, id 0, offset 0, flags [DF], proto TCP (6), length 91)
    172.25.101.53.58102 > 142.251.16.100.443: Flags [P.], cksum 0x5cea (correct), seq 37732:37771, ack 7856, win 2048, options [nop,nop,TS val 892158853 ecr 1661987188], length 39
16:12:31.774174 IP (tos 0x0, ttl 118, id 20771, offset 0, flags [none], proto TCP (6), length 52)
    142.251.16.100.443 > 172.25.101.53.58102: Flags [.], cksum 0x3deb (correct), ack 37732, win 736, options [nop,nop,TS val 1661987203 ecr 892158853], length 0
16:12:31.774175 IP (tos 0x0, ttl 118, id 20772, offset 0, flags [none], proto TCP (6), length 52)
    142.251.16.100.443 > 172.25.101.53.58102: Flags [.], cksum 0x3dc4 (correct), ack 37771, win 736, options [nop,nop,TS val 1661987203 ecr 892158853], length 0
16:12:40.309320 IP (tos 0x0, ttl 64, id 0, offset 0, flags [DF], proto TCP (6), length 1422)
    172.25.101.53.58102 > 142.251.16.100.443: Flags [.], cksum 0x0887 (correct), seq 37771:39141, ack 7856, win 2048, options [nop,nop,TS val 892167399 ecr 1661987203], length 1370
16:12:40.309322 IP (tos 0x0, ttl 64, id 1, offset 0, flags [DF], proto TCP (6), length 1422)
    172.25.101.53.58102 > 142.251.16.100.443: Flags [.], cksum 0xec6c (correct), seq 39141:40511, ack 7856, win 2048, options [nop,nop,TS val 892167399 ecr 1661987203], length 1370
16:12:40.309379 IP (tos 0x0, ttl 64, id 0, offset 0, flags [DF], proto TCP (6), length 352)
    172.25.101.53.58102 > 142.251.16.100.443: Flags [P.], cksum 0xfd77 (correct), seq 40511:40811, ack 7856, win 2048, options [nop,nop,TS val 892167399 ecr 1661987203], length 300
16:12:40.309425 IP (tos 0x0, ttl 64, id 0, offset 0, flags [DF], proto TCP (6), length 1422)
    172.25.101.53.58102 > 142.251.16.100.443: Flags [.], cksum 0x2175 (correct), seq 40811:42181, ack 7856, win 2048, options [nop,nop,TS val 892167399 ecr 1661987203], length 1370
16:12:40.309433 IP (tos 0x0, ttl 64, id 0, offset 0, flags [DF], proto TCP (6), length 127)
    172.25.101.53.58102 > 142.251.16.100.443: Flags [P.], cksum 0xd4c0 (correct), seq 42181:42256, ack 7856, win 2048, options [nop,nop,TS val 892167399 ecr 1661987203], length 75
16:12:40.322037 IP (tos 0x0, ttl 118, id 20773, offset 0, flags [none], proto TCP (6), length 52)
    142.251.16.100.443 > 172.25.101.53.58102: Flags [.], cksum 0xf5a9 (correct), ack 39141, win 731, options [nop,nop,TS val 1661995750 ecr 892167399], length 0
16:12:40.322038 IP (tos 0x0, ttl 118, id 20774, offset 0, flags [none], proto TCP (6), length 52)
    142.251.16.100.443 > 172.25.101.53.58102: Flags [.], cksum 0xf054 (correct), ack 40511, win 726, options [nop,nop,TS val 1661995750 ecr 892167399], length 0
16:12:40.322039 IP (tos 0x0, ttl 118, id 20775, offset 0, flags [none], proto TCP (6), length 52)
    142.251.16.100.443 > 172.25.101.53.58102: Flags [.], cksum 0xef29 (correct), ack 40811, win 725, options [nop,nop,TS val 1661995750 ecr 892167399], length 0
16:12:40.322039 IP (tos 0x0, ttl 118, id 20776, offset 0, flags [none], proto TCP (6), length 64)
    142.251.16.100.443 > 172.25.101.53.58102: Flags [.], cksum 0x2c14 (correct), ack 40811, win 725, options [nop,nop,TS val 1661995750 ecr 892167399,nop,nop,sack 1 {42181:42256}], length 0
16:12:40.322039 IP (tos 0x0, ttl 118, id 20777, offset 0, flags [none], proto TCP (6), length 52)
    142.251.16.100.443 > 172.25.101.53.58102: Flags [.], cksum 0xe989 (correct), ack 42256, win 720, options [nop,nop,TS val 1661995750 ecr 892167399], length 0
16:12:40.344063 IP (tos 0x0, ttl 118, id 20778, offset 0, flags [none], proto TCP (6), length 601)
    142.251.16.100.443 > 172.25.101.53.58102: Flags [P.], cksum 0x6da1 (correct), seq 7856:8405, ack 42256, win 736, options [nop,nop,TS val 1661995772 ecr 892167399], length 549
16:12:40.344064 IP (tos 0x0, ttl 118, id 20779, offset 0, flags [none], proto TCP (6), length 373)
    142.251.16.100.443 > 172.25.101.53.58102: Flags [P.], cksum 0xe1ca (correct), seq 8405:8726, ack 42256, win 736, options [nop,nop,TS val 1661995772 ecr 892167399], length 321
16:12:40.344065 IP (tos 0x0, ttl 118, id 20780, offset 0, flags [none], proto TCP (6), length 83)
    142.251.16.100.443 > 172.25.101.53.58102: Flags [P.], cksum 0x4760 (correct), seq 8726:8757, ack 42256, win 736, options [nop,nop,TS val 1661995772 ecr 892167399], length 31
16:12:40.344066 IP (tos 0x0, ttl 118, id 20781, offset 0, flags [none], proto TCP (6), length 91)
    142.251.16.100.443 > 172.25.101.53.58102: Flags [P.], cksum 0x3f50 (correct), seq 8757:8796, ack 42256, win 736, options [nop,nop,TS val 1661995772 ecr 892167399], length 39
16:12:40.344180 IP (tos 0x0, ttl 64, id 0, offset 0, flags [DF], proto TCP (6), length 52)
    172.25.101.53.58102 > 142.251.16.100.443: Flags [.], cksum 0xe082 (correct), ack 8796, win 2034, options [nop,nop,TS val 892167434 ecr 1661995772], length 0
16:12:40.345863 IP (tos 0x0, ttl 64, id 0, offset 0, flags [DF], proto TCP (6), length 87)
    172.25.101.53.58102 > 142.251.16.100.443: Flags [P.], cksum 0x5389 (correct), seq 42256:42291, ack 8796, win 2048, options [nop,nop,TS val 892167436 ecr 1661995772], length 35
16:12:40.345965 IP (tos 0x0, ttl 64, id 0, offset 0, flags [DF], proto TCP (6), length 91)
