tcpdump: data link type PKTAP
tcpdump: WARNING: snaplen raised from 96 to 524288
tcpdump: listening on pktap, link-type PKTAP (Apple DLT_PKTAP), snapshot length 524288 bytes
15:38:46.844705 IP (tos 0x60, ttl 119, id 942, offset 0, flags [none], proto TCP (6), length 358)
    64.233.180.102.443 > 172.25.64.219.63562: Flags [P.], cksum 0xbf53 (correct), seq 1594461683:1594461989, ack 2602003328, win 670, options [nop,nop,TS val 1718890919 ecr 1527528020], length 306
15:38:46.844898 IP (tos 0x0, ttl 64, id 0, offset 0, flags [DF], proto TCP (6), length 52)
    172.25.64.219.63562 > 64.233.180.102.443: Flags [.], cksum 0x6ede (correct), ack 306, win 2048, options [nop,nop,TS val 1527528358 ecr 1718890919], length 0
15:38:46.969021 IP (tos 0x60, ttl 119, id 943, offset 0, flags [none], proto TCP (6), length 420)
    64.233.180.102.443 > 172.25.64.219.63562: Flags [P.], cksum 0xbe3a (correct), seq 306:674, ack 1, win 670, options [nop,nop,TS val 1718891138 ecr 1527528358], length 368
15:38:46.969131 IP (tos 0x0, ttl 64, id 0, offset 0, flags [DF], proto TCP (6), length 52)
    172.25.64.219.63562 > 64.233.180.102.443: Flags [.], cksum 0x6c17 (correct), ack 674, win 2048, options [nop,nop,TS val 1527528482 ecr 1718891138], length 0
15:38:47.213987 IP (tos 0x60, ttl 119, id 944, offset 0, flags [none], proto TCP (6), length 399)
    64.233.180.102.443 > 172.25.64.219.63562: Flags [P.], cksum 0xaa0a (correct), seq 674:1021, ack 1, win 670, options [nop,nop,TS val 1718891384 ecr 1527528482], length 347
15:38:47.214244 IP (tos 0x0, ttl 64, id 0, offset 0, flags [DF], proto TCP (6), length 52)
    172.25.64.219.63562 > 64.233.180.102.443: Flags [.], cksum 0x68d1 (correct), ack 1021, win 2048, options [nop,nop,TS val 1527528727 ecr 1718891384], length 0
15:38:47.403042 IP (tos 0x60, ttl 119, id 945, offset 0, flags [none], proto TCP (6), length 262)
    64.233.180.102.443 > 172.25.64.219.63562: Flags [P.], cksum 0x8bb1 (correct), seq 1021:1231, ack 1, win 670, options [nop,nop,TS val 1718891572 ecr 1527528727], length 210
15:38:47.403225 IP (tos 0x0, ttl 64, id 0, offset 0, flags [DF], proto TCP (6), length 52)
    172.25.64.219.63562 > 64.233.180.102.443: Flags [.], cksum 0x6686 (correct), ack 1231, win 2048, options [nop,nop,TS val 1527528916 ecr 1718891572], length 0
15:38:47.627997 IP (tos 0x60, ttl 119, id 946, offset 0, flags [none], proto TCP (6), length 293)
    64.233.180.102.443 > 172.25.64.219.63562: Flags [P.], cksum 0xbc3d (correct), seq 1231:1472, ack 1, win 670, options [nop,nop,TS val 1718891798 ecr 1527528916], length 241
15:38:47.628138 IP (tos 0x0, ttl 64, id 0, offset 0, flags [DF], proto TCP (6), length 52)
    172.25.64.219.63562 > 64.233.180.102.443: Flags [.], cksum 0x63d2 (correct), ack 1472, win 2048, options [nop,nop,TS val 1527529141 ecr 1718891798], length 0
15:38:47.972303 IP (tos 0x60, ttl 119, id 947, offset 0, flags [none], proto TCP (6), length 459)
    64.233.180.102.443 > 172.25.64.219.63562: Flags [P.], cksum 0x5c9e (correct), seq 1472:1879, ack 1, win 670, options [nop,nop,TS val 1718892031 ecr 1527529141], length 407
15:38:47.972494 IP (tos 0x0, ttl 64, id 0, offset 0, flags [DF], proto TCP (6), length 52)
    172.25.64.219.63562 > 64.233.180.102.443: Flags [.], cksum 0x5ffa (correct), ack 1879, win 2048, options [nop,nop,TS val 1527529485 ecr 1718892031], length 0
15:38:48.083163 IP (tos 0x60, ttl 119, id 948, offset 0, flags [none], proto TCP (6), length 463)
    64.233.180.102.443 > 172.25.64.219.63562: Flags [P.], cksum 0xd06e (correct), seq 1879:2290, ack 1, win 670, options [nop,nop,TS val 1718892253 ecr 1527529485], length 411
15:38:48.083352 IP (tos 0x0, ttl 64, id 0, offset 0, flags [DF], proto TCP (6), length 52)
    172.25.64.219.63562 > 64.233.180.102.443: Flags [.], cksum 0x5d12 (correct), ack 2290, win 2048, options [nop,nop,TS val 1527529596 ecr 1718892253], length 0
15:38:48.313610 IP (tos 0x60, ttl 119, id 949, offset 0, flags [none], proto TCP (6), length 452)
    64.233.180.102.443 > 172.25.64.219.63562: Flags [P.], cksum 0xde13 (correct), seq 2290:2690, ack 1, win 670, options [nop,nop,TS val 1718892483 ecr 1527529596], length 400
15:38:48.314407 IP (tos 0x0, ttl 64, id 0, offset 0, flags [DF], proto TCP (6), length 52)
    172.25.64.219.63562 > 64.233.180.102.443: Flags [.], cksum 0x59b5 (correct), ack 2690, win 2048, options [nop,nop,TS val 1527529827 ecr 1718892483], length 0
15:38:48.505061 IP (tos 0x60, ttl 119, id 950, offset 0, flags [none], proto TCP (6), length 463)
    64.233.180.102.443 > 172.25.64.219.63562: Flags [P.], cksum 0xc711 (correct), seq 2690:3101, ack 1, win 670, options [nop,nop,TS val 1718892675 ecr 1527529827], length 411
15:38:48.505238 IP (tos 0x0, ttl 64, id 0, offset 0, flags [DF], proto TCP (6), length 52)
    172.25.64.219.63562 > 64.233.180.102.443: Flags [.], cksum 0x569b (correct), ack 3101, win 2048, options [nop,nop,TS val 1527530018 ecr 1718892675], length 0
15:38:48.704287 IP (tos 0x60, ttl 119, id 951, offset 0, flags [none], proto TCP (6), length 417)
    64.233.180.102.443 > 172.25.64.219.63562: Flags [P.], cksum 0x93d7 (correct), seq 3101:3466, ack 1, win 670, options [nop,nop,TS val 1718892874 ecr 1527530018], length 365
15:38:48.704478 IP (tos 0x0, ttl 64, id 0, offset 0, flags [DF], proto TCP (6), length 52)
    172.25.64.219.63562 > 64.233.180.102.443: Flags [.], cksum 0x53a0 (correct), ack 3466, win 2048, options [nop,nop,TS val 1527530217 ecr 1718892874], length 0
15:38:48.995852 IP (tos 0x60, ttl 119, id 952, offset 0, flags [none], proto TCP (6), length 485)
    64.233.180.102.443 > 172.25.64.219.63562: Flags [P.], cksum 0x65a0 (correct), seq 3466:3899, ack 1, win 670, options [nop,nop,TS val 1718893099 ecr 1527530217], length 433
15:38:48.996644 IP (tos 0x0, ttl 64, id 0, offset 0, flags [DF], proto TCP (6), length 52)
    172.25.64.219.63562 > 64.233.180.102.443: Flags [.], cksum 0x4fea (correct), ack 3899, win 2048, options [nop,nop,TS val 1527530509 ecr 1718893099], length 0
15:38:49.175696 IP (tos 0x60, ttl 119, id 953, offset 0, flags [none], proto TCP (6), length 297)
    64.233.180.102.443 > 172.25.64.219.63562: Flags [P.], cksum 0x1324 (correct), seq 3899:4144, ack 1, win 670, options [nop,nop,TS val 1718893344 ecr 1527530509], length 245
15:38:49.175846 IP (tos 0x0, ttl 64, id 0, offset 0, flags [DF], proto TCP (6), length 52)
    172.25.64.219.63562 > 64.233.180.102.443: Flags [.], cksum 0x4d4c (correct), ack 4144, win 2048, options [nop,nop,TS val 1527530689 ecr 1718893344], length 0
15:38:49.364389 IP (tos 0x60, ttl 119, id 954, offset 0, flags [none], proto TCP (6), length 354)
    64.233.180.102.443 > 172.25.64.219.63562: Flags [P.], cksum 0xefc1 (correct), seq 4144:4446, ack 1, win 670, options [nop,nop,TS val 1718893533 ecr 1527530689], length 302
15:38:49.364571 IP (tos 0x0, ttl 64, id 0, offset 0, flags [DF], proto TCP (6), length 52)
    172.25.64.219.63562 > 64.233.180.102.443: Flags [.], cksum 0x4aa5 (correct), ack 4446, win 2048, options [nop,nop,TS val 1527530877 ecr 1718893533], length 0
15:38:49.538110 IP (tos 0x60, ttl 119, id 955, offset 0, flags [none], proto TCP (6), length 474)
    64.233.180.102.443 > 172.25.64.219.63562: Flags [P.], cksum 0x27c5 (correct), seq 4446:4868, ack 1, win 670, options [nop,nop,TS val 1718893708 ecr 1527530877], length 422
15:38:49.538235 IP (tos 0x0, ttl 64, id 0, offset 0, flags [DF], proto TCP (6), length 52)
    172.25.64.219.63562 > 64.233.180.102.443: Flags [.], cksum 0x47a2 (correct), ack 4868, win 2048, options [nop,nop,TS val 1527531051 ecr 1718893708], length 0
15:38:49.766778 IP (tos 0x60, ttl 119, id 956, offset 0, flags [none], proto TCP (6), length 431)
    64.233.180.102.443 > 172.25.64.219.63562: Flags [P.], cksum 0xd2bd (correct), seq 4868:5247, ack 1, win 670, options [nop,nop,TS val 1718893936 ecr 1527531051], length 379
15:38:49.767003 IP (tos 0x0, ttl 64, id 0, offset 0, flags [DF], proto TCP (6), length 52)
    172.25.64.219.63562 > 64.233.180.102.443: Flags [.], cksum 0x445e (correct), ack 5247, win 2048, options [nop,nop,TS val 1527531280 ecr 1718893936], length 0
15:38:50.054103 IP (tos 0x60, ttl 119, id 957, offset 0, flags [none], proto TCP (6), length 414)
    64.233.180.102.443 > 172.25.64.219.63562: Flags [P.], cksum 0xa227 (correct), seq 5247:5609, ack 1, win 670, options [nop,nop,TS val 1718894224 ecr 1527531280], length 362
15:38:50.054300 IP (tos 0x0, ttl 64, id 0, offset 0, flags [DF], proto TCP (6), length 52)
    172.25.64.219.63562 > 64.233.180.102.443: Flags [.], cksum 0x40b5 (correct), ack 5609, win 2048, options [nop,nop,TS val 1527531567 ecr 1718894224], length 0
15:38:50.290664 IP (tos 0x60, ttl 119, id 958, offset 0, flags [none], proto TCP (6), length 342)
    64.233.180.102.443 > 172.25.64.219.63562: Flags [P.], cksum 0x44fe (correct), seq 5609:5899, ack 1, win 670, options [nop,nop,TS val 1718894456 ecr 1527531567], length 290
15:38:50.290784 IP (tos 0x0, ttl 64, id 0, offset 0, flags [DF], proto TCP (6), length 52)
    172.25.64.219.63562 > 64.233.180.102.443: Flags [.], cksum 0x3dbe (correct), ack 5899, win 2048, options [nop,nop,TS val 1527531804 ecr 1718894456], length 0
15:38:50.460740 IP (tos 0x60, ttl 119, id 959, offset 0, flags [none], proto TCP (6), length 295)
    64.233.180.102.443 > 172.25.64.219.63562: Flags [P.], cksum 0xa270 (correct), seq 5899:6142, ack 1, win 670, options [nop,nop,TS val 1718894630 ecr 1527531804], length 243
15:38:50.460941 IP (tos 0x0, ttl 64, id 0, offset 0, flags [DF], proto TCP (6), length 52)
    172.25.64.219.63562 > 64.233.180.102.443: Flags [.], cksum 0x3b73 (correct), ack 6142, win 2048, options [nop,nop,TS val 1527531974 ecr 1718894630], length 0
15:38:50.461035 IP (tos 0x0, ttl 64, id 0, offset 0, flags [DF], proto TCP (6), length 87)
    172.25.64.219.63562 > 64.233.180.102.443: Flags [P.], cksum 0xe4b1 (correct), seq 1:36, ack 6142, win 2048, options [nop,nop,TS val 1527531974 ecr 1718894630], length 35
15:38:50.461053 IP (tos 0x0, ttl 64, id 0, offset 0, flags [DF], proto TCP (6), length 87)
    172.25.64.219.63562 > 64.233.180.102.443: Flags [P.], cksum 0x044c (correct), seq 36:71, ack 6142, win 2048, options [nop,nop,TS val 1527531974 ecr 1718894630], length 35
15:38:50.473708 IP (tos 0x60, ttl 119, id 960, offset 0, flags [none], proto TCP (6), length 52)
    64.233.180.102.443 > 172.25.64.219.63562: Flags [.], cksum 0x4083 (correct), ack 71, win 670, options [nop,nop,TS val 1718894642 ecr 1527531974], length 0
15:38:50.737937 IP (tos 0x60, ttl 119, id 961, offset 0, flags [none], proto TCP (6), length 347)
    64.233.180.102.443 > 172.25.64.219.63562: Flags [P.], cksum 0x9e33 (correct), seq 6142:6437, ack 71, win 670, options [nop,nop,TS val 1718894867 ecr 1527531974], length 295
15:38:50.738164 IP (tos 0x0, ttl 64, id 0, offset 0, flags [DF], proto TCP (6), length 52)
    172.25.64.219.63562 > 64.233.180.102.443: Flags [.], cksum 0x3804 (correct), ack 6437, win 2048, options [nop,nop,TS val 1527532251 ecr 1718894867], length 0
15:38:50.905400 IP (tos 0x60, ttl 119, id 962, offset 0, flags [none], proto TCP (6), length 331)
    64.233.180.102.443 > 172.25.64.219.63562: Flags [P.], cksum 0x85ed (correct), seq 6437:6716, ack 71, win 670, options [nop,nop,TS val 1718895075 ecr 1527532251], length 279
15:38:50.905607 IP (tos 0x0, ttl 64, id 0, offset 0, flags [DF], proto TCP (6), length 52)
    172.25.64.219.63562 > 64.233.180.102.443: Flags [.], cksum 0x3576 (correct), ack 6716, win 2048, options [nop,nop,TS val 1527532418 ecr 1718895075], length 0
15:38:51.085590 IP (tos 0x60, ttl 119, id 963, offset 0, flags [none], proto TCP (6), length 309)
    64.233.180.102.443 > 172.25.64.219.63562: Flags [P.], cksum 0xb372 (correct), seq 6716:6973, ack 71, win 670, options [nop,nop,TS val 1718895254 ecr 1527532418], length 257
15:38:51.085766 IP (tos 0x0, ttl 64, id 0, offset 0, flags [DF], proto TCP (6), length 52)
    172.25.64.219.63562 > 64.233.180.102.443: Flags [.], cksum 0x330e (correct), ack 6973, win 2048, options [nop,nop,TS val 1527532598 ecr 1718895254], length 0
15:38:51.309755 IP (tos 0x60, ttl 119, id 964, offset 0, flags [none], proto TCP (6), length 432)
    64.233.180.102.443 > 172.25.64.219.63562: Flags [P.], cksum 0x8f9b (correct), seq 6973:7353, ack 71, win 670, options [nop,nop,TS val 1718895478 ecr 1527532598], length 380
15:38:51.309956 IP (tos 0x0, ttl 64, id 0, offset 0, flags [DF], proto TCP (6), length 52)
    172.25.64.219.63562 > 64.233.180.102.443: Flags [.], cksum 0x2fd1 (correct), ack 7353, win 2048, options [nop,nop,TS val 1527532823 ecr 1718895478], length 0
15:38:51.520642 IP (tos 0x60, ttl 119, id 965, offset 0, flags [none], proto TCP (6), length 476)
    64.233.180.102.443 > 172.25.64.219.63562: Flags [P.], cksum 0xaf99 (correct), seq 7353:7777, ack 71, win 670, options [nop,nop,TS val 1718895690 ecr 1527532823], length 424
15:38:51.520837 IP (tos 0x0, ttl 64, id 0, offset 0, flags [DF], proto TCP (6), length 52)
    172.25.64.219.63562 > 64.233.180.102.443: Flags [.], cksum 0x2c82 (correct), ack 7777, win 2048, options [nop,nop,TS val 1527533034 ecr 1718895690], length 0
15:38:51.696470 IP (tos 0x60, ttl 119, id 966, offset 0, flags [none], proto TCP (6), length 424)
    64.233.180.102.443 > 172.25.64.219.63562: Flags [P.], cksum 0x5b03 (correct), seq 7777:8149, ack 71, win 670, options [nop,nop,TS val 1718895866 ecr 1527533034], length 372
15:38:51.696909 IP (tos 0x0, ttl 64, id 0, offset 0, flags [DF], proto TCP (6), length 52)
    172.25.64.219.63562 > 64.233.180.102.443: Flags [.], cksum 0x29af (correct), ack 8149, win 2048, options [nop,nop,TS val 1527533209 ecr 1718895866], length 0
15:38:51.965445 IP (tos 0x60, ttl 119, id 967, offset 0, flags [none], proto TCP (6), length 408)
    64.233.180.102.443 > 172.25.64.219.63562: Flags [P.], cksum 0x449e (correct), seq 8149:8505, ack 71, win 670, options [nop,nop,TS val 1718896085 ecr 1527533209], length 356
15:38:51.965637 IP (tos 0x0, ttl 64, id 0, offset 0, flags [DF], proto TCP (6), length 52)
    172.25.64.219.63562 > 64.233.180.102.443: Flags [.], cksum 0x2663 (correct), ack 8505, win 2048, options [nop,nop,TS val 1527533478 ecr 1718896085], length 0
15:38:52.152000 IP (tos 0x60, ttl 119, id 968, offset 0, flags [none], proto TCP (6), length 296)
    64.233.180.102.443 > 172.25.64.219.63562: Flags [P.], cksum 0x4b26 (correct), seq 8505:8749, ack 71, win 670, options [nop,nop,TS val 1718896321 ecr 1527533478], length 244
15:38:52.152163 IP (tos 0x0, ttl 64, id 0, offset 0, flags [DF], proto TCP (6), length 52)
    172.25.64.219.63562 > 64.233.180.102.443: Flags [.], cksum 0x23c8 (correct), ack 8749, win 2048, options [nop,nop,TS val 1527533665 ecr 1718896321], length 0
15:38:52.376257 IP (tos 0x60, ttl 119, id 969, offset 0, flags [none], proto TCP (6), length 335)
    64.233.180.102.443 > 172.25.64.219.63562: Flags [P.], cksum 0x8ee6 (correct), seq 8749:9032, ack 71, win 670, options [nop,nop,TS val 1718896535 ecr 1527533665], length 283
15:38:52.376486 IP (tos 0x0, ttl 64, id 0, offset 0, flags [DF], proto TCP (6), length 52)
    172.25.64.219.63562 > 64.233.180.102.443: Flags [.], cksum 0x20f7 (correct), ack 9032, win 2048, options [nop,nop,TS val 1527533889 ecr 1718896535], length 0
15:38:52.555880 IP (tos 0x60, ttl 119, id 970, offset 0, flags [none], proto TCP (6), length 352)
    64.233.180.102.443 > 172.25.64.219.63562: Flags [P.], cksum 0x0f66 (correct), seq 9032:9332, ack 71, win 670, options [nop,nop,TS val 1718896725 ecr 1527533889], length 300
15:38:52.556069 IP (tos 0x0, ttl 64, id 0, offset 0, flags [DF], proto TCP (6), length 52)
    172.25.64.219.63562 > 64.233.180.102.443: Flags [.], cksum 0x1e59 (correct), ack 9332, win 2048, options [nop,nop,TS val 1527534069 ecr 1718896725], length 0
15:38:52.887005 IP (tos 0x60, ttl 119, id 971, offset 0, flags [none], proto TCP (6), length 499)
    64.233.180.102.443 > 172.25.64.219.63562: Flags [P.], cksum 0x740e (correct), seq 9332:9779, ack 71, win 670, options [nop,nop,TS val 1718896951 ecr 1527534069], length 447
15:38:52.887160 IP (tos 0x0, ttl 64, id 0, offset 0, flags [DF], proto TCP (6), length 52)
    172.25.64.219.63562 > 64.233.180.102.443: Flags [.], cksum 0x1a6d (correct), ack 9779, win 2048, options [nop,nop,TS val 1527534400 ecr 1718896951], length 0
15:38:52.975764 IP (tos 0x60, ttl 119, id 972, offset 0, flags [none], proto TCP (6), length 295)
    64.233.180.102.443 > 172.25.64.219.63562: Flags [P.], cksum 0x1307 (correct), seq 9779:10022, ack 71, win 670, options [nop,nop,TS val 1718897144 ecr 1527534400], length 243
15:38:52.975985 IP (tos 0x0, ttl 64, id 0, offset 0, flags [DF], proto TCP (6), length 52)
    172.25.64.219.63562 > 64.233.180.102.443: Flags [.], cksum 0x1860 (correct), ack 10022, win 2048, options [nop,nop,TS val 1527534489 ecr 1718897144], length 0
15:38:53.183573 IP (tos 0x60, ttl 119, id 973, offset 0, flags [none], proto TCP (6), length 297)
    64.233.180.102.443 > 172.25.64.219.63562: Flags [P.], cksum 0xe461 (correct), seq 10022:10267, ack 71, win 670, options [nop,nop,TS val 1718897352 ecr 1527534489], length 245
15:38:53.183758 IP (tos 0x0, ttl 64, id 0, offset 0, flags [DF], proto TCP (6), length 52)
    172.25.64.219.63562 > 64.233.180.102.443: Flags [.], cksum 0x15cc (correct), ack 10267, win 2048, options [nop,nop,TS val 1527534696 ecr 1718897352], length 0
15:38:53.381859 IP (tos 0x60, ttl 119, id 974, offset 0, flags [none], proto TCP (6), length 447)
    64.233.180.102.443 > 172.25.64.219.63562: Flags [P.], cksum 0x7fb2 (correct), seq 10267:10662, ack 71, win 670, options [nop,nop,TS val 1718897551 ecr 1527534696], length 395
15:38:53.381981 IP (tos 0x0, ttl 64, id 0, offset 0, flags [DF], proto TCP (6), length 52)
    172.25.64.219.63562 > 64.233.180.102.443: Flags [.], cksum 0x12b3 (correct), ack 10662, win 2048, options [nop,nop,TS val 1527534895 ecr 1718897551], length 0
15:38:53.569536 IP (tos 0x60, ttl 119, id 975, offset 0, flags [none], proto TCP (6), length 520)
    64.233.180.102.443 > 172.25.64.219.63562: Flags [P.], cksum 0x3fd2 (correct), seq 10662:11130, ack 71, win 670, options [nop,nop,TS val 1718897738 ecr 1527534895], length 468
15:38:53.569732 IP (tos 0x0, ttl 64, id 0, offset 0, flags [DF], proto TCP (6), length 52)
    172.25.64.219.63562 > 64.233.180.102.443: Flags [.], cksum 0x0f69 (correct), ack 11130, win 2048, options [nop,nop,TS val 1527535082 ecr 1718897738], length 0
15:38:53.912285 IP (tos 0x60, ttl 119, id 976, offset 0, flags [none], proto TCP (6), length 407)
    64.233.180.102.443 > 172.25.64.219.63562: Flags [P.], cksum 0xa982 (correct), seq 11130:11485, ack 71, win 670, options [nop,nop,TS val 1718898013 ecr 1527535082], length 355
15:38:53.913141 IP (tos 0x0, ttl 64, id 0, offset 0, flags [DF], proto TCP (6), length 52)
    172.25.64.219.63562 > 64.233.180.102.443: Flags [.], cksum 0x0b9c (correct), ack 11485, win 2048, options [nop,nop,TS val 1527535425 ecr 1718898013], length 0
15:38:54.044701 IP (tos 0x60, ttl 119, id 977, offset 0, flags [none], proto TCP (6), length 363)
    64.233.180.102.443 > 172.25.64.219.63562: Flags [P.], cksum 0x39c7 (correct), seq 11485:11796, ack 71, win 670, options [nop,nop,TS val 1718898214 ecr 1527535425], length 311
15:38:54.044894 IP (tos 0x0, ttl 64, id 0, offset 0, flags [DF], proto TCP (6), length 52)
    172.25.64.219.63562 > 64.233.180.102.443: Flags [.], cksum 0x0917 (correct), ack 11796, win 2048, options [nop,nop,TS val 1527535558 ecr 1718898214], length 0
15:38:54.208577 IP (tos 0x60, ttl 119, id 978, offset 0, flags [none], proto TCP (6), length 457)
    64.233.180.102.443 > 172.25.64.219.63562: Flags [P.], cksum 0x3335 (correct), seq 11796:12201, ack 71, win 670, options [nop,nop,TS val 1718898378 ecr 1527535558], length 405
15:38:54.208751 IP (tos 0x0, ttl 64, id 0, offset 0, flags [DF], proto TCP (6), length 52)
    172.25.64.219.63562 > 64.233.180.102.443: Flags [.], cksum 0x063b (correct), ack 12201, win 2048, options [nop,nop,TS val 1527535721 ecr 1718898378], length 0
15:38:54.399632 IP (tos 0x60, ttl 119, id 979, offset 0, flags [none], proto TCP (6), length 403)
    64.233.180.102.443 > 172.25.64.219.63562: Flags [P.], cksum 0xeac6 (correct), seq 12201:12552, ack 71, win 670, options [nop,nop,TS val 1718898570 ecr 1527535721], length 351
15:38:54.399754 IP (tos 0x0, ttl 64, id 0, offset 0, flags [DF], proto TCP (6), length 52)
    172.25.64.219.63562 > 64.233.180.102.443: Flags [.], cksum 0x035c (correct), ack 12552, win 2048, options [nop,nop,TS val 1527535913 ecr 1718898570], length 0
15:38:54.553937 IP (tos 0x60, ttl 119, id 980, offset 0, flags [none], proto TCP (6), length 326)
    64.233.180.102.443 > 172.25.64.219.63562: Flags [P.], cksum 0x12b7 (correct), seq 12552:12826, ack 71, win 670, options [nop,nop,TS val 1718898723 ecr 1527535913], length 274
15:38:54.554140 IP (tos 0x0, ttl 64, id 0, offset 0, flags [DF], proto TCP (6), length 52)
    172.25.64.219.63562 > 64.233.180.102.443: Flags [.], cksum 0x0117 (correct), ack 12826, win 2048, options [nop,nop,TS val 1527536067 ecr 1718898723], length 0
15:38:54.731789 IP (tos 0x60, ttl 119, id 981, offset 0, flags [none], proto TCP (6), length 437)
    64.233.180.102.443 > 172.25.64.219.63562: Flags [P.], cksum 0xee8a (correct), seq 12826:13211, ack 71, win 670, options [nop,nop,TS val 1718898901 ecr 1527536067], length 385
15:38:54.731906 IP (tos 0x0, ttl 64, id 0, offset 0, flags [DF], proto TCP (6), length 52)
    172.25.64.219.63562 > 64.233.180.102.443: Flags [.], cksum 0xfe31 (correct), ack 13211, win 2048, options [nop,nop,TS val 1527536245 ecr 1718898901], length 0
15:38:54.923040 IP (tos 0x60, ttl 119, id 982, offset 0, flags [none], proto TCP (6), length 500)
    64.233.180.102.443 > 172.25.64.219.63562: Flags [P.], cksum 0x7c16 (correct), seq 13211:13659, ack 71, win 670, options [nop,nop,TS val 1718899093 ecr 1527536245], length 448
15:38:54.923230 IP (tos 0x0, ttl 64, id 0, offset 0, flags [DF], proto TCP (6), length 52)
    172.25.64.219.63562 > 64.233.180.102.443: Flags [.], cksum 0xfaf2 (correct), ack 13659, win 2048, options [nop,nop,TS val 1527536436 ecr 1718899093], length 0
15:38:55.200355 IP (tos 0x60, ttl 119, id 983, offset 0, flags [none], proto TCP (6), length 370)
    64.233.180.102.443 > 172.25.64.219.63562: Flags [P.], cksum 0x5cef (correct), seq 13659:13977, ack 71, win 670, options [nop,nop,TS val 1718899370 ecr 1527536436], length 318
15:38:55.200532 IP (tos 0x0, ttl 64, id 0, offset 0, flags [DF], proto TCP (6), length 52)
    172.25.64.219.63562 > 64.233.180.102.443: Flags [.], cksum 0xf78a (correct), ack 13977, win 2048, options [nop,nop,TS val 1527536713 ecr 1718899370], length 0
15:38:55.388335 IP (tos 0x60, ttl 119, id 984, offset 0, flags [none], proto TCP (6), length 362)
    64.233.180.102.443 > 172.25.64.219.63562: Flags [P.], cksum 0x3ec8 (correct), seq 13977:14287, ack 71, win 670, options [nop,nop,TS val 1718899558 ecr 1527536713], length 310
15:38:55.388528 IP (tos 0x0, ttl 64, id 0, offset 0, flags [DF], proto TCP (6), length 52)
    172.25.64.219.63562 > 64.233.180.102.443: Flags [.], cksum 0xf4dc (correct), ack 14287, win 2048, options [nop,nop,TS val 1527536901 ecr 1718899558], length 0
15:38:55.600796 IP (tos 0x60, ttl 119, id 985, offset 0, flags [none], proto TCP (6), length 435)
    64.233.180.102.443 > 172.25.64.219.63562: Flags [P.], cksum 0xd1fa (correct), seq 14287:14670, ack 71, win 670, options [nop,nop,TS val 1718899770 ecr 1527536901], length 383
15:38:55.600917 IP (tos 0x0, ttl 64, id 0, offset 0, flags [DF], proto TCP (6), length 52)
    172.25.64.219.63562 > 64.233.180.102.443: Flags [.], cksum 0xf1b4 (correct), ack 14670, win 2048, options [nop,nop,TS val 1527537114 ecr 1718899770], length 0
15:38:55.600994 IP (tos 0x0, ttl 64, id 0, offset 0, flags [DF], proto TCP (6), length 87)
    172.25.64.219.63562 > 64.233.180.102.443: Flags [P.], cksum 0x1331 (correct), seq 71:106, ack 14670, win 2048, options [nop,nop,TS val 1527537114 ecr 1718899770], length 35
15:38:55.601015 IP (tos 0x0, ttl 64, id 0, offset 0, flags [DF], proto TCP (6), length 87)
    172.25.64.219.63562 > 64.233.180.102.443: Flags [P.], cksum 0x99d8 (correct), seq 106:141, ack 14670, win 2048, options [nop,nop,TS val 1527537114 ecr 1718899770], length 35
15:38:55.612444 IP (tos 0x60, ttl 119, id 986, offset 0, flags [none], proto TCP (6), length 52)
    64.233.180.102.443 > 172.25.64.219.63562: Flags [.], cksum 0xf6c4 (correct), ack 141, win 670, options [nop,nop,TS val 1718899782 ecr 1527537114], length 0
15:38:55.856490 IP (tos 0x60, ttl 119, id 987, offset 0, flags [none], proto TCP (6), length 510)
    64.233.180.102.443 > 172.25.64.219.63562: Flags [P.], cksum 0x320e (correct), seq 14670:15128, ack 141, win 670, options [nop,nop,TS val 1718900013 ecr 1527537114], length 458
15:38:55.856665 IP (tos 0x0, ttl 64, id 0, offset 0, flags [DF], proto TCP (6), length 52)
    172.25.64.219.63562 > 64.233.180.102.443: Flags [.], cksum 0xedb2 (correct), ack 15128, win 2048, options [nop,nop,TS val 1527537369 ecr 1718900013], length 0
15:38:56.073175 IP (tos 0x60, ttl 119, id 988, offset 0, flags [none], proto TCP (6), length 510)
    64.233.180.102.443 > 172.25.64.219.63562: Flags [P.], cksum 0xe289 (correct), seq 15128:15586, ack 141, win 670, options [nop,nop,TS val 1718900243 ecr 1527537369], length 458
15:38:56.073372 IP (tos 0x0, ttl 64, id 0, offset 0, flags [DF], proto TCP (6), length 52)
    172.25.64.219.63562 > 64.233.180.102.443: Flags [.], cksum 0xea29 (correct), ack 15586, win 2048, options [nop,nop,TS val 1527537586 ecr 1718900243], length 0
15:38:56.167248 IP (tos 0x60, ttl 119, id 989, offset 0, flags [none], proto TCP (6), length 473)
    64.233.180.102.443 > 172.25.64.219.63562: Flags [P.], cksum 0xdd6d (correct), seq 15586:16007, ack 141, win 670, options [nop,nop,TS val 1718900337 ecr 1527537586], length 421
15:38:56.167457 IP (tos 0x0, ttl 64, id 0, offset 0, flags [DF], proto TCP (6), length 52)
    172.25.64.219.63562 > 64.233.180.102.443: Flags [.], cksum 0xe7c8 (correct), ack 16007, win 2048, options [nop,nop,TS val 1527537680 ecr 1718900337], length 0
15:38:56.386533 IP (tos 0x60, ttl 119, id 990, offset 0, flags [none], proto TCP (6), length 432)
    64.233.180.102.443 > 172.25.64.219.63562: Flags [P.], cksum 0xe2fa (correct), seq 16007:16387, ack 141, win 670, options [nop,nop,TS val 1718900556 ecr 1527537680], length 380
15:38:56.386716 IP (tos 0x0, ttl 64, id 0, offset 0, flags [DF], proto TCP (6), length 52)
    172.25.64.219.63562 > 64.233.180.102.443: Flags [.], cksum 0xe496 (correct), ack 16387, win 2048, options [nop,nop,TS val 1527537899 ecr 1718900556], length 0
15:38:56.561862 IP (tos 0x60, ttl 119, id 991, offset 0, flags [none], proto TCP (6), length 376)
    64.233.180.102.443 > 172.25.64.219.63562: Flags [P.], cksum 0xe74f (correct), seq 16387:16711, ack 141, win 670, options [nop,nop,TS val 1718900732 ecr 1527537899], length 324
15:38:56.562199 IP (tos 0x0, ttl 64, id 0, offset 0, flags [DF], proto TCP (6), length 52)
    172.25.64.219.63562 > 64.233.180.102.443: Flags [.], cksum 0xe1f2 (correct), ack 16711, win 2048, options [nop,nop,TS val 1527538075 ecr 1718900732], length 0
15:38:56.802066 IP (tos 0x60, ttl 119, id 992, offset 0, flags [none], proto TCP (6), length 415)
    64.233.180.102.443 > 172.25.64.219.63562: Flags [P.], cksum 0x6c74 (correct), seq 16711:17074, ack 141, win 670, options [nop,nop,TS val 1718900971 ecr 1527538075], length 363
15:38:56.802263 IP (tos 0x0, ttl 64, id 0, offset 0, flags [DF], proto TCP (6), length 52)
    172.25.64.219.63562 > 64.233.180.102.443: Flags [.], cksum 0xdea8 (correct), ack 17074, win 2048, options [nop,nop,TS val 1527538315 ecr 1718900971], length 0
15:38:57.112470 IP (tos 0x60, ttl 119, id 993, offset 0, flags [none], proto TCP (6), length 446)
    64.233.180.102.443 > 172.25.64.219.63562: Flags [P.], cksum 0x6569 (correct), seq 17074:17468, ack 141, win 670, options [nop,nop,TS val 1718901283 ecr 1527538315], length 394
15:38:57.114641 IP (tos 0x0, ttl 64, id 0, offset 0, flags [DF], proto TCP (6), length 52)
    172.25.64.219.63562 > 64.233.180.102.443: Flags [.], cksum 0xdaae (correct), ack 17468, win 2048, options [nop,nop,TS val 1527538627 ecr 1718901283], length 0
15:38:57.311761 IP (tos 0x60, ttl 119, id 994, offset 0, flags [none], proto TCP (6), length 522)
    64.233.180.102.443 > 172.25.64.219.63562: Flags [P.], cksum 0x963a (correct), seq 17468:17938, ack 141, win 670, options [nop,nop,TS val 1718901481 ecr 1527538627], length 470
15:38:57.311997 IP (tos 0x0, ttl 64, id 0, offset 0, flags [DF], proto TCP (6), length 52)
    172.25.64.219.63562 > 64.233.180.102.443: Flags [.], cksum 0xd74c (correct), ack 17938, win 2048, options [nop,nop,TS val 1527538825 ecr 1718901481], length 0
15:38:57.476234 IP (tos 0x60, ttl 119, id 995, offset 0, flags [none], proto TCP (6), length 539)
    64.233.180.102.443 > 172.25.64.219.63562: Flags [P.], cksum 0x08a0 (correct), seq 17938:18425, ack 141, win 670, options [nop,nop,TS val 1718901646 ecr 1527538825], length 487
15:38:57.476437 IP (tos 0x0, ttl 64, id 0, offset 0, flags [DF], proto TCP (6), length 52)
    172.25.64.219.63562 > 64.233.180.102.443: Flags [.], cksum 0xd41c (correct), ack 18425, win 2048, options [nop,nop,TS val 1527538989 ecr 1718901646], length 0
15:38:57.673117 IP (tos 0x60, ttl 119, id 996, offset 0, flags [none], proto TCP (6), length 551)
    64.233.180.102.443 > 172.25.64.219.63562: Flags [P.], cksum 0xe7cc (correct), seq 18425:18924, ack 141, win 670, options [nop,nop,TS val 1718901842 ecr 1527538989], length 499
15:38:57.673340 IP (tos 0x0, ttl 64, id 0, offset 0, flags [DF], proto TCP (6), length 52)
    172.25.64.219.63562 > 64.233.180.102.443: Flags [.], cksum 0xd0a0 (correct), ack 18924, win 2048, options [nop,nop,TS val 1527539186 ecr 1718901842], length 0
15:38:57.838787 IP (tos 0x60, ttl 119, id 997, offset 0, flags [none], proto TCP (6), length 613)
    64.233.180.102.443 > 172.25.64.219.63562: Flags [P.], cksum 0x5005 (correct), seq 18924:19485, ack 141, win 670, options [nop,nop,TS val 1718902008 ecr 1527539186], length 561
15:38:57.838967 IP (tos 0x0, ttl 64, id 0, offset 0, flags [DF], proto TCP (6), length 52)
    172.25.64.219.63562 > 64.233.180.102.443: Flags [.], cksum 0xcd23 (correct), ack 19485, win 2048, options [nop,nop,TS val 1527539352 ecr 1718902008], length 0
15:38:58.020776 IP (tos 0x60, ttl 119, id 998, offset 0, flags [none], proto TCP (6), length 384)
    64.233.180.102.443 > 172.25.64.219.63562: Flags [P.], cksum 0x6c81 (correct), seq 19485:19817, ack 141, win 670, options [nop,nop,TS val 1718902190 ecr 1527539352], length 332
15:38:58.020986 IP (tos 0x0, ttl 64, id 0, offset 0, flags [DF], proto TCP (6), length 52)
    172.25.64.219.63562 > 64.233.180.102.443: Flags [.], cksum 0xca6b (correct), ack 19817, win 2048, options [nop,nop,TS val 1527539534 ecr 1718902190], length 0
15:38:58.196488 IP (tos 0x60, ttl 119, id 999, offset 0, flags [none], proto TCP (6), length 597)
    64.233.180.102.443 > 172.25.64.219.63562: Flags [P.], cksum 0x7963 (correct), seq 19817:20362, ack 141, win 670, options [nop,nop,TS val 1718902366 ecr 1527539534], length 545
15:38:58.196692 IP (tos 0x0, ttl 64, id 0, offset 0, flags [DF], proto TCP (6), length 52)
    172.25.64.219.63562 > 64.233.180.102.443: Flags [.], cksum 0xc6eb (correct), ack 20362, win 2048, options [nop,nop,TS val 1527539709 ecr 1718902366], length 0
15:38:58.401606 IP (tos 0x60, ttl 119, id 1000, offset 0, flags [none], proto TCP (6), length 382)
    64.233.180.102.443 > 172.25.64.219.63562: Flags [P.], cksum 0x612b (correct), seq 20362:20692, ack 141, win 670, options [nop,nop,TS val 1718902571 ecr 1527539709], length 330
15:38:58.401787 IP (tos 0x0, ttl 64, id 0, offset 0, flags [DF], proto TCP (6), length 52)
    172.25.64.219.63562 > 64.233.180.102.443: Flags [.], cksum 0xc407 (correct), ack 20692, win 2048, options [nop,nop,TS val 1527539914 ecr 1718902571], length 0
15:38:58.567595 IP (tos 0x60, ttl 119, id 1001, offset 0, flags [none], proto TCP (6), length 379)
    64.233.180.102.443 > 172.25.64.219.63562: Flags [P.], cksum 0xc158 (correct), seq 20692:21019, ack 141, win 670, options [nop,nop,TS val 1718902736 ecr 1527539914], length 327
15:38:58.567805 IP (tos 0x0, ttl 64, id 0, offset 0, flags [DF], proto TCP (6), length 52)
    172.25.64.219.63562 > 64.233.180.102.443: Flags [.], cksum 0xc175 (correct), ack 21019, win 2048, options [nop,nop,TS val 1527540080 ecr 1718902736], length 0
15:38:58.774127 IP (tos 0x60, ttl 119, id 1002, offset 0, flags [none], proto TCP (6), length 477)
    64.233.180.102.443 > 172.25.64.219.63562: Flags [P.], cksum 0xb9fe (correct), seq 21019:21444, ack 141, win 670, options [nop,nop,TS val 1718902940 ecr 1527540080], length 425
15:38:58.774364 IP (tos 0x0, ttl 64, id 0, offset 0, flags [DF], proto TCP (6), length 52)
    172.25.64.219.63562 > 64.233.180.102.443: Flags [.], cksum 0xbe31 (correct), ack 21444, win 2048, options [nop,nop,TS val 1527540287 ecr 1718902940], length 0
15:38:58.934983 IP (tos 0x60, ttl 119, id 1003, offset 0, flags [none], proto TCP (6), length 496)
    64.233.180.102.443 > 172.25.64.219.63562: Flags [P.], cksum 0x26ea (correct), seq 21444:21888, ack 141, win 670, options [nop,nop,TS val 1718903104 ecr 1527540287], length 444
15:38:58.935183 IP (tos 0x0, ttl 64, id 0, offset 0, flags [DF], proto TCP (6), length 52)
    172.25.64.219.63562 > 64.233.180.102.443: Flags [.], cksum 0xbb30 (correct), ack 21888, win 2048, options [nop,nop,TS val 1527540448 ecr 1718903104], length 0
15:38:59.141866 IP (tos 0x60, ttl 119, id 1004, offset 0, flags [none], proto TCP (6), length 449)
    64.233.180.102.443 > 172.25.64.219.63562: Flags [P.], cksum 0x2b88 (correct), seq 21888:22285, ack 141, win 670, options [nop,nop,TS val 1718903303 ecr 1527540448], length 397
15:38:59.142056 IP (tos 0x0, ttl 64, id 0, offset 0, flags [DF], proto TCP (6), length 52)
    172.25.64.219.63562 > 64.233.180.102.443: Flags [.], cksum 0xb80d (correct), ack 22285, win 2048, options [nop,nop,TS val 1527540655 ecr 1718903303], length 0
15:38:59.362565 IP (tos 0x60, ttl 119, id 1005, offset 0, flags [none], proto TCP (6), length 460)
    64.233.180.102.443 > 172.25.64.219.63562: Flags [P.], cksum 0x234f (correct), seq 22285:22693, ack 141, win 670, options [nop,nop,TS val 1718903532 ecr 1527540655], length 408
15:38:59.363243 IP (tos 0x0, ttl 64, id 0, offset 0, flags [DF], proto TCP (6), length 52)
    172.25.64.219.63562 > 64.233.180.102.443: Flags [.], cksum 0xb4b4 (correct), ack 22693, win 2048, options [nop,nop,TS val 1527540875 ecr 1718903532], length 0
15:38:59.536384 IP (tos 0x60, ttl 119, id 1006, offset 0, flags [none], proto TCP (6), length 583)
    64.233.180.102.443 > 172.25.64.219.63562: Flags [P.], cksum 0x789c (correct), seq 22693:23224, ack 141, win 670, options [nop,nop,TS val 1718903706 ecr 1527540875], length 531
15:38:59.536578 IP (tos 0x0, ttl 64, id 0, offset 0, flags [DF], proto TCP (6), length 52)
    172.25.64.219.63562 > 64.233.180.102.443: Flags [.], cksum 0xb145 (correct), ack 23224, win 2048, options [nop,nop,TS val 1527541049 ecr 1718903706], length 0
15:38:59.734099 IP (tos 0x60, ttl 119, id 1007, offset 0, flags [none], proto TCP (6), length 382)
    64.233.180.102.443 > 172.25.64.219.63562: Flags [P.], cksum 0xae16 (correct), seq 23224:23554, ack 141, win 670, options [nop,nop,TS val 1718903903 ecr 1527541049], length 330
15:38:59.734266 IP (tos 0x0, ttl 64, id 0, offset 0, flags [DF], proto TCP (6), length 52)
    172.25.64.219.63562 > 64.233.180.102.443: Flags [.], cksum 0xae70 (correct), ack 23554, win 2048, options [nop,nop,TS val 1527541247 ecr 1718903903], length 0
15:38:59.878211 IP (tos 0x60, ttl 119, id 1008, offset 0, flags [none], proto TCP (6), length 353)
    64.233.180.102.443 > 172.25.64.219.63562: Flags [P.], cksum 0xbd63 (correct), seq 23554:23855, ack 141, win 670, options [nop,nop,TS val 1718904048 ecr 1527541247], length 301
15:38:59.878396 IP (tos 0x0, ttl 64, id 0, offset 0, flags [DF], proto TCP (6), length 52)
    172.25.64.219.63562 > 64.233.180.102.443: Flags [.], cksum 0xac22 (correct), ack 23855, win 2048, options [nop,nop,TS val 1527541391 ecr 1718904048], length 0
15:39:00.083318 IP (tos 0x60, ttl 119, id 1009, offset 0, flags [none], proto TCP (6), length 536)
    64.233.180.102.443 > 172.25.64.219.63562: Flags [P.], cksum 0x0943 (correct), seq 23855:24339, ack 141, win 670, options [nop,nop,TS val 1718904252 ecr 1527541391], length 484
15:39:00.083508 IP (tos 0x0, ttl 64, id 0, offset 0, flags [DF], proto TCP (6), length 52)
    172.25.64.219.63562 > 64.233.180.102.443: Flags [.], cksum 0xa8a5 (correct), ack 24339, win 2048, options [nop,nop,TS val 1527541596 ecr 1718904252], length 0
15:39:00.247341 IP (tos 0x60, ttl 119, id 1010, offset 0, flags [none], proto TCP (6), length 408)
    64.233.180.102.443 > 172.25.64.219.63562: Flags [P.], cksum 0x11c2 (correct), seq 24339:24695, ack 141, win 670, options [nop,nop,TS val 1718904416 ecr 1527541596], length 356
15:39:00.247521 IP (tos 0x0, ttl 64, id 0, offset 0, flags [DF], proto TCP (6), length 52)
    172.25.64.219.63562 > 64.233.180.102.443: Flags [.], cksum 0xa5f9 (correct), ack 24695, win 2048, options [nop,nop,TS val 1527541760 ecr 1718904416], length 0
15:39:00.425334 IP (tos 0x60, ttl 119, id 1011, offset 0, flags [none], proto TCP (6), length 352)
    64.233.180.102.443 > 172.25.64.219.63562: Flags [P.], cksum 0xba01 (correct), seq 24695:24995, ack 141, win 670, options [nop,nop,TS val 1718904594 ecr 1527541760], length 300
15:39:00.425462 IP (tos 0x0, ttl 64, id 0, offset 0, flags [DF], proto TCP (6), length 52)
    172.25.64.219.63562 > 64.233.180.102.443: Flags [.], cksum 0xa369 (correct), ack 24995, win 2048, options [nop,nop,TS val 1527541938 ecr 1718904594], length 0
15:39:00.581360 IP (tos 0x60, ttl 119, id 1012, offset 0, flags [none], proto TCP (6), length 611)
    64.233.180.102.443 > 172.25.64.219.63562: Flags [P.], cksum 0x2913 (correct), seq 24995:25554, ack 141, win 670, options [nop,nop,TS val 1718904750 ecr 1527541938], length 559
15:39:00.581552 IP (tos 0x0, ttl 64, id 0, offset 0, flags [DF], proto TCP (6), length 52)
    172.25.64.219.63562 > 64.233.180.102.443: Flags [.], cksum 0xa002 (correct), ack 25554, win 2048, options [nop,nop,TS val 1527542094 ecr 1718904750], length 0
15:39:00.773173 IP (tos 0x60, ttl 119, id 1013, offset 0, flags [none], proto TCP (6), length 540)
    64.233.180.102.443 > 172.25.64.219.63562: Flags [P.], cksum 0x7e21 (correct), seq 25554:26042, ack 141, win 670, options [nop,nop,TS val 1718904942 ecr 1527542094], length 488
15:39:00.773360 IP (tos 0x0, ttl 64, id 0, offset 0, flags [DF], proto TCP (6), length 52)
    172.25.64.219.63562 > 64.233.180.102.443: Flags [.], cksum 0x9c9a (correct), ack 26042, win 2048, options [nop,nop,TS val 1527542286 ecr 1718904942], length 0
15:39:00.773445 IP (tos 0x0, ttl 64, id 0, offset 0, flags [DF], proto TCP (6), length 87)
    172.25.64.219.63562 > 64.233.180.102.443: Flags [P.], cksum 0xc6a6 (correct), seq 141:176, ack 26042, win 2048, options [nop,nop,TS val 1527542286 ecr 1718904942], length 35
15:39:00.773467 IP (tos 0x0, ttl 64, id 0, offset 0, flags [DF], proto TCP (6), length 87)
    172.25.64.219.63562 > 64.233.180.102.443: Flags [P.], cksum 0x3a25 (correct), seq 176:211, ack 26042, win 2048, options [nop,nop,TS val 1527542286 ecr 1718904942], length 35
15:39:00.791984 IP (tos 0x60, ttl 119, id 1014, offset 0, flags [none], proto TCP (6), length 52)
    64.233.180.102.443 > 172.25.64.219.63562: Flags [.], cksum 0xa1a9 (correct), ack 211, win 670, options [nop,nop,TS val 1718904955 ecr 1527542286], length 0
15:39:00.938769 IP (tos 0x60, ttl 119, id 1015, offset 0, flags [none], proto TCP (6), length 644)
    64.233.180.102.443 > 172.25.64.219.63562: Flags [P.], cksum 0xa418 (correct), seq 26042:26634, ack 211, win 670, options [nop,nop,TS val 1718905109 ecr 1527542286], length 592
