tcpdump: data link type PKTAP
tcpdump: WARNING: snaplen raised from 96 to 524288
tcpdump: listening on pktap, link-type PKTAP (Apple DLT_PKTAP), snapshot length 524288 bytes
16:04:30.609745 IP (tos 0x0, ttl 64, id 0, offset 0, flags [DF], proto TCP (6), length 1422)
    172.25.101.53.57985 > 142.251.16.102.443: Flags [.], cksum 0x3e24 (correct), seq 2402286689:2402288059, ack 2966220904, win 2305, options [nop,nop,TS val 3480467038 ecr 2631319039], length 1370
16:04:30.609748 IP (tos 0x0, ttl 64, id 1, offset 0, flags [DF], proto TCP (6), length 1422)
    172.25.101.53.57985 > 142.251.16.102.443: Flags [.], cksum 0xfdb8 (correct), seq 1370:2740, ack 1, win 2305, options [nop,nop,TS val 3480467038 ecr 2631319039], length 1370
16:04:30.609820 IP (tos 0x0, ttl 64, id 0, offset 0, flags [DF], proto TCP (6), length 349)
    172.25.101.53.57985 > 142.251.16.102.443: Flags [P.], cksum 0x68b0 (correct), seq 2740:3037, ack 1, win 2305, options [nop,nop,TS val 3480467038 ecr 2631319039], length 297
16:04:30.609875 IP (tos 0x0, ttl 64, id 0, offset 0, flags [DF], proto TCP (6), length 91)
    172.25.101.53.57985 > 142.251.16.102.443: Flags [P.], cksum 0xc487 (correct), seq 3037:3076, ack 1, win 2305, options [nop,nop,TS val 3480467038 ecr 2631319039], length 39
16:04:30.609896 IP (tos 0x0, ttl 64, id 0, offset 0, flags [DF], proto TCP (6), length 557)
    172.25.101.53.57985 > 142.251.16.102.443: Flags [P.], cksum 0x2399 (correct), seq 3076:3581, ack 1, win 2305, options [nop,nop,TS val 3480467038 ecr 2631319039], length 505
16:04:30.622993 IP (tos 0x80, ttl 119, id 29588, offset 0, flags [none], proto TCP (6), length 52)
    142.251.16.102.443 > 172.25.101.53.57985: Flags [.], cksum 0x8095 (correct), ack 2740, win 4006, options [nop,nop,TS val 2631333744 ecr 3480467038], length 0
16:04:30.622994 IP (tos 0x80, ttl 119, id 29589, offset 0, flags [none], proto TCP (6), length 52)
    142.251.16.102.443 > 172.25.101.53.57985: Flags [.], cksum 0x7d4c (correct), ack 3581, win 4006, options [nop,nop,TS val 2631333744 ecr 3480467038], length 0
16:04:30.622994 IP (tos 0x80, ttl 119, id 29590, offset 0, flags [none], proto TCP (6), length 91)
    142.251.16.102.443 > 172.25.101.53.57985: Flags [P.], cksum 0xe9ba (correct), seq 1:40, ack 3581, win 4006, options [nop,nop,TS val 2631333744 ecr 3480467038], length 39
16:04:30.623124 IP (tos 0x0, ttl 64, id 0, offset 0, flags [DF], proto TCP (6), length 52)
    172.25.101.53.57985 > 142.251.16.102.443: Flags [.], cksum 0x83bc (correct), ack 40, win 2305, options [nop,nop,TS val 3480467052 ecr 2631333744], length 0
16:04:30.644018 IP (tos 0x80, ttl 119, id 29591, offset 0, flags [none], proto TCP (6), length 601)
    142.251.16.102.443 > 172.25.101.53.57985: Flags [P.], cksum 0x854f (correct), seq 40:589, ack 3581, win 4006, options [nop,nop,TS val 2631333763 ecr 3480467052], length 549
16:04:30.644019 IP (tos 0x80, ttl 119, id 29592, offset 0, flags [none], proto TCP (6), length 322)
    142.251.16.102.443 > 172.25.101.53.57985: Flags [P.], cksum 0x6526 (correct), seq 589:859, ack 3581, win 4006, options [nop,nop,TS val 2631333763 ecr 3480467052], length 270
16:04:30.644020 IP (tos 0x80, ttl 119, id 29593, offset 0, flags [none], proto TCP (6), length 83)
    142.251.16.102.443 > 172.25.101.53.57985: Flags [P.], cksum 0xc72d (correct), seq 859:890, ack 3581, win 4006, options [nop,nop,TS val 2631333763 ecr 3480467052], length 31
16:04:30.644020 IP (tos 0x80, ttl 119, id 29594, offset 0, flags [none], proto TCP (6), length 91)
    142.251.16.102.443 > 172.25.101.53.57985: Flags [P.], cksum 0xdd28 (correct), seq 890:929, ack 3581, win 4006, options [nop,nop,TS val 2631333763 ecr 3480467052], length 39
16:04:30.644131 IP (tos 0x0, ttl 64, id 0, offset 0, flags [DF], proto TCP (6), length 52)
    172.25.101.53.57985 > 142.251.16.102.443: Flags [.], cksum 0x8028 (correct), ack 929, win 2292, options [nop,nop,TS val 3480467073 ecr 2631333763], length 0
16:04:30.646137 IP (tos 0x0, ttl 64, id 0, offset 0, flags [DF], proto TCP (6), length 87)
    172.25.101.53.57985 > 142.251.16.102.443: Flags [P.], cksum 0x9861 (correct), seq 3581:3616, ack 929, win 2305, options [nop,nop,TS val 3480467075 ecr 2631333763], length 35
16:04:30.646233 IP (tos 0x0, ttl 64, id 0, offset 0, flags [DF], proto TCP (6), length 91)
    172.25.101.53.57985 > 142.251.16.102.443: Flags [P.], cksum 0xdcaf (correct), seq 3616:3655, ack 929, win 2305, options [nop,nop,TS val 3480467075 ecr 2631333763], length 39
16:04:30.656638 IP (tos 0x80, ttl 119, id 29595, offset 0, flags [none], proto TCP (6), length 52)
    142.251.16.102.443 > 172.25.101.53.57985: Flags [.], cksum 0x791b (correct), ack 3655, win 4006, options [nop,nop,TS val 2631333778 ecr 3480467075], length 0
16:04:35.840034 IP (tos 0x0, ttl 64, id 0, offset 0, flags [DF], proto TCP (6), length 1422)
    172.25.101.53.57985 > 142.251.16.102.443: Flags [.], cksum 0x8f21 (correct), seq 3655:5025, ack 929, win 2305, options [nop,nop,TS val 3480472269 ecr 2631333778], length 1370
16:04:35.840037 IP (tos 0x0, ttl 64, id 1, offset 0, flags [DF], proto TCP (6), length 1422)
    172.25.101.53.57985 > 142.251.16.102.443: Flags [.], cksum 0x3ea9 (correct), seq 5025:6395, ack 929, win 2305, options [nop,nop,TS val 3480472269 ecr 2631333778], length 1370
16:04:35.840093 IP (tos 0x0, ttl 64, id 0, offset 0, flags [DF], proto TCP (6), length 345)
    172.25.101.53.57985 > 142.251.16.102.443: Flags [P.], cksum 0xfb71 (correct), seq 6395:6688, ack 929, win 2305, options [nop,nop,TS val 3480472269 ecr 2631333778], length 293
16:04:35.840135 IP (tos 0x0, ttl 64, id 0, offset 0, flags [DF], proto TCP (6), length 767)
    172.25.101.53.57985 > 142.251.16.102.443: Flags [P.], cksum 0x03f2 (correct), seq 6688:7403, ack 929, win 2305, options [nop,nop,TS val 3480472269 ecr 2631333778], length 715
16:04:35.855212 IP (tos 0x80, ttl 119, id 29596, offset 0, flags [none], proto TCP (6), length 64)
    142.251.16.102.443 > 172.25.101.53.57985: Flags [.], cksum 0xcac8 (correct), ack 5025, win 4017, options [nop,nop,TS val 2631338976 ecr 3480472269,nop,nop,sack 1 {6395:6688}], length 0
16:04:35.855213 IP (tos 0x80, ttl 119, id 29597, offset 0, flags [none], proto TCP (6), length 52)
    142.251.16.102.443 > 172.25.101.53.57985: Flags [.], cksum 0x4494 (correct), ack 6688, win 4028, options [nop,nop,TS val 2631338976 ecr 3480472269], length 0
16:04:35.860152 IP (tos 0x80, ttl 119, id 29598, offset 0, flags [none], proto TCP (6), length 52)
    142.251.16.102.443 > 172.25.101.53.57985: Flags [.], cksum 0x41b9 (correct), ack 7403, win 4039, options [nop,nop,TS val 2631338981 ecr 3480472269], length 0
16:04:35.871965 IP (tos 0x80, ttl 119, id 29599, offset 0, flags [none], proto TCP (6), length 604)
    142.251.16.102.443 > 172.25.101.53.57985: Flags [P.], cksum 0xce45 (correct), seq 929:1481, ack 7403, win 4039, options [nop,nop,TS val 2631338992 ecr 3480472269], length 552
16:04:35.871966 IP (tos 0x80, ttl 119, id 29600, offset 0, flags [none], proto TCP (6), length 382)
    142.251.16.102.443 > 172.25.101.53.57985: Flags [P.], cksum 0x5133 (correct), seq 1481:1811, ack 7403, win 4039, options [nop,nop,TS val 2631338992 ecr 3480472269], length 330
16:04:35.871967 IP (tos 0x80, ttl 119, id 29601, offset 0, flags [none], proto TCP (6), length 83)
    142.251.16.102.443 > 172.25.101.53.57985: Flags [P.], cksum 0xa8ee (correct), seq 1811:1842, ack 7403, win 4039, options [nop,nop,TS val 2631338992 ecr 3480472269], length 31
16:04:35.871967 IP (tos 0x80, ttl 119, id 29602, offset 0, flags [none], proto TCP (6), length 91)
    142.251.16.102.443 > 172.25.101.53.57985: Flags [P.], cksum 0xe977 (correct), seq 1842:1881, ack 7403, win 4039, options [nop,nop,TS val 2631338992 ecr 3480472269], length 39
16:04:35.872029 IP (tos 0x0, ttl 64, id 0, offset 0, flags [DF], proto TCP (6), length 52)
    172.25.101.53.57985 > 142.251.16.102.443: Flags [.], cksum 0x44aa (correct), ack 1881, win 2291, options [nop,nop,TS val 3480472301 ecr 2631338992], length 0
16:04:35.873742 IP (tos 0x0, ttl 64, id 0, offset 0, flags [DF], proto TCP (6), length 87)
    172.25.101.53.57985 > 142.251.16.102.443: Flags [P.], cksum 0xcf76 (correct), seq 7403:7438, ack 1881, win 2305, options [nop,nop,TS val 3480472302 ecr 2631338992], length 35
16:04:35.873897 IP (tos 0x0, ttl 64, id 0, offset 0, flags [DF], proto TCP (6), length 91)
    172.25.101.53.57985 > 142.251.16.102.443: Flags [P.], cksum 0xc797 (correct), seq 7438:7477, ack 1881, win 2305, options [nop,nop,TS val 3480472302 ecr 2631338992], length 39
16:04:35.884321 IP (tos 0x80, ttl 119, id 29603, offset 0, flags [none], proto TCP (6), length 52)
    142.251.16.102.443 > 172.25.101.53.57985: Flags [.], cksum 0x3d7e (correct), ack 7477, win 4039, options [nop,nop,TS val 2631339005 ecr 3480472302], length 0
16:04:37.199956 IP (tos 0x0, ttl 64, id 0, offset 0, flags [DF], proto TCP (6), length 1422)
    172.25.101.53.57985 > 142.251.16.102.443: Flags [.], cksum 0x950f (correct), seq 7477:8847, ack 1881, win 2305, options [nop,nop,TS val 3480473628 ecr 2631339005], length 1370
16:04:37.199958 IP (tos 0x0, ttl 64, id 1, offset 0, flags [DF], proto TCP (6), length 1422)
    172.25.101.53.57985 > 142.251.16.102.443: Flags [.], cksum 0xd230 (correct), seq 8847:10217, ack 1881, win 2305, options [nop,nop,TS val 3480473628 ecr 2631339005], length 1370
16:04:37.199997 IP (tos 0x0, ttl 64, id 0, offset 0, flags [DF], proto TCP (6), length 956)
    172.25.101.53.57985 > 142.251.16.102.443: Flags [P.], cksum 0xb02c (correct), seq 10217:11121, ack 1881, win 2305, options [nop,nop,TS val 3480473628 ecr 2631339005], length 904
16:04:37.200032 IP (tos 0x0, ttl 64, id 0, offset 0, flags [DF], proto TCP (6), length 250)
    172.25.101.53.57985 > 142.251.16.102.443: Flags [P.], cksum 0xae51 (correct), seq 11121:11319, ack 1881, win 2305, options [nop,nop,TS val 3480473628 ecr 2631339005], length 198
16:04:37.205896 IP (tos 0x0, ttl 64, id 0, offset 0, flags [DF], proto TCP (6), length 1422)
    172.25.101.53.57985 > 142.251.16.102.443: Flags [.], cksum 0x4169 (correct), seq 11319:12689, ack 1881, win 2305, options [nop,nop,TS val 3480473634 ecr 2631339005], length 1370
16:04:37.205897 IP (tos 0x0, ttl 64, id 1, offset 0, flags [DF], proto TCP (6), length 1422)
    172.25.101.53.57985 > 142.251.16.102.443: Flags [.], cksum 0xde25 (correct), seq 12689:14059, ack 1881, win 2305, options [nop,nop,TS val 3480473634 ecr 2631339005], length 1370
16:04:37.205925 IP (tos 0x0, ttl 64, id 0, offset 0, flags [DF], proto TCP (6), length 1020)
    172.25.101.53.57985 > 142.251.16.102.443: Flags [P.], cksum 0x3602 (correct), seq 14059:15027, ack 1881, win 2305, options [nop,nop,TS val 3480473634 ecr 2631339005], length 968
16:04:37.205950 IP (tos 0x0, ttl 64, id 0, offset 0, flags [DF], proto TCP (6), length 1422)
    172.25.101.53.57985 > 142.251.16.102.443: Flags [.], cksum 0x2e0f (correct), seq 15027:16397, ack 1881, win 2305, options [nop,nop,TS val 3480473634 ecr 2631339005], length 1370
16:04:37.205954 IP (tos 0x0, ttl 64, id 0, offset 0, flags [DF], proto TCP (6), length 1341)
    172.25.101.53.57985 > 142.251.16.102.443: Flags [P.], cksum 0xe2d3 (correct), seq 16397:17686, ack 1881, win 2305, options [nop,nop,TS val 3480473634 ecr 2631339005], length 1289
16:04:37.208773 IP (tos 0x0, ttl 64, id 0, offset 0, flags [DF], proto TCP (6), length 1422)
    172.25.101.53.57985 > 142.251.16.102.443: Flags [.], cksum 0xab6d (correct), seq 17686:19056, ack 1881, win 2305, options [nop,nop,TS val 3480473637 ecr 2631339005], length 1370
16:04:37.208774 IP (tos 0x0, ttl 64, id 1, offset 0, flags [DF], proto TCP (6), length 1422)
    172.25.101.53.57985 > 142.251.16.102.443: Flags [.], cksum 0x956e (correct), seq 19056:20426, ack 1881, win 2305, options [nop,nop,TS val 3480473637 ecr 2631339005], length 1370
16:04:37.208791 IP (tos 0x0, ttl 64, id 0, offset 0, flags [DF], proto TCP (6), length 347)
    172.25.101.53.57985 > 142.251.16.102.443: Flags [P.], cksum 0x4662 (correct), seq 20426:20721, ack 1881, win 2305, options [nop,nop,TS val 3480473637 ecr 2631339005], length 295
16:04:37.208806 IP (tos 0x0, ttl 64, id 0, offset 0, flags [DF], proto TCP (6), length 711)
    172.25.101.53.57985 > 142.251.16.102.443: Flags [P.], cksum 0x91ea (correct), seq 20721:21380, ack 1881, win 2305, options [nop,nop,TS val 3480473637 ecr 2631339005], length 659
16:04:37.210823 IP (tos 0x80, ttl 119, id 29604, offset 0, flags [none], proto TCP (6), length 52)
    142.251.16.102.443 > 172.25.101.53.57985: Flags [.], cksum 0x2858 (correct), ack 10217, win 4060, options [nop,nop,TS val 2631340332 ecr 3480473628], length 0
16:04:37.210824 IP (tos 0x80, ttl 119, id 29605, offset 0, flags [none], proto TCP (6), length 52)
    142.251.16.102.443 > 172.25.101.53.57985: Flags [.], cksum 0x23ff (correct), ack 11319, win 4071, options [nop,nop,TS val 2631340332 ecr 3480473628], length 0
16:04:37.216473 IP (tos 0x60, ttl 119, id 29606, offset 0, flags [none], proto TCP (6), length 52)
    142.251.16.102.443 > 172.25.101.53.57985: Flags [.], cksum 0x192a (correct), ack 14059, win 4093, options [nop,nop,TS val 2631340337 ecr 3480473634], length 0
16:04:37.216474 IP (tos 0x60, ttl 119, id 29607, offset 0, flags [none], proto TCP (6), length 52)
    142.251.16.102.443 > 172.25.101.53.57985: Flags [.], cksum 0x0ff2 (correct), ack 16397, win 4114, options [nop,nop,TS val 2631340338 ecr 3480473634], length 0
16:04:37.219263 IP (tos 0x60, ttl 119, id 29608, offset 0, flags [none], proto TCP (6), length 52)
    142.251.16.102.443 > 172.25.101.53.57985: Flags [.], cksum 0x0577 (correct), ack 19056, win 4136, options [nop,nop,TS val 2631340340 ecr 3480473634], length 0
16:04:37.219264 IP (tos 0x60, ttl 119, id 29609, offset 0, flags [none], proto TCP (6), length 64)
    142.251.16.102.443 > 172.25.101.53.57985: Flags [.], cksum 0x1781 (correct), ack 19056, win 4136, options [nop,nop,TS val 2631340340 ecr 3480473634,nop,nop,sack 1 {20426:20721}], length 0
16:04:37.219264 IP (tos 0x60, ttl 119, id 29610, offset 0, flags [none], proto TCP (6), length 52)
    142.251.16.102.443 > 172.25.101.53.57985: Flags [.], cksum 0xfc49 (correct), ack 21380, win 4158, options [nop,nop,TS val 2631340340 ecr 3480473637], length 0
16:04:37.233489 IP (tos 0x80, ttl 119, id 29611, offset 0, flags [none], proto TCP (6), length 599)
    142.251.16.102.443 > 172.25.101.53.57985: Flags [P.], cksum 0xe192 (correct), seq 1881:2428, ack 21380, win 4158, options [nop,nop,TS val 2631340354 ecr 3480473637], length 547
16:04:37.233490 IP (tos 0x80, ttl 119, id 29612, offset 0, flags [none], proto TCP (6), length 348)
    142.251.16.102.443 > 172.25.101.53.57985: Flags [P.], cksum 0x9aed (correct), seq 2428:2724, ack 21380, win 4158, options [nop,nop,TS val 2631340354 ecr 3480473637], length 296
16:04:37.233490 IP (tos 0x80, ttl 119, id 29613, offset 0, flags [none], proto TCP (6), length 83)
    142.251.16.102.443 > 172.25.101.53.57985: Flags [P.], cksum 0xc3ca (correct), seq 2724:2755, ack 21380, win 4158, options [nop,nop,TS val 2631340354 ecr 3480473637], length 31
16:04:37.233490 IP (tos 0x60, ttl 119, id 29614, offset 0, flags [none], proto TCP (6), length 91)
    142.251.16.102.443 > 172.25.101.53.57985: Flags [P.], cksum 0x1b40 (correct), seq 2755:2794, ack 21380, win 4158, options [nop,nop,TS val 2631340354 ecr 3480473637], length 39
16:04:37.233535 IP (tos 0x0, ttl 64, id 0, offset 0, flags [DF], proto TCP (6), length 52)
    172.25.101.53.57985 > 142.251.16.102.443: Flags [.], cksum 0x0003 (correct), ack 2755, win 2292, options [nop,nop,TS val 3480473662 ecr 2631340354], length 0
16:04:37.233576 IP (tos 0x0, ttl 64, id 0, offset 0, flags [DF], proto TCP (6), length 52)
    172.25.101.53.57985 > 142.251.16.102.443: Flags [.], cksum 0xffdb (correct), ack 2794, win 2292, options [nop,nop,TS val 3480473662 ecr 2631340354], length 0
16:04:37.234135 IP (tos 0x0, ttl 64, id 0, offset 0, flags [DF], proto TCP (6), length 91)
    172.25.101.53.57985 > 142.251.16.102.443: Flags [P.], cksum 0xf13f (correct), seq 21380:21419, ack 2794, win 2305, options [nop,nop,TS val 3480473662 ecr 2631340354], length 39
16:04:37.251120 IP (tos 0x60, ttl 119, id 29615, offset 0, flags [none], proto TCP (6), length 52)
    142.251.16.102.443 > 172.25.101.53.57985: Flags [.], cksum 0xf859 (correct), ack 21419, win 4158, options [nop,nop,TS val 2631340371 ecr 3480473662], length 0
16:04:37.303708 IP (tos 0x60, ttl 119, id 29616, offset 0, flags [none], proto TCP (6), length 583)
    142.251.16.102.443 > 172.25.101.53.57985: Flags [P.], cksum 0x06d3 (correct), seq 2794:3325, ack 21419, win 4158, options [nop,nop,TS val 2631340423 ecr 3480473662], length 531
16:04:37.303708 IP (tos 0x60, ttl 119, id 29617, offset 0, flags [none], proto TCP (6), length 428)
    142.251.16.102.443 > 172.25.101.53.57985: Flags [P.], cksum 0x1e42 (correct), seq 3325:3701, ack 21419, win 4158, options [nop,nop,TS val 2631340423 ecr 3480473662], length 376
16:04:37.303734 IP (tos 0x0, ttl 64, id 0, offset 0, flags [DF], proto TCP (6), length 52)
    172.25.101.53.57985 > 142.251.16.102.443: Flags [.], cksum 0xfb9f (correct), ack 3701, win 2291, options [nop,nop,TS val 3480473732 ecr 2631340423], length 0
16:04:37.308300 IP (tos 0x0, ttl 64, id 0, offset 0, flags [DF], proto TCP (6), length 1422)
    172.25.101.53.57985 > 142.251.16.102.443: Flags [.], cksum 0x01bd (correct), seq 21419:22789, ack 3701, win 2305, options [nop,nop,TS val 3480473737 ecr 2631340423], length 1370
16:04:37.308300 IP (tos 0x0, ttl 64, id 1, offset 0, flags [DF], proto TCP (6), length 1422)
    172.25.101.53.57985 > 142.251.16.102.443: Flags [.], cksum 0x803d (correct), seq 22789:24159, ack 3701, win 2305, options [nop,nop,TS val 3480473737 ecr 2631340423], length 1370
16:04:37.308311 IP (tos 0x0, ttl 64, id 0, offset 0, flags [DF], proto TCP (6), length 725)
    172.25.101.53.57985 > 142.251.16.102.443: Flags [P.], cksum 0x86f0 (correct), seq 24159:24832, ack 3701, win 2305, options [nop,nop,TS val 3480473737 ecr 2631340423], length 673
16:04:37.308322 IP (tos 0x0, ttl 64, id 0, offset 0, flags [DF], proto TCP (6), length 1422)
    172.25.101.53.57985 > 142.251.16.102.443: Flags [.], cksum 0x69ad (correct), seq 24832:26202, ack 3701, win 2305, options [nop,nop,TS val 3480473737 ecr 2631340423], length 1370
16:04:37.308322 IP (tos 0x0, ttl 64, id 1, offset 0, flags [DF], proto TCP (6), length 1422)
    172.25.101.53.57985 > 142.251.16.102.443: Flags [.], cksum 0x00cc (correct), seq 26202:27572, ack 3701, win 2305, options [nop,nop,TS val 3480473737 ecr 2631340423], length 1370
16:04:37.308324 IP (tos 0x0, ttl 64, id 0, offset 0, flags [DF], proto TCP (6), length 1260)
    172.25.101.53.57985 > 142.251.16.102.443: Flags [P.], cksum 0xfa01 (correct), seq 27572:28780, ack 3701, win 2305, options [nop,nop,TS val 3480473737 ecr 2631340423], length 1208
16:04:37.310321 IP (tos 0x60, ttl 119, id 29618, offset 0, flags [none], proto TCP (6), length 1057)
    142.251.16.102.443 > 172.25.101.53.57985: Flags [P.], cksum 0xfb59 (correct), seq 3701:4706, ack 21419, win 4158, options [nop,nop,TS val 2631340430 ecr 3480473662], length 1005
16:04:37.310322 IP (tos 0x60, ttl 119, id 29619, offset 0, flags [none], proto TCP (6), length 221)
    142.251.16.102.443 > 172.25.101.53.57985: Flags [P.], cksum 0x7bbb (correct), seq 4706:4875, ack 21419, win 4158, options [nop,nop,TS val 2631340430 ecr 3480473662], length 169
16:04:37.310323 IP (tos 0x60, ttl 119, id 29620, offset 0, flags [none], proto TCP (6), length 238)
    142.251.16.102.443 > 172.25.101.53.57985: Flags [P.], cksum 0x6e3a (correct), seq 4875:5061, ack 21419, win 4158, options [nop,nop,TS val 2631340430 ecr 3480473662], length 186
16:04:37.310323 IP (tos 0x60, ttl 119, id 29621, offset 0, flags [none], proto TCP (6), length 83)
    142.251.16.102.443 > 172.25.101.53.57985: Flags [P.], cksum 0xeaa8 (correct), seq 5061:5092, ack 21419, win 4158, options [nop,nop,TS val 2631340430 ecr 3480473662], length 31
16:04:37.310323 IP (tos 0x60, ttl 119, id 29622, offset 0, flags [none], proto TCP (6), length 91)
    142.251.16.102.443 > 172.25.101.53.57985: Flags [P.], cksum 0xa81f (correct), seq 5092:5131, ack 21419, win 4158, options [nop,nop,TS val 2631340430 ecr 3480473662], length 39
16:04:37.310427 IP (tos 0x0, ttl 64, id 0, offset 0, flags [DF], proto TCP (6), length 52)
    172.25.101.53.57985 > 142.251.16.102.443: Flags [.], cksum 0xd942 (correct), ack 5131, win 2283, options [nop,nop,TS val 3480473739 ecr 2631340430], length 0
16:04:37.310926 IP (tos 0x0, ttl 64, id 0, offset 0, flags [DF], proto TCP (6), length 91)
    172.25.101.53.57985 > 142.251.16.102.443: Flags [P.], cksum 0xefd9 (correct), seq 28780:28819, ack 5131, win 2305, options [nop,nop,TS val 3480473739 ecr 2631340430], length 39
16:04:37.312712 IP (tos 0x0, ttl 64, id 0, offset 0, flags [DF], proto TCP (6), length 1422)
    172.25.101.53.57985 > 142.251.16.102.443: Flags [.], cksum 0xbf9f (correct), seq 28819:30189, ack 5131, win 2305, options [nop,nop,TS val 3480473741 ecr 2631340430], length 1370
16:04:37.312713 IP (tos 0x0, ttl 64, id 1, offset 0, flags [DF], proto TCP (6), length 1422)
    172.25.101.53.57985 > 142.251.16.102.443: Flags [.], cksum 0x29af (correct), seq 30189:31559, ack 5131, win 2305, options [nop,nop,TS val 3480473741 ecr 2631340430], length 1370
16:04:37.312724 IP (tos 0x0, ttl 64, id 0, offset 0, flags [DF], proto TCP (6), length 955)
    172.25.101.53.57985 > 142.251.16.102.443: Flags [P.], cksum 0xb1cd (correct), seq 31559:32462, ack 5131, win 2305, options [nop,nop,TS val 3480473741 ecr 2631340430], length 903
16:04:37.312732 IP (tos 0x0, ttl 64, id 0, offset 0, flags [DF], proto TCP (6), length 236)
    172.25.101.53.57985 > 142.251.16.102.443: Flags [P.], cksum 0xb7a7 (correct), seq 32462:32646, ack 5131, win 2305, options [nop,nop,TS val 3480473741 ecr 2631340430], length 184
16:04:37.320157 IP (tos 0x60, ttl 119, id 29623, offset 0, flags [none], proto TCP (6), length 52)
    142.251.16.102.443 > 172.25.101.53.57985: Flags [.], cksum 0xe943 (correct), ack 22789, win 4169, options [nop,nop,TS val 2631340440 ecr 3480473737], length 0
16:04:37.320158 IP (tos 0x60, ttl 119, id 29624, offset 0, flags [none], proto TCP (6), length 52)
    142.251.16.102.443 > 172.25.101.53.57985: Flags [.], cksum 0xe3de (correct), ack 24159, win 4180, options [nop,nop,TS val 2631340440 ecr 3480473737], length 0
16:04:37.320158 IP (tos 0x60, ttl 119, id 29625, offset 0, flags [none], proto TCP (6), length 52)
    142.251.16.102.443 > 172.25.101.53.57985: Flags [.], cksum 0xe133 (correct), ack 24832, win 4190, options [nop,nop,TS val 2631340440 ecr 3480473737], length 0
16:04:37.320158 IP (tos 0x60, ttl 119, id 29626, offset 0, flags [none], proto TCP (6), length 52)
    142.251.16.102.443 > 172.25.101.53.57985: Flags [.], cksum 0xd669 (correct), ack 27572, win 4212, options [nop,nop,TS val 2631340440 ecr 3480473737], length 0
16:04:37.320158 IP (tos 0x60, ttl 119, id 29627, offset 0, flags [none], proto TCP (6), length 52)
    142.251.16.102.443 > 172.25.101.53.57985: Flags [.], cksum 0xd1a6 (correct), ack 28780, win 4223, options [nop,nop,TS val 2631340440 ecr 3480473737], length 0
16:04:37.321415 IP (tos 0x60, ttl 119, id 29628, offset 0, flags [none], proto TCP (6), length 52)
    142.251.16.102.443 > 172.25.101.53.57985: Flags [.], cksum 0xd17a (correct), ack 28819, win 4223, options [nop,nop,TS val 2631340443 ecr 3480473739], length 0
16:04:37.324902 IP (tos 0x60, ttl 119, id 29629, offset 0, flags [none], proto TCP (6), length 52)
    142.251.16.102.443 > 172.25.101.53.57985: Flags [.], cksum 0xcc12 (correct), ack 30189, win 4234, options [nop,nop,TS val 2631340444 ecr 3480473741], length 0
16:04:37.324902 IP (tos 0x60, ttl 119, id 29630, offset 0, flags [none], proto TCP (6), length 52)
    142.251.16.102.443 > 172.25.101.53.57985: Flags [.], cksum 0xc6ad (correct), ack 31559, win 4245, options [nop,nop,TS val 2631340444 ecr 3480473741], length 0
16:04:37.324903 IP (tos 0x60, ttl 119, id 29631, offset 0, flags [none], proto TCP (6), length 52)
    142.251.16.102.443 > 172.25.101.53.57985: Flags [.], cksum 0xc31c (correct), ack 32462, win 4255, options [nop,nop,TS val 2631340444 ecr 3480473741], length 0
16:04:37.324903 IP (tos 0x60, ttl 119, id 29632, offset 0, flags [none], proto TCP (6), length 52)
    142.251.16.102.443 > 172.25.101.53.57985: Flags [.], cksum 0xc264 (correct), ack 32646, win 4255, options [nop,nop,TS val 2631340444 ecr 3480473741], length 0
16:04:37.335745 IP (tos 0x60, ttl 119, id 29633, offset 0, flags [none], proto TCP (6), length 297)
    142.251.16.102.443 > 172.25.101.53.57985: Flags [P.], cksum 0x45c3 (correct), seq 5131:5376, ack 32646, win 4255, options [nop,nop,TS val 2631340457 ecr 3480473741], length 245
16:04:37.335745 IP (tos 0x60, ttl 119, id 29634, offset 0, flags [none], proto TCP (6), length 83)
    142.251.16.102.443 > 172.25.101.53.57985: Flags [P.], cksum 0x52ec (correct), seq 5376:5407, ack 32646, win 4255, options [nop,nop,TS val 2631340457 ecr 3480473741], length 31
16:04:37.335746 IP (tos 0x60, ttl 119, id 29635, offset 0, flags [none], proto TCP (6), length 91)
    142.251.16.102.443 > 172.25.101.53.57985: Flags [P.], cksum 0xeae8 (correct), seq 5407:5446, ack 32646, win 4255, options [nop,nop,TS val 2631340457 ecr 3480473741], length 39
16:04:37.335803 IP (tos 0x0, ttl 64, id 0, offset 0, flags [DF], proto TCP (6), length 52)
    172.25.101.53.57985 > 142.251.16.102.443: Flags [.], cksum 0xc8a7 (correct), ack 5446, win 2301, options [nop,nop,TS val 3480473764 ecr 2631340457], length 0
16:04:37.336131 IP (tos 0x0, ttl 64, id 0, offset 0, flags [DF], proto TCP (6), length 91)
    172.25.101.53.57985 > 142.251.16.102.443: Flags [P.], cksum 0x0732 (correct), seq 32646:32685, ack 5446, win 2305, options [nop,nop,TS val 3480473764 ecr 2631340457], length 39
16:04:37.352283 IP (tos 0x60, ttl 119, id 29636, offset 0, flags [none], proto TCP (6), length 52)
    142.251.16.102.443 > 172.25.101.53.57985: Flags [.], cksum 0xc0ce (correct), ack 32685, win 4255, options [nop,nop,TS val 2631340473 ecr 3480473764], length 0
16:04:37.565988 IP (tos 0x60, ttl 119, id 29637, offset 0, flags [none], proto TCP (6), length 594)
    142.251.16.102.443 > 172.25.101.53.57985: Flags [P.], cksum 0x6b3e (correct), seq 5446:5988, ack 32685, win 4255, options [nop,nop,TS val 2631340685 ecr 3480473764], length 542
16:04:37.565989 IP (tos 0x60, ttl 119, id 29638, offset 0, flags [none], proto TCP (6), length 326)
    142.251.16.102.443 > 172.25.101.53.57985: Flags [P.], cksum 0x111c (correct), seq 5988:6262, ack 32685, win 4255, options [nop,nop,TS val 2631340685 ecr 3480473764], length 274
16:04:37.565990 IP (tos 0x60, ttl 119, id 29639, offset 0, flags [none], proto TCP (6), length 153)
    142.251.16.102.443 > 172.25.101.53.57985: Flags [P.], cksum 0x2327 (correct), seq 6262:6363, ack 32685, win 4255, options [nop,nop,TS val 2631340685 ecr 3480473764], length 101
16:04:37.565990 IP (tos 0x60, ttl 119, id 29640, offset 0, flags [none], proto TCP (6), length 83)
    142.251.16.102.443 > 172.25.101.53.57985: Flags [P.], cksum 0x3fd5 (correct), seq 6363:6394, ack 32685, win 4255, options [nop,nop,TS val 2631340686 ecr 3480473764], length 31
16:04:37.565991 IP (tos 0x60, ttl 119, id 29641, offset 0, flags [none], proto TCP (6), length 91)
    142.251.16.102.443 > 172.25.101.53.57985: Flags [P.], cksum 0x91ba (correct), seq 6394:6433, ack 32685, win 4255, options [nop,nop,TS val 2631340686 ecr 3480473764], length 39
16:04:37.566130 IP (tos 0x0, ttl 64, id 0, offset 0, flags [DF], proto TCP (6), length 52)
    172.25.101.53.57985 > 142.251.16.102.443: Flags [.], cksum 0xc2e4 (correct), ack 6433, win 2290, options [nop,nop,TS val 3480473995 ecr 2631340686], length 0
16:04:37.567707 IP (tos 0x0, ttl 64, id 0, offset 0, flags [DF], proto TCP (6), length 91)
    172.25.101.53.57985 > 142.251.16.102.443: Flags [P.], cksum 0x4d28 (correct), seq 32685:32724, ack 6433, win 2305, options [nop,nop,TS val 3480473996 ecr 2631340686], length 39
16:04:37.577893 IP (tos 0x60, ttl 119, id 29642, offset 0, flags [none], proto TCP (6), length 52)
    142.251.16.102.443 > 172.25.101.53.57985: Flags [.], cksum 0xbb02 (correct), ack 32724, win 4255, options [nop,nop,TS val 2631340699 ecr 3480473996], length 0
16:04:38.505123 IP (tos 0x60, ttl 119, id 29643, offset 0, flags [none], proto TCP (6), length 632)
    142.251.16.102.443 > 172.25.101.53.57985: Flags [P.], cksum 0xfbec (correct), seq 6433:7013, ack 32724, win 4255, options [nop,nop,TS val 2631341573 ecr 3480473996], length 580
16:04:38.505124 IP (tos 0x60, ttl 119, id 29644, offset 0, flags [none], proto TCP (6), length 202)
    142.251.16.102.443 > 172.25.101.53.57985: Flags [P.], cksum 0xff7d (correct), seq 7013:7163, ack 32724, win 4255, options [nop,nop,TS val 2631341594 ecr 3480473996], length 150
16:04:38.505125 IP (tos 0x60, ttl 119, id 29645, offset 0, flags [none], proto TCP (6), length 202)
    142.251.16.102.443 > 172.25.101.53.57985: Flags [P.], cksum 0xff60 (correct), seq 7013:7163, ack 32724, win 4255, options [nop,nop,TS val 2631341623 ecr 3480473996], length 150
16:04:38.505230 IP (tos 0x0, ttl 64, id 0, offset 0, flags [DF], proto TCP (6), length 52)
    172.25.101.53.57985 > 142.251.16.102.443: Flags [.], cksum 0xb8a8 (correct), ack 7163, win 2294, options [nop,nop,TS val 3480474934 ecr 2631341594], length 0
16:04:38.505341 IP (tos 0x0, ttl 64, id 0, offset 0, flags [DF], proto TCP (6), length 64)
    172.25.101.53.57985 > 142.251.16.102.443: Flags [.], cksum 0x08ab (correct), ack 7163, win 2294, options [nop,nop,TS val 3480474934 ecr 2631341623,nop,nop,sack 1 {7013:7163}], length 0
16:04:38.531159 IP (tos 0x60, ttl 119, id 29646, offset 0, flags [none], proto TCP (6), length 177)
    142.251.16.102.443 > 172.25.101.53.57985: Flags [P.], cksum 0x2af3 (correct), seq 7163:7288, ack 32724, win 4255, options [nop,nop,TS val 2631341652 ecr 3480474934], length 125
16:04:38.531266 IP (tos 0x0, ttl 64, id 0, offset 0, flags [DF], proto TCP (6), length 52)
    172.25.101.53.57985 > 142.251.16.102.443: Flags [.], cksum 0xb7ce (correct), ack 7288, win 2303, options [nop,nop,TS val 3480474960 ecr 2631341652], length 0
16:04:38.583241 IP (tos 0x60, ttl 119, id 29647, offset 0, flags [none], proto TCP (6), length 212)
    142.251.16.102.443 > 172.25.101.53.57985: Flags [P.], cksum 0xf606 (correct), seq 7288:7448, ack 32724, win 4255, options [nop,nop,TS val 2631341704 ecr 3480474960], length 160
16:04:38.583343 IP (tos 0x0, ttl 64, id 0, offset 0, flags [DF], proto TCP (6), length 52)
    172.25.101.53.57985 > 142.251.16.102.443: Flags [.], cksum 0xb6c6 (correct), ack 7448, win 2303, options [nop,nop,TS val 3480475012 ecr 2631341704], length 0
16:04:38.618729 IP (tos 0x60, ttl 119, id 29648, offset 0, flags [none], proto TCP (6), length 313)
    142.251.16.102.443 > 172.25.101.53.57985: Flags [P.], cksum 0x8ccf (correct), seq 7448:7709, ack 32724, win 4255, options [nop,nop,TS val 2631341740 ecr 3480475012], length 261
16:04:38.618821 IP (tos 0x0, ttl 64, id 0, offset 0, flags [DF], proto TCP (6), length 52)
    172.25.101.53.57985 > 142.251.16.102.443: Flags [.], cksum 0xb57c (correct), ack 7709, win 2301, options [nop,nop,TS val 3480475047 ecr 2631341740], length 0
16:04:38.673438 IP (tos 0x60, ttl 119, id 29649, offset 0, flags [none], proto TCP (6), length 194)
    142.251.16.102.443 > 172.25.101.53.57985: Flags [P.], cksum 0x8615 (correct), seq 7709:7851, ack 32724, win 4255, options [nop,nop,TS val 2631341793 ecr 3480475047], length 142
16:04:38.673543 IP (tos 0x0, ttl 64, id 0, offset 0, flags [DF], proto TCP (6), length 52)
    172.25.101.53.57985 > 142.251.16.102.443: Flags [.], cksum 0xb480 (correct), ack 7851, win 2303, options [nop,nop,TS val 3480475102 ecr 2631341793], length 0
16:04:38.725116 IP (tos 0x60, ttl 119, id 29650, offset 0, flags [none], proto TCP (6), length 272)
    142.251.16.102.443 > 172.25.101.53.57985: Flags [P.], cksum 0xd1dd (correct), seq 7851:8071, ack 32724, win 4255, options [nop,nop,TS val 2631341846 ecr 3480475102], length 220
16:04:38.725220 IP (tos 0x0, ttl 64, id 0, offset 0, flags [DF], proto TCP (6), length 52)
    172.25.101.53.57985 > 142.251.16.102.443: Flags [.], cksum 0xb33c (correct), ack 8071, win 2302, options [nop,nop,TS val 3480475154 ecr 2631341846], length 0
16:04:38.779885 IP (tos 0x60, ttl 119, id 29651, offset 0, flags [none], proto TCP (6), length 400)
    142.251.16.102.443 > 172.25.101.53.57985: Flags [P.], cksum 0xc2ef (correct), seq 8071:8419, ack 32724, win 4255, options [nop,nop,TS val 2631341900 ecr 3480475154], length 348
16:04:38.779987 IP (tos 0x0, ttl 64, id 0, offset 0, flags [DF], proto TCP (6), length 52)
    172.25.101.53.57985 > 142.251.16.102.443: Flags [.], cksum 0xb176 (correct), ack 8419, win 2300, options [nop,nop,TS val 3480475208 ecr 2631341900], length 0
16:04:38.831912 IP (tos 0x60, ttl 119, id 29652, offset 0, flags [none], proto TCP (6), length 341)
    142.251.16.102.443 > 172.25.101.53.57985: Flags [P.], cksum 0xeb6c (correct), seq 8419:8708, ack 32724, win 4255, options [nop,nop,TS val 2631341953 ecr 3480475208], length 289
16:04:38.832004 IP (tos 0x0, ttl 64, id 0, offset 0, flags [DF], proto TCP (6), length 52)
    172.25.101.53.57985 > 142.251.16.102.443: Flags [.], cksum 0xafeb (correct), ack 8708, win 2301, options [nop,nop,TS val 3480475260 ecr 2631341953], length 0
16:04:38.885213 IP (tos 0x60, ttl 119, id 29653, offset 0, flags [none], proto TCP (6), length 190)
    142.251.16.102.443 > 172.25.101.53.57985: Flags [P.], cksum 0x0b7f (correct), seq 8708:8846, ack 32724, win 4255, options [nop,nop,TS val 2631342006 ecr 3480475260], length 138
16:04:38.885292 IP (tos 0x0, ttl 64, id 0, offset 0, flags [DF], proto TCP (6), length 52)
    172.25.101.53.57985 > 142.251.16.102.443: Flags [.], cksum 0xaef4 (correct), ack 8846, win 2303, options [nop,nop,TS val 3480475314 ecr 2631342006], length 0
16:04:38.925402 IP (tos 0x60, ttl 119, id 29654, offset 0, flags [none], proto TCP (6), length 143)
    142.251.16.102.443 > 172.25.101.53.57985: Flags [P.], cksum 0xecbe (correct), seq 8846:8937, ack 32724, win 4255, options [nop,nop,TS val 2631342046 ecr 3480475314], length 91
16:04:38.925505 IP (tos 0x0, ttl 64, id 0, offset 0, flags [DF], proto TCP (6), length 52)
    172.25.101.53.57985 > 142.251.16.102.443: Flags [.], cksum 0xae48 (correct), ack 8937, win 2304, options [nop,nop,TS val 3480475354 ecr 2631342046], length 0
16:04:38.999511 IP (tos 0x60, ttl 119, id 29655, offset 0, flags [none], proto TCP (6), length 180)
    142.251.16.102.443 > 172.25.101.53.57985: Flags [P.], cksum 0x007d (correct), seq 8937:9065, ack 32724, win 4255, options [nop,nop,TS val 2631342120 ecr 3480475354], length 128
16:04:38.999748 IP (tos 0x0, ttl 64, id 0, offset 0, flags [DF], proto TCP (6), length 52)
    172.25.101.53.57985 > 142.251.16.102.443: Flags [.], cksum 0xad33 (correct), ack 9065, win 2305, options [nop,nop,TS val 3480475428 ecr 2631342120], length 0
16:04:39.054884 IP (tos 0x60, ttl 119, id 29656, offset 0, flags [none], proto TCP (6), length 339)
    142.251.16.102.443 > 172.25.101.53.57985: Flags [P.], cksum 0x1063 (correct), seq 9065:9352, ack 32724, win 4255, options [nop,nop,TS val 2631342176 ecr 3480475428], length 287
16:04:39.055025 IP (tos 0x0, ttl 64, id 0, offset 0, flags [DF], proto TCP (6), length 52)
    172.25.101.53.57985 > 142.251.16.102.443: Flags [.], cksum 0xaba5 (correct), ack 9352, win 2305, options [nop,nop,TS val 3480475483 ecr 2631342176], length 0
16:04:39.095509 IP (tos 0x60, ttl 119, id 29657, offset 0, flags [none], proto TCP (6), length 326)
    142.251.16.102.443 > 172.25.101.53.57985: Flags [P.], cksum 0x41bf (correct), seq 9352:9626, ack 32724, win 4255, options [nop,nop,TS val 2631342217 ecr 3480475483], length 274
16:04:39.095692 IP (tos 0x0, ttl 64, id 0, offset 0, flags [DF], proto TCP (6), length 52)
    172.25.101.53.57985 > 142.251.16.102.443: Flags [.], cksum 0xaa41 (correct), ack 9626, win 2305, options [nop,nop,TS val 3480475524 ecr 2631342217], length 0
16:04:39.132903 IP (tos 0x60, ttl 119, id 29658, offset 0, flags [none], proto TCP (6), length 253)
    142.251.16.102.443 > 172.25.101.53.57985: Flags [P.], cksum 0xeadf (correct), seq 9626:9827, ack 32724, win 4255, options [nop,nop,TS val 2631342254 ecr 3480475524], length 201
16:04:39.132993 IP (tos 0x0, ttl 64, id 0, offset 0, flags [DF], proto TCP (6), length 52)
    172.25.101.53.57985 > 142.251.16.102.443: Flags [.], cksum 0xa92e (correct), ack 9827, win 2305, options [nop,nop,TS val 3480475561 ecr 2631342254], length 0
16:04:39.174235 IP (tos 0x60, ttl 119, id 29659, offset 0, flags [none], proto TCP (6), length 194)
    142.251.16.102.443 > 172.25.101.53.57985: Flags [P.], cksum 0x615e (correct), seq 9827:9969, ack 32724, win 4255, options [nop,nop,TS val 2631342295 ecr 3480475561], length 142
16:04:39.174367 IP (tos 0x0, ttl 64, id 0, offset 0, flags [DF], proto TCP (6), length 52)
    172.25.101.53.57985 > 142.251.16.102.443: Flags [.], cksum 0xa84d (correct), ack 9969, win 2305, options [nop,nop,TS val 3480475603 ecr 2631342295], length 0
16:04:39.212664 IP (tos 0x60, ttl 119, id 29660, offset 0, flags [none], proto TCP (6), length 166)
    142.251.16.102.443 > 172.25.101.53.57985: Flags [P.], cksum 0xd0f4 (correct), seq 9969:10083, ack 32724, win 4255, options [nop,nop,TS val 2631342334 ecr 3480475603], length 114
16:04:39.212824 IP (tos 0x0, ttl 64, id 0, offset 0, flags [DF], proto TCP (6), length 52)
    172.25.101.53.57985 > 142.251.16.102.443: Flags [.], cksum 0xa78e (correct), ack 10083, win 2305, options [nop,nop,TS val 3480475641 ecr 2631342334], length 0
16:04:39.408926 IP (tos 0x60, ttl 119, id 29661, offset 0, flags [none], proto TCP (6), length 299)
    142.251.16.102.443 > 172.25.101.53.57985: Flags [P.], cksum 0xefce (correct), seq 10083:10330, ack 32724, win 4255, options [nop,nop,TS val 2631342528 ecr 3480475641], length 247
16:04:39.409119 IP (tos 0x0, ttl 64, id 0, offset 0, flags [DF], proto TCP (6), length 52)
    172.25.101.53.57985 > 142.251.16.102.443: Flags [.], cksum 0xa510 (correct), ack 10330, win 2305, options [nop,nop,TS val 3480475838 ecr 2631342528], length 0
16:04:39.585046 IP (tos 0x60, ttl 119, id 29662, offset 0, flags [none], proto TCP (6), length 440)
    142.251.16.102.443 > 172.25.101.53.57985: Flags [P.], cksum 0xd49e (correct), seq 10330:10718, ack 32724, win 4255, options [nop,nop,TS val 2631342705 ecr 3480475838], length 388
16:04:39.585252 IP (tos 0x0, ttl 64, id 0, offset 0, flags [DF], proto TCP (6), length 52)
    172.25.101.53.57985 > 142.251.16.102.443: Flags [.], cksum 0xa22b (correct), ack 10718, win 2305, options [nop,nop,TS val 3480476014 ecr 2631342705], length 0
16:04:39.727577 IP (tos 0x60, ttl 119, id 29663, offset 0, flags [none], proto TCP (6), length 383)
    142.251.16.102.443 > 172.25.101.53.57985: Flags [P.], cksum 0xcb58 (correct), seq 10718:11049, ack 32724, win 4255, options [nop,nop,TS val 2631342848 ecr 3480476014], length 331
16:04:39.727776 IP (tos 0x0, ttl 64, id 0, offset 0, flags [DF], proto TCP (6), length 52)
    172.25.101.53.57985 > 142.251.16.102.443: Flags [.], cksum 0x9fc3 (correct), ack 11049, win 2305, options [nop,nop,TS val 3480476156 ecr 2631342848], length 0
16:04:39.842785 IP (tos 0x60, ttl 119, id 29664, offset 0, flags [none], proto TCP (6), length 299)
    142.251.16.102.443 > 172.25.101.53.57985: Flags [P.], cksum 0x1b2c (correct), seq 11049:11296, ack 32724, win 4255, options [nop,nop,TS val 2631342964 ecr 3480476156], length 247
16:04:39.842877 IP (tos 0x0, ttl 64, id 0, offset 0, flags [DF], proto TCP (6), length 52)
    172.25.101.53.57985 > 142.251.16.102.443: Flags [.], cksum 0x9de5 (correct), ack 11296, win 2305, options [nop,nop,TS val 3480476271 ecr 2631342964], length 0
16:04:39.980987 IP (tos 0x60, ttl 119, id 29665, offset 0, flags [none], proto TCP (6), length 414)
