tcpdump: data link type PKTAP
tcpdump: WARNING: snaplen raised from 96 to 524288
tcpdump: listening on pktap, link-type PKTAP (Apple DLT_PKTAP), snapshot length 524288 bytes
15:42:26.263654 IP (tos 0x0, ttl 64, id 0, offset 0, flags [DF], proto TCP (6), length 1422)
    172.25.64.219.63643 > 64.233.180.101.443: Flags [.], cksum 0xcdbd (correct), seq 388894383:388895753, ack 2985996982, win 2048, options [nop,nop,TS val 527187276 ecr 3790042956], length 1370
15:42:26.263655 IP (tos 0x0, ttl 64, id 1, offset 0, flags [DF], proto TCP (6), length 1422)
    172.25.64.219.63643 > 64.233.180.101.443: Flags [.], cksum 0xaa90 (correct), seq 1370:2740, ack 1, win 2048, options [nop,nop,TS val 527187276 ecr 3790042956], length 1370
15:42:26.263680 IP (tos 0x0, ttl 64, id 0, offset 0, flags [DF], proto TCP (6), length 517)
    172.25.64.219.63643 > 64.233.180.101.443: Flags [P.], cksum 0xeafe (correct), seq 2740:3205, ack 1, win 2048, options [nop,nop,TS val 527187276 ecr 3790042956], length 465
15:42:26.263698 IP (tos 0x0, ttl 64, id 0, offset 0, flags [DF], proto TCP (6), length 250)
    172.25.64.219.63643 > 64.233.180.101.443: Flags [P.], cksum 0x4e5c (correct), seq 3205:3403, ack 1, win 2048, options [nop,nop,TS val 527187276 ecr 3790042956], length 198
15:42:26.280557 IP (tos 0x0, ttl 118, id 1916, offset 0, flags [none], proto TCP (6), length 52)
    64.233.180.101.443 > 172.25.64.219.63643: Flags [.], cksum 0x3a34 (correct), ack 1370, win 641, options [nop,nop,TS val 3790048997 ecr 527187276], length 0
15:42:26.280558 IP (tos 0x0, ttl 118, id 1917, offset 0, flags [none], proto TCP (6), length 64)
    64.233.180.101.443 > 172.25.64.219.63643: Flags [.], cksum 0xa129 (correct), ack 1370, win 641, options [nop,nop,TS val 3790048997 ecr 527187276,nop,nop,sack 1 {2740:3205}], length 0
15:42:26.280558 IP (tos 0x0, ttl 118, id 1918, offset 0, flags [none], proto TCP (6), length 52)
    64.233.180.101.443 > 172.25.64.219.63643: Flags [.], cksum 0x3310 (correct), ack 3205, win 634, options [nop,nop,TS val 3790048997 ecr 527187276], length 0
15:42:26.280558 IP (tos 0x0, ttl 118, id 1919, offset 0, flags [none], proto TCP (6), length 52)
    64.233.180.101.443 > 172.25.64.219.63643: Flags [.], cksum 0x324a (correct), ack 3403, win 634, options [nop,nop,TS val 3790048997 ecr 527187276], length 0
15:42:26.372052 IP (tos 0x0, ttl 118, id 1920, offset 0, flags [none], proto TCP (6), length 585)
    64.233.180.101.443 > 172.25.64.219.63643: Flags [P.], cksum 0x58e6 (correct), seq 1:534, ack 3403, win 634, options [nop,nop,TS val 3790049089 ecr 527187276], length 533
15:42:26.372053 IP (tos 0x0, ttl 118, id 1921, offset 0, flags [none], proto TCP (6), length 425)
    64.233.180.101.443 > 172.25.64.219.63643: Flags [P.], cksum 0x255b (correct), seq 534:907, ack 3403, win 634, options [nop,nop,TS val 3790049089 ecr 527187276], length 373
15:42:26.372054 IP (tos 0x0, ttl 118, id 1922, offset 0, flags [none], proto TCP (6), length 345)
    64.233.180.101.443 > 172.25.64.219.63643: Flags [P.], cksum 0xc3de (correct), seq 907:1200, ack 3403, win 634, options [nop,nop,TS val 3790049089 ecr 527187276], length 293
15:42:26.372054 IP (tos 0x0, ttl 118, id 1923, offset 0, flags [none], proto TCP (6), length 213)
    64.233.180.101.443 > 172.25.64.219.63643: Flags [P.], cksum 0x031e (correct), seq 1200:1361, ack 3403, win 634, options [nop,nop,TS val 3790049089 ecr 527187276], length 161
15:42:26.372166 IP (tos 0x0, ttl 64, id 0, offset 0, flags [DF], proto TCP (6), length 52)
    172.25.64.219.63643 > 64.233.180.101.443: Flags [.], cksum 0x26c1 (correct), ack 1361, win 2027, options [nop,nop,TS val 527187384 ecr 3790049089], length 0
15:42:26.373154 IP (tos 0x0, ttl 64, id 0, offset 0, flags [DF], proto TCP (6), length 87)
    172.25.64.219.63643 > 64.233.180.101.443: Flags [P.], cksum 0xfd6b (correct), seq 3403:3438, ack 1361, win 2048, options [nop,nop,TS val 527187385 ecr 3790049089], length 35
15:42:26.373190 IP (tos 0x0, ttl 64, id 0, offset 0, flags [DF], proto TCP (6), length 91)
    172.25.64.219.63643 > 64.233.180.101.443: Flags [P.], cksum 0xcc14 (correct), seq 3438:3477, ack 1361, win 2048, options [nop,nop,TS val 527187385 ecr 3790049089], length 39
15:42:26.384318 IP (tos 0x0, ttl 118, id 1924, offset 0, flags [none], proto TCP (6), length 52)
    64.233.180.101.443 > 172.25.64.219.63643: Flags [.], cksum 0x2c00 (correct), ack 3438, win 634, options [nop,nop,TS val 3790049103 ecr 527187385], length 0
15:42:26.384319 IP (tos 0x0, ttl 118, id 1925, offset 0, flags [none], proto TCP (6), length 52)
    64.233.180.101.443 > 172.25.64.219.63643: Flags [.], cksum 0x2bd9 (correct), ack 3477, win 634, options [nop,nop,TS val 3790049103 ecr 527187385], length 0
15:43:05.993003 IP (tos 0x0, ttl 64, id 0, offset 0, flags [DF], proto TCP (6), length 1422)
    172.25.64.219.63643 > 64.233.180.101.443: Flags [.], cksum 0x8de0 (correct), seq 3477:4847, ack 1361, win 2048, options [nop,nop,TS val 527227005 ecr 3790049103], length 1370
15:43:05.993005 IP (tos 0x0, ttl 64, id 1, offset 0, flags [DF], proto TCP (6), length 1422)
    172.25.64.219.63643 > 64.233.180.101.443: Flags [.], cksum 0x6e33 (correct), seq 4847:6217, ack 1361, win 2048, options [nop,nop,TS val 527227005 ecr 3790049103], length 1370
15:43:05.993061 IP (tos 0x0, ttl 64, id 0, offset 0, flags [DF], proto TCP (6), length 517)
    172.25.64.219.63643 > 64.233.180.101.443: Flags [P.], cksum 0x9fa1 (correct), seq 6217:6682, ack 1361, win 2048, options [nop,nop,TS val 527227005 ecr 3790049103], length 465
15:43:05.993105 IP (tos 0x0, ttl 64, id 0, offset 0, flags [DF], proto TCP (6), length 91)
    172.25.64.219.63643 > 64.233.180.101.443: Flags [P.], cksum 0x07b7 (correct), seq 6682:6721, ack 1361, win 2048, options [nop,nop,TS val 527227005 ecr 3790049103], length 39
15:43:05.993120 IP (tos 0x0, ttl 64, id 0, offset 0, flags [DF], proto TCP (6), length 250)
    172.25.64.219.63643 > 64.233.180.101.443: Flags [P.], cksum 0x5ff4 (correct), seq 6721:6919, ack 1361, win 2048, options [nop,nop,TS val 527227005 ecr 3790049103], length 198
15:43:05.998596 IP (tos 0x0, ttl 64, id 0, offset 0, flags [DF], proto TCP (6), length 1422)
    172.25.64.219.63643 > 64.233.180.101.443: Flags [.], cksum 0x44e0 (correct), seq 6919:8289, ack 1361, win 2048, options [nop,nop,TS val 527227011 ecr 3790049103], length 1370
15:43:05.998598 IP (tos 0x0, ttl 64, id 1, offset 0, flags [DF], proto TCP (6), length 1422)
    172.25.64.219.63643 > 64.233.180.101.443: Flags [.], cksum 0xbbf0 (correct), seq 8289:9659, ack 1361, win 2048, options [nop,nop,TS val 527227011 ecr 3790049103], length 1370
15:43:05.998623 IP (tos 0x0, ttl 64, id 0, offset 0, flags [DF], proto TCP (6), length 524)
    172.25.64.219.63643 > 64.233.180.101.443: Flags [P.], cksum 0x25ca (correct), seq 9659:10131, ack 1361, win 2048, options [nop,nop,TS val 527227011 ecr 3790049103], length 472
15:43:05.998648 IP (tos 0x0, ttl 64, id 0, offset 0, flags [DF], proto TCP (6), length 1422)
    172.25.64.219.63643 > 64.233.180.101.443: Flags [.], cksum 0x33d3 (correct), seq 10131:11501, ack 1361, win 2048, options [nop,nop,TS val 527227011 ecr 3790049103], length 1370
15:43:05.998654 IP (tos 0x0, ttl 64, id 0, offset 0, flags [DF], proto TCP (6), length 1363)
    172.25.64.219.63643 > 64.233.180.101.443: Flags [P.], cksum 0xa50d (correct), seq 11501:12812, ack 1361, win 2048, options [nop,nop,TS val 527227011 ecr 3790049103], length 1311
15:43:06.011643 IP (tos 0x0, ttl 118, id 1926, offset 0, flags [none], proto TCP (6), length 52)
    64.233.180.101.443 > 172.25.64.219.63643: Flags [.], cksum 0xf0f6 (correct), ack 4847, win 629, options [nop,nop,TS val 3790088727 ecr 527227005], length 0
15:43:06.011643 IP (tos 0x0, ttl 118, id 1927, offset 0, flags [none], proto TCP (6), length 52)
    64.233.180.101.443 > 172.25.64.219.63643: Flags [.], cksum 0xeba1 (correct), ack 6217, win 624, options [nop,nop,TS val 3790088727 ecr 527227005], length 0
15:43:06.011644 IP (tos 0x0, ttl 118, id 1928, offset 0, flags [none], proto TCP (6), length 52)
    64.233.180.101.443 > 172.25.64.219.63643: Flags [.], cksum 0xe9d1 (correct), ack 6682, win 623, options [nop,nop,TS val 3790088727 ecr 527227005], length 0
15:43:06.011644 IP (tos 0x0, ttl 118, id 1929, offset 0, flags [none], proto TCP (6), length 52)
    64.233.180.101.443 > 172.25.64.219.63643: Flags [.], cksum 0xe9aa (correct), ack 6721, win 623, options [nop,nop,TS val 3790088727 ecr 527227005], length 0
15:43:06.011645 IP (tos 0x0, ttl 118, id 1930, offset 0, flags [none], proto TCP (6), length 52)
    64.233.180.101.443 > 172.25.64.219.63643: Flags [.], cksum 0xe8e4 (correct), ack 6919, win 623, options [nop,nop,TS val 3790088727 ecr 527227005], length 0
15:43:06.011645 IP (tos 0x0, ttl 118, id 1931, offset 0, flags [none], proto TCP (6), length 52)
    64.233.180.101.443 > 172.25.64.219.63643: Flags [.], cksum 0xe388 (correct), ack 8289, win 618, options [nop,nop,TS val 3790088728 ecr 527227011], length 0
15:43:06.011645 IP (tos 0x0, ttl 118, id 1932, offset 0, flags [none], proto TCP (6), length 64)
    64.233.180.101.443 > 172.25.64.219.63643: Flags [.], cksum 0x1469 (correct), ack 8289, win 618, options [nop,nop,TS val 3790088728 ecr 527227011,nop,nop,sack 1 {9659:10131}], length 0
15:43:06.011645 IP (tos 0x0, ttl 118, id 1933, offset 0, flags [none], proto TCP (6), length 52)
    64.233.180.101.443 > 172.25.64.219.63643: Flags [.], cksum 0xdc5d (correct), ack 10131, win 611, options [nop,nop,TS val 3790088728 ecr 527227011], length 0
15:43:06.011646 IP (tos 0x0, ttl 118, id 1934, offset 0, flags [none], proto TCP (6), length 52)
    64.233.180.101.443 > 172.25.64.219.63643: Flags [.], cksum 0xd708 (correct), ack 11501, win 606, options [nop,nop,TS val 3790088728 ecr 527227011], length 0
15:43:06.011646 IP (tos 0x0, ttl 118, id 1935, offset 0, flags [none], proto TCP (6), length 52)
    64.233.180.101.443 > 172.25.64.219.63643: Flags [.], cksum 0xd1ee (correct), ack 12812, win 601, options [nop,nop,TS val 3790088728 ecr 527227011], length 0
15:43:06.011646 IP (tos 0x0, ttl 118, id 1936, offset 0, flags [none], proto TCP (6), length 91)
    64.233.180.101.443 > 172.25.64.219.63643: Flags [P.], cksum 0x67b9 (correct), seq 1361:1400, ack 12812, win 601, options [nop,nop,TS val 3790088729 ecr 527227011], length 39
15:43:06.011779 IP (tos 0x0, ttl 64, id 0, offset 0, flags [DF], proto TCP (6), length 52)
    172.25.64.219.63643 > 64.233.180.101.443: Flags [.], cksum 0xcc12 (correct), ack 1400, win 2048, options [nop,nop,TS val 527227024 ecr 3790088729], length 0
15:43:06.096909 IP (tos 0x0, ttl 64, id 0, offset 0, flags [DF], proto TCP (6), length 1422)
    172.25.64.219.63643 > 64.233.180.101.443: Flags [.], cksum 0xd92a (correct), seq 12812:14182, ack 1400, win 2048, options [nop,nop,TS val 527227109 ecr 3790088729], length 1370
15:43:06.096909 IP (tos 0x0, ttl 64, id 1, offset 0, flags [DF], proto TCP (6), length 1422)
    172.25.64.219.63643 > 64.233.180.101.443: Flags [.], cksum 0x3831 (correct), seq 14182:15552, ack 1400, win 2048, options [nop,nop,TS val 527227109 ecr 3790088729], length 1370
15:43:06.096918 IP (tos 0x0, ttl 64, id 0, offset 0, flags [DF], proto TCP (6), length 284)
    172.25.64.219.63643 > 64.233.180.101.443: Flags [P.], cksum 0x1d63 (correct), seq 15552:15784, ack 1400, win 2048, options [nop,nop,TS val 527227109 ecr 3790088729], length 232
15:43:06.096927 IP (tos 0x0, ttl 64, id 0, offset 0, flags [DF], proto TCP (6), length 1422)
    172.25.64.219.63643 > 64.233.180.101.443: Flags [.], cksum 0x4c78 (correct), seq 15784:17154, ack 1400, win 2048, options [nop,nop,TS val 527227109 ecr 3790088729], length 1370
15:43:06.096927 IP (tos 0x0, ttl 64, id 1, offset 0, flags [DF], proto TCP (6), length 1422)
    172.25.64.219.63643 > 64.233.180.101.443: Flags [.], cksum 0x3752 (correct), seq 17154:18524, ack 1400, win 2048, options [nop,nop,TS val 527227109 ecr 3790088729], length 1370
15:43:06.096930 IP (tos 0x0, ttl 64, id 0, offset 0, flags [DF], proto TCP (6), length 1083)
    172.25.64.219.63643 > 64.233.180.101.443: Flags [P.], cksum 0xe872 (correct), seq 18524:19555, ack 1400, win 2048, options [nop,nop,TS val 527227109 ecr 3790088729], length 1031
15:43:06.097247 IP (tos 0x0, ttl 118, id 1937, offset 0, flags [none], proto TCP (6), length 575)
    64.233.180.101.443 > 172.25.64.219.63643: Flags [P.], cksum 0x2cb3 (correct), seq 1400:1923, ack 12812, win 601, options [nop,nop,TS val 3790088815 ecr 527227024], length 523
15:43:06.097248 IP (tos 0x0, ttl 118, id 1938, offset 0, flags [none], proto TCP (6), length 463)
    64.233.180.101.443 > 172.25.64.219.63643: Flags [P.], cksum 0x3b40 (correct), seq 1923:2334, ack 12812, win 601, options [nop,nop,TS val 3790088815 ecr 527227024], length 411
15:43:06.097288 IP (tos 0x0, ttl 64, id 0, offset 0, flags [DF], proto TCP (6), length 52)
    172.25.64.219.63643 > 64.233.180.101.443: Flags [.], cksum 0xad78 (correct), ack 2334, win 2034, options [nop,nop,TS val 527227109 ecr 3790088815], length 0
15:43:06.097719 IP (tos 0x0, ttl 64, id 0, offset 0, flags [DF], proto TCP (6), length 87)
    172.25.64.219.63643 > 64.233.180.101.443: Flags [P.], cksum 0x9967 (correct), seq 19555:19590, ack 2334, win 2048, options [nop,nop,TS val 527227109 ecr 3790088815], length 35
15:43:06.102259 IP (tos 0x0, ttl 118, id 1939, offset 0, flags [none], proto TCP (6), length 572)
    64.233.180.101.443 > 172.25.64.219.63643: Flags [P.], cksum 0xadba (correct), seq 2334:2854, ack 12812, win 601, options [nop,nop,TS val 3790088818 ecr 527227024], length 520
15:43:06.102260 IP (tos 0x0, ttl 118, id 1940, offset 0, flags [none], proto TCP (6), length 432)
    64.233.180.101.443 > 172.25.64.219.63643: Flags [P.], cksum 0x4c3a (correct), seq 2854:3234, ack 12812, win 601, options [nop,nop,TS val 3790088818 ecr 527227024], length 380
15:43:06.102260 IP (tos 0x0, ttl 118, id 1941, offset 0, flags [none], proto TCP (6), length 261)
    64.233.180.101.443 > 172.25.64.219.63643: Flags [P.], cksum 0x6820 (correct), seq 3234:3443, ack 12812, win 601, options [nop,nop,TS val 3790088818 ecr 527227024], length 209
15:43:06.102260 IP (tos 0x0, ttl 118, id 1942, offset 0, flags [none], proto TCP (6), length 178)
    64.233.180.101.443 > 172.25.64.219.63643: Flags [P.], cksum 0x15fa (correct), seq 3443:3569, ack 12812, win 601, options [nop,nop,TS val 3790088818 ecr 527227024], length 126
15:43:06.102261 IP (tos 0x0, ttl 118, id 1943, offset 0, flags [none], proto TCP (6), length 91)
    64.233.180.101.443 > 172.25.64.219.63643: Flags [P.], cksum 0x69cb (correct), seq 3569:3608, ack 12812, win 601, options [nop,nop,TS val 3790088818 ecr 527227024], length 39
15:43:06.102321 IP (tos 0x0, ttl 64, id 0, offset 0, flags [DF], proto TCP (6), length 52)
    172.25.64.219.63643 > 64.233.180.101.443: Flags [.], cksum 0xa858 (correct), ack 3608, win 2029, options [nop,nop,TS val 527227114 ecr 3790088818], length 0
15:43:06.102876 IP (tos 0x0, ttl 64, id 0, offset 0, flags [DF], proto TCP (6), length 91)
    172.25.64.219.63643 > 64.233.180.101.443: Flags [P.], cksum 0xedc8 (correct), seq 19590:19629, ack 3608, win 2048, options [nop,nop,TS val 527227114 ecr 3790088818], length 39
15:43:06.103153 IP (tos 0x0, ttl 64, id 0, offset 0, flags [DF], proto TCP (6), length 1422)
    172.25.64.219.63643 > 64.233.180.101.443: Flags [.], cksum 0xbaf2 (correct), seq 19629:20999, ack 3608, win 2048, options [nop,nop,TS val 527227114 ecr 3790088818], length 1370
15:43:06.103153 IP (tos 0x0, ttl 64, id 1, offset 0, flags [DF], proto TCP (6), length 1422)
    172.25.64.219.63643 > 64.233.180.101.443: Flags [.], cksum 0xe3d8 (correct), seq 20999:22369, ack 3608, win 2048, options [nop,nop,TS val 527227114 ecr 3790088818], length 1370
15:43:06.103159 IP (tos 0x0, ttl 64, id 0, offset 0, flags [DF], proto TCP (6), length 516)
    172.25.64.219.63643 > 64.233.180.101.443: Flags [P.], cksum 0x241d (correct), seq 22369:22833, ack 3608, win 2048, options [nop,nop,TS val 527227114 ecr 3790088818], length 464
15:43:06.103166 IP (tos 0x0, ttl 64, id 0, offset 0, flags [DF], proto TCP (6), length 236)
    172.25.64.219.63643 > 64.233.180.101.443: Flags [P.], cksum 0xdb99 (correct), seq 22833:23017, ack 3608, win 2048, options [nop,nop,TS val 527227114 ecr 3790088818], length 184
15:43:06.107819 IP (tos 0x0, ttl 118, id 1944, offset 0, flags [none], proto TCP (6), length 64)
    64.233.180.101.443 > 172.25.64.219.63643: Flags [.], cksum 0xc6d4 (correct), ack 14182, win 596, options [nop,nop,TS val 3790088826 ecr 527227109,nop,nop,sack 1 {15552:15784}], length 0
15:43:06.107819 IP (tos 0x0, ttl 118, id 1945, offset 0, flags [none], proto TCP (6), length 52)
    64.233.180.101.443 > 172.25.64.219.63643: Flags [.], cksum 0xbcd2 (correct), ack 15784, win 590, options [nop,nop,TS val 3790088826 ecr 527227109], length 0
15:43:06.108793 IP (tos 0x0, ttl 118, id 1946, offset 0, flags [none], proto TCP (6), length 52)
    64.233.180.101.443 > 172.25.64.219.63643: Flags [.], cksum 0xb228 (correct), ack 18524, win 580, options [nop,nop,TS val 3790088826 ecr 527227109], length 0
15:43:06.110646 IP (tos 0x0, ttl 118, id 1947, offset 0, flags [none], proto TCP (6), length 52)
    64.233.180.101.443 > 172.25.64.219.63643: Flags [.], cksum 0xae01 (correct), ack 19590, win 576, options [nop,nop,TS val 3790088827 ecr 527227109], length 0
15:43:06.114887 IP (tos 0x0, ttl 118, id 1948, offset 0, flags [none], proto TCP (6), length 52)
    64.233.180.101.443 > 172.25.64.219.63643: Flags [.], cksum 0xa87a (correct), ack 20999, win 571, options [nop,nop,TS val 3790088833 ecr 527227114], length 0
15:43:06.114888 IP (tos 0x0, ttl 118, id 1949, offset 0, flags [none], proto TCP (6), length 52)
    64.233.180.101.443 > 172.25.64.219.63643: Flags [.], cksum 0xa157 (correct), ack 22833, win 564, options [nop,nop,TS val 3790088833 ecr 527227114], length 0
15:43:06.121328 IP (tos 0x0, ttl 118, id 1950, offset 0, flags [none], proto TCP (6), length 52)
    64.233.180.101.443 > 172.25.64.219.63643: Flags [.], cksum 0xa09a (correct), ack 23017, win 564, options [nop,nop,TS val 3790088838 ecr 527227114], length 0
15:43:06.137688 IP (tos 0x0, ttl 118, id 1951, offset 0, flags [none], proto TCP (6), length 271)
    64.233.180.101.443 > 172.25.64.219.63643: Flags [P.], cksum 0x397b (correct), seq 3608:3827, ack 23017, win 564, options [nop,nop,TS val 3790088856 ecr 527227114], length 219
15:43:06.137689 IP (tos 0x0, ttl 118, id 1952, offset 0, flags [none], proto TCP (6), length 83)
    64.233.180.101.443 > 172.25.64.219.63643: Flags [P.], cksum 0x1cca (correct), seq 3827:3858, ack 23017, win 564, options [nop,nop,TS val 3790088856 ecr 527227114], length 31
15:43:06.137743 IP (tos 0x0, ttl 64, id 0, offset 0, flags [DF], proto TCP (6), length 52)
    172.25.64.219.63643 > 64.233.180.101.443: Flags [.], cksum 0x99a1 (correct), ack 3858, win 2045, options [nop,nop,TS val 527227150 ecr 3790088856], length 0
15:43:06.138411 IP (tos 0x0, ttl 118, id 1953, offset 0, flags [none], proto TCP (6), length 91)
    64.233.180.101.443 > 172.25.64.219.63643: Flags [P.], cksum 0x8d15 (correct), seq 3858:3897, ack 23017, win 564, options [nop,nop,TS val 3790088856 ecr 527227114], length 39
15:43:06.138432 IP (tos 0x0, ttl 64, id 0, offset 0, flags [DF], proto TCP (6), length 52)
    172.25.64.219.63643 > 64.233.180.101.443: Flags [.], cksum 0x9977 (correct), ack 3897, win 2048, options [nop,nop,TS val 527227150 ecr 3790088856], length 0
15:43:06.138467 IP (tos 0x0, ttl 64, id 0, offset 0, flags [DF], proto TCP (6), length 91)
    172.25.64.219.63643 > 64.233.180.101.443: Flags [P.], cksum 0xef73 (correct), seq 23017:23056, ack 3897, win 2048, options [nop,nop,TS val 527227150 ecr 3790088856], length 39
15:43:06.156030 IP (tos 0x0, ttl 118, id 1954, offset 0, flags [none], proto TCP (6), length 52)
    64.233.180.101.443 > 172.25.64.219.63643: Flags [.], cksum 0x9f0b (correct), ack 23056, win 564, options [nop,nop,TS val 3790088873 ecr 527227150], length 0
15:43:06.399660 IP (tos 0x0, ttl 118, id 1955, offset 0, flags [none], proto TCP (6), length 585)
    64.233.180.101.443 > 172.25.64.219.63643: Flags [P.], cksum 0xac4e (correct), seq 3897:4430, ack 23056, win 564, options [nop,nop,TS val 3790089116 ecr 527227150], length 533
15:43:06.399662 IP (tos 0x0, ttl 118, id 1956, offset 0, flags [none], proto TCP (6), length 259)
    64.233.180.101.443 > 172.25.64.219.63643: Flags [P.], cksum 0x4265 (correct), seq 4430:4637, ack 23056, win 564, options [nop,nop,TS val 3790089116 ecr 527227150], length 207
15:43:06.399663 IP (tos 0x0, ttl 118, id 1957, offset 0, flags [none], proto TCP (6), length 234)
    64.233.180.101.443 > 172.25.64.219.63643: Flags [P.], cksum 0x315d (correct), seq 4637:4819, ack 23056, win 564, options [nop,nop,TS val 3790089116 ecr 527227150], length 182
15:43:06.399663 IP (tos 0x0, ttl 118, id 1958, offset 0, flags [none], proto TCP (6), length 181)
    64.233.180.101.443 > 172.25.64.219.63643: Flags [P.], cksum 0x065b (correct), seq 4819:4948, ack 23056, win 564, options [nop,nop,TS val 3790089116 ecr 527227150], length 129
15:43:06.399793 IP (tos 0x0, ttl 64, id 0, offset 0, flags [DF], proto TCP (6), length 52)
    172.25.64.219.63643 > 64.233.180.101.443: Flags [.], cksum 0x933b (correct), ack 4948, win 2032, options [nop,nop,TS val 527227412 ecr 3790089116], length 0
15:43:06.400039 IP (tos 0x0, ttl 118, id 1959, offset 0, flags [none], proto TCP (6), length 91)
    64.233.180.101.443 > 172.25.64.219.63643: Flags [P.], cksum 0x1679 (correct), seq 4948:4987, ack 23056, win 564, options [nop,nop,TS val 3790089116 ecr 527227150], length 39
15:43:06.400089 IP (tos 0x0, ttl 64, id 0, offset 0, flags [DF], proto TCP (6), length 52)
    172.25.64.219.63643 > 64.233.180.101.443: Flags [.], cksum 0x9304 (correct), ack 4987, win 2048, options [nop,nop,TS val 527227412 ecr 3790089116], length 0
15:43:06.401048 IP (tos 0x0, ttl 64, id 0, offset 0, flags [DF], proto TCP (6), length 91)
    172.25.64.219.63643 > 64.233.180.101.443: Flags [P.], cksum 0x2168 (correct), seq 23056:23095, ack 4987, win 2048, options [nop,nop,TS val 527227413 ecr 3790089116], length 39
15:43:06.415287 IP (tos 0x0, ttl 118, id 1960, offset 0, flags [none], proto TCP (6), length 52)
    64.233.180.101.443 > 172.25.64.219.63643: Flags [.], cksum 0x989a (correct), ack 23095, win 564, options [nop,nop,TS val 3790089130 ecr 527227413], length 0
15:43:06.853187 IP (tos 0x0, ttl 118, id 1961, offset 0, flags [none], proto TCP (6), length 244)
    64.233.180.101.443 > 172.25.64.219.63643: Flags [P.], cksum 0x8afb (correct), seq 4987:5179, ack 23095, win 564, options [nop,nop,TS val 3790089571 ecr 527227413], length 192
15:43:06.853281 IP (tos 0x0, ttl 64, id 0, offset 0, flags [DF], proto TCP (6), length 52)
    172.25.64.219.63643 > 64.233.180.101.443: Flags [.], cksum 0x8e94 (correct), ack 5179, win 2045, options [nop,nop,TS val 527227865 ecr 3790089571], length 0
15:43:07.367969 IP (tos 0x0, ttl 64, id 0, offset 0, flags [DF], proto TCP (6), length 1422)
    172.25.64.219.63643 > 64.233.180.101.443: Flags [.], cksum 0xe6bf (correct), seq 23095:24465, ack 5179, win 2048, options [nop,nop,TS val 527228380 ecr 3790089571], length 1370
15:43:07.367971 IP (tos 0x0, ttl 64, id 1, offset 0, flags [DF], proto TCP (6), length 1422)
    172.25.64.219.63643 > 64.233.180.101.443: Flags [.], cksum 0xa811 (correct), seq 24465:25835, ack 5179, win 2048, options [nop,nop,TS val 527228380 ecr 3790089571], length 1370
15:43:07.368019 IP (tos 0x0, ttl 64, id 0, offset 0, flags [DF], proto TCP (6), length 523)
    172.25.64.219.63643 > 64.233.180.101.443: Flags [P.], cksum 0x4d44 (correct), seq 25835:26306, ack 5179, win 2048, options [nop,nop,TS val 527228380 ecr 3790089571], length 471
15:43:07.368051 IP (tos 0x0, ttl 64, id 0, offset 0, flags [DF], proto TCP (6), length 206)
    172.25.64.219.63643 > 64.233.180.101.443: Flags [P.], cksum 0x636d (correct), seq 26306:26460, ack 5179, win 2048, options [nop,nop,TS val 527228380 ecr 3790089571], length 154
15:43:07.455833 IP (tos 0x0, ttl 118, id 1962, offset 0, flags [none], proto TCP (6), length 52)
    64.233.180.101.443 > 172.25.64.219.63643: Flags [.], cksum 0x8aba (correct), ack 24465, win 559, options [nop,nop,TS val 3790090158 ecr 527228380], length 0
15:43:07.455834 IP (tos 0x0, ttl 118, id 1963, offset 0, flags [none], proto TCP (6), length 64)
    64.233.180.101.443 > 172.25.64.219.63643: Flags [.], cksum 0x3d3b (correct), ack 24465, win 559, options [nop,nop,TS val 3790090158 ecr 527228380,nop,nop,sack 1 {25835:26306}], length 0
15:43:07.455835 IP (tos 0x0, ttl 118, id 1964, offset 0, flags [none], proto TCP (6), length 52)
    64.233.180.101.443 > 172.25.64.219.63643: Flags [.], cksum 0x8390 (correct), ack 26306, win 552, options [nop,nop,TS val 3790090158 ecr 527228380], length 0
15:43:07.455835 IP (tos 0x0, ttl 118, id 1965, offset 0, flags [none], proto TCP (6), length 52)
    64.233.180.101.443 > 172.25.64.219.63643: Flags [.], cksum 0x82f6 (correct), ack 26460, win 552, options [nop,nop,TS val 3790090158 ecr 527228380], length 0
15:43:07.550834 IP (tos 0x0, ttl 118, id 1966, offset 0, flags [none], proto TCP (6), length 575)
    64.233.180.101.443 > 172.25.64.219.63643: Flags [P.], cksum 0x52ce (correct), seq 5179:5702, ack 26460, win 552, options [nop,nop,TS val 3790090266 ecr 527228380], length 523
15:43:07.550835 IP (tos 0x0, ttl 118, id 1967, offset 0, flags [none], proto TCP (6), length 352)
    64.233.180.101.443 > 172.25.64.219.63643: Flags [P.], cksum 0x8dbb (correct), seq 5702:6002, ack 26460, win 552, options [nop,nop,TS val 3790090266 ecr 527228380], length 300
15:43:07.550836 IP (tos 0x0, ttl 118, id 1968, offset 0, flags [none], proto TCP (6), length 140)
    64.233.180.101.443 > 172.25.64.219.63643: Flags [P.], cksum 0x836f (correct), seq 6002:6090, ack 26460, win 552, options [nop,nop,TS val 3790090266 ecr 527228380], length 88
15:43:07.550836 IP (tos 0x0, ttl 118, id 1969, offset 0, flags [none], proto TCP (6), length 83)
    64.233.180.101.443 > 172.25.64.219.63643: Flags [P.], cksum 0x5911 (correct), seq 6090:6121, ack 26460, win 552, options [nop,nop,TS val 3790090266 ecr 527228380], length 31
15:43:07.550836 IP (tos 0x0, ttl 118, id 1970, offset 0, flags [none], proto TCP (6), length 91)
    64.233.180.101.443 > 172.25.64.219.63643: Flags [P.], cksum 0x9da1 (correct), seq 6121:6160, ack 26460, win 552, options [nop,nop,TS val 3790090266 ecr 527228380], length 39
15:43:07.550928 IP (tos 0x0, ttl 64, id 0, offset 0, flags [DF], proto TCP (6), length 52)
    172.25.64.219.63643 > 64.233.180.101.443: Flags [.], cksum 0x7835 (correct), ack 6160, win 2033, options [nop,nop,TS val 527228563 ecr 3790090266], length 0
15:43:07.552455 IP (tos 0x0, ttl 64, id 0, offset 0, flags [DF], proto TCP (6), length 91)
    172.25.64.219.63643 > 64.233.180.101.443: Flags [P.], cksum 0x13f4 (correct), seq 26460:26499, ack 6160, win 2048, options [nop,nop,TS val 527228564 ecr 3790090266], length 39
15:43:07.601879 IP (tos 0x0, ttl 118, id 1971, offset 0, flags [none], proto TCP (6), length 91)
    64.233.180.101.443 > 172.25.64.219.63643: Flags [P.], cksum 0x9d7f (correct), seq 6121:6160, ack 26460, win 552, options [nop,nop,TS val 3790090300 ecr 527228380], length 39
15:43:07.601985 IP (tos 0x0, ttl 64, id 0, offset 0, flags [DF], proto TCP (6), length 64)
    172.25.64.219.63643 > 64.233.180.101.443: Flags [.], cksum 0x4839 (correct), ack 6160, win 2048, options [nop,nop,TS val 527228614 ecr 3790090300,nop,nop,sack 1 {6121:6160}], length 0
15:43:07.611268 IP (tos 0x0, ttl 118, id 1972, offset 0, flags [none], proto TCP (6), length 52)
    64.233.180.101.443 > 172.25.64.219.63643: Flags [.], cksum 0x7d97 (correct), ack 26499, win 552, options [nop,nop,TS val 3790090329 ecr 527228564], length 0
15:43:07.866057 IP (tos 0x0, ttl 118, id 1973, offset 0, flags [none], proto TCP (6), length 1250)
    64.233.180.101.443 > 172.25.64.219.63643: Flags [P.], cksum 0x7a3f (correct), seq 6160:7358, ack 26499, win 552, options [nop,nop,TS val 3790090536 ecr 527228614], length 1198
15:43:07.866058 IP (tos 0x0, ttl 118, id 1974, offset 0, flags [none], proto TCP (6), length 253)
    64.233.180.101.443 > 172.25.64.219.63643: Flags [P.], cksum 0x06dc (correct), seq 7358:7559, ack 26499, win 552, options [nop,nop,TS val 3790090575 ecr 527228614], length 201
15:43:07.866149 IP (tos 0x0, ttl 64, id 0, offset 0, flags [DF], proto TCP (6), length 52)
    172.25.64.219.63643 > 64.233.180.101.443: Flags [.], cksum 0x702d (correct), ack 7559, win 2027, options [nop,nop,TS val 527228878 ecr 3790090575], length 0
15:43:07.904401 IP (tos 0x0, ttl 118, id 1975, offset 0, flags [none], proto TCP (6), length 376)
    64.233.180.101.443 > 172.25.64.219.63643: Flags [P.], cksum 0xedb0 (correct), seq 7559:7883, ack 26499, win 552, options [nop,nop,TS val 3790090618 ecr 527228878], length 324
15:43:07.904509 IP (tos 0x0, ttl 64, id 0, offset 0, flags [DF], proto TCP (6), length 52)
    172.25.64.219.63643 > 64.233.180.101.443: Flags [.], cksum 0x6e88 (correct), ack 7883, win 2043, options [nop,nop,TS val 527228916 ecr 3790090618], length 0
15:43:07.971139 IP (tos 0x0, ttl 118, id 1976, offset 0, flags [none], proto TCP (6), length 375)
    64.233.180.101.443 > 172.25.64.219.63643: Flags [P.], cksum 0x2b44 (correct), seq 7883:8206, ack 26499, win 552, options [nop,nop,TS val 3790090688 ecr 527228916], length 323
15:43:07.971254 IP (tos 0x0, ttl 64, id 0, offset 0, flags [DF], proto TCP (6), length 52)
    172.25.64.219.63643 > 64.233.180.101.443: Flags [.], cksum 0x6cbc (correct), ack 8206, win 2043, options [nop,nop,TS val 527228983 ecr 3790090688], length 0
15:43:08.015881 IP (tos 0x0, ttl 118, id 1977, offset 0, flags [none], proto TCP (6), length 212)
    64.233.180.101.443 > 172.25.64.219.63643: Flags [P.], cksum 0xb5c5 (correct), seq 8206:8366, ack 26499, win 552, options [nop,nop,TS val 3790090732 ecr 527228983], length 160
15:43:08.015981 IP (tos 0x0, ttl 64, id 0, offset 0, flags [DF], proto TCP (6), length 52)
    172.25.64.219.63643 > 64.233.180.101.443: Flags [.], cksum 0x6bc0 (correct), ack 8366, win 2046, options [nop,nop,TS val 527229028 ecr 3790090732], length 0
15:43:08.072370 IP (tos 0x0, ttl 118, id 1978, offset 0, flags [none], proto TCP (6), length 262)
    64.233.180.101.443 > 172.25.64.219.63643: Flags [P.], cksum 0x9a95 (correct), seq 8366:8576, ack 26499, win 552, options [nop,nop,TS val 3790090790 ecr 527229028], length 210
15:43:08.072500 IP (tos 0x0, ttl 64, id 0, offset 0, flags [DF], proto TCP (6), length 52)
    172.25.64.219.63643 > 64.233.180.101.443: Flags [.], cksum 0x6a7d (correct), ack 8576, win 2045, options [nop,nop,TS val 527229084 ecr 3790090790], length 0
15:43:08.164300 IP (tos 0x0, ttl 118, id 1979, offset 0, flags [none], proto TCP (6), length 223)
    64.233.180.101.443 > 172.25.64.219.63643: Flags [P.], cksum 0x3e80 (correct), seq 8576:8747, ack 26499, win 552, options [nop,nop,TS val 3790090881 ecr 527229084], length 171
15:43:08.164432 IP (tos 0x0, ttl 64, id 0, offset 0, flags [DF], proto TCP (6), length 52)
    172.25.64.219.63643 > 64.233.180.101.443: Flags [.], cksum 0x691a (correct), ack 8747, win 2046, options [nop,nop,TS val 527229176 ecr 3790090881], length 0
15:43:08.208016 IP (tos 0x0, ttl 118, id 1980, offset 0, flags [none], proto TCP (6), length 370)
    64.233.180.101.443 > 172.25.64.219.63643: Flags [P.], cksum 0x6bad (correct), seq 8747:9065, ack 26499, win 552, options [nop,nop,TS val 3790090924 ecr 527229176], length 318
15:43:08.208125 IP (tos 0x0, ttl 64, id 0, offset 0, flags [DF], proto TCP (6), length 52)
    172.25.64.219.63643 > 64.233.180.101.443: Flags [.], cksum 0x6787 (correct), ack 9065, win 2044, options [nop,nop,TS val 527229220 ecr 3790090924], length 0
15:43:08.253981 IP (tos 0x0, ttl 118, id 1981, offset 0, flags [none], proto TCP (6), length 359)
    64.233.180.101.443 > 172.25.64.219.63643: Flags [P.], cksum 0x16f4 (correct), seq 9065:9372, ack 26499, win 552, options [nop,nop,TS val 3790090970 ecr 527229220], length 307
15:43:08.254090 IP (tos 0x0, ttl 64, id 0, offset 0, flags [DF], proto TCP (6), length 52)
    172.25.64.219.63643 > 64.233.180.101.443: Flags [.], cksum 0x65f8 (correct), ack 9372, win 2044, options [nop,nop,TS val 527229266 ecr 3790090970], length 0
15:43:08.293683 IP (tos 0x0, ttl 118, id 1982, offset 0, flags [none], proto TCP (6), length 364)
    64.233.180.101.443 > 172.25.64.219.63643: Flags [P.], cksum 0xa53c (correct), seq 9372:9684, ack 26499, win 552, options [nop,nop,TS val 3790091009 ecr 527229266], length 312
15:43:08.293785 IP (tos 0x0, ttl 64, id 0, offset 0, flags [DF], proto TCP (6), length 52)
    172.25.64.219.63643 > 64.233.180.101.443: Flags [.], cksum 0x6471 (correct), ack 9684, win 2044, options [nop,nop,TS val 527229306 ecr 3790091009], length 0
15:43:08.335673 IP (tos 0x0, ttl 118, id 1983, offset 0, flags [none], proto TCP (6), length 386)
    64.233.180.101.443 > 172.25.64.219.63643: Flags [P.], cksum 0x1e79 (correct), seq 9684:10018, ack 26499, win 552, options [nop,nop,TS val 3790091053 ecr 527229306], length 334
15:43:08.335746 IP (tos 0x0, ttl 64, id 0, offset 0, flags [DF], proto TCP (6), length 52)
    172.25.64.219.63643 > 64.233.180.101.443: Flags [.], cksum 0x62ce (correct), ack 10018, win 2043, options [nop,nop,TS val 527229348 ecr 3790091053], length 0
15:43:08.366252 IP (tos 0x0, ttl 118, id 1984, offset 0, flags [none], proto TCP (6), length 239)
    64.233.180.101.443 > 172.25.64.219.63643: Flags [P.], cksum 0x3200 (correct), seq 10018:10205, ack 26499, win 552, options [nop,nop,TS val 3790091082 ecr 527229348], length 187
15:43:08.366353 IP (tos 0x0, ttl 64, id 0, offset 0, flags [DF], proto TCP (6), length 52)
    172.25.64.219.63643 > 64.233.180.101.443: Flags [.], cksum 0x61d5 (correct), ack 10205, win 2046, options [nop,nop,TS val 527229378 ecr 3790091082], length 0
15:43:08.414320 IP (tos 0x0, ttl 118, id 1985, offset 0, flags [none], proto TCP (6), length 315)
    64.233.180.101.443 > 172.25.64.219.63643: Flags [P.], cksum 0xa102 (correct), seq 10205:10468, ack 26499, win 552, options [nop,nop,TS val 3790091131 ecr 527229378], length 263
15:43:08.414459 IP (tos 0x0, ttl 64, id 0, offset 0, flags [DF], proto TCP (6), length 52)
    172.25.64.219.63643 > 64.233.180.101.443: Flags [.], cksum 0x606f (correct), ack 10468, win 2044, options [nop,nop,TS val 527229426 ecr 3790091131], length 0
15:43:08.455570 IP (tos 0x0, ttl 118, id 1986, offset 0, flags [none], proto TCP (6), length 199)
    64.233.180.101.443 > 172.25.64.219.63643: Flags [P.], cksum 0x38cb (correct), seq 10468:10615, ack 26499, win 552, options [nop,nop,TS val 3790091172 ecr 527229426], length 147
15:43:08.455687 IP (tos 0x0, ttl 64, id 0, offset 0, flags [DF], proto TCP (6), length 52)
    172.25.64.219.63643 > 64.233.180.101.443: Flags [.], cksum 0x5f87 (correct), ack 10615, win 2046, options [nop,nop,TS val 527229468 ecr 3790091172], length 0
15:43:08.492275 IP (tos 0x0, ttl 118, id 1987, offset 0, flags [none], proto TCP (6), length 212)
    64.233.180.101.443 > 172.25.64.219.63643: Flags [P.], cksum 0xe6fc (correct), seq 10615:10775, ack 26499, win 552, options [nop,nop,TS val 3790091209 ecr 527229468], length 160
15:43:08.492375 IP (tos 0x0, ttl 64, id 0, offset 0, flags [DF], proto TCP (6), length 52)
    172.25.64.219.63643 > 64.233.180.101.443: Flags [.], cksum 0x5e9e (correct), ack 10775, win 2046, options [nop,nop,TS val 527229504 ecr 3790091209], length 0
15:43:08.538865 IP (tos 0x0, ttl 118, id 1988, offset 0, flags [none], proto TCP (6), length 285)
    64.233.180.101.443 > 172.25.64.219.63643: Flags [P.], cksum 0x5985 (correct), seq 10775:11008, ack 26499, win 552, options [nop,nop,TS val 3790091255 ecr 527229504], length 233
15:43:08.538952 IP (tos 0x0, ttl 64, id 0, offset 0, flags [DF], proto TCP (6), length 52)
    172.25.64.219.63643 > 64.233.180.101.443: Flags [.], cksum 0x5d56 (correct), ack 11008, win 2048, options [nop,nop,TS val 527229551 ecr 3790091255], length 0
15:43:08.673459 IP (tos 0x0, ttl 118, id 1989, offset 0, flags [none], proto TCP (6), length 397)
    64.233.180.101.443 > 172.25.64.219.63643: Flags [P.], cksum 0x2a1b (correct), seq 11008:11353, ack 26499, win 552, options [nop,nop,TS val 3790091385 ecr 527229551], length 345
15:43:08.673656 IP (tos 0x0, ttl 64, id 0, offset 0, flags [DF], proto TCP (6), length 52)
    172.25.64.219.63643 > 64.233.180.101.443: Flags [.], cksum 0x5af5 (correct), ack 11353, win 2048, options [nop,nop,TS val 527229685 ecr 3790091385], length 0
15:43:08.777380 IP (tos 0x0, ttl 118, id 1990, offset 0, flags [none], proto TCP (6), length 460)
    64.233.180.101.443 > 172.25.64.219.63643: Flags [P.], cksum 0x0edd (correct), seq 11353:11761, ack 26499, win 552, options [nop,nop,TS val 3790091494 ecr 527229685], length 408
15:43:08.777496 IP (tos 0x0, ttl 64, id 0, offset 0, flags [DF], proto TCP (6), length 52)
    172.25.64.219.63643 > 64.233.180.101.443: Flags [.], cksum 0x5888 (correct), ack 11761, win 2048, options [nop,nop,TS val 527229789 ecr 3790091494], length 0
15:43:08.891991 IP (tos 0x0, ttl 118, id 1991, offset 0, flags [none], proto TCP (6), length 327)
    64.233.180.101.443 > 172.25.64.219.63643: Flags [P.], cksum 0x7cc8 (correct), seq 11761:12036, ack 26499, win 552, options [nop,nop,TS val 3790091607 ecr 527229789], length 275
15:43:08.892188 IP (tos 0x0, ttl 64, id 0, offset 0, flags [DF], proto TCP (6), length 52)
    172.25.64.219.63643 > 64.233.180.101.443: Flags [.], cksum 0x5691 (correct), ack 12036, win 2048, options [nop,nop,TS val 527229904 ecr 3790091607], length 0
15:43:09.019385 IP (tos 0x0, ttl 118, id 1992, offset 0, flags [none], proto TCP (6), length 310)
    64.233.180.101.443 > 172.25.64.219.63643: Flags [P.], cksum 0x6bc8 (correct), seq 12036:12294, ack 26499, win 552, options [nop,nop,TS val 3790091737 ecr 527229904], length 258
15:43:09.019534 IP (tos 0x0, ttl 64, id 0, offset 0, flags [DF], proto TCP (6), length 52)
    172.25.64.219.63643 > 64.233.180.101.443: Flags [.], cksum 0x548e (correct), ack 12294, win 2048, options [nop,nop,TS val 527230031 ecr 3790091737], length 0
15:43:09.134909 IP (tos 0x0, ttl 118, id 1993, offset 0, flags [none], proto TCP (6), length 231)
    64.233.180.101.443 > 172.25.64.219.63643: Flags [P.], cksum 0x0a5c (correct), seq 12294:12473, ack 26499, win 552, options [nop,nop,TS val 3790091851 ecr 527230031], length 179
15:43:09.135015 IP (tos 0x0, ttl 64, id 0, offset 0, flags [DF], proto TCP (6), length 52)
    172.25.64.219.63643 > 64.233.180.101.443: Flags [.], cksum 0x52f5 (correct), ack 12473, win 2048, options [nop,nop,TS val 527230147 ecr 3790091851], length 0
15:43:09.249869 IP (tos 0x0, ttl 118, id 1994, offset 0, flags [none], proto TCP (6), length 370)
    64.233.180.101.443 > 172.25.64.219.63643: Flags [P.], cksum 0xf0e1 (correct), seq 12473:12791, ack 26499, win 552, options [nop,nop,TS val 3790091967 ecr 527230147], length 318
15:43:09.250002 IP (tos 0x0, ttl 64, id 0, offset 0, flags [DF], proto TCP (6), length 52)
    172.25.64.219.63643 > 64.233.180.101.443: Flags [.], cksum 0x50d0 (correct), ack 12791, win 2048, options [nop,nop,TS val 527230262 ecr 3790091967], length 0
15:43:09.377509 IP (tos 0x0, ttl 118, id 1995, offset 0, flags [none], proto TCP (6), length 320)
    64.233.180.101.443 > 172.25.64.219.63643: Flags [P.], cksum 0xc7c6 (correct), seq 12791:13059, ack 26499, win 552, options [nop,nop,TS val 3790092094 ecr 527230262], length 268
15:43:09.377695 IP (tos 0x0, ttl 64, id 0, offset 0, flags [DF], proto TCP (6), length 52)
    172.25.64.219.63643 > 64.233.180.101.443: Flags [.], cksum 0x4ec5 (correct), ack 13059, win 2048, options [nop,nop,TS val 527230390 ecr 3790092094], length 0
15:43:09.491204 IP (tos 0x0, ttl 118, id 1996, offset 0, flags [none], proto TCP (6), length 434)
