tcpdump: data link type PKTAP
tcpdump: WARNING: snaplen raised from 96 to 524288
tcpdump: listening on pktap, link-type PKTAP (Apple DLT_PKTAP), snapshot length 524288 bytes
15:52:16.990815 IP (tos 0x0, ttl 64, id 0, offset 0, flags [DF], proto TCP (6), length 1422)
    172.25.64.219.64035 > 64.233.180.139.443: Flags [.], cksum 0x77d6 (correct), seq 2598995317:2598996687, ack 1812792633, win 2048, options [nop,nop,TS val 3473484543 ecr 4257732150], length 1370
15:52:16.990818 IP (tos 0x0, ttl 64, id 1, offset 0, flags [DF], proto TCP (6), length 1422)
    172.25.64.219.64035 > 64.233.180.139.443: Flags [.], cksum 0x9005 (correct), seq 1370:2740, ack 1, win 2048, options [nop,nop,TS val 3473484543 ecr 4257732150], length 1370
15:52:16.990889 IP (tos 0x0, ttl 64, id 0, offset 0, flags [DF], proto TCP (6), length 510)
    172.25.64.219.64035 > 64.233.180.139.443: Flags [P.], cksum 0xbdbe (correct), seq 2740:3198, ack 1, win 2048, options [nop,nop,TS val 3473484543 ecr 4257732150], length 458
15:52:16.991011 IP (tos 0x0, ttl 64, id 0, offset 0, flags [DF], proto TCP (6), length 91)
    172.25.64.219.64035 > 64.233.180.139.443: Flags [P.], cksum 0xfad5 (correct), seq 3198:3237, ack 1, win 2048, options [nop,nop,TS val 3473484543 ecr 4257732150], length 39
15:52:16.991050 IP (tos 0x0, ttl 64, id 0, offset 0, flags [DF], proto TCP (6), length 250)
    172.25.64.219.64035 > 64.233.180.139.443: Flags [P.], cksum 0x5236 (correct), seq 3237:3435, ack 1, win 2048, options [nop,nop,TS val 3473484543 ecr 4257732150], length 198
15:52:16.998005 IP (tos 0x0, ttl 64, id 0, offset 0, flags [DF], proto TCP (6), length 1422)
    172.25.64.219.64035 > 64.233.180.139.443: Flags [.], cksum 0xc2da (correct), seq 3435:4805, ack 1, win 2048, options [nop,nop,TS val 3473484550 ecr 4257732150], length 1370
15:52:17.005568 IP (tos 0x0, ttl 118, id 38004, offset 0, flags [none], proto TCP (6), length 52)
    64.233.180.139.443 > 172.25.64.219.64035: Flags [.], cksum 0xea8d (correct), ack 1370, win 884, options [nop,nop,TS val 4257749922 ecr 3473484543], length 0
15:52:17.005569 IP (tos 0x0, ttl 118, id 38005, offset 0, flags [none], proto TCP (6), length 64)
    64.233.180.139.443 > 172.25.64.219.64035: Flags [.], cksum 0x5c86 (correct), ack 1370, win 884, options [nop,nop,TS val 4257749922 ecr 3473484543,nop,nop,sack 1 {2740:3198}], length 0
15:52:17.005570 IP (tos 0x0, ttl 118, id 38006, offset 0, flags [none], proto TCP (6), length 52)
    64.233.180.139.443 > 172.25.64.219.64035: Flags [.], cksum 0xe370 (correct), ack 3198, win 877, options [nop,nop,TS val 4257749922 ecr 3473484543], length 0
15:52:17.005570 IP (tos 0x0, ttl 118, id 38007, offset 0, flags [none], proto TCP (6), length 52)
    64.233.180.139.443 > 172.25.64.219.64035: Flags [.], cksum 0xe349 (correct), ack 3237, win 877, options [nop,nop,TS val 4257749922 ecr 3473484543], length 0
15:52:17.005570 IP (tos 0x0, ttl 118, id 38008, offset 0, flags [none], proto TCP (6), length 52)
    64.233.180.139.443 > 172.25.64.219.64035: Flags [.], cksum 0xe283 (correct), ack 3435, win 877, options [nop,nop,TS val 4257749922 ecr 3473484543], length 0
15:52:17.005571 IP (tos 0x0, ttl 118, id 38009, offset 0, flags [none], proto TCP (6), length 91)
    64.233.180.139.443 > 172.25.64.219.64035: Flags [P.], cksum 0x37c2 (correct), seq 1:40, ack 3435, win 877, options [nop,nop,TS val 4257749923 ecr 3473484543], length 39
15:52:17.005667 IP (tos 0x0, ttl 64, id 0, offset 0, flags [DF], proto TCP (6), length 1422)
    172.25.64.219.64035 > 64.233.180.139.443: Flags [.], cksum 0x719b (correct), seq 4805:6175, ack 1, win 2048, options [nop,nop,TS val 3473484558 ecr 4257749922], length 1370
15:52:17.005669 IP (tos 0x0, ttl 64, id 1, offset 0, flags [DF], proto TCP (6), length 1422)
    172.25.64.219.64035 > 64.233.180.139.443: Flags [.], cksum 0xdecb (correct), seq 6175:7545, ack 1, win 2048, options [nop,nop,TS val 3473484558 ecr 4257749922], length 1370
15:52:17.005740 IP (tos 0x0, ttl 64, id 0, offset 0, flags [DF], proto TCP (6), length 1422)
    172.25.64.219.64035 > 64.233.180.139.443: Flags [.], cksum 0x87c7 (correct), seq 7545:8915, ack 1, win 2048, options [nop,nop,TS val 3473484558 ecr 4257749922], length 1370
15:52:17.005751 IP (tos 0x0, ttl 64, id 0, offset 0, flags [DF], proto TCP (6), length 444)
    172.25.64.219.64035 > 64.233.180.139.443: Flags [P.], cksum 0x8ebf (correct), seq 8915:9307, ack 1, win 2048, options [nop,nop,TS val 3473484558 ecr 4257749922], length 392
15:52:17.005782 IP (tos 0x0, ttl 64, id 0, offset 0, flags [DF], proto TCP (6), length 52)
    172.25.64.219.64035 > 64.233.180.139.443: Flags [.], cksum 0xc6c9 (correct), ack 40, win 2048, options [nop,nop,TS val 3473484558 ecr 4257749923], length 0
15:52:17.013763 IP (tos 0x0, ttl 118, id 38010, offset 0, flags [none], proto TCP (6), length 52)
    64.233.180.139.443 > 172.25.64.219.64035: Flags [.], cksum 0xdcf7 (correct), ack 4805, win 872, options [nop,nop,TS val 4257749931 ecr 3473484550], length 0
15:52:17.018378 IP (tos 0x0, ttl 118, id 38011, offset 0, flags [none], proto TCP (6), length 52)
    64.233.180.139.443 > 172.25.64.219.64035: Flags [.], cksum 0xd797 (correct), ack 6175, win 867, options [nop,nop,TS val 4257749934 ecr 3473484558], length 0
15:52:17.018379 IP (tos 0x0, ttl 118, id 38012, offset 0, flags [none], proto TCP (6), length 52)
    64.233.180.139.443 > 172.25.64.219.64035: Flags [.], cksum 0xd241 (correct), ack 7545, win 862, options [nop,nop,TS val 4257749935 ecr 3473484558], length 0
15:52:17.018380 IP (tos 0x0, ttl 118, id 38013, offset 0, flags [none], proto TCP (6), length 64)
    64.233.180.139.443 > 172.25.64.219.64035: Flags [.], cksum 0x143e (correct), ack 7545, win 862, options [nop,nop,TS val 4257749935 ecr 3473484558,nop,nop,sack 1 {8915:9307}], length 0
15:52:17.018380 IP (tos 0x0, ttl 118, id 38014, offset 0, flags [none], proto TCP (6), length 52)
    64.233.180.139.443 > 172.25.64.219.64035: Flags [.], cksum 0xcb65 (correct), ack 9307, win 856, options [nop,nop,TS val 4257749935 ecr 3473484558], length 0
15:52:17.090392 IP (tos 0x0, ttl 118, id 38015, offset 0, flags [none], proto TCP (6), length 571)
    64.233.180.139.443 > 172.25.64.219.64035: Flags [P.], cksum 0x464c (correct), seq 40:559, ack 9307, win 856, options [nop,nop,TS val 4257750006 ecr 3473484558], length 519
15:52:17.090393 IP (tos 0x0, ttl 118, id 38016, offset 0, flags [none], proto TCP (6), length 238)
    64.233.180.139.443 > 172.25.64.219.64035: Flags [P.], cksum 0x8d96 (correct), seq 559:745, ack 9307, win 856, options [nop,nop,TS val 4257750006 ecr 3473484558], length 186
15:52:17.090393 IP (tos 0x0, ttl 118, id 38017, offset 0, flags [none], proto TCP (6), length 366)
    64.233.180.139.443 > 172.25.64.219.64035: Flags [P.], cksum 0xfe7f (correct), seq 745:1059, ack 9307, win 856, options [nop,nop,TS val 4257750006 ecr 3473484558], length 314
15:52:17.090393 IP (tos 0x0, ttl 118, id 38018, offset 0, flags [none], proto TCP (6), length 91)
    64.233.180.139.443 > 172.25.64.219.64035: Flags [P.], cksum 0x1c40 (correct), seq 1059:1098, ack 9307, win 856, options [nop,nop,TS val 4257750006 ecr 3473484558], length 39
15:52:17.090442 IP (tos 0x0, ttl 64, id 0, offset 0, flags [DF], proto TCP (6), length 52)
    172.25.64.219.64035 > 64.233.180.139.443: Flags [.], cksum 0xc210 (correct), ack 1098, win 2032, options [nop,nop,TS val 3473484642 ecr 4257750006], length 0
15:52:17.091037 IP (tos 0x0, ttl 64, id 0, offset 0, flags [DF], proto TCP (6), length 87)
    172.25.64.219.64035 > 64.233.180.139.443: Flags [P.], cksum 0x13f5 (correct), seq 9307:9342, ack 1098, win 2048, options [nop,nop,TS val 3473484643 ecr 4257750006], length 35
15:52:17.091051 IP (tos 0x0, ttl 64, id 0, offset 0, flags [DF], proto TCP (6), length 91)
    172.25.64.219.64035 > 64.233.180.139.443: Flags [P.], cksum 0x9612 (correct), seq 9342:9381, ack 1098, win 2048, options [nop,nop,TS val 3473484643 ecr 4257750006], length 39
15:52:17.096805 IP (tos 0x0, ttl 64, id 0, offset 0, flags [DF], proto TCP (6), length 1422)
    172.25.64.219.64035 > 64.233.180.139.443: Flags [.], cksum 0xfd5b (correct), seq 9381:10751, ack 1098, win 2048, options [nop,nop,TS val 3473484649 ecr 4257750006], length 1370
15:52:17.096806 IP (tos 0x0, ttl 64, id 1, offset 0, flags [DF], proto TCP (6), length 1422)
    172.25.64.219.64035 > 64.233.180.139.443: Flags [.], cksum 0x709b (correct), seq 10751:12121, ack 1098, win 2048, options [nop,nop,TS val 3473484649 ecr 4257750006], length 1370
15:52:17.096822 IP (tos 0x0, ttl 64, id 0, offset 0, flags [DF], proto TCP (6), length 278)
    172.25.64.219.64035 > 64.233.180.139.443: Flags [P.], cksum 0x617a (correct), seq 12121:12347, ack 1098, win 2048, options [nop,nop,TS val 3473484649 ecr 4257750006], length 226
15:52:17.096834 IP (tos 0x0, ttl 64, id 0, offset 0, flags [DF], proto TCP (6), length 1422)
    172.25.64.219.64035 > 64.233.180.139.443: Flags [.], cksum 0x4a6d (correct), seq 12347:13717, ack 1098, win 2048, options [nop,nop,TS val 3473484649 ecr 4257750006], length 1370
15:52:17.096834 IP (tos 0x0, ttl 64, id 1, offset 0, flags [DF], proto TCP (6), length 1422)
    172.25.64.219.64035 > 64.233.180.139.443: Flags [.], cksum 0xc379 (correct), seq 13717:15087, ack 1098, win 2048, options [nop,nop,TS val 3473484649 ecr 4257750006], length 1370
15:52:17.096836 IP (tos 0x0, ttl 64, id 0, offset 0, flags [DF], proto TCP (6), length 1083)
    172.25.64.219.64035 > 64.233.180.139.443: Flags [P.], cksum 0xc0a5 (correct), seq 15087:16118, ack 1098, win 2048, options [nop,nop,TS val 3473484649 ecr 4257750006], length 1031
15:52:17.101677 IP (tos 0x0, ttl 118, id 38019, offset 0, flags [none], proto TCP (6), length 52)
    64.233.180.139.443 > 172.25.64.219.64035: Flags [.], cksum 0xc677 (correct), ack 9342, win 856, options [nop,nop,TS val 4257750019 ecr 3473484643], length 0
15:52:17.101677 IP (tos 0x0, ttl 118, id 38020, offset 0, flags [none], proto TCP (6), length 52)
    64.233.180.139.443 > 172.25.64.219.64035: Flags [.], cksum 0xc650 (correct), ack 9381, win 856, options [nop,nop,TS val 4257750019 ecr 3473484643], length 0
15:52:17.108921 IP (tos 0x0, ttl 118, id 38021, offset 0, flags [none], proto TCP (6), length 52)
    64.233.180.139.443 > 172.25.64.219.64035: Flags [.], cksum 0xc0ef (correct), ack 10751, win 851, options [nop,nop,TS val 4257750025 ecr 3473484649], length 0
15:52:17.108921 IP (tos 0x0, ttl 118, id 38022, offset 0, flags [none], proto TCP (6), length 64)
    64.233.180.139.443 > 172.25.64.219.64035: Flags [.], cksum 0xea85 (correct), ack 10751, win 851, options [nop,nop,TS val 4257750025 ecr 3473484649,nop,nop,sack 1 {12121:12347}], length 0
15:52:17.108921 IP (tos 0x0, ttl 118, id 38023, offset 0, flags [none], proto TCP (6), length 52)
    64.233.180.139.443 > 172.25.64.219.64035: Flags [.], cksum 0xbab9 (correct), ack 12347, win 845, options [nop,nop,TS val 4257750025 ecr 3473484649], length 0
15:52:17.108921 IP (tos 0x0, ttl 118, id 38024, offset 0, flags [none], proto TCP (6), length 52)
    64.233.180.139.443 > 172.25.64.219.64035: Flags [.], cksum 0xb564 (correct), ack 13717, win 840, options [nop,nop,TS val 4257750025 ecr 3473484649], length 0
15:52:17.108921 IP (tos 0x0, ttl 118, id 38025, offset 0, flags [none], proto TCP (6), length 52)
    64.233.180.139.443 > 172.25.64.219.64035: Flags [.], cksum 0xac0c (correct), ack 16118, win 831, options [nop,nop,TS val 4257750025 ecr 3473484649], length 0
15:52:17.131220 IP (tos 0x0, ttl 118, id 38026, offset 0, flags [none], proto TCP (6), length 585)
    64.233.180.139.443 > 172.25.64.219.64035: Flags [P.], cksum 0xebd9 (correct), seq 1098:1631, ack 16118, win 831, options [nop,nop,TS val 4257750049 ecr 3473484649], length 533
15:52:17.131220 IP (tos 0x0, ttl 118, id 38027, offset 0, flags [none], proto TCP (6), length 447)
    64.233.180.139.443 > 172.25.64.219.64035: Flags [P.], cksum 0xd9a8 (correct), seq 1631:2026, ack 16118, win 831, options [nop,nop,TS val 4257750049 ecr 3473484649], length 395
15:52:17.131262 IP (tos 0x0, ttl 64, id 0, offset 0, flags [DF], proto TCP (6), length 52)
    172.25.64.219.64035 > 64.233.180.139.443: Flags [.], cksum 0xa37e (correct), ack 2026, win 2034, options [nop,nop,TS val 3473484684 ecr 4257750049], length 0
15:52:17.136847 IP (tos 0x0, ttl 64, id 0, offset 0, flags [DF], proto TCP (6), length 1422)
    172.25.64.219.64035 > 64.233.180.139.443: Flags [.], cksum 0x7c3c (correct), seq 16118:17488, ack 2026, win 2048, options [nop,nop,TS val 3473484689 ecr 4257750049], length 1370
15:52:17.136848 IP (tos 0x0, ttl 64, id 1, offset 0, flags [DF], proto TCP (6), length 1422)
    172.25.64.219.64035 > 64.233.180.139.443: Flags [.], cksum 0x6cb7 (correct), seq 17488:18858, ack 2026, win 2048, options [nop,nop,TS val 3473484689 ecr 4257750049], length 1370
15:52:17.136859 IP (tos 0x0, ttl 64, id 0, offset 0, flags [DF], proto TCP (6), length 511)
    172.25.64.219.64035 > 64.233.180.139.443: Flags [P.], cksum 0xce19 (correct), seq 18858:19317, ack 2026, win 2048, options [nop,nop,TS val 3473484689 ecr 4257750049], length 459
15:52:17.136866 IP (tos 0x0, ttl 64, id 0, offset 0, flags [DF], proto TCP (6), length 236)
    172.25.64.219.64035 > 64.233.180.139.443: Flags [P.], cksum 0x1193 (correct), seq 19317:19501, ack 2026, win 2048, options [nop,nop,TS val 3473484689 ecr 4257750049], length 184
15:52:17.149960 IP (tos 0x0, ttl 118, id 38028, offset 0, flags [none], proto TCP (6), length 52)
    64.233.180.139.443 > 172.25.64.219.64035: Flags [.], cksum 0x9d71 (correct), ack 18858, win 821, options [nop,nop,TS val 4257750066 ecr 3473484689], length 0
15:52:17.149960 IP (tos 0x0, ttl 118, id 38029, offset 0, flags [none], proto TCP (6), length 52)
    64.233.180.139.443 > 172.25.64.219.64035: Flags [.], cksum 0x9af0 (correct), ack 19501, win 819, options [nop,nop,TS val 4257750066 ecr 3473484689], length 0
15:52:17.156663 IP (tos 0x0, ttl 118, id 38030, offset 0, flags [none], proto TCP (6), length 285)
    64.233.180.139.443 > 172.25.64.219.64035: Flags [P.], cksum 0xa1fc (correct), seq 2026:2259, ack 19501, win 819, options [nop,nop,TS val 4257750074 ecr 3473484689], length 233
15:52:17.156663 IP (tos 0x0, ttl 118, id 38031, offset 0, flags [none], proto TCP (6), length 83)
    64.233.180.139.443 > 172.25.64.219.64035: Flags [P.], cksum 0x5eac (correct), seq 2259:2290, ack 19501, win 819, options [nop,nop,TS val 4257750074 ecr 3473484689], length 31
15:52:17.156698 IP (tos 0x0, ttl 64, id 0, offset 0, flags [DF], proto TCP (6), length 52)
    172.25.64.219.64035 > 64.233.180.139.443: Flags [.], cksum 0x9503 (correct), ack 2290, win 2044, options [nop,nop,TS val 3473484709 ecr 4257750074], length 0
15:52:17.158095 IP (tos 0x0, ttl 118, id 38032, offset 0, flags [none], proto TCP (6), length 91)
    64.233.180.139.443 > 172.25.64.219.64035: Flags [P.], cksum 0xb2f3 (correct), seq 2290:2329, ack 19501, win 819, options [nop,nop,TS val 4257750074 ecr 3473484689], length 39
15:52:17.158235 IP (tos 0x0, ttl 64, id 0, offset 0, flags [DF], proto TCP (6), length 52)
    172.25.64.219.64035 > 64.233.180.139.443: Flags [.], cksum 0x94d6 (correct), ack 2329, win 2048, options [nop,nop,TS val 3473484711 ecr 4257750074], length 0
15:52:17.158479 IP (tos 0x0, ttl 64, id 0, offset 0, flags [DF], proto TCP (6), length 91)
    172.25.64.219.64035 > 64.233.180.139.443: Flags [P.], cksum 0xf11c (correct), seq 19501:19540, ack 2329, win 2048, options [nop,nop,TS val 3473484711 ecr 4257750074], length 39
15:52:17.175574 IP (tos 0x0, ttl 118, id 38033, offset 0, flags [none], proto TCP (6), length 52)
    64.233.180.139.443 > 172.25.64.219.64035: Flags [.], cksum 0x9969 (correct), ack 19540, win 819, options [nop,nop,TS val 4257750093 ecr 3473484711], length 0
15:52:17.410342 IP (tos 0x0, ttl 118, id 38034, offset 0, flags [none], proto TCP (6), length 586)
    64.233.180.139.443 > 172.25.64.219.64035: Flags [P.], cksum 0xc670 (correct), seq 2329:2863, ack 19540, win 819, options [nop,nop,TS val 4257750328 ecr 3473484711], length 534
15:52:17.410344 IP (tos 0x0, ttl 118, id 38035, offset 0, flags [none], proto TCP (6), length 241)
    64.233.180.139.443 > 172.25.64.219.64035: Flags [P.], cksum 0xd4a8 (correct), seq 2863:3052, ack 19540, win 819, options [nop,nop,TS val 4257750328 ecr 3473484711], length 189
15:52:17.410344 IP (tos 0x0, ttl 118, id 38036, offset 0, flags [none], proto TCP (6), length 370)
    64.233.180.139.443 > 172.25.64.219.64035: Flags [P.], cksum 0x10c6 (correct), seq 3052:3370, ack 19540, win 819, options [nop,nop,TS val 4257750328 ecr 3473484711], length 318
15:52:17.410471 IP (tos 0x0, ttl 64, id 0, offset 0, flags [DF], proto TCP (6), length 52)
    172.25.64.219.64035 > 64.233.180.139.443: Flags [.], cksum 0x8eb4 (correct), ack 3370, win 2032, options [nop,nop,TS val 3473484963 ecr 4257750328], length 0
15:52:17.414917 IP (tos 0x0, ttl 118, id 38037, offset 0, flags [none], proto TCP (6), length 91)
    64.233.180.139.443 > 172.25.64.219.64035: Flags [P.], cksum 0xdb8e (correct), seq 3370:3409, ack 19540, win 819, options [nop,nop,TS val 4257750328 ecr 3473484711], length 39
15:52:17.414992 IP (tos 0x0, ttl 64, id 0, offset 0, flags [DF], proto TCP (6), length 52)
    172.25.64.219.64035 > 64.233.180.139.443: Flags [.], cksum 0x8e79 (correct), ack 3409, win 2048, options [nop,nop,TS val 3473484967 ecr 4257750328], length 0
15:52:17.415136 IP (tos 0x0, ttl 64, id 0, offset 0, flags [DF], proto TCP (6), length 91)
    172.25.64.219.64035 > 64.233.180.139.443: Flags [P.], cksum 0x0f46 (correct), seq 19540:19579, ack 3409, win 2048, options [nop,nop,TS val 3473484967 ecr 4257750328], length 39
15:52:17.427884 IP (tos 0x0, ttl 118, id 38038, offset 0, flags [none], proto TCP (6), length 52)
    64.233.180.139.443 > 172.25.64.219.64035: Flags [.], cksum 0x930f (correct), ack 19579, win 819, options [nop,nop,TS val 4257750344 ecr 3473484967], length 0
15:52:17.858953 IP (tos 0x0, ttl 118, id 38039, offset 0, flags [none], proto TCP (6), length 302)
    64.233.180.139.443 > 172.25.64.219.64035: Flags [P.], cksum 0x23b2 (correct), seq 3409:3659, ack 19579, win 819, options [nop,nop,TS val 4257750746 ecr 3473484967], length 250
15:52:17.859061 IP (tos 0x0, ttl 64, id 0, offset 0, flags [DF], proto TCP (6), length 52)
    172.25.64.219.64035 > 64.233.180.139.443: Flags [.], cksum 0x89fd (correct), ack 3659, win 2045, options [nop,nop,TS val 3473485411 ecr 4257750746], length 0
15:52:17.867296 IP (tos 0x0, ttl 118, id 38040, offset 0, flags [none], proto TCP (6), length 183)
    64.233.180.139.443 > 172.25.64.219.64035: Flags [P.], cksum 0x0509 (correct), seq 3659:3790, ack 19579, win 819, options [nop,nop,TS val 4257750784 ecr 3473484967], length 131
15:52:17.867386 IP (tos 0x0, ttl 64, id 0, offset 0, flags [DF], proto TCP (6), length 52)
    172.25.64.219.64035 > 64.233.180.139.443: Flags [.], cksum 0x894a (correct), ack 3790, win 2046, options [nop,nop,TS val 3473485420 ecr 4257750784], length 0
15:52:18.416028 IP (tos 0x0, ttl 64, id 0, offset 0, flags [DF], proto TCP (6), length 1422)
    172.25.64.219.64035 > 64.233.180.139.443: Flags [.], cksum 0xadd8 (correct), seq 19579:20949, ack 3790, win 2048, options [nop,nop,TS val 3473485968 ecr 4257750784], length 1370
15:52:18.416030 IP (tos 0x0, ttl 64, id 1, offset 0, flags [DF], proto TCP (6), length 1422)
    172.25.64.219.64035 > 64.233.180.139.443: Flags [.], cksum 0x869f (correct), seq 20949:22319, ack 3790, win 2048, options [nop,nop,TS val 3473485968 ecr 4257750784], length 1370
15:52:18.416070 IP (tos 0x0, ttl 64, id 0, offset 0, flags [DF], proto TCP (6), length 523)
    172.25.64.219.64035 > 64.233.180.139.443: Flags [P.], cksum 0xe860 (correct), seq 22319:22790, ack 3790, win 2048, options [nop,nop,TS val 3473485968 ecr 4257750784], length 471
15:52:18.416099 IP (tos 0x0, ttl 64, id 0, offset 0, flags [DF], proto TCP (6), length 206)
    172.25.64.219.64035 > 64.233.180.139.443: Flags [P.], cksum 0xffb3 (correct), seq 22790:22944, ack 3790, win 2048, options [nop,nop,TS val 3473485968 ecr 4257750784], length 154
15:52:18.428570 IP (tos 0x0, ttl 118, id 38041, offset 0, flags [none], proto TCP (6), length 52)
    64.233.180.139.443 > 172.25.64.219.64035: Flags [.], cksum 0x846b (correct), ack 20949, win 814, options [nop,nop,TS val 4257751345 ecr 3473485968], length 0
15:52:18.428571 IP (tos 0x0, ttl 118, id 38042, offset 0, flags [none], proto TCP (6), length 52)
    64.233.180.139.443 > 172.25.64.219.64035: Flags [.], cksum 0x7f16 (correct), ack 22319, win 809, options [nop,nop,TS val 4257751345 ecr 3473485968], length 0
15:52:18.428571 IP (tos 0x0, ttl 118, id 38043, offset 0, flags [none], proto TCP (6), length 52)
    64.233.180.139.443 > 172.25.64.219.64035: Flags [.], cksum 0x7d40 (correct), ack 22790, win 808, options [nop,nop,TS val 4257751345 ecr 3473485968], length 0
15:52:18.428572 IP (tos 0x0, ttl 118, id 38044, offset 0, flags [none], proto TCP (6), length 52)
    64.233.180.139.443 > 172.25.64.219.64035: Flags [.], cksum 0x7ca6 (correct), ack 22944, win 808, options [nop,nop,TS val 4257751345 ecr 3473485968], length 0
15:52:18.555472 IP (tos 0x0, ttl 118, id 38045, offset 0, flags [none], proto TCP (6), length 583)
    64.233.180.139.443 > 172.25.64.219.64035: Flags [P.], cksum 0x6e60 (correct), seq 3790:4321, ack 22944, win 808, options [nop,nop,TS val 4257751448 ecr 3473485968], length 531
15:52:18.555473 IP (tos 0x0, ttl 118, id 38046, offset 0, flags [none], proto TCP (6), length 306)
    64.233.180.139.443 > 172.25.64.219.64035: Flags [P.], cksum 0x934e (correct), seq 4321:4575, ack 22944, win 808, options [nop,nop,TS val 4257751448 ecr 3473485968], length 254
15:52:18.555474 IP (tos 0x0, ttl 118, id 38047, offset 0, flags [none], proto TCP (6), length 196)
    64.233.180.139.443 > 172.25.64.219.64035: Flags [P.], cksum 0x9154 (correct), seq 4575:4719, ack 22944, win 808, options [nop,nop,TS val 4257751448 ecr 3473485968], length 144
15:52:18.555587 IP (tos 0x0, ttl 64, id 0, offset 0, flags [DF], proto TCP (6), length 52)
    172.25.64.219.64035 > 64.233.180.139.443: Flags [.], cksum 0x7348 (correct), ack 4719, win 2034, options [nop,nop,TS val 3473486108 ecr 4257751448], length 0
15:52:18.557551 IP (tos 0x0, ttl 64, id 0, offset 0, flags [DF], proto TCP (6), length 91)
    172.25.64.219.64035 > 64.233.180.139.443: Flags [P.], cksum 0xfd4d (correct), seq 22944:22983, ack 4719, win 2048, options [nop,nop,TS val 3473486110 ecr 4257751448], length 39
15:52:18.566563 IP (tos 0x0, ttl 118, id 38048, offset 0, flags [none], proto TCP (6), length 196)
    64.233.180.139.443 > 172.25.64.219.64035: Flags [P.], cksum 0x9131 (correct), seq 4575:4719, ack 22944, win 808, options [nop,nop,TS val 4257751483 ecr 3473485968], length 144
15:52:18.566668 IP (tos 0x0, ttl 64, id 0, offset 0, flags [DF], proto TCP (6), length 64)
    172.25.64.219.64035 > 64.233.180.139.443: Flags [.], cksum 0x35f5 (correct), ack 4719, win 2048, options [nop,nop,TS val 3473486119 ecr 4257751483,nop,nop,sack 1 {4575:4719}], length 0
15:52:18.568392 IP (tos 0x0, ttl 118, id 38049, offset 0, flags [none], proto TCP (6), length 52)
    64.233.180.139.443 > 172.25.64.219.64035: Flags [.], cksum 0x77c3 (correct), ack 22983, win 808, options [nop,nop,TS val 4257751486 ecr 3473486110], length 0
15:52:28.847641 IP (tos 0x0, ttl 64, id 0, offset 0, flags [DF], proto TCP (6), length 1422)
    172.25.64.219.64035 > 64.233.180.139.443: Flags [.], cksum 0xf76a (correct), seq 22983:24353, ack 4719, win 2048, options [nop,nop,TS val 3473496400 ecr 4257751486], length 1370
15:52:28.847642 IP (tos 0x0, ttl 64, id 1, offset 0, flags [DF], proto TCP (6), length 1422)
    172.25.64.219.64035 > 64.233.180.139.443: Flags [.], cksum 0x90e3 (correct), seq 24353:25723, ack 4719, win 2048, options [nop,nop,TS val 3473496400 ecr 4257751486], length 1370
15:52:28.847680 IP (tos 0x0, ttl 64, id 0, offset 0, flags [DF], proto TCP (6), length 512)
    172.25.64.219.64035 > 64.233.180.139.443: Flags [P.], cksum 0x41c1 (correct), seq 25723:26183, ack 4719, win 2048, options [nop,nop,TS val 3473496400 ecr 4257751486], length 460
15:52:28.847704 IP (tos 0x0, ttl 64, id 0, offset 0, flags [DF], proto TCP (6), length 91)
    172.25.64.219.64035 > 64.233.180.139.443: Flags [P.], cksum 0x3218 (correct), seq 26183:26222, ack 4719, win 2048, options [nop,nop,TS val 3473496400 ecr 4257751486], length 39
15:52:28.847714 IP (tos 0x0, ttl 64, id 0, offset 0, flags [DF], proto TCP (6), length 250)
    172.25.64.219.64035 > 64.233.180.139.443: Flags [P.], cksum 0x4762 (correct), seq 26222:26420, ack 4719, win 2048, options [nop,nop,TS val 3473496400 ecr 4257751486], length 198
15:52:28.860186 IP (tos 0x0, ttl 118, id 38050, offset 0, flags [none], proto TCP (6), length 52)
    64.233.180.139.443 > 172.25.64.219.64035: Flags [.], cksum 0x220a (correct), ack 24353, win 803, options [nop,nop,TS val 4257761776 ecr 3473496400], length 0
15:52:28.860187 IP (tos 0x0, ttl 118, id 38051, offset 0, flags [none], proto TCP (6), length 64)
    64.233.180.139.443 > 172.25.64.219.64035: Flags [.], cksum 0xe071 (correct), ack 24353, win 803, options [nop,nop,TS val 4257761776 ecr 3473496400,nop,nop,sack 1 {25723:26183}], length 0
15:52:28.860187 IP (tos 0x0, ttl 118, id 38052, offset 0, flags [none], proto TCP (6), length 52)
    64.233.180.139.443 > 172.25.64.219.64035: Flags [.], cksum 0x1aeb (correct), ack 26183, win 796, options [nop,nop,TS val 4257761776 ecr 3473496400], length 0
15:52:28.860188 IP (tos 0x0, ttl 118, id 38053, offset 0, flags [none], proto TCP (6), length 52)
    64.233.180.139.443 > 172.25.64.219.64035: Flags [.], cksum 0x19fe (correct), ack 26420, win 796, options [nop,nop,TS val 4257761776 ecr 3473496400], length 0
15:52:28.861364 IP (tos 0x0, ttl 118, id 38054, offset 0, flags [none], proto TCP (6), length 91)
    64.233.180.139.443 > 172.25.64.219.64035: Flags [P.], cksum 0x5cf7 (correct), seq 4719:4758, ack 26420, win 796, options [nop,nop,TS val 4257761777 ecr 3473496400], length 39
15:52:28.861437 IP (tos 0x0, ttl 64, id 0, offset 0, flags [DF], proto TCP (6), length 52)
    172.25.64.219.64035 > 64.233.180.139.443: Flags [.], cksum 0x14e4 (correct), ack 4758, win 2048, options [nop,nop,TS val 3473496414 ecr 4257761777], length 0
15:52:28.943477 IP (tos 0x0, ttl 118, id 38055, offset 0, flags [none], proto TCP (6), length 575)
    64.233.180.139.443 > 172.25.64.219.64035: Flags [P.], cksum 0x9c91 (correct), seq 4758:5281, ack 26420, win 796, options [nop,nop,TS val 4257761861 ecr 3473496414], length 523
15:52:28.943478 IP (tos 0x0, ttl 118, id 38056, offset 0, flags [none], proto TCP (6), length 444)
    64.233.180.139.443 > 172.25.64.219.64035: Flags [P.], cksum 0xfcab (correct), seq 5281:5673, ack 26420, win 796, options [nop,nop,TS val 4257761861 ecr 3473496414], length 392
15:52:28.943479 IP (tos 0x0, ttl 118, id 38057, offset 0, flags [none], proto TCP (6), length 238)
    64.233.180.139.443 > 172.25.64.219.64035: Flags [P.], cksum 0xd19a (correct), seq 5673:5859, ack 26420, win 796, options [nop,nop,TS val 4257761861 ecr 3473496414], length 186
15:52:28.943577 IP (tos 0x0, ttl 64, id 0, offset 0, flags [DF], proto TCP (6), length 52)
    172.25.64.219.64035 > 64.233.180.139.443: Flags [.], cksum 0x1002 (correct), ack 5859, win 2031, options [nop,nop,TS val 3473496496 ecr 4257761861], length 0
15:52:28.944181 IP (tos 0x0, ttl 118, id 38058, offset 0, flags [none], proto TCP (6), length 91)
    64.233.180.139.443 > 172.25.64.219.64035: Flags [P.], cksum 0x8a52 (correct), seq 5859:5898, ack 26420, win 796, options [nop,nop,TS val 4257761861 ecr 3473496414], length 39
15:52:28.944308 IP (tos 0x0, ttl 64, id 0, offset 0, flags [DF], proto TCP (6), length 52)
    172.25.64.219.64035 > 64.233.180.139.443: Flags [.], cksum 0x0fca (correct), ack 5898, win 2048, options [nop,nop,TS val 3473496496 ecr 4257761861], length 0
15:52:28.945236 IP (tos 0x0, ttl 64, id 0, offset 0, flags [DF], proto TCP (6), length 87)
    172.25.64.219.64035 > 64.233.180.139.443: Flags [P.], cksum 0xb28a (correct), seq 26420:26455, ack 5898, win 2048, options [nop,nop,TS val 3473496497 ecr 4257761861], length 35
15:52:28.945359 IP (tos 0x0, ttl 64, id 0, offset 0, flags [DF], proto TCP (6), length 91)
    172.25.64.219.64035 > 64.233.180.139.443: Flags [P.], cksum 0x32d0 (correct), seq 26455:26494, ack 5898, win 2048, options [nop,nop,TS val 3473496497 ecr 4257761861], length 39
15:52:28.959106 IP (tos 0x0, ttl 118, id 38059, offset 0, flags [none], proto TCP (6), length 52)
    64.233.180.139.443 > 172.25.64.219.64035: Flags [.], cksum 0x1455 (correct), ack 26494, win 796, options [nop,nop,TS val 4257761875 ecr 3473496497], length 0
15:52:52.377927 IP (tos 0x0, ttl 118, id 38060, offset 0, flags [none], proto TCP (6), length 333)
    64.233.180.139.443 > 172.25.64.219.64035: Flags [P.], cksum 0x3f1d (correct), seq 5898:6179, ack 26494, win 796, options [nop,nop,TS val 4257785295 ecr 3473496497], length 281
15:52:52.378044 IP (tos 0x0, ttl 64, id 0, offset 0, flags [DF], proto TCP (6), length 52)
    172.25.64.219.64035 > 64.233.180.139.443: Flags [.], cksum 0x5756 (correct), ack 6179, win 2044, options [nop,nop,TS val 3473519930 ecr 4257785295], length 0
15:52:52.378302 IP (tos 0x0, ttl 64, id 0, offset 0, flags [DF], proto TCP (6), length 87)
    172.25.64.219.64035 > 64.233.180.139.443: Flags [P.], cksum 0x5f62 (correct), seq 26494:26529, ack 6179, win 2048, options [nop,nop,TS val 3473519930 ecr 4257785295], length 35
15:52:52.378337 IP (tos 0x0, ttl 64, id 0, offset 0, flags [DF], proto TCP (6), length 87)
    172.25.64.219.64035 > 64.233.180.139.443: Flags [P.], cksum 0x9ad0 (correct), seq 26529:26564, ack 6179, win 2048, options [nop,nop,TS val 3473519930 ecr 4257785295], length 35
15:52:52.391205 IP (tos 0x0, ttl 118, id 38061, offset 0, flags [none], proto TCP (6), length 52)
    64.233.180.139.443 > 172.25.64.219.64035: Flags [.], cksum 0x5be3 (correct), ack 26564, win 796, options [nop,nop,TS val 4257785308 ecr 3473519930], length 0
15:52:52.428954 IP (tos 0x0, ttl 118, id 38062, offset 0, flags [none], proto TCP (6), length 1422)
    64.233.180.139.443 > 172.25.64.219.64035: Flags [P.], cksum 0xbafe (correct), seq 6179:7549, ack 26564, win 796, options [nop,nop,TS val 4257785345 ecr 3473519930], length 1370
15:52:52.428955 IP (tos 0x0, ttl 118, id 38063, offset 0, flags [none], proto TCP (6), length 326)
    64.233.180.139.443 > 172.25.64.219.64035: Flags [P.], cksum 0x94b7 (correct), seq 7549:7823, ack 26564, win 796, options [nop,nop,TS val 4257785346 ecr 3473519930], length 274
15:52:52.428956 IP (tos 0x0, ttl 118, id 38064, offset 0, flags [none], proto TCP (6), length 396)
    64.233.180.139.443 > 172.25.64.219.64035: Flags [P.], cksum 0x3bf0 (correct), seq 7823:8167, ack 26564, win 796, options [nop,nop,TS val 4257785346 ecr 3473519930], length 344
15:52:52.429061 IP (tos 0x0, ttl 64, id 0, offset 0, flags [DF], proto TCP (6), length 52)
    172.25.64.219.64035 > 64.233.180.139.443: Flags [.], cksum 0x4f01 (correct), ack 8167, win 2017, options [nop,nop,TS val 3473519981 ecr 4257785346], length 0
15:52:54.290843 IP (tos 0x0, ttl 64, id 0, offset 0, flags [DF], proto TCP (6), length 1422)
    172.25.64.219.64035 > 64.233.180.139.443: Flags [.], cksum 0x09f8 (correct), seq 26564:27934, ack 8167, win 2048, options [nop,nop,TS val 3473521843 ecr 4257785346], length 1370
15:52:54.290845 IP (tos 0x0, ttl 64, id 1, offset 0, flags [DF], proto TCP (6), length 1422)
    172.25.64.219.64035 > 64.233.180.139.443: Flags [.], cksum 0x7d96 (correct), seq 27934:29304, ack 8167, win 2048, options [nop,nop,TS val 3473521843 ecr 4257785346], length 1370
15:52:54.290912 IP (tos 0x0, ttl 64, id 0, offset 0, flags [DF], proto TCP (6), length 524)
    172.25.64.219.64035 > 64.233.180.139.443: Flags [P.], cksum 0x21b0 (correct), seq 29304:29776, ack 8167, win 2048, options [nop,nop,TS val 3473521843 ecr 4257785346], length 472
15:52:54.291007 IP (tos 0x0, ttl 64, id 0, offset 0, flags [DF], proto TCP (6), length 206)
    172.25.64.219.64035 > 64.233.180.139.443: Flags [P.], cksum 0x5b68 (correct), seq 29776:29930, ack 8167, win 2048, options [nop,nop,TS val 3473521843 ecr 4257785346], length 154
15:52:54.304471 IP (tos 0x0, ttl 118, id 38065, offset 0, flags [none], proto TCP (6), length 64)
    64.233.180.139.443 > 172.25.64.219.64035: Flags [.], cksum 0xe238 (correct), ack 27934, win 791, options [nop,nop,TS val 4257787222 ecr 3473521843,nop,nop,sack 1 {29304:29776}], length 0
15:52:54.304472 IP (tos 0x0, ttl 118, id 38066, offset 0, flags [none], proto TCP (6), length 52)
    64.233.180.139.443 > 172.25.64.219.64035: Flags [.], cksum 0x38ac (correct), ack 29776, win 784, options [nop,nop,TS val 4257787222 ecr 3473521843], length 0
15:52:54.310909 IP (tos 0x0, ttl 118, id 38067, offset 0, flags [none], proto TCP (6), length 52)
    64.233.180.139.443 > 172.25.64.219.64035: Flags [.], cksum 0x380d (correct), ack 29930, win 784, options [nop,nop,TS val 4257787227 ecr 3473521843], length 0
15:52:54.411135 IP (tos 0x0, ttl 118, id 38068, offset 0, flags [none], proto TCP (6), length 583)
    64.233.180.139.443 > 172.25.64.219.64035: Flags [P.], cksum 0xfd89 (correct), seq 8167:8698, ack 29930, win 784, options [nop,nop,TS val 4257787327 ecr 3473521843], length 531
15:52:54.411136 IP (tos 0x0, ttl 118, id 38069, offset 0, flags [none], proto TCP (6), length 355)
    64.233.180.139.443 > 172.25.64.219.64035: Flags [P.], cksum 0x30a3 (correct), seq 8698:9001, ack 29930, win 784, options [nop,nop,TS val 4257787327 ecr 3473521843], length 303
15:52:54.411137 IP (tos 0x0, ttl 118, id 38070, offset 0, flags [none], proto TCP (6), length 263)
    64.233.180.139.443 > 172.25.64.219.64035: Flags [P.], cksum 0x9547 (correct), seq 9001:9212, ack 29930, win 784, options [nop,nop,TS val 4257787327 ecr 3473521843], length 211
15:52:54.411137 IP (tos 0x0, ttl 118, id 38071, offset 0, flags [none], proto TCP (6), length 91)
    64.233.180.139.443 > 172.25.64.219.64035: Flags [P.], cksum 0x5ac5 (correct), seq 9212:9251, ack 29930, win 784, options [nop,nop,TS val 4257787327 ecr 3473521843], length 39
15:52:54.411246 IP (tos 0x0, ttl 64, id 0, offset 0, flags [DF], proto TCP (6), length 52)
    172.25.64.219.64035 > 64.233.180.139.443: Flags [.], cksum 0x2e14 (correct), ack 9251, win 2032, options [nop,nop,TS val 3473521964 ecr 4257787327], length 0
15:52:54.413326 IP (tos 0x0, ttl 64, id 0, offset 0, flags [DF], proto TCP (6), length 91)
    172.25.64.219.64035 > 64.233.180.139.443: Flags [P.], cksum 0x1048 (correct), seq 29930:29969, ack 9251, win 2048, options [nop,nop,TS val 3473521966 ecr 4257787327], length 39
15:52:54.426241 IP (tos 0x0, ttl 118, id 38072, offset 0, flags [none], proto TCP (6), length 52)
    64.233.180.139.443 > 172.25.64.219.64035: Flags [.], cksum 0x32bc (correct), ack 29969, win 784, options [nop,nop,TS val 4257787342 ecr 3473521966], length 0
15:52:55.477181 IP (tos 0x0, ttl 118, id 38073, offset 0, flags [none], proto TCP (6), length 1422)
    64.233.180.139.443 > 172.25.64.219.64035: Flags [P.], cksum 0xef18 (correct), seq 9251:10621, ack 29969, win 784, options [nop,nop,TS val 4257788394 ecr 3473521966], length 1370
15:52:55.477300 IP (tos 0x0, ttl 64, id 0, offset 0, flags [DF], proto TCP (6), length 52)
    172.25.64.219.64035 > 64.233.180.139.443: Flags [.], cksum 0x2043 (correct), ack 10621, win 2027, options [nop,nop,TS val 3473523030 ecr 4257788394], length 0
15:52:55.477619 IP (tos 0x0, ttl 118, id 38074, offset 0, flags [none], proto TCP (6), length 1422)
    64.233.180.139.443 > 172.25.64.219.64035: Flags [P.], cksum 0xef9c (correct), seq 10621:11991, ack 29969, win 784, options [nop,nop,TS val 4257788395 ecr 3473521966], length 1370
15:52:55.477670 IP (tos 0x0, ttl 64, id 0, offset 0, flags [DF], proto TCP (6), length 52)
    172.25.64.219.64035 > 64.233.180.139.443: Flags [.], cksum 0x1ae8 (correct), ack 11991, win 2027, options [nop,nop,TS val 3473523030 ecr 4257788395], length 0
15:52:55.478576 IP (tos 0x0, ttl 118, id 38075, offset 0, flags [none], proto TCP (6), length 329)
    64.233.180.139.443 > 172.25.64.219.64035: Flags [P.], cksum 0x6bf5 (correct), seq 11991:12268, ack 29969, win 784, options [nop,nop,TS val 4257788395 ecr 3473521966], length 277
15:52:55.478605 IP (tos 0x0, ttl 64, id 0, offset 0, flags [DF], proto TCP (6), length 52)
    172.25.64.219.64035 > 64.233.180.139.443: Flags [.], cksum 0x19c1 (correct), ack 12268, win 2044, options [nop,nop,TS val 3473523031 ecr 4257788395], length 0
15:52:55.566959 IP (tos 0x0, ttl 118, id 38076, offset 0, flags [none], proto TCP (6), length 297)
    64.233.180.139.443 > 172.25.64.219.64035: Flags [P.], cksum 0x4f90 (correct), seq 12268:12513, ack 29969, win 784, options [nop,nop,TS val 4257788483 ecr 3473523031], length 245
15:52:55.567078 IP (tos 0x0, ttl 64, id 0, offset 0, flags [DF], proto TCP (6), length 52)
    172.25.64.219.64035 > 64.233.180.139.443: Flags [.], cksum 0x181b (correct), ack 12513, win 2045, options [nop,nop,TS val 3473523119 ecr 4257788483], length 0
15:52:56.612177 IP (tos 0x0, ttl 118, id 38077, offset 0, flags [none], proto TCP (6), length 325)
    64.233.180.139.443 > 172.25.64.219.64035: Flags [P.], cksum 0xaa7c (correct), seq 12513:12786, ack 29969, win 784, options [nop,nop,TS val 4257789529 ecr 3473523119], length 273
15:52:56.612178 IP (tos 0x0, ttl 118, id 38078, offset 0, flags [none], proto TCP (6), length 378)
    64.233.180.139.443 > 172.25.64.219.64035: Flags [P.], cksum 0x1ea7 (correct), seq 12786:13112, ack 29969, win 784, options [nop,nop,TS val 4257789529 ecr 3473523119], length 326
15:52:56.612179 IP (tos 0x0, ttl 118, id 38079, offset 0, flags [none], proto TCP (6), length 329)
    64.233.180.139.443 > 172.25.64.219.64035: Flags [P.], cksum 0x66c8 (correct), seq 13112:13389, ack 29969, win 784, options [nop,nop,TS val 4257789529 ecr 3473523119], length 277
15:52:56.612179 IP (tos 0x0, ttl 118, id 38080, offset 0, flags [none], proto TCP (6), length 167)
    64.233.180.139.443 > 172.25.64.219.64035: Flags [P.], cksum 0x34d1 (correct), seq 13389:13504, ack 29969, win 784, options [nop,nop,TS val 4257789530 ecr 3473523119], length 115
15:52:56.612180 IP (tos 0x0, ttl 118, id 38081, offset 0, flags [none], proto TCP (6), length 83)
    64.233.180.139.443 > 172.25.64.219.64035: Flags [P.], cksum 0x899b (correct), seq 13504:13535, ack 29969, win 784, options [nop,nop,TS val 4257789530 ecr 3473523119], length 31
15:52:56.612317 IP (tos 0x0, ttl 64, id 0, offset 0, flags [DF], proto TCP (6), length 52)
    172.25.64.219.64035 > 64.233.180.139.443: Flags [.], cksum 0x0bfc (correct), ack 13535, win 2033, options [nop,nop,TS val 3473524165 ecr 4257789530], length 0
15:52:56.614141 IP (tos 0x0, ttl 118, id 38082, offset 0, flags [none], proto TCP (6), length 91)
    64.233.180.139.443 > 172.25.64.219.64035: Flags [P.], cksum 0x647d (correct), seq 13535:13574, ack 29969, win 784, options [nop,nop,TS val 4257789530 ecr 3473523119], length 39
15:52:56.614240 IP (tos 0x0, ttl 64, id 0, offset 0, flags [DF], proto TCP (6), length 52)
    172.25.64.219.64035 > 64.233.180.139.443: Flags [.], cksum 0x0bc4 (correct), ack 13574, win 2048, options [nop,nop,TS val 3473524167 ecr 4257789530], length 0
15:52:56.615300 IP (tos 0x0, ttl 64, id 0, offset 0, flags [DF], proto TCP (6), length 91)
    172.25.64.219.64035 > 64.233.180.139.443: Flags [P.], cksum 0x8c16 (correct), seq 29969:30008, ack 13574, win 2048, options [nop,nop,TS val 3473524168 ecr 4257789530], length 39
15:52:56.626696 IP (tos 0x0, ttl 118, id 38083, offset 0, flags [none], proto TCP (6), length 52)
    64.233.180.139.443 > 172.25.64.219.64035: Flags [.], cksum 0x107e (correct), ack 30008, win 784, options [nop,nop,TS val 4257789544 ecr 3473524168], length 0
15:52:57.288767 IP (tos 0x0, ttl 64, id 0, offset 0, flags [DF], proto TCP (6), length 1422)
