tcpdump: data link type PKTAP
tcpdump: WARNING: snaplen raised from 96 to 524288
tcpdump: listening on pktap, link-type PKTAP (Apple DLT_PKTAP), snapshot length 524288 bytes
08:48:30.516808 IP (tos 0x0, ttl 64, id 0, offset 0, flags [DF], proto TCP (6), length 1426)
    172.25.186.179.55229 > 172.253.115.113.443: Flags [.], cksum 0x0d68 (correct), seq 3372107039:3372108413, ack 4003458705, win 3680, options [nop,nop,TS val 2506435001 ecr 285786785], length 1374
08:48:30.516810 IP (tos 0x0, ttl 64, id 1, offset 0, flags [DF], proto TCP (6), length 1426)
    172.25.186.179.55229 > 172.253.115.113.443: Flags [.], cksum 0xfa28 (correct), seq 1374:2748, ack 1, win 3680, options [nop,nop,TS val 2506435001 ecr 285786785], length 1374
08:48:30.516874 IP (tos 0x0, ttl 64, id 0, offset 0, flags [DF], proto TCP (6), length 540)
    172.25.186.179.55229 > 172.253.115.113.443: Flags [P.], cksum 0xced3 (correct), seq 2748:3236, ack 1, win 3680, options [nop,nop,TS val 2506435001 ecr 285786785], length 488
08:48:30.516919 IP (tos 0x0, ttl 64, id 0, offset 0, flags [DF], proto TCP (6), length 91)
    172.25.186.179.55229 > 172.253.115.113.443: Flags [P.], cksum 0x84b6 (correct), seq 3236:3275, ack 1, win 3680, options [nop,nop,TS val 2506435001 ecr 285786785], length 39
08:48:30.516945 IP (tos 0x0, ttl 64, id 0, offset 0, flags [DF], proto TCP (6), length 250)
    172.25.186.179.55229 > 172.253.115.113.443: Flags [P.], cksum 0x9bc5 (correct), seq 3275:3473, ack 1, win 3680, options [nop,nop,TS val 2506435001 ecr 285786785], length 198
08:48:30.525703 IP (tos 0x0, ttl 64, id 0, offset 0, flags [DF], proto TCP (6), length 1426)
    172.25.186.179.55229 > 172.253.115.113.443: Flags [.], cksum 0x9bc4 (correct), seq 3473:4847, ack 1, win 3680, options [nop,nop,TS val 2506435009 ecr 285786785], length 1374
08:48:30.525705 IP (tos 0x0, ttl 64, id 1, offset 0, flags [DF], proto TCP (6), length 1426)
    172.25.186.179.55229 > 172.253.115.113.443: Flags [.], cksum 0xc8ff (correct), seq 4847:6221, ack 1, win 3680, options [nop,nop,TS val 2506435009 ecr 285786785], length 1374
08:48:30.525745 IP (tos 0x0, ttl 64, id 0, offset 0, flags [DF], proto TCP (6), length 548)
    172.25.186.179.55229 > 172.253.115.113.443: Flags [P.], cksum 0x0185 (correct), seq 6221:6717, ack 1, win 3680, options [nop,nop,TS val 2506435009 ecr 285786785], length 496
08:48:30.525814 IP (tos 0x0, ttl 64, id 0, offset 0, flags [DF], proto TCP (6), length 1426)
    172.25.186.179.55229 > 172.253.115.113.443: Flags [.], cksum 0xd483 (correct), seq 6717:8091, ack 1, win 3680, options [nop,nop,TS val 2506435009 ecr 285786785], length 1374
08:48:30.525816 IP (tos 0x0, ttl 64, id 1, offset 0, flags [DF], proto TCP (6), length 1426)
    172.25.186.179.55229 > 172.253.115.113.443: Flags [.], cksum 0x2c1d (correct), seq 8091:9465, ack 1, win 3680, options [nop,nop,TS val 2506435009 ecr 285786785], length 1374
08:48:30.525816 IP (tos 0x0, ttl 64, id 2, offset 0, flags [DF], proto TCP (6), length 1426)
    172.25.186.179.55229 > 172.253.115.113.443: Flags [.], cksum 0x0b99 (correct), seq 9465:10839, ack 1, win 3680, options [nop,nop,TS val 2506435009 ecr 285786785], length 1374
08:48:30.525817 IP (tos 0x0, ttl 64, id 3, offset 0, flags [DF], proto TCP (6), length 1426)
    172.25.186.179.55229 > 172.253.115.113.443: Flags [.], cksum 0xfc45 (correct), seq 10839:12213, ack 1, win 3680, options [nop,nop,TS val 2506435009 ecr 285786785], length 1374
08:48:30.525818 IP (tos 0x0, ttl 64, id 4, offset 0, flags [DF], proto TCP (6), length 1426)
    172.25.186.179.55229 > 172.253.115.113.443: Flags [.], cksum 0xb0f4 (correct), seq 12213:13587, ack 1, win 3680, options [nop,nop,TS val 2506435009 ecr 285786785], length 1374
08:48:30.525819 IP (tos 0x0, ttl 64, id 5, offset 0, flags [DF], proto TCP (6), length 1426)
    172.25.186.179.55229 > 172.253.115.113.443: Flags [.], cksum 0x3d1c (correct), seq 13587:14961, ack 1, win 3680, options [nop,nop,TS val 2506435009 ecr 285786785], length 1374
08:48:30.525820 IP (tos 0x0, ttl 64, id 6, offset 0, flags [DF], proto TCP (6), length 1426)
    172.25.186.179.55229 > 172.253.115.113.443: Flags [.], cksum 0x484e (correct), seq 14961:16335, ack 1, win 3680, options [nop,nop,TS val 2506435009 ecr 285786785], length 1374
08:48:30.525821 IP (tos 0x0, ttl 64, id 7, offset 0, flags [DF], proto TCP (6), length 1426)
    172.25.186.179.55229 > 172.253.115.113.443: Flags [.], cksum 0x670c (correct), seq 16335:17709, ack 1, win 3680, options [nop,nop,TS val 2506435009 ecr 285786785], length 1374
08:48:30.525822 IP (tos 0x0, ttl 64, id 8, offset 0, flags [DF], proto TCP (6), length 1426)
    172.25.186.179.55229 > 172.253.115.113.443: Flags [.], cksum 0x653b (correct), seq 17709:19083, ack 1, win 3680, options [nop,nop,TS val 2506435009 ecr 285786785], length 1374
08:48:30.525822 IP (tos 0x0, ttl 64, id 9, offset 0, flags [DF], proto TCP (6), length 1426)
    172.25.186.179.55229 > 172.253.115.113.443: Flags [.], cksum 0xf418 (correct), seq 19083:20457, ack 1, win 3680, options [nop,nop,TS val 2506435009 ecr 285786785], length 1374
08:48:30.525824 IP (tos 0x0, ttl 64, id 10, offset 0, flags [DF], proto TCP (6), length 1426)
    172.25.186.179.55229 > 172.253.115.113.443: Flags [.], cksum 0xa9c2 (correct), seq 20457:21831, ack 1, win 3680, options [nop,nop,TS val 2506435009 ecr 285786785], length 1374
08:48:30.525844 IP (tos 0x0, ttl 64, id 0, offset 0, flags [DF], proto TCP (6), length 1344)
    172.25.186.179.55229 > 172.253.115.113.443: Flags [P.], cksum 0x3281 (correct), seq 21831:23123, ack 1, win 3680, options [nop,nop,TS val 2506435009 ecr 285786785], length 1292
08:48:30.525877 IP (tos 0x0, ttl 64, id 0, offset 0, flags [DF], proto TCP (6), length 1426)
    172.25.186.179.55229 > 172.253.115.113.443: Flags [.], cksum 0x975b (correct), seq 23123:24497, ack 1, win 3680, options [nop,nop,TS val 2506435009 ecr 285786785], length 1374
08:48:30.525878 IP (tos 0x0, ttl 64, id 1, offset 0, flags [DF], proto TCP (6), length 1426)
    172.25.186.179.55229 > 172.253.115.113.443: Flags [.], cksum 0x391a (correct), seq 24497:25871, ack 1, win 3680, options [nop,nop,TS val 2506435009 ecr 285786785], length 1374
08:48:30.525878 IP (tos 0x0, ttl 64, id 2, offset 0, flags [DF], proto TCP (6), length 1426)
    172.25.186.179.55229 > 172.253.115.113.443: Flags [.], cksum 0x4ab2 (correct), seq 25871:27245, ack 1, win 3680, options [nop,nop,TS val 2506435009 ecr 285786785], length 1374
08:48:30.525879 IP (tos 0x0, ttl 64, id 3, offset 0, flags [DF], proto TCP (6), length 1426)
    172.25.186.179.55229 > 172.253.115.113.443: Flags [.], cksum 0xf61e (correct), seq 27245:28619, ack 1, win 3680, options [nop,nop,TS val 2506435009 ecr 285786785], length 1374
08:48:30.525880 IP (tos 0x0, ttl 64, id 4, offset 0, flags [DF], proto TCP (6), length 1426)
    172.25.186.179.55229 > 172.253.115.113.443: Flags [.], cksum 0x622f (correct), seq 28619:29993, ack 1, win 3680, options [nop,nop,TS val 2506435009 ecr 285786785], length 1374
08:48:30.525881 IP (tos 0x0, ttl 64, id 5, offset 0, flags [DF], proto TCP (6), length 1426)
    172.25.186.179.55229 > 172.253.115.113.443: Flags [.], cksum 0x1895 (correct), seq 29993:31367, ack 1, win 3680, options [nop,nop,TS val 2506435009 ecr 285786785], length 1374
08:48:30.525882 IP (tos 0x0, ttl 64, id 6, offset 0, flags [DF], proto TCP (6), length 1426)
    172.25.186.179.55229 > 172.253.115.113.443: Flags [.], cksum 0x8336 (correct), seq 31367:32741, ack 1, win 3680, options [nop,nop,TS val 2506435009 ecr 285786785], length 1374
08:48:30.525883 IP (tos 0x0, ttl 64, id 7, offset 0, flags [DF], proto TCP (6), length 1426)
    172.25.186.179.55229 > 172.253.115.113.443: Flags [.], cksum 0x16d2 (correct), seq 32741:34115, ack 1, win 3680, options [nop,nop,TS val 2506435009 ecr 285786785], length 1374
08:48:30.525884 IP (tos 0x0, ttl 64, id 8, offset 0, flags [DF], proto TCP (6), length 1426)
    172.25.186.179.55229 > 172.253.115.113.443: Flags [.], cksum 0x943c (correct), seq 34115:35489, ack 1, win 3680, options [nop,nop,TS val 2506435009 ecr 285786785], length 1374
08:48:30.525885 IP (tos 0x0, ttl 64, id 9, offset 0, flags [DF], proto TCP (6), length 1426)
    172.25.186.179.55229 > 172.253.115.113.443: Flags [.], cksum 0x2673 (correct), seq 35489:36863, ack 1, win 3680, options [nop,nop,TS val 2506435009 ecr 285786785], length 1374
08:48:30.525886 IP (tos 0x0, ttl 64, id 10, offset 0, flags [DF], proto TCP (6), length 1426)
    172.25.186.179.55229 > 172.253.115.113.443: Flags [.], cksum 0xdb1d (correct), seq 36863:38237, ack 1, win 3680, options [nop,nop,TS val 2506435009 ecr 285786785], length 1374
08:48:30.525902 IP (tos 0x0, ttl 64, id 0, offset 0, flags [DF], proto TCP (6), length 1344)
    172.25.186.179.55229 > 172.253.115.113.443: Flags [P.], cksum 0xf135 (correct), seq 38237:39529, ack 1, win 3680, options [nop,nop,TS val 2506435009 ecr 285786785], length 1292
08:48:30.525931 IP (tos 0x0, ttl 64, id 0, offset 0, flags [DF], proto TCP (6), length 1426)
    172.25.186.179.55229 > 172.253.115.113.443: Flags [.], cksum 0xb223 (correct), seq 39529:40903, ack 1, win 3680, options [nop,nop,TS val 2506435009 ecr 285786785], length 1374
08:48:30.525932 IP (tos 0x0, ttl 64, id 1, offset 0, flags [DF], proto TCP (6), length 1426)
    172.25.186.179.55229 > 172.253.115.113.443: Flags [.], cksum 0xe10f (correct), seq 40903:42277, ack 1, win 3680, options [nop,nop,TS val 2506435009 ecr 285786785], length 1374
08:48:30.525933 IP (tos 0x0, ttl 64, id 2, offset 0, flags [DF], proto TCP (6), length 1426)
    172.25.186.179.55229 > 172.253.115.113.443: Flags [.], cksum 0xc156 (correct), seq 42277:43651, ack 1, win 3680, options [nop,nop,TS val 2506435009 ecr 285786785], length 1374
08:48:30.525933 IP (tos 0x0, ttl 64, id 3, offset 0, flags [DF], proto TCP (6), length 1426)
    172.25.186.179.55229 > 172.253.115.113.443: Flags [.], cksum 0xee9a (correct), seq 43651:45025, ack 1, win 3680, options [nop,nop,TS val 2506435009 ecr 285786785], length 1374
08:48:30.525934 IP (tos 0x0, ttl 64, id 4, offset 0, flags [DF], proto TCP (6), length 1426)
    172.25.186.179.55229 > 172.253.115.113.443: Flags [.], cksum 0x27a6 (correct), seq 45025:46399, ack 1, win 3680, options [nop,nop,TS val 2506435009 ecr 285786785], length 1374
08:48:30.525936 IP (tos 0x0, ttl 64, id 5, offset 0, flags [DF], proto TCP (6), length 1426)
    172.25.186.179.55229 > 172.253.115.113.443: Flags [.], cksum 0x05c0 (correct), seq 46399:47773, ack 1, win 3680, options [nop,nop,TS val 2506435009 ecr 285786785], length 1374
08:48:30.525937 IP (tos 0x0, ttl 64, id 6, offset 0, flags [DF], proto TCP (6), length 1426)
    172.25.186.179.55229 > 172.253.115.113.443: Flags [.], cksum 0x45ec (correct), seq 47773:49147, ack 1, win 3680, options [nop,nop,TS val 2506435009 ecr 285786785], length 1374
08:48:30.525938 IP (tos 0x0, ttl 64, id 7, offset 0, flags [DF], proto TCP (6), length 1426)
    172.25.186.179.55229 > 172.253.115.113.443: Flags [.], cksum 0xf41d (correct), seq 49147:50521, ack 1, win 3680, options [nop,nop,TS val 2506435009 ecr 285786785], length 1374
08:48:30.525938 IP (tos 0x0, ttl 64, id 8, offset 0, flags [DF], proto TCP (6), length 1426)
    172.25.186.179.55229 > 172.253.115.113.443: Flags [.], cksum 0x7b0b (correct), seq 50521:51895, ack 1, win 3680, options [nop,nop,TS val 2506435009 ecr 285786785], length 1374
08:48:30.525939 IP (tos 0x0, ttl 64, id 9, offset 0, flags [DF], proto TCP (6), length 1426)
    172.25.186.179.55229 > 172.253.115.113.443: Flags [.], cksum 0x3f6e (correct), seq 51895:53269, ack 1, win 3680, options [nop,nop,TS val 2506435009 ecr 285786785], length 1374
08:48:30.525940 IP (tos 0x0, ttl 64, id 10, offset 0, flags [DF], proto TCP (6), length 1426)
    172.25.186.179.55229 > 172.253.115.113.443: Flags [.], cksum 0x26a3 (correct), seq 53269:54643, ack 1, win 3680, options [nop,nop,TS val 2506435009 ecr 285786785], length 1374
08:48:30.525953 IP (tos 0x0, ttl 64, id 0, offset 0, flags [DF], proto TCP (6), length 1344)
    172.25.186.179.55229 > 172.253.115.113.443: Flags [P.], cksum 0x4200 (correct), seq 54643:55935, ack 1, win 3680, options [nop,nop,TS val 2506435009 ecr 285786785], length 1292
08:48:30.525967 IP (tos 0x0, ttl 64, id 0, offset 0, flags [DF], proto TCP (6), length 1426)
    172.25.186.179.55229 > 172.253.115.113.443: Flags [.], cksum 0xf6ec (correct), seq 55935:57309, ack 1, win 3680, options [nop,nop,TS val 2506435009 ecr 285786785], length 1374
08:48:30.525968 IP (tos 0x0, ttl 64, id 1, offset 0, flags [DF], proto TCP (6), length 1426)
    172.25.186.179.55229 > 172.253.115.113.443: Flags [.], cksum 0x8eaa (correct), seq 57309:58683, ack 1, win 3680, options [nop,nop,TS val 2506435009 ecr 285786785], length 1374
08:48:30.525974 IP (tos 0x0, ttl 64, id 0, offset 0, flags [DF], proto TCP (6), length 95)
    172.25.186.179.55229 > 172.253.115.113.443: Flags [P.], cksum 0x9252 (correct), seq 58683:58726, ack 1, win 3680, options [nop,nop,TS val 2506435009 ecr 285786785], length 43
08:48:30.534500 IP (tos 0x0, ttl 118, id 45470, offset 0, flags [none], proto TCP (6), length 52)
    172.253.115.113.443 > 172.25.186.179.55229: Flags [.], cksum 0x5d1c (correct), ack 1374, win 3954, options [nop,nop,TS val 285796517 ecr 2506435001], length 0
08:48:30.534501 IP (tos 0x0, ttl 118, id 45471, offset 0, flags [none], proto TCP (6), length 52)
    172.253.115.113.443 > 172.25.186.179.55229: Flags [.], cksum 0x57c2 (correct), ack 2748, win 3950, options [nop,nop,TS val 285796517 ecr 2506435001], length 0
08:48:30.534501 IP (tos 0x0, ttl 118, id 45472, offset 0, flags [none], proto TCP (6), length 52)
    172.253.115.113.443 > 172.25.186.179.55229: Flags [.], cksum 0x55db (correct), ack 3236, win 3949, options [nop,nop,TS val 285796517 ecr 2506435001], length 0
08:48:30.534502 IP (tos 0x0, ttl 118, id 45473, offset 0, flags [none], proto TCP (6), length 52)
    172.253.115.113.443 > 172.25.186.179.55229: Flags [.], cksum 0x55b4 (correct), ack 3275, win 3949, options [nop,nop,TS val 285796517 ecr 2506435001], length 0
08:48:30.534502 IP (tos 0x0, ttl 118, id 45474, offset 0, flags [none], proto TCP (6), length 52)
    172.253.115.113.443 > 172.25.186.179.55229: Flags [.], cksum 0x54ee (correct), ack 3473, win 3949, options [nop,nop,TS val 285796517 ecr 2506435001], length 0
08:48:30.534502 IP (tos 0x0, ttl 118, id 45475, offset 0, flags [none], proto TCP (6), length 91)
    172.253.115.113.443 > 172.25.186.179.55229: Flags [P.], cksum 0x5385 (correct), seq 1:40, ack 3473, win 3954, options [nop,nop,TS val 285796518 ecr 2506435001], length 39
08:48:30.534609 IP (tos 0x0, ttl 64, id 0, offset 0, flags [DF], proto TCP (6), length 52)
    172.25.186.179.55229 > 172.253.115.113.443: Flags [.], cksum 0x7dec (correct), ack 40, win 3680, options [nop,nop,TS val 2506435018 ecr 285796518], length 0
08:48:30.537753 IP (tos 0x0, ttl 118, id 45476, offset 0, flags [none], proto TCP (6), length 52)
    172.253.115.113.443 > 172.25.186.179.55229: Flags [.], cksum 0x49fc (correct), ack 6221, win 3950, options [nop,nop,TS val 285796523 ecr 2506435009], length 0
08:48:30.541372 IP (tos 0x0, ttl 118, id 45477, offset 0, flags [none], proto TCP (6), length 52)
    172.253.115.113.443 > 172.25.186.179.55229: Flags [.], cksum 0x42a9 (correct), ack 8091, win 3954, options [nop,nop,TS val 285796524 ecr 2506435009], length 0
08:48:30.541373 IP (tos 0x0, ttl 118, id 45478, offset 0, flags [none], proto TCP (6), length 52)
    172.253.115.113.443 > 172.25.186.179.55229: Flags [.], cksum 0x329c (correct), ack 12213, win 3941, options [nop,nop,TS val 285796524 ecr 2506435009], length 0
08:48:30.541373 IP (tos 0x0, ttl 118, id 45479, offset 0, flags [none], proto TCP (6), length 52)
    172.253.115.113.443 > 172.25.186.179.55229: Flags [.], cksum 0x27d3 (correct), ack 14961, win 3954, options [nop,nop,TS val 285796524 ecr 2506435009], length 0
08:48:30.541373 IP (tos 0x0, ttl 118, id 45480, offset 0, flags [none], proto TCP (6), length 52)
    172.253.115.113.443 > 172.25.186.179.55229: Flags [.], cksum 0x17bd (correct), ack 19083, win 3950, options [nop,nop,TS val 285796524 ecr 2506435009], length 0
08:48:30.541374 IP (tos 0x0, ttl 118, id 45481, offset 0, flags [none], proto TCP (6), length 52)
    172.253.115.113.443 > 172.25.186.179.55229: Flags [.], cksum 0x0cfd (correct), ack 21831, win 3954, options [nop,nop,TS val 285796524 ecr 2506435009], length 0
08:48:30.541374 IP (tos 0x0, ttl 118, id 45482, offset 0, flags [none], proto TCP (6), length 52)
    172.253.115.113.443 > 172.25.186.179.55229: Flags [.], cksum 0x0297 (correct), ack 24497, win 3950, options [nop,nop,TS val 285796524 ecr 2506435009], length 0
08:48:30.541374 IP (tos 0x0, ttl 118, id 45483, offset 0, flags [none], proto TCP (6), length 52)
    172.253.115.113.443 > 172.25.186.179.55229: Flags [.], cksum 0xf7d6 (correct), ack 27245, win 3954, options [nop,nop,TS val 285796524 ecr 2506435009], length 0
08:48:30.541375 IP (tos 0x0, ttl 118, id 45484, offset 0, flags [none], proto TCP (6), length 52)
    172.253.115.113.443 > 172.25.186.179.55229: Flags [.], cksum 0xed19 (correct), ack 29993, win 3954, options [nop,nop,TS val 285796525 ecr 2506435009], length 0
08:48:30.541375 IP (tos 0x0, ttl 118, id 45485, offset 0, flags [none], proto TCP (6), length 52)
    172.253.115.113.443 > 172.25.186.179.55229: Flags [.], cksum 0xdd03 (correct), ack 34115, win 3950, options [nop,nop,TS val 285796525 ecr 2506435009], length 0
08:48:30.541375 IP (tos 0x0, ttl 118, id 45486, offset 0, flags [none], proto TCP (6), length 52)
    172.253.115.113.443 > 172.25.186.179.55229: Flags [.], cksum 0xd243 (correct), ack 36863, win 3954, options [nop,nop,TS val 285796525 ecr 2506435009], length 0
08:48:30.541376 IP (tos 0x0, ttl 118, id 45487, offset 0, flags [none], proto TCP (6), length 52)
    172.253.115.113.443 > 172.25.186.179.55229: Flags [.], cksum 0xc7d9 (correct), ack 39529, win 3954, options [nop,nop,TS val 285796525 ecr 2506435009], length 0
08:48:30.541376 IP (tos 0x0, ttl 118, id 45488, offset 0, flags [none], proto TCP (6), length 52)
    172.253.115.113.443 > 172.25.186.179.55229: Flags [.], cksum 0xbd21 (correct), ack 42277, win 3950, options [nop,nop,TS val 285796525 ecr 2506435009], length 0
08:48:30.541376 IP (tos 0x0, ttl 118, id 45489, offset 0, flags [none], proto TCP (6), length 52)
    172.253.115.113.443 > 172.25.186.179.55229: Flags [.], cksum 0xb261 (correct), ack 45025, win 3954, options [nop,nop,TS val 285796525 ecr 2506435009], length 0
08:48:30.541377 IP (tos 0x0, ttl 118, id 45490, offset 0, flags [none], proto TCP (6), length 52)
    172.253.115.113.443 > 172.25.186.179.55229: Flags [.], cksum 0xa7a5 (correct), ack 47773, win 3954, options [nop,nop,TS val 285796525 ecr 2506435009], length 0
08:48:30.541377 IP (tos 0x0, ttl 118, id 45491, offset 0, flags [none], proto TCP (6), length 52)
    172.253.115.113.443 > 172.25.186.179.55229: Flags [.], cksum 0x9ce9 (correct), ack 50521, win 3954, options [nop,nop,TS val 285796525 ecr 2506435009], length 0
08:48:30.541377 IP (tos 0x0, ttl 118, id 45492, offset 0, flags [none], proto TCP (6), length 52)
    172.253.115.113.443 > 172.25.186.179.55229: Flags [.], cksum 0x922d (correct), ack 53269, win 3954, options [nop,nop,TS val 285796525 ecr 2506435009], length 0
08:48:30.541378 IP (tos 0x0, ttl 118, id 45493, offset 0, flags [none], proto TCP (6), length 52)
    172.253.115.113.443 > 172.25.186.179.55229: Flags [.], cksum 0x87c3 (correct), ack 55935, win 3954, options [nop,nop,TS val 285796525 ecr 2506435009], length 0
08:48:30.541378 IP (tos 0x0, ttl 118, id 45494, offset 0, flags [none], proto TCP (6), length 52)
    172.253.115.113.443 > 172.25.186.179.55229: Flags [.], cksum 0x7d0b (correct), ack 58683, win 3950, options [nop,nop,TS val 285796525 ecr 2506435009], length 0
08:48:30.545041 IP (tos 0x0, ttl 118, id 45495, offset 0, flags [none], proto TCP (6), length 52)
    172.253.115.113.443 > 172.25.186.179.55229: Flags [.], cksum 0x7cd7 (correct), ack 58726, win 3954, options [nop,nop,TS val 285796530 ecr 2506435009], length 0
08:48:30.598510 IP (tos 0x0, ttl 118, id 45496, offset 0, flags [none], proto TCP (6), length 579)
    172.253.115.113.443 > 172.25.186.179.55229: Flags [P.], cksum 0xdd4d (correct), seq 40:567, ack 58726, win 3954, options [nop,nop,TS val 285796583 ecr 2506435018], length 527
08:48:30.598511 IP (tos 0x0, ttl 118, id 45497, offset 0, flags [none], proto TCP (6), length 320)
    172.253.115.113.443 > 172.25.186.179.55229: Flags [P.], cksum 0xc308 (correct), seq 567:835, ack 58726, win 3954, options [nop,nop,TS val 285796584 ecr 2506435018], length 268
08:48:30.598511 IP (tos 0x0, ttl 118, id 45498, offset 0, flags [none], proto TCP (6), length 267)
    172.253.115.113.443 > 172.25.186.179.55229: Flags [P.], cksum 0x1d3b (correct), seq 835:1050, ack 58726, win 3954, options [nop,nop,TS val 285796584 ecr 2506435018], length 215
08:48:30.598512 IP (tos 0x0, ttl 118, id 45499, offset 0, flags [none], proto TCP (6), length 83)
    172.253.115.113.443 > 172.25.186.179.55229: Flags [P.], cksum 0xe806 (correct), seq 1050:1081, ack 58726, win 3954, options [nop,nop,TS val 285796584 ecr 2506435018], length 31
08:48:30.598642 IP (tos 0x0, ttl 64, id 0, offset 0, flags [DF], proto TCP (6), length 52)
    172.25.186.179.55229 > 172.253.115.113.443: Flags [.], cksum 0x7969 (correct), ack 1081, win 3664, options [nop,nop,TS val 2506435082 ecr 285796584], length 0
08:48:30.599352 IP (tos 0x0, ttl 64, id 0, offset 0, flags [DF], proto TCP (6), length 87)
    172.25.186.179.55229 > 172.253.115.113.443: Flags [P.], cksum 0x47f9 (correct), seq 58726:58761, ack 1081, win 3680, options [nop,nop,TS val 2506435082 ecr 285796584], length 35
08:48:30.600049 IP (tos 0x0, ttl 118, id 45500, offset 0, flags [none], proto TCP (6), length 91)
    172.253.115.113.443 > 172.25.186.179.55229: Flags [P.], cksum 0x3c6a (correct), seq 1081:1120, ack 58726, win 3954, options [nop,nop,TS val 285796584 ecr 2506435018], length 39
08:48:30.600083 IP (tos 0x0, ttl 64, id 0, offset 0, flags [DF], proto TCP (6), length 52)
    172.25.186.179.55229 > 172.253.115.113.443: Flags [.], cksum 0x790d (correct), ack 1120, win 3680, options [nop,nop,TS val 2506435084 ecr 285796584], length 0
08:48:30.600145 IP (tos 0x0, ttl 64, id 0, offset 0, flags [DF], proto TCP (6), length 91)
    172.25.186.179.55229 > 172.253.115.113.443: Flags [P.], cksum 0xaf3b (correct), seq 58761:58800, ack 1120, win 3680, options [nop,nop,TS val 2506435084 ecr 285796584], length 39
08:48:30.611406 IP (tos 0x0, ttl 118, id 45501, offset 0, flags [none], proto TCP (6), length 52)
    172.253.115.113.443 > 172.25.186.179.55229: Flags [.], cksum 0x77f1 (correct), ack 58761, win 3954, options [nop,nop,TS val 285796596 ecr 2506435082], length 0
08:48:30.612898 IP (tos 0x0, ttl 118, id 45502, offset 0, flags [none], proto TCP (6), length 52)
    172.253.115.113.443 > 172.25.186.179.55229: Flags [.], cksum 0x77c6 (correct), ack 58800, win 3954, options [nop,nop,TS val 285796598 ecr 2506435084], length 0
08:48:30.617462 IP (tos 0x0, ttl 118, id 45503, offset 0, flags [none], proto TCP (6), length 592)
    172.253.115.113.443 > 172.25.186.179.55229: Flags [P.], cksum 0x0517 (correct), seq 1120:1660, ack 58800, win 3954, options [nop,nop,TS val 285796602 ecr 2506435084], length 540
08:48:30.617463 IP (tos 0x0, ttl 118, id 45504, offset 0, flags [none], proto TCP (6), length 374)
    172.253.115.113.443 > 172.25.186.179.55229: Flags [P.], cksum 0xe038 (correct), seq 1660:1982, ack 58800, win 3954, options [nop,nop,TS val 285796602 ecr 2506435084], length 322
08:48:30.617504 IP (tos 0x0, ttl 64, id 0, offset 0, flags [DF], proto TCP (6), length 52)
    172.25.186.179.55229 > 172.253.115.113.443: Flags [.], cksum 0x7572 (correct), ack 1982, win 3667, options [nop,nop,TS val 2506435101 ecr 285796602], length 0
08:48:30.626318 IP (tos 0x0, ttl 64, id 0, offset 0, flags [DF], proto TCP (6), length 1426)
    172.25.186.179.55229 > 172.253.115.113.443: Flags [.], cksum 0x9c07 (correct), seq 58800:60174, ack 1982, win 3680, options [nop,nop,TS val 2506435110 ecr 285796602], length 1374
08:48:30.626318 IP (tos 0x0, ttl 64, id 1, offset 0, flags [DF], proto TCP (6), length 1426)
    172.25.186.179.55229 > 172.253.115.113.443: Flags [.], cksum 0x9b76 (correct), seq 60174:61548, ack 1982, win 3680, options [nop,nop,TS val 2506435110 ecr 285796602], length 1374
08:48:30.626326 IP (tos 0x0, ttl 64, id 0, offset 0, flags [DF], proto TCP (6), length 312)
    172.25.186.179.55229 > 172.253.115.113.443: Flags [P.], cksum 0x7858 (correct), seq 61548:61808, ack 1982, win 3680, options [nop,nop,TS val 2506435110 ecr 285796602], length 260
08:48:30.626336 IP (tos 0x0, ttl 64, id 0, offset 0, flags [DF], proto TCP (6), length 1426)
    172.25.186.179.55229 > 172.253.115.113.443: Flags [.], cksum 0xfec7 (correct), seq 61808:63182, ack 1982, win 3680, options [nop,nop,TS val 2506435110 ecr 285796602], length 1374
08:48:30.626336 IP (tos 0x0, ttl 64, id 1, offset 0, flags [DF], proto TCP (6), length 1426)
    172.25.186.179.55229 > 172.253.115.113.443: Flags [.], cksum 0x3997 (correct), seq 63182:64556, ack 1982, win 3680, options [nop,nop,TS val 2506435110 ecr 285796602], length 1374
08:48:30.626344 IP (tos 0x0, ttl 64, id 0, offset 0, flags [DF], proto TCP (6), length 1230)
    172.25.186.179.55229 > 172.253.115.113.443: Flags [P.], cksum 0x1687 (correct), seq 64556:65734, ack 1982, win 3680, options [nop,nop,TS val 2506435110 ecr 285796602], length 1178
08:48:30.629905 IP (tos 0x0, ttl 64, id 0, offset 0, flags [DF], proto TCP (6), length 1426)
    172.25.186.179.55229 > 172.253.115.113.443: Flags [.], cksum 0xd05d (correct), seq 65734:67108, ack 1982, win 3680, options [nop,nop,TS val 2506435114 ecr 285796602], length 1374
08:48:30.629906 IP (tos 0x0, ttl 64, id 1, offset 0, flags [DF], proto TCP (6), length 1426)
    172.25.186.179.55229 > 172.253.115.113.443: Flags [.], cksum 0xb7ad (correct), seq 67108:68482, ack 1982, win 3680, options [nop,nop,TS val 2506435114 ecr 285796602], length 1374
08:48:30.629921 IP (tos 0x0, ttl 64, id 0, offset 0, flags [DF], proto TCP (6), length 541)
    172.25.186.179.55229 > 172.253.115.113.443: Flags [P.], cksum 0xf552 (correct), seq 68482:68971, ack 1982, win 3680, options [nop,nop,TS val 2506435114 ecr 285796602], length 489
08:48:30.629930 IP (tos 0x0, ttl 64, id 0, offset 0, flags [DF], proto TCP (6), length 236)
    172.25.186.179.55229 > 172.253.115.113.443: Flags [P.], cksum 0xa8cb (correct), seq 68971:69155, ack 1982, win 3680, options [nop,nop,TS val 2506435114 ecr 285796602], length 184
08:48:30.638466 IP (tos 0x0, ttl 118, id 45505, offset 0, flags [none], proto TCP (6), length 52)
    172.253.115.113.443 > 172.25.186.179.55229: Flags [.], cksum 0x697d (correct), ack 61548, win 3950, options [nop,nop,TS val 285796623 ecr 2506435110], length 0
08:48:30.638466 IP (tos 0x0, ttl 118, id 45506, offset 0, flags [none], proto TCP (6), length 52)
    172.253.115.113.443 > 172.25.186.179.55229: Flags [.], cksum 0x6317 (correct), ack 63182, win 3954, options [nop,nop,TS val 285796623 ecr 2506435110], length 0
08:48:30.638467 IP (tos 0x0, ttl 118, id 45507, offset 0, flags [none], proto TCP (6), length 52)
    172.253.115.113.443 > 172.25.186.179.55229: Flags [.], cksum 0x5926 (correct), ack 65734, win 3946, options [nop,nop,TS val 285796624 ecr 2506435110], length 0
08:48:30.644337 IP (tos 0x0, ttl 118, id 45509, offset 0, flags [none], proto TCP (6), length 52)
    172.253.115.113.443 > 172.25.186.179.55229: Flags [.], cksum 0x4bb8 (correct), ack 69155, win 3954, options [nop,nop,TS val 285796629 ecr 2506435114], length 0
08:48:30.644337 IP (tos 0x0, ttl 118, id 45508, offset 0, flags [none], proto TCP (6), length 52)
    172.253.115.113.443 > 172.25.186.179.55229: Flags [.], cksum 0x4e59 (correct), ack 68482, win 3954, options [nop,nop,TS val 285796629 ecr 2506435114], length 0
08:48:30.663276 IP (tos 0x0, ttl 118, id 45510, offset 0, flags [none], proto TCP (6), length 293)
    172.253.115.113.443 > 172.25.186.179.55229: Flags [P.], cksum 0x970e (correct), seq 1982:2223, ack 69155, win 3954, options [nop,nop,TS val 285796648 ecr 2506435114], length 241
08:48:30.663277 IP (tos 0x0, ttl 118, id 45511, offset 0, flags [none], proto TCP (6), length 83)
    172.253.115.113.443 > 172.25.186.179.55229: Flags [P.], cksum 0xba94 (correct), seq 2223:2254, ack 69155, win 3954, options [nop,nop,TS val 285796648 ecr 2506435114], length 31
08:48:30.663277 IP (tos 0x0, ttl 118, id 45512, offset 0, flags [none], proto TCP (6), length 91)
    172.253.115.113.443 > 172.25.186.179.55229: Flags [P.], cksum 0x8207 (correct), seq 2254:2293, ack 69155, win 3954, options [nop,nop,TS val 285796648 ecr 2506435114], length 39
08:48:30.663348 IP (tos 0x0, ttl 64, id 0, offset 0, flags [DF], proto TCP (6), length 52)
    172.25.186.179.55229 > 172.253.115.113.443: Flags [.], cksum 0x4b63 (correct), ack 2293, win 3676, options [nop,nop,TS val 2506435147 ecr 285796648], length 0
08:48:30.663743 IP (tos 0x0, ttl 64, id 0, offset 0, flags [DF], proto TCP (6), length 91)
    172.25.186.179.55229 > 172.253.115.113.443: Flags [P.], cksum 0xd0f7 (correct), seq 69155:69194, ack 2293, win 3680, options [nop,nop,TS val 2506435147 ecr 285796648], length 39
08:48:30.681099 IP (tos 0x0, ttl 118, id 45513, offset 0, flags [none], proto TCP (6), length 52)
    172.253.115.113.443 > 172.25.186.179.55229: Flags [.], cksum 0x4a14 (correct), ack 69194, win 3954, options [nop,nop,TS val 285796666 ecr 2506435147], length 0
08:48:30.896726 IP (tos 0x0, ttl 118, id 45514, offset 0, flags [none], proto TCP (6), length 597)
    172.253.115.113.443 > 172.25.186.179.55229: Flags [P.], cksum 0x9ce0 (correct), seq 2293:2838, ack 69194, win 3954, options [nop,nop,TS val 285796881 ecr 2506435147], length 545
08:48:30.896728 IP (tos 0x0, ttl 118, id 45515, offset 0, flags [none], proto TCP (6), length 386)
    172.253.115.113.443 > 172.25.186.179.55229: Flags [P.], cksum 0xc0ae (correct), seq 2838:3172, ack 69194, win 3954, options [nop,nop,TS val 285796882 ecr 2506435147], length 334
08:48:30.896728 IP (tos 0x0, ttl 118, id 45516, offset 0, flags [none], proto TCP (6), length 294)
    172.253.115.113.443 > 172.25.186.179.55229: Flags [P.], cksum 0x91a3 (correct), seq 3172:3414, ack 69194, win 3954, options [nop,nop,TS val 285796882 ecr 2506435147], length 242
08:48:30.896729 IP (tos 0x0, ttl 118, id 45517, offset 0, flags [none], proto TCP (6), length 83)
    172.253.115.113.443 > 172.25.186.179.55229: Flags [P.], cksum 0x53a7 (correct), seq 3414:3445, ack 69194, win 3954, options [nop,nop,TS val 285796882 ecr 2506435147], length 31
08:48:30.896850 IP (tos 0x0, ttl 64, id 0, offset 0, flags [DF], proto TCP (6), length 52)
    172.25.186.179.55229 > 172.253.115.113.443: Flags [.], cksum 0x44f6 (correct), ack 3445, win 3662, options [nop,nop,TS val 2506435381 ecr 285796882], length 0
08:48:30.898390 IP (tos 0x0, ttl 118, id 45518, offset 0, flags [none], proto TCP (6), length 91)
    172.253.115.113.443 > 172.25.186.179.55229: Flags [P.], cksum 0x69d5 (correct), seq 3445:3484, ack 69194, win 3954, options [nop,nop,TS val 285796882 ecr 2506435147], length 39
08:48:30.898453 IP (tos 0x0, ttl 64, id 0, offset 0, flags [DF], proto TCP (6), length 52)
    172.25.186.179.55229 > 172.253.115.113.443: Flags [.], cksum 0x44bc (correct), ack 3484, win 3680, options [nop,nop,TS val 2506435382 ecr 285796882], length 0
08:48:30.898561 IP (tos 0x0, ttl 64, id 0, offset 0, flags [DF], proto TCP (6), length 91)
    172.25.186.179.55229 > 172.253.115.113.443: Flags [P.], cksum 0x5f23 (correct), seq 69194:69233, ack 3484, win 3680, options [nop,nop,TS val 2506435382 ecr 285796882], length 39
08:48:30.910668 IP (tos 0x0, ttl 118, id 45519, offset 0, flags [none], proto TCP (6), length 52)
    172.253.115.113.443 > 172.25.186.179.55229: Flags [.], cksum 0x4375 (correct), ack 69233, win 3954, options [nop,nop,TS val 285796896 ecr 2506435382], length 0
08:48:31.343624 IP (tos 0x0, ttl 118, id 45520, offset 0, flags [none], proto TCP (6), length 361)
    172.253.115.113.443 > 172.25.186.179.55229: Flags [P.], cksum 0x3bb1 (correct), seq 3484:3793, ack 69233, win 3954, options [nop,nop,TS val 285797329 ecr 2506435382], length 309
08:48:31.343742 IP (tos 0x0, ttl 64, id 0, offset 0, flags [DF], proto TCP (6), length 52)
    172.25.186.179.55229 > 172.253.115.113.443: Flags [.], cksum 0x3fe8 (correct), ack 3793, win 3676, options [nop,nop,TS val 2506435827 ecr 285797329], length 0
08:48:31.863118 IP (tos 0x0, ttl 64, id 0, offset 0, flags [DF], proto TCP (6), length 1426)
    172.25.186.179.55229 > 172.253.115.113.443: Flags [.], cksum 0x59a7 (correct), seq 69233:70607, ack 3793, win 3680, options [nop,nop,TS val 2506436347 ecr 285797329], length 1374
08:48:31.863121 IP (tos 0x0, ttl 64, id 1, offset 0, flags [DF], proto TCP (6), length 1426)
    172.25.186.179.55229 > 172.253.115.113.443: Flags [.], cksum 0x3284 (correct), seq 70607:71981, ack 3793, win 3680, options [nop,nop,TS val 2506436347 ecr 285797329], length 1374
08:48:31.863183 IP (tos 0x0, ttl 64, id 0, offset 0, flags [DF], proto TCP (6), length 551)
    172.25.186.179.55229 > 172.253.115.113.443: Flags [P.], cksum 0x56fe (correct), seq 71981:72480, ack 3793, win 3680, options [nop,nop,TS val 2506436347 ecr 285797329], length 499
08:48:31.863239 IP (tos 0x0, ttl 64, id 0, offset 0, flags [DF], proto TCP (6), length 206)
    172.25.186.179.55229 > 172.253.115.113.443: Flags [P.], cksum 0x5f44 (correct), seq 72480:72634, ack 3793, win 3680, options [nop,nop,TS val 2506436347 ecr 285797329], length 154
08:48:31.877690 IP (tos 0x0, ttl 118, id 45521, offset 0, flags [none], proto TCP (6), length 52)
    172.253.115.113.443 > 172.25.186.179.55229: Flags [.], cksum 0x3556 (correct), ack 70607, win 3954, options [nop,nop,TS val 285797863 ecr 2506436347], length 0
08:48:31.877691 IP (tos 0x0, ttl 118, id 45522, offset 0, flags [none], proto TCP (6), length 52)
    172.253.115.113.443 > 172.25.186.179.55229: Flags [.], cksum 0x2ff8 (correct), ack 71981, win 3954, options [nop,nop,TS val 285797863 ecr 2506436347], length 0
08:48:31.877692 IP (tos 0x0, ttl 118, id 45523, offset 0, flags [none], proto TCP (6), length 52)
    172.253.115.113.443 > 172.25.186.179.55229: Flags [.], cksum 0x2e05 (correct), ack 72480, win 3954, options [nop,nop,TS val 285797863 ecr 2506436347], length 0
08:48:31.877872 IP (tos 0x0, ttl 118, id 45524, offset 0, flags [none], proto TCP (6), length 52)
    172.253.115.113.443 > 172.25.186.179.55229: Flags [.], cksum 0x2d6b (correct), ack 72634, win 3954, options [nop,nop,TS val 285797863 ecr 2506436347], length 0
08:48:31.933069 IP (tos 0x0, ttl 118, id 45525, offset 0, flags [none], proto TCP (6), length 507)
    172.253.115.113.443 > 172.25.186.179.55229: Flags [P.], cksum 0x1d8f (correct), seq 3793:4248, ack 72634, win 3954, options [nop,nop,TS val 285797918 ecr 2506436347], length 455
08:48:31.933174 IP (tos 0x0, ttl 64, id 0, offset 0, flags [DF], proto TCP (6), length 52)
    172.25.186.179.55229 > 172.253.115.113.443: Flags [.], cksum 0x2c40 (correct), ack 4248, win 3673, options [nop,nop,TS val 2506436417 ecr 285797918], length 0
08:48:31.956047 IP (tos 0x0, ttl 118, id 45526, offset 0, flags [none], proto TCP (6), length 362)
    172.253.115.113.443 > 172.25.186.179.55229: Flags [P.], cksum 0xab63 (correct), seq 4248:4558, ack 72634, win 3954, options [nop,nop,TS val 285797941 ecr 2506436417], length 310
08:48:31.956110 IP (tos 0x0, ttl 64, id 0, offset 0, flags [DF], proto TCP (6), length 52)
    172.25.186.179.55229 > 172.253.115.113.443: Flags [.], cksum 0x2ada (correct), ack 4558, win 3675, options [nop,nop,TS val 2506436440 ecr 285797941], length 0
08:48:31.965131 IP (tos 0x0, ttl 118, id 45527, offset 0, flags [none], proto TCP (6), length 590)
    172.253.115.113.443 > 172.25.186.179.55229: Flags [P.], cksum 0xc631 (correct), seq 4558:5096, ack 72634, win 3954, options [nop,nop,TS val 285797949 ecr 2506436417], length 538
08:48:31.965133 IP (tos 0x0, ttl 118, id 45528, offset 0, flags [none], proto TCP (6), length 367)
    172.253.115.113.443 > 172.25.186.179.55229: Flags [P.], cksum 0x48cd (correct), seq 5096:5411, ack 72634, win 3954, options [nop,nop,TS val 285797949 ecr 2506436417], length 315
08:48:31.965133 IP (tos 0x0, ttl 118, id 45529, offset 0, flags [none], proto TCP (6), length 149)
    172.253.115.113.443 > 172.25.186.179.55229: Flags [P.], cksum 0xb0fc (correct), seq 5411:5508, ack 72634, win 3954, options [nop,nop,TS val 285797949 ecr 2506436417], length 97
08:48:31.965134 IP (tos 0x0, ttl 118, id 45530, offset 0, flags [none], proto TCP (6), length 214)
    172.253.115.113.443 > 172.25.186.179.55229: Flags [P.], cksum 0x3d44 (correct), seq 5508:5670, ack 72634, win 3954, options [nop,nop,TS val 285797949 ecr 2506436417], length 162
08:48:31.965134 IP (tos 0x0, ttl 118, id 45531, offset 0, flags [none], proto TCP (6), length 83)
    172.253.115.113.443 > 172.25.186.179.55229: Flags [P.], cksum 0xc652 (correct), seq 5670:5701, ack 72634, win 3954, options [nop,nop,TS val 285797949 ecr 2506436417], length 31
08:48:31.965135 IP (tos 0x0, ttl 118, id 45532, offset 0, flags [none], proto TCP (6), length 91)
    172.253.115.113.443 > 172.25.186.179.55229: Flags [P.], cksum 0xf872 (correct), seq 5701:5740, ack 72634, win 3954, options [nop,nop,TS val 285797949 ecr 2506436417], length 39
08:48:31.965229 IP (tos 0x0, ttl 64, id 0, offset 0, flags [DF], proto TCP (6), length 52)
    172.25.186.179.55229 > 172.253.115.113.443: Flags [.], cksum 0x2638 (correct), ack 5740, win 3662, options [nop,nop,TS val 2506436449 ecr 285797949], length 0
08:48:31.966253 IP (tos 0x0, ttl 64, id 0, offset 0, flags [DF], proto TCP (6), length 91)
    172.25.186.179.55229 > 172.253.115.113.443: Flags [P.], cksum 0x4b5d (correct), seq 72634:72673, ack 5740, win 3680, options [nop,nop,TS val 2506436450 ecr 285797949], length 39
08:48:32.054220 IP (tos 0x0, ttl 118, id 45533, offset 0, flags [none], proto TCP (6), length 91)
    172.253.115.113.443 > 172.25.186.179.55229: Flags [P.], cksum 0xf832 (correct), seq 5701:5740, ack 72634, win 3954, options [nop,nop,TS val 285797990 ecr 2506436440], length 39
08:48:32.054341 IP (tos 0x0, ttl 64, id 0, offset 0, flags [DF], proto TCP (6), length 64)
    172.25.186.179.55229 > 172.253.115.113.443: Flags [.], cksum 0x0853 (correct), ack 5740, win 3680, options [nop,nop,TS val 2506436538 ecr 285797990,nop,nop,sack 1 {5701:5740}], length 0
08:48:32.064410 IP (tos 0x0, ttl 118, id 45534, offset 0, flags [none], proto TCP (6), length 52)
    172.253.115.113.443 > 172.25.186.179.55229: Flags [.], cksum 0x2488 (correct), ack 72673, win 3954, options [nop,nop,TS val 285798049 ecr 2506436450], length 0
08:48:32.078092 IP (tos 0x0, ttl 118, id 45535, offset 0, flags [none], proto TCP (6), length 150)
    172.253.115.113.443 > 172.25.186.179.55229: Flags [P.], cksum 0x2e34 (correct), seq 5740:5838, ack 72673, win 3954, options [nop,nop,TS val 285798063 ecr 2506436538], length 98
08:48:32.078210 IP (tos 0x0, ttl 64, id 0, offset 0, flags [DF], proto TCP (6), length 52)
    172.25.186.179.55229 > 172.253.115.113.443: Flags [.], cksum 0x24bb (correct), ack 5838, win 3679, options [nop,nop,TS val 2506436562 ecr 285798063], length 0
08:48:32.096732 IP (tos 0x0, ttl 118, id 45536, offset 0, flags [none], proto TCP (6), length 140)
    172.253.115.113.443 > 172.25.186.179.55229: Flags [P.], cksum 0x0c91 (correct), seq 5838:5926, ack 72673, win 3954, options [nop,nop,TS val 285798082 ecr 2506436562], length 88
08:48:32.096840 IP (tos 0x0, ttl 64, id 0, offset 0, flags [DF], proto TCP (6), length 52)
    172.25.186.179.55229 > 172.253.115.113.443: Flags [.], cksum 0x243e (correct), ack 5926, win 3679, options [nop,nop,TS val 2506436580 ecr 285798082], length 0
08:48:32.123811 IP (tos 0x0, ttl 118, id 45537, offset 0, flags [none], proto TCP (6), length 273)
