tcpdump: data link type PKTAP
tcpdump: WARNING: snaplen raised from 96 to 524288
tcpdump: listening on pktap, link-type PKTAP (Apple DLT_PKTAP), snapshot length 524288 bytes
08:55:05.433994 IP (tos 0x60, ttl 119, id 42228, offset 0, flags [none], proto TCP (6), length 1426)
    172.253.115.101.443 > 172.25.186.179.55364: Flags [P.], cksum 0x50e5 (correct), seq 2094442492:2094443866, ack 2429971609, win 4715, options [nop,nop,TS val 3241912999 ecr 932638422], length 1374
08:55:05.433995 IP (tos 0x60, ttl 119, id 42229, offset 0, flags [none], proto TCP (6), length 397)
    172.253.115.101.443 > 172.25.186.179.55364: Flags [P.], cksum 0xac26 (correct), seq 1374:1719, ack 1, win 4715, options [nop,nop,TS val 3241912999 ecr 932638422], length 345
08:55:05.434171 IP (tos 0x0, ttl 64, id 0, offset 0, flags [DF], proto TCP (6), length 52)
    172.25.186.179.55364 > 172.253.115.101.443: Flags [.], cksum 0x4bf7 (correct), ack 1719, win 3530, options [nop,nop,TS val 932638552 ecr 3241912999], length 0
08:55:05.559622 IP (tos 0x60, ttl 119, id 42230, offset 0, flags [none], proto TCP (6), length 1426)
    172.253.115.101.443 > 172.25.186.179.55364: Flags [P.], cksum 0xefb3 (correct), seq 1719:3093, ack 1, win 4715, options [nop,nop,TS val 3241913124 ecr 932638552], length 1374
08:55:05.559623 IP (tos 0x60, ttl 119, id 42231, offset 0, flags [none], proto TCP (6), length 589)
    172.253.115.101.443 > 172.25.186.179.55364: Flags [P.], cksum 0x67b7 (correct), seq 3093:3630, ack 1, win 4715, options [nop,nop,TS val 3241913124 ecr 932638552], length 537
08:55:05.559821 IP (tos 0x0, ttl 64, id 0, offset 0, flags [DF], proto TCP (6), length 52)
    172.25.186.179.55364 > 172.253.115.101.443: Flags [.], cksum 0x4385 (correct), ack 3630, win 3530, options [nop,nop,TS val 932638678 ecr 3241913124], length 0
08:55:05.559901 IP (tos 0x0, ttl 64, id 0, offset 0, flags [DF], proto TCP (6), length 87)
    172.25.186.179.55364 > 172.253.115.101.443: Flags [P.], cksum 0xd1f1 (correct), seq 1:36, ack 3630, win 3530, options [nop,nop,TS val 932638678 ecr 3241913124], length 35
08:55:05.559913 IP (tos 0x0, ttl 64, id 0, offset 0, flags [DF], proto TCP (6), length 87)
    172.25.186.179.55364 > 172.253.115.101.443: Flags [P.], cksum 0x84f8 (correct), seq 36:71, ack 3630, win 3530, options [nop,nop,TS val 932638678 ecr 3241913124], length 35
08:55:05.571633 IP (tos 0x60, ttl 119, id 42232, offset 0, flags [none], proto TCP (6), length 52)
    172.253.115.101.443 > 172.25.186.179.55364: Flags [.], cksum 0x3e91 (correct), ack 71, win 4715, options [nop,nop,TS val 3241913137 ecr 932638678], length 0
08:55:05.693297 IP (tos 0x60, ttl 119, id 42233, offset 0, flags [none], proto TCP (6), length 1426)
    172.253.115.101.443 > 172.25.186.179.55364: Flags [P.], cksum 0xb8dd (correct), seq 3630:5004, ack 71, win 4715, options [nop,nop,TS val 3241913258 ecr 932638678], length 1374
08:55:05.693298 IP (tos 0x60, ttl 119, id 42234, offset 0, flags [none], proto TCP (6), length 475)
    172.253.115.101.443 > 172.25.186.179.55364: Flags [P.], cksum 0xe34d (correct), seq 5004:5427, ack 71, win 4715, options [nop,nop,TS val 3241913258 ecr 932638678], length 423
08:55:05.693434 IP (tos 0x0, ttl 64, id 0, offset 0, flags [DF], proto TCP (6), length 52)
    172.25.186.179.55364 > 172.253.115.101.443: Flags [.], cksum 0x3b2f (correct), ack 5427, win 3530, options [nop,nop,TS val 932638811 ecr 3241913258], length 0
08:55:05.865490 IP (tos 0x60, ttl 119, id 42235, offset 0, flags [none], proto TCP (6), length 1426)
    172.253.115.101.443 > 172.25.186.179.55364: Flags [P.], cksum 0xd5e9 (correct), seq 5427:6801, ack 71, win 4715, options [nop,nop,TS val 3241913430 ecr 932638811], length 1374
08:55:05.865491 IP (tos 0x60, ttl 119, id 42236, offset 0, flags [none], proto TCP (6), length 435)
    172.253.115.101.443 > 172.25.186.179.55364: Flags [P.], cksum 0xb4bb (correct), seq 6801:7184, ack 71, win 4715, options [nop,nop,TS val 3241913430 ecr 932638811], length 383
08:55:05.865686 IP (tos 0x0, ttl 64, id 0, offset 0, flags [DF], proto TCP (6), length 52)
    172.25.186.179.55364 > 172.253.115.101.443: Flags [.], cksum 0x32f9 (correct), ack 7184, win 3530, options [nop,nop,TS val 932638984 ecr 3241913430], length 0
08:55:05.994791 IP (tos 0x60, ttl 119, id 42237, offset 0, flags [none], proto TCP (6), length 1426)
    172.253.115.101.443 > 172.25.186.179.55364: Flags [P.], cksum 0x202b (correct), seq 7184:8558, ack 71, win 4715, options [nop,nop,TS val 3241913560 ecr 932638984], length 1374
08:55:05.994792 IP (tos 0x60, ttl 119, id 42238, offset 0, flags [none], proto TCP (6), length 466)
    172.253.115.101.443 > 172.25.186.179.55364: Flags [P.], cksum 0x144f (correct), seq 8558:8972, ack 71, win 4715, options [nop,nop,TS val 3241913560 ecr 932638984], length 414
08:55:05.994874 IP (tos 0x0, ttl 64, id 0, offset 0, flags [DF], proto TCP (6), length 52)
    172.25.186.179.55364 > 172.253.115.101.443: Flags [.], cksum 0x2afa (correct), ack 8972, win 3530, options [nop,nop,TS val 932639113 ecr 3241913560], length 0
08:55:06.206038 IP (tos 0x60, ttl 119, id 42239, offset 0, flags [none], proto TCP (6), length 1426)
    172.253.115.101.443 > 172.25.186.179.55364: Flags [P.], cksum 0x55c9 (correct), seq 8972:10346, ack 71, win 4715, options [nop,nop,TS val 3241913739 ecr 932639113], length 1374
08:55:06.206039 IP (tos 0x60, ttl 119, id 42240, offset 0, flags [none], proto TCP (6), length 661)
    172.253.115.101.443 > 172.25.186.179.55364: Flags [P.], cksum 0x0404 (correct), seq 10346:10955, ack 71, win 4715, options [nop,nop,TS val 3241913739 ecr 932639113], length 609
08:55:06.206231 IP (tos 0x0, ttl 64, id 0, offset 0, flags [DF], proto TCP (6), length 52)
    172.25.186.179.55364 > 172.253.115.101.443: Flags [.], cksum 0x21b5 (correct), ack 10955, win 3530, options [nop,nop,TS val 932639324 ecr 3241913739], length 0
08:55:06.405906 IP (tos 0x60, ttl 119, id 42241, offset 0, flags [none], proto TCP (6), length 1426)
    172.253.115.101.443 > 172.25.186.179.55364: Flags [P.], cksum 0x584e (correct), seq 10955:12329, ack 71, win 4715, options [nop,nop,TS val 3241913971 ecr 932639324], length 1374
08:55:06.405907 IP (tos 0x60, ttl 119, id 42242, offset 0, flags [none], proto TCP (6), length 423)
    172.253.115.101.443 > 172.25.186.179.55364: Flags [P.], cksum 0x7318 (correct), seq 12329:12700, ack 71, win 4715, options [nop,nop,TS val 3241913971 ecr 932639324], length 371
08:55:06.406115 IP (tos 0x0, ttl 64, id 0, offset 0, flags [DF], proto TCP (6), length 52)
    172.25.186.179.55364 > 172.253.115.101.443: Flags [.], cksum 0x1934 (correct), ack 12700, win 3530, options [nop,nop,TS val 932639524 ecr 3241913971], length 0
08:55:06.621614 IP (tos 0x60, ttl 119, id 42243, offset 0, flags [none], proto TCP (6), length 1426)
    172.253.115.101.443 > 172.25.186.179.55364: Flags [P.], cksum 0x128e (correct), seq 12700:14074, ack 71, win 4715, options [nop,nop,TS val 3241914186 ecr 932639524], length 1374
08:55:06.621615 IP (tos 0x60, ttl 119, id 42244, offset 0, flags [none], proto TCP (6), length 517)
    172.253.115.101.443 > 172.25.186.179.55364: Flags [P.], cksum 0xb7e7 (correct), seq 14074:14539, ack 71, win 4715, options [nop,nop,TS val 3241914186 ecr 932639524], length 465
08:55:06.621809 IP (tos 0x0, ttl 64, id 0, offset 0, flags [DF], proto TCP (6), length 52)
    172.25.186.179.55364 > 172.253.115.101.443: Flags [.], cksum 0x1056 (correct), ack 14539, win 3530, options [nop,nop,TS val 932639740 ecr 3241914186], length 0
08:55:06.809150 IP (tos 0x60, ttl 119, id 42245, offset 0, flags [none], proto TCP (6), length 1426)
    172.253.115.101.443 > 172.25.186.179.55364: Flags [P.], cksum 0x8de8 (correct), seq 14539:15913, ack 71, win 4715, options [nop,nop,TS val 3241914374 ecr 932639740], length 1374
08:55:06.809151 IP (tos 0x60, ttl 119, id 42246, offset 0, flags [none], proto TCP (6), length 628)
    172.253.115.101.443 > 172.25.186.179.55364: Flags [P.], cksum 0xde68 (correct), seq 15913:16489, ack 71, win 4715, options [nop,nop,TS val 3241914374 ecr 932639740], length 576
08:55:06.809258 IP (tos 0x0, ttl 64, id 0, offset 0, flags [DF], proto TCP (6), length 52)
    172.25.186.179.55364 > 172.253.115.101.443: Flags [.], cksum 0x0741 (correct), ack 16489, win 3530, options [nop,nop,TS val 932639927 ecr 3241914374], length 0
08:55:06.980256 IP (tos 0x60, ttl 119, id 42247, offset 0, flags [none], proto TCP (6), length 1426)
    172.253.115.101.443 > 172.25.186.179.55364: Flags [P.], cksum 0xca26 (correct), seq 16489:17863, ack 71, win 4715, options [nop,nop,TS val 3241914545 ecr 932639927], length 1374
08:55:06.980257 IP (tos 0x60, ttl 119, id 42248, offset 0, flags [none], proto TCP (6), length 570)
    172.253.115.101.443 > 172.25.186.179.55364: Flags [P.], cksum 0xc172 (correct), seq 17863:18381, ack 71, win 4715, options [nop,nop,TS val 3241914545 ecr 932639927], length 518
08:55:06.980454 IP (tos 0x0, ttl 64, id 0, offset 0, flags [DF], proto TCP (6), length 52)
    172.25.186.179.55364 > 172.253.115.101.443: Flags [.], cksum 0xfe86 (correct), ack 18381, win 3530, options [nop,nop,TS val 932640098 ecr 3241914545], length 0
08:55:06.988144 IP (tos 0x60, ttl 119, id 42249, offset 0, flags [none], proto TCP (6), length 1426)
    172.253.115.101.443 > 172.25.186.179.55364: Flags [P.], cksum 0xc885 (correct), seq 18381:19755, ack 71, win 4715, options [nop,nop,TS val 3241914553 ecr 932639927], length 1374
08:55:06.988165 IP (tos 0x60, ttl 119, id 42250, offset 0, flags [none], proto TCP (6), length 873)
    172.253.115.101.443 > 172.25.186.179.55364: Flags [P.], cksum 0xf5ab (correct), seq 19755:20576, ack 71, win 4715, options [nop,nop,TS val 3241914553 ecr 932639927], length 821
08:55:06.988304 IP (tos 0x0, ttl 64, id 0, offset 0, flags [DF], proto TCP (6), length 52)
    172.25.186.179.55364 > 172.253.115.101.443: Flags [.], cksum 0xf5e3 (correct), ack 20576, win 3530, options [nop,nop,TS val 932640106 ecr 3241914553], length 0
08:55:07.000704 IP (tos 0x60, ttl 119, id 42251, offset 0, flags [none], proto TCP (6), length 1426)
    172.253.115.101.443 > 172.25.186.179.55364: Flags [P.], cksum 0xa6ce (correct), seq 20576:21950, ack 71, win 4715, options [nop,nop,TS val 3241914566 ecr 932640106], length 1374
08:55:07.000705 IP (tos 0x60, ttl 119, id 42252, offset 0, flags [none], proto TCP (6), length 732)
    172.253.115.101.443 > 172.25.186.179.55364: Flags [P.], cksum 0xfae6 (correct), seq 21950:22630, ack 71, win 4715, options [nop,nop,TS val 3241914566 ecr 932640106], length 680
08:55:07.000802 IP (tos 0x0, ttl 64, id 0, offset 0, flags [DF], proto TCP (6), length 52)
    172.25.186.179.55364 > 172.253.115.101.443: Flags [.], cksum 0xedc3 (correct), ack 22630, win 3530, options [nop,nop,TS val 932640119 ecr 3241914566], length 0
08:55:07.009500 IP (tos 0x60, ttl 119, id 42253, offset 0, flags [none], proto TCP (6), length 1426)
    172.253.115.101.443 > 172.25.186.179.55364: Flags [P.], cksum 0xcb96 (correct), seq 22630:24004, ack 71, win 4715, options [nop,nop,TS val 3241914575 ecr 932640106], length 1374
08:55:07.009501 IP (tos 0x60, ttl 119, id 42254, offset 0, flags [none], proto TCP (6), length 750)
    172.253.115.101.443 > 172.25.186.179.55364: Flags [P.], cksum 0x5af0 (correct), seq 24004:24702, ack 71, win 4715, options [nop,nop,TS val 3241914575 ecr 932640106], length 698
08:55:07.009592 IP (tos 0x0, ttl 64, id 0, offset 0, flags [DF], proto TCP (6), length 52)
    172.25.186.179.55364 > 172.253.115.101.443: Flags [.], cksum 0xe599 (correct), ack 24702, win 3530, options [nop,nop,TS val 932640128 ecr 3241914575], length 0
08:55:07.031346 IP (tos 0x60, ttl 119, id 42255, offset 0, flags [none], proto TCP (6), length 286)
    172.253.115.101.443 > 172.25.186.179.55364: Flags [P.], cksum 0x8aad (correct), seq 24702:24936, ack 71, win 4715, options [nop,nop,TS val 3241914597 ecr 932640128], length 234
08:55:07.031355 IP (tos 0x80, ttl 119, id 42258, offset 0, flags [none], proto TCP (6), length 91)
    172.253.115.101.443 > 172.25.186.179.55364: Flags [P.], cksum 0xf8fd (correct), seq 25328:25367, ack 71, win 4715, options [nop,nop,TS val 3241914597 ecr 932640128], length 39
08:55:07.031404 IP (tos 0x0, ttl 64, id 0, offset 0, flags [DF], proto TCP (6), length 64)
    172.25.186.179.55364 > 172.253.115.101.443: Flags [.], cksum 0x9ec2 (correct), ack 24936, win 3527, options [nop,nop,TS val 932640149 ecr 3241914597,nop,nop,sack 1 {25328:25367}], length 0
08:55:07.032883 IP (tos 0x60, ttl 119, id 42256, offset 0, flags [none], proto TCP (6), length 413)
    172.253.115.101.443 > 172.25.186.179.55364: Flags [P.], cksum 0xf200 (correct), seq 24936:25297, ack 71, win 4715, options [nop,nop,TS val 3241914597 ecr 932640128], length 361
08:55:07.032883 IP (tos 0x60, ttl 119, id 42257, offset 0, flags [none], proto TCP (6), length 83)
    172.253.115.101.443 > 172.25.186.179.55364: Flags [P.], cksum 0xdf53 (correct), seq 25297:25328, ack 71, win 4715, options [nop,nop,TS val 3241914597 ecr 932640128], length 31
08:55:07.032914 IP (tos 0x0, ttl 64, id 0, offset 0, flags [DF], proto TCP (6), length 52)
    172.25.186.179.55364 > 172.253.115.101.443: Flags [.], cksum 0xe2da (correct), ack 25367, win 3523, options [nop,nop,TS val 932640151 ecr 3241914597], length 0
08:55:07.033144 IP (tos 0x0, ttl 64, id 0, offset 0, flags [DF], proto TCP (6), length 91)
    172.25.186.179.55364 > 172.253.115.101.443: Flags [P.], cksum 0xaa11 (correct), seq 71:110, ack 25367, win 3530, options [nop,nop,TS val 932640151 ecr 3241914597], length 39
08:55:07.049487 IP (tos 0x80, ttl 119, id 42259, offset 0, flags [none], proto TCP (6), length 52)
    172.253.115.101.443 > 172.25.186.179.55364: Flags [.], cksum 0xddf9 (correct), ack 110, win 4715, options [nop,nop,TS val 3241914615 ecr 932640151], length 0
08:55:18.087824 IP (tos 0x0, ttl 64, id 0, offset 0, flags [DF], proto TCP (6), length 307)
    172.25.186.179.55364 > 172.253.115.101.443: Flags [P.], cksum 0x599b (correct), seq 110:365, ack 25367, win 3530, options [nop,nop,TS val 932651205 ecr 3241914615], length 255
08:55:18.087954 IP (tos 0x0, ttl 64, id 0, offset 0, flags [DF], proto TCP (6), length 91)
    172.25.186.179.55364 > 172.253.115.101.443: Flags [P.], cksum 0xb040 (correct), seq 365:404, ack 25367, win 3530, options [nop,nop,TS val 932651205 ecr 3241914615], length 39
08:55:18.101390 IP (tos 0x80, ttl 119, id 42260, offset 0, flags [none], proto TCP (6), length 52)
    172.253.115.101.443 > 172.25.186.179.55364: Flags [.], cksum 0x86a2 (correct), ack 365, win 4715, options [nop,nop,TS val 3241925665 ecr 932651205], length 0
08:55:18.101391 IP (tos 0x80, ttl 119, id 42261, offset 0, flags [none], proto TCP (6), length 52)
    172.253.115.101.443 > 172.25.186.179.55364: Flags [.], cksum 0x867b (correct), ack 404, win 4715, options [nop,nop,TS val 3241925665 ecr 932651205], length 0
08:55:18.101392 IP (tos 0x60, ttl 119, id 42262, offset 0, flags [none], proto TCP (6), length 91)
    172.253.115.101.443 > 172.25.186.179.55364: Flags [P.], cksum 0xd855 (correct), seq 25367:25406, ack 404, win 4715, options [nop,nop,TS val 3241925665 ecr 932651205], length 39
08:55:18.101536 IP (tos 0x0, ttl 64, id 0, offset 0, flags [DF], proto TCP (6), length 52)
    172.25.186.179.55364 > 172.253.115.101.443: Flags [.], cksum 0x8ae7 (correct), ack 25406, win 3530, options [nop,nop,TS val 932651219 ecr 3241925665], length 0
08:55:18.138527 IP (tos 0x60, ttl 119, id 42263, offset 0, flags [none], proto TCP (6), length 1426)
    172.253.115.101.443 > 172.25.186.179.55364: Flags [P.], cksum 0x6add (correct), seq 25406:26780, ack 404, win 4715, options [nop,nop,TS val 3241925698 ecr 932651219], length 1374
08:55:18.138528 IP (tos 0x60, ttl 119, id 42264, offset 0, flags [none], proto TCP (6), length 1426)
    172.253.115.101.443 > 172.25.186.179.55364: Flags [P.], cksum 0xcc30 (correct), seq 26780:28154, ack 404, win 4715, options [nop,nop,TS val 3241925698 ecr 932651219], length 1374
08:55:18.138529 IP (tos 0x60, ttl 119, id 42265, offset 0, flags [none], proto TCP (6), length 590)
    172.253.115.101.443 > 172.25.186.179.55364: Flags [P.], cksum 0x6d26 (correct), seq 28154:28692, ack 404, win 4715, options [nop,nop,TS val 3241925698 ecr 932651219], length 538
08:55:18.138530 IP (tos 0x60, ttl 119, id 42266, offset 0, flags [none], proto TCP (6), length 1426)
    172.253.115.101.443 > 172.25.186.179.55364: Flags [P.], cksum 0x5ac3 (correct), seq 28692:30066, ack 404, win 4715, options [nop,nop,TS val 3241925698 ecr 932651219], length 1374
08:55:18.138530 IP (tos 0x60, ttl 119, id 42267, offset 0, flags [none], proto TCP (6), length 1426)
    172.253.115.101.443 > 172.25.186.179.55364: Flags [P.], cksum 0x7a3a (correct), seq 30066:31440, ack 404, win 4715, options [nop,nop,TS val 3241925698 ecr 932651219], length 1374
08:55:18.138531 IP (tos 0x60, ttl 119, id 42268, offset 0, flags [none], proto TCP (6), length 1426)
    172.253.115.101.443 > 172.25.186.179.55364: Flags [.], cksum 0x573b (correct), seq 31440:32814, ack 404, win 4715, options [nop,nop,TS val 3241925698 ecr 932651219], length 1374
08:55:18.138532 IP (tos 0x60, ttl 119, id 42269, offset 0, flags [none], proto TCP (6), length 1426)
    172.253.115.101.443 > 172.25.186.179.55364: Flags [.], cksum 0x5472 (correct), seq 32814:34188, ack 404, win 4715, options [nop,nop,TS val 3241925698 ecr 932651219], length 1374
08:55:18.138532 IP (tos 0x60, ttl 119, id 42270, offset 0, flags [none], proto TCP (6), length 1426)
    172.253.115.101.443 > 172.25.186.179.55364: Flags [.], cksum 0x4de9 (correct), seq 34188:35562, ack 404, win 4715, options [nop,nop,TS val 3241925698 ecr 932651219], length 1374
08:55:18.138533 IP (tos 0x60, ttl 119, id 42271, offset 0, flags [none], proto TCP (6), length 1194)
    172.253.115.101.443 > 172.25.186.179.55364: Flags [P.], cksum 0x79ca (correct), seq 35562:36704, ack 404, win 4715, options [nop,nop,TS val 3241925698 ecr 932651219], length 1142
08:55:18.138534 IP (tos 0x60, ttl 119, id 42272, offset 0, flags [none], proto TCP (6), length 1426)
    172.253.115.101.443 > 172.25.186.179.55364: Flags [.], cksum 0xa72d (correct), seq 36704:38078, ack 404, win 4715, options [nop,nop,TS val 3241925699 ecr 932651219], length 1374
08:55:18.138534 IP (tos 0x60, ttl 119, id 42273, offset 0, flags [none], proto TCP (6), length 1426)
    172.253.115.101.443 > 172.25.186.179.55364: Flags [.], cksum 0xc207 (correct), seq 38078:39452, ack 404, win 4715, options [nop,nop,TS val 3241925699 ecr 932651219], length 1374
08:55:18.138535 IP (tos 0x60, ttl 119, id 42274, offset 0, flags [none], proto TCP (6), length 1149)
    172.253.115.101.443 > 172.25.186.179.55364: Flags [P.], cksum 0xfcf6 (correct), seq 39452:40549, ack 404, win 4715, options [nop,nop,TS val 3241925699 ecr 932651219], length 1097
08:55:18.138536 IP (tos 0x60, ttl 119, id 42275, offset 0, flags [none], proto TCP (6), length 1426)
    172.253.115.101.443 > 172.25.186.179.55364: Flags [P.], cksum 0x66bc (correct), seq 40549:41923, ack 404, win 4715, options [nop,nop,TS val 3241925699 ecr 932651219], length 1374
08:55:18.138537 IP (tos 0x60, ttl 119, id 42276, offset 0, flags [none], proto TCP (6), length 1426)
    172.253.115.101.443 > 172.25.186.179.55364: Flags [P.], cksum 0xd72e (correct), seq 41923:43297, ack 404, win 4715, options [nop,nop,TS val 3241925699 ecr 932651219], length 1374
08:55:18.138537 IP (tos 0x60, ttl 119, id 42277, offset 0, flags [none], proto TCP (6), length 1426)
    172.253.115.101.443 > 172.25.186.179.55364: Flags [P.], cksum 0xb3ff (correct), seq 43297:44671, ack 404, win 4715, options [nop,nop,TS val 3241925699 ecr 932651219], length 1374
08:55:18.138538 IP (tos 0x60, ttl 119, id 42278, offset 0, flags [none], proto TCP (6), length 1426)
    172.253.115.101.443 > 172.25.186.179.55364: Flags [.], cksum 0x933b (correct), seq 44671:46045, ack 404, win 4715, options [nop,nop,TS val 3241925699 ecr 932651219], length 1374
08:55:18.138539 IP (tos 0x60, ttl 119, id 42279, offset 0, flags [none], proto TCP (6), length 1426)
    172.253.115.101.443 > 172.25.186.179.55364: Flags [.], cksum 0xcd88 (correct), seq 46045:47419, ack 404, win 4715, options [nop,nop,TS val 3241925699 ecr 932651219], length 1374
08:55:18.138539 IP (tos 0x60, ttl 119, id 42280, offset 0, flags [none], proto TCP (6), length 1426)
    172.253.115.101.443 > 172.25.186.179.55364: Flags [.], cksum 0x6c69 (correct), seq 47419:48793, ack 404, win 4715, options [nop,nop,TS val 3241925699 ecr 932651219], length 1374
08:55:18.138540 IP (tos 0x60, ttl 119, id 42281, offset 0, flags [none], proto TCP (6), length 1426)
    172.253.115.101.443 > 172.25.186.179.55364: Flags [.], cksum 0x9d21 (correct), seq 48793:50167, ack 404, win 4715, options [nop,nop,TS val 3241925699 ecr 932651219], length 1374
08:55:18.138541 IP (tos 0x60, ttl 119, id 42282, offset 0, flags [none], proto TCP (6), length 1204)
    172.253.115.101.443 > 172.25.186.179.55364: Flags [P.], cksum 0x659b (correct), seq 50167:51319, ack 404, win 4715, options [nop,nop,TS val 3241925699 ecr 932651219], length 1152
08:55:18.138541 IP (tos 0x60, ttl 119, id 42283, offset 0, flags [none], proto TCP (6), length 1426)
    172.253.115.101.443 > 172.25.186.179.55364: Flags [.], cksum 0xe11d (correct), seq 51319:52693, ack 404, win 4715, options [nop,nop,TS val 3241925700 ecr 932651219], length 1374
08:55:18.138542 IP (tos 0x60, ttl 119, id 42284, offset 0, flags [none], proto TCP (6), length 1426)
    172.253.115.101.443 > 172.25.186.179.55364: Flags [.], cksum 0x950f (correct), seq 52693:54067, ack 404, win 4715, options [nop,nop,TS val 3241925700 ecr 932651219], length 1374
08:55:18.138543 IP (tos 0x60, ttl 119, id 42285, offset 0, flags [none], proto TCP (6), length 1426)
    172.253.115.101.443 > 172.25.186.179.55364: Flags [.], cksum 0x49f4 (correct), seq 54067:55441, ack 404, win 4715, options [nop,nop,TS val 3241925700 ecr 932651219], length 1374
08:55:18.138543 IP (tos 0x60, ttl 119, id 42286, offset 0, flags [none], proto TCP (6), length 1426)
    172.253.115.101.443 > 172.25.186.179.55364: Flags [.], cksum 0xaf88 (correct), seq 55441:56815, ack 404, win 4715, options [nop,nop,TS val 3241925700 ecr 932651219], length 1374
08:55:18.138544 IP (tos 0x60, ttl 119, id 42287, offset 0, flags [none], proto TCP (6), length 1426)
    172.253.115.101.443 > 172.25.186.179.55364: Flags [.], cksum 0x3ccd (correct), seq 56815:58189, ack 404, win 4715, options [nop,nop,TS val 3241925700 ecr 932651219], length 1374
08:55:18.138545 IP (tos 0x60, ttl 119, id 42288, offset 0, flags [none], proto TCP (6), length 1422)
    172.253.115.101.443 > 172.25.186.179.55364: Flags [P.], cksum 0xa2c0 (correct), seq 58189:59559, ack 404, win 4715, options [nop,nop,TS val 3241925700 ecr 932651219], length 1370
08:55:18.138630 IP (tos 0x0, ttl 64, id 0, offset 0, flags [DF], proto TCP (6), length 52)
    172.25.186.179.55364 > 172.253.115.101.443: Flags [.], cksum 0x5065 (correct), ack 40549, win 3294, options [nop,nop,TS val 932651256 ecr 3241925699], length 0
08:55:18.138674 IP (tos 0x0, ttl 64, id 0, offset 0, flags [DF], proto TCP (6), length 52)
    172.25.186.179.55364 > 172.253.115.101.443: Flags [.], cksum 0x11d8 (correct), ack 56815, win 3040, options [nop,nop,TS val 932651256 ecr 3241925700], length 0
08:55:18.138686 IP (tos 0x0, ttl 64, id 0, offset 0, flags [DF], proto TCP (6), length 52)
    172.25.186.179.55364 > 172.253.115.101.443: Flags [.], cksum 0x074a (correct), ack 59559, win 2998, options [nop,nop,TS val 932651256 ecr 3241925700], length 0
08:55:18.138888 IP (tos 0x60, ttl 119, id 42289, offset 0, flags [none], proto TCP (6), length 1426)
    172.253.115.101.443 > 172.25.186.179.55364: Flags [P.], cksum 0xbbc1 (correct), seq 59559:60933, ack 404, win 4715, options [nop,nop,TS val 3241925701 ecr 932651219], length 1374
08:55:18.138890 IP (tos 0x60, ttl 119, id 42290, offset 0, flags [none], proto TCP (6), length 1426)
    172.253.115.101.443 > 172.25.186.179.55364: Flags [.], cksum 0xb2b1 (correct), seq 60933:62307, ack 404, win 4715, options [nop,nop,TS val 3241925701 ecr 932651219], length 1374
08:55:18.138890 IP (tos 0x60, ttl 119, id 42291, offset 0, flags [none], proto TCP (6), length 1426)
    172.253.115.101.443 > 172.25.186.179.55364: Flags [.], cksum 0x325f (correct), seq 62307:63681, ack 404, win 4715, options [nop,nop,TS val 3241925701 ecr 932651219], length 1374
08:55:18.138891 IP (tos 0x60, ttl 119, id 42292, offset 0, flags [none], proto TCP (6), length 1426)
    172.253.115.101.443 > 172.25.186.179.55364: Flags [.], cksum 0x95bb (correct), seq 63681:65055, ack 404, win 4715, options [nop,nop,TS val 3241925701 ecr 932651219], length 1374
08:55:18.138892 IP (tos 0x60, ttl 119, id 42293, offset 0, flags [none], proto TCP (6), length 1426)
    172.253.115.101.443 > 172.25.186.179.55364: Flags [P.], cksum 0x7586 (correct), seq 65055:66429, ack 404, win 4715, options [nop,nop,TS val 3241925701 ecr 932651219], length 1374
08:55:18.138892 IP (tos 0x60, ttl 119, id 42294, offset 0, flags [none], proto TCP (6), length 1426)
    172.253.115.101.443 > 172.25.186.179.55364: Flags [.], cksum 0x8e6e (correct), seq 66429:67803, ack 404, win 4715, options [nop,nop,TS val 3241925701 ecr 932651219], length 1374
08:55:18.138893 IP (tos 0x60, ttl 119, id 42295, offset 0, flags [none], proto TCP (6), length 1426)
    172.253.115.101.443 > 172.25.186.179.55364: Flags [.], cksum 0x1796 (correct), seq 67803:69177, ack 404, win 4715, options [nop,nop,TS val 3241925701 ecr 932651219], length 1374
08:55:18.138894 IP (tos 0x60, ttl 119, id 42296, offset 0, flags [none], proto TCP (6), length 1426)
    172.253.115.101.443 > 172.25.186.179.55364: Flags [.], cksum 0x5411 (correct), seq 69177:70551, ack 404, win 4715, options [nop,nop,TS val 3241925701 ecr 932651219], length 1374
08:55:18.138894 IP (tos 0x60, ttl 119, id 42297, offset 0, flags [none], proto TCP (6), length 1426)
    172.253.115.101.443 > 172.25.186.179.55364: Flags [.], cksum 0xbc3e (correct), seq 70551:71925, ack 404, win 4715, options [nop,nop,TS val 3241925701 ecr 932651219], length 1374
08:55:18.138895 IP (tos 0x60, ttl 119, id 42298, offset 0, flags [none], proto TCP (6), length 1426)
    172.253.115.101.443 > 172.25.186.179.55364: Flags [.], cksum 0xac0e (correct), seq 71925:73299, ack 404, win 4715, options [nop,nop,TS val 3241925701 ecr 932651219], length 1374
08:55:18.138896 IP (tos 0x60, ttl 119, id 42299, offset 0, flags [none], proto TCP (6), length 1426)
    172.253.115.101.443 > 172.25.186.179.55364: Flags [.], cksum 0x04dd (correct), seq 73299:74673, ack 404, win 4715, options [nop,nop,TS val 3241925701 ecr 932651219], length 1374
08:55:18.138896 IP (tos 0x60, ttl 119, id 42300, offset 0, flags [none], proto TCP (6), length 319)
    172.253.115.101.443 > 172.25.186.179.55364: Flags [P.], cksum 0x6618 (correct), seq 74673:74940, ack 404, win 4715, options [nop,nop,TS val 3241925701 ecr 932651219], length 267
08:55:18.138897 IP (tos 0x60, ttl 119, id 42301, offset 0, flags [none], proto TCP (6), length 1426)
    172.253.115.101.443 > 172.25.186.179.55364: Flags [.], cksum 0x0479 (correct), seq 74940:76314, ack 404, win 4715, options [nop,nop,TS val 3241925702 ecr 932651219], length 1374
08:55:18.138898 IP (tos 0x60, ttl 119, id 42302, offset 0, flags [none], proto TCP (6), length 1426)
    172.253.115.101.443 > 172.25.186.179.55364: Flags [.], cksum 0x2773 (correct), seq 76314:77688, ack 404, win 4715, options [nop,nop,TS val 3241925702 ecr 932651219], length 1374
08:55:18.138898 IP (tos 0x60, ttl 119, id 42303, offset 0, flags [none], proto TCP (6), length 1426)
    172.253.115.101.443 > 172.25.186.179.55364: Flags [.], cksum 0x36ab (correct), seq 77688:79062, ack 404, win 4715, options [nop,nop,TS val 3241925702 ecr 932651219], length 1374
08:55:18.138899 IP (tos 0x60, ttl 119, id 42304, offset 0, flags [none], proto TCP (6), length 1426)
    172.253.115.101.443 > 172.25.186.179.55364: Flags [.], cksum 0x4e48 (correct), seq 79062:80436, ack 404, win 4715, options [nop,nop,TS val 3241925702 ecr 932651219], length 1374
08:55:18.138900 IP (tos 0x60, ttl 119, id 42305, offset 0, flags [none], proto TCP (6), length 1426)
    172.253.115.101.443 > 172.25.186.179.55364: Flags [.], cksum 0x9b1f (correct), seq 80436:81810, ack 404, win 4715, options [nop,nop,TS val 3241925702 ecr 932651219], length 1374
08:55:18.138900 IP (tos 0x60, ttl 119, id 42306, offset 0, flags [none], proto TCP (6), length 259)
    172.253.115.101.443 > 172.25.186.179.55364: Flags [P.], cksum 0x9a74 (correct), seq 81810:82017, ack 404, win 4715, options [nop,nop,TS val 3241925702 ecr 932651219], length 207
08:55:18.138901 IP (tos 0x60, ttl 119, id 42307, offset 0, flags [none], proto TCP (6), length 1426)
    172.253.115.101.443 > 172.25.186.179.55364: Flags [.], cksum 0xd76d (correct), seq 82017:83391, ack 404, win 4715, options [nop,nop,TS val 3241925703 ecr 932651219], length 1374
08:55:18.138901 IP (tos 0x60, ttl 119, id 42308, offset 0, flags [none], proto TCP (6), length 1426)
    172.253.115.101.443 > 172.25.186.179.55364: Flags [.], cksum 0x6f97 (correct), seq 83391:84765, ack 404, win 4715, options [nop,nop,TS val 3241925703 ecr 932651219], length 1374
08:55:18.138902 IP (tos 0x60, ttl 119, id 42309, offset 0, flags [none], proto TCP (6), length 1303)
    172.253.115.101.443 > 172.25.186.179.55364: Flags [P.], cksum 0x992d (correct), seq 84765:86016, ack 404, win 4715, options [nop,nop,TS val 3241925703 ecr 932651219], length 1251
08:55:18.138903 IP (tos 0x60, ttl 119, id 42310, offset 0, flags [none], proto TCP (6), length 1426)
    172.253.115.101.443 > 172.25.186.179.55364: Flags [.], cksum 0x1123 (correct), seq 86016:87390, ack 404, win 4715, options [nop,nop,TS val 3241925703 ecr 932651219], length 1374
08:55:18.138903 IP (tos 0x60, ttl 119, id 42311, offset 0, flags [none], proto TCP (6), length 1215)
    172.253.115.101.443 > 172.25.186.179.55364: Flags [P.], cksum 0xfb0a (correct), seq 87390:88553, ack 404, win 4715, options [nop,nop,TS val 3241925703 ecr 932651219], length 1163
08:55:18.138904 IP (tos 0x60, ttl 119, id 42312, offset 0, flags [none], proto TCP (6), length 1426)
    172.253.115.101.443 > 172.25.186.179.55364: Flags [P.], cksum 0xc7eb (correct), seq 88553:89927, ack 404, win 4715, options [nop,nop,TS val 3241925703 ecr 932651219], length 1374
08:55:18.138905 IP (tos 0x60, ttl 119, id 42313, offset 0, flags [none], proto TCP (6), length 1426)
    172.253.115.101.443 > 172.25.186.179.55364: Flags [.], cksum 0x89b9 (correct), seq 89927:91301, ack 404, win 4715, options [nop,nop,TS val 3241925703 ecr 932651219], length 1374
08:55:18.138905 IP (tos 0x60, ttl 119, id 42314, offset 0, flags [none], proto TCP (6), length 1426)
    172.253.115.101.443 > 172.25.186.179.55364: Flags [.], cksum 0x9ff7 (correct), seq 91301:92675, ack 404, win 4715, options [nop,nop,TS val 3241925703 ecr 932651219], length 1374
08:55:18.138906 IP (tos 0x60, ttl 119, id 42315, offset 0, flags [none], proto TCP (6), length 663)
    172.253.115.101.443 > 172.25.186.179.55364: Flags [P.], cksum 0x260c (correct), seq 92675:93286, ack 404, win 4715, options [nop,nop,TS val 3241925703 ecr 932651219], length 611
08:55:18.138907 IP (tos 0x60, ttl 119, id 42316, offset 0, flags [none], proto TCP (6), length 1426)
    172.253.115.101.443 > 172.25.186.179.55364: Flags [P.], cksum 0x3c5c (correct), seq 93286:94660, ack 404, win 4715, options [nop,nop,TS val 3241925703 ecr 932651219], length 1374
08:55:18.138907 IP (tos 0x60, ttl 119, id 42317, offset 0, flags [none], proto TCP (6), length 1426)
    172.253.115.101.443 > 172.25.186.179.55364: Flags [P.], cksum 0x34c3 (correct), seq 94660:96034, ack 404, win 4715, options [nop,nop,TS val 3241925704 ecr 932651219], length 1374
08:55:18.138908 IP (tos 0x60, ttl 119, id 42318, offset 0, flags [none], proto TCP (6), length 1014)
    172.253.115.101.443 > 172.25.186.179.55364: Flags [P.], cksum 0x6bcd (correct), seq 96034:96996, ack 404, win 4715, options [nop,nop,TS val 3241925704 ecr 932651219], length 962
08:55:18.138908 IP (tos 0x60, ttl 119, id 42319, offset 0, flags [none], proto TCP (6), length 1338)
    172.253.115.101.443 > 172.25.186.179.55364: Flags [P.], cksum 0xdff7 (correct), seq 96996:98282, ack 404, win 4715, options [nop,nop,TS val 3241925704 ecr 932651219], length 1286
08:55:18.138974 IP (tos 0x0, ttl 64, id 0, offset 0, flags [DF], proto TCP (6), length 52)
    172.25.186.179.55364 > 172.253.115.101.443: Flags [.], cksum 0xcb15 (correct), ack 74940, win 3028, options [nop,nop,TS val 932651256 ecr 3241925701], length 0
08:55:18.138993 IP (tos 0x0, ttl 64, id 0, offset 0, flags [DF], proto TCP (6), length 52)
    172.25.186.179.55364 > 172.253.115.101.443: Flags [.], cksum 0x9172 (correct), ack 89927, win 2794, options [nop,nop,TS val 932651256 ecr 3241925703], length 0
08:55:18.139003 IP (tos 0x0, ttl 64, id 0, offset 0, flags [DF], proto TCP (6), length 52)
    172.25.186.179.55364 > 172.253.115.101.443: Flags [.], cksum 0x7150 (correct), ack 98282, win 2664, options [nop,nop,TS val 932651256 ecr 3241925704], length 0
08:55:18.139131 IP (tos 0x0, ttl 64, id 0, offset 0, flags [DF], proto TCP (6), length 87)
    172.25.186.179.55364 > 172.253.115.101.443: Flags [P.], cksum 0x232b (correct), seq 404:439, ack 98282, win 3207, options [nop,nop,TS val 932651256 ecr 3241925704], length 35
08:55:18.139463 IP (tos 0x0, ttl 64, id 0, offset 0, flags [DF], proto TCP (6), length 52)
    172.25.186.179.55364 > 172.253.115.101.443: Flags [.], cksum 0x6dcb (correct), ack 98282, win 3530, options [nop,nop,TS val 932651256 ecr 3241925704], length 0
08:55:18.142870 IP (tos 0x60, ttl 119, id 42320, offset 0, flags [none], proto TCP (6), length 1426)
    172.253.115.101.443 > 172.25.186.179.55364: Flags [P.], cksum 0x251b (correct), seq 98282:99656, ack 404, win 4715, options [nop,nop,TS val 3241925704 ecr 932651219], length 1374
08:55:18.142871 IP (tos 0x60, ttl 119, id 42321, offset 0, flags [none], proto TCP (6), length 672)
    172.253.115.101.443 > 172.25.186.179.55364: Flags [P.], cksum 0x3d36 (correct), seq 99656:100276, ack 404, win 4715, options [nop,nop,TS val 3241925704 ecr 932651219], length 620
08:55:18.142872 IP (tos 0x60, ttl 119, id 42322, offset 0, flags [none], proto TCP (6), length 1426)
    172.253.115.101.443 > 172.25.186.179.55364: Flags [P.], cksum 0x399f (correct), seq 100276:101650, ack 404, win 4715, options [nop,nop,TS val 3241925704 ecr 932651219], length 1374
08:55:18.142872 IP (tos 0x60, ttl 119, id 42323, offset 0, flags [none], proto TCP (6), length 667)
    172.253.115.101.443 > 172.25.186.179.55364: Flags [P.], cksum 0x4405 (correct), seq 101650:102265, ack 404, win 4715, options [nop,nop,TS val 3241925704 ecr 932651219], length 615
08:55:18.142873 IP (tos 0x60, ttl 119, id 42324, offset 0, flags [none], proto TCP (6), length 1426)
    172.253.115.101.443 > 172.25.186.179.55364: Flags [P.], cksum 0x8a4d (correct), seq 102265:103639, ack 404, win 4715, options [nop,nop,TS val 3241925705 ecr 932651219], length 1374
08:55:18.142874 IP (tos 0x60, ttl 119, id 42325, offset 0, flags [none], proto TCP (6), length 773)
    172.253.115.101.443 > 172.25.186.179.55364: Flags [P.], cksum 0xf441 (correct), seq 103639:104360, ack 404, win 4715, options [nop,nop,TS val 3241925705 ecr 932651219], length 721
08:55:18.142874 IP (tos 0x60, ttl 119, id 42326, offset 0, flags [none], proto TCP (6), length 1426)
    172.253.115.101.443 > 172.25.186.179.55364: Flags [P.], cksum 0xe388 (correct), seq 104360:105734, ack 404, win 4715, options [nop,nop,TS val 3241925705 ecr 932651219], length 1374
08:55:18.142875 IP (tos 0x60, ttl 119, id 42327, offset 0, flags [none], proto TCP (6), length 310)
    172.253.115.101.443 > 172.25.186.179.55364: Flags [P.], cksum 0x2bff (correct), seq 105734:105992, ack 404, win 4715, options [nop,nop,TS val 3241925705 ecr 932651219], length 258
08:55:18.142924 IP (tos 0x0, ttl 64, id 0, offset 0, flags [DF], proto TCP (6), length 52)
    172.25.186.179.55364 > 172.253.115.101.443: Flags [.], cksum 0x501f (correct), ack 105992, win 3410, options [nop,nop,TS val 932651261 ecr 3241925705], length 0
08:55:18.143051 IP (tos 0x0, ttl 64, id 0, offset 0, flags [DF], proto TCP (6), length 52)
    172.25.186.179.55364 > 172.253.115.101.443: Flags [.], cksum 0x4fa7 (correct), ack 105992, win 3530, options [nop,nop,TS val 932651261 ecr 3241925705], length 0
08:55:18.144981 IP (tos 0x60, ttl 119, id 42328, offset 0, flags [none], proto TCP (6), length 1426)
    172.253.115.101.443 > 172.25.186.179.55364: Flags [P.], cksum 0x2bde (correct), seq 105992:107366, ack 404, win 4715, options [nop,nop,TS val 3241925708 ecr 932651219], length 1374
08:55:18.144981 IP (tos 0x60, ttl 119, id 42329, offset 0, flags [none], proto TCP (6), length 1426)
    172.253.115.101.443 > 172.25.186.179.55364: Flags [P.], cksum 0xbcd5 (correct), seq 107366:108740, ack 404, win 4715, options [nop,nop,TS val 3241925708 ecr 932651219], length 1374
08:55:18.144982 IP (tos 0x60, ttl 119, id 42330, offset 0, flags [none], proto TCP (6), length 1426)
    172.253.115.101.443 > 172.25.186.179.55364: Flags [P.], cksum 0xb6f3 (correct), seq 108740:110114, ack 404, win 4715, options [nop,nop,TS val 3241925708 ecr 932651219], length 1374
08:55:18.144982 IP (tos 0x60, ttl 119, id 42331, offset 0, flags [none], proto TCP (6), length 1426)
    172.253.115.101.443 > 172.25.186.179.55364: Flags [P.], cksum 0x3cbc (correct), seq 110114:111488, ack 404, win 4715, options [nop,nop,TS val 3241925708 ecr 932651219], length 1374
08:55:18.144983 IP (tos 0x60, ttl 119, id 42332, offset 0, flags [none], proto TCP (6), length 1426)
    172.253.115.101.443 > 172.25.186.179.55364: Flags [P.], cksum 0x959c (correct), seq 111488:112862, ack 404, win 4715, options [nop,nop,TS val 3241925708 ecr 932651219], length 1374
08:55:18.144984 IP (tos 0x60, ttl 119, id 42333, offset 0, flags [none], proto TCP (6), length 1426)
    172.253.115.101.443 > 172.25.186.179.55364: Flags [.], cksum 0xb82a (correct), seq 112862:114236, ack 404, win 4715, options [nop,nop,TS val 3241925708 ecr 932651219], length 1374
08:55:18.144985 IP (tos 0x60, ttl 119, id 42334, offset 0, flags [none], proto TCP (6), length 1426)
    172.253.115.101.443 > 172.25.186.179.55364: Flags [.], cksum 0x10bb (correct), seq 114236:115610, ack 404, win 4715, options [nop,nop,TS val 3241925708 ecr 932651219], length 1374
08:55:18.144985 IP (tos 0x60, ttl 119, id 42335, offset 0, flags [none], proto TCP (6), length 1140)
    172.253.115.101.443 > 172.25.186.179.55364: Flags [P.], cksum 0xeb8b (correct), seq 115610:116698, ack 404, win 4715, options [nop,nop,TS val 3241925708 ecr 932651219], length 1088
08:55:18.145016 IP (tos 0x0, ttl 64, id 0, offset 0, flags [DF], proto TCP (6), length 52)
    172.25.186.179.55364 > 172.253.115.101.443: Flags [.], cksum 0x2678 (correct), ack 116698, win 3363, options [nop,nop,TS val 932651262 ecr 3241925708], length 0
08:55:18.145044 IP (tos 0x0, ttl 64, id 0, offset 0, flags [DF], proto TCP (6), length 52)
    172.25.186.179.55364 > 172.253.115.101.443: Flags [.], cksum 0x25d1 (correct), ack 116698, win 3530, options [nop,nop,TS val 932651262 ecr 3241925708], length 0
08:55:18.148038 IP (tos 0x60, ttl 119, id 42336, offset 0, flags [none], proto TCP (6), length 1426)
    172.253.115.101.443 > 172.25.186.179.55364: Flags [P.], cksum 0xbb84 (correct), seq 116698:118072, ack 404, win 4715, options [nop,nop,TS val 3241925711 ecr 932651219], length 1374
08:55:18.148039 IP (tos 0x60, ttl 119, id 42337, offset 0, flags [none], proto TCP (6), length 655)
    172.253.115.101.443 > 172.25.186.179.55364: Flags [P.], cksum 0xb51d (correct), seq 118072:118675, ack 404, win 4715, options [nop,nop,TS val 3241925711 ecr 932651219], length 603
08:55:18.148039 IP (tos 0x80, ttl 119, id 42345, offset 0, flags [none], proto TCP (6), length 91)
