tcpdump: data link type PKTAP
tcpdump: WARNING: snaplen raised from 96 to 524288
tcpdump: listening on pktap, link-type PKTAP (Apple DLT_PKTAP), snapshot length 524288 bytes
15:18:00.869078 IP (tos 0x0, ttl 64, id 0, offset 0, flags [DF], proto TCP (6), length 1422)
    172.25.64.219.63352 > 172.253.139.102.443: Flags [.], cksum 0xfad7 (correct), seq 68878435:68879805, ack 961145632, win 2712, options [nop,nop,TS val 572168308 ecr 3210012835], length 1370
15:18:00.869081 IP (tos 0x0, ttl 64, id 1, offset 0, flags [DF], proto TCP (6), length 1422)
    172.25.64.219.63352 > 172.253.139.102.443: Flags [.], cksum 0x2d20 (correct), seq 1370:2740, ack 1, win 2712, options [nop,nop,TS val 572168308 ecr 3210012835], length 1370
15:18:00.869145 IP (tos 0x0, ttl 64, id 0, offset 0, flags [DF], proto TCP (6), length 508)
    172.25.64.219.63352 > 172.253.139.102.443: Flags [P.], cksum 0x0796 (correct), seq 2740:3196, ack 1, win 2712, options [nop,nop,TS val 572168308 ecr 3210012835], length 456
15:18:00.869198 IP (tos 0x0, ttl 64, id 0, offset 0, flags [DF], proto TCP (6), length 91)
    172.25.64.219.63352 > 172.253.139.102.443: Flags [P.], cksum 0xef4f (correct), seq 3196:3235, ack 1, win 2712, options [nop,nop,TS val 572168308 ecr 3210012835], length 39
15:18:00.869224 IP (tos 0x0, ttl 64, id 0, offset 0, flags [DF], proto TCP (6), length 250)
    172.25.64.219.63352 > 172.253.139.102.443: Flags [P.], cksum 0xa700 (correct), seq 3235:3433, ack 1, win 2712, options [nop,nop,TS val 572168308 ecr 3210012835], length 198
15:18:00.876190 IP (tos 0x0, ttl 64, id 0, offset 0, flags [DF], proto TCP (6), length 1422)
    172.25.64.219.63352 > 172.253.139.102.443: Flags [.], cksum 0x22e2 (correct), seq 3433:4803, ack 1, win 2712, options [nop,nop,TS val 572168315 ecr 3210012835], length 1370
15:18:00.876191 IP (tos 0x0, ttl 64, id 1, offset 0, flags [DF], proto TCP (6), length 1422)
    172.25.64.219.63352 > 172.253.139.102.443: Flags [.], cksum 0x378a (correct), seq 4803:6173, ack 1, win 2712, options [nop,nop,TS val 572168315 ecr 3210012835], length 1370
15:18:00.876232 IP (tos 0x0, ttl 64, id 0, offset 0, flags [DF], proto TCP (6), length 515)
    172.25.64.219.63352 > 172.253.139.102.443: Flags [P.], cksum 0x5c4a (correct), seq 6173:6636, ack 1, win 2712, options [nop,nop,TS val 572168315 ecr 3210012835], length 463
15:18:00.876267 IP (tos 0x0, ttl 64, id 0, offset 0, flags [DF], proto TCP (6), length 1422)
    172.25.64.219.63352 > 172.253.139.102.443: Flags [.], cksum 0x3e67 (correct), seq 6636:8006, ack 1, win 2712, options [nop,nop,TS val 572168315 ecr 3210012835], length 1370
15:18:00.876272 IP (tos 0x0, ttl 64, id 0, offset 0, flags [DF], proto TCP (6), length 1309)
    172.25.64.219.63352 > 172.253.139.102.443: Flags [P.], cksum 0x8de7 (correct), seq 8006:9263, ack 1, win 2712, options [nop,nop,TS val 572168315 ecr 3210012835], length 1257
15:18:00.880078 IP (tos 0x0, ttl 64, id 0, offset 0, flags [DF], proto TCP (6), length 1422)
    172.25.64.219.63352 > 172.253.139.102.443: Flags [.], cksum 0x2538 (correct), seq 9263:10633, ack 1, win 2712, options [nop,nop,TS val 572168319 ecr 3210012835], length 1370
15:18:00.880080 IP (tos 0x0, ttl 64, id 1, offset 0, flags [DF], proto TCP (6), length 1422)
    172.25.64.219.63352 > 172.253.139.102.443: Flags [.], cksum 0x0e42 (correct), seq 10633:12003, ack 1, win 2712, options [nop,nop,TS val 572168319 ecr 3210012835], length 1370
15:18:00.880100 IP (tos 0x0, ttl 64, id 0, offset 0, flags [DF], proto TCP (6), length 313)
    172.25.64.219.63352 > 172.253.139.102.443: Flags [P.], cksum 0xcd93 (correct), seq 12003:12264, ack 1, win 2712, options [nop,nop,TS val 572168319 ecr 3210012835], length 261
15:18:00.880119 IP (tos 0x0, ttl 64, id 0, offset 0, flags [DF], proto TCP (6), length 902)
    172.25.64.219.63352 > 172.253.139.102.443: Flags [P.], cksum 0xd7bc (correct), seq 12264:13114, ack 1, win 2712, options [nop,nop,TS val 572168319 ecr 3210012835], length 850
15:18:00.881932 IP (tos 0x0, ttl 118, id 27988, offset 0, flags [none], proto TCP (6), length 64)
    172.253.139.102.443 > 172.25.64.219.63352: Flags [.], cksum 0x39f5 (correct), ack 1370, win 3434, options [nop,nop,TS val 3210023528 ecr 572168308,nop,nop,sack 1 {2740:3196}], length 0
15:18:00.881933 IP (tos 0x0, ttl 118, id 27989, offset 0, flags [none], proto TCP (6), length 52)
    172.253.139.102.443 > 172.25.64.219.63352: Flags [.], cksum 0x890b (correct), ack 3196, win 3445, options [nop,nop,TS val 3210023528 ecr 572168308], length 0
15:18:00.882187 IP (tos 0x0, ttl 118, id 27990, offset 0, flags [none], proto TCP (6), length 52)
    172.253.139.102.443 > 172.25.64.219.63352: Flags [.], cksum 0x881e (correct), ack 3433, win 3445, options [nop,nop,TS val 3210023528 ecr 572168308], length 0
15:18:00.884093 IP (tos 0x0, ttl 118, id 27991, offset 0, flags [none], proto TCP (6), length 91)
    172.253.139.102.443 > 172.25.64.219.63352: Flags [P.], cksum 0xafe6 (correct), seq 1:40, ack 3433, win 3445, options [nop,nop,TS val 3210023529 ecr 572168308], length 39
15:18:00.884160 IP (tos 0x0, ttl 64, id 0, offset 0, flags [DF], proto TCP (6), length 52)
    172.25.64.219.63352 > 172.253.139.102.443: Flags [.], cksum 0x64f3 (correct), ack 40, win 2712, options [nop,nop,TS val 572168323 ecr 3210023529], length 0
15:18:00.892951 IP (tos 0x0, ttl 118, id 27992, offset 0, flags [none], proto TCP (6), length 52)
    172.253.139.102.443 > 172.25.64.219.63352: Flags [.], cksum 0x7d21 (correct), ack 6173, win 3467, options [nop,nop,TS val 3210023533 ecr 572168315], length 0
15:18:00.892952 IP (tos 0x0, ttl 118, id 27993, offset 0, flags [none], proto TCP (6), length 52)
    172.253.139.102.443 > 172.25.64.219.63352: Flags [.], cksum 0x70f0 (correct), ack 9263, win 3498, options [nop,nop,TS val 3210023533 ecr 572168315], length 0
15:18:00.892952 IP (tos 0x0, ttl 118, id 27994, offset 0, flags [none], proto TCP (6), length 64)
    172.253.139.102.443 > 172.25.64.219.63352: Flags [.], cksum 0xcda4 (correct), ack 10633, win 3509, options [nop,nop,TS val 3210023537 ecr 572168319,nop,nop,sack 1 {12003:12264}], length 0
15:18:00.892953 IP (tos 0x0, ttl 118, id 27995, offset 0, flags [none], proto TCP (6), length 52)
    172.253.139.102.443 > 172.25.64.219.63352: Flags [.], cksum 0x6519 (correct), ack 12264, win 3520, options [nop,nop,TS val 3210023537 ecr 572168319], length 0
15:18:00.897156 IP (tos 0x0, ttl 118, id 27996, offset 0, flags [none], proto TCP (6), length 52)
    172.253.139.102.443 > 172.25.64.219.63352: Flags [.], cksum 0x61b8 (correct), ack 13114, win 3530, options [nop,nop,TS val 3210023542 ecr 572168319], length 0
15:18:00.912089 IP (tos 0x0, ttl 118, id 27997, offset 0, flags [none], proto TCP (6), length 596)
    172.253.139.102.443 > 172.25.64.219.63352: Flags [P.], cksum 0x7821 (correct), seq 40:584, ack 13114, win 3530, options [nop,nop,TS val 3210023555 ecr 572168319], length 544
15:18:00.912090 IP (tos 0x0, ttl 118, id 27998, offset 0, flags [none], proto TCP (6), length 336)
    172.253.139.102.443 > 172.25.64.219.63352: Flags [P.], cksum 0xac3f (correct), seq 584:868, ack 13114, win 3530, options [nop,nop,TS val 3210023555 ecr 572168319], length 284
15:18:00.912091 IP (tos 0x0, ttl 118, id 27999, offset 0, flags [none], proto TCP (6), length 83)
    172.253.139.102.443 > 172.25.64.219.63352: Flags [P.], cksum 0x26fe (correct), seq 868:899, ack 13114, win 3530, options [nop,nop,TS val 3210023555 ecr 572168319], length 31
15:18:00.912091 IP (tos 0x0, ttl 118, id 28000, offset 0, flags [none], proto TCP (6), length 91)
    172.253.139.102.443 > 172.25.64.219.63352: Flags [P.], cksum 0xdcb7 (correct), seq 899:938, ack 13114, win 3530, options [nop,nop,TS val 3210023556 ecr 572168319], length 39
15:18:00.912146 IP (tos 0x0, ttl 64, id 0, offset 0, flags [DF], proto TCP (6), length 52)
    172.25.64.219.63352 > 172.253.139.102.443: Flags [.], cksum 0x6148 (correct), ack 938, win 2698, options [nop,nop,TS val 572168351 ecr 3210023556], length 0
15:18:00.912665 IP (tos 0x0, ttl 64, id 0, offset 0, flags [DF], proto TCP (6), length 87)
    172.25.64.219.63352 > 172.253.139.102.443: Flags [P.], cksum 0x59ef (correct), seq 13114:13149, ack 938, win 2712, options [nop,nop,TS val 572168351 ecr 3210023556], length 35
15:18:00.912694 IP (tos 0x0, ttl 64, id 0, offset 0, flags [DF], proto TCP (6), length 91)
    172.25.64.219.63352 > 172.253.139.102.443: Flags [P.], cksum 0xa926 (correct), seq 13149:13188, ack 938, win 2712, options [nop,nop,TS val 572168351 ecr 3210023556], length 39
15:18:00.924997 IP (tos 0x0, ttl 118, id 28001, offset 0, flags [none], proto TCP (6), length 52)
    172.253.139.102.443 > 172.25.64.219.63352: Flags [.], cksum 0x5db0 (correct), ack 13188, win 3530, options [nop,nop,TS val 3210023570 ecr 572168351], length 0
15:18:00.976521 IP (tos 0x0, ttl 118, id 28002, offset 0, flags [none], proto TCP (6), length 596)
    172.253.139.102.443 > 172.25.64.219.63352: Flags [P.], cksum 0xbfdb (correct), seq 938:1482, ack 13188, win 3530, options [nop,nop,TS val 3210023622 ecr 572168351], length 544
15:18:00.976522 IP (tos 0x0, ttl 118, id 28003, offset 0, flags [none], proto TCP (6), length 334)
    172.253.139.102.443 > 172.25.64.219.63352: Flags [P.], cksum 0xf4c9 (correct), seq 1482:1764, ack 13188, win 3530, options [nop,nop,TS val 3210023622 ecr 572168351], length 282
15:18:00.976572 IP (tos 0x0, ttl 64, id 0, offset 0, flags [DF], proto TCP (6), length 52)
    172.25.64.219.63352 > 172.253.139.102.443: Flags [.], cksum 0x5d40 (correct), ack 1764, win 2700, options [nop,nop,TS val 572168415 ecr 3210023622], length 0
15:18:00.979257 IP (tos 0x0, ttl 64, id 0, offset 0, flags [DF], proto TCP (6), length 1422)
    172.25.64.219.63352 > 172.253.139.102.443: Flags [.], cksum 0x4b38 (correct), seq 13188:14558, ack 1764, win 2712, options [nop,nop,TS val 572168417 ecr 3210023622], length 1370
15:18:00.979258 IP (tos 0x0, ttl 64, id 1, offset 0, flags [DF], proto TCP (6), length 1422)
    172.25.64.219.63352 > 172.253.139.102.443: Flags [.], cksum 0x912a (correct), seq 14558:15928, ack 1764, win 2712, options [nop,nop,TS val 572168417 ecr 3210023622], length 1370
15:18:00.979270 IP (tos 0x0, ttl 64, id 0, offset 0, flags [DF], proto TCP (6), length 280)
    172.25.64.219.63352 > 172.253.139.102.443: Flags [P.], cksum 0x55f6 (correct), seq 15928:16156, ack 1764, win 2712, options [nop,nop,TS val 572168417 ecr 3210023622], length 228
15:18:00.979281 IP (tos 0x0, ttl 64, id 0, offset 0, flags [DF], proto TCP (6), length 1422)
    172.25.64.219.63352 > 172.253.139.102.443: Flags [.], cksum 0x9928 (correct), seq 16156:17526, ack 1764, win 2712, options [nop,nop,TS val 572168417 ecr 3210023622], length 1370
15:18:00.979281 IP (tos 0x0, ttl 64, id 1, offset 0, flags [DF], proto TCP (6), length 1422)
    172.25.64.219.63352 > 172.253.139.102.443: Flags [.], cksum 0x8ed6 (correct), seq 17526:18896, ack 1764, win 2712, options [nop,nop,TS val 572168417 ecr 3210023622], length 1370
15:18:00.979284 IP (tos 0x0, ttl 64, id 0, offset 0, flags [DF], proto TCP (6), length 1291)
    172.25.64.219.63352 > 172.253.139.102.443: Flags [P.], cksum 0x9207 (correct), seq 18896:20135, ack 1764, win 2712, options [nop,nop,TS val 572168417 ecr 3210023622], length 1239
15:18:00.984485 IP (tos 0x0, ttl 64, id 0, offset 0, flags [DF], proto TCP (6), length 1422)
    172.25.64.219.63352 > 172.253.139.102.443: Flags [.], cksum 0x9c97 (correct), seq 20135:21505, ack 1764, win 2712, options [nop,nop,TS val 572168423 ecr 3210023622], length 1370
15:18:00.984486 IP (tos 0x0, ttl 64, id 1, offset 0, flags [DF], proto TCP (6), length 1422)
    172.25.64.219.63352 > 172.253.139.102.443: Flags [.], cksum 0xa4d4 (correct), seq 21505:22875, ack 1764, win 2712, options [nop,nop,TS val 572168423 ecr 3210023622], length 1370
15:18:00.984502 IP (tos 0x0, ttl 64, id 0, offset 0, flags [DF], proto TCP (6), length 510)
    172.25.64.219.63352 > 172.253.139.102.443: Flags [P.], cksum 0x755b (correct), seq 22875:23333, ack 1764, win 2712, options [nop,nop,TS val 572168423 ecr 3210023622], length 458
15:18:00.984514 IP (tos 0x0, ttl 64, id 0, offset 0, flags [DF], proto TCP (6), length 236)
    172.25.64.219.63352 > 172.253.139.102.443: Flags [P.], cksum 0x2dca (correct), seq 23333:23517, ack 1764, win 2712, options [nop,nop,TS val 572168423 ecr 3210023622], length 184
15:18:00.989640 IP (tos 0x0, ttl 118, id 28004, offset 0, flags [none], proto TCP (6), length 52)
    172.253.139.102.443 > 172.25.64.219.63352: Flags [.], cksum 0x4f28 (correct), ack 15928, win 3552, options [nop,nop,TS val 3210023636 ecr 572168417], length 0
15:18:00.989641 IP (tos 0x0, ttl 118, id 28005, offset 0, flags [none], proto TCP (6), length 52)
    172.253.139.102.443 > 172.25.64.219.63352: Flags [.], cksum 0x48df (correct), ack 17526, win 3563, options [nop,nop,TS val 3210023636 ecr 572168417], length 0
15:18:00.991215 IP (tos 0x0, ttl 118, id 28006, offset 0, flags [none], proto TCP (6), length 52)
    172.253.139.102.443 > 172.25.64.219.63352: Flags [.], cksum 0x3e98 (correct), ack 20135, win 3585, options [nop,nop,TS val 3210023636 ecr 572168417], length 0
15:18:00.994178 IP (tos 0x0, ttl 118, id 28007, offset 0, flags [none], proto TCP (6), length 580)
    172.253.139.102.443 > 172.25.64.219.63352: Flags [P.], cksum 0x2594 (correct), seq 1764:2292, ack 20135, win 3585, options [nop,nop,TS val 3210023638 ecr 572168417], length 528
15:18:00.994179 IP (tos 0x0, ttl 118, id 28008, offset 0, flags [none], proto TCP (6), length 255)
    172.253.139.102.443 > 172.25.64.219.63352: Flags [P.], cksum 0x4d88 (correct), seq 2292:2495, ack 20135, win 3585, options [nop,nop,TS val 3210023638 ecr 572168417], length 203
15:18:00.994180 IP (tos 0x0, ttl 118, id 28009, offset 0, flags [none], proto TCP (6), length 242)
    172.253.139.102.443 > 172.25.64.219.63352: Flags [P.], cksum 0x22b1 (correct), seq 2495:2685, ack 20135, win 3585, options [nop,nop,TS val 3210023638 ecr 572168417], length 190
15:18:00.994180 IP (tos 0x0, ttl 118, id 28010, offset 0, flags [none], proto TCP (6), length 83)
    172.253.139.102.443 > 172.25.64.219.63352: Flags [P.], cksum 0xbba7 (correct), seq 2685:2716, ack 20135, win 3585, options [nop,nop,TS val 3210023638 ecr 572168417], length 31
15:18:00.994181 IP (tos 0x0, ttl 118, id 28011, offset 0, flags [none], proto TCP (6), length 91)
    172.253.139.102.443 > 172.25.64.219.63352: Flags [P.], cksum 0x221b (correct), seq 2716:2755, ack 20135, win 3585, options [nop,nop,TS val 3210023638 ecr 572168417], length 39
15:18:00.994269 IP (tos 0x0, ttl 64, id 0, offset 0, flags [DF], proto TCP (6), length 52)
    172.25.64.219.63352 > 172.253.139.102.443: Flags [.], cksum 0x30e9 (correct), ack 2755, win 2697, options [nop,nop,TS val 572168433 ecr 3210023638], length 0
15:18:00.994801 IP (tos 0x0, ttl 118, id 28012, offset 0, flags [none], proto TCP (6), length 64)
    172.253.139.102.443 > 172.25.64.219.63352: Flags [.], cksum 0x41b5 (correct), ack 21505, win 3596, options [nop,nop,TS val 3210023641 ecr 572168423,nop,nop,sack 1 {22875:23333}], length 0
15:18:00.994802 IP (tos 0x0, ttl 118, id 28013, offset 0, flags [none], proto TCP (6), length 52)
    172.253.139.102.443 > 172.25.64.219.63352: Flags [.], cksum 0x2e1a (correct), ack 23333, win 3607, options [nop,nop,TS val 3210023641 ecr 572168423], length 0
15:18:00.994810 IP (tos 0x0, ttl 64, id 0, offset 0, flags [DF], proto TCP (6), length 91)
    172.25.64.219.63352 > 172.253.139.102.443: Flags [P.], cksum 0x479d (correct), seq 23517:23556, ack 2755, win 2712, options [nop,nop,TS val 572168433 ecr 3210023638], length 39
15:18:01.000933 IP (tos 0x0, ttl 118, id 28014, offset 0, flags [none], proto TCP (6), length 52)
    172.253.139.102.443 > 172.25.64.219.63352: Flags [.], cksum 0x2d5d (correct), ack 23517, win 3607, options [nop,nop,TS val 3210023646 ecr 572168423], length 0
15:18:01.006518 IP (tos 0x0, ttl 118, id 28015, offset 0, flags [none], proto TCP (6), length 52)
    172.253.139.102.443 > 172.25.64.219.63352: Flags [.], cksum 0x2d26 (correct), ack 23556, win 3607, options [nop,nop,TS val 3210023652 ecr 572168433], length 0
15:18:01.019452 IP (tos 0x0, ttl 118, id 28016, offset 0, flags [none], proto TCP (6), length 294)
    172.253.139.102.443 > 172.25.64.219.63352: Flags [P.], cksum 0xc8bc (correct), seq 2755:2997, ack 23556, win 3607, options [nop,nop,TS val 3210023665 ecr 572168433], length 242
15:18:01.019453 IP (tos 0x0, ttl 118, id 28017, offset 0, flags [none], proto TCP (6), length 83)
    172.253.139.102.443 > 172.25.64.219.63352: Flags [P.], cksum 0x78ca (correct), seq 2997:3028, ack 23556, win 3607, options [nop,nop,TS val 3210023665 ecr 572168433], length 31
15:18:01.019453 IP (tos 0x0, ttl 118, id 28018, offset 0, flags [none], proto TCP (6), length 91)
    172.253.139.102.443 > 172.25.64.219.63352: Flags [P.], cksum 0x5cf2 (correct), seq 3028:3067, ack 23556, win 3607, options [nop,nop,TS val 3210023666 ecr 572168433], length 39
15:18:01.019549 IP (tos 0x0, ttl 64, id 0, offset 0, flags [DF], proto TCP (6), length 52)
    172.25.64.219.63352 > 172.253.139.102.443: Flags [.], cksum 0x2f4a (correct), ack 3067, win 2708, options [nop,nop,TS val 572168458 ecr 3210023666], length 0
15:18:01.019971 IP (tos 0x0, ttl 64, id 0, offset 0, flags [DF], proto TCP (6), length 91)
    172.25.64.219.63352 > 172.253.139.102.443: Flags [P.], cksum 0x1fb6 (correct), seq 23556:23595, ack 3067, win 2712, options [nop,nop,TS val 572168458 ecr 3210023666], length 39
15:18:01.037003 IP (tos 0x0, ttl 118, id 28019, offset 0, flags [none], proto TCP (6), length 52)
    172.253.139.102.443 > 172.25.64.219.63352: Flags [.], cksum 0x2b90 (correct), ack 23595, win 3607, options [nop,nop,TS val 3210023682 ecr 572168458], length 0
15:18:01.292595 IP (tos 0x0, ttl 118, id 28020, offset 0, flags [none], proto TCP (6), length 596)
    172.253.139.102.443 > 172.25.64.219.63352: Flags [P.], cksum 0x6482 (correct), seq 3067:3611, ack 23595, win 3607, options [nop,nop,TS val 3210023936 ecr 572168458], length 544
15:18:01.292596 IP (tos 0x0, ttl 118, id 28021, offset 0, flags [none], proto TCP (6), length 302)
    172.253.139.102.443 > 172.25.64.219.63352: Flags [P.], cksum 0x3661 (correct), seq 3611:3861, ack 23595, win 3607, options [nop,nop,TS val 3210023936 ecr 572168458], length 250
15:18:01.292596 IP (tos 0x0, ttl 118, id 28022, offset 0, flags [none], proto TCP (6), length 178)
    172.253.139.102.443 > 172.25.64.219.63352: Flags [P.], cksum 0x5815 (correct), seq 3861:3987, ack 23595, win 3607, options [nop,nop,TS val 3210023936 ecr 572168458], length 126
15:18:01.292597 IP (tos 0x0, ttl 118, id 28023, offset 0, flags [none], proto TCP (6), length 293)
    172.253.139.102.443 > 172.25.64.219.63352: Flags [P.], cksum 0xe20d (correct), seq 3987:4228, ack 23595, win 3607, options [nop,nop,TS val 3210023936 ecr 572168458], length 241
15:18:01.292597 IP (tos 0x0, ttl 118, id 28024, offset 0, flags [none], proto TCP (6), length 83)
    172.253.139.102.443 > 172.25.64.219.63352: Flags [P.], cksum 0x21f4 (correct), seq 4228:4259, ack 23595, win 3607, options [nop,nop,TS val 3210023936 ecr 572168458], length 31
15:18:01.292597 IP (tos 0x0, ttl 118, id 28025, offset 0, flags [none], proto TCP (6), length 91)
    172.253.139.102.443 > 172.25.64.219.63352: Flags [P.], cksum 0x3851 (correct), seq 4259:4298, ack 23595, win 3607, options [nop,nop,TS val 3210023936 ecr 572168458], length 39
15:18:01.292677 IP (tos 0x0, ttl 64, id 0, offset 0, flags [DF], proto TCP (6), length 52)
    172.25.64.219.63352 > 172.253.139.102.443: Flags [.], cksum 0x2844 (correct), ack 4298, win 2693, options [nop,nop,TS val 572168731 ecr 3210023936], length 0
15:18:01.293843 IP (tos 0x0, ttl 64, id 0, offset 0, flags [DF], proto TCP (6), length 91)
    172.25.64.219.63352 > 172.253.139.102.443: Flags [P.], cksum 0x812c (correct), seq 23595:23634, ack 4298, win 2712, options [nop,nop,TS val 572168732 ecr 3210023936], length 39
15:18:01.304269 IP (tos 0x0, ttl 118, id 28026, offset 0, flags [none], proto TCP (6), length 52)
    172.253.139.102.443 > 172.25.64.219.63352: Flags [.], cksum 0x247c (correct), ack 23634, win 3607, options [nop,nop,TS val 3210023950 ecr 572168732], length 0
15:18:01.653015 IP (tos 0x0, ttl 118, id 28027, offset 0, flags [none], proto TCP (6), length 207)
    172.253.139.102.443 > 172.25.64.219.63352: Flags [P.], cksum 0x2095 (correct), seq 4298:4453, ack 23634, win 3607, options [nop,nop,TS val 3210024233 ecr 572168732], length 155
15:18:01.653107 IP (tos 0x0, ttl 64, id 0, offset 0, flags [DF], proto TCP (6), length 52)
    172.25.64.219.63352 > 172.253.139.102.443: Flags [.], cksum 0x24df (correct), ack 4453, win 2710, options [nop,nop,TS val 572169092 ecr 3210024233], length 0
15:18:02.105697 IP (tos 0x0, ttl 118, id 28028, offset 0, flags [none], proto TCP (6), length 744)
    172.253.139.102.443 > 172.25.64.219.63352: Flags [P.], cksum 0x4acf (correct), seq 4453:5145, ack 23634, win 3607, options [nop,nop,TS val 3210024751 ecr 572169092], length 692
15:18:02.105821 IP (tos 0x0, ttl 64, id 0, offset 0, flags [DF], proto TCP (6), length 52)
    172.25.64.219.63352 > 172.253.139.102.443: Flags [.], cksum 0x1e6a (correct), ack 5145, win 2701, options [nop,nop,TS val 572169544 ecr 3210024751], length 0
15:18:02.158721 IP (tos 0x0, ttl 118, id 28029, offset 0, flags [none], proto TCP (6), length 361)
    172.253.139.102.443 > 172.25.64.219.63352: Flags [P.], cksum 0xb791 (correct), seq 5145:5454, ack 23634, win 3607, options [nop,nop,TS val 3210024804 ecr 572169544], length 309
15:18:02.158800 IP (tos 0x0, ttl 64, id 0, offset 0, flags [DF], proto TCP (6), length 52)
    172.25.64.219.63352 > 172.253.139.102.443: Flags [.], cksum 0x1cc5 (correct), ack 5454, win 2707, options [nop,nop,TS val 572169597 ecr 3210024804], length 0
15:18:02.183247 IP (tos 0x0, ttl 118, id 28030, offset 0, flags [none], proto TCP (6), length 229)
    172.253.139.102.443 > 172.25.64.219.63352: Flags [P.], cksum 0xfeb4 (correct), seq 5454:5631, ack 23634, win 3607, options [nop,nop,TS val 3210024829 ecr 572169597], length 177
15:18:02.183336 IP (tos 0x0, ttl 64, id 0, offset 0, flags [DF], proto TCP (6), length 52)
    172.25.64.219.63352 > 172.253.139.102.443: Flags [.], cksum 0x1be0 (correct), ack 5631, win 2709, options [nop,nop,TS val 572169622 ecr 3210024829], length 0
15:18:02.203262 IP (tos 0x0, ttl 118, id 28031, offset 0, flags [none], proto TCP (6), length 210)
    172.253.139.102.443 > 172.25.64.219.63352: Flags [P.], cksum 0x0afe (correct), seq 5631:5789, ack 23634, win 3607, options [nop,nop,TS val 3210024849 ecr 572169622], length 158
15:18:02.203373 IP (tos 0x0, ttl 64, id 0, offset 0, flags [DF], proto TCP (6), length 52)
    172.25.64.219.63352 > 172.253.139.102.443: Flags [.], cksum 0x1b19 (correct), ack 5789, win 2710, options [nop,nop,TS val 572169642 ecr 3210024849], length 0
15:18:02.272800 IP (tos 0x0, ttl 118, id 28032, offset 0, flags [none], proto TCP (6), length 259)
    172.253.139.102.443 > 172.25.64.219.63352: Flags [P.], cksum 0xf150 (correct), seq 5789:5996, ack 23634, win 3607, options [nop,nop,TS val 3210024918 ecr 572169642], length 207
15:18:02.272867 IP (tos 0x0, ttl 64, id 0, offset 0, flags [DF], proto TCP (6), length 52)
    172.25.64.219.63352 > 172.253.139.102.443: Flags [.], cksum 0x19c1 (correct), ack 5996, win 2709, options [nop,nop,TS val 572169711 ecr 3210024918], length 0
15:18:02.329502 IP (tos 0x0, ttl 118, id 28033, offset 0, flags [none], proto TCP (6), length 327)
    172.253.139.102.443 > 172.25.64.219.63352: Flags [P.], cksum 0x03e1 (correct), seq 5996:6271, ack 23634, win 3607, options [nop,nop,TS val 3210024974 ecr 572169711], length 275
15:18:02.329604 IP (tos 0x0, ttl 64, id 0, offset 0, flags [DF], proto TCP (6), length 52)
    172.25.64.219.63352 > 172.253.139.102.443: Flags [.], cksum 0x183e (correct), ack 6271, win 2708, options [nop,nop,TS val 572169768 ecr 3210024974], length 0
15:18:02.370367 IP (tos 0x0, ttl 118, id 28034, offset 0, flags [none], proto TCP (6), length 394)
    172.253.139.102.443 > 172.25.64.219.63352: Flags [P.], cksum 0x01d7 (correct), seq 6271:6613, ack 23634, win 3607, options [nop,nop,TS val 3210025016 ecr 572169768], length 342
15:18:02.370476 IP (tos 0x0, ttl 64, id 0, offset 0, flags [DF], proto TCP (6), length 52)
    172.25.64.219.63352 > 172.253.139.102.443: Flags [.], cksum 0x1696 (correct), ack 6613, win 2707, options [nop,nop,TS val 572169809 ecr 3210025016], length 0
15:18:02.411919 IP (tos 0x0, ttl 118, id 28035, offset 0, flags [none], proto TCP (6), length 259)
    172.253.139.102.443 > 172.25.64.219.63352: Flags [P.], cksum 0x747d (correct), seq 6613:6820, ack 23634, win 3607, options [nop,nop,TS val 3210025057 ecr 572169809], length 207
15:18:02.412033 IP (tos 0x0, ttl 64, id 0, offset 0, flags [DF], proto TCP (6), length 52)
    172.25.64.219.63352 > 172.253.139.102.443: Flags [.], cksum 0x1572 (correct), ack 6820, win 2709, options [nop,nop,TS val 572169851 ecr 3210025057], length 0
15:18:02.464516 IP (tos 0x0, ttl 118, id 28036, offset 0, flags [none], proto TCP (6), length 210)
    172.253.139.102.443 > 172.25.64.219.63352: Flags [P.], cksum 0x118c (correct), seq 6820:6978, ack 23634, win 3607, options [nop,nop,TS val 3210025110 ecr 572169851], length 158
15:18:02.464615 IP (tos 0x0, ttl 64, id 0, offset 0, flags [DF], proto TCP (6), length 52)
    172.25.64.219.63352 > 172.253.139.102.443: Flags [.], cksum 0x146a (correct), ack 6978, win 2710, options [nop,nop,TS val 572169903 ecr 3210025110], length 0
15:18:02.493053 IP (tos 0x0, ttl 118, id 28037, offset 0, flags [none], proto TCP (6), length 376)
    172.253.139.102.443 > 172.25.64.219.63352: Flags [P.], cksum 0x3eb5 (correct), seq 6978:7302, ack 23634, win 3607, options [nop,nop,TS val 3210025138 ecr 572169903], length 324
15:18:02.493203 IP (tos 0x0, ttl 64, id 0, offset 0, flags [DF], proto TCP (6), length 52)
    172.25.64.219.63352 > 172.253.139.102.443: Flags [.], cksum 0x12eb (correct), ack 7302, win 2712, options [nop,nop,TS val 572169932 ecr 3210025138], length 0
15:18:02.532791 IP (tos 0x0, ttl 118, id 28038, offset 0, flags [none], proto TCP (6), length 158)
    172.253.139.102.443 > 172.25.64.219.63352: Flags [P.], cksum 0x88e1 (correct), seq 7302:7408, ack 23634, win 3607, options [nop,nop,TS val 3210025178 ecr 572169932], length 106
15:18:02.533067 IP (tos 0x0, ttl 64, id 0, offset 0, flags [DF], proto TCP (6), length 52)
    172.25.64.219.63352 > 172.253.139.102.443: Flags [.], cksum 0x1232 (correct), ack 7408, win 2712, options [nop,nop,TS val 572169971 ecr 3210025178], length 0
15:18:02.620260 IP (tos 0x0, ttl 118, id 28039, offset 0, flags [none], proto TCP (6), length 415)
    172.253.139.102.443 > 172.25.64.219.63352: Flags [P.], cksum 0xe3f0 (correct), seq 7408:7771, ack 23634, win 3607, options [nop,nop,TS val 3210025266 ecr 572169971], length 363
15:18:02.620391 IP (tos 0x0, ttl 64, id 0, offset 0, flags [DF], proto TCP (6), length 52)
    172.25.64.219.63352 > 172.253.139.102.443: Flags [.], cksum 0x1017 (correct), ack 7771, win 2712, options [nop,nop,TS val 572170059 ecr 3210025266], length 0
15:18:02.655634 IP (tos 0x0, ttl 118, id 28040, offset 0, flags [none], proto TCP (6), length 319)
    172.253.139.102.443 > 172.25.64.219.63352: Flags [P.], cksum 0xc775 (correct), seq 7771:8038, ack 23634, win 3607, options [nop,nop,TS val 3210025301 ecr 572170059], length 267
15:18:02.655789 IP (tos 0x0, ttl 64, id 0, offset 0, flags [DF], proto TCP (6), length 52)
    172.25.64.219.63352 > 172.253.139.102.443: Flags [.], cksum 0x0ec6 (correct), ack 8038, win 2712, options [nop,nop,TS val 572170094 ecr 3210025301], length 0
15:18:02.684068 IP (tos 0x0, ttl 118, id 28041, offset 0, flags [none], proto TCP (6), length 293)
    172.253.139.102.443 > 172.25.64.219.63352: Flags [P.], cksum 0x4af0 (correct), seq 8038:8279, ack 23634, win 3607, options [nop,nop,TS val 3210025330 ecr 572170094], length 241
15:18:02.684192 IP (tos 0x0, ttl 64, id 0, offset 0, flags [DF], proto TCP (6), length 52)
    172.25.64.219.63352 > 172.253.139.102.443: Flags [.], cksum 0x0d9b (correct), ack 8279, win 2712, options [nop,nop,TS val 572170123 ecr 3210025330], length 0
15:18:02.724856 IP (tos 0x0, ttl 118, id 28042, offset 0, flags [none], proto TCP (6), length 270)
    172.253.139.102.443 > 172.25.64.219.63352: Flags [P.], cksum 0x5da8 (correct), seq 8279:8497, ack 23634, win 3607, options [nop,nop,TS val 3210025371 ecr 572170123], length 218
15:18:02.724992 IP (tos 0x0, ttl 64, id 0, offset 0, flags [DF], proto TCP (6), length 52)
    172.25.64.219.63352 > 172.253.139.102.443: Flags [.], cksum 0x0c6f (correct), ack 8497, win 2712, options [nop,nop,TS val 572170164 ecr 3210025371], length 0
15:18:02.785629 IP (tos 0x0, ttl 118, id 28043, offset 0, flags [none], proto TCP (6), length 205)
    172.253.139.102.443 > 172.25.64.219.63352: Flags [P.], cksum 0x7275 (correct), seq 8497:8650, ack 23634, win 3607, options [nop,nop,TS val 3210025431 ecr 572170164], length 153
15:18:02.785814 IP (tos 0x0, ttl 64, id 0, offset 0, flags [DF], proto TCP (6), length 52)
    172.25.64.219.63352 > 172.253.139.102.443: Flags [.], cksum 0x0b5e (correct), ack 8650, win 2712, options [nop,nop,TS val 572170224 ecr 3210025431], length 0
15:18:02.920366 IP (tos 0x0, ttl 118, id 28044, offset 0, flags [none], proto TCP (6), length 258)
    172.253.139.102.443 > 172.25.64.219.63352: Flags [P.], cksum 0x50a3 (correct), seq 8650:8856, ack 23634, win 3607, options [nop,nop,TS val 3210025566 ecr 572170224], length 206
15:18:02.920551 IP (tos 0x0, ttl 64, id 0, offset 0, flags [DF], proto TCP (6), length 52)
    172.25.64.219.63352 > 172.253.139.102.443: Flags [.], cksum 0x0982 (correct), ack 8856, win 2712, options [nop,nop,TS val 572170359 ecr 3210025566], length 0
15:18:03.085109 IP (tos 0x0, ttl 118, id 28045, offset 0, flags [none], proto TCP (6), length 292)
    172.253.139.102.443 > 172.25.64.219.63352: Flags [P.], cksum 0x1317 (correct), seq 8856:9096, ack 23634, win 3607, options [nop,nop,TS val 3210025730 ecr 572170359], length 240
15:18:03.085281 IP (tos 0x0, ttl 64, id 0, offset 0, flags [DF], proto TCP (6), length 52)
    172.25.64.219.63352 > 172.253.139.102.443: Flags [.], cksum 0x0749 (correct), ack 9096, win 2712, options [nop,nop,TS val 572170524 ecr 3210025730], length 0
15:18:03.222706 IP (tos 0x0, ttl 118, id 28046, offset 0, flags [none], proto TCP (6), length 404)
    172.253.139.102.443 > 172.25.64.219.63352: Flags [P.], cksum 0x83f6 (correct), seq 9096:9448, ack 23634, win 3607, options [nop,nop,TS val 3210025868 ecr 572170524], length 352
15:18:03.222907 IP (tos 0x0, ttl 64, id 0, offset 0, flags [DF], proto TCP (6), length 52)
    172.25.64.219.63352 > 172.253.139.102.443: Flags [.], cksum 0x04d6 (correct), ack 9448, win 2712, options [nop,nop,TS val 572170661 ecr 3210025868], length 0
15:18:03.364883 IP (tos 0x0, ttl 118, id 28047, offset 0, flags [none], proto TCP (6), length 583)
    172.253.139.102.443 > 172.25.64.219.63352: Flags [P.], cksum 0x126c (correct), seq 9448:9979, ack 23634, win 3607, options [nop,nop,TS val 3210026010 ecr 572170661], length 531
15:18:03.365079 IP (tos 0x0, ttl 64, id 0, offset 0, flags [DF], proto TCP (6), length 52)
    172.25.64.219.63352 > 172.253.139.102.443: Flags [.], cksum 0x01a6 (correct), ack 9979, win 2712, options [nop,nop,TS val 572170804 ecr 3210026010], length 0
15:18:03.552026 IP (tos 0x0, ttl 118, id 28048, offset 0, flags [none], proto TCP (6), length 482)
    172.253.139.102.443 > 172.25.64.219.63352: Flags [P.], cksum 0x8375 (correct), seq 9979:10409, ack 23634, win 3607, options [nop,nop,TS val 3210026197 ecr 572170804], length 430
15:18:03.552140 IP (tos 0x0, ttl 64, id 0, offset 0, flags [DF], proto TCP (6), length 52)
    172.25.64.219.63352 > 172.253.139.102.443: Flags [.], cksum 0xfe81 (correct), ack 10409, win 2712, options [nop,nop,TS val 572170991 ecr 3210026197], length 0
15:18:03.713591 IP (tos 0x0, ttl 118, id 28049, offset 0, flags [none], proto TCP (6), length 342)
    172.253.139.102.443 > 172.25.64.219.63352: Flags [P.], cksum 0xf1f4 (correct), seq 10409:10699, ack 23634, win 3607, options [nop,nop,TS val 3210026359 ecr 572170991], length 290
15:18:03.713800 IP (tos 0x0, ttl 64, id 0, offset 0, flags [DF], proto TCP (6), length 52)
    172.25.64.219.63352 > 172.253.139.102.443: Flags [.], cksum 0xfc1c (correct), ack 10699, win 2712, options [nop,nop,TS val 572171152 ecr 3210026359], length 0
15:18:03.854925 IP (tos 0x0, ttl 118, id 28050, offset 0, flags [none], proto TCP (6), length 353)
    172.253.139.102.443 > 172.25.64.219.63352: Flags [P.], cksum 0x7d17 (correct), seq 10699:11000, ack 23634, win 3607, options [nop,nop,TS val 3210026500 ecr 572171152], length 301
15:18:03.855123 IP (tos 0x0, ttl 64, id 0, offset 0, flags [DF], proto TCP (6), length 52)
    172.25.64.219.63352 > 172.253.139.102.443: Flags [.], cksum 0xf9d4 (correct), ack 11000, win 2712, options [nop,nop,TS val 572171294 ecr 3210026500], length 0
15:18:03.989955 IP (tos 0x0, ttl 118, id 28051, offset 0, flags [none], proto TCP (6), length 554)
    172.253.139.102.443 > 172.25.64.219.63352: Flags [P.], cksum 0xd96a (correct), seq 11000:11502, ack 23634, win 3607, options [nop,nop,TS val 3210026635 ecr 572171294], length 502
15:18:03.990153 IP (tos 0x0, ttl 64, id 0, offset 0, flags [DF], proto TCP (6), length 52)
    172.25.64.219.63352 > 172.253.139.102.443: Flags [.], cksum 0xf6d0 (correct), ack 11502, win 2712, options [nop,nop,TS val 572171429 ecr 3210026635], length 0
15:18:04.125822 IP (tos 0x0, ttl 118, id 28052, offset 0, flags [none], proto TCP (6), length 411)
    172.253.139.102.443 > 172.25.64.219.63352: Flags [P.], cksum 0xd0bc (correct), seq 11502:11861, ack 23634, win 3607, options [nop,nop,TS val 3210026771 ecr 572171429], length 359
15:18:04.126035 IP (tos 0x0, ttl 64, id 0, offset 0, flags [DF], proto TCP (6), length 52)
    172.25.64.219.63352 > 172.253.139.102.443: Flags [.], cksum 0xf45a (correct), ack 11861, win 2712, options [nop,nop,TS val 572171564 ecr 3210026771], length 0
15:18:04.253568 IP (tos 0x0, ttl 118, id 28053, offset 0, flags [none], proto TCP (6), length 419)
    172.253.139.102.443 > 172.25.64.219.63352: Flags [P.], cksum 0x957f (correct), seq 11861:12228, ack 23634, win 3607, options [nop,nop,TS val 3210026899 ecr 572171564], length 367
15:18:04.253770 IP (tos 0x0, ttl 64, id 0, offset 0, flags [DF], proto TCP (6), length 52)
    172.25.64.219.63352 > 172.253.139.102.443: Flags [.], cksum 0xf1eb (correct), ack 12228, win 2712, options [nop,nop,TS val 572171692 ecr 3210026899], length 0
15:18:04.398218 IP (tos 0x0, ttl 118, id 28054, offset 0, flags [none], proto TCP (6), length 422)
    172.253.139.102.443 > 172.25.64.219.63352: Flags [P.], cksum 0xcd88 (correct), seq 12228:12598, ack 23634, win 3607, options [nop,nop,TS val 3210027043 ecr 572171692], length 370
15:18:04.398429 IP (tos 0x0, ttl 64, id 0, offset 0, flags [DF], proto TCP (6), length 52)
    172.25.64.219.63352 > 172.253.139.102.443: Flags [.], cksum 0xef58 (correct), ack 12598, win 2712, options [nop,nop,TS val 572171837 ecr 3210027043], length 0
15:18:04.586340 IP (tos 0x0, ttl 118, id 28055, offset 0, flags [none], proto TCP (6), length 474)
    172.253.139.102.443 > 172.25.64.219.63352: Flags [P.], cksum 0x4b67 (correct), seq 12598:13020, ack 23634, win 3607, options [nop,nop,TS val 3210027232 ecr 572171837], length 422
15:18:04.586514 IP (tos 0x0, ttl 64, id 0, offset 0, flags [DF], proto TCP (6), length 52)
    172.25.64.219.63352 > 172.253.139.102.443: Flags [.], cksum 0xec39 (correct), ack 13020, win 2712, options [nop,nop,TS val 572172025 ecr 3210027232], length 0
15:18:04.699294 IP (tos 0x0, ttl 118, id 28056, offset 0, flags [none], proto TCP (6), length 379)
    172.253.139.102.443 > 172.25.64.219.63352: Flags [P.], cksum 0x8787 (correct), seq 13020:13347, ack 23634, win 3607, options [nop,nop,TS val 3210027345 ecr 572172025], length 327
15:18:04.699510 IP (tos 0x0, ttl 64, id 0, offset 0, flags [DF], proto TCP (6), length 52)
    172.25.64.219.63352 > 172.253.139.102.443: Flags [.], cksum 0xea10 (correct), ack 13347, win 2712, options [nop,nop,TS val 572172138 ecr 3210027345], length 0
15:18:05.031523 IP (tos 0x0, ttl 118, id 28057, offset 0, flags [none], proto TCP (6), length 489)
    172.253.139.102.443 > 172.25.64.219.63352: Flags [P.], cksum 0x0aa0 (correct), seq 13347:13784, ack 23634, win 3607, options [nop,nop,TS val 3210027619 ecr 572172138], length 437
15:18:05.031738 IP (tos 0x0, ttl 64, id 0, offset 0, flags [DF], proto TCP (6), length 52)
    172.25.64.219.63352 > 172.253.139.102.443: Flags [.], cksum 0xe5fd (correct), ack 13784, win 2712, options [nop,nop,TS val 572172470 ecr 3210027619], length 0
15:18:05.049375 IP (tos 0x0, ttl 118, id 28058, offset 0, flags [none], proto TCP (6), length 509)
    172.253.139.102.443 > 172.25.64.219.63352: Flags [P.], cksum 0x35c8 (correct), seq 13784:14241, ack 23634, win 3607, options [nop,nop,TS val 3210027695 ecr 572172470], length 457
15:18:05.049550 IP (tos 0x0, ttl 64, id 0, offset 0, flags [DF], proto TCP (6), length 52)
    172.25.64.219.63352 > 172.253.139.102.443: Flags [.], cksum 0xe3d6 (correct), ack 14241, win 2712, options [nop,nop,TS val 572172488 ecr 3210027695], length 0
15:18:05.206283 IP (tos 0x0, ttl 118, id 28059, offset 0, flags [none], proto TCP (6), length 590)
    172.253.139.102.443 > 172.25.64.219.63352: Flags [P.], cksum 0xc2e3 (correct), seq 14241:14779, ack 23634, win 3607, options [nop,nop,TS val 3210027852 ecr 572172488], length 538
15:18:05.206504 IP (tos 0x0, ttl 64, id 0, offset 0, flags [DF], proto TCP (6), length 52)
    172.25.64.219.63352 > 172.253.139.102.443: Flags [.], cksum 0xe082 (correct), ack 14779, win 2712, options [nop,nop,TS val 572172645 ecr 3210027852], length 0
15:18:05.319609 IP (tos 0x0, ttl 118, id 28060, offset 0, flags [none], proto TCP (6), length 557)
    172.253.139.102.443 > 172.25.64.219.63352: Flags [P.], cksum 0x613f (correct), seq 14779:15284, ack 23634, win 3607, options [nop,nop,TS val 3210027965 ecr 572172645], length 505
15:18:05.319826 IP (tos 0x0, ttl 64, id 0, offset 0, flags [DF], proto TCP (6), length 52)
    172.25.64.219.63352 > 172.253.139.102.443: Flags [.], cksum 0xdda7 (correct), ack 15284, win 2712, options [nop,nop,TS val 572172758 ecr 3210027965], length 0
15:18:05.425247 IP (tos 0x0, ttl 118, id 28061, offset 0, flags [none], proto TCP (6), length 608)
    172.253.139.102.443 > 172.25.64.219.63352: Flags [P.], cksum 0x87f3 (correct), seq 15284:15840, ack 23634, win 3607, options [nop,nop,TS val 3210028070 ecr 572172758], length 556
15:18:05.425446 IP (tos 0x0, ttl 64, id 0, offset 0, flags [DF], proto TCP (6), length 52)
    172.25.64.219.63352 > 172.253.139.102.443: Flags [.], cksum 0xdaa8 (correct), ack 15840, win 2712, options [nop,nop,TS val 572172864 ecr 3210028070], length 0
15:18:05.537519 IP (tos 0x0, ttl 118, id 28062, offset 0, flags [none], proto TCP (6), length 614)
    172.253.139.102.443 > 172.25.64.219.63352: Flags [P.], cksum 0xfd91 (correct), seq 15840:16402, ack 23634, win 3607, options [nop,nop,TS val 3210028183 ecr 572172864], length 562
15:18:05.537635 IP (tos 0x0, ttl 64, id 0, offset 0, flags [DF], proto TCP (6), length 52)
    172.25.64.219.63352 > 172.253.139.102.443: Flags [.], cksum 0xd795 (correct), ack 16402, win 2712, options [nop,nop,TS val 572172976 ecr 3210028183], length 0
15:18:05.671915 IP (tos 0x0, ttl 118, id 28063, offset 0, flags [none], proto TCP (6), length 550)
    172.253.139.102.443 > 172.25.64.219.63352: Flags [P.], cksum 0x9176 (correct), seq 16402:16900, ack 23634, win 3607, options [nop,nop,TS val 3210028317 ecr 572172976], length 498
15:18:05.672115 IP (tos 0x0, ttl 64, id 0, offset 0, flags [DF], proto TCP (6), length 52)
    172.25.64.219.63352 > 172.253.139.102.443: Flags [.], cksum 0xd496 (correct), ack 16900, win 2712, options [nop,nop,TS val 572173111 ecr 3210028317], length 0
