tcpdump: data link type PKTAP
tcpdump: WARNING: snaplen raised from 96 to 524288
tcpdump: listening on pktap, link-type PKTAP (Apple DLT_PKTAP), snapshot length 524288 bytes
19:47:11.909990 IP6 (flowlabel 0xf0400, hlim 64, next-header UDP (17) payload length: 1238) 2601:5cf:407e:8160:3d22:aa06:6a3c:6a63.54963 > 2607:6bc0::10.443: [udp sum ok] quic, protected
19:47:11.910041 IP6 (flowlabel 0xf0400, hlim 64, next-header UDP (17) payload length: 1033) 2601:5cf:407e:8160:3d22:aa06:6a3c:6a63.54963 > 2607:6bc0::10.443: [udp sum ok] quic, protected
19:47:11.926647 IP6 (flowlabel 0xf0400, hlim 64, next-header UDP (17) payload length: 1238) 2601:5cf:407e:8160:3d22:aa06:6a3c:6a63.54963 > 2607:6bc0::10.443: [udp sum ok] quic, protected
19:47:11.926666 IP6 (flowlabel 0xf0400, hlim 64, next-header UDP (17) payload length: 1231) 2601:5cf:407e:8160:3d22:aa06:6a3c:6a63.54963 > 2607:6bc0::10.443: [udp sum ok] quic, protected
19:47:11.926674 IP6 (flowlabel 0xf0400, hlim 64, next-header UDP (17) payload length: 143) 2601:5cf:407e:8160:3d22:aa06:6a3c:6a63.54963 > 2607:6bc0::10.443: [udp sum ok] quic, protected
19:47:11.940321 IP6 (flowlabel 0xec0a0, hlim 55, next-header UDP (17) payload length: 33) 2607:6bc0::10.443 > 2601:5cf:407e:8160:3d22:aa06:6a3c:6a63.54963: [udp sum ok] quic, protected
19:47:11.957111 IP6 (flowlabel 0xec0a0, hlim 55, next-header UDP (17) payload length: 32) 2607:6bc0::10.443 > 2601:5cf:407e:8160:3d22:aa06:6a3c:6a63.54963: [udp sum ok] quic, protected
19:47:11.981387 IP6 (flowlabel 0xf0400, hlim 64, next-header UDP (17) payload length: 1238) 2601:5cf:407e:8160:3d22:aa06:6a3c:6a63.54963 > 2607:6bc0::10.443: [udp sum ok] quic, protected
19:47:11.981404 IP6 (flowlabel 0xf0400, hlim 64, next-header UDP (17) payload length: 809) 2601:5cf:407e:8160:3d22:aa06:6a3c:6a63.54963 > 2607:6bc0::10.443: [udp sum ok] quic, protected
19:47:11.996501 IP6 (flowlabel 0xb0c00, hlim 64, next-header UDP (17) payload length: 1232) 2601:5cf:407e:8160:3d22:aa06:6a3c:6a63.53656 > 2607:6bc0::10.443: [udp sum ok] quic, protected
19:47:11.996533 IP6 (flowlabel 0xb0c00, hlim 64, next-header UDP (17) payload length: 1238) 2601:5cf:407e:8160:3d22:aa06:6a3c:6a63.53656 > 2607:6bc0::10.443: [udp sum ok] quic, protected
19:47:11.996544 IP6 (flowlabel 0xb0c00, hlim 64, next-header UDP (17) payload length: 285) 2601:5cf:407e:8160:3d22:aa06:6a3c:6a63.53656 > 2607:6bc0::10.443: [udp sum ok] quic, protected
19:47:12.011268 IP6 (flowlabel 0xec0a0, hlim 55, next-header UDP (17) payload length: 33) 2607:6bc0::10.443 > 2601:5cf:407e:8160:3d22:aa06:6a3c:6a63.54963: [udp sum ok] quic, protected
19:47:12.028876 IP6 (flowlabel 0x57747, hlim 55, next-header UDP (17) payload length: 31) 2607:6bc0::10.443 > 2601:5cf:407e:8160:3d22:aa06:6a3c:6a63.53656: [udp sum ok] quic, protected
19:47:12.094331 IP6 (flowlabel 0xec0a0, hlim 55, next-header UDP (17) payload length: 513) 2607:6bc0::10.443 > 2601:5cf:407e:8160:3d22:aa06:6a3c:6a63.54963: [udp sum ok] quic, protected
19:47:12.101431 IP6 (flowlabel 0xf0400, hlim 64, next-header UDP (17) payload length: 53) 2601:5cf:407e:8160:3d22:aa06:6a3c:6a63.54963 > 2607:6bc0::10.443: [udp sum ok] quic, protected
19:47:12.153318 IP6 (flowlabel 0x57747, hlim 55, next-header UDP (17) payload length: 434) 2607:6bc0::10.443 > 2601:5cf:407e:8160:3d22:aa06:6a3c:6a63.53656: [udp sum ok] quic, protected
19:47:12.182844 IP6 (flowlabel 0xb0c00, hlim 64, next-header UDP (17) payload length: 52) 2601:5cf:407e:8160:3d22:aa06:6a3c:6a63.53656 > 2607:6bc0::10.443: [udp sum ok] quic, protected
19:47:12.213215 IP6 (flowlabel 0xec0a0, hlim 55, next-header UDP (17) payload length: 551) 2607:6bc0::10.443 > 2601:5cf:407e:8160:3d22:aa06:6a3c:6a63.54963: [udp sum ok] quic, protected
19:47:12.213218 IP6 (flowlabel 0xec0a0, hlim 55, next-header UDP (17) payload length: 35) 2607:6bc0::10.443 > 2601:5cf:407e:8160:3d22:aa06:6a3c:6a63.54963: [udp sum ok] quic, protected
19:47:12.221184 IP6 (flowlabel 0xf0400, hlim 64, next-header UDP (17) payload length: 53) 2601:5cf:407e:8160:3d22:aa06:6a3c:6a63.54963 > 2607:6bc0::10.443: [udp sum ok] quic, protected
19:47:15.906841 IP6 (flowlabel 0xc0100, hlim 64, next-header TCP (6) payload length: 20) 2601:5cf:407e:8160:3d22:aa06:6a3c:6a63.50900 > 2607:6bc0::10.443: Flags [.], cksum 0x5268 (correct), ack 1352929625, win 2048, length 0
19:47:15.935338 IP6 (flowlabel 0x4deff, hlim 55, next-header TCP (6) payload length: 32) 2607:6bc0::10.443 > 2601:5cf:407e:8160:3d22:aa06:6a3c:6a63.50900: Flags [.], cksum 0x9edd (correct), ack 1, win 16, options [nop,nop,TS val 237029399 ecr 877754329], length 0
19:47:16.037278 IP6 (flowlabel 0x30c00, hlim 64, next-header TCP (6) payload length: 20) 2601:5cf:407e:8160:3d22:aa06:6a3c:6a63.50902 > 2607:6bc0::10.443: Flags [.], cksum 0x1de6 (correct), ack 2948770491, win 2048, length 0
19:47:16.065996 IP6 (flowlabel 0xe1f4d, hlim 55, next-header TCP (6) payload length: 32) 2607:6bc0::10.443 > 2601:5cf:407e:8160:3d22:aa06:6a3c:6a63.50902: Flags [.], cksum 0xe516 (correct), ack 1, win 16, options [nop,nop,TS val 1479427489 ecr 1993536260], length 0
19:47:16.138561 IP6 (flowlabel 0x80100, hlim 64, next-header TCP (6) payload length: 20) 2601:5cf:407e:8160:3d22:aa06:6a3c:6a63.50905 > 2607:6bc0::10.443: Flags [.], cksum 0xfc60 (correct), ack 2758969433, win 2048, length 0
19:47:16.138581 IP6 (flowlabel 0xa0a00, hlim 64, next-header TCP (6) payload length: 20) 2601:5cf:407e:8160:3d22:aa06:6a3c:6a63.50904 > 2607:6bc0::10.443: Flags [.], cksum 0xf408 (correct), ack 3962009395, win 2048, length 0
19:47:16.138593 IP6 (flowlabel 0x10400, hlim 64, next-header TCP (6) payload length: 20) 2601:5cf:407e:8160:3d22:aa06:6a3c:6a63.50903 > 2607:6bc0::10.443: Flags [.], cksum 0x7a89 (correct), ack 1968771560, win 2048, length 0
19:47:16.164592 IP6 (flowlabel 0x8b03f, hlim 55, next-header TCP (6) payload length: 32) 2607:6bc0::10.443 > 2601:5cf:407e:8160:3d22:aa06:6a3c:6a63.50903: Flags [.], cksum 0x46cb (correct), ack 1, win 16, options [nop,nop,TS val 1295087035 ecr 4091694022], length 0
19:47:16.166556 IP6 (flowlabel 0xab71b, hlim 55, next-header TCP (6) payload length: 32) 2607:6bc0::10.443 > 2601:5cf:407e:8160:3d22:aa06:6a3c:6a63.50905: Flags [.], cksum 0x60d4 (correct), ack 1, win 16, options [nop,nop,TS val 3094405563 ecr 1081708478], length 0
19:47:16.166573 IP6 (flowlabel 0xa3280, hlim 55, next-header TCP (6) payload length: 32) 2607:6bc0::10.443 > 2601:5cf:407e:8160:3d22:aa06:6a3c:6a63.50904: Flags [.], cksum 0x74fa (correct), ack 1, win 17, options [nop,nop,TS val 2787634714 ecr 3959934362], length 0
19:47:17.417475 IP6 (flowlabel 0xec0a0, hlim 55, next-header UDP (17) payload length: 692) 2607:6bc0::10.443 > 2601:5cf:407e:8160:3d22:aa06:6a3c:6a63.54963: [udp sum ok] quic, protected
19:47:17.425032 IP6 (flowlabel 0xf0400, hlim 64, next-header UDP (17) payload length: 53) 2601:5cf:407e:8160:3d22:aa06:6a3c:6a63.54963 > 2607:6bc0::10.443: [udp sum ok] quic, protected
19:47:17.464462 IP6 (flowlabel 0xf0400, hlim 64, next-header UDP (17) payload length: 1238) 2601:5cf:407e:8160:3d22:aa06:6a3c:6a63.54963 > 2607:6bc0::10.443: [udp sum ok] quic, protected
19:47:17.464488 IP6 (flowlabel 0xf0400, hlim 64, next-header UDP (17) payload length: 798) 2601:5cf:407e:8160:3d22:aa06:6a3c:6a63.54963 > 2607:6bc0::10.443: [udp sum ok] quic, protected
19:47:17.491839 IP6 (flowlabel 0xec0a0, hlim 55, next-header UDP (17) payload length: 33) 2607:6bc0::10.443 > 2601:5cf:407e:8160:3d22:aa06:6a3c:6a63.54963: [udp sum ok] quic, protected
19:47:17.541824 IP6 (flowlabel 0xec0a0, hlim 55, next-header UDP (17) payload length: 65) 2607:6bc0::10.443 > 2601:5cf:407e:8160:3d22:aa06:6a3c:6a63.54963: [udp sum ok] quic, protected
19:47:17.549516 IP6 (flowlabel 0xf0400, hlim 64, next-header UDP (17) payload length: 53) 2601:5cf:407e:8160:3d22:aa06:6a3c:6a63.54963 > 2607:6bc0::10.443: [udp sum ok] quic, protected
19:47:17.689445 IP6 (flowlabel 0xec0a0, hlim 55, next-header UDP (17) payload length: 80) 2607:6bc0::10.443 > 2601:5cf:407e:8160:3d22:aa06:6a3c:6a63.54963: [udp sum ok] quic, protected
19:47:17.693981 IP6 (flowlabel 0xec0a0, hlim 55, next-header UDP (17) payload length: 459) 2607:6bc0::10.443 > 2601:5cf:407e:8160:3d22:aa06:6a3c:6a63.54963: [udp sum ok] quic, protected
19:47:17.693984 IP6 (flowlabel 0xec0a0, hlim 55, next-header UDP (17) payload length: 597) 2607:6bc0::10.443 > 2601:5cf:407e:8160:3d22:aa06:6a3c:6a63.54963: [udp sum ok] quic, protected
19:47:17.694888 IP6 (flowlabel 0xec0a0, hlim 55, next-header UDP (17) payload length: 35) 2607:6bc0::10.443 > 2601:5cf:407e:8160:3d22:aa06:6a3c:6a63.54963: [udp sum ok] quic, protected
19:47:17.696857 IP6 (flowlabel 0xf0400, hlim 64, next-header UDP (17) payload length: 53) 2601:5cf:407e:8160:3d22:aa06:6a3c:6a63.54963 > 2607:6bc0::10.443: [udp sum ok] quic, protected
19:47:17.860277 IP6 (flowlabel 0xec0a0, hlim 55, next-header UDP (17) payload length: 295) 2607:6bc0::10.443 > 2601:5cf:407e:8160:3d22:aa06:6a3c:6a63.54963: [udp sum ok] quic, protected
19:47:17.860929 IP6 (flowlabel 0xec0a0, hlim 55, next-header UDP (17) payload length: 80) 2607:6bc0::10.443 > 2601:5cf:407e:8160:3d22:aa06:6a3c:6a63.54963: [udp sum ok] quic, protected
19:47:17.868189 IP6 (flowlabel 0xf0400, hlim 64, next-header UDP (17) payload length: 53) 2601:5cf:407e:8160:3d22:aa06:6a3c:6a63.54963 > 2607:6bc0::10.443: [udp sum ok] quic, protected
19:47:17.971061 IP6 (flowlabel 0xec0a0, hlim 55, next-header UDP (17) payload length: 111) 2607:6bc0::10.443 > 2601:5cf:407e:8160:3d22:aa06:6a3c:6a63.54963: [udp sum ok] quic, protected
19:47:17.979239 IP6 (flowlabel 0xf0400, hlim 64, next-header UDP (17) payload length: 53) 2601:5cf:407e:8160:3d22:aa06:6a3c:6a63.54963 > 2607:6bc0::10.443: [udp sum ok] quic, protected
19:47:18.141980 IP6 (flowlabel 0xec0a0, hlim 55, next-header UDP (17) payload length: 76) 2607:6bc0::10.443 > 2601:5cf:407e:8160:3d22:aa06:6a3c:6a63.54963: [udp sum ok] quic, protected
19:47:18.149463 IP6 (flowlabel 0xf0400, hlim 64, next-header UDP (17) payload length: 53) 2601:5cf:407e:8160:3d22:aa06:6a3c:6a63.54963 > 2607:6bc0::10.443: [udp sum ok] quic, protected
19:47:18.213694 IP6 (flowlabel 0xec0a0, hlim 55, next-header UDP (17) payload length: 73) 2607:6bc0::10.443 > 2601:5cf:407e:8160:3d22:aa06:6a3c:6a63.54963: [udp sum ok] quic, protected
19:47:18.221869 IP6 (flowlabel 0xf0400, hlim 64, next-header UDP (17) payload length: 53) 2601:5cf:407e:8160:3d22:aa06:6a3c:6a63.54963 > 2607:6bc0::10.443: [udp sum ok] quic, protected
19:47:18.254169 IP6 (flowlabel 0xec0a0, hlim 55, next-header UDP (17) payload length: 49) 2607:6bc0::10.443 > 2601:5cf:407e:8160:3d22:aa06:6a3c:6a63.54963: [udp sum ok] quic, protected
19:47:18.254834 IP6 (flowlabel 0xec0a0, hlim 55, next-header UDP (17) payload length: 52) 2607:6bc0::10.443 > 2601:5cf:407e:8160:3d22:aa06:6a3c:6a63.54963: [udp sum ok] quic, protected
19:47:18.262271 IP6 (flowlabel 0xf0400, hlim 64, next-header UDP (17) payload length: 53) 2601:5cf:407e:8160:3d22:aa06:6a3c:6a63.54963 > 2607:6bc0::10.443: [udp sum ok] quic, protected
19:47:18.374104 IP6 (flowlabel 0xec0a0, hlim 55, next-header UDP (17) payload length: 65) 2607:6bc0::10.443 > 2601:5cf:407e:8160:3d22:aa06:6a3c:6a63.54963: [udp sum ok] quic, protected
19:47:18.382321 IP6 (flowlabel 0xf0400, hlim 64, next-header UDP (17) payload length: 53) 2601:5cf:407e:8160:3d22:aa06:6a3c:6a63.54963 > 2607:6bc0::10.443: [udp sum ok] quic, protected
19:47:18.542528 IP6 (flowlabel 0xec0a0, hlim 55, next-header UDP (17) payload length: 65) 2607:6bc0::10.443 > 2601:5cf:407e:8160:3d22:aa06:6a3c:6a63.54963: [udp sum ok] quic, protected
19:47:18.549547 IP6 (flowlabel 0xf0400, hlim 64, next-header UDP (17) payload length: 53) 2601:5cf:407e:8160:3d22:aa06:6a3c:6a63.54963 > 2607:6bc0::10.443: [udp sum ok] quic, protected
19:47:18.608397 IP6 (flowlabel 0xec0a0, hlim 55, next-header UDP (17) payload length: 58) 2607:6bc0::10.443 > 2601:5cf:407e:8160:3d22:aa06:6a3c:6a63.54963: [udp sum ok] quic, protected
19:47:18.616239 IP6 (flowlabel 0xf0400, hlim 64, next-header UDP (17) payload length: 53) 2601:5cf:407e:8160:3d22:aa06:6a3c:6a63.54963 > 2607:6bc0::10.443: [udp sum ok] quic, protected
19:47:18.664305 IP6 (flowlabel 0xec0a0, hlim 55, next-header UDP (17) payload length: 50) 2607:6bc0::10.443 > 2601:5cf:407e:8160:3d22:aa06:6a3c:6a63.54963: [udp sum ok] quic, protected
19:47:18.664690 IP6 (flowlabel 0xec0a0, hlim 55, next-header UDP (17) payload length: 55) 2607:6bc0::10.443 > 2601:5cf:407e:8160:3d22:aa06:6a3c:6a63.54963: [udp sum ok] quic, protected
19:47:18.672356 IP6 (flowlabel 0xf0400, hlim 64, next-header UDP (17) payload length: 53) 2601:5cf:407e:8160:3d22:aa06:6a3c:6a63.54963 > 2607:6bc0::10.443: [udp sum ok] quic, protected
19:47:18.690122 IP6 (flowlabel 0xf0400, hlim 64, next-header UDP (17) payload length: 1238) 2601:5cf:407e:8160:3d22:aa06:6a3c:6a63.54963 > 2607:6bc0::10.443: [udp sum ok] quic, protected
19:47:18.690144 IP6 (flowlabel 0xf0400, hlim 64, next-header UDP (17) payload length: 833) 2601:5cf:407e:8160:3d22:aa06:6a3c:6a63.54963 > 2607:6bc0::10.443: [udp sum ok] quic, protected
19:47:18.690283 IP6 (flowlabel 0xf0400, hlim 64, next-header UDP (17) payload length: 1238) 2601:5cf:407e:8160:3d22:aa06:6a3c:6a63.54963 > 2607:6bc0::10.443: [udp sum ok] quic, protected
19:47:18.690293 IP6 (flowlabel 0xf0400, hlim 64, next-header UDP (17) payload length: 818) 2601:5cf:407e:8160:3d22:aa06:6a3c:6a63.54963 > 2607:6bc0::10.443: [udp sum ok] quic, protected
19:47:18.704041 IP6 (flowlabel 0xf0400, hlim 64, next-header UDP (17) payload length: 1238) 2601:5cf:407e:8160:3d22:aa06:6a3c:6a63.54963 > 2607:6bc0::10.443: [udp sum ok] quic, protected
19:47:18.704059 IP6 (flowlabel 0xf0400, hlim 64, next-header UDP (17) payload length: 846) 2601:5cf:407e:8160:3d22:aa06:6a3c:6a63.54963 > 2607:6bc0::10.443: [udp sum ok] quic, protected
19:47:18.716472 IP6 (flowlabel 0xec0a0, hlim 55, next-header UDP (17) payload length: 33) 2607:6bc0::10.443 > 2601:5cf:407e:8160:3d22:aa06:6a3c:6a63.54963: [udp sum ok] quic, protected
19:47:18.716997 IP6 (flowlabel 0xec0a0, hlim 55, next-header UDP (17) payload length: 89) 2607:6bc0::10.443 > 2601:5cf:407e:8160:3d22:aa06:6a3c:6a63.54963: [udp sum ok] quic, protected
19:47:18.723459 IP6 (flowlabel 0xf0400, hlim 64, next-header UDP (17) payload length: 53) 2601:5cf:407e:8160:3d22:aa06:6a3c:6a63.54963 > 2607:6bc0::10.443: [udp sum ok] quic, protected
19:47:18.725352 IP6 (flowlabel 0xec0a0, hlim 55, next-header UDP (17) payload length: 33) 2607:6bc0::10.443 > 2601:5cf:407e:8160:3d22:aa06:6a3c:6a63.54963: [udp sum ok] quic, protected
19:47:18.734119 IP6 (flowlabel 0xec0a0, hlim 55, next-header UDP (17) payload length: 33) 2607:6bc0::10.443 > 2601:5cf:407e:8160:3d22:aa06:6a3c:6a63.54963: [udp sum ok] quic, protected
19:47:18.768857 IP6 (flowlabel 0x10000, hlim 64, next-header TCP (6) payload length: 44) 2601:5cf:407e:8160:3d22:aa06:6a3c:6a63.50914 > 2607:6bc0::10.443: Flags [S], cksum 0xa466 (correct), seq 3101304650, win 65535, options [mss 1440,nop,wscale 6,nop,nop,TS val 1534219046 ecr 0,sackOK,eol], length 0
19:47:18.812533 IP6 (flowlabel 0x6ea5d, hlim 55, next-header TCP (6) payload length: 40) 2607:6bc0::10.443 > 2601:5cf:407e:8160:3d22:aa06:6a3c:6a63.50914: Flags [S.], cksum 0xdbf3 (correct), seq 808139423, ack 3101304651, win 65535, options [mss 1360,sackOK,TS val 3619919649 ecr 1534219046,nop,wscale 13], length 0
19:47:18.812630 IP6 (flowlabel 0x10000, hlim 64, next-header TCP (6) payload length: 32) 2601:5cf:407e:8160:3d22:aa06:6a3c:6a63.50914 > 2607:6bc0::10.443: Flags [.], cksum 0x0225 (correct), ack 1, win 2065, options [nop,nop,TS val 1534219090 ecr 3619919649], length 0
19:47:18.812744 IP6 (flowlabel 0x10000, hlim 64, next-header TCP (6) payload length: 1380) 2601:5cf:407e:8160:3d22:aa06:6a3c:6a63.50914 > 2607:6bc0::10.443: Flags [.], cksum 0x267c (correct), seq 1:1349, ack 1, win 2065, options [nop,nop,TS val 1534219090 ecr 3619919649], length 1348
19:47:18.812754 IP6 (flowlabel 0x10000, hlim 64, next-header TCP (6) payload length: 451) 2601:5cf:407e:8160:3d22:aa06:6a3c:6a63.50914 > 2607:6bc0::10.443: Flags [P.], cksum 0x3a45 (correct), seq 1349:1768, ack 1, win 2065, options [nop,nop,TS val 1534219090 ecr 3619919649], length 419
19:47:18.846841 IP6 (flowlabel 0x6ea5d, hlim 55, next-header TCP (6) payload length: 32) 2607:6bc0::10.443 > 2601:5cf:407e:8160:3d22:aa06:6a3c:6a63.50914: Flags [.], cksum 0x04bd (correct), ack 1349, win 16, options [nop,nop,TS val 3619919686 ecr 1534219090], length 0
19:47:18.846841 IP6 (flowlabel 0x6ea5d, hlim 55, next-header TCP (6) payload length: 32) 2607:6bc0::10.443 > 2601:5cf:407e:8160:3d22:aa06:6a3c:6a63.50914: Flags [.], cksum 0x031a (correct), ack 1768, win 16, options [nop,nop,TS val 3619919686 ecr 1534219090], length 0
19:47:18.846861 IP6 (flowlabel 0xec0a0, hlim 55, next-header UDP (17) payload length: 79) 2607:6bc0::10.443 > 2601:5cf:407e:8160:3d22:aa06:6a3c:6a63.54963: [udp sum ok] quic, protected
19:47:18.848420 IP6 (flowlabel 0xec0a0, hlim 55, next-header UDP (17) payload length: 60) 2607:6bc0::10.443 > 2601:5cf:407e:8160:3d22:aa06:6a3c:6a63.54963: [udp sum ok] quic, protected
19:47:18.852237 IP6 (flowlabel 0x40400, hlim 64, next-header TCP (6) payload length: 44) 2601:5cf:407e:8160:3d22:aa06:6a3c:6a63.50915 > 2607:6bc0::10.443: Flags [S], cksum 0x6b32 (correct), seq 1574174330, win 65535, options [mss 1440,nop,wscale 6,nop,nop,TS val 3382419974 ecr 0,sackOK,eol], length 0
19:47:18.852326 IP6 (flowlabel 0x6ea5d, hlim 55, next-header TCP (6) payload length: 1380) 2607:6bc0::10.443 > 2601:5cf:407e:8160:3d22:aa06:6a3c:6a63.50914: Flags [.], cksum 0x8e1e (correct), seq 1:1349, ack 1768, win 16, options [nop,nop,TS val 3619919691 ecr 1534219090], length 1348
19:47:18.852361 IP6 (flowlabel 0x10000, hlim 64, next-header TCP (6) payload length: 32) 2601:5cf:407e:8160:3d22:aa06:6a3c:6a63.50914 > 2607:6bc0::10.443: Flags [.], cksum 0xf5bd (correct), ack 1349, win 2044, options [nop,nop,TS val 1534219129 ecr 3619919691], length 0
19:47:18.854060 IP6 (flowlabel 0x6ea5d, hlim 55, next-header TCP (6) payload length: 1380) 2607:6bc0::10.443 > 2601:5cf:407e:8160:3d22:aa06:6a3c:6a63.50914: Flags [.], cksum 0x8319 (correct), seq 1349:2697, ack 1768, win 16, options [nop,nop,TS val 3619919691 ecr 1534219090], length 1348
19:47:18.854061 IP6 (flowlabel 0x6ea5d, hlim 55, next-header TCP (6) payload length: 822) 2607:6bc0::10.443 > 2601:5cf:407e:8160:3d22:aa06:6a3c:6a63.50914: Flags [P.], cksum 0xdb1a (correct), seq 2697:3487, ack 1768, win 16, options [nop,nop,TS val 3619919691 ecr 1534219090], length 790
19:47:18.854120 IP6 (flowlabel 0x10000, hlim 64, next-header TCP (6) payload length: 32) 2601:5cf:407e:8160:3d22:aa06:6a3c:6a63.50914 > 2607:6bc0::10.443: Flags [.], cksum 0xed7e (correct), ack 3487, win 2015, options [nop,nop,TS val 1534219131 ecr 3619919691], length 0
19:47:18.855737 IP6 (flowlabel 0xf0400, hlim 64, next-header UDP (17) payload length: 53) 2601:5cf:407e:8160:3d22:aa06:6a3c:6a63.54963 > 2607:6bc0::10.443: [udp sum ok] quic, protected
19:47:18.866213 IP6 (flowlabel 0xec0a0, hlim 55, next-header UDP (17) payload length: 465) 2607:6bc0::10.443 > 2601:5cf:407e:8160:3d22:aa06:6a3c:6a63.54963: [udp sum ok] quic, protected
19:47:18.867849 IP6 (flowlabel 0x10000, hlim 64, next-header TCP (6) payload length: 96) 2601:5cf:407e:8160:3d22:aa06:6a3c:6a63.50914 > 2607:6bc0::10.443: Flags [P.], cksum 0x9f5d (correct), seq 1768:1832, ack 3487, win 2048, options [nop,nop,TS val 1534219145 ecr 3619919691], length 64
19:47:18.867995 IP6 (flowlabel 0x10000, hlim 64, next-header TCP (6) payload length: 124) 2601:5cf:407e:8160:3d22:aa06:6a3c:6a63.50914 > 2607:6bc0::10.443: Flags [P.], cksum 0x3c1c (correct), seq 1832:1924, ack 3487, win 2048, options [nop,nop,TS val 1534219145 ecr 3619919691], length 92
19:47:18.868020 IP6 (flowlabel 0x10000, hlim 64, next-header TCP (6) payload length: 591) 2601:5cf:407e:8160:3d22:aa06:6a3c:6a63.50914 > 2607:6bc0::10.443: Flags [P.], cksum 0x05ad (correct), seq 1924:2483, ack 3487, win 2048, options [nop,nop,TS val 1534219145 ecr 3619919691], length 559
19:47:18.874090 IP6 (flowlabel 0xf0400, hlim 64, next-header UDP (17) payload length: 53) 2601:5cf:407e:8160:3d22:aa06:6a3c:6a63.54963 > 2607:6bc0::10.443: [udp sum ok] quic, protected
19:47:18.882293 IP6 (flowlabel 0x7769b, hlim 55, next-header TCP (6) payload length: 40) 2607:6bc0::10.443 > 2601:5cf:407e:8160:3d22:aa06:6a3c:6a63.50915: Flags [S.], cksum 0xb2ab (correct), seq 2154745848, ack 1574174331, win 65535, options [mss 1360,sackOK,TS val 3354243438 ecr 3382419974,nop,wscale 13], length 0
19:47:18.882354 IP6 (flowlabel 0x40400, hlim 64, next-header TCP (6) payload length: 32) 2601:5cf:407e:8160:3d22:aa06:6a3c:6a63.50915 > 2607:6bc0::10.443: Flags [.], cksum 0xd8e9 (correct), ack 1, win 2065, options [nop,nop,TS val 3382420005 ecr 3354243438], length 0
19:47:18.882475 IP6 (flowlabel 0x40400, hlim 64, next-header TCP (6) payload length: 1380) 2601:5cf:407e:8160:3d22:aa06:6a3c:6a63.50915 > 2607:6bc0::10.443: Flags [.], cksum 0xb48b (correct), seq 1:1349, ack 1, win 2065, options [nop,nop,TS val 3382420005 ecr 3354243438], length 1348
19:47:18.882485 IP6 (flowlabel 0x40400, hlim 64, next-header TCP (6) payload length: 419) 2601:5cf:407e:8160:3d22:aa06:6a3c:6a63.50915 > 2607:6bc0::10.443: Flags [P.], cksum 0x1acc (correct), seq 1349:1736, ack 1, win 2065, options [nop,nop,TS val 3382420005 ecr 3354243438], length 387
19:47:18.891722 IP6 (flowlabel 0xec0a0, hlim 55, next-header UDP (17) payload length: 62) 2607:6bc0::10.443 > 2601:5cf:407e:8160:3d22:aa06:6a3c:6a63.54963: [udp sum ok] quic, protected
19:47:18.895327 IP6 (flowlabel 0x6ea5d, hlim 55, next-header TCP (6) payload length: 32) 2607:6bc0::10.443 > 2601:5cf:407e:8160:3d22:aa06:6a3c:6a63.50914: Flags [.], cksum 0xf477 (correct), ack 1924, win 16, options [nop,nop,TS val 3619919735 ecr 1534219145], length 0
19:47:18.896911 IP6 (flowlabel 0x6ea5d, hlim 55, next-header TCP (6) payload length: 553) 2607:6bc0::10.443 > 2601:5cf:407e:8160:3d22:aa06:6a3c:6a63.50914: Flags [P.], cksum 0x5b02 (correct), seq 3487:4008, ack 1924, win 16, options [nop,nop,TS val 3619919735 ecr 1534219145], length 521
19:47:18.896971 IP6 (flowlabel 0x10000, hlim 64, next-header TCP (6) payload length: 32) 2601:5cf:407e:8160:3d22:aa06:6a3c:6a63.50914 > 2607:6bc0::10.443: Flags [.], cksum 0xe83a (correct), ack 4008, win 2040, options [nop,nop,TS val 1534219174 ecr 3619919735], length 0
19:47:18.897072 IP6 (flowlabel 0x10000, hlim 64, next-header TCP (6) payload length: 63) 2601:5cf:407e:8160:3d22:aa06:6a3c:6a63.50914 > 2607:6bc0::10.443: Flags [P.], cksum 0x134d (correct), seq 2483:2514, ack 4008, win 2048, options [nop,nop,TS val 1534219174 ecr 3619919735], length 31
19:47:18.899403 IP6 (flowlabel 0xf0400, hlim 64, next-header UDP (17) payload length: 53) 2601:5cf:407e:8160:3d22:aa06:6a3c:6a63.54963 > 2607:6bc0::10.443: [udp sum ok] quic, protected
19:47:18.921511 IP6 (flowlabel 0x7769b, hlim 55, next-header TCP (6) payload length: 32) 2607:6bc0::10.443 > 2601:5cf:407e:8160:3d22:aa06:6a3c:6a63.50915: Flags [.], cksum 0xd9fc (correct), ack 1736, win 16, options [nop,nop,TS val 3354243477 ecr 3382420005], length 0
19:47:18.927467 IP6 (flowlabel 0x6ea5d, hlim 55, next-header TCP (6) payload length: 32) 2607:6bc0::10.443 > 2601:5cf:407e:8160:3d22:aa06:6a3c:6a63.50914: Flags [.], cksum 0xf001 (correct), ack 2514, win 16, options [nop,nop,TS val 3619919766 ecr 1534219145], length 0
19:47:18.929016 IP6 (flowlabel 0x7769b, hlim 55, next-header TCP (6) payload length: 1380) 2607:6bc0::10.443 > 2601:5cf:407e:8160:3d22:aa06:6a3c:6a63.50915: Flags [.], cksum 0xe614 (correct), seq 1:1349, ack 1736, win 16, options [nop,nop,TS val 3354243483 ecr 3382420005], length 1348
19:47:18.929115 IP6 (flowlabel 0x40400, hlim 64, next-header TCP (6) payload length: 32) 2601:5cf:407e:8160:3d22:aa06:6a3c:6a63.50915 > 2607:6bc0::10.443: Flags [.], cksum 0xcc98 (correct), ack 1349, win 2044, options [nop,nop,TS val 3382420051 ecr 3354243483], length 0
19:47:18.929557 IP6 (flowlabel 0x7769b, hlim 55, next-header TCP (6) payload length: 1380) 2607:6bc0::10.443 > 2601:5cf:407e:8160:3d22:aa06:6a3c:6a63.50915: Flags [.], cksum 0x6f18 (correct), seq 1349:2697, ack 1736, win 16, options [nop,nop,TS val 3354243483 ecr 3382420005], length 1348
19:47:18.929558 IP6 (flowlabel 0x7769b, hlim 55, next-header TCP (6) payload length: 821) 2607:6bc0::10.443 > 2601:5cf:407e:8160:3d22:aa06:6a3c:6a63.50915: Flags [P.], cksum 0xa2b7 (correct), seq 2697:3486, ack 1736, win 16, options [nop,nop,TS val 3354243483 ecr 3382420005], length 789
19:47:18.929591 IP6 (flowlabel 0x40400, hlim 64, next-header TCP (6) payload length: 32) 2601:5cf:407e:8160:3d22:aa06:6a3c:6a63.50915 > 2607:6bc0::10.443: Flags [.], cksum 0xc45c (correct), ack 3486, win 2015, options [nop,nop,TS val 3382420051 ecr 3354243483], length 0
19:47:18.929761 IP6 (flowlabel 0x40400, hlim 64, next-header TCP (6) payload length: 96) 2601:5cf:407e:8160:3d22:aa06:6a3c:6a63.50915 > 2607:6bc0::10.443: Flags [P.], cksum 0x2780 (correct), seq 1736:1800, ack 3486, win 2048, options [nop,nop,TS val 3382420051 ecr 3354243483], length 64
19:47:18.958560 IP6 (flowlabel 0x7769b, hlim 55, next-header TCP (6) payload length: 544) 2607:6bc0::10.443 > 2601:5cf:407e:8160:3d22:aa06:6a3c:6a63.50915: Flags [P.], cksum 0x8d5a (correct), seq 3486:3998, ack 1800, win 16, options [nop,nop,TS val 3354243514 ecr 3382420051], length 512
19:47:18.958681 IP6 (flowlabel 0x40400, hlim 64, next-header TCP (6) payload length: 32) 2601:5cf:407e:8160:3d22:aa06:6a3c:6a63.50915 > 2607:6bc0::10.443: Flags [.], cksum 0xc1c6 (correct), ack 3998, win 2040, options [nop,nop,TS val 3382420081 ecr 3354243514], length 0
19:47:18.966253 IP6 (flowlabel 0xec0a0, hlim 55, next-header UDP (17) payload length: 462) 2607:6bc0::10.443 > 2601:5cf:407e:8160:3d22:aa06:6a3c:6a63.54963: [udp sum ok] quic, protected
19:47:18.974297 IP6 (flowlabel 0xf0400, hlim 64, next-header UDP (17) payload length: 53) 2601:5cf:407e:8160:3d22:aa06:6a3c:6a63.54963 > 2607:6bc0::10.443: [udp sum ok] quic, protected
19:47:18.991065 IP6 (flowlabel 0x6ea5d, hlim 55, next-header TCP (6) payload length: 1380) 2607:6bc0::10.443 > 2601:5cf:407e:8160:3d22:aa06:6a3c:6a63.50914: Flags [.], cksum 0xbb26 (correct), seq 4008:5356, ack 2514, win 16, options [nop,nop,TS val 3619919829 ecr 1534219145], length 1348
19:47:18.991066 IP6 (flowlabel 0x6ea5d, hlim 55, next-header TCP (6) payload length: 75) 2607:6bc0::10.443 > 2601:5cf:407e:8160:3d22:aa06:6a3c:6a63.50914: Flags [P.], cksum 0x45c8 (correct), seq 5356:5399, ack 2514, win 16, options [nop,nop,TS val 3619919829 ecr 1534219145], length 43
19:47:18.991182 IP6 (flowlabel 0x10000, hlim 64, next-header TCP (6) payload length: 32) 2601:5cf:407e:8160:3d22:aa06:6a3c:6a63.50914 > 2607:6bc0::10.443: Flags [.], cksum 0xe1fd (correct), ack 5399, win 2027, options [nop,nop,TS val 1534219268 ecr 3619919829], length 0
19:47:18.992476 IP6 (flowlabel 0x6ea5d, hlim 55, next-header TCP (6) payload length: 348) 2607:6bc0::10.443 > 2601:5cf:407e:8160:3d22:aa06:6a3c:6a63.50914: Flags [P.], cksum 0xb461 (correct), seq 5399:5715, ack 2514, win 16, options [nop,nop,TS val 3619919829 ecr 1534219145], length 316
19:47:18.992477 IP6 (flowlabel 0x6ea5d, hlim 55, next-header TCP (6) payload length: 1380) 2607:6bc0::10.443 > 2601:5cf:407e:8160:3d22:aa06:6a3c:6a63.50914: Flags [.], cksum 0xc5f8 (correct), seq 5715:7063, ack 2514, win 16, options [nop,nop,TS val 3619919829 ecr 1534219145], length 1348
19:47:18.992478 IP6 (flowlabel 0x6ea5d, hlim 55, next-header TCP (6) payload length: 75) 2607:6bc0::10.443 > 2601:5cf:407e:8160:3d22:aa06:6a3c:6a63.50914: Flags [P.], cksum 0x6ca9 (correct), seq 7063:7106, ack 2514, win 16, options [nop,nop,TS val 3619919829 ecr 1534219145], length 43
19:47:18.992479 IP6 (flowlabel 0x6ea5d, hlim 55, next-header TCP (6) payload length: 1380) 2607:6bc0::10.443 > 2601:5cf:407e:8160:3d22:aa06:6a3c:6a63.50914: Flags [.], cksum 0xba67 (correct), seq 7106:8454, ack 2514, win 16, options [nop,nop,TS val 3619919829 ecr 1534219145], length 1348
19:47:18.992581 IP6 (flowlabel 0x10000, hlim 64, next-header TCP (6) payload length: 32) 2601:5cf:407e:8160:3d22:aa06:6a3c:6a63.50914 > 2607:6bc0::10.443: Flags [.], cksum 0xd626 (correct), ack 8454, win 2001, options [nop,nop,TS val 1534219270 ecr 3619919829], length 0
19:47:18.992690 IP6 (flowlabel 0x10000, hlim 64, next-header TCP (6) payload length: 32) 2601:5cf:407e:8160:3d22:aa06:6a3c:6a63.50914 > 2607:6bc0::10.443: Flags [.], cksum 0xd5f7 (correct), ack 8454, win 2048, options [nop,nop,TS val 1534219270 ecr 3619919829], length 0
19:47:18.992742 IP6 (flowlabel 0x6ea5d, hlim 55, next-header TCP (6) payload length: 75) 2607:6bc0::10.443 > 2601:5cf:407e:8160:3d22:aa06:6a3c:6a63.50914: Flags [P.], cksum 0x3ae9 (correct), seq 8454:8497, ack 2514, win 16, options [nop,nop,TS val 3619919829 ecr 1534219145], length 43
19:47:18.992786 IP6 (flowlabel 0x10000, hlim 64, next-header TCP (6) payload length: 32) 2601:5cf:407e:8160:3d22:aa06:6a3c:6a63.50914 > 2607:6bc0::10.443: Flags [.], cksum 0xd5cc (correct), ack 8497, win 2048, options [nop,nop,TS val 1534219270 ecr 3619919829], length 0
19:47:18.993970 IP6 (flowlabel 0x6ea5d, hlim 55, next-header TCP (6) payload length: 350) 2607:6bc0::10.443 > 2601:5cf:407e:8160:3d22:aa06:6a3c:6a63.50914: Flags [P.], cksum 0x2a2d (correct), seq 8497:8815, ack 2514, win 16, options [nop,nop,TS val 3619919829 ecr 1534219145], length 318
19:47:18.994014 IP6 (flowlabel 0x10000, hlim 64, next-header TCP (6) payload length: 32) 2601:5cf:407e:8160:3d22:aa06:6a3c:6a63.50914 > 2607:6bc0::10.443: Flags [.], cksum 0xd491 (correct), ack 8815, win 2044, options [nop,nop,TS val 1534219271 ecr 3619919829], length 0
19:47:18.994253 IP6 (flowlabel 0x6ea5d, hlim 55, next-header TCP (6) payload length: 63) 2607:6bc0::10.443 > 2601:5cf:407e:8160:3d22:aa06:6a3c:6a63.50914: Flags [P.], cksum 0xd85c (correct), seq 8815:8846, ack 2514, win 16, options [nop,nop,TS val 3619919829 ecr 1534219145], length 31
19:47:18.994292 IP6 (flowlabel 0x10000, hlim 64, next-header TCP (6) payload length: 32) 2601:5cf:407e:8160:3d22:aa06:6a3c:6a63.50914 > 2607:6bc0::10.443: Flags [.], cksum 0xd46e (correct), ack 8846, win 2048, options [nop,nop,TS val 1534219271 ecr 3619919829], length 0
19:47:19.016780 IP6 (flowlabel 0xec0a0, hlim 55, next-header UDP (17) payload length: 59) 2607:6bc0::10.443 > 2601:5cf:407e:8160:3d22:aa06:6a3c:6a63.54963: [udp sum ok] quic, protected
19:47:19.023242 IP6 (flowlabel 0xf0400, hlim 64, next-header UDP (17) payload length: 53) 2601:5cf:407e:8160:3d22:aa06:6a3c:6a63.54963 > 2607:6bc0::10.443: [udp sum ok] quic, protected
19:47:19.031765 IP6 (flowlabel 0xec0a0, hlim 55, next-header UDP (17) payload length: 51) 2607:6bc0::10.443 > 2601:5cf:407e:8160:3d22:aa06:6a3c:6a63.54963: [udp sum ok] quic, protected
19:47:19.039796 IP6 (flowlabel 0xf0400, hlim 64, next-header UDP (17) payload length: 53) 2601:5cf:407e:8160:3d22:aa06:6a3c:6a63.54963 > 2607:6bc0::10.443: [udp sum ok] quic, protected
19:47:19.061394 IP6 (flowlabel 0xec0a0, hlim 55, next-header UDP (17) payload length: 59) 2607:6bc0::10.443 > 2601:5cf:407e:8160:3d22:aa06:6a3c:6a63.54963: [udp sum ok] quic, protected
19:47:19.068614 IP6 (flowlabel 0xf0400, hlim 64, next-header UDP (17) payload length: 53) 2601:5cf:407e:8160:3d22:aa06:6a3c:6a63.54963 > 2607:6bc0::10.443: [udp sum ok] quic, protected
19:47:19.159711 IP6 (flowlabel 0xec0a0, hlim 55, next-header UDP (17) payload length: 65) 2607:6bc0::10.443 > 2601:5cf:407e:8160:3d22:aa06:6a3c:6a63.54963: [udp sum ok] quic, protected
19:47:19.166692 IP6 (flowlabel 0xf0400, hlim 64, next-header UDP (17) payload length: 53) 2601:5cf:407e:8160:3d22:aa06:6a3c:6a63.54963 > 2607:6bc0::10.443: [udp sum ok] quic, protected
19:47:19.254566 IP6 (flowlabel 0xec0a0, hlim 55, next-header UDP (17) payload length: 474) 2607:6bc0::10.443 > 2601:5cf:407e:8160:3d22:aa06:6a3c:6a63.54963: [udp sum ok] quic, protected
19:47:19.262664 IP6 (flowlabel 0xf0400, hlim 64, next-header UDP (17) payload length: 53) 2601:5cf:407e:8160:3d22:aa06:6a3c:6a63.54963 > 2607:6bc0::10.443: [udp sum ok] quic, protected
19:47:19.365823 IP6 (flowlabel 0xec0a0, hlim 55, next-header UDP (17) payload length: 70) 2607:6bc0::10.443 > 2601:5cf:407e:8160:3d22:aa06:6a3c:6a63.54963: [udp sum ok] quic, protected
19:47:19.365827 IP6 (flowlabel 0xec0a0, hlim 55, next-header UDP (17) payload length: 62) 2607:6bc0::10.443 > 2601:5cf:407e:8160:3d22:aa06:6a3c:6a63.54963: [udp sum ok] quic, protected
19:47:19.373637 IP6 (flowlabel 0xf0400, hlim 64, next-header UDP (17) payload length: 53) 2601:5cf:407e:8160:3d22:aa06:6a3c:6a63.54963 > 2607:6bc0::10.443: [udp sum ok] quic, protected
19:47:19.383546 IP6 (flowlabel 0xec0a0, hlim 55, next-header UDP (17) payload length: 66) 2607:6bc0::10.443 > 2601:5cf:407e:8160:3d22:aa06:6a3c:6a63.54963: [udp sum ok] quic, protected
19:47:19.391710 IP6 (flowlabel 0xf0400, hlim 64, next-header UDP (17) payload length: 53) 2601:5cf:407e:8160:3d22:aa06:6a3c:6a63.54963 > 2607:6bc0::10.443: [udp sum ok] quic, protected
19:47:19.437834 IP6 (flowlabel 0xec0a0, hlim 55, next-header UDP (17) payload length: 87) 2607:6bc0::10.443 > 2601:5cf:407e:8160:3d22:aa06:6a3c:6a63.54963: [udp sum ok] quic, protected
19:47:19.445986 IP6 (flowlabel 0xf0400, hlim 64, next-header UDP (17) payload length: 53) 2601:5cf:407e:8160:3d22:aa06:6a3c:6a63.54963 > 2607:6bc0::10.443: [udp sum ok] quic, protected
19:47:19.464414 IP6 (flowlabel 0xec0a0, hlim 55, next-header UDP (17) payload length: 59) 2607:6bc0::10.443 > 2601:5cf:407e:8160:3d22:aa06:6a3c:6a63.54963: [udp sum ok] quic, protected
19:47:19.472570 IP6 (flowlabel 0xf0400, hlim 64, next-header UDP (17) payload length: 53) 2601:5cf:407e:8160:3d22:aa06:6a3c:6a63.54963 > 2607:6bc0::10.443: [udp sum ok] quic, protected
19:47:19.613740 IP6 (flowlabel 0xec0a0, hlim 55, next-header UDP (17) payload length: 73) 2607:6bc0::10.443 > 2601:5cf:407e:8160:3d22:aa06:6a3c:6a63.54963: [udp sum ok] quic, protected
19:47:19.621305 IP6 (flowlabel 0xf0400, hlim 64, next-header UDP (17) payload length: 53) 2601:5cf:407e:8160:3d22:aa06:6a3c:6a63.54963 > 2607:6bc0::10.443: [udp sum ok] quic, protected
19:47:19.666291 IP6 (flowlabel 0xec0a0, hlim 55, next-header UDP (17) payload length: 67) 2607:6bc0::10.443 > 2601:5cf:407e:8160:3d22:aa06:6a3c:6a63.54963: [udp sum ok] quic, protected
19:47:19.674482 IP6 (flowlabel 0xf0400, hlim 64, next-header UDP (17) payload length: 53) 2601:5cf:407e:8160:3d22:aa06:6a3c:6a63.54963 > 2607:6bc0::10.443: [udp sum ok] quic, protected
19:47:19.699428 IP6 (flowlabel 0xec0a0, hlim 55, next-header UDP (17) payload length: 63) 2607:6bc0::10.443 > 2601:5cf:407e:8160:3d22:aa06:6a3c:6a63.54963: [udp sum ok] quic, protected
19:47:19.707592 IP6 (flowlabel 0xf0400, hlim 64, next-header UDP (17) payload length: 53) 2601:5cf:407e:8160:3d22:aa06:6a3c:6a63.54963 > 2607:6bc0::10.443: [udp sum ok] quic, protected
19:47:19.773485 IP6 (flowlabel 0xec0a0, hlim 55, next-header UDP (17) payload length: 69) 2607:6bc0::10.443 > 2601:5cf:407e:8160:3d22:aa06:6a3c:6a63.54963: [udp sum ok] quic, protected
19:47:19.781608 IP6 (flowlabel 0xf0400, hlim 64, next-header UDP (17) payload length: 53) 2601:5cf:407e:8160:3d22:aa06:6a3c:6a63.54963 > 2607:6bc0::10.443: [udp sum ok] quic, protected
19:47:19.856477 IP6 (flowlabel 0xec0a0, hlim 55, next-header UDP (17) payload length: 66) 2607:6bc0::10.443 > 2601:5cf:407e:8160:3d22:aa06:6a3c:6a63.54963: [udp sum ok] quic, protected
19:47:19.864589 IP6 (flowlabel 0xf0400, hlim 64, next-header UDP (17) payload length: 53) 2601:5cf:407e:8160:3d22:aa06:6a3c:6a63.54963 > 2607:6bc0::10.443: [udp sum ok] quic, protected
19:47:19.909066 IP6 (flowlabel 0xec0a0, hlim 55, next-header UDP (17) payload length: 63) 2607:6bc0::10.443 > 2601:5cf:407e:8160:3d22:aa06:6a3c:6a63.54963: [udp sum ok] quic, protected
19:47:19.916192 IP6 (flowlabel 0xf0400, hlim 64, next-header UDP (17) payload length: 58) 2601:5cf:407e:8160:3d22:aa06:6a3c:6a63.54963 > 2607:6bc0::10.443: [udp sum ok] quic, protected
19:47:19.941738 IP6 (flowlabel 0xec0a0, hlim 55, next-header UDP (17) payload length: 32) 2607:6bc0::10.443 > 2601:5cf:407e:8160:3d22:aa06:6a3c:6a63.54963: [udp sum ok] quic, protected
19:47:19.999520 IP6 (flowlabel 0xec0a0, hlim 55, next-header UDP (17) payload length: 95) 2607:6bc0::10.443 > 2601:5cf:407e:8160:3d22:aa06:6a3c:6a63.54963: [udp sum ok] quic, protected
19:47:20.007666 IP6 (flowlabel 0xf0400, hlim 64, next-header UDP (17) payload length: 53) 2601:5cf:407e:8160:3d22:aa06:6a3c:6a63.54963 > 2607:6bc0::10.443: [udp sum ok] quic, protected
19:47:20.079488 IP6 (flowlabel 0xec0a0, hlim 55, next-header UDP (17) payload length: 65) 2607:6bc0::10.443 > 2601:5cf:407e:8160:3d22:aa06:6a3c:6a63.54963: [udp sum ok] quic, protected
19:47:20.087691 IP6 (flowlabel 0xf0400, hlim 64, next-header UDP (17) payload length: 53) 2601:5cf:407e:8160:3d22:aa06:6a3c:6a63.54963 > 2607:6bc0::10.443: [udp sum ok] quic, protected
19:47:20.119811 IP6 (flowlabel 0xec0a0, hlim 55, next-header UDP (17) payload length: 61) 2607:6bc0::10.443 > 2601:5cf:407e:8160:3d22:aa06:6a3c:6a63.54963: [udp sum ok] quic, protected
19:47:20.127883 IP6 (flowlabel 0xf0400, hlim 64, next-header UDP (17) payload length: 53) 2601:5cf:407e:8160:3d22:aa06:6a3c:6a63.54963 > 2607:6bc0::10.443: [udp sum ok] quic, protected
19:47:20.191336 IP6 (flowlabel 0xec0a0, hlim 55, next-header UDP (17) payload length: 65) 2607:6bc0::10.443 > 2601:5cf:407e:8160:3d22:aa06:6a3c:6a63.54963: [udp sum ok] quic, protected
19:47:20.199467 IP6 (flowlabel 0xf0400, hlim 64, next-header UDP (17) payload length: 53) 2601:5cf:407e:8160:3d22:aa06:6a3c:6a63.54963 > 2607:6bc0::10.443: [udp sum ok] quic, protected
19:47:20.269018 IP6 (flowlabel 0xec0a0, hlim 55, next-header UDP (17) payload length: 67) 2607:6bc0::10.443 > 2601:5cf:407e:8160:3d22:aa06:6a3c:6a63.54963: [udp sum ok] quic, protected
19:47:20.277128 IP6 (flowlabel 0xf0400, hlim 64, next-header UDP (17) payload length: 53) 2601:5cf:407e:8160:3d22:aa06:6a3c:6a63.54963 > 2607:6bc0::10.443: [udp sum ok] quic, protected
19:47:20.325071 IP6 (flowlabel 0xec0a0, hlim 55, next-header UDP (17) payload length: 67) 2607:6bc0::10.443 > 2601:5cf:407e:8160:3d22:aa06:6a3c:6a63.54963: [udp sum ok] quic, protected
19:47:20.332841 IP6 (flowlabel 0xf0400, hlim 64, next-header UDP (17) payload length: 53) 2601:5cf:407e:8160:3d22:aa06:6a3c:6a63.54963 > 2607:6bc0::10.443: [udp sum ok] quic, protected
19:47:20.364463 IP6 (flowlabel 0xec0a0, hlim 55, next-header UDP (17) payload length: 49) 2607:6bc0::10.443 > 2601:5cf:407e:8160:3d22:aa06:6a3c:6a63.54963: [udp sum ok] quic, protected
19:47:20.371308 IP6 (flowlabel 0xf0400, hlim 64, next-header UDP (17) payload length: 53) 2601:5cf:407e:8160:3d22:aa06:6a3c:6a63.54963 > 2607:6bc0::10.443: [udp sum ok] quic, protected
19:47:20.433266 IP6 (flowlabel 0xec0a0, hlim 55, next-header UDP (17) payload length: 65) 2607:6bc0::10.443 > 2601:5cf:407e:8160:3d22:aa06:6a3c:6a63.54963: [udp sum ok] quic, protected
19:47:20.441158 IP6 (flowlabel 0xf0400, hlim 64, next-header UDP (17) payload length: 53) 2601:5cf:407e:8160:3d22:aa06:6a3c:6a63.54963 > 2607:6bc0::10.443: [udp sum ok] quic, protected
19:47:20.484545 IP6 (flowlabel 0xec0a0, hlim 55, next-header UDP (17) payload length: 58) 2607:6bc0::10.443 > 2601:5cf:407e:8160:3d22:aa06:6a3c:6a63.54963: [udp sum ok] quic, protected
19:47:20.486695 IP6 (flowlabel 0xec0a0, hlim 55, next-header UDP (17) payload length: 53) 2607:6bc0::10.443 > 2601:5cf:407e:8160:3d22:aa06:6a3c:6a63.54963: [udp sum ok] quic, protected
19:47:20.491673 IP6 (flowlabel 0xf0400, hlim 64, next-header UDP (17) payload length: 53) 2601:5cf:407e:8160:3d22:aa06:6a3c:6a63.54963 > 2607:6bc0::10.443: [udp sum ok] quic, protected
19:47:20.599893 IP6 (flowlabel 0xec0a0, hlim 55, next-header UDP (17) payload length: 68) 2607:6bc0::10.443 > 2601:5cf:407e:8160:3d22:aa06:6a3c:6a63.54963: [udp sum ok] quic, protected
