tcpdump: data link type PKTAP
tcpdump: WARNING: snaplen raised from 96 to 524288
tcpdump: listening on pktap, link-type PKTAP (Apple DLT_PKTAP), snapshot length 524288 bytes
16:17:34.580659 IP (tos 0x0, ttl 64, id 24460, offset 0, flags [none], proto TCP (6), length 40)
    172.25.187.30.53952 > 160.79.104.10.443: Flags [.], cksum 0x3686 (correct), ack 3174813964, win 7823, length 0
16:17:34.591720 IP (tos 0x0, ttl 54, id 23654, offset 0, flags [DF], proto TCP (6), length 52)
    160.79.104.10.443 > 172.25.187.30.53952: Flags [.], cksum 0xd344 (correct), ack 1, win 19, options [nop,nop,TS val 107079586 ecr 487013786], length 0
16:17:42.074694 IP (tos 0x2,ECT(0), ttl 64, id 0, offset 0, flags [DF], proto TCP (6), length 282)
    172.25.187.30.53952 > 160.79.104.10.443: Flags [P.], cksum 0xad14 (correct), seq 1:231, ack 1, win 7824, options [nop,nop,TS val 487066281 ecr 107079586], length 230
16:17:42.074759 IP (tos 0x2,ECT(0), ttl 64, id 0, offset 0, flags [DF], proto TCP (6), length 91)
    172.25.187.30.53952 > 160.79.104.10.443: Flags [P.], cksum 0xa03c (correct), seq 231:270, ack 1, win 7824, options [nop,nop,TS val 487066281 ecr 107079586], length 39
16:17:42.074769 IP (tos 0x2,ECT(0), ttl 64, id 0, offset 0, flags [DF], proto TCP (6), length 274)
    172.25.187.30.53952 > 160.79.104.10.443: Flags [P.], cksum 0x58fd (correct), seq 270:492, ack 1, win 7824, options [nop,nop,TS val 487066281 ecr 107079586], length 222
16:17:42.085304 IP (tos 0x0, ttl 54, id 23655, offset 0, flags [DF], proto TCP (6), length 52)
    160.79.104.10.443 > 172.25.187.30.53952: Flags [.], cksum 0xe703 (correct), ack 492, win 19, options [nop,nop,TS val 107087080 ecr 487066281], length 0
16:17:42.085810 IP (tos 0x2,ECT(0), ttl 54, id 23656, offset 0, flags [DF], proto TCP (6), length 91)
    160.79.104.10.443 > 172.25.187.30.53952: Flags [P.], cksum 0x5cf8 (correct), seq 1:40, ack 492, win 19, options [nop,nop,TS val 107087080 ecr 487066281], length 39
16:17:42.085846 IP (tos 0x0, ttl 64, id 0, offset 0, flags [DF], proto TCP (6), length 52)
    172.25.187.30.53952 > 160.79.104.10.443: Flags [.], cksum 0xc854 (correct), ack 40, win 7824, options [nop,nop,TS val 487066292 ecr 107087080], length 0
16:17:42.094357 IP (tos 0x2,ECT(0), ttl 64, id 0, offset 0, flags [DF], proto TCP (6), length 281)
    172.25.187.30.53952 > 160.79.104.10.443: Flags [P.], cksum 0x002b (correct), seq 492:721, ack 40, win 7824, options [nop,nop,TS val 487066301 ecr 107087080], length 229
16:17:42.094388 IP (tos 0x2,ECT(0), ttl 64, id 0, offset 0, flags [DF], proto TCP (6), length 666)
    172.25.187.30.53952 > 160.79.104.10.443: Flags [P.], cksum 0x4b76 (correct), seq 721:1335, ack 40, win 7824, options [nop,nop,TS val 487066301 ecr 107087080], length 614
16:17:42.101349 IP (tos 0x0, ttl 54, id 23657, offset 0, flags [DF], proto TCP (6), length 52)
    160.79.104.10.443 > 172.25.187.30.53952: Flags [.], cksum 0xe36d (correct), ack 1335, win 19, options [nop,nop,TS val 107087096 ecr 487066301], length 0
16:17:42.165841 IP (tos 0x2,ECT(0), ttl 64, id 0, offset 0, flags [DF], proto TCP (6), length 815)
    172.25.187.30.53952 > 160.79.104.10.443: Flags [P.], cksum 0x146a (correct), seq 1335:2098, ack 40, win 7824, options [nop,nop,TS val 487066372 ecr 107087096], length 763
16:17:42.166002 IP (tos 0x2,ECT(0), ttl 64, id 0, offset 0, flags [DF], proto TCP (6), length 1283)
    172.25.187.30.53952 > 160.79.104.10.443: Flags [P.], cksum 0x0108 (correct), seq 2098:3329, ack 40, win 7824, options [nop,nop,TS val 487066372 ecr 107087096], length 1231
16:17:42.173938 IP (tos 0x0, ttl 54, id 23658, offset 0, flags [DF], proto TCP (6), length 52)
    160.79.104.10.443 > 172.25.187.30.53952: Flags [.], cksum 0xdb14 (correct), ack 3329, win 19, options [nop,nop,TS val 107087168 ecr 487066372], length 0
16:17:42.178698 IP (tos 0x2,ECT(0), ttl 64, id 0, offset 0, flags [DF], proto TCP (6), length 112)
    172.25.187.30.53956 > 160.79.104.10.443: Flags [P.], cksum 0x5935 (correct), seq 879534119:879534179, ack 3537496724, win 2048, options [nop,nop,TS val 163531320 ecr 2624264125], length 60
16:17:42.178723 IP (tos 0x2,ECT(0), ttl 64, id 0, offset 0, flags [DF], proto TCP (6), length 91)
    172.25.187.30.53956 > 160.79.104.10.443: Flags [P.], cksum 0x9447 (correct), seq 60:99, ack 1, win 2048, options [nop,nop,TS val 163531320 ecr 2624264125], length 39
16:17:42.178731 IP (tos 0x2,ECT(0), ttl 64, id 0, offset 0, flags [DF], proto TCP (6), length 1426)
    172.25.187.30.53956 > 160.79.104.10.443: Flags [.], cksum 0x758c (correct), seq 99:1473, ack 1, win 2048, options [nop,nop,TS val 163531320 ecr 2624264125], length 1374
16:17:42.178733 IP (tos 0x2,ECT(0), ttl 64, id 0, offset 0, flags [DF], proto TCP (6), length 970)
    172.25.187.30.53956 > 160.79.104.10.443: Flags [P.], cksum 0x5e3c (correct), seq 1473:2391, ack 1, win 2048, options [nop,nop,TS val 163531320 ecr 2624264125], length 918
16:17:42.184760 IP (tos 0x0, ttl 54, id 7531, offset 0, flags [DF], proto TCP (6), length 52)
    160.79.104.10.443 > 172.25.187.30.53956: Flags [.], cksum 0x4720 (correct), ack 60, win 19, options [nop,nop,TS val 2624284887 ecr 163531320], length 0
16:17:42.184760 IP (tos 0x0, ttl 54, id 7532, offset 0, flags [DF], proto TCP (6), length 52)
    160.79.104.10.443 > 172.25.187.30.53956: Flags [.], cksum 0x46f9 (correct), ack 99, win 19, options [nop,nop,TS val 2624284887 ecr 163531320], length 0
16:17:42.184761 IP (tos 0x0, ttl 54, id 7533, offset 0, flags [DF], proto TCP (6), length 52)
    160.79.104.10.443 > 172.25.187.30.53956: Flags [.], cksum 0x3e05 (correct), ack 2391, win 19, options [nop,nop,TS val 2624284887 ecr 163531320], length 0
16:17:42.184971 IP (tos 0x2,ECT(0), ttl 54, id 7534, offset 0, flags [DF], proto TCP (6), length 91)
    160.79.104.10.443 > 172.25.187.30.53956: Flags [P.], cksum 0x752e (correct), seq 1:40, ack 2391, win 19, options [nop,nop,TS val 2624284887 ecr 163531320], length 39
16:17:42.185041 IP (tos 0x0, ttl 64, id 0, offset 0, flags [DF], proto TCP (6), length 52)
    172.25.187.30.53956 > 160.79.104.10.443: Flags [.], cksum 0x35eb (correct), ack 40, win 2048, options [nop,nop,TS val 163531326 ecr 2624284887], length 0
16:17:42.282048 IP (tos 0x2,ECT(0), ttl 54, id 23659, offset 0, flags [DF], proto TCP (6), length 165)
    160.79.104.10.443 > 172.25.187.30.53952: Flags [P.], cksum 0x7e80 (correct), seq 40:153, ack 3329, win 19, options [nop,nop,TS val 107087275 ecr 487066372], length 113
16:17:42.282049 IP (tos 0x2,ECT(0), ttl 54, id 23660, offset 0, flags [DF], proto TCP (6), length 635)
    160.79.104.10.443 > 172.25.187.30.53952: Flags [P.], cksum 0x243c (correct), seq 153:736, ack 3329, win 19, options [nop,nop,TS val 107087275 ecr 487066372], length 583
16:17:42.282050 IP (tos 0x2,ECT(0), ttl 54, id 23661, offset 0, flags [DF], proto TCP (6), length 90)
    160.79.104.10.443 > 172.25.187.30.53952: Flags [P.], cksum 0xc9cc (correct), seq 736:774, ack 3329, win 19, options [nop,nop,TS val 107087275 ecr 487066372], length 38
16:17:42.282050 IP (tos 0x2,ECT(0), ttl 54, id 23662, offset 0, flags [DF], proto TCP (6), length 83)
    160.79.104.10.443 > 172.25.187.30.53952: Flags [P.], cksum 0x8f25 (correct), seq 774:805, ack 3329, win 19, options [nop,nop,TS val 107087275 ecr 487066372], length 31
16:17:42.282159 IP (tos 0x0, ttl 64, id 0, offset 0, flags [DF], proto TCP (6), length 52)
    172.25.187.30.53952 > 160.79.104.10.443: Flags [.], cksum 0xb8c6 (correct), ack 805, win 7813, options [nop,nop,TS val 487066488 ecr 107087275], length 0
16:17:42.282783 IP (tos 0x2,ECT(0), ttl 64, id 0, offset 0, flags [DF], proto TCP (6), length 87)
    172.25.187.30.53952 > 160.79.104.10.443: Flags [P.], cksum 0x7a77 (correct), seq 3329:3364, ack 805, win 7824, options [nop,nop,TS val 487066488 ecr 107087275], length 35
16:17:42.284349 IP (tos 0x2,ECT(0), ttl 54, id 7535, offset 0, flags [DF], proto TCP (6), length 351)
    160.79.104.10.443 > 172.25.187.30.53956: Flags [P.], cksum 0x5fb2 (correct), seq 40:339, ack 2391, win 19, options [nop,nop,TS val 2624284987 ecr 163531326], length 299
16:17:42.284350 IP (tos 0x2,ECT(0), ttl 54, id 7536, offset 0, flags [DF], proto TCP (6), length 104)
    160.79.104.10.443 > 172.25.187.30.53956: Flags [P.], cksum 0xd27e (correct), seq 339:391, ack 2391, win 19, options [nop,nop,TS val 2624284987 ecr 163531326], length 52
16:17:42.284442 IP (tos 0x0, ttl 64, id 0, offset 0, flags [DF], proto TCP (6), length 52)
    172.25.187.30.53956 > 160.79.104.10.443: Flags [.], cksum 0x33c9 (correct), ack 391, win 2043, options [nop,nop,TS val 163531426 ecr 2624284987], length 0
16:17:42.284758 IP (tos 0x2,ECT(0), ttl 54, id 7537, offset 0, flags [DF], proto TCP (6), length 83)
    160.79.104.10.443 > 172.25.187.30.53956: Flags [P.], cksum 0xd161 (correct), seq 391:422, ack 2391, win 19, options [nop,nop,TS val 2624284987 ecr 163531326], length 31
16:17:42.284807 IP (tos 0x0, ttl 64, id 0, offset 0, flags [DF], proto TCP (6), length 52)
    172.25.187.30.53956 > 160.79.104.10.443: Flags [.], cksum 0x33a5 (correct), ack 422, win 2048, options [nop,nop,TS val 163531426 ecr 2624284987], length 0
16:17:42.284954 IP (tos 0x2,ECT(0), ttl 64, id 0, offset 0, flags [DF], proto TCP (6), length 87)
    172.25.187.30.53956 > 160.79.104.10.443: Flags [P.], cksum 0x7305 (correct), seq 2391:2426, ack 422, win 2048, options [nop,nop,TS val 163531426 ecr 2624284987], length 35
16:17:42.288775 IP (tos 0x2,ECT(0), ttl 54, id 23663, offset 0, flags [DF], proto TCP (6), length 142)
    160.79.104.10.443 > 172.25.187.30.53952: Flags [P.], cksum 0x39dc (correct), seq 805:895, ack 3329, win 19, options [nop,nop,TS val 107087284 ecr 487066488], length 90
16:17:42.288776 IP (tos 0x2,ECT(0), ttl 54, id 23664, offset 0, flags [DF], proto TCP (6), length 163)
    160.79.104.10.443 > 172.25.187.30.53952: Flags [P.], cksum 0xc622 (correct), seq 895:1006, ack 3329, win 19, options [nop,nop,TS val 107087284 ecr 487066488], length 111
16:17:42.288776 IP (tos 0x2,ECT(0), ttl 54, id 23665, offset 0, flags [DF], proto TCP (6), length 90)
    160.79.104.10.443 > 172.25.187.30.53952: Flags [P.], cksum 0xdc9d (correct), seq 1006:1044, ack 3329, win 19, options [nop,nop,TS val 107087285 ecr 487066488], length 38
16:17:42.288817 IP (tos 0x0, ttl 64, id 0, offset 0, flags [DF], proto TCP (6), length 52)
    172.25.187.30.53952 > 160.79.104.10.443: Flags [.], cksum 0xb79b (correct), ack 1044, win 7821, options [nop,nop,TS val 487066495 ecr 107087285], length 0
16:17:42.290433 IP (tos 0x2,ECT(0), ttl 54, id 23666, offset 0, flags [DF], proto TCP (6), length 83)
    160.79.104.10.443 > 172.25.187.30.53952: Flags [P.], cksum 0x8dc3 (correct), seq 1044:1075, ack 3329, win 19, options [nop,nop,TS val 107087285 ecr 487066488], length 31
16:17:42.290486 IP (tos 0x0, ttl 64, id 0, offset 0, flags [DF], proto TCP (6), length 52)
    172.25.187.30.53952 > 160.79.104.10.443: Flags [.], cksum 0xb778 (correct), ack 1075, win 7823, options [nop,nop,TS val 487066497 ecr 107087285], length 0
16:17:42.332267 IP (tos 0x0, ttl 54, id 23667, offset 0, flags [DF], proto TCP (6), length 52)
    160.79.104.10.443 > 172.25.187.30.53952: Flags [.], cksum 0xd5d3 (correct), ack 3364, win 19, options [nop,nop,TS val 107087327 ecr 487066488], length 0
16:17:42.333775 IP (tos 0x0, ttl 54, id 7538, offset 0, flags [DF], proto TCP (6), length 52)
    160.79.104.10.443 > 172.25.187.30.53956: Flags [.], cksum 0x3b3e (correct), ack 2426, win 19, options [nop,nop,TS val 2624285036 ecr 163531426], length 0
16:17:42.484744 IP (tos 0x2,ECT(0), ttl 54, id 23668, offset 0, flags [DF], proto TCP (6), length 195)
    160.79.104.10.443 > 172.25.187.30.53952: Flags [P.], cksum 0xdcaf (correct), seq 1075:1218, ack 3364, win 19, options [nop,nop,TS val 107087478 ecr 487066488], length 143
16:17:42.484849 IP (tos 0x0, ttl 64, id 0, offset 0, flags [DF], proto TCP (6), length 52)
    172.25.187.30.53952 > 160.79.104.10.443: Flags [.], cksum 0xb568 (correct), ack 1218, win 7821, options [nop,nop,TS val 487066691 ecr 107087478], length 0
16:17:42.489258 IP (tos 0x2,ECT(0), ttl 54, id 23669, offset 0, flags [DF], proto TCP (6), length 105)
    160.79.104.10.443 > 172.25.187.30.53952: Flags [P.], cksum 0x7724 (correct), seq 1218:1271, ack 3364, win 19, options [nop,nop,TS val 107087484 ecr 487066488], length 53
16:17:42.489259 IP (tos 0x2,ECT(0), ttl 54, id 23670, offset 0, flags [DF], proto TCP (6), length 83)
    160.79.104.10.443 > 172.25.187.30.53952: Flags [P.], cksum 0xd711 (correct), seq 1271:1302, ack 3364, win 19, options [nop,nop,TS val 107087484 ecr 487066488], length 31
16:17:42.489352 IP (tos 0x0, ttl 64, id 0, offset 0, flags [DF], proto TCP (6), length 52)
    172.25.187.30.53952 > 160.79.104.10.443: Flags [.], cksum 0xb508 (correct), ack 1302, win 7822, options [nop,nop,TS val 487066696 ecr 107087484], length 0
16:17:44.564427 IP (tos 0x2,ECT(0), ttl 54, id 23671, offset 0, flags [DF], proto TCP (6), length 169)
    160.79.104.10.443 > 172.25.187.30.53952: Flags [P.], cksum 0xf817 (correct), seq 1302:1419, ack 3364, win 19, options [nop,nop,TS val 107089510 ecr 487066696], length 117
16:17:44.564427 IP (tos 0x2,ECT(0), ttl 54, id 23672, offset 0, flags [DF], proto TCP (6), length 432)
    160.79.104.10.443 > 172.25.187.30.53952: Flags [P.], cksum 0x34c2 (correct), seq 1419:1799, ack 3364, win 19, options [nop,nop,TS val 107089510 ecr 487066696], length 380
16:17:44.564428 IP (tos 0x0, ttl 54, id 23673, offset 0, flags [DF], proto TCP (6), length 432)
    160.79.104.10.443 > 172.25.187.30.53952: Flags [P.], cksum 0x34a8 (correct), seq 1419:1799, ack 3364, win 19, options [nop,nop,TS val 107089536 ecr 487066696], length 380
16:17:44.564558 IP (tos 0x0, ttl 64, id 0, offset 0, flags [DF], proto TCP (6), length 52)
    172.25.187.30.53952 > 160.79.104.10.443: Flags [.], cksum 0xa318 (correct), ack 1799, win 7816, options [nop,nop,TS val 487068771 ecr 107089510], length 0
16:17:44.564643 IP (tos 0x0, ttl 64, id 0, offset 0, flags [DF], proto TCP (6), length 64)
    172.25.187.30.53952 > 160.79.104.10.443: Flags [.], cksum 0x43c6 (correct), ack 1799, win 7816, options [nop,nop,TS val 487068771 ecr 107089536,nop,nop,sack 1 {1419:1799}], length 0
16:17:44.719037 IP (tos 0x2,ECT(0), ttl 54, id 23674, offset 0, flags [DF], proto TCP (6), length 114)
    160.79.104.10.443 > 172.25.187.30.53952: Flags [P.], cksum 0x5402 (correct), seq 1799:1861, ack 3364, win 19, options [nop,nop,TS val 107089713 ecr 487068771], length 62
16:17:44.719149 IP (tos 0x0, ttl 64, id 0, offset 0, flags [DF], proto TCP (6), length 52)
    172.25.187.30.53952 > 160.79.104.10.443: Flags [.], cksum 0xa16e (correct), ack 1861, win 7823, options [nop,nop,TS val 487068925 ecr 107089713], length 0
16:17:44.724480 IP (tos 0x2,ECT(0), ttl 54, id 23675, offset 0, flags [DF], proto TCP (6), length 106)
    160.79.104.10.443 > 172.25.187.30.53952: Flags [P.], cksum 0xaec7 (correct), seq 1861:1915, ack 3364, win 19, options [nop,nop,TS val 107089719 ecr 487068771], length 54
16:17:44.724577 IP (tos 0x0, ttl 64, id 0, offset 0, flags [DF], proto TCP (6), length 52)
    172.25.187.30.53952 > 160.79.104.10.443: Flags [.], cksum 0xa12c (correct), ack 1915, win 7823, options [nop,nop,TS val 487068931 ecr 107089719], length 0
16:17:44.783472 IP (tos 0x2,ECT(0), ttl 54, id 23676, offset 0, flags [DF], proto TCP (6), length 116)
    160.79.104.10.443 > 172.25.187.30.53952: Flags [P.], cksum 0xb3e1 (correct), seq 1915:1979, ack 3364, win 19, options [nop,nop,TS val 107089777 ecr 487068931], length 64
16:17:44.783580 IP (tos 0x0, ttl 64, id 0, offset 0, flags [DF], proto TCP (6), length 52)
    172.25.187.30.53952 > 160.79.104.10.443: Flags [.], cksum 0xa077 (correct), ack 1979, win 7823, options [nop,nop,TS val 487068990 ecr 107089777], length 0
16:17:44.902693 IP (tos 0x2,ECT(0), ttl 54, id 23677, offset 0, flags [DF], proto TCP (6), length 133)
    160.79.104.10.443 > 172.25.187.30.53952: Flags [P.], cksum 0xb3ba (correct), seq 1979:2060, ack 3364, win 19, options [nop,nop,TS val 107089897 ecr 487068990], length 81
16:17:44.902797 IP (tos 0x0, ttl 64, id 0, offset 0, flags [DF], proto TCP (6), length 52)
    172.25.187.30.53952 > 160.79.104.10.443: Flags [.], cksum 0x9f38 (correct), ack 2060, win 7822, options [nop,nop,TS val 487069109 ecr 107089897], length 0
16:17:45.029535 IP (tos 0x2,ECT(0), ttl 54, id 23678, offset 0, flags [DF], proto TCP (6), length 119)
    160.79.104.10.443 > 172.25.187.30.53952: Flags [P.], cksum 0xd1dc (correct), seq 2060:2127, ack 3364, win 19, options [nop,nop,TS val 107090023 ecr 487069109], length 67
16:17:45.029637 IP (tos 0x0, ttl 64, id 0, offset 0, flags [DF], proto TCP (6), length 52)
    172.25.187.30.53952 > 160.79.104.10.443: Flags [.], cksum 0x9df7 (correct), ack 2127, win 7823, options [nop,nop,TS val 487069236 ecr 107090023], length 0
16:17:45.038939 IP (tos 0x2,ECT(0), ttl 54, id 23679, offset 0, flags [DF], proto TCP (6), length 102)
    160.79.104.10.443 > 172.25.187.30.53952: Flags [P.], cksum 0xf93d (correct), seq 2127:2177, ack 3364, win 19, options [nop,nop,TS val 107090033 ecr 487069236], length 50
16:17:45.039034 IP (tos 0x0, ttl 64, id 0, offset 0, flags [DF], proto TCP (6), length 52)
    172.25.187.30.53952 > 160.79.104.10.443: Flags [.], cksum 0x9db2 (correct), ack 2177, win 7823, options [nop,nop,TS val 487069245 ecr 107090033], length 0
16:17:45.042812 IP (tos 0x2,ECT(0), ttl 54, id 23680, offset 0, flags [DF], proto TCP (6), length 107)
    160.79.104.10.443 > 172.25.187.30.53952: Flags [P.], cksum 0x4849 (correct), seq 2177:2232, ack 3364, win 19, options [nop,nop,TS val 107090037 ecr 487069236], length 55
16:17:45.042890 IP (tos 0x0, ttl 64, id 0, offset 0, flags [DF], proto TCP (6), length 52)
    172.25.187.30.53952 > 160.79.104.10.443: Flags [.], cksum 0x9d73 (correct), ack 2232, win 7823, options [nop,nop,TS val 487069249 ecr 107090037], length 0
16:17:45.127228 IP (tos 0x2,ECT(0), ttl 54, id 23681, offset 0, flags [DF], proto TCP (6), length 114)
    160.79.104.10.443 > 172.25.187.30.53952: Flags [P.], cksum 0xdc50 (correct), seq 2232:2294, ack 3364, win 19, options [nop,nop,TS val 107090121 ecr 487069249], length 62
16:17:45.127320 IP (tos 0x0, ttl 64, id 0, offset 0, flags [DF], proto TCP (6), length 52)
    172.25.187.30.53952 > 160.79.104.10.443: Flags [.], cksum 0x9c8c (correct), ack 2294, win 7823, options [nop,nop,TS val 487069334 ecr 107090121], length 0
16:17:45.132709 IP (tos 0x2,ECT(0), ttl 54, id 23682, offset 0, flags [DF], proto TCP (6), length 102)
    160.79.104.10.443 > 172.25.187.30.53952: Flags [P.], cksum 0xb1ed (correct), seq 2294:2344, ack 3364, win 19, options [nop,nop,TS val 107090128 ecr 487069249], length 50
16:17:45.132864 IP (tos 0x0, ttl 64, id 0, offset 0, flags [DF], proto TCP (6), length 52)
    172.25.187.30.53952 > 160.79.104.10.443: Flags [.], cksum 0x9c4d (correct), ack 2344, win 7824, options [nop,nop,TS val 487069339 ecr 107090128], length 0
16:17:45.299160 IP (tos 0x2,ECT(0), ttl 54, id 23683, offset 0, flags [DF], proto TCP (6), length 131)
    160.79.104.10.443 > 172.25.187.30.53952: Flags [P.], cksum 0x0ec5 (correct), seq 2344:2423, ack 3364, win 19, options [nop,nop,TS val 107090294 ecr 487069339], length 79
16:17:45.299345 IP (tos 0x0, ttl 64, id 0, offset 0, flags [DF], proto TCP (6), length 52)
    172.25.187.30.53952 > 160.79.104.10.443: Flags [.], cksum 0x9ab2 (correct), ack 2423, win 7824, options [nop,nop,TS val 487069505 ecr 107090294], length 0
16:17:45.304564 IP (tos 0x2,ECT(0), ttl 54, id 23684, offset 0, flags [DF], proto TCP (6), length 108)
    160.79.104.10.443 > 172.25.187.30.53952: Flags [P.], cksum 0x1de8 (correct), seq 2423:2479, ack 3364, win 19, options [nop,nop,TS val 107090298 ecr 487069339], length 56
16:17:45.304699 IP (tos 0x0, ttl 64, id 0, offset 0, flags [DF], proto TCP (6), length 52)
    172.25.187.30.53952 > 160.79.104.10.443: Flags [.], cksum 0x9a70 (correct), ack 2479, win 7824, options [nop,nop,TS val 487069511 ecr 107090298], length 0
16:17:45.377247 IP (tos 0x2,ECT(0), ttl 54, id 23685, offset 0, flags [DF], proto TCP (6), length 103)
    160.79.104.10.443 > 172.25.187.30.53952: Flags [P.], cksum 0xb9dc (correct), seq 2479:2530, ack 3364, win 19, options [nop,nop,TS val 107090371 ecr 487069511], length 51
16:17:45.377416 IP (tos 0x0, ttl 64, id 0, offset 0, flags [DF], proto TCP (6), length 52)
    172.25.187.30.53952 > 160.79.104.10.443: Flags [.], cksum 0x99ab (correct), ack 2530, win 7824, options [nop,nop,TS val 487069584 ecr 107090371], length 0
16:17:45.418222 IP (tos 0x2,ECT(0), ttl 54, id 23686, offset 0, flags [DF], proto TCP (6), length 108)
    160.79.104.10.443 > 172.25.187.30.53952: Flags [P.], cksum 0x29e7 (correct), seq 2530:2586, ack 3364, win 19, options [nop,nop,TS val 107090413 ecr 487069584], length 56
16:17:45.418341 IP (tos 0x0, ttl 64, id 0, offset 0, flags [DF], proto TCP (6), length 52)
    172.25.187.30.53952 > 160.79.104.10.443: Flags [.], cksum 0x9920 (correct), ack 2586, win 7824, options [nop,nop,TS val 487069625 ecr 107090413], length 0
16:17:45.478856 IP (tos 0x2,ECT(0), ttl 54, id 23687, offset 0, flags [DF], proto TCP (6), length 107)
    160.79.104.10.443 > 172.25.187.30.53952: Flags [P.], cksum 0xaa02 (correct), seq 2586:2641, ack 3364, win 19, options [nop,nop,TS val 107090472 ecr 487069625], length 55
16:17:45.479006 IP (tos 0x0, ttl 64, id 0, offset 0, flags [DF], proto TCP (6), length 52)
    172.25.187.30.53952 > 160.79.104.10.443: Flags [.], cksum 0x9872 (correct), ack 2641, win 7824, options [nop,nop,TS val 487069685 ecr 107090472], length 0
16:17:45.566702 IP (tos 0x2,ECT(0), ttl 54, id 23688, offset 0, flags [DF], proto TCP (6), length 106)
    160.79.104.10.443 > 172.25.187.30.53952: Flags [P.], cksum 0x0923 (correct), seq 2641:2695, ack 3364, win 19, options [nop,nop,TS val 107090561 ecr 487069685], length 54
16:17:45.566883 IP (tos 0x0, ttl 64, id 0, offset 0, flags [DF], proto TCP (6), length 52)
    172.25.187.30.53952 > 160.79.104.10.443: Flags [.], cksum 0x978b (correct), ack 2695, win 7824, options [nop,nop,TS val 487069773 ecr 107090561], length 0
16:17:45.599893 IP (tos 0x2,ECT(0), ttl 54, id 23689, offset 0, flags [DF], proto TCP (6), length 100)
    160.79.104.10.443 > 172.25.187.30.53952: Flags [P.], cksum 0x95a6 (correct), seq 2695:2743, ack 3364, win 19, options [nop,nop,TS val 107090593 ecr 487069773], length 48
16:17:45.600081 IP (tos 0x0, ttl 64, id 0, offset 0, flags [DF], proto TCP (6), length 52)
    172.25.187.30.53952 > 160.79.104.10.443: Flags [.], cksum 0x971a (correct), ack 2743, win 7824, options [nop,nop,TS val 487069806 ecr 107090593], length 0
16:17:45.650720 IP (tos 0x2,ECT(0), ttl 54, id 23690, offset 0, flags [DF], proto TCP (6), length 101)
    160.79.104.10.443 > 172.25.187.30.53952: Flags [P.], cksum 0x4405 (correct), seq 2743:2792, ack 3364, win 19, options [nop,nop,TS val 107090646 ecr 487069806], length 49
16:17:45.650899 IP (tos 0x0, ttl 64, id 0, offset 0, flags [DF], proto TCP (6), length 52)
    172.25.187.30.53952 > 160.79.104.10.443: Flags [.], cksum 0x9681 (correct), ack 2792, win 7824, options [nop,nop,TS val 487069857 ecr 107090646], length 0
16:17:45.791174 IP (tos 0x2,ECT(0), ttl 54, id 23691, offset 0, flags [DF], proto TCP (6), length 104)
    160.79.104.10.443 > 172.25.187.30.53952: Flags [P.], cksum 0x191a (correct), seq 2792:2844, ack 3364, win 19, options [nop,nop,TS val 107090785 ecr 487069857], length 52
16:17:45.791358 IP (tos 0x0, ttl 64, id 0, offset 0, flags [DF], proto TCP (6), length 52)
    172.25.187.30.53952 > 160.79.104.10.443: Flags [.], cksum 0x9536 (correct), ack 2844, win 7824, options [nop,nop,TS val 487069997 ecr 107090785], length 0
16:17:45.802714 IP (tos 0x2,ECT(0), ttl 54, id 23692, offset 0, flags [DF], proto TCP (6), length 108)
    160.79.104.10.443 > 172.25.187.30.53952: Flags [P.], cksum 0xab39 (correct), seq 2844:2900, ack 3364, win 19, options [nop,nop,TS val 107090798 ecr 487069997], length 56
16:17:45.802899 IP (tos 0x0, ttl 64, id 0, offset 0, flags [DF], proto TCP (6), length 52)
    172.25.187.30.53952 > 160.79.104.10.443: Flags [.], cksum 0x94e5 (correct), ack 2900, win 7824, options [nop,nop,TS val 487070009 ecr 107090798], length 0
16:17:46.103117 IP (tos 0x2,ECT(0), ttl 54, id 23693, offset 0, flags [DF], proto TCP (6), length 110)
    160.79.104.10.443 > 172.25.187.30.53952: Flags [P.], cksum 0xb169 (correct), seq 2900:2958, ack 3364, win 19, options [nop,nop,TS val 107091054 ecr 487070009], length 58
16:17:46.103650 IP (tos 0x0, ttl 64, id 0, offset 0, flags [DF], proto TCP (6), length 52)
    172.25.187.30.53952 > 160.79.104.10.443: Flags [.], cksum 0x927f (correct), ack 2958, win 7824, options [nop,nop,TS val 487070309 ecr 107091054], length 0
16:17:46.187726 IP (tos 0x2,ECT(0), ttl 54, id 23694, offset 0, flags [DF], proto TCP (6), length 345)
    160.79.104.10.443 > 172.25.187.30.53952: Flags [P.], cksum 0xf906 (correct), seq 2958:3251, ack 3364, win 19, options [nop,nop,TS val 107091182 ecr 487070309], length 293
16:17:46.187987 IP (tos 0x0, ttl 64, id 0, offset 0, flags [DF], proto TCP (6), length 52)
    172.25.187.30.53952 > 160.79.104.10.443: Flags [.], cksum 0x9085 (correct), ack 3251, win 7824, options [nop,nop,TS val 487070394 ecr 107091182], length 0
16:17:46.236707 IP (tos 0x2,ECT(0), ttl 54, id 23695, offset 0, flags [DF], proto TCP (6), length 129)
    160.79.104.10.443 > 172.25.187.30.53952: Flags [P.], cksum 0xc382 (correct), seq 3251:3328, ack 3364, win 19, options [nop,nop,TS val 107091230 ecr 487070394], length 77
16:17:46.236909 IP (tos 0x0, ttl 64, id 0, offset 0, flags [DF], proto TCP (6), length 52)
    172.25.187.30.53952 > 160.79.104.10.443: Flags [.], cksum 0x8fd7 (correct), ack 3328, win 7824, options [nop,nop,TS val 487070443 ecr 107091230], length 0
16:17:46.390948 IP (tos 0x2,ECT(0), ttl 54, id 23696, offset 0, flags [DF], proto TCP (6), length 120)
    160.79.104.10.443 > 172.25.187.30.53952: Flags [P.], cksum 0x1d30 (correct), seq 3328:3396, ack 3364, win 19, options [nop,nop,TS val 107091385 ecr 487070443], length 68
16:17:46.391135 IP (tos 0x0, ttl 64, id 0, offset 0, flags [DF], proto TCP (6), length 52)
    172.25.187.30.53952 > 160.79.104.10.443: Flags [.], cksum 0x8e5e (correct), ack 3396, win 7824, options [nop,nop,TS val 487070597 ecr 107091385], length 0
16:17:46.465636 IP (tos 0x2,ECT(0), ttl 54, id 23697, offset 0, flags [DF], proto TCP (6), length 108)
    160.79.104.10.443 > 172.25.187.30.53952: Flags [P.], cksum 0x02a3 (correct), seq 3396:3452, ack 3364, win 19, options [nop,nop,TS val 107091461 ecr 487070597], length 56
16:17:46.465637 IP (tos 0x2,ECT(0), ttl 54, id 23698, offset 0, flags [DF], proto TCP (6), length 106)
    160.79.104.10.443 > 172.25.187.30.53952: Flags [P.], cksum 0xd701 (correct), seq 3452:3506, ack 3364, win 19, options [nop,nop,TS val 107091461 ecr 487070597], length 54
16:17:46.465847 IP (tos 0x0, ttl 64, id 0, offset 0, flags [DF], proto TCP (6), length 52)
    172.25.187.30.53952 > 160.79.104.10.443: Flags [.], cksum 0x8d59 (correct), ack 3506, win 7824, options [nop,nop,TS val 487070672 ecr 107091461], length 0
16:17:46.553045 IP (tos 0x2,ECT(0), ttl 54, id 23699, offset 0, flags [DF], proto TCP (6), length 107)
    160.79.104.10.443 > 172.25.187.30.53952: Flags [P.], cksum 0xa496 (correct), seq 3506:3561, ack 3364, win 19, options [nop,nop,TS val 107091548 ecr 487070672], length 55
16:17:46.553204 IP (tos 0x0, ttl 64, id 0, offset 0, flags [DF], proto TCP (6), length 52)
    172.25.187.30.53952 > 160.79.104.10.443: Flags [.], cksum 0x8c74 (correct), ack 3561, win 7824, options [nop,nop,TS val 487070759 ecr 107091548], length 0
16:17:46.664265 IP (tos 0x2,ECT(0), ttl 54, id 23700, offset 0, flags [DF], proto TCP (6), length 135)
    160.79.104.10.443 > 172.25.187.30.53952: Flags [P.], cksum 0xa0ba (correct), seq 3561:3644, ack 3364, win 19, options [nop,nop,TS val 107091659 ecr 487070759], length 83
16:17:46.664428 IP (tos 0x0, ttl 64, id 0, offset 0, flags [DF], proto TCP (6), length 52)
    172.25.187.30.53952 > 160.79.104.10.443: Flags [.], cksum 0x8b42 (correct), ack 3644, win 7824, options [nop,nop,TS val 487070871 ecr 107091659], length 0
16:17:46.795199 IP (tos 0x2,ECT(0), ttl 54, id 23701, offset 0, flags [DF], proto TCP (6), length 146)
    160.79.104.10.443 > 172.25.187.30.53952: Flags [P.], cksum 0xbb0c (correct), seq 3644:3738, ack 3364, win 19, options [nop,nop,TS val 107091789 ecr 487070871], length 94
16:17:46.795387 IP (tos 0x0, ttl 64, id 0, offset 0, flags [DF], proto TCP (6), length 52)
    172.25.187.30.53952 > 160.79.104.10.443: Flags [.], cksum 0x89df (correct), ack 3738, win 7824, options [nop,nop,TS val 487071002 ecr 107091789], length 0
16:17:46.830404 IP (tos 0x2,ECT(0), ttl 54, id 23702, offset 0, flags [DF], proto TCP (6), length 124)
    160.79.104.10.443 > 172.25.187.30.53952: Flags [P.], cksum 0x9822 (correct), seq 3738:3810, ack 3364, win 19, options [nop,nop,TS val 107091825 ecr 487071002], length 72
16:17:46.830582 IP (tos 0x0, ttl 64, id 0, offset 0, flags [DF], proto TCP (6), length 52)
    172.25.187.30.53952 > 160.79.104.10.443: Flags [.], cksum 0x8950 (correct), ack 3810, win 7824, options [nop,nop,TS val 487071037 ecr 107091825], length 0
16:17:46.889031 IP (tos 0x2,ECT(0), ttl 54, id 23703, offset 0, flags [DF], proto TCP (6), length 130)
    160.79.104.10.443 > 172.25.187.30.53952: Flags [P.], cksum 0x3388 (correct), seq 3810:3888, ack 3364, win 19, options [nop,nop,TS val 107091883 ecr 487071037], length 78
16:17:46.889226 IP (tos 0x0, ttl 64, id 0, offset 0, flags [DF], proto TCP (6), length 52)
    172.25.187.30.53952 > 160.79.104.10.443: Flags [.], cksum 0x888e (correct), ack 3888, win 7824, options [nop,nop,TS val 487071095 ecr 107091883], length 0
16:17:46.945550 IP (tos 0x2,ECT(0), ttl 54, id 23704, offset 0, flags [DF], proto TCP (6), length 111)
    160.79.104.10.443 > 172.25.187.30.53952: Flags [P.], cksum 0x3ef9 (correct), seq 3888:3947, ack 3364, win 19, options [nop,nop,TS val 107091939 ecr 487071095], length 59
16:17:46.945715 IP (tos 0x0, ttl 64, id 0, offset 0, flags [DF], proto TCP (6), length 52)
    172.25.187.30.53952 > 160.79.104.10.443: Flags [.], cksum 0x87e2 (correct), ack 3947, win 7824, options [nop,nop,TS val 487071152 ecr 107091939], length 0
16:17:46.997239 IP (tos 0x2,ECT(0), ttl 64, id 0, offset 0, flags [DF], proto TCP (6), length 360)
    172.25.187.30.53952 > 160.79.104.10.443: Flags [P.], cksum 0x809e (correct), seq 3364:3672, ack 3947, win 7824, options [nop,nop,TS val 487071203 ecr 107091939], length 308
16:17:46.997418 IP (tos 0x2,ECT(0), ttl 64, id 0, offset 0, flags [DF], proto TCP (6), length 225)
    172.25.187.30.53952 > 160.79.104.10.443: Flags [P.], cksum 0x3622 (correct), seq 3672:3845, ack 3947, win 7824, options [nop,nop,TS val 487071203 ecr 107091939], length 173
16:17:47.004059 IP (tos 0x0, ttl 54, id 23705, offset 0, flags [DF], proto TCP (6), length 52)
    160.79.104.10.443 > 172.25.187.30.53952: Flags [.], cksum 0xa4bc (correct), ack 3672, win 19, options [nop,nop,TS val 107091999 ecr 487071203], length 0
16:17:47.005617 IP (tos 0x0, ttl 54, id 23706, offset 0, flags [DF], proto TCP (6), length 52)
    160.79.104.10.443 > 172.25.187.30.53952: Flags [.], cksum 0xa40e (correct), ack 3845, win 19, options [nop,nop,TS val 107092000 ecr 487071203], length 0
16:17:47.011564 IP (tos 0x2,ECT(0), ttl 54, id 23707, offset 0, flags [DF], proto TCP (6), length 128)
    160.79.104.10.443 > 172.25.187.30.53952: Flags [P.], cksum 0xca08 (correct), seq 3947:4023, ack 3845, win 19, options [nop,nop,TS val 107092005 ecr 487071203], length 76
16:17:47.011641 IP (tos 0x0, ttl 64, id 0, offset 0, flags [DF], proto TCP (6), length 52)
    172.25.187.30.53952 > 160.79.104.10.443: Flags [.], cksum 0x8531 (correct), ack 4023, win 7824, options [nop,nop,TS val 487071218 ecr 107092005], length 0
16:17:47.014910 IP (tos 0x2,ECT(0), ttl 64, id 0, offset 0, flags [DF], proto TCP (6), length 251)
    172.25.187.30.53952 > 160.79.104.10.443: Flags [P.], cksum 0x97cd (correct), seq 3845:4044, ack 4023, win 7824, options [nop,nop,TS val 487071221 ecr 107092005], length 199
16:17:47.029884 IP (tos 0x0, ttl 64, id 0, offset 0, flags [DF], proto TCP (6), length 64)
    172.25.187.30.53975 > 160.79.104.10.443: Flags [S], cksum 0x5652 (correct), seq 2666247089, win 65535, options [mss 1460,nop,wscale 6,nop,nop,TS val 3477568160 ecr 0,sackOK,eol], length 0
16:17:47.036989 IP (tos 0x0, ttl 54, id 0, offset 0, flags [DF], proto TCP (6), length 60)
    160.79.104.10.443 > 172.25.187.30.53975: Flags [S.], cksum 0x7fdb (correct), seq 2467260386, ack 2666247090, win 65535, options [mss 1386,sackOK,TS val 1242079923 ecr 3477568160,nop,wscale 13], length 0
16:17:47.037045 IP (tos 0x0, ttl 64, id 0, offset 0, flags [DF], proto TCP (6), length 52)
    172.25.187.30.53975 > 160.79.104.10.443: Flags [.], cksum 0xa64f (correct), ack 1, win 2061, options [nop,nop,TS val 3477568167 ecr 1242079923], length 0
16:17:47.037175 IP (tos 0x0, ttl 64, id 0, offset 0, flags [DF], proto TCP (6), length 1426)
    172.25.187.30.53975 > 160.79.104.10.443: Flags [.], cksum 0xe858 (correct), seq 1:1375, ack 1, win 2061, options [nop,nop,TS val 3477568167 ecr 1242079923], length 1374
16:17:47.037184 IP (tos 0x0, ttl 64, id 0, offset 0, flags [DF], proto TCP (6), length 445)
    172.25.187.30.53975 > 160.79.104.10.443: Flags [P.], cksum 0xe2b1 (correct), seq 1375:1768, ack 1, win 2061, options [nop,nop,TS val 3477568167 ecr 1242079923], length 393
16:17:47.044697 IP (tos 0x0, ttl 54, id 57555, offset 0, flags [DF], proto TCP (6), length 64)
    160.79.104.10.443 > 172.25.187.30.53975: Flags [.], cksum 0xc6ab (correct), ack 1, win 16, options [nop,nop,TS val 1242079931 ecr 3477568167,nop,nop,sack 1 {1375:1768}], length 0
16:17:47.044698 IP (tos 0x0, ttl 54, id 57556, offset 0, flags [DF], proto TCP (6), length 52)
    160.79.104.10.443 > 172.25.187.30.53975: Flags [.], cksum 0xa75d (correct), ack 1768, win 16, options [nop,nop,TS val 1242079931 ecr 3477568167], length 0
16:17:47.044755 IP (tos 0x0, ttl 64, id 0, offset 0, flags [DF], proto TCP (6), length 1426)
    172.25.187.30.53975 > 160.79.104.10.443: Flags [.], cksum 0xe848 (correct), seq 1:1375, ack 1, win 2061, options [nop,nop,TS val 3477568175 ecr 1242079931], length 1374
16:17:47.048971 IP (tos 0x0, ttl 54, id 57557, offset 0, flags [DF], proto TCP (6), length 1426)
    160.79.104.10.443 > 172.25.187.30.53975: Flags [.], cksum 0x9123 (correct), seq 1:1375, ack 1768, win 16, options [nop,nop,TS val 1242079935 ecr 3477568167], length 1374
16:17:47.048971 IP (tos 0x0, ttl 54, id 57558, offset 0, flags [DF], proto TCP (6), length 1426)
    160.79.104.10.443 > 172.25.187.30.53975: Flags [.], cksum 0xe33d (correct), seq 1375:2749, ack 1768, win 16, options [nop,nop,TS val 1242079935 ecr 3477568167], length 1374
16:17:47.049015 IP (tos 0x0, ttl 64, id 0, offset 0, flags [DF], proto TCP (6), length 52)
    172.25.187.30.53975 > 160.79.104.10.443: Flags [.], cksum 0x94bf (correct), ack 2749, win 2019, options [nop,nop,TS val 3477568178 ecr 1242079935], length 0
16:17:47.050704 IP (tos 0x0, ttl 54, id 57559, offset 0, flags [DF], proto TCP (6), length 800)
    160.79.104.10.443 > 172.25.187.30.53975: Flags [P.], cksum 0x7e95 (correct), seq 2749:3497, ack 1768, win 16, options [nop,nop,TS val 1242079935 ecr 3477568167], length 748
16:17:47.050751 IP (tos 0x0, ttl 64, id 0, offset 0, flags [DF], proto TCP (6), length 52)
    172.25.187.30.53975 > 160.79.104.10.443: Flags [.], cksum 0x91be (correct), ack 3497, win 2037, options [nop,nop,TS val 3477568181 ecr 1242079935], length 0
16:17:47.051858 IP (tos 0x0, ttl 64, id 0, offset 0, flags [DF], proto TCP (6), length 116)
    172.25.187.30.53975 > 160.79.104.10.443: Flags [P.], cksum 0xff03 (correct), seq 1768:1832, ack 3497, win 2048, options [nop,nop,TS val 3477568182 ecr 1242079935], length 64
16:17:47.052472 IP (tos 0x0, ttl 54, id 57560, offset 0, flags [DF], proto TCP (6), length 64)
    160.79.104.10.443 > 172.25.187.30.53975: Flags [.], cksum 0xb8fd (correct), ack 1768, win 16, options [nop,nop,TS val 1242079937 ecr 3477568167,nop,nop,sack 1 {1:1375}], length 0
16:17:47.056692 IP (tos 0x2,ECT(0), ttl 54, id 23708, offset 0, flags [DF], proto TCP (6), length 122)
    160.79.104.10.443 > 172.25.187.30.53952: Flags [P.], cksum 0x9215 (correct), seq 4023:4093, ack 4044, win 19, options [nop,nop,TS val 107092051 ecr 487071221], length 70
16:17:47.056745 IP (tos 0x0, ttl 64, id 0, offset 0, flags [DF], proto TCP (6), length 52)
    172.25.187.30.53952 > 160.79.104.10.443: Flags [.], cksum 0x83ca (correct), ack 4093, win 7823, options [nop,nop,TS val 487071263 ecr 107092051], length 0
16:17:47.057544 IP (tos 0x0, ttl 54, id 57561, offset 0, flags [DF], proto TCP (6), length 52)
    160.79.104.10.443 > 172.25.187.30.53975: Flags [.], cksum 0x9959 (correct), ack 1832, win 16, options [nop,nop,TS val 1242079944 ecr 3477568182], length 0
16:17:47.057544 IP (tos 0x0, ttl 54, id 57562, offset 0, flags [DF], proto TCP (6), length 564)
    160.79.104.10.443 > 172.25.187.30.53975: Flags [P.], cksum 0x580a (correct), seq 3497:4009, ack 1832, win 16, options [nop,nop,TS val 1242079944 ecr 3477568182], length 512
16:17:47.057574 IP (tos 0x0, ttl 64, id 0, offset 0, flags [DF], proto TCP (6), length 52)
    172.25.187.30.53975 > 160.79.104.10.443: Flags [.], cksum 0x8f6c (correct), ack 4009, win 2040, options [nop,nop,TS val 3477568187 ecr 1242079944], length 0
16:17:47.063669 IP (tos 0x0, ttl 64, id 0, offset 0, flags [DF], proto TCP (6), length 144)
    172.25.187.30.53975 > 160.79.104.10.443: Flags [P.], cksum 0x6638 (correct), seq 1832:1924, ack 4009, win 2048, options [nop,nop,TS val 3477568194 ecr 1242079944], length 92
16:17:47.063762 IP (tos 0x0, ttl 64, id 0, offset 0, flags [DF], proto TCP (6), length 611)
    172.25.187.30.53975 > 160.79.104.10.443: Flags [P.], cksum 0xabca (correct), seq 1924:2483, ack 4009, win 2048, options [nop,nop,TS val 3477568194 ecr 1242079944], length 559
16:17:47.063802 IP (tos 0x0, ttl 64, id 0, offset 0, flags [DF], proto TCP (6), length 83)
    172.25.187.30.53975 > 160.79.104.10.443: Flags [P.], cksum 0x31e6 (correct), seq 2483:2514, ack 4009, win 2048, options [nop,nop,TS val 3477568194 ecr 1242079944], length 31
16:17:47.070201 IP (tos 0x0, ttl 54, id 57563, offset 0, flags [DF], proto TCP (6), length 83)
    160.79.104.10.443 > 172.25.187.30.53975: Flags [P.], cksum 0x2688 (correct), seq 4009:4040, ack 1924, win 16, options [nop,nop,TS val 1242079956 ecr 3477568194], length 31
16:17:47.070263 IP (tos 0x0, ttl 64, id 0, offset 0, flags [DF], proto TCP (6), length 52)
    172.25.187.30.53975 > 160.79.104.10.443: Flags [.], cksum 0x8c81 (correct), ack 4040, win 2048, options [nop,nop,TS val 3477568201 ecr 1242079956], length 0
16:17:47.072066 IP (tos 0x0, ttl 54, id 57564, offset 0, flags [DF], proto TCP (6), length 52)
    160.79.104.10.443 > 172.25.187.30.53975: Flags [.], cksum 0x9477 (correct), ack 2514, win 16, options [nop,nop,TS val 1242079957 ecr 3477568194], length 0
16:17:47.113530 IP (tos 0x2,ECT(0), ttl 54, id 23709, offset 0, flags [DF], proto TCP (6), length 120)
    160.79.104.10.443 > 172.25.187.30.53952: Flags [P.], cksum 0x620d (correct), seq 4093:4161, ack 4044, win 19, options [nop,nop,TS val 107092108 ecr 487071263], length 68
16:17:47.113610 IP (tos 0x0, ttl 64, id 0, offset 0, flags [DF], proto TCP (6), length 52)
    172.25.187.30.53952 > 160.79.104.10.443: Flags [.], cksum 0x8313 (correct), ack 4161, win 7824, options [nop,nop,TS val 487071320 ecr 107092108], length 0
16:17:47.114945 IP (tos 0x2,ECT(0), ttl 64, id 0, offset 0, flags [DF], proto TCP (6), length 87)
    172.25.187.30.53952 > 160.79.104.10.443: Flags [P.], cksum 0x7fdc (correct), seq 4044:4079, ack 4161, win 7824, options [nop,nop,TS val 487071321 ecr 107092108], length 35
16:17:47.126642 IP (tos 0x2,ECT(0), ttl 54, id 23710, offset 0, flags [DF], proto TCP (6), length 230)
