tcpdump: data link type PKTAP
tcpdump: WARNING: snaplen raised from 96 to 524288
tcpdump: listening on pktap, link-type PKTAP (Apple DLT_PKTAP), snapshot length 524288 bytes
09:06:53.116744 IP (tos 0x0, ttl 64, id 0, offset 0, flags [DF], proto TCP (6), length 463)
    172.25.186.179.55410 > 160.79.104.10.443: Flags [P.], cksum 0xc5f8 (correct), seq 557133288:557133699, ack 2250202952, win 9090, options [nop,nop,TS val 2464314024 ecr 1201733337], length 411
09:06:53.123984 IP (tos 0x0, ttl 54, id 36978, offset 0, flags [DF], proto TCP (6), length 52)
    160.79.104.10.443 > 172.25.186.179.55410: Flags [.], cksum 0x948a (correct), ack 411, win 35, options [nop,nop,TS val 1201739119 ecr 2464314024], length 0
09:06:53.551982 IP (tos 0x0, ttl 54, id 36979, offset 0, flags [DF], proto TCP (6), length 177)
    160.79.104.10.443 > 172.25.186.179.55410: Flags [P.], cksum 0x2038 (correct), seq 1:126, ack 411, win 35, options [nop,nop,TS val 1201739547 ecr 2464314024], length 125
09:06:53.551982 IP (tos 0x0, ttl 54, id 36980, offset 0, flags [DF], proto TCP (6), length 144)
    160.79.104.10.443 > 172.25.186.179.55410: Flags [P.], cksum 0xbd73 (correct), seq 126:218, ack 411, win 35, options [nop,nop,TS val 1201739547 ecr 2464314024], length 92
09:06:53.551983 IP (tos 0x0, ttl 54, id 36981, offset 0, flags [DF], proto TCP (6), length 90)
    160.79.104.10.443 > 172.25.186.179.55410: Flags [P.], cksum 0x6be4 (correct), seq 218:256, ack 411, win 35, options [nop,nop,TS val 1201739547 ecr 2464314024], length 38
09:06:53.551983 IP (tos 0x0, ttl 54, id 36982, offset 0, flags [DF], proto TCP (6), length 83)
    160.79.104.10.443 > 172.25.186.179.55410: Flags [P.], cksum 0xaac2 (correct), seq 256:287, ack 411, win 35, options [nop,nop,TS val 1201739547 ecr 2464314024], length 31
09:06:53.552099 IP (tos 0x0, ttl 64, id 0, offset 0, flags [DF], proto TCP (6), length 52)
    172.25.186.179.55410 > 160.79.104.10.443: Flags [.], cksum 0x6cb2 (correct), ack 287, win 9086, options [nop,nop,TS val 2464314459 ecr 1201739547], length 0
09:06:53.553631 IP (tos 0x0, ttl 64, id 0, offset 0, flags [DF], proto TCP (6), length 87)
    172.25.186.179.55410 > 160.79.104.10.443: Flags [P.], cksum 0x3c60 (correct), seq 411:446, ack 287, win 9090, options [nop,nop,TS val 2464314461 ecr 1201739547], length 35
09:06:53.560259 IP (tos 0x0, ttl 54, id 36983, offset 0, flags [DF], proto TCP (6), length 52)
    160.79.104.10.443 > 172.25.186.179.55410: Flags [.], cksum 0x8fe0 (correct), ack 446, win 35, options [nop,nop,TS val 1201739555 ecr 2464314461], length 0
09:06:55.415982 IP (tos 0x0, ttl 64, id 0, offset 0, flags [DF], proto TCP (6), length 977)
    172.25.186.179.55410 > 160.79.104.10.443: Flags [P.], cksum 0xd756 (correct), seq 446:1371, ack 287, win 9090, options [nop,nop,TS val 2464316323 ecr 1201739555], length 925
09:06:55.425125 IP (tos 0x0, ttl 54, id 36984, offset 0, flags [DF], proto TCP (6), length 52)
    160.79.104.10.443 > 172.25.186.179.55410: Flags [.], cksum 0x7db3 (correct), ack 1371, win 35, options [nop,nop,TS val 1201741421 ecr 2464316323], length 0
09:06:55.595714 IP (tos 0x0, ttl 54, id 36985, offset 0, flags [DF], proto TCP (6), length 168)
    160.79.104.10.443 > 172.25.186.179.55410: Flags [P.], cksum 0x8a51 (correct), seq 287:403, ack 1371, win 35, options [nop,nop,TS val 1201741589 ecr 2464316323], length 116
09:06:55.595715 IP (tos 0x0, ttl 54, id 36986, offset 0, flags [DF], proto TCP (6), length 144)
    160.79.104.10.443 > 172.25.186.179.55410: Flags [P.], cksum 0xd7ed (correct), seq 403:495, ack 1371, win 35, options [nop,nop,TS val 1201741589 ecr 2464316323], length 92
09:06:55.595716 IP (tos 0x0, ttl 54, id 36987, offset 0, flags [DF], proto TCP (6), length 90)
    160.79.104.10.443 > 172.25.186.179.55410: Flags [P.], cksum 0xfff4 (correct), seq 495:533, ack 1371, win 35, options [nop,nop,TS val 1201741589 ecr 2464316323], length 38
09:06:55.595716 IP (tos 0x0, ttl 54, id 36988, offset 0, flags [DF], proto TCP (6), length 83)
    160.79.104.10.443 > 172.25.186.179.55410: Flags [P.], cksum 0x8e53 (correct), seq 533:564, ack 1371, win 35, options [nop,nop,TS val 1201741589 ecr 2464316323], length 31
09:06:55.595829 IP (tos 0x0, ttl 64, id 0, offset 0, flags [DF], proto TCP (6), length 52)
    172.25.186.179.55410 > 160.79.104.10.443: Flags [.], cksum 0x57e7 (correct), ack 564, win 9086, options [nop,nop,TS val 2464316503 ecr 1201741589], length 0
09:06:57.432904 IP (tos 0x0, ttl 64, id 0, offset 0, flags [DF], proto TCP (6), length 1069)
    172.25.186.179.55410 > 160.79.104.10.443: Flags [P.], cksum 0xb36a (correct), seq 1371:2388, ack 564, win 9090, options [nop,nop,TS val 2464318340 ecr 1201741589], length 1017
09:06:57.433021 IP (tos 0x0, ttl 64, id 0, offset 0, flags [DF], proto TCP (6), length 727)
    172.25.186.179.55410 > 160.79.104.10.443: Flags [P.], cksum 0x40d4 (correct), seq 2388:3063, ack 564, win 9090, options [nop,nop,TS val 2464318340 ecr 1201741589], length 675
09:06:57.443130 IP (tos 0x0, ttl 54, id 36989, offset 0, flags [DF], proto TCP (6), length 52)
    160.79.104.10.443 > 172.25.186.179.55410: Flags [.], cksum 0x68e3 (correct), ack 2388, win 35, options [nop,nop,TS val 1201743438 ecr 2464318340], length 0
09:06:57.443131 IP (tos 0x0, ttl 54, id 36990, offset 0, flags [DF], proto TCP (6), length 52)
    160.79.104.10.443 > 172.25.186.179.55410: Flags [.], cksum 0x6640 (correct), ack 3063, win 35, options [nop,nop,TS val 1201743438 ecr 2464318340], length 0
09:06:58.417052 IP (tos 0x0, ttl 64, id 0, offset 0, flags [DF], proto TCP (6), length 328)
    172.25.186.179.55410 > 160.79.104.10.443: Flags [P.], cksum 0x6828 (correct), seq 3063:3339, ack 564, win 9090, options [nop,nop,TS val 2464319324 ecr 1201743438], length 276
09:06:58.427153 IP (tos 0x0, ttl 54, id 36991, offset 0, flags [DF], proto TCP (6), length 52)
    160.79.104.10.443 > 172.25.186.179.55410: Flags [.], cksum 0x5d7c (correct), ack 3339, win 35, options [nop,nop,TS val 1201744422 ecr 2464319324], length 0
09:06:58.564558 IP (tos 0x0, ttl 54, id 36992, offset 0, flags [DF], proto TCP (6), length 168)
    160.79.104.10.443 > 172.25.186.179.55410: Flags [P.], cksum 0xd40c (correct), seq 564:680, ack 3339, win 35, options [nop,nop,TS val 1201744560 ecr 2464319324], length 116
09:06:58.564560 IP (tos 0x0, ttl 54, id 36993, offset 0, flags [DF], proto TCP (6), length 144)
    160.79.104.10.443 > 172.25.186.179.55410: Flags [P.], cksum 0x0948 (correct), seq 680:772, ack 3339, win 35, options [nop,nop,TS val 1201744560 ecr 2464319324], length 92
09:06:58.564679 IP (tos 0x0, ttl 64, id 0, offset 0, flags [DF], proto TCP (6), length 52)
    172.25.186.179.55410 > 160.79.104.10.443: Flags [.], cksum 0x3833 (correct), ack 772, win 9087, options [nop,nop,TS val 2464319471 ecr 1201744560], length 0
09:06:58.564757 IP (tos 0x0, ttl 54, id 36994, offset 0, flags [DF], proto TCP (6), length 90)
    160.79.104.10.443 > 172.25.186.179.55410: Flags [P.], cksum 0xa512 (correct), seq 772:810, ack 3339, win 35, options [nop,nop,TS val 1201744560 ecr 2464319324], length 38
09:06:58.564811 IP (tos 0x0, ttl 64, id 0, offset 0, flags [DF], proto TCP (6), length 52)
    172.25.186.179.55410 > 160.79.104.10.443: Flags [.], cksum 0x380d (correct), ack 810, win 9087, options [nop,nop,TS val 2464319471 ecr 1201744560], length 0
09:06:58.565023 IP (tos 0x0, ttl 54, id 36995, offset 0, flags [DF], proto TCP (6), length 83)
    160.79.104.10.443 > 172.25.186.179.55410: Flags [P.], cksum 0x8935 (correct), seq 810:841, ack 3339, win 35, options [nop,nop,TS val 1201744560 ecr 2464319324], length 31
09:06:58.565054 IP (tos 0x0, ttl 64, id 0, offset 0, flags [DF], proto TCP (6), length 52)
    172.25.186.179.55410 > 160.79.104.10.443: Flags [.], cksum 0x37eb (correct), ack 841, win 9090, options [nop,nop,TS val 2464319471 ecr 1201744560], length 0
09:06:58.566014 IP (tos 0x0, ttl 64, id 0, offset 0, flags [DF], proto TCP (6), length 87)
    172.25.186.179.55410 > 160.79.104.10.443: Flags [P.], cksum 0x42ce (correct), seq 3339:3374, ack 841, win 9090, options [nop,nop,TS val 2464319473 ecr 1201744560], length 35
09:06:58.572838 IP (tos 0x0, ttl 54, id 36996, offset 0, flags [DF], proto TCP (6), length 52)
    160.79.104.10.443 > 172.25.186.179.55410: Flags [.], cksum 0x5b1e (correct), ack 3374, win 35, options [nop,nop,TS val 1201744567 ecr 2464319473], length 0
09:06:59.166494 IP (tos 0x0, ttl 64, id 0, offset 0, flags [DF], proto TCP (6), length 256)
    172.25.186.179.55410 > 160.79.104.10.443: Flags [P.], cksum 0x2b36 (correct), seq 3374:3578, ack 841, win 9090, options [nop,nop,TS val 2464320073 ecr 1201744567], length 204
09:06:59.238344 IP (tos 0x0, ttl 54, id 36997, offset 0, flags [DF], proto TCP (6), length 52)
    160.79.104.10.443 > 172.25.186.179.55410: Flags [.], cksum 0x5560 (correct), ack 3578, win 35, options [nop,nop,TS val 1201745233 ecr 2464320073], length 0
09:06:59.917042 IP (tos 0x0, ttl 64, id 0, offset 0, flags [DF], proto TCP (6), length 462)
    172.25.186.179.55410 > 160.79.104.10.443: Flags [P.], cksum 0xda69 (correct), seq 3578:3988, ack 841, win 9090, options [nop,nop,TS val 2464320824 ecr 1201745233], length 410
09:06:59.927229 IP (tos 0x0, ttl 54, id 36998, offset 0, flags [DF], proto TCP (6), length 52)
    160.79.104.10.443 > 172.25.186.179.55410: Flags [.], cksum 0x4e26 (correct), ack 3988, win 35, options [nop,nop,TS val 1201745922 ecr 2464320824], length 0
09:06:59.978935 IP (tos 0x0, ttl 54, id 36999, offset 0, flags [DF], proto TCP (6), length 238)
    160.79.104.10.443 > 172.25.186.179.55410: Flags [P.], cksum 0x3590 (correct), seq 841:1027, ack 3988, win 35, options [nop,nop,TS val 1201745974 ecr 2464320824], length 186
09:06:59.978936 IP (tos 0x0, ttl 54, id 37000, offset 0, flags [DF], proto TCP (6), length 144)
    160.79.104.10.443 > 172.25.186.179.55410: Flags [P.], cksum 0xa4fd (correct), seq 1027:1119, ack 3988, win 35, options [nop,nop,TS val 1201745974 ecr 2464320824], length 92
09:06:59.978937 IP (tos 0x0, ttl 54, id 37001, offset 0, flags [DF], proto TCP (6), length 90)
    160.79.104.10.443 > 172.25.186.179.55410: Flags [P.], cksum 0x7fa8 (correct), seq 1119:1157, ack 3988, win 35, options [nop,nop,TS val 1201745974 ecr 2464320824], length 38
09:06:59.978937 IP (tos 0x0, ttl 54, id 37002, offset 0, flags [DF], proto TCP (6), length 83)
    160.79.104.10.443 > 172.25.186.179.55410: Flags [P.], cksum 0x6616 (correct), seq 1157:1188, ack 3988, win 35, options [nop,nop,TS val 1201745974 ecr 2464320824], length 31
09:06:59.979042 IP (tos 0x0, ttl 64, id 0, offset 0, flags [DF], proto TCP (6), length 52)
    172.25.186.179.55410 > 160.79.104.10.443: Flags [.], cksum 0x28ff (correct), ack 1188, win 9085, options [nop,nop,TS val 2464320886 ecr 1201745974], length 0
09:07:00.130427 IP (tos 0x0, ttl 54, id 37003, offset 0, flags [DF], proto TCP (6), length 150)
    160.79.104.10.443 > 172.25.186.179.55410: Flags [P.], cksum 0x2112 (correct), seq 1188:1286, ack 3988, win 35, options [nop,nop,TS val 1201746125 ecr 2464320886], length 98
09:07:00.130428 IP (tos 0x0, ttl 54, id 37004, offset 0, flags [DF], proto TCP (6), length 151)
    160.79.104.10.443 > 172.25.186.179.55410: Flags [P.], cksum 0x9324 (correct), seq 1286:1385, ack 3988, win 35, options [nop,nop,TS val 1201746125 ecr 2464320886], length 99
09:07:00.130429 IP (tos 0x0, ttl 54, id 37005, offset 0, flags [DF], proto TCP (6), length 83)
    160.79.104.10.443 > 172.25.186.179.55410: Flags [P.], cksum 0xb5af (correct), seq 1385:1416, ack 3988, win 35, options [nop,nop,TS val 1201746125 ecr 2464320886], length 31
09:07:00.130544 IP (tos 0x0, ttl 64, id 0, offset 0, flags [DF], proto TCP (6), length 52)
    172.25.186.179.55410 > 160.79.104.10.443: Flags [.], cksum 0x26eb (correct), ack 1416, win 9087, options [nop,nop,TS val 2464321037 ecr 1201746125], length 0
09:07:00.649932 IP (tos 0x0, ttl 64, id 0, offset 0, flags [DF], proto TCP (6), length 977)
    172.25.186.179.55410 > 160.79.104.10.443: Flags [P.], cksum 0x61cf (correct), seq 3988:4913, ack 1416, win 9090, options [nop,nop,TS val 2464321557 ecr 1201746125], length 925
09:07:00.659362 IP (tos 0x0, ttl 54, id 37006, offset 0, flags [DF], proto TCP (6), length 52)
    160.79.104.10.443 > 172.25.186.179.55410: Flags [.], cksum 0x4290 (correct), ack 4913, win 35, options [nop,nop,TS val 1201746655 ecr 2464321557], length 0
09:07:01.064317 IP (tos 0x0, ttl 64, id 46855, offset 0, flags [none], proto TCP (6), length 40)
    172.25.186.179.55414 > 160.79.104.10.443: Flags [.], cksum 0xb0d0 (correct), ack 3011471306, win 2048, length 0
09:07:01.073708 IP (tos 0x0, ttl 54, id 7042, offset 0, flags [DF], proto TCP (6), length 52)
    160.79.104.10.443 > 172.25.186.179.55414: Flags [.], cksum 0xe3ca (correct), ack 1, win 19, options [nop,nop,TS val 4097149388 ecr 3864606590], length 0
09:07:04.863701 IP (tos 0x0, ttl 54, id 37007, offset 0, flags [DF], proto TCP (6), length 192)
    160.79.104.10.443 > 172.25.186.179.55410: Flags [P.], cksum 0xbce9 (correct), seq 1416:1556, ack 4913, win 35, options [nop,nop,TS val 1201750794 ecr 2464321557], length 140
09:07:04.863826 IP (tos 0x0, ttl 64, id 0, offset 0, flags [DF], proto TCP (6), length 52)
    172.25.186.179.55410 > 160.79.104.10.443: Flags [.], cksum 0xfe06 (correct), ack 1556, win 9088, options [nop,nop,TS val 2464325770 ecr 1201750794], length 0
09:07:04.866560 IP (tos 0x0, ttl 54, id 37008, offset 0, flags [DF], proto TCP (6), length 85)
    160.79.104.10.443 > 172.25.186.179.55410: Flags [P.], cksum 0x94c8 (correct), seq 1556:1589, ack 4913, win 35, options [nop,nop,TS val 1201750794 ecr 2464321557], length 33
09:07:04.866561 IP (tos 0x0, ttl 54, id 37009, offset 0, flags [DF], proto TCP (6), length 282)
    160.79.104.10.443 > 172.25.186.179.55410: Flags [P.], cksum 0x09e9 (correct), seq 1589:1819, ack 4913, win 35, options [nop,nop,TS val 1201750799 ecr 2464321557], length 230
09:07:04.866562 IP (tos 0x0, ttl 54, id 37010, offset 0, flags [DF], proto TCP (6), length 282)
    160.79.104.10.443 > 172.25.186.179.55410: Flags [P.], cksum 0x09c6 (correct), seq 1589:1819, ack 4913, win 35, options [nop,nop,TS val 1201750834 ecr 2464321557], length 230
09:07:04.866562 IP (tos 0x0, ttl 54, id 37011, offset 0, flags [DF], proto TCP (6), length 164)
    160.79.104.10.443 > 172.25.186.179.55410: Flags [P.], cksum 0xe49b (correct), seq 1819:1931, ack 4913, win 35, options [nop,nop,TS val 1201750838 ecr 2464321557], length 112
09:07:04.866562 IP (tos 0x0, ttl 54, id 37012, offset 0, flags [DF], proto TCP (6), length 144)
    160.79.104.10.443 > 172.25.186.179.55410: Flags [P.], cksum 0xef1d (correct), seq 1931:2023, ack 4913, win 35, options [nop,nop,TS val 1201750838 ecr 2464321557], length 92
09:07:04.866563 IP (tos 0x0, ttl 54, id 37013, offset 0, flags [DF], proto TCP (6), length 378)
    160.79.104.10.443 > 172.25.186.179.55410: Flags [P.], cksum 0xae64 (correct), seq 2023:2349, ack 4913, win 35, options [nop,nop,TS val 1201750849 ecr 2464321557], length 326
09:07:04.866677 IP (tos 0x0, ttl 64, id 0, offset 0, flags [DF], proto TCP (6), length 52)
    172.25.186.179.55410 > 160.79.104.10.443: Flags [.], cksum 0xfcf9 (correct), ack 1819, win 9086, options [nop,nop,TS val 2464325773 ecr 1201750799], length 0
09:07:04.866775 IP (tos 0x0, ttl 64, id 0, offset 0, flags [DF], proto TCP (6), length 64)
    172.25.186.179.55410 > 160.79.104.10.443: Flags [.], cksum 0xec88 (correct), ack 2349, win 9078, options [nop,nop,TS val 2464325773 ecr 1201750849,nop,nop,sack 1 {1589:1819}], length 0
09:07:04.867662 IP (tos 0x0, ttl 54, id 37014, offset 0, flags [DF], proto TCP (6), length 243)
    160.79.104.10.443 > 172.25.186.179.55410: Flags [P.], cksum 0x49c0 (correct), seq 2349:2540, ack 4913, win 35, options [nop,nop,TS val 1201750862 ecr 2464321557], length 191
09:07:04.867747 IP (tos 0x0, ttl 64, id 0, offset 0, flags [DF], proto TCP (6), length 52)
    172.25.186.179.55410 > 160.79.104.10.443: Flags [.], cksum 0xf9e7 (correct), ack 2540, win 9087, options [nop,nop,TS val 2464325774 ecr 1201750862], length 0
09:07:04.869328 IP (tos 0x0, ttl 64, id 0, offset 0, flags [DF], proto TCP (6), length 87)
    172.25.186.179.55410 > 160.79.104.10.443: Flags [P.], cksum 0x64c0 (correct), seq 4913:4948, ack 2540, win 9090, options [nop,nop,TS val 2464325776 ecr 1201750862], length 35
09:07:04.869405 IP (tos 0x0, ttl 64, id 0, offset 0, flags [DF], proto TCP (6), length 87)
    172.25.186.179.55410 > 160.79.104.10.443: Flags [P.], cksum 0x87bb (correct), seq 4948:4983, ack 2540, win 9090, options [nop,nop,TS val 2464325776 ecr 1201750862], length 35
09:07:04.876430 IP (tos 0x0, ttl 54, id 37015, offset 0, flags [DF], proto TCP (6), length 52)
    160.79.104.10.443 > 172.25.186.179.55410: Flags [.], cksum 0x1d16 (correct), ack 4948, win 35, options [nop,nop,TS val 1201750871 ecr 2464325776], length 0
09:07:04.876431 IP (tos 0x0, ttl 54, id 37016, offset 0, flags [DF], proto TCP (6), length 52)
    160.79.104.10.443 > 172.25.186.179.55410: Flags [.], cksum 0x1cf2 (correct), ack 4983, win 35, options [nop,nop,TS val 1201750872 ecr 2464325776], length 0
09:07:04.883802 IP (tos 0x0, ttl 54, id 37017, offset 0, flags [DF], proto TCP (6), length 108)
    160.79.104.10.443 > 172.25.186.179.55410: Flags [P.], cksum 0xf194 (correct), seq 2540:2596, ack 4983, win 35, options [nop,nop,TS val 1201750878 ecr 2464325776], length 56
09:07:04.883895 IP (tos 0x0, ttl 64, id 0, offset 0, flags [DF], proto TCP (6), length 52)
    172.25.186.179.55410 > 160.79.104.10.443: Flags [.], cksum 0xf945 (correct), ack 2596, win 9090, options [nop,nop,TS val 2464325791 ecr 1201750878], length 0
09:07:04.907307 IP (tos 0x0, ttl 54, id 37018, offset 0, flags [DF], proto TCP (6), length 151)
    160.79.104.10.443 > 172.25.186.179.55410: Flags [P.], cksum 0xb772 (correct), seq 2596:2695, ack 4983, win 35, options [nop,nop,TS val 1201750902 ecr 2464325791], length 99
09:07:04.907308 IP (tos 0x0, ttl 54, id 37019, offset 0, flags [DF], proto TCP (6), length 83)
    160.79.104.10.443 > 172.25.186.179.55410: Flags [P.], cksum 0x0652 (correct), seq 2695:2726, ack 4983, win 35, options [nop,nop,TS val 1201750902 ecr 2464325791], length 31
09:07:04.907422 IP (tos 0x0, ttl 64, id 0, offset 0, flags [DF], proto TCP (6), length 52)
    172.25.186.179.55410 > 160.79.104.10.443: Flags [.], cksum 0xf896 (correct), ack 2726, win 9088, options [nop,nop,TS val 2464325814 ecr 1201750902], length 0
09:07:05.377195 IP (tos 0x0, ttl 54, id 37020, offset 0, flags [DF], proto TCP (6), length 84)
    160.79.104.10.443 > 172.25.186.179.55410: Flags [P.], cksum 0x2f91 (correct), seq 2726:2758, ack 4983, win 35, options [nop,nop,TS val 1201751289 ecr 2464325814], length 32
09:07:05.377196 IP (tos 0x0, ttl 54, id 37021, offset 0, flags [DF], proto TCP (6), length 83)
    160.79.104.10.443 > 172.25.186.179.55410: Flags [P.], cksum 0x0b98 (correct), seq 2758:2789, ack 4983, win 35, options [nop,nop,TS val 1201751289 ecr 2464325814], length 31
09:07:05.377196 IP (tos 0x0, ttl 54, id 37022, offset 0, flags [DF], proto TCP (6), length 83)
    160.79.104.10.443 > 172.25.186.179.55410: Flags [P.], cksum 0x0b69 (correct), seq 2758:2789, ack 4983, win 35, options [nop,nop,TS val 1201751336 ecr 2464325814], length 31
09:07:05.377311 IP (tos 0x0, ttl 64, id 0, offset 0, flags [DF], proto TCP (6), length 52)
    172.25.186.179.55410 > 160.79.104.10.443: Flags [.], cksum 0xf4fd (correct), ack 2789, win 9089, options [nop,nop,TS val 2464326284 ecr 1201751289], length 0
09:07:05.377393 IP (tos 0x0, ttl 64, id 0, offset 0, flags [DF], proto TCP (6), length 64)
    172.25.186.179.55410 > 160.79.104.10.443: Flags [.], cksum 0xde3e (correct), ack 2789, win 9089, options [nop,nop,TS val 2464326284 ecr 1201751336,nop,nop,sack 1 {2758:2789}], length 0
09:07:05.383748 IP (tos 0x0, ttl 64, id 0, offset 0, flags [DF], proto TCP (6), length 1034)
    172.25.186.179.55410 > 160.79.104.10.443: Flags [P.], cksum 0xfa1d (correct), seq 4983:5965, ack 2789, win 9090, options [nop,nop,TS val 2464326290 ecr 1201751336], length 982
09:07:05.431950 IP (tos 0x0, ttl 54, id 37023, offset 0, flags [DF], proto TCP (6), length 52)
    160.79.104.10.443 > 172.25.186.179.55410: Flags [.], cksum 0x13f6 (correct), ack 5965, win 35, options [nop,nop,TS val 1201751427 ecr 2464326290], length 0
09:07:05.441785 IP (tos 0x0, ttl 64, id 0, offset 0, flags [DF], proto TCP (6), length 270)
    172.25.186.179.55410 > 160.79.104.10.443: Flags [P.], cksum 0xf6d0 (correct), seq 5965:6183, ack 2789, win 9090, options [nop,nop,TS val 2464326348 ecr 1201751427], length 218
09:07:05.443350 IP (tos 0x0, ttl 64, id 0, offset 0, flags [DF], proto TCP (6), length 307)
    172.25.186.179.55410 > 160.79.104.10.443: Flags [P.], cksum 0x36a0 (correct), seq 6183:6438, ack 2789, win 9090, options [nop,nop,TS val 2464326350 ecr 1201751427], length 255
09:07:05.486116 IP (tos 0x0, ttl 64, id 0, offset 0, flags [DF], proto TCP (6), length 299)
    172.25.186.179.55410 > 160.79.104.10.443: Flags [P.], cksum 0x0890 (correct), seq 6438:6685, ack 2789, win 9090, options [nop,nop,TS val 2464326393 ecr 1201751427], length 247
09:07:05.530563 IP (tos 0x0, ttl 54, id 37024, offset 0, flags [DF], proto TCP (6), length 52)
    160.79.104.10.443 > 172.25.186.179.55410: Flags [.], cksum 0x1280 (correct), ack 6183, win 35, options [nop,nop,TS val 1201751525 ecr 2464326348], length 0
09:07:05.530564 IP (tos 0x0, ttl 54, id 37025, offset 0, flags [DF], proto TCP (6), length 52)
    160.79.104.10.443 > 172.25.186.179.55410: Flags [.], cksum 0x117f (correct), ack 6438, win 35, options [nop,nop,TS val 1201751525 ecr 2464326350], length 0
09:07:05.530564 IP (tos 0x0, ttl 54, id 37026, offset 0, flags [DF], proto TCP (6), length 52)
    160.79.104.10.443 > 172.25.186.179.55410: Flags [.], cksum 0x105d (correct), ack 6685, win 35, options [nop,nop,TS val 1201751525 ecr 2464326393], length 0
09:07:05.602280 IP (tos 0x0, ttl 54, id 37027, offset 0, flags [DF], proto TCP (6), length 165)
    160.79.104.10.443 > 172.25.186.179.55410: Flags [P.], cksum 0x173f (correct), seq 2789:2902, ack 6685, win 35, options [nop,nop,TS val 1201751597 ecr 2464326393], length 113
09:07:05.602280 IP (tos 0x0, ttl 54, id 37028, offset 0, flags [DF], proto TCP (6), length 193)
    160.79.104.10.443 > 172.25.186.179.55410: Flags [P.], cksum 0x3d88 (correct), seq 2902:3043, ack 6685, win 35, options [nop,nop,TS val 1201751597 ecr 2464326393], length 141
09:07:05.602281 IP (tos 0x0, ttl 54, id 37029, offset 0, flags [DF], proto TCP (6), length 83)
    160.79.104.10.443 > 172.25.186.179.55410: Flags [P.], cksum 0x4b2f (correct), seq 3043:3074, ack 6685, win 35, options [nop,nop,TS val 1201751597 ecr 2464326393], length 31
09:07:05.602337 IP (tos 0x0, ttl 64, id 0, offset 0, flags [DF], proto TCP (6), length 52)
    172.25.186.179.55410 > 160.79.104.10.443: Flags [.], cksum 0xeb28 (correct), ack 3074, win 9086, options [nop,nop,TS val 2464326509 ecr 1201751597], length 0
09:07:05.726986 IP (tos 0x0, ttl 54, id 37030, offset 0, flags [DF], proto TCP (6), length 142)
    160.79.104.10.443 > 172.25.186.179.55410: Flags [P.], cksum 0x4e94 (correct), seq 3074:3164, ack 6685, win 35, options [nop,nop,TS val 1201751721 ecr 2464326509], length 90
09:07:05.727095 IP (tos 0x0, ttl 64, id 0, offset 0, flags [DF], proto TCP (6), length 52)
    172.25.186.179.55410 > 160.79.104.10.443: Flags [.], cksum 0xe9d2 (correct), ack 3164, win 9089, options [nop,nop,TS val 2464326634 ecr 1201751721], length 0
09:07:05.728527 IP (tos 0x0, ttl 54, id 37031, offset 0, flags [DF], proto TCP (6), length 1426)
    160.79.104.10.443 > 172.25.186.179.55410: Flags [.], cksum 0x29da (correct), seq 3164:4538, ack 6685, win 35, options [nop,nop,TS val 1201751721 ecr 2464326509], length 1374
09:07:05.728528 IP (tos 0x0, ttl 54, id 37032, offset 0, flags [DF], proto TCP (6), length 1426)
    160.79.104.10.443 > 172.25.186.179.55410: Flags [.], cksum 0x9271 (correct), seq 4538:5912, ack 6685, win 35, options [nop,nop,TS val 1201751721 ecr 2464326509], length 1374
09:07:05.728529 IP (tos 0x0, ttl 54, id 37033, offset 0, flags [DF], proto TCP (6), length 1426)
    160.79.104.10.443 > 172.25.186.179.55410: Flags [.], cksum 0xd818 (correct), seq 5912:7286, ack 6685, win 35, options [nop,nop,TS val 1201751721 ecr 2464326509], length 1374
09:07:05.728529 IP (tos 0x0, ttl 54, id 37034, offset 0, flags [DF], proto TCP (6), length 1349)
    160.79.104.10.443 > 172.25.186.179.55410: Flags [P.], cksum 0x62b6 (correct), seq 7286:8583, ack 6685, win 35, options [nop,nop,TS val 1201751721 ecr 2464326509], length 1297
09:07:05.728530 IP (tos 0x0, ttl 54, id 37035, offset 0, flags [DF], proto TCP (6), length 83)
    160.79.104.10.443 > 172.25.186.179.55410: Flags [P.], cksum 0xac57 (correct), seq 8583:8614, ack 6685, win 35, options [nop,nop,TS val 1201751721 ecr 2464326509], length 31
09:07:05.728627 IP (tos 0x0, ttl 64, id 0, offset 0, flags [DF], proto TCP (6), length 52)
    172.25.186.179.55410 > 160.79.104.10.443: Flags [.], cksum 0xd4db (correct), ack 8614, win 9005, options [nop,nop,TS val 2464326635 ecr 1201751721], length 0
09:07:05.728731 IP (tos 0x0, ttl 64, id 0, offset 0, flags [DF], proto TCP (6), length 52)
    172.25.186.179.55410 > 160.79.104.10.443: Flags [.], cksum 0xd486 (correct), ack 8614, win 9090, options [nop,nop,TS val 2464326635 ecr 1201751721], length 0
09:07:05.753916 IP (tos 0x0, ttl 64, id 0, offset 0, flags [DF], proto TCP (6), length 469)
    172.25.186.179.55410 > 160.79.104.10.443: Flags [P.], cksum 0xcea6 (correct), seq 6685:7102, ack 8614, win 9090, options [nop,nop,TS val 2464326661 ecr 1201751721], length 417
09:07:05.760782 IP (tos 0x0, ttl 54, id 37036, offset 0, flags [DF], proto TCP (6), length 52)
    160.79.104.10.443 > 172.25.186.179.55410: Flags [.], cksum 0xf608 (correct), ack 7102, win 35, options [nop,nop,TS val 1201751755 ecr 2464326661], length 0
09:07:05.770166 IP (tos 0x0, ttl 64, id 0, offset 0, flags [DF], proto TCP (6), length 975)
    172.25.186.179.55410 > 160.79.104.10.443: Flags [P.], cksum 0xd6bc (correct), seq 7102:8025, ack 8614, win 9090, options [nop,nop,TS val 2464326677 ecr 1201751755], length 923
09:07:05.770209 IP (tos 0x0, ttl 64, id 0, offset 0, flags [DF], proto TCP (6), length 1059)
    172.25.186.179.55410 > 160.79.104.10.443: Flags [P.], cksum 0x6254 (correct), seq 8025:9032, ack 8614, win 9090, options [nop,nop,TS val 2464326677 ecr 1201751755], length 1007
09:07:05.777095 IP (tos 0x0, ttl 54, id 37037, offset 0, flags [DF], proto TCP (6), length 52)
    160.79.104.10.443 > 172.25.186.179.55410: Flags [.], cksum 0xf24c (correct), ack 8025, win 35, options [nop,nop,TS val 1201751772 ecr 2464326677], length 0
09:07:05.777096 IP (tos 0x0, ttl 54, id 37038, offset 0, flags [DF], proto TCP (6), length 52)
    160.79.104.10.443 > 172.25.186.179.55410: Flags [.], cksum 0xee5d (correct), ack 9032, win 35, options [nop,nop,TS val 1201751772 ecr 2464326677], length 0
09:07:05.898196 IP (tos 0x0, ttl 54, id 37039, offset 0, flags [DF], proto TCP (6), length 141)
    160.79.104.10.443 > 172.25.186.179.55410: Flags [P.], cksum 0xf289 (correct), seq 8614:8703, ack 9032, win 35, options [nop,nop,TS val 1201751893 ecr 2464326677], length 89
09:07:05.898319 IP (tos 0x0, ttl 64, id 0, offset 0, flags [DF], proto TCP (6), length 52)
    172.25.186.179.55410 > 160.79.104.10.443: Flags [.], cksum 0xc9ad (correct), ack 8703, win 9089, options [nop,nop,TS val 2464326805 ecr 1201751893], length 0
09:07:05.898647 IP (tos 0x0, ttl 54, id 37040, offset 0, flags [DF], proto TCP (6), length 163)
    160.79.104.10.443 > 172.25.186.179.55410: Flags [P.], cksum 0x06e3 (correct), seq 8703:8814, ack 9032, win 35, options [nop,nop,TS val 1201751894 ecr 2464326677], length 111
09:07:05.898648 IP (tos 0x0, ttl 54, id 37041, offset 0, flags [DF], proto TCP (6), length 83)
    160.79.104.10.443 > 172.25.186.179.55410: Flags [P.], cksum 0xe42e (correct), seq 8814:8845, ack 9032, win 35, options [nop,nop,TS val 1201751894 ecr 2464326677], length 31
09:07:05.898705 IP (tos 0x0, ttl 64, id 0, offset 0, flags [DF], proto TCP (6), length 52)
    172.25.186.179.55410 > 160.79.104.10.443: Flags [.], cksum 0xc91f (correct), ack 8845, win 9088, options [nop,nop,TS val 2464326805 ecr 1201751894], length 0
09:07:05.939499 IP (tos 0x0, ttl 64, id 0, offset 0, flags [DF], proto TCP (6), length 259)
    172.25.186.179.55410 > 160.79.104.10.443: Flags [P.], cksum 0x77b2 (correct), seq 9032:9239, ack 8845, win 9090, options [nop,nop,TS val 2464326846 ecr 1201751894], length 207
09:07:05.946271 IP (tos 0x0, ttl 54, id 37042, offset 0, flags [DF], proto TCP (6), length 52)
    160.79.104.10.443 > 172.25.186.179.55410: Flags [.], cksum 0xeb55 (correct), ack 9239, win 35, options [nop,nop,TS val 1201751941 ecr 2464326846], length 0
09:07:06.050318 IP (tos 0x0, ttl 54, id 37043, offset 0, flags [DF], proto TCP (6), length 311)
    160.79.104.10.443 > 172.25.186.179.55410: Flags [P.], cksum 0xbdf8 (correct), seq 8845:9104, ack 9239, win 35, options [nop,nop,TS val 1201752013 ecr 2464326846], length 259
09:07:06.050320 IP (tos 0x0, ttl 54, id 37044, offset 0, flags [DF], proto TCP (6), length 85)
    160.79.104.10.443 > 172.25.186.179.55410: Flags [P.], cksum 0x60ec (correct), seq 9104:9137, ack 9239, win 35, options [nop,nop,TS val 1201752014 ecr 2464326846], length 33
09:07:06.050320 IP (tos 0x0, ttl 54, id 37045, offset 0, flags [DF], proto TCP (6), length 83)
    160.79.104.10.443 > 172.25.186.179.55410: Flags [P.], cksum 0xc3fb (correct), seq 9137:9168, ack 9239, win 35, options [nop,nop,TS val 1201752014 ecr 2464326846], length 31
09:07:06.050434 IP (tos 0x0, ttl 64, id 0, offset 0, flags [DF], proto TCP (6), length 52)
    172.25.186.179.55410 > 160.79.104.10.443: Flags [.], cksum 0xc600 (correct), ack 9168, win 9085, options [nop,nop,TS val 2464326957 ecr 1201752014], length 0
09:07:06.061191 IP (tos 0x0, ttl 54, id 37046, offset 0, flags [DF], proto TCP (6), length 159)
    160.79.104.10.443 > 172.25.186.179.55410: Flags [P.], cksum 0x94ab (correct), seq 9168:9275, ack 9239, win 35, options [nop,nop,TS val 1201752055 ecr 2464326957], length 107
09:07:06.061191 IP (tos 0x0, ttl 54, id 37047, offset 0, flags [DF], proto TCP (6), length 231)
    160.79.104.10.443 > 172.25.186.179.55410: Flags [P.], cksum 0x3c77 (correct), seq 9275:9454, ack 9239, win 35, options [nop,nop,TS val 1201752055 ecr 2464326957], length 179
09:07:06.061192 IP (tos 0x0, ttl 54, id 37048, offset 0, flags [DF], proto TCP (6), length 90)
    160.79.104.10.443 > 172.25.186.179.55410: Flags [P.], cksum 0x5519 (correct), seq 9454:9492, ack 9239, win 35, options [nop,nop,TS val 1201752056 ecr 2464326957], length 38
09:07:06.061192 IP (tos 0x0, ttl 54, id 37049, offset 0, flags [DF], proto TCP (6), length 83)
    160.79.104.10.443 > 172.25.186.179.55410: Flags [P.], cksum 0x6376 (correct), seq 9492:9523, ack 9239, win 35, options [nop,nop,TS val 1201752056 ecr 2464326957], length 31
09:07:06.061305 IP (tos 0x0, ttl 64, id 0, offset 0, flags [DF], proto TCP (6), length 52)
    172.25.186.179.55410 > 160.79.104.10.443: Flags [.], cksum 0xc468 (correct), ack 9523, win 9085, options [nop,nop,TS val 2464326968 ecr 1201752056], length 0
09:07:06.068517 IP (tos 0x0, ttl 54, id 37050, offset 0, flags [DF], proto TCP (6), length 143)
    160.79.104.10.443 > 172.25.186.179.55410: Flags [P.], cksum 0xd873 (correct), seq 9523:9614, ack 9239, win 35, options [nop,nop,TS val 1201752063 ecr 2464326968], length 91
09:07:06.068518 IP (tos 0x0, ttl 54, id 37051, offset 0, flags [DF], proto TCP (6), length 642)
    160.79.104.10.443 > 172.25.186.179.55410: Flags [P.], cksum 0x3529 (correct), seq 9614:10204, ack 9239, win 35, options [nop,nop,TS val 1201752063 ecr 2464326968], length 590
09:07:06.068519 IP (tos 0x0, ttl 54, id 37052, offset 0, flags [DF], proto TCP (6), length 83)
    160.79.104.10.443 > 172.25.186.179.55410: Flags [P.], cksum 0xa58a (correct), seq 10204:10235, ack 9239, win 35, options [nop,nop,TS val 1201752063 ecr 2464326968], length 31
09:07:06.068579 IP (tos 0x0, ttl 64, id 0, offset 0, flags [DF], proto TCP (6), length 52)
    172.25.186.179.55410 > 160.79.104.10.443: Flags [.], cksum 0xc198 (correct), ack 10235, win 9079, options [nop,nop,TS val 2464326975 ecr 1201752063], length 0
09:07:06.606024 IP (tos 0x0, ttl 54, id 37053, offset 0, flags [DF], proto TCP (6), length 174)
    160.79.104.10.443 > 172.25.186.179.55410: Flags [P.], cksum 0x8822 (correct), seq 10235:10357, ack 9239, win 35, options [nop,nop,TS val 1201752561 ecr 2464326975], length 122
09:07:06.606025 IP (tos 0x0, ttl 54, id 37054, offset 0, flags [DF], proto TCP (6), length 242)
    160.79.104.10.443 > 172.25.186.179.55410: Flags [P.], cksum 0x70a2 (correct), seq 10357:10547, ack 9239, win 35, options [nop,nop,TS val 1201752580 ecr 2464326975], length 190
09:07:06.606026 IP (tos 0x0, ttl 54, id 37055, offset 0, flags [DF], proto TCP (6), length 83)
    160.79.104.10.443 > 172.25.186.179.55410: Flags [P.], cksum 0xb3b2 (correct), seq 10547:10578, ack 9239, win 35, options [nop,nop,TS val 1201752580 ecr 2464326975], length 31
09:07:06.606135 IP (tos 0x0, ttl 64, id 0, offset 0, flags [DF], proto TCP (6), length 52)
    172.25.186.179.55410 > 160.79.104.10.443: Flags [.], cksum 0xbc1c (correct), ack 10578, win 9085, options [nop,nop,TS val 2464327513 ecr 1201752580], length 0
09:07:06.618650 IP (tos 0x0, ttl 54, id 37056, offset 0, flags [DF], proto TCP (6), length 143)
    160.79.104.10.443 > 172.25.186.179.55410: Flags [P.], cksum 0xa514 (correct), seq 10578:10669, ack 9239, win 35, options [nop,nop,TS val 1201752613 ecr 2464327513], length 91
09:07:06.618750 IP (tos 0x0, ttl 64, id 0, offset 0, flags [DF], proto TCP (6), length 52)
    172.25.186.179.55410 > 160.79.104.10.443: Flags [.], cksum 0xbb90 (correct), ack 10669, win 9089, options [nop,nop,TS val 2464327525 ecr 1201752613], length 0
09:07:06.645161 IP (tos 0x0, ttl 54, id 37057, offset 0, flags [DF], proto TCP (6), length 163)
    160.79.104.10.443 > 172.25.186.179.55410: Flags [P.], cksum 0xc28b (correct), seq 10669:10780, ack 9239, win 35, options [nop,nop,TS val 1201752640 ecr 2464327525], length 111
09:07:06.645162 IP (tos 0x0, ttl 54, id 37058, offset 0, flags [DF], proto TCP (6), length 90)
    160.79.104.10.443 > 172.25.186.179.55410: Flags [P.], cksum 0x6719 (correct), seq 10780:10818, ack 9239, win 35, options [nop,nop,TS val 1201752640 ecr 2464327525], length 38
09:07:06.645163 IP (tos 0x0, ttl 54, id 37059, offset 0, flags [DF], proto TCP (6), length 83)
    160.79.104.10.443 > 172.25.186.179.55410: Flags [P.], cksum 0xe612 (correct), seq 10818:10849, ack 9239, win 35, options [nop,nop,TS val 1201752640 ecr 2464327525], length 31
09:07:06.645348 IP (tos 0x0, ttl 64, id 0, offset 0, flags [DF], proto TCP (6), length 52)
    172.25.186.179.55410 > 160.79.104.10.443: Flags [.], cksum 0xbaa5 (correct), ack 10849, win 9090, options [nop,nop,TS val 2464327552 ecr 1201752640], length 0
09:07:12.260702 IP (tos 0x0, ttl 64, id 0, offset 0, flags [DF], proto TCP (6), length 283)
    172.25.186.179.55410 > 160.79.104.10.443: Flags [P.], cksum 0x4c42 (correct), seq 9239:9470, ack 10849, win 9090, options [nop,nop,TS val 2464333167 ecr 1201752640], length 231
09:07:12.260735 IP (tos 0x0, ttl 64, id 0, offset 0, flags [DF], proto TCP (6), length 232)
    172.25.186.179.55410 > 160.79.104.10.443: Flags [P.], cksum 0xbfc6 (correct), seq 9470:9650, ack 10849, win 9090, options [nop,nop,TS val 2464333167 ecr 1201752640], length 180
09:07:12.278731 IP (tos 0x0, ttl 64, id 0, offset 0, flags [DF], proto TCP (6), length 281)
    172.25.186.179.55410 > 160.79.104.10.443: Flags [P.], cksum 0x597e (correct), seq 9650:9879, ack 10849, win 9090, options [nop,nop,TS val 2464333185 ecr 1201752640], length 229
09:07:12.278763 IP (tos 0x0, ttl 64, id 0, offset 0, flags [DF], proto TCP (6), length 624)
    172.25.186.179.55410 > 160.79.104.10.443: Flags [P.], cksum 0xc95c (correct), seq 9879:10451, ack 10849, win 9090, options [nop,nop,TS val 2464333185 ecr 1201752640], length 572
09:07:12.335411 IP (tos 0x0, ttl 64, id 0, offset 0, flags [DF], proto TCP (6), length 384)
    172.25.186.179.55410 > 160.79.104.10.443: Flags [P.], cksum 0xbd14 (correct), seq 10451:10783, ack 10849, win 9090, options [nop,nop,TS val 2464333242 ecr 1201752640], length 332
09:07:12.335733 IP (tos 0x0, ttl 64, id 0, offset 0, flags [DF], proto TCP (6), length 936)
    172.25.186.179.55410 > 160.79.104.10.443: Flags [P.], cksum 0x5395 (correct), seq 10783:11667, ack 10849, win 9090, options [nop,nop,TS val 2464333242 ecr 1201752640], length 884
09:07:12.346307 IP (tos 0x0, ttl 64, id 0, offset 0, flags [DF], proto TCP (6), length 116)
    172.25.186.179.55414 > 160.79.104.10.443: Flags [P.], cksum 0x1858 (correct), seq 1:65, ack 1, win 2048, options [nop,nop,TS val 3864798106 ecr 4097149388], length 64
09:07:12.346332 IP (tos 0x0, ttl 64, id 0, offset 0, flags [DF], proto TCP (6), length 91)
    172.25.186.179.55414 > 160.79.104.10.443: Flags [P.], cksum 0x30f0 (correct), seq 65:104, ack 1, win 2048, options [nop,nop,TS val 3864798106 ecr 4097149388], length 39
09:07:12.346340 IP (tos 0x0, ttl 64, id 0, offset 0, flags [DF], proto TCP (6), length 1426)
    172.25.186.179.55414 > 160.79.104.10.443: Flags [.], cksum 0x7df6 (correct), seq 104:1478, ack 1, win 2048, options [nop,nop,TS val 3864798106 ecr 4097149388], length 1374
09:07:12.346342 IP (tos 0x0, ttl 64, id 0, offset 0, flags [DF], proto TCP (6), length 963)
    172.25.186.179.55414 > 160.79.104.10.443: Flags [P.], cksum 0xc41e (correct), seq 1478:2389, ack 1, win 2048, options [nop,nop,TS val 3864798106 ecr 4097149388], length 911
09:07:12.348143 IP (tos 0x0, ttl 54, id 37060, offset 0, flags [DF], proto TCP (6), length 52)
    160.79.104.10.443 > 172.25.186.179.55410: Flags [.], cksum 0xb0ea (correct), ack 9470, win 35, options [nop,nop,TS val 1201758340 ecr 2464333167], length 0
09:07:12.348143 IP (tos 0x0, ttl 54, id 37061, offset 0, flags [DF], proto TCP (6), length 52)
    160.79.104.10.443 > 172.25.186.179.55410: Flags [.], cksum 0xb036 (correct), ack 9650, win 35, options [nop,nop,TS val 1201758340 ecr 2464333167], length 0
09:07:12.348143 IP (tos 0x0, ttl 54, id 37062, offset 0, flags [DF], proto TCP (6), length 52)
    160.79.104.10.443 > 172.25.186.179.55410: Flags [.], cksum 0xaf3f (correct), ack 9879, win 35, options [nop,nop,TS val 1201758340 ecr 2464333185], length 0
09:07:12.348143 IP (tos 0x0, ttl 54, id 37063, offset 0, flags [DF], proto TCP (6), length 52)
    160.79.104.10.443 > 172.25.186.179.55410: Flags [.], cksum 0xad03 (correct), ack 10451, win 35, options [nop,nop,TS val 1201758340 ecr 2464333185], length 0
09:07:12.348143 IP (tos 0x0, ttl 54, id 37064, offset 0, flags [DF], proto TCP (6), length 52)
    160.79.104.10.443 > 172.25.186.179.55410: Flags [.], cksum 0xab7d (correct), ack 10783, win 35, options [nop,nop,TS val 1201758341 ecr 2464333242], length 0
09:07:12.348143 IP (tos 0x0, ttl 54, id 37065, offset 0, flags [DF], proto TCP (6), length 52)
    160.79.104.10.443 > 172.25.186.179.55410: Flags [.], cksum 0xa809 (correct), ack 11667, win 35, options [nop,nop,TS val 1201758341 ecr 2464333242], length 0
09:07:12.354463 IP (tos 0x0, ttl 54, id 7043, offset 0, flags [DF], proto TCP (6), length 52)
    160.79.104.10.443 > 172.25.186.179.55414: Flags [.], cksum 0xcb5c (correct), ack 65, win 19, options [nop,nop,TS val 4097160667 ecr 3864798106], length 0
09:07:12.354463 IP (tos 0x0, ttl 54, id 7044, offset 0, flags [DF], proto TCP (6), length 52)
    160.79.104.10.443 > 172.25.186.179.55414: Flags [.], cksum 0xcb35 (correct), ack 104, win 19, options [nop,nop,TS val 4097160667 ecr 3864798106], length 0
09:07:12.354463 IP (tos 0x0, ttl 54, id 7045, offset 0, flags [DF], proto TCP (6), length 52)
    160.79.104.10.443 > 172.25.186.179.55414: Flags [.], cksum 0xc248 (correct), ack 2389, win 19, options [nop,nop,TS val 4097160667 ecr 3864798106], length 0
