tcpdump: data link type PKTAP
tcpdump: WARNING: snaplen raised from 96 to 524288
tcpdump: listening on pktap, link-type PKTAP (Apple DLT_PKTAP), snapshot length 524288 bytes
11:58:14.649882 IP (tos 0x0, ttl 54, id 37991, offset 0, flags [DF], proto TCP (6), length 52)
    160.79.104.10.443 > 172.25.187.30.61480: Flags [.], cksum 0xc140 (correct), ack 1808025718, win 18, options [nop,nop,TS val 2608717322 ecr 3897044127], length 0
11:58:14.755717 IP (tos 0x0, ttl 54, id 37992, offset 0, flags [DF], proto TCP (6), length 115)
    160.79.104.10.443 > 172.25.187.30.61480: Flags [P.], cksum 0x62e4 (correct), seq 0:63, ack 1, win 18, options [nop,nop,TS val 2608717426 ecr 3897044127], length 63
11:58:14.755930 IP (tos 0x0, ttl 64, id 0, offset 0, flags [DF], proto TCP (6), length 52)
    172.25.187.30.61480 > 160.79.104.10.443: Flags [.], cksum 0xa49b (correct), ack 63, win 7072, options [nop,nop,TS val 3897044239 ecr 2608717426], length 0
11:58:14.859438 IP (tos 0x0, ttl 54, id 37993, offset 0, flags [DF], proto TCP (6), length 118)
    160.79.104.10.443 > 172.25.187.30.61480: Flags [P.], cksum 0x0429 (correct), seq 63:129, ack 1, win 18, options [nop,nop,TS val 2608717529 ecr 3897044239], length 66
11:58:14.859640 IP (tos 0x0, ttl 64, id 0, offset 0, flags [DF], proto TCP (6), length 52)
    172.25.187.30.61480 > 160.79.104.10.443: Flags [.], cksum 0xa38a (correct), ack 129, win 7072, options [nop,nop,TS val 3897044343 ecr 2608717529], length 0
11:58:14.870550 IP (tos 0x0, ttl 54, id 37994, offset 0, flags [DF], proto TCP (6), length 124)
    160.79.104.10.443 > 172.25.187.30.61480: Flags [P.], cksum 0x6fdb (correct), seq 129:201, ack 1, win 18, options [nop,nop,TS val 2608717541 ecr 3897044343], length 72
11:58:14.870635 IP (tos 0x0, ttl 64, id 0, offset 0, flags [DF], proto TCP (6), length 52)
    172.25.187.30.61480 > 160.79.104.10.443: Flags [.], cksum 0xa32b (correct), ack 201, win 7072, options [nop,nop,TS val 3897044354 ecr 2608717541], length 0
11:58:14.997837 IP (tos 0x0, ttl 54, id 37995, offset 0, flags [DF], proto TCP (6), length 137)
    160.79.104.10.443 > 172.25.187.30.61480: Flags [P.], cksum 0x4529 (correct), seq 201:286, ack 1, win 18, options [nop,nop,TS val 2608717668 ecr 3897044354], length 85
11:58:14.998046 IP (tos 0x0, ttl 64, id 0, offset 0, flags [DF], proto TCP (6), length 52)
    172.25.187.30.61480 > 160.79.104.10.443: Flags [.], cksum 0xa1d8 (correct), ack 286, win 7072, options [nop,nop,TS val 3897044481 ecr 2608717668], length 0
11:58:15.047255 IP (tos 0x0, ttl 54, id 37996, offset 0, flags [DF], proto TCP (6), length 110)
    160.79.104.10.443 > 172.25.187.30.61480: Flags [P.], cksum 0xdbd4 (correct), seq 286:344, ack 1, win 18, options [nop,nop,TS val 2608717718 ecr 3897044481], length 58
11:58:15.047255 IP (tos 0x0, ttl 54, id 37997, offset 0, flags [DF], proto TCP (6), length 103)
    160.79.104.10.443 > 172.25.187.30.61480: Flags [P.], cksum 0x7d56 (correct), seq 344:395, ack 1, win 18, options [nop,nop,TS val 2608717719 ecr 3897044481], length 51
11:58:15.047447 IP (tos 0x0, ttl 64, id 0, offset 0, flags [DF], proto TCP (6), length 52)
    172.25.187.30.61480 > 160.79.104.10.443: Flags [.], cksum 0xa106 (correct), ack 395, win 7072, options [nop,nop,TS val 3897044531 ecr 2608717719], length 0
11:58:15.078367 IP (tos 0x0, ttl 54, id 37998, offset 0, flags [DF], proto TCP (6), length 103)
    160.79.104.10.443 > 172.25.187.30.61480: Flags [P.], cksum 0xcd03 (correct), seq 395:446, ack 1, win 18, options [nop,nop,TS val 2608717748 ecr 3897044531], length 51
11:58:15.078507 IP (tos 0x0, ttl 64, id 0, offset 0, flags [DF], proto TCP (6), length 52)
    172.25.187.30.61480 > 160.79.104.10.443: Flags [.], cksum 0xa097 (correct), ack 446, win 7072, options [nop,nop,TS val 3897044562 ecr 2608717748], length 0
11:58:15.138497 IP (tos 0x0, ttl 54, id 37999, offset 0, flags [DF], proto TCP (6), length 103)
    160.79.104.10.443 > 172.25.187.30.61480: Flags [P.], cksum 0x094a (correct), seq 446:497, ack 1, win 18, options [nop,nop,TS val 2608717809 ecr 3897044562], length 51
11:58:15.138671 IP (tos 0x0, ttl 64, id 0, offset 0, flags [DF], proto TCP (6), length 52)
    172.25.187.30.61480 > 160.79.104.10.443: Flags [.], cksum 0x9feb (correct), ack 497, win 7072, options [nop,nop,TS val 3897044622 ecr 2608717809], length 0
11:58:15.197017 IP (tos 0x0, ttl 54, id 38000, offset 0, flags [DF], proto TCP (6), length 100)
    160.79.104.10.443 > 172.25.187.30.61480: Flags [P.], cksum 0x91fa (correct), seq 497:545, ack 1, win 18, options [nop,nop,TS val 2608717867 ecr 3897044622], length 48
11:58:15.197202 IP (tos 0x0, ttl 64, id 0, offset 0, flags [DF], proto TCP (6), length 52)
    172.25.187.30.61480 > 160.79.104.10.443: Flags [.], cksum 0x9f47 (correct), ack 545, win 7072, options [nop,nop,TS val 3897044680 ecr 2608717867], length 0
11:58:15.277155 IP (tos 0x0, ttl 54, id 38001, offset 0, flags [DF], proto TCP (6), length 113)
    160.79.104.10.443 > 172.25.187.30.61480: Flags [P.], cksum 0x8fbb (correct), seq 545:606, ack 1, win 18, options [nop,nop,TS val 2608717947 ecr 3897044680], length 61
11:58:15.277359 IP (tos 0x0, ttl 64, id 0, offset 0, flags [DF], proto TCP (6), length 52)
    172.25.187.30.61480 > 160.79.104.10.443: Flags [.], cksum 0x9e6a (correct), ack 606, win 7072, options [nop,nop,TS val 3897044760 ecr 2608717947], length 0
11:58:15.336050 IP (tos 0x0, ttl 54, id 38002, offset 0, flags [DF], proto TCP (6), length 105)
    160.79.104.10.443 > 172.25.187.30.61480: Flags [P.], cksum 0x0ea2 (correct), seq 606:659, ack 1, win 18, options [nop,nop,TS val 2608718006 ecr 3897044760], length 53
11:58:15.336224 IP (tos 0x0, ttl 64, id 0, offset 0, flags [DF], proto TCP (6), length 52)
    172.25.187.30.61480 > 160.79.104.10.443: Flags [.], cksum 0x9dbf (correct), ack 659, win 7072, options [nop,nop,TS val 3897044819 ecr 2608718006], length 0
11:58:15.417698 IP (tos 0x0, ttl 54, id 38003, offset 0, flags [DF], proto TCP (6), length 108)
    160.79.104.10.443 > 172.25.187.30.61480: Flags [P.], cksum 0x2964 (correct), seq 659:715, ack 1, win 18, options [nop,nop,TS val 2608718089 ecr 3897044819], length 56
11:58:15.417882 IP (tos 0x0, ttl 64, id 0, offset 0, flags [DF], proto TCP (6), length 52)
    172.25.187.30.61480 > 160.79.104.10.443: Flags [.], cksum 0x9ce2 (correct), ack 715, win 7072, options [nop,nop,TS val 3897044901 ecr 2608718089], length 0
11:58:15.452757 IP (tos 0x0, ttl 54, id 38004, offset 0, flags [DF], proto TCP (6), length 111)
    160.79.104.10.443 > 172.25.187.30.61480: Flags [P.], cksum 0x3b45 (correct), seq 715:774, ack 1, win 18, options [nop,nop,TS val 2608718123 ecr 3897044901], length 59
11:58:15.452867 IP (tos 0x0, ttl 64, id 0, offset 0, flags [DF], proto TCP (6), length 52)
    172.25.187.30.61480 > 160.79.104.10.443: Flags [.], cksum 0x9c62 (correct), ack 774, win 7072, options [nop,nop,TS val 3897044936 ecr 2608718123], length 0
11:58:15.534683 IP (tos 0x0, ttl 54, id 38005, offset 0, flags [DF], proto TCP (6), length 114)
    160.79.104.10.443 > 172.25.187.30.61480: Flags [P.], cksum 0x8d5b (correct), seq 774:836, ack 1, win 18, options [nop,nop,TS val 2608718205 ecr 3897044936], length 62
11:58:15.534898 IP (tos 0x0, ttl 64, id 0, offset 0, flags [DF], proto TCP (6), length 52)
    172.25.187.30.61480 > 160.79.104.10.443: Flags [.], cksum 0x9b80 (correct), ack 836, win 7072, options [nop,nop,TS val 3897045018 ecr 2608718205], length 0
11:58:15.548561 IP (tos 0x0, ttl 54, id 38006, offset 0, flags [DF], proto TCP (6), length 99)
    160.79.104.10.443 > 172.25.187.30.61480: Flags [P.], cksum 0x79a9 (correct), seq 836:883, ack 1, win 18, options [nop,nop,TS val 2608718219 ecr 3897045018], length 47
11:58:15.548701 IP (tos 0x0, ttl 64, id 0, offset 0, flags [DF], proto TCP (6), length 52)
    172.25.187.30.61480 > 160.79.104.10.443: Flags [.], cksum 0x9b35 (correct), ack 883, win 7072, options [nop,nop,TS val 3897045032 ecr 2608718219], length 0
11:58:15.613162 IP (tos 0x0, ttl 54, id 38007, offset 0, flags [DF], proto TCP (6), length 103)
    160.79.104.10.443 > 172.25.187.30.61480: Flags [P.], cksum 0x2901 (correct), seq 883:934, ack 1, win 18, options [nop,nop,TS val 2608718284 ecr 3897045032], length 51
11:58:15.613377 IP (tos 0x0, ttl 64, id 0, offset 0, flags [DF], proto TCP (6), length 52)
    172.25.187.30.61480 > 160.79.104.10.443: Flags [.], cksum 0x9a81 (correct), ack 934, win 7072, options [nop,nop,TS val 3897045096 ecr 2608718284], length 0
11:58:15.665745 IP (tos 0x0, ttl 54, id 38008, offset 0, flags [DF], proto TCP (6), length 108)
    160.79.104.10.443 > 172.25.187.30.61480: Flags [P.], cksum 0x3c3c (correct), seq 934:990, ack 1, win 18, options [nop,nop,TS val 2608718337 ecr 3897045096], length 56
11:58:15.665864 IP (tos 0x0, ttl 64, id 0, offset 0, flags [DF], proto TCP (6), length 52)
    172.25.187.30.61480 > 160.79.104.10.443: Flags [.], cksum 0x99df (correct), ack 990, win 7072, options [nop,nop,TS val 3897045149 ecr 2608718337], length 0
11:58:15.726367 IP (tos 0x0, ttl 54, id 38009, offset 0, flags [DF], proto TCP (6), length 105)
    160.79.104.10.443 > 172.25.187.30.61480: Flags [P.], cksum 0xc2a6 (correct), seq 990:1043, ack 1, win 18, options [nop,nop,TS val 2608718397 ecr 3897045149], length 53
11:58:15.726479 IP (tos 0x0, ttl 64, id 0, offset 0, flags [DF], proto TCP (6), length 52)
    172.25.187.30.61480 > 160.79.104.10.443: Flags [.], cksum 0x9931 (correct), ack 1043, win 7072, options [nop,nop,TS val 3897045210 ecr 2608718397], length 0
11:58:15.784627 IP (tos 0x0, ttl 54, id 38010, offset 0, flags [DF], proto TCP (6), length 106)
    160.79.104.10.443 > 172.25.187.30.61480: Flags [P.], cksum 0x0483 (correct), seq 1043:1097, ack 1, win 18, options [nop,nop,TS val 2608718455 ecr 3897045210], length 54
11:58:15.784777 IP (tos 0x0, ttl 64, id 0, offset 0, flags [DF], proto TCP (6), length 52)
    172.25.187.30.61480 > 160.79.104.10.443: Flags [.], cksum 0x9887 (correct), ack 1097, win 7072, options [nop,nop,TS val 3897045268 ecr 2608718455], length 0
11:58:15.843852 IP (tos 0x0, ttl 54, id 38011, offset 0, flags [DF], proto TCP (6), length 104)
    160.79.104.10.443 > 172.25.187.30.61480: Flags [P.], cksum 0x1aee (correct), seq 1097:1149, ack 1, win 18, options [nop,nop,TS val 2608718514 ecr 3897045268], length 52
11:58:15.844021 IP (tos 0x0, ttl 64, id 0, offset 0, flags [DF], proto TCP (6), length 52)
    172.25.187.30.61480 > 160.79.104.10.443: Flags [.], cksum 0x97dd (correct), ack 1149, win 7072, options [nop,nop,TS val 3897045327 ecr 2608718514], length 0
11:58:15.947072 IP (tos 0x0, ttl 54, id 38012, offset 0, flags [DF], proto TCP (6), length 102)
    160.79.104.10.443 > 172.25.187.30.61480: Flags [P.], cksum 0x27d0 (correct), seq 1149:1199, ack 1, win 18, options [nop,nop,TS val 2608718617 ecr 3897045327], length 50
11:58:15.947279 IP (tos 0x0, ttl 64, id 0, offset 0, flags [DF], proto TCP (6), length 52)
    172.25.187.30.61480 > 160.79.104.10.443: Flags [.], cksum 0x96dd (correct), ack 1199, win 7072, options [nop,nop,TS val 3897045430 ecr 2608718617], length 0
11:58:15.972532 IP (tos 0x0, ttl 54, id 38013, offset 0, flags [DF], proto TCP (6), length 102)
    160.79.104.10.443 > 172.25.187.30.61480: Flags [P.], cksum 0x4d63 (correct), seq 1199:1249, ack 1, win 18, options [nop,nop,TS val 2608718642 ecr 3897045430], length 50
11:58:15.972739 IP (tos 0x0, ttl 64, id 0, offset 0, flags [DF], proto TCP (6), length 52)
    172.25.187.30.61480 > 160.79.104.10.443: Flags [.], cksum 0x9678 (correct), ack 1249, win 7072, options [nop,nop,TS val 3897045456 ecr 2608718642], length 0
11:58:16.134400 IP (tos 0x0, ttl 54, id 38014, offset 0, flags [DF], proto TCP (6), length 120)
    160.79.104.10.443 > 172.25.187.30.61480: Flags [P.], cksum 0xf2e6 (correct), seq 1249:1317, ack 1, win 18, options [nop,nop,TS val 2608718806 ecr 3897045456], length 68
11:58:16.134576 IP (tos 0x0, ttl 64, id 0, offset 0, flags [DF], proto TCP (6), length 52)
    172.25.187.30.61480 > 160.79.104.10.443: Flags [.], cksum 0x94ee (correct), ack 1317, win 7072, options [nop,nop,TS val 3897045618 ecr 2608718806], length 0
11:58:16.181158 IP (tos 0x0, ttl 54, id 38015, offset 0, flags [DF], proto TCP (6), length 114)
    160.79.104.10.443 > 172.25.187.30.61480: Flags [P.], cksum 0xd102 (correct), seq 1317:1379, ack 1, win 18, options [nop,nop,TS val 2608718852 ecr 3897045618], length 62
11:58:16.181371 IP (tos 0x0, ttl 64, id 0, offset 0, flags [DF], proto TCP (6), length 52)
    172.25.187.30.61480 > 160.79.104.10.443: Flags [.], cksum 0x9454 (correct), ack 1379, win 7072, options [nop,nop,TS val 3897045664 ecr 2608718852], length 0
11:58:16.239729 IP (tos 0x0, ttl 54, id 38016, offset 0, flags [DF], proto TCP (6), length 107)
    160.79.104.10.443 > 172.25.187.30.61480: Flags [P.], cksum 0x464e (correct), seq 1379:1434, ack 1, win 18, options [nop,nop,TS val 2608718911 ecr 3897045664], length 55
11:58:16.239921 IP (tos 0x0, ttl 64, id 0, offset 0, flags [DF], proto TCP (6), length 52)
    172.25.187.30.61480 > 160.79.104.10.443: Flags [.], cksum 0x93a7 (correct), ack 1434, win 7072, options [nop,nop,TS val 3897045723 ecr 2608718911], length 0
11:58:16.370985 IP (tos 0x0, ttl 54, id 38017, offset 0, flags [DF], proto TCP (6), length 106)
    160.79.104.10.443 > 172.25.187.30.61480: Flags [P.], cksum 0x6ece (correct), seq 1434:1488, ack 1, win 18, options [nop,nop,TS val 2608719042 ecr 3897045723], length 54
11:58:16.371176 IP (tos 0x0, ttl 64, id 0, offset 0, flags [DF], proto TCP (6), length 52)
    172.25.187.30.61480 > 160.79.104.10.443: Flags [.], cksum 0x926b (correct), ack 1488, win 7072, options [nop,nop,TS val 3897045854 ecr 2608719042], length 0
11:58:16.371469 IP (tos 0x0, ttl 54, id 38018, offset 0, flags [DF], proto TCP (6), length 118)
    160.79.104.10.443 > 172.25.187.30.61480: Flags [P.], cksum 0xf7d2 (correct), seq 1488:1554, ack 1, win 18, options [nop,nop,TS val 2608719043 ecr 3897045723], length 66
11:58:16.371469 IP (tos 0x0, ttl 54, id 38019, offset 0, flags [DF], proto TCP (6), length 138)
    160.79.104.10.443 > 172.25.187.30.61480: Flags [P.], cksum 0x3de7 (correct), seq 1554:1640, ack 1, win 18, options [nop,nop,TS val 2608719044 ecr 3897045723], length 86
11:58:16.371518 IP (tos 0x0, ttl 64, id 0, offset 0, flags [DF], proto TCP (6), length 52)
    172.25.187.30.61480 > 160.79.104.10.443: Flags [.], cksum 0x91d1 (correct), ack 1640, win 7072, options [nop,nop,TS val 3897045854 ecr 2608719044], length 0
11:58:16.407635 IP (tos 0x0, ttl 54, id 38020, offset 0, flags [DF], proto TCP (6), length 284)
    160.79.104.10.443 > 172.25.187.30.61480: Flags [P.], cksum 0x199a (correct), seq 1640:1872, ack 1, win 18, options [nop,nop,TS val 2608719079 ecr 3897045854], length 232
11:58:16.407833 IP (tos 0x0, ttl 64, id 0, offset 0, flags [DF], proto TCP (6), length 52)
    172.25.187.30.61480 > 160.79.104.10.443: Flags [.], cksum 0x90a1 (correct), ack 1872, win 7072, options [nop,nop,TS val 3897045891 ecr 2608719079], length 0
11:58:16.493316 IP (tos 0x0, ttl 54, id 38021, offset 0, flags [DF], proto TCP (6), length 84)
    160.79.104.10.443 > 172.25.187.30.61480: Flags [P.], cksum 0x277a (correct), seq 1872:1904, ack 1, win 18, options [nop,nop,TS val 2608719165 ecr 3897045891], length 32
11:58:16.493316 IP (tos 0x0, ttl 54, id 38022, offset 0, flags [DF], proto TCP (6), length 83)
    160.79.104.10.443 > 172.25.187.30.61480: Flags [P.], cksum 0xbad0 (correct), seq 1904:1935, ack 1, win 18, options [nop,nop,TS val 2608719165 ecr 3897045891], length 31
11:58:16.493522 IP (tos 0x0, ttl 64, id 0, offset 0, flags [DF], proto TCP (6), length 52)
    172.25.187.30.61480 > 160.79.104.10.443: Flags [.], cksum 0x8fb6 (correct), ack 1935, win 7072, options [nop,nop,TS val 3897045977 ecr 2608719165], length 0
11:58:19.490509 IP (tos 0x0, ttl 64, id 0, offset 0, flags [DF], proto TCP (6), length 1073)
    172.25.187.30.61480 > 160.79.104.10.443: Flags [P.], cksum 0x200b (correct), seq 1:1022, ack 1935, win 7072, options [nop,nop,TS val 3897048974 ecr 2608719165], length 1021
11:58:19.501740 IP (tos 0x0, ttl 54, id 38023, offset 0, flags [DF], proto TCP (6), length 52)
    160.79.104.10.443 > 172.25.187.30.61480: Flags [.], cksum 0x8fd3 (correct), ack 1022, win 18, options [nop,nop,TS val 2608722172 ecr 3897048974], length 0
11:58:19.517686 IP (tos 0x0, ttl 64, id 0, offset 0, flags [DF], proto TCP (6), length 258)
    172.25.187.30.61480 > 160.79.104.10.443: Flags [P.], cksum 0xb64d (correct), seq 1022:1228, ack 1935, win 7072, options [nop,nop,TS val 3897049001 ecr 2608722172], length 206
11:58:19.519899 IP (tos 0x0, ttl 64, id 0, offset 0, flags [DF], proto TCP (6), length 306)
    172.25.187.30.61480 > 160.79.104.10.443: Flags [P.], cksum 0x3a89 (correct), seq 1228:1482, ack 1935, win 7072, options [nop,nop,TS val 3897049003 ecr 2608722172], length 254
11:58:19.524827 IP (tos 0x0, ttl 54, id 38024, offset 0, flags [DF], proto TCP (6), length 52)
    160.79.104.10.443 > 172.25.187.30.61480: Flags [.], cksum 0x8ed2 (correct), ack 1228, win 18, options [nop,nop,TS val 2608722196 ecr 3897049001], length 0
11:58:19.527093 IP (tos 0x0, ttl 54, id 38025, offset 0, flags [DF], proto TCP (6), length 52)
    160.79.104.10.443 > 172.25.187.30.61480: Flags [.], cksum 0x8dd0 (correct), ack 1482, win 18, options [nop,nop,TS val 2608722198 ecr 3897049003], length 0
11:58:19.589180 IP (tos 0x0, ttl 64, id 0, offset 0, flags [DF], proto TCP (6), length 506)
    172.25.187.30.61480 > 160.79.104.10.443: Flags [P.], cksum 0x75d8 (correct), seq 1482:1936, ack 1935, win 7072, options [nop,nop,TS val 3897049072 ecr 2608722198], length 454
11:58:19.595562 IP (tos 0x0, ttl 54, id 38026, offset 0, flags [DF], proto TCP (6), length 52)
    160.79.104.10.443 > 172.25.187.30.61480: Flags [.], cksum 0x8b80 (correct), ack 1936, win 18, options [nop,nop,TS val 2608722267 ecr 3897049072], length 0
11:58:19.629790 IP (tos 0x0, ttl 64, id 11697, offset 0, flags [none], proto TCP (6), length 40)
    172.25.187.30.61485 > 160.79.104.10.443: Flags [.], cksum 0x9748 (correct), ack 1990766233, win 2048, length 0
11:58:19.636522 IP (tos 0x0, ttl 54, id 29655, offset 0, flags [DF], proto TCP (6), length 52)
    160.79.104.10.443 > 172.25.187.30.61485: Flags [.], cksum 0x81f6 (correct), ack 1, win 16, options [nop,nop,TS val 1531549179 ecr 2817477365], length 0
11:58:19.672997 IP (tos 0x0, ttl 54, id 38027, offset 0, flags [DF], proto TCP (6), length 379)
    160.79.104.10.443 > 172.25.187.30.61480: Flags [P.], cksum 0x1402 (correct), seq 1935:2262, ack 1936, win 18, options [nop,nop,TS val 2608722344 ecr 3897049072], length 327
11:58:19.672998 IP (tos 0x0, ttl 54, id 38028, offset 0, flags [DF], proto TCP (6), length 192)
    160.79.104.10.443 > 172.25.187.30.61480: Flags [P.], cksum 0x9043 (correct), seq 2262:2402, ack 1936, win 18, options [nop,nop,TS val 2608722344 ecr 3897049072], length 140
11:58:19.672999 IP (tos 0x0, ttl 54, id 38029, offset 0, flags [DF], proto TCP (6), length 83)
    160.79.104.10.443 > 172.25.187.30.61480: Flags [P.], cksum 0x585b (correct), seq 2402:2433, ack 1936, win 18, options [nop,nop,TS val 2608722345 ecr 3897049072], length 31
11:58:19.673124 IP (tos 0x0, ttl 64, id 0, offset 0, flags [DF], proto TCP (6), length 52)
    172.25.187.30.61480 > 160.79.104.10.443: Flags [.], cksum 0x6d65 (correct), ack 2433, win 7065, options [nop,nop,TS val 3897049156 ecr 2608722345], length 0
11:58:19.673861 IP (tos 0x0, ttl 64, id 0, offset 0, flags [DF], proto TCP (6), length 87)
    172.25.187.30.61480 > 160.79.104.10.443: Flags [P.], cksum 0x7e0c (correct), seq 1936:1971, ack 2433, win 7072, options [nop,nop,TS val 3897049156 ecr 2608722345], length 35
11:58:19.681134 IP (tos 0x0, ttl 54, id 38030, offset 0, flags [DF], proto TCP (6), length 52)
    160.79.104.10.443 > 172.25.187.30.61480: Flags [.], cksum 0x88c2 (correct), ack 1971, win 18, options [nop,nop,TS val 2608722352 ecr 3897049156], length 0
11:58:19.771862 IP (tos 0x0, ttl 54, id 38031, offset 0, flags [DF], proto TCP (6), length 402)
    160.79.104.10.443 > 172.25.187.30.61480: Flags [P.], cksum 0x6dd6 (correct), seq 2433:2783, ack 1971, win 18, options [nop,nop,TS val 2608722443 ecr 3897049156], length 350
11:58:19.771864 IP (tos 0x0, ttl 54, id 38032, offset 0, flags [DF], proto TCP (6), length 1426)
    160.79.104.10.443 > 172.25.187.30.61480: Flags [.], cksum 0xca11 (correct), seq 2783:4157, ack 1971, win 18, options [nop,nop,TS val 2608722443 ecr 3897049156], length 1374
11:58:19.771865 IP (tos 0x0, ttl 54, id 38033, offset 0, flags [DF], proto TCP (6), length 1426)
    160.79.104.10.443 > 172.25.187.30.61480: Flags [.], cksum 0xf2dc (correct), seq 4157:5531, ack 1971, win 18, options [nop,nop,TS val 2608722443 ecr 3897049156], length 1374
11:58:19.771865 IP (tos 0x0, ttl 54, id 38034, offset 0, flags [DF], proto TCP (6), length 1426)
    160.79.104.10.443 > 172.25.187.30.61480: Flags [.], cksum 0xcd3f (correct), seq 5531:6905, ack 1971, win 18, options [nop,nop,TS val 2608722443 ecr 3897049156], length 1374
11:58:19.771994 IP (tos 0x0, ttl 64, id 0, offset 0, flags [DF], proto TCP (6), length 52)
    172.25.187.30.61480 > 160.79.104.10.443: Flags [.], cksum 0x5b43 (correct), ack 6905, win 7003, options [nop,nop,TS val 3897049255 ecr 2608722443], length 0
11:58:19.772193 IP (tos 0x0, ttl 64, id 0, offset 0, flags [DF], proto TCP (6), length 52)
    172.25.187.30.61480 > 160.79.104.10.443: Flags [.], cksum 0x5afe (correct), ack 6905, win 7072, options [nop,nop,TS val 3897049255 ecr 2608722443], length 0
11:58:19.772471 IP (tos 0x0, ttl 54, id 38035, offset 0, flags [DF], proto TCP (6), length 406)
    160.79.104.10.443 > 172.25.187.30.61480: Flags [P.], cksum 0xc684 (correct), seq 6905:7259, ack 1971, win 18, options [nop,nop,TS val 2608722443 ecr 3897049156], length 354
11:58:19.772471 IP (tos 0x0, ttl 54, id 38036, offset 0, flags [DF], proto TCP (6), length 83)
    160.79.104.10.443 > 172.25.187.30.61480: Flags [P.], cksum 0x801b (correct), seq 7259:7290, ack 1971, win 18, options [nop,nop,TS val 2608722443 ecr 3897049156], length 31
11:58:19.772507 IP (tos 0x0, ttl 64, id 0, offset 0, flags [DF], proto TCP (6), length 52)
    172.25.187.30.61480 > 160.79.104.10.443: Flags [.], cksum 0x5983 (correct), ack 7290, win 7066, options [nop,nop,TS val 3897049255 ecr 2608722443], length 0
11:58:19.792377 IP (tos 0x0, ttl 54, id 38037, offset 0, flags [DF], proto TCP (6), length 527)
    160.79.104.10.443 > 172.25.187.30.61480: Flags [P.], cksum 0x3934 (correct), seq 7290:7765, ack 1971, win 18, options [nop,nop,TS val 2608722464 ecr 3897049255], length 475
11:58:19.792378 IP (tos 0x0, ttl 54, id 38038, offset 0, flags [DF], proto TCP (6), length 105)
    160.79.104.10.443 > 172.25.187.30.61480: Flags [P.], cksum 0x667f (correct), seq 7765:7818, ack 1971, win 18, options [nop,nop,TS val 2608722464 ecr 3897049255], length 53
11:58:19.792435 IP (tos 0x0, ttl 64, id 0, offset 0, flags [DF], proto TCP (6), length 52)
    172.25.187.30.61480 > 160.79.104.10.443: Flags [.], cksum 0x574b (correct), ack 7818, win 7064, options [nop,nop,TS val 3897049276 ecr 2608722464], length 0
11:58:19.792910 IP (tos 0x0, ttl 54, id 38039, offset 0, flags [DF], proto TCP (6), length 83)
    160.79.104.10.443 > 172.25.187.30.61480: Flags [P.], cksum 0x0e0d (correct), seq 7818:7849, ack 1971, win 18, options [nop,nop,TS val 2608722464 ecr 3897049255], length 31
11:58:19.792938 IP (tos 0x0, ttl 64, id 0, offset 0, flags [DF], proto TCP (6), length 52)
    172.25.187.30.61480 > 160.79.104.10.443: Flags [.], cksum 0x5724 (correct), ack 7849, win 7072, options [nop,nop,TS val 3897049276 ecr 2608722464], length 0
11:58:19.808237 IP (tos 0x0, ttl 54, id 38040, offset 0, flags [DF], proto TCP (6), length 360)
    160.79.104.10.443 > 172.25.187.30.61480: Flags [P.], cksum 0x08e5 (correct), seq 7849:8157, ack 1971, win 18, options [nop,nop,TS val 2608722479 ecr 3897049276], length 308
11:58:19.808238 IP (tos 0x0, ttl 54, id 38041, offset 0, flags [DF], proto TCP (6), length 201)
    160.79.104.10.443 > 172.25.187.30.61480: Flags [P.], cksum 0xc168 (correct), seq 8157:8306, ack 1971, win 18, options [nop,nop,TS val 2608722479 ecr 3897049276], length 149
11:58:19.808308 IP (tos 0x0, ttl 64, id 0, offset 0, flags [DF], proto TCP (6), length 52)
    172.25.187.30.61480 > 160.79.104.10.443: Flags [.], cksum 0x5544 (correct), ack 8306, win 7065, options [nop,nop,TS val 3897049291 ecr 2608722479], length 0
11:58:24.100130 IP (tos 0x0, ttl 64, id 8266, offset 0, flags [none], proto TCP (6), length 40)
    172.25.187.30.61494 > 160.79.104.10.443: Flags [.], cksum 0x5e68 (correct), ack 1017203800, win 2048, length 0
11:58:24.117334 IP (tos 0x0, ttl 54, id 8474, offset 0, flags [DF], proto TCP (6), length 52)
    160.79.104.10.443 > 172.25.187.30.61494: Flags [.], cksum 0x5249 (correct), ack 1, win 16, options [nop,nop,TS val 2015671171 ecr 3233017498], length 0
11:58:26.515550 IP (tos 0x0, ttl 64, id 65483, offset 0, flags [none], proto TCP (6), length 40)
    172.25.187.30.61482 > 160.79.104.10.443: Flags [.], cksum 0xad0b (correct), ack 4268080827, win 2048, length 0
11:58:26.523156 IP (tos 0x0, ttl 54, id 3919, offset 0, flags [DF], proto TCP (6), length 52)
    160.79.104.10.443 > 172.25.187.30.61482: Flags [.], cksum 0x63b2 (correct), ack 1, win 15, options [nop,nop,TS val 3758868725 ecr 2302404084], length 0
11:58:49.776643 IP (tos 0x0, ttl 64, id 0, offset 0, flags [DF], proto TCP (6), length 583)
    172.25.187.30.61480 > 160.79.104.10.443: Flags [P.], cksum 0xdfb2 (correct), seq 1971:2502, ack 8306, win 7072, options [nop,nop,TS val 3897079260 ecr 2608722479], length 531
11:58:49.776682 IP (tos 0x0, ttl 64, id 0, offset 0, flags [DF], proto TCP (6), length 91)
    172.25.187.30.61480 > 160.79.104.10.443: Flags [P.], cksum 0x1068 (correct), seq 2502:2541, ack 8306, win 7072, options [nop,nop,TS val 3897079260 ecr 2608722479], length 39
11:58:49.776690 IP (tos 0x0, ttl 64, id 0, offset 0, flags [DF], proto TCP (6), length 365)
    172.25.187.30.61480 > 160.79.104.10.443: Flags [P.], cksum 0x69c6 (correct), seq 2541:2854, ack 8306, win 7072, options [nop,nop,TS val 3897079260 ecr 2608722479], length 313
11:58:49.788761 IP (tos 0x0, ttl 54, id 38042, offset 0, flags [DF], proto TCP (6), length 52)
    160.79.104.10.443 > 172.25.187.30.61480: Flags [.], cksum 0x848b (correct), ack 2502, win 18, options [nop,nop,TS val 2608752458 ecr 3897079260], length 0
11:58:49.788762 IP (tos 0x0, ttl 54, id 38043, offset 0, flags [DF], proto TCP (6), length 52)
    160.79.104.10.443 > 172.25.187.30.61480: Flags [.], cksum 0x8464 (correct), ack 2541, win 18, options [nop,nop,TS val 2608752458 ecr 3897079260], length 0
11:58:49.788762 IP (tos 0x0, ttl 54, id 38044, offset 0, flags [DF], proto TCP (6), length 52)
    160.79.104.10.443 > 172.25.187.30.61480: Flags [.], cksum 0x832b (correct), ack 2854, win 18, options [nop,nop,TS val 2608752458 ecr 3897079260], length 0
11:58:49.788762 IP (tos 0x0, ttl 54, id 38045, offset 0, flags [DF], proto TCP (6), length 91)
    160.79.104.10.443 > 172.25.187.30.61480: Flags [P.], cksum 0x6998 (correct), seq 8306:8345, ack 2854, win 18, options [nop,nop,TS val 2608752458 ecr 3897079260], length 39
11:58:49.788855 IP (tos 0x0, ttl 64, id 0, offset 0, flags [DF], proto TCP (6), length 52)
    172.25.187.30.61480 > 160.79.104.10.443: Flags [.], cksum 0x676a (correct), ack 8345, win 7072, options [nop,nop,TS val 3897079272 ecr 2608752458], length 0
11:58:49.796537 IP (tos 0x0, ttl 64, id 0, offset 0, flags [DF], proto TCP (6), length 530)
    172.25.187.30.61480 > 160.79.104.10.443: Flags [P.], cksum 0x8123 (correct), seq 2854:3332, ack 8345, win 7072, options [nop,nop,TS val 3897079279 ecr 2608752458], length 478
11:58:49.796573 IP (tos 0x0, ttl 64, id 0, offset 0, flags [DF], proto TCP (6), length 757)
    172.25.187.30.61480 > 160.79.104.10.443: Flags [P.], cksum 0x7e20 (correct), seq 3332:4037, ack 8345, win 7072, options [nop,nop,TS val 3897079279 ecr 2608752458], length 705
11:58:49.803084 IP (tos 0x0, ttl 54, id 38046, offset 0, flags [DF], proto TCP (6), length 52)
    160.79.104.10.443 > 172.25.187.30.61480: Flags [.], cksum 0x7e42 (correct), ack 4037, win 18, options [nop,nop,TS val 2608752474 ecr 3897079279], length 0
11:58:49.875802 IP (tos 0x0, ttl 64, id 0, offset 0, flags [DF], proto TCP (6), length 1224)
    172.25.187.30.61480 > 160.79.104.10.443: Flags [P.], cksum 0xc075 (correct), seq 4037:5209, ack 8345, win 7072, options [nop,nop,TS val 3897079359 ecr 2608752474], length 1172
11:58:49.875846 IP (tos 0x0, ttl 64, id 0, offset 0, flags [DF], proto TCP (6), length 453)
    172.25.187.30.61480 > 160.79.104.10.443: Flags [P.], cksum 0xbe02 (correct), seq 5209:5610, ack 8345, win 7072, options [nop,nop,TS val 3897079359 ecr 2608752474], length 401
11:58:49.882907 IP (tos 0x0, ttl 54, id 38047, offset 0, flags [DF], proto TCP (6), length 52)
    160.79.104.10.443 > 172.25.187.30.61480: Flags [.], cksum 0x777e (correct), ack 5610, win 18, options [nop,nop,TS val 2608752553 ecr 3897079359], length 0
11:58:49.892058 IP (tos 0x0, ttl 64, id 0, offset 0, flags [DF], proto TCP (6), length 116)
    172.25.187.30.61485 > 160.79.104.10.443: Flags [P.], cksum 0x9141 (correct), seq 1:65, ack 1, win 2048, options [nop,nop,TS val 2817552818 ecr 1531549179], length 64
11:58:49.892104 IP (tos 0x0, ttl 64, id 0, offset 0, flags [DF], proto TCP (6), length 91)
    172.25.187.30.61485 > 160.79.104.10.443: Flags [P.], cksum 0xcbdd (correct), seq 65:104, ack 1, win 2048, options [nop,nop,TS val 2817552818 ecr 1531549179], length 39
11:58:49.892115 IP (tos 0x0, ttl 64, id 0, offset 0, flags [DF], proto TCP (6), length 1426)
    172.25.187.30.61485 > 160.79.104.10.443: Flags [.], cksum 0xe490 (correct), seq 104:1478, ack 1, win 2048, options [nop,nop,TS val 2817552818 ecr 1531549179], length 1374
11:58:49.892117 IP (tos 0x0, ttl 64, id 0, offset 0, flags [DF], proto TCP (6), length 1001)
    172.25.187.30.61485 > 160.79.104.10.443: Flags [P.], cksum 0xbca6 (correct), seq 1478:2427, ack 1, win 2048, options [nop,nop,TS val 2817552818 ecr 1531549179], length 949
11:58:49.898502 IP (tos 0x0, ttl 54, id 29656, offset 0, flags [DF], proto TCP (6), length 52)
    160.79.104.10.443 > 172.25.187.30.61485: Flags [.], cksum 0xe4c1 (correct), ack 65, win 16, options [nop,nop,TS val 1531579441 ecr 2817552818], length 0
11:58:49.898503 IP (tos 0x0, ttl 54, id 29657, offset 0, flags [DF], proto TCP (6), length 52)
    160.79.104.10.443 > 172.25.187.30.61485: Flags [.], cksum 0xe49a (correct), ack 104, win 16, options [nop,nop,TS val 1531579441 ecr 2817552818], length 0
11:58:49.898503 IP (tos 0x0, ttl 54, id 29658, offset 0, flags [DF], proto TCP (6), length 52)
    160.79.104.10.443 > 172.25.187.30.61485: Flags [.], cksum 0xdf3c (correct), ack 1478, win 16, options [nop,nop,TS val 1531579441 ecr 2817552818], length 0
11:58:49.898503 IP (tos 0x0, ttl 54, id 29659, offset 0, flags [DF], proto TCP (6), length 91)
    160.79.104.10.443 > 172.25.187.30.61485: Flags [P.], cksum 0xc22b (correct), seq 1:40, ack 1478, win 16, options [nop,nop,TS val 1531579441 ecr 2817552818], length 39
11:58:49.898574 IP (tos 0x0, ttl 64, id 0, offset 0, flags [DF], proto TCP (6), length 52)
    172.25.187.30.61485 > 160.79.104.10.443: Flags [.], cksum 0xd36a (correct), ack 40, win 2048, options [nop,nop,TS val 2817552824 ecr 1531579441], length 0
11:58:49.913204 IP (tos 0x0, ttl 64, id 0, offset 0, flags [DF], proto TCP (6), length 1001)
    172.25.187.30.61485 > 160.79.104.10.443: Flags [P.], cksum 0x4634 (correct), seq 1478:2427, ack 40, win 2048, options [nop,nop,TS val 2817552839 ecr 1531579441], length 949
11:58:49.920168 IP (tos 0x0, ttl 54, id 29660, offset 0, flags [DF], proto TCP (6), length 64)
    160.79.104.10.443 > 172.25.187.30.61485: Flags [.], cksum 0x823f (correct), ack 2427, win 16, options [nop,nop,TS val 1531579462 ecr 2817552839,nop,nop,sack 1 {1478:2427}], length 0
11:58:49.943746 IP (tos 0x0, ttl 54, id 38048, offset 0, flags [DF], proto TCP (6), length 239)
    160.79.104.10.443 > 172.25.187.30.61480: Flags [P.], cksum 0x5e56 (correct), seq 8345:8532, ack 5610, win 18, options [nop,nop,TS val 2608752615 ecr 3897079359], length 187
11:58:49.943748 IP (tos 0x0, ttl 54, id 38049, offset 0, flags [DF], proto TCP (6), length 105)
    160.79.104.10.443 > 172.25.187.30.61480: Flags [P.], cksum 0x9e22 (correct), seq 8532:8585, ack 5610, win 18, options [nop,nop,TS val 2608752615 ecr 3897079359], length 53
11:58:49.943853 IP (tos 0x0, ttl 64, id 0, offset 0, flags [DF], proto TCP (6), length 52)
    172.25.187.30.61480 > 160.79.104.10.443: Flags [.], cksum 0x5a81 (correct), ack 8585, win 7069, options [nop,nop,TS val 3897079427 ecr 2608752615], length 0
11:58:49.945219 IP (tos 0x0, ttl 54, id 38050, offset 0, flags [DF], proto TCP (6), length 83)
    160.79.104.10.443 > 172.25.187.30.61480: Flags [P.], cksum 0xda24 (correct), seq 8585:8616, ack 5610, win 18, options [nop,nop,TS val 2608752615 ecr 3897079359], length 31
11:58:49.945267 IP (tos 0x0, ttl 64, id 0, offset 0, flags [DF], proto TCP (6), length 52)
    172.25.187.30.61480 > 160.79.104.10.443: Flags [.], cksum 0x5a5e (correct), ack 8616, win 7072, options [nop,nop,TS val 3897079428 ecr 2608752615], length 0
11:58:49.945551 IP (tos 0x0, ttl 64, id 0, offset 0, flags [DF], proto TCP (6), length 87)
    172.25.187.30.61480 > 160.79.104.10.443: Flags [P.], cksum 0xa6ef (correct), seq 5610:5645, ack 8616, win 7072, options [nop,nop,TS val 3897079428 ecr 2608752615], length 35
11:58:49.994499 IP (tos 0x0, ttl 54, id 38051, offset 0, flags [DF], proto TCP (6), length 52)
    160.79.104.10.443 > 172.25.187.30.61480: Flags [.], cksum 0x7597 (correct), ack 5645, win 18, options [nop,nop,TS val 2608752665 ecr 3897079428], length 0
11:58:50.002755 IP (tos 0x0, ttl 54, id 38052, offset 0, flags [DF], proto TCP (6), length 143)
    160.79.104.10.443 > 172.25.187.30.61480: Flags [P.], cksum 0x4742 (correct), seq 8616:8707, ack 5645, win 18, options [nop,nop,TS val 2608752674 ecr 3897079428], length 91
11:58:50.002756 IP (tos 0x0, ttl 54, id 38053, offset 0, flags [DF], proto TCP (6), length 642)
    160.79.104.10.443 > 172.25.187.30.61480: Flags [P.], cksum 0x6e2e (correct), seq 8707:9297, ack 5645, win 18, options [nop,nop,TS val 2608752674 ecr 3897079428], length 590
11:58:50.002843 IP (tos 0x0, ttl 64, id 0, offset 0, flags [DF], proto TCP (6), length 52)
    172.25.187.30.61480 > 160.79.104.10.443: Flags [.], cksum 0x5727 (correct), ack 9297, win 7062, options [nop,nop,TS val 3897079486 ecr 2608752674], length 0
11:58:50.003723 IP (tos 0x0, ttl 54, id 38054, offset 0, flags [DF], proto TCP (6), length 83)
    160.79.104.10.443 > 172.25.187.30.61480: Flags [P.], cksum 0xdaf3 (correct), seq 9297:9328, ack 5645, win 18, options [nop,nop,TS val 2608752674 ecr 3897079428], length 31
11:58:50.003758 IP (tos 0x0, ttl 64, id 0, offset 0, flags [DF], proto TCP (6), length 52)
    172.25.187.30.61480 > 160.79.104.10.443: Flags [.], cksum 0x56fe (correct), ack 9328, win 7072, options [nop,nop,TS val 3897079486 ecr 2608752674], length 0
11:58:50.018254 IP (tos 0x0, ttl 54, id 29661, offset 0, flags [DF], proto TCP (6), length 352)
    160.79.104.10.443 > 172.25.187.30.61485: Flags [P.], cksum 0xed9c (correct), seq 40:340, ack 2427, win 16, options [nop,nop,TS val 1531579561 ecr 2817552839], length 300
11:58:50.018254 IP (tos 0x0, ttl 54, id 29662, offset 0, flags [DF], proto TCP (6), length 104)
    160.79.104.10.443 > 172.25.187.30.61485: Flags [P.], cksum 0x5422 (correct), seq 340:392, ack 2427, win 16, options [nop,nop,TS val 1531579561 ecr 2817552839], length 52
11:58:50.018297 IP (tos 0x0, ttl 64, id 0, offset 0, flags [DF], proto TCP (6), length 52)
    172.25.187.30.61485 > 160.79.104.10.443: Flags [.], cksum 0xd11f (correct), ack 392, win 2043, options [nop,nop,TS val 2817552944 ecr 1531579561], length 0
11:58:50.019726 IP (tos 0x0, ttl 54, id 29663, offset 0, flags [DF], proto TCP (6), length 83)
    160.79.104.10.443 > 172.25.187.30.61485: Flags [P.], cksum 0x2e84 (correct), seq 392:423, ack 2427, win 16, options [nop,nop,TS val 1531579561 ecr 2817552839], length 31
11:58:50.019764 IP (tos 0x0, ttl 64, id 0, offset 0, flags [DF], proto TCP (6), length 52)
    172.25.187.30.61485 > 160.79.104.10.443: Flags [.], cksum 0xd0f9 (correct), ack 423, win 2048, options [nop,nop,TS val 2817552946 ecr 1531579561], length 0
11:58:50.020057 IP (tos 0x0, ttl 64, id 0, offset 0, flags [DF], proto TCP (6), length 87)
    172.25.187.30.61485 > 160.79.104.10.443: Flags [P.], cksum 0x1ca3 (correct), seq 2427:2462, ack 423, win 2048, options [nop,nop,TS val 2817552946 ecr 1531579561], length 35
11:58:50.027663 IP (tos 0x0, ttl 54, id 29664, offset 0, flags [DF], proto TCP (6), length 52)
    160.79.104.10.443 > 172.25.187.30.61485: Flags [.], cksum 0xd8be (correct), ack 2462, win 16, options [nop,nop,TS val 1531579569 ecr 2817552946], length 0
11:58:50.080865 IP (tos 0x0, ttl 54, id 38055, offset 0, flags [DF], proto TCP (6), length 167)
    160.79.104.10.443 > 172.25.187.30.61480: Flags [P.], cksum 0x0595 (correct), seq 9328:9443, ack 5645, win 18, options [nop,nop,TS val 2608752752 ecr 3897079486], length 115
11:58:50.080866 IP (tos 0x0, ttl 54, id 38056, offset 0, flags [DF], proto TCP (6), length 170)
    160.79.104.10.443 > 172.25.187.30.61480: Flags [P.], cksum 0x518d (correct), seq 9443:9561, ack 5645, win 18, options [nop,nop,TS val 2608752752 ecr 3897079486], length 118
11:58:50.080971 IP (tos 0x0, ttl 64, id 0, offset 0, flags [DF], proto TCP (6), length 52)
    172.25.187.30.61480 > 160.79.104.10.443: Flags [.], cksum 0x557c (correct), ack 9561, win 7069, options [nop,nop,TS val 3897079564 ecr 2608752752], length 0
11:58:50.081878 IP (tos 0x0, ttl 54, id 38057, offset 0, flags [DF], proto TCP (6), length 83)
    160.79.104.10.443 > 172.25.187.30.61480: Flags [P.], cksum 0x39b6 (correct), seq 9561:9592, ack 5645, win 18, options [nop,nop,TS val 2608752752 ecr 3897079486], length 31
11:58:50.081916 IP (tos 0x0, ttl 64, id 0, offset 0, flags [DF], proto TCP (6), length 52)
    172.25.187.30.61480 > 160.79.104.10.443: Flags [.], cksum 0x555a (correct), ack 9592, win 7072, options [nop,nop,TS val 3897079564 ecr 2608752752], length 0
11:58:52.026022 IP (tos 0x0, ttl 54, id 38058, offset 0, flags [DF], proto TCP (6), length 252)
    160.79.104.10.443 > 172.25.187.30.61480: Flags [P.], cksum 0xc758 (correct), seq 9592:9792, ack 5645, win 18, options [nop,nop,TS val 2608754697 ecr 3897079564], length 200
11:58:52.026024 IP (tos 0x0, ttl 54, id 38059, offset 0, flags [DF], proto TCP (6), length 284)
    160.79.104.10.443 > 172.25.187.30.61480: Flags [P.], cksum 0x212b (correct), seq 9792:10024, ack 5645, win 18, options [nop,nop,TS val 2608754697 ecr 3897079564], length 232
11:58:52.026149 IP (tos 0x0, ttl 64, id 0, offset 0, flags [DF], proto TCP (6), length 52)
    172.25.187.30.61480 > 160.79.104.10.443: Flags [.], cksum 0x447e (correct), ack 10024, win 7066, options [nop,nop,TS val 3897081509 ecr 2608754697], length 0
11:58:52.026846 IP (tos 0x0, ttl 54, id 38060, offset 0, flags [DF], proto TCP (6), length 206)
    160.79.104.10.443 > 172.25.187.30.61480: Flags [P.], cksum 0x3dc2 (correct), seq 10024:10178, ack 5645, win 18, options [nop,nop,TS val 2608754697 ecr 3897079564], length 154
11:58:52.026847 IP (tos 0x0, ttl 54, id 38061, offset 0, flags [DF], proto TCP (6), length 134)
    160.79.104.10.443 > 172.25.187.30.61480: Flags [P.], cksum 0x9732 (correct), seq 10178:10260, ack 5645, win 18, options [nop,nop,TS val 2608754698 ecr 3897079564], length 82
11:58:52.026921 IP (tos 0x0, ttl 64, id 0, offset 0, flags [DF], proto TCP (6), length 52)
    172.25.187.30.61480 > 160.79.104.10.443: Flags [.], cksum 0x438f (correct), ack 10260, win 7068, options [nop,nop,TS val 3897081509 ecr 2608754698], length 0
11:58:52.242270 IP (tos 0x0, ttl 54, id 38062, offset 0, flags [DF], proto TCP (6), length 120)
