tcpdump: data link type PKTAP
tcpdump: WARNING: snaplen raised from 96 to 524288
tcpdump: listening on pktap, link-type PKTAP (Apple DLT_PKTAP), snapshot length 524288 bytes
08:58:08.135358 IP (tos 0x0, ttl 54, id 31828, offset 0, flags [DF], proto TCP (6), length 143)
    160.79.104.10.443 > 172.25.186.179.55410: Flags [P.], cksum 0x7610 (correct), seq 2249199463:2249199554, ack 557051805, win 35, options [nop,nop,TS val 1201213977 ecr 2463788302], length 91
08:58:08.135358 IP (tos 0x0, ttl 54, id 31829, offset 0, flags [DF], proto TCP (6), length 1426)
    160.79.104.10.443 > 172.25.186.179.55410: Flags [.], cksum 0x56b0 (correct), seq 91:1465, ack 1, win 35, options [nop,nop,TS val 1201213980 ecr 2463788302], length 1374
08:58:08.135359 IP (tos 0x0, ttl 54, id 31830, offset 0, flags [DF], proto TCP (6), length 1426)
    160.79.104.10.443 > 172.25.186.179.55410: Flags [.], cksum 0x92ba (correct), seq 1465:2839, ack 1, win 35, options [nop,nop,TS val 1201213980 ecr 2463788302], length 1374
08:58:08.135360 IP (tos 0x0, ttl 54, id 31831, offset 0, flags [DF], proto TCP (6), length 263)
    160.79.104.10.443 > 172.25.186.179.55410: Flags [P.], cksum 0x37d8 (correct), seq 2839:3050, ack 1, win 35, options [nop,nop,TS val 1201213980 ecr 2463788302], length 211
08:58:08.135361 IP (tos 0x0, ttl 54, id 31832, offset 0, flags [DF], proto TCP (6), length 83)
    160.79.104.10.443 > 172.25.186.179.55410: Flags [P.], cksum 0x0119 (correct), seq 3050:3081, ack 1, win 35, options [nop,nop,TS val 1201213980 ecr 2463788302], length 31
08:58:08.135361 IP (tos 0x0, ttl 54, id 31833, offset 0, flags [DF], proto TCP (6), length 83)
    160.79.104.10.443 > 172.25.186.179.55410: Flags [P.], cksum 0x00fd (correct), seq 3050:3081, ack 1, win 35, options [nop,nop,TS val 1201214008 ecr 2463788302], length 31
08:58:08.135503 IP (tos 0x0, ttl 64, id 0, offset 0, flags [DF], proto TCP (6), length 52)
    172.25.186.179.55410 > 160.79.104.10.443: Flags [.], cksum 0x0be3 (correct), ack 3081, win 4770, options [nop,nop,TS val 2463789058 ecr 1201213980], length 0
08:58:08.135582 IP (tos 0x0, ttl 64, id 0, offset 0, flags [DF], proto TCP (6), length 64)
    172.25.186.179.55410 > 160.79.104.10.443: Flags [.], cksum 0x92cd (correct), ack 3081, win 4770, options [nop,nop,TS val 2463789058 ecr 1201214008,nop,nop,sack 1 {3050:3081}], length 0
08:58:08.135671 IP (tos 0x0, ttl 64, id 0, offset 0, flags [DF], proto TCP (6), length 52)
    172.25.186.179.55410 > 160.79.104.10.443: Flags [.], cksum 0x0b97 (correct), ack 3081, win 4818, options [nop,nop,TS val 2463789058 ecr 1201214008], length 0
08:58:08.137334 IP (tos 0x0, ttl 64, id 0, offset 0, flags [DF], proto TCP (6), length 87)
    172.25.186.179.55410 > 160.79.104.10.443: Flags [P.], cksum 0xc4b2 (correct), seq 1:36, ack 3081, win 4818, options [nop,nop,TS val 2463789060 ecr 1201214008], length 35
08:58:08.185121 IP (tos 0x0, ttl 54, id 31834, offset 0, flags [DF], proto TCP (6), length 52)
    160.79.104.10.443 > 172.25.186.179.55410: Flags [.], cksum 0x1d64 (correct), ack 36, win 35, options [nop,nop,TS val 1201214197 ecr 2463789060], length 0
08:58:11.006260 IP (tos 0x0, ttl 64, id 60930, offset 0, flags [none], proto TCP (6), length 40)
    172.25.186.179.55411 > 160.79.104.10.443: Flags [.], cksum 0xf725 (correct), ack 3270915827, win 2048, length 0
08:58:11.016366 IP (tos 0x0, ttl 54, id 21446, offset 0, flags [DF], proto TCP (6), length 52)
    160.79.104.10.443 > 172.25.186.179.55411: Flags [.], cksum 0x569d (correct), ack 1, win 17, options [nop,nop,TS val 1981301958 ecr 170895953], length 0
08:58:17.101727 IP (tos 0x0, ttl 64, id 0, offset 0, flags [DF], proto TCP (6), length 393)
    172.25.186.179.55410 > 160.79.104.10.443: Flags [P.], cksum 0x09e3 (correct), seq 36:377, ack 3081, win 4818, options [nop,nop,TS val 2463798024 ecr 1201214197], length 341
08:58:17.101762 IP (tos 0x0, ttl 64, id 0, offset 0, flags [DF], proto TCP (6), length 241)
    172.25.186.179.55410 > 160.79.104.10.443: Flags [P.], cksum 0xebb5 (correct), seq 377:566, ack 3081, win 4818, options [nop,nop,TS val 2463798024 ecr 1201214197], length 189
08:58:17.111762 IP (tos 0x0, ttl 54, id 31835, offset 0, flags [DF], proto TCP (6), length 52)
    160.79.104.10.443 > 172.25.186.179.55410: Flags [.], cksum 0xd62d (correct), ack 377, win 35, options [nop,nop,TS val 1201223122 ecr 2463798024], length 0
08:58:17.111763 IP (tos 0x0, ttl 54, id 31836, offset 0, flags [DF], proto TCP (6), length 52)
    160.79.104.10.443 > 172.25.186.179.55410: Flags [.], cksum 0xd570 (correct), ack 566, win 35, options [nop,nop,TS val 1201223122 ecr 2463798024], length 0
08:58:17.121407 IP (tos 0x0, ttl 64, id 0, offset 0, flags [DF], proto TCP (6), length 391)
    172.25.186.179.55410 > 160.79.104.10.443: Flags [P.], cksum 0x94bb (correct), seq 566:905, ack 3081, win 4818, options [nop,nop,TS val 2463798044 ecr 1201223122], length 339
08:58:17.121437 IP (tos 0x0, ttl 64, id 0, offset 0, flags [DF], proto TCP (6), length 633)
    172.25.186.179.55410 > 160.79.104.10.443: Flags [P.], cksum 0xd4fc (correct), seq 905:1486, ack 3081, win 4818, options [nop,nop,TS val 2463798044 ecr 1201223122], length 581
08:58:17.128290 IP (tos 0x0, ttl 54, id 31837, offset 0, flags [DF], proto TCP (6), length 52)
    160.79.104.10.443 > 172.25.186.179.55410: Flags [.], cksum 0xd3f9 (correct), ack 905, win 35, options [nop,nop,TS val 1201223138 ecr 2463798044], length 0
08:58:17.128290 IP (tos 0x0, ttl 54, id 31838, offset 0, flags [DF], proto TCP (6), length 52)
    160.79.104.10.443 > 172.25.186.179.55410: Flags [.], cksum 0xd1b4 (correct), ack 1486, win 35, options [nop,nop,TS val 1201223138 ecr 2463798044], length 0
08:58:17.185546 IP (tos 0x0, ttl 64, id 0, offset 0, flags [DF], proto TCP (6), length 406)
    172.25.186.179.55410 > 160.79.104.10.443: Flags [P.], cksum 0x0953 (correct), seq 1486:1840, ack 3081, win 4818, options [nop,nop,TS val 2463798108 ecr 1201223138], length 354
08:58:17.185617 IP (tos 0x0, ttl 64, id 0, offset 0, flags [DF], proto TCP (6), length 1426)
    172.25.186.179.55410 > 160.79.104.10.443: Flags [.], cksum 0x71c0 (correct), seq 1840:3214, ack 3081, win 4818, options [nop,nop,TS val 2463798108 ecr 1201223138], length 1374
08:58:17.185624 IP (tos 0x0, ttl 64, id 0, offset 0, flags [DF], proto TCP (6), length 218)
    172.25.186.179.55410 > 160.79.104.10.443: Flags [P.], cksum 0x7930 (correct), seq 3214:3380, ack 3081, win 4818, options [nop,nop,TS val 2463798108 ecr 1201223138], length 166
08:58:17.194510 IP (tos 0x0, ttl 54, id 31839, offset 0, flags [DF], proto TCP (6), length 52)
    160.79.104.10.443 > 172.25.186.179.55410: Flags [.], cksum 0xcfcf (correct), ack 1840, win 35, options [nop,nop,TS val 1201223205 ecr 2463798108], length 0
08:58:17.194510 IP (tos 0x0, ttl 54, id 31840, offset 0, flags [DF], proto TCP (6), length 64)
    160.79.104.10.443 > 172.25.186.179.55410: Flags [.], cksum 0x5e56 (correct), ack 1840, win 35, options [nop,nop,TS val 1201223205 ecr 2463798108,nop,nop,sack 1 {3214:3380}], length 0
08:58:17.194560 IP (tos 0x0, ttl 64, id 0, offset 0, flags [DF], proto TCP (6), length 1426)
    172.25.186.179.55410 > 160.79.104.10.443: Flags [.], cksum 0x7174 (correct), seq 1840:3214, ack 3081, win 4818, options [nop,nop,TS val 2463798117 ecr 1201223205], length 1374
08:58:17.196498 IP (tos 0x0, ttl 54, id 31841, offset 0, flags [DF], proto TCP (6), length 52)
    160.79.104.10.443 > 172.25.186.179.55410: Flags [.], cksum 0xc9cb (correct), ack 3380, win 35, options [nop,nop,TS val 1201223205 ecr 2463798108], length 0
08:58:17.199680 IP (tos 0x0, ttl 64, id 0, offset 0, flags [DF], proto TCP (6), length 116)
    172.25.186.179.55414 > 160.79.104.10.443: Flags [P.], cksum 0x8580 (correct), seq 777577841:777577905, ack 3011464874, win 2048, options [nop,nop,TS val 3864262975 ecr 4096604829], length 64
08:58:17.199709 IP (tos 0x0, ttl 64, id 0, offset 0, flags [DF], proto TCP (6), length 91)
    172.25.186.179.55414 > 160.79.104.10.443: Flags [P.], cksum 0xd5e8 (correct), seq 64:103, ack 1, win 2048, options [nop,nop,TS val 3864262975 ecr 4096604829], length 39
08:58:17.199717 IP (tos 0x0, ttl 64, id 0, offset 0, flags [DF], proto TCP (6), length 1426)
    172.25.186.179.55414 > 160.79.104.10.443: Flags [.], cksum 0x0251 (correct), seq 103:1477, ack 1, win 2048, options [nop,nop,TS val 3864262975 ecr 4096604829], length 1374
08:58:17.199722 IP (tos 0x0, ttl 64, id 0, offset 0, flags [DF], proto TCP (6), length 940)
    172.25.186.179.55414 > 160.79.104.10.443: Flags [P.], cksum 0x9675 (correct), seq 1477:2365, ack 1, win 2048, options [nop,nop,TS val 3864262975 ecr 4096604829], length 888
08:58:17.202215 IP (tos 0x0, ttl 54, id 31842, offset 0, flags [DF], proto TCP (6), length 64)
    160.79.104.10.443 > 172.25.186.179.55410: Flags [.], cksum 0x5e4f (correct), ack 3380, win 35, options [nop,nop,TS val 1201223212 ecr 2463798108,nop,nop,sack 1 {1840:3214}], length 0
08:58:17.206551 IP (tos 0x0, ttl 54, id 6937, offset 0, flags [DF], proto TCP (6), length 52)
    160.79.104.10.443 > 172.25.186.179.55414: Flags [.], cksum 0xb7db (correct), ack 64, win 19, options [nop,nop,TS val 4096625536 ecr 3864262975], length 0
08:58:17.206551 IP (tos 0x0, ttl 54, id 6938, offset 0, flags [DF], proto TCP (6), length 52)
    160.79.104.10.443 > 172.25.186.179.55414: Flags [.], cksum 0xb7b4 (correct), ack 103, win 19, options [nop,nop,TS val 4096625536 ecr 3864262975], length 0
08:58:17.206551 IP (tos 0x0, ttl 54, id 6939, offset 0, flags [DF], proto TCP (6), length 52)
    160.79.104.10.443 > 172.25.186.179.55414: Flags [.], cksum 0xaede (correct), ack 2365, win 19, options [nop,nop,TS val 4096625536 ecr 3864262975], length 0
08:58:17.206552 IP (tos 0x0, ttl 54, id 6940, offset 0, flags [DF], proto TCP (6), length 91)
    160.79.104.10.443 > 172.25.186.179.55414: Flags [P.], cksum 0x077a (correct), seq 1:40, ack 2365, win 19, options [nop,nop,TS val 4096625536 ecr 3864262975], length 39
08:58:17.206605 IP (tos 0x0, ttl 64, id 0, offset 0, flags [DF], proto TCP (6), length 52)
    172.25.186.179.55414 > 160.79.104.10.443: Flags [.], cksum 0xa6c3 (correct), ack 40, win 2048, options [nop,nop,TS val 3864262982 ecr 4096625536], length 0
08:58:17.300748 IP (tos 0x0, ttl 54, id 31843, offset 0, flags [DF], proto TCP (6), length 387)
    160.79.104.10.443 > 172.25.186.179.55410: Flags [P.], cksum 0xb56c (correct), seq 3081:3416, ack 3380, win 35, options [nop,nop,TS val 1201223311 ecr 2463798108], length 335
08:58:17.300749 IP (tos 0x0, ttl 54, id 31844, offset 0, flags [DF], proto TCP (6), length 105)
    160.79.104.10.443 > 172.25.186.179.55410: Flags [P.], cksum 0xd7ca (correct), seq 3416:3469, ack 3380, win 35, options [nop,nop,TS val 1201223311 ecr 2463798108], length 53
08:58:17.300750 IP (tos 0x0, ttl 54, id 31845, offset 0, flags [DF], proto TCP (6), length 83)
    160.79.104.10.443 > 172.25.186.179.55410: Flags [P.], cksum 0xd9a7 (correct), seq 3469:3500, ack 3380, win 35, options [nop,nop,TS val 1201223311 ecr 2463798108], length 31
08:58:17.300839 IP (tos 0x0, ttl 64, id 0, offset 0, flags [DF], proto TCP (6), length 52)
    172.25.186.179.55410 > 160.79.104.10.443: Flags [.], cksum 0xb4a2 (correct), ack 3500, win 4812, options [nop,nop,TS val 2463798223 ecr 1201223311], length 0
08:58:17.301331 IP (tos 0x0, ttl 64, id 0, offset 0, flags [DF], proto TCP (6), length 87)
    172.25.186.179.55410 > 160.79.104.10.443: Flags [P.], cksum 0xf084 (correct), seq 3380:3415, ack 3500, win 4818, options [nop,nop,TS val 2463798223 ecr 1201223311], length 35
08:58:17.308611 IP (tos 0x0, ttl 54, id 31846, offset 0, flags [DF], proto TCP (6), length 52)
    160.79.104.10.443 > 172.25.186.179.55410: Flags [.], cksum 0xc720 (correct), ack 3415, win 35, options [nop,nop,TS val 1201223319 ecr 2463798223], length 0
08:58:17.344660 IP (tos 0x0, ttl 54, id 31847, offset 0, flags [DF], proto TCP (6), length 143)
    160.79.104.10.443 > 172.25.186.179.55410: Flags [P.], cksum 0x4b7c (correct), seq 3500:3591, ack 3415, win 35, options [nop,nop,TS val 1201223355 ecr 2463798223], length 91
08:58:17.344703 IP (tos 0x0, ttl 64, id 0, offset 0, flags [DF], proto TCP (6), length 52)
    172.25.186.179.55410 > 160.79.104.10.443: Flags [.], cksum 0xb3c7 (correct), ack 3591, win 4817, options [nop,nop,TS val 2463798267 ecr 1201223355], length 0
08:58:17.362135 IP (tos 0x0, ttl 54, id 31848, offset 0, flags [DF], proto TCP (6), length 170)
    160.79.104.10.443 > 172.25.186.179.55410: Flags [P.], cksum 0x728b (correct), seq 3591:3709, ack 3415, win 35, options [nop,nop,TS val 1201223372 ecr 2463798267], length 118
08:58:17.362136 IP (tos 0x0, ttl 54, id 31849, offset 0, flags [DF], proto TCP (6), length 83)
    160.79.104.10.443 > 172.25.186.179.55410: Flags [P.], cksum 0x7b43 (correct), seq 3709:3740, ack 3415, win 35, options [nop,nop,TS val 1201223372 ecr 2463798267], length 31
08:58:17.362178 IP (tos 0x0, ttl 64, id 0, offset 0, flags [DF], proto TCP (6), length 52)
    172.25.186.179.55410 > 160.79.104.10.443: Flags [.], cksum 0xb310 (correct), ack 3740, win 4816, options [nop,nop,TS val 2463798285 ecr 1201223372], length 0
08:58:17.365300 IP (tos 0x0, ttl 54, id 6941, offset 0, flags [DF], proto TCP (6), length 354)
    160.79.104.10.443 > 172.25.186.179.55414: Flags [P.], cksum 0xc797 (correct), seq 40:342, ack 2365, win 19, options [nop,nop,TS val 4096625693 ecr 3864262982], length 302
08:58:17.365300 IP (tos 0x0, ttl 54, id 6942, offset 0, flags [DF], proto TCP (6), length 104)
    160.79.104.10.443 > 172.25.186.179.55414: Flags [P.], cksum 0xdcee (correct), seq 342:394, ack 2365, win 19, options [nop,nop,TS val 4096625693 ecr 3864262982], length 52
08:58:17.365300 IP (tos 0x0, ttl 54, id 6943, offset 0, flags [DF], proto TCP (6), length 83)
    160.79.104.10.443 > 172.25.186.179.55414: Flags [P.], cksum 0xebfe (correct), seq 394:425, ack 2365, win 19, options [nop,nop,TS val 4096625693 ecr 3864262982], length 31
08:58:17.365358 IP (tos 0x0, ttl 64, id 0, offset 0, flags [DF], proto TCP (6), length 52)
    172.25.186.179.55414 > 160.79.104.10.443: Flags [.], cksum 0xa40c (correct), ack 425, win 2042, options [nop,nop,TS val 3864263141 ecr 4096625693], length 0
08:58:17.365698 IP (tos 0x0, ttl 64, id 0, offset 0, flags [DF], proto TCP (6), length 87)
    172.25.186.179.55414 > 160.79.104.10.443: Flags [P.], cksum 0x359b (correct), seq 2365:2400, ack 425, win 2048, options [nop,nop,TS val 3864263141 ecr 4096625693], length 35
08:58:17.369503 IP (tos 0x0, ttl 54, id 31850, offset 0, flags [DF], proto TCP (6), length 143)
    160.79.104.10.443 > 172.25.186.179.55410: Flags [P.], cksum 0xf90e (correct), seq 3740:3831, ack 3415, win 35, options [nop,nop,TS val 1201223379 ecr 2463798267], length 91
08:58:17.369504 IP (tos 0x0, ttl 54, id 31851, offset 0, flags [DF], proto TCP (6), length 642)
    160.79.104.10.443 > 172.25.186.179.55410: Flags [P.], cksum 0xdef7 (correct), seq 3831:4421, ack 3415, win 35, options [nop,nop,TS val 1201223379 ecr 2463798267], length 590
08:58:17.369504 IP (tos 0x0, ttl 54, id 31852, offset 0, flags [DF], proto TCP (6), length 83)
    160.79.104.10.443 > 172.25.186.179.55410: Flags [P.], cksum 0x8881 (correct), seq 4421:4452, ack 3415, win 35, options [nop,nop,TS val 1201223379 ecr 2463798267], length 31
08:58:17.369550 IP (tos 0x0, ttl 64, id 0, offset 0, flags [DF], proto TCP (6), length 52)
    172.25.186.179.55410 > 160.79.104.10.443: Flags [.], cksum 0xb043 (correct), ack 4452, win 4807, options [nop,nop,TS val 2463798292 ecr 1201223379], length 0
08:58:17.413042 IP (tos 0x0, ttl 54, id 6944, offset 0, flags [DF], proto TCP (6), length 52)
    160.79.104.10.443 > 172.25.186.179.55414: Flags [.], cksum 0xab9e (correct), ack 2400, win 19, options [nop,nop,TS val 4096625743 ecr 3864263141], length 0
08:58:20.451847 IP (tos 0x0, ttl 54, id 31853, offset 0, flags [DF], proto TCP (6), length 204)
    160.79.104.10.443 > 172.25.186.179.55410: Flags [P.], cksum 0x4908 (correct), seq 4452:4604, ack 3415, win 35, options [nop,nop,TS val 1201226441 ecr 2463798292], length 152
08:58:20.451848 IP (tos 0x0, ttl 54, id 31854, offset 0, flags [DF], proto TCP (6), length 85)
    160.79.104.10.443 > 172.25.186.179.55410: Flags [P.], cksum 0xdf2c (correct), seq 4604:4637, ack 3415, win 35, options [nop,nop,TS val 1201226441 ecr 2463798292], length 33
08:58:20.451849 IP (tos 0x0, ttl 54, id 31855, offset 0, flags [DF], proto TCP (6), length 281)
    160.79.104.10.443 > 172.25.186.179.55410: Flags [P.], cksum 0xcbee (correct), seq 4637:4866, ack 3415, win 35, options [nop,nop,TS val 1201226444 ecr 2463798292], length 229
08:58:20.451849 IP (tos 0x0, ttl 54, id 31856, offset 0, flags [DF], proto TCP (6), length 208)
    160.79.104.10.443 > 172.25.186.179.55410: Flags [P.], cksum 0xe19f (correct), seq 4866:5022, ack 3415, win 35, options [nop,nop,TS val 1201226449 ecr 2463798292], length 156
08:58:20.451850 IP (tos 0x0, ttl 54, id 31857, offset 0, flags [DF], proto TCP (6), length 157)
    160.79.104.10.443 > 172.25.186.179.55410: Flags [P.], cksum 0xe90c (correct), seq 5022:5127, ack 3415, win 35, options [nop,nop,TS val 1201226459 ecr 2463798292], length 105
08:58:20.451979 IP (tos 0x0, ttl 64, id 0, offset 0, flags [DF], proto TCP (6), length 52)
    172.25.186.179.55410 > 160.79.104.10.443: Flags [.], cksum 0x958e (correct), ack 5127, win 4807, options [nop,nop,TS val 2463801374 ecr 1201226459], length 0
08:58:20.455883 IP (tos 0x0, ttl 54, id 31858, offset 0, flags [DF], proto TCP (6), length 106)
    160.79.104.10.443 > 172.25.186.179.55410: Flags [P.], cksum 0xb1cf (correct), seq 5127:5181, ack 3415, win 35, options [nop,nop,TS val 1201226467 ecr 2463798292], length 54
08:58:20.455967 IP (tos 0x0, ttl 64, id 0, offset 0, flags [DF], proto TCP (6), length 52)
    172.25.186.179.55410 > 160.79.104.10.443: Flags [.], cksum 0x9542 (correct), ack 5181, win 4817, options [nop,nop,TS val 2463801378 ecr 1201226467], length 0
08:58:20.541754 IP (tos 0x0, ttl 54, id 31859, offset 0, flags [DF], proto TCP (6), length 101)
    160.79.104.10.443 > 172.25.186.179.55410: Flags [P.], cksum 0xee4e (correct), seq 5181:5230, ack 3415, win 35, options [nop,nop,TS val 1201226552 ecr 2463801378], length 49
08:58:20.541862 IP (tos 0x0, ttl 64, id 0, offset 0, flags [DF], proto TCP (6), length 52)
    172.25.186.179.55410 > 160.79.104.10.443: Flags [.], cksum 0x9466 (correct), ack 5230, win 4817, options [nop,nop,TS val 2463801464 ecr 1201226552], length 0
08:58:20.608257 IP (tos 0x0, ttl 54, id 31860, offset 0, flags [DF], proto TCP (6), length 107)
    160.79.104.10.443 > 172.25.186.179.55410: Flags [P.], cksum 0x72a6 (correct), seq 5230:5285, ack 3415, win 35, options [nop,nop,TS val 1201226618 ecr 2463801464], length 55
08:58:20.608331 IP (tos 0x0, ttl 64, id 0, offset 0, flags [DF], proto TCP (6), length 52)
    172.25.186.179.55410 > 160.79.104.10.443: Flags [.], cksum 0x93aa (correct), ack 5285, win 4817, options [nop,nop,TS val 2463801531 ecr 1201226618], length 0
08:58:20.713314 IP (tos 0x0, ttl 54, id 31861, offset 0, flags [DF], proto TCP (6), length 103)
    160.79.104.10.443 > 172.25.186.179.55410: Flags [P.], cksum 0x41ac (correct), seq 5285:5336, ack 3415, win 35, options [nop,nop,TS val 1201226651 ecr 2463801531], length 51
08:58:20.713438 IP (tos 0x0, ttl 64, id 0, offset 0, flags [DF], proto TCP (6), length 52)
    172.25.186.179.55410 > 160.79.104.10.443: Flags [.], cksum 0x92ed (correct), ack 5336, win 4817, options [nop,nop,TS val 2463801636 ecr 1201226651], length 0
08:58:20.733407 IP (tos 0x0, ttl 54, id 31862, offset 0, flags [DF], proto TCP (6), length 109)
    160.79.104.10.443 > 172.25.186.179.55410: Flags [P.], cksum 0xed85 (correct), seq 5336:5393, ack 3415, win 35, options [nop,nop,TS val 1201226743 ecr 2463801636], length 57
08:58:20.733513 IP (tos 0x0, ttl 64, id 0, offset 0, flags [DF], proto TCP (6), length 52)
    172.25.186.179.55410 > 160.79.104.10.443: Flags [.], cksum 0x9244 (correct), ack 5393, win 4817, options [nop,nop,TS val 2463801656 ecr 1201226743], length 0
08:58:21.065241 IP (tos 0x0, ttl 54, id 31863, offset 0, flags [DF], proto TCP (6), length 122)
    160.79.104.10.443 > 172.25.186.179.55410: Flags [P.], cksum 0x100e (correct), seq 5393:5463, ack 3415, win 35, options [nop,nop,TS val 1201226986 ecr 2463801656], length 70
08:58:21.065242 IP (tos 0x0, ttl 54, id 31864, offset 0, flags [DF], proto TCP (6), length 249)
    160.79.104.10.443 > 172.25.186.179.55410: Flags [P.], cksum 0x47b1 (correct), seq 5463:5660, ack 3415, win 35, options [nop,nop,TS val 1201226987 ecr 2463801656], length 197
08:58:21.065358 IP (tos 0x0, ttl 64, id 0, offset 0, flags [DF], proto TCP (6), length 52)
    172.25.186.179.55410 > 160.79.104.10.443: Flags [.], cksum 0x8efc (correct), ack 5660, win 4814, options [nop,nop,TS val 2463801988 ecr 1201226987], length 0
08:58:21.067310 IP (tos 0x0, ttl 54, id 31865, offset 0, flags [DF], proto TCP (6), length 148)
    160.79.104.10.443 > 172.25.186.179.55410: Flags [P.], cksum 0xeba2 (correct), seq 5660:5756, ack 3415, win 35, options [nop,nop,TS val 1201226993 ecr 2463801656], length 96
08:58:21.067310 IP (tos 0x0, ttl 54, id 31866, offset 0, flags [DF], proto TCP (6), length 133)
    160.79.104.10.443 > 172.25.186.179.55410: Flags [P.], cksum 0xb412 (correct), seq 5756:5837, ack 3415, win 35, options [nop,nop,TS val 1201226999 ecr 2463801656], length 81
08:58:21.067311 IP (tos 0x0, ttl 54, id 31867, offset 0, flags [DF], proto TCP (6), length 98)
    160.79.104.10.443 > 172.25.186.179.55410: Flags [P.], cksum 0xd6de (correct), seq 5837:5883, ack 3415, win 35, options [nop,nop,TS val 1201227041 ecr 2463801656], length 46
08:58:21.067311 IP (tos 0x0, ttl 54, id 31868, offset 0, flags [DF], proto TCP (6), length 115)
    160.79.104.10.443 > 172.25.186.179.55410: Flags [P.], cksum 0x7c1b (correct), seq 5883:5946, ack 3415, win 35, options [nop,nop,TS val 1201227049 ecr 2463801656], length 63
08:58:21.067312 IP (tos 0x0, ttl 54, id 31869, offset 0, flags [DF], proto TCP (6), length 106)
    160.79.104.10.443 > 172.25.186.179.55410: Flags [P.], cksum 0x0285 (correct), seq 5946:6000, ack 3415, win 35, options [nop,nop,TS val 1201227071 ecr 2463801656], length 54
08:58:21.067367 IP (tos 0x0, ttl 64, id 0, offset 0, flags [DF], proto TCP (6), length 52)
    172.25.186.179.55410 > 160.79.104.10.443: Flags [.], cksum 0x8d53 (correct), ack 6000, win 4813, options [nop,nop,TS val 2463801990 ecr 1201227071], length 0
08:58:21.237836 IP (tos 0x0, ttl 54, id 31870, offset 0, flags [DF], proto TCP (6), length 101)
    160.79.104.10.443 > 172.25.186.179.55410: Flags [P.], cksum 0x2d91 (correct), seq 6000:6049, ack 3415, win 35, options [nop,nop,TS val 1201227185 ecr 2463801990], length 49
08:58:21.237837 IP (tos 0x0, ttl 54, id 31871, offset 0, flags [DF], proto TCP (6), length 108)
    160.79.104.10.443 > 172.25.186.179.55410: Flags [P.], cksum 0x36dc (correct), seq 6049:6105, ack 3415, win 35, options [nop,nop,TS val 1201227186 ecr 2463801990], length 56
08:58:21.237837 IP (tos 0x0, ttl 54, id 31872, offset 0, flags [DF], proto TCP (6), length 114)
    160.79.104.10.443 > 172.25.186.179.55410: Flags [P.], cksum 0x6867 (correct), seq 6105:6167, ack 3415, win 35, options [nop,nop,TS val 1201227187 ecr 2463801990], length 62
08:58:21.237951 IP (tos 0x0, ttl 64, id 0, offset 0, flags [DF], proto TCP (6), length 52)
    172.25.186.179.55410 > 160.79.104.10.443: Flags [.], cksum 0x8b8c (correct), ack 6167, win 4815, options [nop,nop,TS val 2463802160 ecr 1201227187], length 0
08:58:21.359260 IP (tos 0x0, ttl 54, id 31873, offset 0, flags [DF], proto TCP (6), length 101)
    160.79.104.10.443 > 172.25.186.179.55410: Flags [P.], cksum 0xc77b (correct), seq 6167:6216, ack 3415, win 35, options [nop,nop,TS val 1201227369 ecr 2463802160], length 49
08:58:21.359305 IP (tos 0x0, ttl 64, id 0, offset 0, flags [DF], proto TCP (6), length 52)
    172.25.186.179.55410 > 160.79.104.10.443: Flags [.], cksum 0x8a29 (correct), ack 6216, win 4817, options [nop,nop,TS val 2463802282 ecr 1201227369], length 0
08:58:21.360582 IP (tos 0x0, ttl 54, id 31874, offset 0, flags [DF], proto TCP (6), length 104)
    160.79.104.10.443 > 172.25.186.179.55410: Flags [P.], cksum 0x5c6e (correct), seq 6216:6268, ack 3415, win 35, options [nop,nop,TS val 1201227371 ecr 2463802160], length 52
08:58:21.360629 IP (tos 0x0, ttl 64, id 0, offset 0, flags [DF], proto TCP (6), length 52)
    172.25.186.179.55410 > 160.79.104.10.443: Flags [.], cksum 0x89f2 (correct), ack 6268, win 4817, options [nop,nop,TS val 2463802283 ecr 1201227371], length 0
08:58:21.477206 IP (tos 0x0, ttl 54, id 31875, offset 0, flags [DF], proto TCP (6), length 105)
    160.79.104.10.443 > 172.25.186.179.55410: Flags [P.], cksum 0xc946 (correct), seq 6268:6321, ack 3415, win 35, options [nop,nop,TS val 1201227488 ecr 2463802283], length 53
08:58:21.477294 IP (tos 0x0, ttl 64, id 0, offset 0, flags [DF], proto TCP (6), length 52)
    172.25.186.179.55410 > 160.79.104.10.443: Flags [.], cksum 0x88d4 (correct), ack 6321, win 4817, options [nop,nop,TS val 2463802399 ecr 1201227488], length 0
08:58:21.532948 IP (tos 0x0, ttl 54, id 31876, offset 0, flags [DF], proto TCP (6), length 121)
    160.79.104.10.443 > 172.25.186.179.55410: Flags [P.], cksum 0x94ab (correct), seq 6321:6390, ack 3415, win 35, options [nop,nop,TS val 1201227543 ecr 2463802399], length 69
08:58:21.533153 IP (tos 0x0, ttl 64, id 0, offset 0, flags [DF], proto TCP (6), length 52)
    172.25.186.179.55410 > 160.79.104.10.443: Flags [.], cksum 0x881f (correct), ack 6390, win 4818, options [nop,nop,TS val 2463802455 ecr 1201227543], length 0
08:58:21.586089 IP (tos 0x0, ttl 54, id 31877, offset 0, flags [DF], proto TCP (6), length 105)
    160.79.104.10.443 > 172.25.186.179.55410: Flags [P.], cksum 0x4792 (correct), seq 6390:6443, ack 3415, win 35, options [nop,nop,TS val 1201227595 ecr 2463802455], length 53
08:58:21.586276 IP (tos 0x0, ttl 64, id 0, offset 0, flags [DF], proto TCP (6), length 52)
    172.25.186.179.55410 > 160.79.104.10.443: Flags [.], cksum 0x8781 (correct), ack 6443, win 4818, options [nop,nop,TS val 2463802508 ecr 1201227595], length 0
08:58:21.641797 IP (tos 0x0, ttl 54, id 31878, offset 0, flags [DF], proto TCP (6), length 96)
    160.79.104.10.443 > 172.25.186.179.55410: Flags [P.], cksum 0xcba3 (correct), seq 6443:6487, ack 3415, win 35, options [nop,nop,TS val 1201227652 ecr 2463802508], length 44
08:58:21.642009 IP (tos 0x0, ttl 64, id 0, offset 0, flags [DF], proto TCP (6), length 52)
    172.25.186.179.55410 > 160.79.104.10.443: Flags [.], cksum 0x86e4 (correct), ack 6487, win 4818, options [nop,nop,TS val 2463802564 ecr 1201227652], length 0
08:58:21.643872 IP (tos 0x0, ttl 54, id 31879, offset 0, flags [DF], proto TCP (6), length 106)
    160.79.104.10.443 > 172.25.186.179.55410: Flags [P.], cksum 0x39f0 (correct), seq 6487:6541, ack 3415, win 35, options [nop,nop,TS val 1201227654 ecr 2463802508], length 54
08:58:21.644003 IP (tos 0x0, ttl 64, id 0, offset 0, flags [DF], proto TCP (6), length 52)
    172.25.186.179.55410 > 160.79.104.10.443: Flags [.], cksum 0x86aa (correct), ack 6541, win 4818, options [nop,nop,TS val 2463802566 ecr 1201227654], length 0
08:58:21.765836 IP (tos 0x0, ttl 64, id 0, offset 0, flags [DF], proto TCP (6), length 350)
    172.25.186.179.55410 > 160.79.104.10.443: Flags [P.], cksum 0xb211 (correct), seq 3415:3713, ack 6541, win 4818, options [nop,nop,TS val 2463802688 ecr 1201227654], length 298
08:58:21.766145 IP (tos 0x0, ttl 64, id 0, offset 0, flags [DF], proto TCP (6), length 224)
    172.25.186.179.55410 > 160.79.104.10.443: Flags [P.], cksum 0x6067 (correct), seq 3713:3885, ack 6541, win 4818, options [nop,nop,TS val 2463802688 ecr 1201227654], length 172
08:58:21.772957 IP (tos 0x0, ttl 54, id 31880, offset 0, flags [DF], proto TCP (6), length 52)
    160.79.104.10.443 > 172.25.186.179.55410: Flags [.], cksum 0x9687 (correct), ack 3885, win 35, options [nop,nop,TS val 1201227784 ecr 2463802688], length 0
08:58:21.779707 IP (tos 0x0, ttl 64, id 0, offset 0, flags [DF], proto TCP (6), length 342)
    172.25.186.179.55410 > 160.79.104.10.443: Flags [P.], cksum 0x942b (correct), seq 3885:4175, ack 6541, win 4818, options [nop,nop,TS val 2463802702 ecr 1201227784], length 290
08:58:21.792687 IP (tos 0x0, ttl 64, id 0, offset 0, flags [DF], proto TCP (6), length 64)
    172.25.186.179.55425 > 160.79.104.10.443: Flags [S], cksum 0xe95a (correct), seq 1494499185, win 65535, options [mss 1460,nop,wscale 6,nop,nop,TS val 3314984481 ecr 0,sackOK,eol], length 0
08:58:21.799956 IP (tos 0x0, ttl 54, id 0, offset 0, flags [DF], proto TCP (6), length 60)
    160.79.104.10.443 > 172.25.186.179.55425: Flags [S.], cksum 0x2c93 (correct), seq 3989265671, ack 1494499186, win 65535, options [mss 1386,sackOK,TS val 1829508643 ecr 3314984481,nop,wscale 13], length 0
08:58:21.800046 IP (tos 0x0, ttl 64, id 0, offset 0, flags [DF], proto TCP (6), length 52)
    172.25.186.179.55425 > 160.79.104.10.443: Flags [.], cksum 0x5307 (correct), ack 1, win 2061, options [nop,nop,TS val 3314984488 ecr 1829508643], length 0
08:58:21.800168 IP (tos 0x0, ttl 64, id 0, offset 0, flags [DF], proto TCP (6), length 1426)
    172.25.186.179.55425 > 160.79.104.10.443: Flags [.], cksum 0xafb4 (correct), seq 1:1375, ack 1, win 2061, options [nop,nop,TS val 3314984488 ecr 1829508643], length 1374
08:58:21.800177 IP (tos 0x0, ttl 64, id 0, offset 0, flags [DF], proto TCP (6), length 413)
    172.25.186.179.55425 > 160.79.104.10.443: Flags [P.], cksum 0xe7c3 (correct), seq 1375:1736, ack 1, win 2061, options [nop,nop,TS val 3314984488 ecr 1829508643], length 361
08:58:21.808423 IP (tos 0x0, ttl 54, id 580, offset 0, flags [DF], proto TCP (6), length 64)
    160.79.104.10.443 > 172.25.186.179.55425: Flags [.], cksum 0xe7b1 (correct), ack 1, win 16, options [nop,nop,TS val 1829508652 ecr 3314984488,nop,nop,sack 1 {1375:1736}], length 0
08:58:21.808423 IP (tos 0x0, ttl 54, id 581, offset 0, flags [DF], proto TCP (6), length 52)
    160.79.104.10.443 > 172.25.186.179.55425: Flags [.], cksum 0x5433 (correct), ack 1736, win 17, options [nop,nop,TS val 1829508652 ecr 3314984488], length 0
08:58:21.808460 IP (tos 0x0, ttl 64, id 0, offset 0, flags [DF], proto TCP (6), length 1426)
    172.25.186.179.55425 > 160.79.104.10.443: Flags [.], cksum 0xafa2 (correct), seq 1:1375, ack 1, win 2061, options [nop,nop,TS val 3314984497 ecr 1829508652], length 1374
08:58:21.813379 IP (tos 0x0, ttl 54, id 582, offset 0, flags [DF], proto TCP (6), length 1426)
    160.79.104.10.443 > 172.25.186.179.55425: Flags [.], cksum 0x596e (correct), seq 1:1375, ack 1736, win 17, options [nop,nop,TS val 1829508656 ecr 3314984488], length 1374
08:58:21.813380 IP (tos 0x0, ttl 54, id 583, offset 0, flags [DF], proto TCP (6), length 1426)
    160.79.104.10.443 > 172.25.186.179.55425: Flags [.], cksum 0x1c90 (correct), seq 1375:2749, ack 1736, win 17, options [nop,nop,TS val 1829508656 ecr 3314984488], length 1374
08:58:21.813380 IP (tos 0x0, ttl 54, id 584, offset 0, flags [DF], proto TCP (6), length 790)
    160.79.104.10.443 > 172.25.186.179.55425: Flags [P.], cksum 0x55f1 (correct), seq 2749:3487, ack 1736, win 17, options [nop,nop,TS val 1829508656 ecr 3314984488], length 738
08:58:21.813431 IP (tos 0x0, ttl 64, id 0, offset 0, flags [DF], proto TCP (6), length 52)
    172.25.186.179.55425 > 160.79.104.10.443: Flags [.], cksum 0x3ebd (correct), ack 3487, win 2007, options [nop,nop,TS val 3314984502 ecr 1829508656], length 0
08:58:21.815064 IP (tos 0x0, ttl 64, id 0, offset 0, flags [DF], proto TCP (6), length 116)
    172.25.186.179.55425 > 160.79.104.10.443: Flags [P.], cksum 0x472f (correct), seq 1736:1800, ack 3487, win 2048, options [nop,nop,TS val 3314984503 ecr 1829508656], length 64
08:58:21.815356 IP (tos 0x0, ttl 54, id 585, offset 0, flags [DF], proto TCP (6), length 64)
    160.79.104.10.443 > 172.25.186.179.55425: Flags [.], cksum 0xda0b (correct), ack 1736, win 17, options [nop,nop,TS val 1829508659 ecr 3314984488,nop,nop,sack 1 {1:1375}], length 0
08:58:21.821809 IP (tos 0x0, ttl 54, id 586, offset 0, flags [DF], proto TCP (6), length 52)
    160.79.104.10.443 > 172.25.186.179.55425: Flags [.], cksum 0x4639 (correct), ack 1800, win 17, options [nop,nop,TS val 1829508665 ecr 3314984503], length 0
08:58:21.821810 IP (tos 0x0, ttl 54, id 587, offset 0, flags [DF], proto TCP (6), length 564)
    160.79.104.10.443 > 172.25.186.179.55425: Flags [P.], cksum 0x994a (correct), seq 3487:3999, ack 1800, win 17, options [nop,nop,TS val 1829508665 ecr 3314984503], length 512
08:58:21.821863 IP (tos 0x0, ttl 64, id 0, offset 0, flags [DF], proto TCP (6), length 52)
    172.25.186.179.55425 > 160.79.104.10.443: Flags [.], cksum 0x3c4b (correct), ack 3999, win 2040, options [nop,nop,TS val 3314984510 ecr 1829508665], length 0
08:58:21.827284 IP (tos 0x0, ttl 54, id 31881, offset 0, flags [DF], proto TCP (6), length 52)
    160.79.104.10.443 > 172.25.186.179.55410: Flags [.], cksum 0x9521 (correct), ack 4175, win 35, options [nop,nop,TS val 1201227838 ecr 2463802702], length 0
08:58:21.831041 IP (tos 0x0, ttl 64, id 0, offset 0, flags [DF], proto TCP (6), length 144)
    172.25.186.179.55425 > 160.79.104.10.443: Flags [P.], cksum 0xfb1e (correct), seq 1800:1892, ack 3999, win 2048, options [nop,nop,TS val 3314984519 ecr 1829508665], length 92
08:58:21.831150 IP (tos 0x0, ttl 64, id 0, offset 0, flags [DF], proto TCP (6), length 626)
    172.25.186.179.55425 > 160.79.104.10.443: Flags [P.], cksum 0xedca (correct), seq 1892:2466, ack 3999, win 2048, options [nop,nop,TS val 3314984519 ecr 1829508665], length 574
08:58:21.831190 IP (tos 0x0, ttl 64, id 0, offset 0, flags [DF], proto TCP (6), length 83)
    172.25.186.179.55425 > 160.79.104.10.443: Flags [P.], cksum 0xe995 (correct), seq 2466:2497, ack 3999, win 2048, options [nop,nop,TS val 3314984519 ecr 1829508665], length 31
08:58:21.837870 IP (tos 0x0, ttl 54, id 588, offset 0, flags [DF], proto TCP (6), length 83)
    160.79.104.10.443 > 172.25.186.179.55425: Flags [P.], cksum 0x5142 (correct), seq 3999:4030, ack 1892, win 17, options [nop,nop,TS val 1829508681 ecr 3314984519], length 31
08:58:21.837928 IP (tos 0x0, ttl 64, id 0, offset 0, flags [DF], proto TCP (6), length 52)
    172.25.186.179.55425 > 160.79.104.10.443: Flags [.], cksum 0x394b (correct), ack 4030, win 2048, options [nop,nop,TS val 3314984526 ecr 1829508681], length 0
08:58:21.838196 IP (tos 0x0, ttl 54, id 589, offset 0, flags [DF], proto TCP (6), length 52)
    160.79.104.10.443 > 172.25.186.179.55425: Flags [.], cksum 0x4140 (correct), ack 2497, win 17, options [nop,nop,TS val 1829508682 ecr 3314984519], length 0
08:58:21.878351 IP (tos 0x0, ttl 54, id 31882, offset 0, flags [DF], proto TCP (6), length 199)
    160.79.104.10.443 > 172.25.186.179.55410: Flags [P.], cksum 0xe98d (correct), seq 6541:6688, ack 4175, win 35, options [nop,nop,TS val 1201227888 ecr 2463802702], length 147
08:58:21.878434 IP (tos 0x0, ttl 64, id 0, offset 0, flags [DF], proto TCP (6), length 52)
    172.25.186.179.55410 > 160.79.104.10.443: Flags [.], cksum 0x814a (correct), ack 6688, win 4818, options [nop,nop,TS val 2463802801 ecr 1201227888], length 0
08:58:21.919304 IP (tos 0x0, ttl 54, id 31883, offset 0, flags [DF], proto TCP (6), length 107)
    160.79.104.10.443 > 172.25.186.179.55410: Flags [P.], cksum 0x76f8 (correct), seq 6688:6743, ack 4175, win 35, options [nop,nop,TS val 1201227929 ecr 2463802801], length 55
08:58:21.919310 IP (tos 0x0, ttl 54, id 590, offset 0, flags [DF], proto TCP (6), length 1426)
    160.79.104.10.443 > 172.25.186.179.55425: Flags [.], cksum 0x9a31 (correct), seq 4030:5404, ack 2497, win 17, options [nop,nop,TS val 1829508764 ecr 3314984526], length 1374
08:58:21.919311 IP (tos 0x0, ttl 54, id 591, offset 0, flags [DF], proto TCP (6), length 69)
    160.79.104.10.443 > 172.25.186.179.55425: Flags [P.], cksum 0xc16d (correct), seq 5404:5421, ack 2497, win 17, options [nop,nop,TS val 1829508764 ecr 3314984526], length 17
08:58:21.919353 IP (tos 0x0, ttl 64, id 0, offset 0, flags [DF], proto TCP (6), length 52)
    172.25.186.179.55425 > 160.79.104.10.443: Flags [.], cksum 0x334c (correct), ack 5421, win 2027, options [nop,nop,TS val 3314984608 ecr 1829508764], length 0
08:58:21.919467 IP (tos 0x0, ttl 64, id 0, offset 0, flags [DF], proto TCP (6), length 52)
    172.25.186.179.55410 > 160.79.104.10.443: Flags [.], cksum 0x80c1 (correct), ack 6743, win 4818, options [nop,nop,TS val 2463802842 ecr 1201227929], length 0
08:58:21.922304 IP (tos 0x0, ttl 54, id 592, offset 0, flags [DF], proto TCP (6), length 368)
    160.79.104.10.443 > 172.25.186.179.55425: Flags [P.], cksum 0x5107 (correct), seq 5421:5737, ack 2497, win 17, options [nop,nop,TS val 1829508764 ecr 3314984526], length 316
08:58:21.922304 IP (tos 0x0, ttl 54, id 593, offset 0, flags [DF], proto TCP (6), length 1203)
    160.79.104.10.443 > 172.25.186.179.55425: Flags [P.], cksum 0x8c93 (correct), seq 5737:6888, ack 2497, win 17, options [nop,nop,TS val 1829508764 ecr 3314984526], length 1151
08:58:21.922305 IP (tos 0x0, ttl 54, id 594, offset 0, flags [DF], proto TCP (6), length 1077)
    160.79.104.10.443 > 172.25.186.179.55425: Flags [P.], cksum 0x2201 (correct), seq 6888:7913, ack 2497, win 17, options [nop,nop,TS val 1829508764 ecr 3314984526], length 1025
08:58:21.922305 IP (tos 0x0, ttl 54, id 595, offset 0, flags [DF], proto TCP (6), length 882)
    160.79.104.10.443 > 172.25.186.179.55425: Flags [P.], cksum 0xd5f3 (correct), seq 7913:8743, ack 2497, win 17, options [nop,nop,TS val 1829508764 ecr 3314984526], length 830
08:58:21.922306 IP (tos 0x0, ttl 54, id 596, offset 0, flags [DF], proto TCP (6), length 93)
    160.79.104.10.443 > 172.25.186.179.55425: Flags [P.], cksum 0x38f0 (correct), seq 8743:8784, ack 2497, win 17, options [nop,nop,TS val 1829508764 ecr 3314984526], length 41
08:58:21.922306 IP (tos 0x0, ttl 54, id 597, offset 0, flags [DF], proto TCP (6), length 83)
    160.79.104.10.443 > 172.25.186.179.55425: Flags [P.], cksum 0xd1ba (correct), seq 8784:8815, ack 2497, win 17, options [nop,nop,TS val 1829508764 ecr 3314984526], length 31
08:58:21.922359 IP (tos 0x0, ttl 64, id 0, offset 0, flags [DF], proto TCP (6), length 52)
    172.25.186.179.55425 > 160.79.104.10.443: Flags [.], cksum 0x2627 (correct), ack 8815, win 1995, options [nop,nop,TS val 3314984611 ecr 1829508764], length 0
08:58:21.922417 IP (tos 0x0, ttl 64, id 0, offset 0, flags [DF], proto TCP (6), length 52)
    172.25.186.179.55425 > 160.79.104.10.443: Flags [.], cksum 0x25f2 (correct), ack 8815, win 2048, options [nop,nop,TS val 3314984611 ecr 1829508764], length 0
08:58:21.927153 IP (tos 0x0, ttl 64, id 0, offset 0, flags [DF], proto TCP (6), length 251)
    172.25.186.179.55425 > 160.79.104.10.443: Flags [P.], cksum 0x44fa (correct), seq 2497:2696, ack 8815, win 2048, options [nop,nop,TS val 3314984615 ecr 1829508764], length 199
08:58:21.933434 IP (tos 0x0, ttl 64, id 0, offset 0, flags [DF], proto TCP (6), length 147)
    172.25.186.179.55425 > 160.79.104.10.443: Flags [P.], cksum 0x6885 (correct), seq 2696:2791, ack 8815, win 2048, options [nop,nop,TS val 3314984622 ecr 1829508764], length 95
08:58:21.940403 IP (tos 0x0, ttl 54, id 598, offset 0, flags [DF], proto TCP (6), length 52)
    160.79.104.10.443 > 172.25.186.179.55425: Flags [.], cksum 0x2ca2 (correct), ack 2791, win 18, options [nop,nop,TS val 1829508784 ecr 3314984615], length 0
08:58:21.951191 IP (tos 0x0, ttl 54, id 31884, offset 0, flags [DF], proto TCP (6), length 167)
    160.79.104.10.443 > 172.25.186.179.55410: Flags [P.], cksum 0x0e2c (correct), seq 6743:6858, ack 4175, win 35, options [nop,nop,TS val 1201227961 ecr 2463802842], length 115
08:58:21.951192 IP (tos 0x0, ttl 54, id 31885, offset 0, flags [DF], proto TCP (6), length 85)
