tcpdump: data link type PKTAP
tcpdump: WARNING: snaplen raised from 96 to 524288
tcpdump: listening on pktap, link-type PKTAP (Apple DLT_PKTAP), snapshot length 524288 bytes
09:04:00.589413 IP (tos 0x0, ttl 64, id 0, offset 0, flags [DF], proto TCP (6), length 1079)
    172.25.186.179.55410 > 160.79.104.10.443: Flags [P.], cksum 0xc8e0 (correct), seq 557124550:557125577, ack 2250089594, win 9090, options [nop,nop,TS val 2464141502 ecr 1201535168], length 1027
09:04:00.589446 IP (tos 0x0, ttl 64, id 0, offset 0, flags [DF], proto TCP (6), length 91)
    172.25.186.179.55410 > 160.79.104.10.443: Flags [P.], cksum 0xd00e (correct), seq 1027:1066, ack 1, win 9090, options [nop,nop,TS val 2464141502 ecr 1201535168], length 39
09:04:00.589453 IP (tos 0x0, ttl 64, id 0, offset 0, flags [DF], proto TCP (6), length 335)
    172.25.186.179.55410 > 160.79.104.10.443: Flags [P.], cksum 0x079d (correct), seq 1066:1349, ack 1, win 9090, options [nop,nop,TS val 2464141502 ecr 1201535168], length 283
09:04:00.599467 IP (tos 0x0, ttl 54, id 34969, offset 0, flags [DF], proto TCP (6), length 52)
    160.79.104.10.443 > 172.25.186.179.55410: Flags [.], cksum 0xb2ea (correct), ack 1027, win 35, options [nop,nop,TS val 1201566600 ecr 2464141502], length 0
09:04:00.599468 IP (tos 0x0, ttl 54, id 34970, offset 0, flags [DF], proto TCP (6), length 52)
    160.79.104.10.443 > 172.25.186.179.55410: Flags [.], cksum 0xb2c3 (correct), ack 1066, win 35, options [nop,nop,TS val 1201566600 ecr 2464141502], length 0
09:04:00.599732 IP (tos 0x0, ttl 54, id 34971, offset 0, flags [DF], proto TCP (6), length 52)
    160.79.104.10.443 > 172.25.186.179.55410: Flags [.], cksum 0xb1a8 (correct), ack 1349, win 35, options [nop,nop,TS val 1201566600 ecr 2464141502], length 0
09:04:00.600006 IP (tos 0x0, ttl 54, id 34972, offset 0, flags [DF], proto TCP (6), length 91)
    160.79.104.10.443 > 172.25.186.179.55410: Flags [P.], cksum 0x3576 (correct), seq 1:40, ack 1349, win 35, options [nop,nop,TS val 1201566601 ecr 2464141502], length 39
09:04:00.600040 IP (tos 0x0, ttl 64, id 0, offset 0, flags [DF], proto TCP (6), length 52)
    172.25.186.179.55410 > 160.79.104.10.443: Flags [.], cksum 0x8e17 (correct), ack 40, win 9090, options [nop,nop,TS val 2464141512 ecr 1201566601], length 0
09:04:00.604454 IP (tos 0x0, ttl 64, id 0, offset 0, flags [DF], proto TCP (6), length 331)
    172.25.186.179.55410 > 160.79.104.10.443: Flags [P.], cksum 0x324b (correct), seq 1349:1628, ack 40, win 9090, options [nop,nop,TS val 2464141517 ecr 1201566601], length 279
09:04:00.604474 IP (tos 0x0, ttl 64, id 0, offset 0, flags [DF], proto TCP (6), length 727)
    172.25.186.179.55410 > 160.79.104.10.443: Flags [P.], cksum 0xad6a (correct), seq 1628:2303, ack 40, win 9090, options [nop,nop,TS val 2464141517 ecr 1201566601], length 675
09:04:00.610590 IP (tos 0x0, ttl 54, id 34973, offset 0, flags [DF], proto TCP (6), length 52)
    160.79.104.10.443 > 172.25.186.179.55410: Flags [.], cksum 0xadad (correct), ack 2303, win 35, options [nop,nop,TS val 1201566611 ecr 2464141517], length 0
09:04:00.674622 IP (tos 0x0, ttl 64, id 0, offset 0, flags [DF], proto TCP (6), length 421)
    172.25.186.179.55410 > 160.79.104.10.443: Flags [P.], cksum 0xa9b8 (correct), seq 2303:2672, ack 40, win 9090, options [nop,nop,TS val 2464141587 ecr 1201566611], length 369
09:04:00.674661 IP (tos 0x0, ttl 64, id 0, offset 0, flags [DF], proto TCP (6), length 927)
    172.25.186.179.55410 > 160.79.104.10.443: Flags [P.], cksum 0x55c6 (correct), seq 2672:3547, ack 40, win 9090, options [nop,nop,TS val 2464141587 ecr 1201566611], length 875
09:04:00.682383 IP (tos 0x0, ttl 54, id 34974, offset 0, flags [DF], proto TCP (6), length 52)
    160.79.104.10.443 > 172.25.186.179.55410: Flags [.], cksum 0xa843 (correct), ack 3547, win 35, options [nop,nop,TS val 1201566683 ecr 2464141587], length 0
09:04:00.686292 IP (tos 0x0, ttl 64, id 0, offset 0, flags [DF], proto TCP (6), length 116)
    172.25.186.179.55414 > 160.79.104.10.443: Flags [P.], cksum 0x29f9 (correct), seq 777607825:777607889, ack 3011470788, win 2048, options [nop,nop,TS val 3864606451 ecr 4096927110], length 64
09:04:00.686319 IP (tos 0x0, ttl 64, id 0, offset 0, flags [DF], proto TCP (6), length 91)
    172.25.186.179.55414 > 160.79.104.10.443: Flags [P.], cksum 0x4be8 (correct), seq 64:103, ack 1, win 2048, options [nop,nop,TS val 3864606451 ecr 4096927110], length 39
09:04:00.686327 IP (tos 0x0, ttl 64, id 0, offset 0, flags [DF], proto TCP (6), length 1426)
    172.25.186.179.55414 > 160.79.104.10.443: Flags [.], cksum 0x07e9 (correct), seq 103:1477, ack 1, win 2048, options [nop,nop,TS val 3864606451 ecr 4096927110], length 1374
09:04:00.686330 IP (tos 0x0, ttl 64, id 0, offset 0, flags [DF], proto TCP (6), length 964)
    172.25.186.179.55414 > 160.79.104.10.443: Flags [P.], cksum 0x4c20 (correct), seq 1477:2389, ack 1, win 2048, options [nop,nop,TS val 3864606451 ecr 4096927110], length 912
09:04:00.692373 IP (tos 0x0, ttl 54, id 7031, offset 0, flags [DF], proto TCP (6), length 52)
    160.79.104.10.443 > 172.25.186.179.55414: Flags [.], cksum 0xb02e (correct), ack 64, win 19, options [nop,nop,TS val 4096969012 ecr 3864606451], length 0
09:04:00.692374 IP (tos 0x0, ttl 54, id 7032, offset 0, flags [DF], proto TCP (6), length 52)
    160.79.104.10.443 > 172.25.186.179.55414: Flags [.], cksum 0xb007 (correct), ack 103, win 19, options [nop,nop,TS val 4096969012 ecr 3864606451], length 0
09:04:00.692374 IP (tos 0x0, ttl 54, id 7033, offset 0, flags [DF], proto TCP (6), length 52)
    160.79.104.10.443 > 172.25.186.179.55414: Flags [.], cksum 0xa718 (correct), ack 2389, win 19, options [nop,nop,TS val 4096969013 ecr 3864606451], length 0
09:04:00.692623 IP (tos 0x0, ttl 54, id 7034, offset 0, flags [DF], proto TCP (6), length 91)
    160.79.104.10.443 > 172.25.186.179.55414: Flags [P.], cksum 0x8f6b (correct), seq 1:40, ack 2389, win 19, options [nop,nop,TS val 4096969013 ecr 3864606451], length 39
09:04:00.692660 IP (tos 0x0, ttl 64, id 0, offset 0, flags [DF], proto TCP (6), length 52)
    172.25.186.179.55414 > 160.79.104.10.443: Flags [.], cksum 0x9efd (correct), ack 40, win 2048, options [nop,nop,TS val 3864606458 ecr 4096969013], length 0
09:04:00.738335 IP (tos 0x0, ttl 54, id 34975, offset 0, flags [DF], proto TCP (6), length 408)
    160.79.104.10.443 > 172.25.186.179.55410: Flags [P.], cksum 0x8d7a (correct), seq 40:396, ack 3547, win 35, options [nop,nop,TS val 1201566739 ecr 2464141587], length 356
09:04:00.738336 IP (tos 0x0, ttl 54, id 34976, offset 0, flags [DF], proto TCP (6), length 105)
    160.79.104.10.443 > 172.25.186.179.55410: Flags [P.], cksum 0x5394 (correct), seq 396:449, ack 3547, win 35, options [nop,nop,TS val 1201566739 ecr 2464141587], length 53
09:04:00.738446 IP (tos 0x0, ttl 64, id 0, offset 0, flags [DF], proto TCP (6), length 52)
    172.25.186.179.55410 > 160.79.104.10.443: Flags [.], cksum 0x82d9 (correct), ack 449, win 9084, options [nop,nop,TS val 2464141651 ecr 1201566739], length 0
09:04:00.738791 IP (tos 0x0, ttl 54, id 34977, offset 0, flags [DF], proto TCP (6), length 83)
    160.79.104.10.443 > 172.25.186.179.55410: Flags [P.], cksum 0xf7f4 (correct), seq 449:480, ack 3547, win 35, options [nop,nop,TS val 1201566739 ecr 2464141587], length 31
09:04:00.738828 IP (tos 0x0, ttl 64, id 0, offset 0, flags [DF], proto TCP (6), length 52)
    172.25.186.179.55410 > 160.79.104.10.443: Flags [.], cksum 0x82b4 (correct), ack 480, win 9090, options [nop,nop,TS val 2464141651 ecr 1201566739], length 0
09:04:00.738983 IP (tos 0x0, ttl 64, id 0, offset 0, flags [DF], proto TCP (6), length 87)
    172.25.186.179.55410 > 160.79.104.10.443: Flags [P.], cksum 0x7d7a (correct), seq 3547:3582, ack 480, win 9090, options [nop,nop,TS val 2464141651 ecr 1201566739], length 35
09:04:00.785993 IP (tos 0x0, ttl 54, id 34978, offset 0, flags [DF], proto TCP (6), length 52)
    160.79.104.10.443 > 172.25.186.179.55410: Flags [.], cksum 0xa5c0 (correct), ack 3582, win 35, options [nop,nop,TS val 1201566787 ecr 2464141651], length 0
09:04:00.824589 IP (tos 0x0, ttl 54, id 7035, offset 0, flags [DF], proto TCP (6), length 448)
    160.79.104.10.443 > 172.25.186.179.55414: Flags [P.], cksum 0x21eb (correct), seq 40:436, ack 2389, win 19, options [nop,nop,TS val 4096969145 ecr 3864606458], length 396
09:04:00.824590 IP (tos 0x0, ttl 54, id 7036, offset 0, flags [DF], proto TCP (6), length 104)
    160.79.104.10.443 > 172.25.186.179.55414: Flags [P.], cksum 0x0664 (correct), seq 436:488, ack 2389, win 19, options [nop,nop,TS val 4096969145 ecr 3864606458], length 52
09:04:00.824716 IP (tos 0x0, ttl 64, id 0, offset 0, flags [DF], proto TCP (6), length 52)
    172.25.186.179.55414 > 160.79.104.10.443: Flags [.], cksum 0x9c3c (correct), ack 488, win 2041, options [nop,nop,TS val 3864606590 ecr 4096969145], length 0
09:04:00.824732 IP (tos 0x0, ttl 54, id 7037, offset 0, flags [DF], proto TCP (6), length 83)
    160.79.104.10.443 > 172.25.186.179.55414: Flags [P.], cksum 0x05c8 (correct), seq 488:519, ack 2389, win 19, options [nop,nop,TS val 4096969145 ecr 3864606458], length 31
09:04:00.824814 IP (tos 0x0, ttl 64, id 0, offset 0, flags [DF], proto TCP (6), length 52)
    172.25.186.179.55414 > 160.79.104.10.443: Flags [.], cksum 0x9c1d (correct), ack 519, win 2041, options [nop,nop,TS val 3864606590 ecr 4096969145], length 0
09:04:00.825221 IP (tos 0x0, ttl 64, id 0, offset 0, flags [DF], proto TCP (6), length 87)
    172.25.186.179.55414 > 160.79.104.10.443: Flags [P.], cksum 0x71c1 (correct), seq 2389:2424, ack 519, win 2048, options [nop,nop,TS val 3864606590 ecr 4096969145], length 35
09:04:00.872510 IP (tos 0x0, ttl 54, id 7038, offset 0, flags [DF], proto TCP (6), length 52)
    160.79.104.10.443 > 172.25.186.179.55414: Flags [.], cksum 0xa3b0 (correct), ack 2424, win 19, options [nop,nop,TS val 4096969193 ecr 3864606590], length 0
09:04:01.062662 IP (tos 0x0, ttl 54, id 34979, offset 0, flags [DF], proto TCP (6), length 147)
    160.79.104.10.443 > 172.25.186.179.55410: Flags [P.], cksum 0xf179 (correct), seq 480:575, ack 3582, win 35, options [nop,nop,TS val 1201567063 ecr 2464141651], length 95
09:04:01.062762 IP (tos 0x0, ttl 64, id 0, offset 0, flags [DF], proto TCP (6), length 52)
    172.25.186.179.55410 > 160.79.104.10.443: Flags [.], cksum 0x7fab (correct), ack 575, win 9089, options [nop,nop,TS val 2464141975 ecr 1201567063], length 0
09:04:01.069608 IP (tos 0x0, ttl 54, id 34980, offset 0, flags [DF], proto TCP (6), length 170)
    160.79.104.10.443 > 172.25.186.179.55410: Flags [P.], cksum 0xba81 (correct), seq 575:693, ack 3582, win 35, options [nop,nop,TS val 1201567070 ecr 2464141975], length 118
09:04:01.069609 IP (tos 0x0, ttl 54, id 34981, offset 0, flags [DF], proto TCP (6), length 83)
    160.79.104.10.443 > 172.25.186.179.55410: Flags [P.], cksum 0xf0cf (correct), seq 693:724, ack 3582, win 35, options [nop,nop,TS val 1201567070 ecr 2464141975], length 31
09:04:01.069717 IP (tos 0x0, ttl 64, id 0, offset 0, flags [DF], proto TCP (6), length 52)
    172.25.186.179.55410 > 160.79.104.10.443: Flags [.], cksum 0x7f09 (correct), ack 724, win 9088, options [nop,nop,TS val 2464141982 ecr 1201567070], length 0
09:04:01.662326 IP (tos 0x0, ttl 54, id 34982, offset 0, flags [DF], proto TCP (6), length 420)
    160.79.104.10.443 > 172.25.186.179.55410: Flags [P.], cksum 0x1036 (correct), seq 724:1092, ack 3582, win 35, options [nop,nop,TS val 1201567637 ecr 2464141982], length 368
09:04:01.662328 IP (tos 0x0, ttl 54, id 34983, offset 0, flags [DF], proto TCP (6), length 642)
    160.79.104.10.443 > 172.25.186.179.55410: Flags [P.], cksum 0x578f (correct), seq 1092:1682, ack 3582, win 35, options [nop,nop,TS val 1201567645 ecr 2464141982], length 590
09:04:01.662435 IP (tos 0x0, ttl 64, id 0, offset 0, flags [DF], proto TCP (6), length 52)
    172.25.186.179.55410 > 160.79.104.10.443: Flags [.], cksum 0x76c8 (correct), ack 1682, win 9075, options [nop,nop,TS val 2464142575 ecr 1201567645], length 0
09:04:01.662523 IP (tos 0x0, ttl 54, id 34984, offset 0, flags [DF], proto TCP (6), length 83)
    160.79.104.10.443 > 172.25.186.179.55410: Flags [P.], cksum 0x8e9f (correct), seq 1682:1713, ack 3582, win 35, options [nop,nop,TS val 1201567645 ecr 2464141982], length 31
09:04:01.662587 IP (tos 0x0, ttl 64, id 0, offset 0, flags [DF], proto TCP (6), length 52)
    172.25.186.179.55410 > 160.79.104.10.443: Flags [.], cksum 0x76a9 (correct), ack 1713, win 9075, options [nop,nop,TS val 2464142575 ecr 1201567645], length 0
09:04:03.505835 IP (tos 0x0, ttl 54, id 34985, offset 0, flags [DF], proto TCP (6), length 203)
    160.79.104.10.443 > 172.25.186.179.55410: Flags [P.], cksum 0x34d4 (correct), seq 1713:1864, ack 3582, win 35, options [nop,nop,TS val 1201569437 ecr 2464142575], length 151
09:04:03.505837 IP (tos 0x0, ttl 54, id 34986, offset 0, flags [DF], proto TCP (6), length 382)
    160.79.104.10.443 > 172.25.186.179.55410: Flags [P.], cksum 0x3145 (correct), seq 1864:2194, ack 3582, win 35, options [nop,nop,TS val 1201569437 ecr 2464142575], length 330
09:04:03.505957 IP (tos 0x0, ttl 64, id 0, offset 0, flags [DF], proto TCP (6), length 52)
    172.25.186.179.55410 > 160.79.104.10.443: Flags [.], cksum 0x668d (correct), ack 2194, win 9083, options [nop,nop,TS val 2464144418 ecr 1201569437], length 0
09:04:03.506010 IP (tos 0x0, ttl 54, id 34987, offset 0, flags [DF], proto TCP (6), length 132)
    160.79.104.10.443 > 172.25.186.179.55410: Flags [P.], cksum 0x324e (correct), seq 2194:2274, ack 3582, win 35, options [nop,nop,TS val 1201569437 ecr 2464142575], length 80
09:04:03.506011 IP (tos 0x0, ttl 54, id 34988, offset 0, flags [DF], proto TCP (6), length 132)
    160.79.104.10.443 > 172.25.186.179.55410: Flags [P.], cksum 0x3229 (correct), seq 2194:2274, ack 3582, win 35, options [nop,nop,TS val 1201569474 ecr 2464142575], length 80
09:04:03.506062 IP (tos 0x0, ttl 64, id 0, offset 0, flags [DF], proto TCP (6), length 52)
    172.25.186.179.55410 > 160.79.104.10.443: Flags [.], cksum 0x663e (correct), ack 2274, win 9082, options [nop,nop,TS val 2464144418 ecr 1201569437], length 0
09:04:03.506092 IP (tos 0x0, ttl 64, id 0, offset 0, flags [DF], proto TCP (6), length 64)
    172.25.186.179.55410 > 160.79.104.10.443: Flags [.], cksum 0xc95f (correct), ack 2274, win 9082, options [nop,nop,TS val 2464144418 ecr 1201569474,nop,nop,sack 1 {2194:2274}], length 0
09:04:03.813019 IP (tos 0x0, ttl 54, id 34989, offset 0, flags [DF], proto TCP (6), length 119)
    160.79.104.10.443 > 172.25.186.179.55410: Flags [P.], cksum 0xd086 (correct), seq 2274:2341, ack 3582, win 35, options [nop,nop,TS val 1201569713 ecr 2464144418], length 67
09:04:03.813021 IP (tos 0x0, ttl 54, id 34990, offset 0, flags [DF], proto TCP (6), length 246)
    160.79.104.10.443 > 172.25.186.179.55410: Flags [P.], cksum 0x7f4e (correct), seq 2341:2535, ack 3582, win 35, options [nop,nop,TS val 1201569719 ecr 2464144418], length 194
09:04:03.813126 IP (tos 0x0, ttl 64, id 0, offset 0, flags [DF], proto TCP (6), length 52)
    172.25.186.179.55410 > 160.79.104.10.443: Flags [.], cksum 0x62e8 (correct), ack 2535, win 9086, options [nop,nop,TS val 2464144725 ecr 1201569719], length 0
09:04:03.813159 IP (tos 0x0, ttl 54, id 34991, offset 0, flags [DF], proto TCP (6), length 180)
    160.79.104.10.443 > 172.25.186.179.55410: Flags [P.], cksum 0xfc92 (correct), seq 2535:2663, ack 3582, win 35, options [nop,nop,TS val 1201569719 ecr 2464144418], length 128
09:04:03.813160 IP (tos 0x0, ttl 54, id 34992, offset 0, flags [DF], proto TCP (6), length 180)
    160.79.104.10.443 > 172.25.186.179.55410: Flags [P.], cksum 0xfc4d (correct), seq 2535:2663, ack 3582, win 35, options [nop,nop,TS val 1201569788 ecr 2464144418], length 128
09:04:03.813209 IP (tos 0x0, ttl 64, id 0, offset 0, flags [DF], proto TCP (6), length 52)
    172.25.186.179.55410 > 160.79.104.10.443: Flags [.], cksum 0x626a (correct), ack 2663, win 9084, options [nop,nop,TS val 2464144725 ecr 1201569719], length 0
09:04:03.813232 IP (tos 0x0, ttl 64, id 0, offset 0, flags [DF], proto TCP (6), length 64)
    172.25.186.179.55410 > 160.79.104.10.443: Flags [.], cksum 0xc291 (correct), ack 2663, win 9084, options [nop,nop,TS val 2464144725 ecr 1201569788,nop,nop,sack 1 {2535:2663}], length 0
09:04:03.835140 IP (tos 0x0, ttl 54, id 34993, offset 0, flags [DF], proto TCP (6), length 122)
    160.79.104.10.443 > 172.25.186.179.55410: Flags [P.], cksum 0xf6a9 (correct), seq 2663:2733, ack 3582, win 35, options [nop,nop,TS val 1201569836 ecr 2464144725], length 70
09:04:03.835217 IP (tos 0x0, ttl 64, id 0, offset 0, flags [DF], proto TCP (6), length 52)
    172.25.186.179.55410 > 160.79.104.10.443: Flags [.], cksum 0x6194 (correct), ack 2733, win 9089, options [nop,nop,TS val 2464144747 ecr 1201569836], length 0
09:04:03.871364 IP (tos 0x0, ttl 54, id 34994, offset 0, flags [DF], proto TCP (6), length 105)
    160.79.104.10.443 > 172.25.186.179.55410: Flags [P.], cksum 0x29e9 (correct), seq 2733:2786, ack 3582, win 35, options [nop,nop,TS val 1201569872 ecr 2464144747], length 53
09:04:03.871474 IP (tos 0x0, ttl 64, id 0, offset 0, flags [DF], proto TCP (6), length 52)
    172.25.186.179.55410 > 160.79.104.10.443: Flags [.], cksum 0x6117 (correct), ack 2786, win 9089, options [nop,nop,TS val 2464144783 ecr 1201569872], length 0
09:04:04.006481 IP (tos 0x0, ttl 54, id 34995, offset 0, flags [DF], proto TCP (6), length 96)
    160.79.104.10.443 > 172.25.186.179.55410: Flags [P.], cksum 0xcda3 (correct), seq 2786:2830, ack 3582, win 35, options [nop,nop,TS val 1201570007 ecr 2464144783], length 44
09:04:04.006482 IP (tos 0x0, ttl 54, id 34996, offset 0, flags [DF], proto TCP (6), length 110)
    160.79.104.10.443 > 172.25.186.179.55410: Flags [P.], cksum 0x6b15 (correct), seq 2830:2888, ack 3582, win 35, options [nop,nop,TS val 1201570007 ecr 2464144783], length 58
09:04:04.006593 IP (tos 0x0, ttl 64, id 0, offset 0, flags [DF], proto TCP (6), length 52)
    172.25.186.179.55410 > 160.79.104.10.443: Flags [.], cksum 0x5fa2 (correct), ack 2888, win 9089, options [nop,nop,TS val 2464144919 ecr 1201570007], length 0
09:04:04.051057 IP (tos 0x0, ttl 54, id 34997, offset 0, flags [DF], proto TCP (6), length 116)
    160.79.104.10.443 > 172.25.186.179.55410: Flags [P.], cksum 0xd64f (correct), seq 2888:2952, ack 3582, win 35, options [nop,nop,TS val 1201570051 ecr 2464144919], length 64
09:04:04.051260 IP (tos 0x0, ttl 64, id 0, offset 0, flags [DF], proto TCP (6), length 52)
    172.25.186.179.55410 > 160.79.104.10.443: Flags [.], cksum 0x5f09 (correct), ack 2952, win 9090, options [nop,nop,TS val 2464144963 ecr 1201570051], length 0
09:04:04.165130 IP (tos 0x0, ttl 54, id 34998, offset 0, flags [DF], proto TCP (6), length 105)
    160.79.104.10.443 > 172.25.186.179.55410: Flags [P.], cksum 0x18fe (correct), seq 2952:3005, ack 3582, win 35, options [nop,nop,TS val 1201570165 ecr 2464144963], length 53
09:04:04.165323 IP (tos 0x0, ttl 64, id 0, offset 0, flags [DF], proto TCP (6), length 52)
    172.25.186.179.55410 > 160.79.104.10.443: Flags [.], cksum 0x5df0 (correct), ack 3005, win 9090, options [nop,nop,TS val 2464145077 ecr 1201570165], length 0
09:04:04.177383 IP (tos 0x0, ttl 54, id 34999, offset 0, flags [DF], proto TCP (6), length 119)
    160.79.104.10.443 > 172.25.186.179.55410: Flags [P.], cksum 0xb7b8 (correct), seq 3005:3072, ack 3582, win 35, options [nop,nop,TS val 1201570178 ecr 2464145077], length 67
09:04:04.177566 IP (tos 0x0, ttl 64, id 0, offset 0, flags [DF], proto TCP (6), length 52)
    172.25.186.179.55410 > 160.79.104.10.443: Flags [.], cksum 0x5d94 (correct), ack 3072, win 9090, options [nop,nop,TS val 2464145089 ecr 1201570178], length 0
09:04:04.329597 IP (tos 0x0, ttl 54, id 35000, offset 0, flags [DF], proto TCP (6), length 115)
    160.79.104.10.443 > 172.25.186.179.55410: Flags [P.], cksum 0x6bbf (correct), seq 3072:3135, ack 3582, win 35, options [nop,nop,TS val 1201570330 ecr 2464145089], length 63
09:04:04.329792 IP (tos 0x0, ttl 64, id 0, offset 0, flags [DF], proto TCP (6), length 52)
    172.25.186.179.55410 > 160.79.104.10.443: Flags [.], cksum 0x5c24 (correct), ack 3135, win 9090, options [nop,nop,TS val 2464145242 ecr 1201570330], length 0
09:04:04.466093 IP (tos 0x0, ttl 54, id 35001, offset 0, flags [DF], proto TCP (6), length 153)
    160.79.104.10.443 > 172.25.186.179.55410: Flags [P.], cksum 0x13f3 (correct), seq 3135:3236, ack 3582, win 35, options [nop,nop,TS val 1201570467 ecr 2464145242], length 101
09:04:04.466284 IP (tos 0x0, ttl 64, id 0, offset 0, flags [DF], proto TCP (6), length 52)
    172.25.186.179.55410 > 160.79.104.10.443: Flags [.], cksum 0x5aae (correct), ack 3236, win 9090, options [nop,nop,TS val 2464145378 ecr 1201570467], length 0
09:04:04.507608 IP (tos 0x0, ttl 64, id 0, offset 0, flags [DF], proto TCP (6), length 334)
    172.25.186.179.55410 > 160.79.104.10.443: Flags [P.], cksum 0x61a6 (correct), seq 3582:3864, ack 3236, win 9090, options [nop,nop,TS val 2464145420 ecr 1201570467], length 282
09:04:04.507651 IP (tos 0x0, ttl 64, id 0, offset 0, flags [DF], proto TCP (6), length 954)
    172.25.186.179.55410 > 160.79.104.10.443: Flags [P.], cksum 0x3be4 (correct), seq 3864:4766, ack 3236, win 9090, options [nop,nop,TS val 2464145420 ecr 1201570467], length 902
09:04:04.514080 IP (tos 0x0, ttl 54, id 35002, offset 0, flags [DF], proto TCP (6), length 52)
    160.79.104.10.443 > 172.25.186.179.55410: Flags [.], cksum 0x7c99 (correct), ack 3864, win 35, options [nop,nop,TS val 1201570515 ecr 2464145420], length 0
09:04:04.514080 IP (tos 0x0, ttl 54, id 35003, offset 0, flags [DF], proto TCP (6), length 52)
    160.79.104.10.443 > 172.25.186.179.55410: Flags [.], cksum 0x7913 (correct), ack 4766, win 35, options [nop,nop,TS val 1201570515 ecr 2464145420], length 0
09:04:04.519478 IP (tos 0x0, ttl 64, id 0, offset 0, flags [DF], proto TCP (6), length 303)
    172.25.186.179.55410 > 160.79.104.10.443: Flags [P.], cksum 0x861f (correct), seq 4766:5017, ack 3236, win 9090, options [nop,nop,TS val 2464145432 ecr 1201570515], length 251
09:04:04.525761 IP (tos 0x0, ttl 54, id 35004, offset 0, flags [DF], proto TCP (6), length 52)
    160.79.104.10.443 > 172.25.186.179.55410: Flags [.], cksum 0x7801 (correct), ack 5017, win 35, options [nop,nop,TS val 1201570526 ecr 2464145432], length 0
09:04:04.543180 IP (tos 0x0, ttl 54, id 35005, offset 0, flags [DF], proto TCP (6), length 117)
    160.79.104.10.443 > 172.25.186.179.55410: Flags [P.], cksum 0x3edc (correct), seq 3236:3301, ack 5017, win 35, options [nop,nop,TS val 1201570544 ecr 2464145432], length 65
09:04:04.543262 IP (tos 0x0, ttl 64, id 0, offset 0, flags [DF], proto TCP (6), length 52)
    172.25.186.179.55410 > 160.79.104.10.443: Flags [.], cksum 0x5438 (correct), ack 3301, win 9090, options [nop,nop,TS val 2464145455 ecr 1201570544], length 0
09:04:04.594059 IP (tos 0x0, ttl 54, id 35006, offset 0, flags [DF], proto TCP (6), length 109)
    160.79.104.10.443 > 172.25.186.179.55410: Flags [P.], cksum 0xd20e (correct), seq 3301:3358, ack 5017, win 35, options [nop,nop,TS val 1201570595 ecr 2464145455], length 57
09:04:04.594124 IP (tos 0x0, ttl 64, id 0, offset 0, flags [DF], proto TCP (6), length 52)
    172.25.186.179.55410 > 160.79.104.10.443: Flags [.], cksum 0x5399 (correct), ack 3358, win 9090, options [nop,nop,TS val 2464145506 ecr 1201570595], length 0
09:04:04.665585 IP (tos 0x0, ttl 54, id 35007, offset 0, flags [DF], proto TCP (6), length 117)
    160.79.104.10.443 > 172.25.186.179.55410: Flags [P.], cksum 0x5c37 (correct), seq 3358:3423, ack 5017, win 35, options [nop,nop,TS val 1201570666 ecr 2464145506], length 65
09:04:04.665667 IP (tos 0x0, ttl 64, id 0, offset 0, flags [DF], proto TCP (6), length 52)
    172.25.186.179.55410 > 160.79.104.10.443: Flags [.], cksum 0x52c9 (correct), ack 3423, win 9090, options [nop,nop,TS val 2464145578 ecr 1201570666], length 0
09:04:04.770253 IP (tos 0x0, ttl 54, id 35008, offset 0, flags [DF], proto TCP (6), length 106)
    160.79.104.10.443 > 172.25.186.179.55410: Flags [P.], cksum 0xd727 (correct), seq 3423:3477, ack 5017, win 35, options [nop,nop,TS val 1201570771 ecr 2464145578], length 54
09:04:04.770339 IP (tos 0x0, ttl 64, id 0, offset 0, flags [DF], proto TCP (6), length 52)
    172.25.186.179.55410 > 160.79.104.10.443: Flags [.], cksum 0x51c2 (correct), ack 3477, win 9090, options [nop,nop,TS val 2464145682 ecr 1201570771], length 0
09:04:04.876511 IP (tos 0x0, ttl 54, id 35009, offset 0, flags [DF], proto TCP (6), length 122)
    160.79.104.10.443 > 172.25.186.179.55410: Flags [P.], cksum 0xae83 (correct), seq 3477:3547, ack 5017, win 35, options [nop,nop,TS val 1201570877 ecr 2464145682], length 70
09:04:04.876687 IP (tos 0x0, ttl 64, id 0, offset 0, flags [DF], proto TCP (6), length 52)
    172.25.186.179.55410 > 160.79.104.10.443: Flags [.], cksum 0x50a7 (correct), ack 3547, win 9090, options [nop,nop,TS val 2464145789 ecr 1201570877], length 0
09:04:04.943202 IP (tos 0x0, ttl 54, id 35010, offset 0, flags [DF], proto TCP (6), length 169)
    160.79.104.10.443 > 172.25.186.179.55410: Flags [P.], cksum 0x3020 (correct), seq 3547:3664, ack 5017, win 35, options [nop,nop,TS val 1201570944 ecr 2464145789], length 117
09:04:04.943386 IP (tos 0x0, ttl 64, id 0, offset 0, flags [DF], proto TCP (6), length 52)
    172.25.186.179.55410 > 160.79.104.10.443: Flags [.], cksum 0x4fad (correct), ack 3664, win 9090, options [nop,nop,TS val 2464145855 ecr 1201570944], length 0
09:04:04.947381 IP (tos 0x0, ttl 54, id 35011, offset 0, flags [DF], proto TCP (6), length 88)
    160.79.104.10.443 > 172.25.186.179.55410: Flags [P.], cksum 0x52f6 (correct), seq 3664:3700, ack 5017, win 35, options [nop,nop,TS val 1201570948 ecr 2464145789], length 36
09:04:04.947381 IP (tos 0x0, ttl 54, id 35012, offset 0, flags [DF], proto TCP (6), length 83)
    160.79.104.10.443 > 172.25.186.179.55410: Flags [P.], cksum 0xeb3e (correct), seq 3700:3731, ack 5017, win 35, options [nop,nop,TS val 1201570948 ecr 2464145789], length 31
09:04:04.947589 IP (tos 0x0, ttl 64, id 0, offset 0, flags [DF], proto TCP (6), length 52)
    172.25.186.179.55410 > 160.79.104.10.443: Flags [.], cksum 0x4f62 (correct), ack 3731, win 9090, options [nop,nop,TS val 2464145859 ecr 1201570948], length 0
09:04:04.949107 IP (tos 0x0, ttl 54, id 35013, offset 0, flags [DF], proto TCP (6), length 108)
    160.79.104.10.443 > 172.25.186.179.55410: Flags [P.], cksum 0x835b (correct), seq 3731:3787, ack 5017, win 35, options [nop,nop,TS val 1201570950 ecr 2464145789], length 56
09:04:04.949235 IP (tos 0x0, ttl 64, id 0, offset 0, flags [DF], proto TCP (6), length 52)
    172.25.186.179.55410 > 160.79.104.10.443: Flags [.], cksum 0x4f26 (correct), ack 3787, win 9090, options [nop,nop,TS val 2464145861 ecr 1201570950], length 0
09:04:04.992223 IP (tos 0x0, ttl 54, id 35014, offset 0, flags [DF], proto TCP (6), length 109)
    160.79.104.10.443 > 172.25.186.179.55410: Flags [P.], cksum 0x7177 (correct), seq 3787:3844, ack 5017, win 35, options [nop,nop,TS val 1201570993 ecr 2464145861], length 57
09:04:04.992407 IP (tos 0x0, ttl 64, id 0, offset 0, flags [DF], proto TCP (6), length 52)
    172.25.186.179.55410 > 160.79.104.10.443: Flags [.], cksum 0x4e97 (correct), ack 3844, win 9090, options [nop,nop,TS val 2464145904 ecr 1201570993], length 0
09:04:05.056470 IP (tos 0x0, ttl 54, id 35015, offset 0, flags [DF], proto TCP (6), length 124)
    160.79.104.10.443 > 172.25.186.179.55410: Flags [P.], cksum 0x63da (correct), seq 3844:3916, ack 5017, win 35, options [nop,nop,TS val 1201571057 ecr 2464145904], length 72
09:04:05.056640 IP (tos 0x0, ttl 64, id 0, offset 0, flags [DF], proto TCP (6), length 52)
    172.25.186.179.55410 > 160.79.104.10.443: Flags [.], cksum 0x4dce (correct), ack 3916, win 9090, options [nop,nop,TS val 2464145969 ecr 1201571057], length 0
09:04:05.058044 IP (tos 0x0, ttl 54, id 35016, offset 0, flags [DF], proto TCP (6), length 102)
    160.79.104.10.443 > 172.25.186.179.55410: Flags [P.], cksum 0xdc1c (correct), seq 3916:3966, ack 5017, win 35, options [nop,nop,TS val 1201571059 ecr 2464145904], length 50
09:04:05.058152 IP (tos 0x0, ttl 64, id 0, offset 0, flags [DF], proto TCP (6), length 52)
    172.25.186.179.55410 > 160.79.104.10.443: Flags [.], cksum 0x4d99 (correct), ack 3966, win 9090, options [nop,nop,TS val 2464145970 ecr 1201571059], length 0
09:04:05.131102 IP (tos 0x0, ttl 54, id 35017, offset 0, flags [DF], proto TCP (6), length 115)
    160.79.104.10.443 > 172.25.186.179.55410: Flags [P.], cksum 0x23ad (correct), seq 3966:4029, ack 5017, win 35, options [nop,nop,TS val 1201571131 ecr 2464145970], length 63
09:04:05.131270 IP (tos 0x0, ttl 64, id 0, offset 0, flags [DF], proto TCP (6), length 52)
    172.25.186.179.55410 > 160.79.104.10.443: Flags [.], cksum 0x4cc9 (correct), ack 4029, win 9090, options [nop,nop,TS val 2464146043 ecr 1201571131], length 0
09:04:05.168980 IP (tos 0x0, ttl 54, id 35018, offset 0, flags [DF], proto TCP (6), length 116)
    160.79.104.10.443 > 172.25.186.179.55410: Flags [P.], cksum 0x5d66 (correct), seq 4029:4093, ack 5017, win 35, options [nop,nop,TS val 1201571169 ecr 2464146043], length 64
09:04:05.169173 IP (tos 0x0, ttl 64, id 0, offset 0, flags [DF], proto TCP (6), length 52)
    172.25.186.179.55410 > 160.79.104.10.443: Flags [.], cksum 0x4c3d (correct), ack 4093, win 9090, options [nop,nop,TS val 2464146081 ecr 1201571169], length 0
09:04:05.231407 IP (tos 0x0, ttl 54, id 35019, offset 0, flags [DF], proto TCP (6), length 109)
    160.79.104.10.443 > 172.25.186.179.55410: Flags [P.], cksum 0x5f15 (correct), seq 4093:4150, ack 5017, win 35, options [nop,nop,TS val 1201571232 ecr 2464146081], length 57
09:04:05.231541 IP (tos 0x0, ttl 64, id 0, offset 0, flags [DF], proto TCP (6), length 52)
    172.25.186.179.55410 > 160.79.104.10.443: Flags [.], cksum 0x4b87 (correct), ack 4150, win 9090, options [nop,nop,TS val 2464146143 ecr 1201571232], length 0
09:04:05.268440 IP (tos 0x0, ttl 54, id 35020, offset 0, flags [DF], proto TCP (6), length 105)
    160.79.104.10.443 > 172.25.186.179.55410: Flags [P.], cksum 0x004a (correct), seq 4150:4203, ack 5017, win 35, options [nop,nop,TS val 1201571269 ecr 2464146143], length 53
09:04:05.268604 IP (tos 0x0, ttl 64, id 0, offset 0, flags [DF], proto TCP (6), length 52)
    172.25.186.179.55410 > 160.79.104.10.443: Flags [.], cksum 0x4b07 (correct), ack 4203, win 9090, options [nop,nop,TS val 2464146181 ecr 1201571269], length 0
09:04:05.325272 IP (tos 0x0, ttl 54, id 35021, offset 0, flags [DF], proto TCP (6), length 103)
    160.79.104.10.443 > 172.25.186.179.55410: Flags [P.], cksum 0x204c (correct), seq 4203:4254, ack 5017, win 35, options [nop,nop,TS val 1201571326 ecr 2464146181], length 51
09:04:05.325460 IP (tos 0x0, ttl 64, id 0, offset 0, flags [DF], proto TCP (6), length 52)
    172.25.186.179.55410 > 160.79.104.10.443: Flags [.], cksum 0x4a63 (correct), ack 4254, win 9090, options [nop,nop,TS val 2464146237 ecr 1201571326], length 0
09:04:05.383201 IP (tos 0x0, ttl 54, id 35022, offset 0, flags [DF], proto TCP (6), length 106)
    160.79.104.10.443 > 172.25.186.179.55410: Flags [P.], cksum 0x0c56 (correct), seq 4254:4308, ack 5017, win 35, options [nop,nop,TS val 1201571384 ecr 2464146237], length 54
09:04:05.383379 IP (tos 0x0, ttl 64, id 0, offset 0, flags [DF], proto TCP (6), length 52)
    172.25.186.179.55410 > 160.79.104.10.443: Flags [.], cksum 0x49b9 (correct), ack 4308, win 9090, options [nop,nop,TS val 2464146295 ecr 1201571384], length 0
09:04:05.452848 IP (tos 0x0, ttl 54, id 35023, offset 0, flags [DF], proto TCP (6), length 184)
    160.79.104.10.443 > 172.25.186.179.55410: Flags [P.], cksum 0xb349 (correct), seq 4308:4440, ack 5017, win 35, options [nop,nop,TS val 1201571453 ecr 2464146295], length 132
09:04:05.453044 IP (tos 0x0, ttl 64, id 0, offset 0, flags [DF], proto TCP (6), length 52)
    172.25.186.179.55410 > 160.79.104.10.443: Flags [.], cksum 0x48aa (correct), ack 4440, win 9090, options [nop,nop,TS val 2464146365 ecr 1201571453], length 0
09:04:05.454191 IP (tos 0x0, ttl 54, id 35024, offset 0, flags [DF], proto TCP (6), length 107)
    160.79.104.10.443 > 172.25.186.179.55410: Flags [P.], cksum 0xcfce (correct), seq 4440:4495, ack 5017, win 35, options [nop,nop,TS val 1201571455 ecr 2464146295], length 55
09:04:05.454291 IP (tos 0x0, ttl 64, id 0, offset 0, flags [DF], proto TCP (6), length 52)
    172.25.186.179.55410 > 160.79.104.10.443: Flags [.], cksum 0x4870 (correct), ack 4495, win 9090, options [nop,nop,TS val 2464146366 ecr 1201571455], length 0
09:04:05.454760 IP (tos 0x0, ttl 54, id 35025, offset 0, flags [DF], proto TCP (6), length 237)
    160.79.104.10.443 > 172.25.186.179.55410: Flags [P.], cksum 0x60d2 (correct), seq 4495:4680, ack 5017, win 35, options [nop,nop,TS val 1201571455 ecr 2464146295], length 185
09:04:05.454819 IP (tos 0x0, ttl 64, id 0, offset 0, flags [DF], proto TCP (6), length 52)
    172.25.186.179.55410 > 160.79.104.10.443: Flags [.], cksum 0x47b7 (correct), ack 4680, win 9090, options [nop,nop,TS val 2464146366 ecr 1201571455], length 0
09:04:05.455227 IP (tos 0x0, ttl 54, id 35026, offset 0, flags [DF], proto TCP (6), length 90)
    160.79.104.10.443 > 172.25.186.179.55410: Flags [P.], cksum 0x3a00 (correct), seq 4680:4718, ack 5017, win 35, options [nop,nop,TS val 1201571455 ecr 2464146295], length 38
09:04:05.455290 IP (tos 0x0, ttl 64, id 0, offset 0, flags [DF], proto TCP (6), length 52)
    172.25.186.179.55410 > 160.79.104.10.443: Flags [.], cksum 0x4790 (correct), ack 4718, win 9090, options [nop,nop,TS val 2464146367 ecr 1201571455], length 0
09:04:05.455814 IP (tos 0x0, ttl 54, id 35027, offset 0, flags [DF], proto TCP (6), length 83)
    160.79.104.10.443 > 172.25.186.179.55410: Flags [P.], cksum 0x1383 (correct), seq 4718:4749, ack 5017, win 35, options [nop,nop,TS val 1201571455 ecr 2464146295], length 31
09:04:05.455865 IP (tos 0x0, ttl 64, id 0, offset 0, flags [DF], proto TCP (6), length 52)
    172.25.186.179.55410 > 160.79.104.10.443: Flags [.], cksum 0x4771 (correct), ack 4749, win 9090, options [nop,nop,TS val 2464146367 ecr 1201571455], length 0
09:04:05.564261 IP (tos 0x0, ttl 54, id 35028, offset 0, flags [DF], proto TCP (6), length 133)
    160.79.104.10.443 > 172.25.186.179.55410: Flags [P.], cksum 0x8e40 (correct), seq 4749:4830, ack 5017, win 35, options [nop,nop,TS val 1201571565 ecr 2464146367], length 81
09:04:05.564442 IP (tos 0x0, ttl 64, id 0, offset 0, flags [DF], proto TCP (6), length 52)
    172.25.186.179.55410 > 160.79.104.10.443: Flags [.], cksum 0x4645 (correct), ack 4830, win 9090, options [nop,nop,TS val 2464146476 ecr 1201571565], length 0
09:04:05.570632 IP (tos 0x0, ttl 54, id 35029, offset 0, flags [DF], proto TCP (6), length 109)
    160.79.104.10.443 > 172.25.186.179.55410: Flags [P.], cksum 0x6dba (correct), seq 4830:4887, ack 5017, win 35, options [nop,nop,TS val 1201571571 ecr 2464146476], length 57
09:04:05.570760 IP (tos 0x0, ttl 64, id 0, offset 0, flags [DF], proto TCP (6), length 52)
    172.25.186.179.55410 > 160.79.104.10.443: Flags [.], cksum 0x45ff (correct), ack 4887, win 9090, options [nop,nop,TS val 2464146483 ecr 1201571571], length 0
09:04:05.616179 IP (tos 0x0, ttl 54, id 35030, offset 0, flags [DF], proto TCP (6), length 104)
    160.79.104.10.443 > 172.25.186.179.55410: Flags [P.], cksum 0x01b1 (correct), seq 4887:4939, ack 5017, win 35, options [nop,nop,TS val 1201571617 ecr 2464146483], length 52
09:04:05.616338 IP (tos 0x0, ttl 64, id 0, offset 0, flags [DF], proto TCP (6), length 52)
    172.25.186.179.55410 > 160.79.104.10.443: Flags [.], cksum 0x4570 (correct), ack 4939, win 9090, options [nop,nop,TS val 2464146528 ecr 1201571617], length 0
09:04:05.617731 IP (tos 0x0, ttl 64, id 0, offset 0, flags [DF], proto TCP (6), length 87)
    172.25.186.179.55410 > 160.79.104.10.443: Flags [P.], cksum 0xf2b5 (correct), seq 5017:5052, ack 4939, win 9090, options [nop,nop,TS val 2464146530 ecr 1201571617], length 35
09:04:05.665042 IP (tos 0x0, ttl 54, id 35031, offset 0, flags [DF], proto TCP (6), length 52)
    160.79.104.10.443 > 172.25.186.179.55410: Flags [.], cksum 0x6879 (correct), ack 5052, win 35, options [nop,nop,TS val 1201571666 ecr 2464146530], length 0
09:04:05.688289 IP (tos 0x0, ttl 54, id 35032, offset 0, flags [DF], proto TCP (6), length 116)
    160.79.104.10.443 > 172.25.186.179.55410: Flags [P.], cksum 0x6627 (correct), seq 4939:5003, ack 5052, win 35, options [nop,nop,TS val 1201571689 ecr 2464146530], length 64
09:04:05.688576 IP (tos 0x0, ttl 64, id 0, offset 0, flags [DF], proto TCP (6), length 52)
    172.25.186.179.55410 > 160.79.104.10.443: Flags [.], cksum 0x447d (correct), ack 5003, win 9090, options [nop,nop,TS val 2464146600 ecr 1201571689], length 0
09:04:05.750001 IP (tos 0x0, ttl 54, id 35033, offset 0, flags [DF], proto TCP (6), length 107)
    160.79.104.10.443 > 172.25.186.179.55410: Flags [P.], cksum 0xce7c (correct), seq 5003:5058, ack 5052, win 35, options [nop,nop,TS val 1201571750 ecr 2464146600], length 55
09:04:05.750192 IP (tos 0x0, ttl 64, id 0, offset 0, flags [DF], proto TCP (6), length 52)
    172.25.186.179.55410 > 160.79.104.10.443: Flags [.], cksum 0x43cb (correct), ack 5058, win 9090, options [nop,nop,TS val 2464146662 ecr 1201571750], length 0
09:04:05.751648 IP (tos 0x0, ttl 64, id 0, offset 0, flags [DF], proto TCP (6), length 87)
    172.25.186.179.55410 > 160.79.104.10.443: Flags [P.], cksum 0x0408 (correct), seq 5052:5087, ack 5058, win 9090, options [nop,nop,TS val 2464146664 ecr 1201571750], length 35
09:04:05.758399 IP (tos 0x0, ttl 54, id 35034, offset 0, flags [DF], proto TCP (6), length 52)
    160.79.104.10.443 > 172.25.186.179.55410: Flags [.], cksum 0x66fd (correct), ack 5087, win 35, options [nop,nop,TS val 1201571758 ecr 2464146664], length 0
09:04:05.768473 IP (tos 0x0, ttl 54, id 35035, offset 0, flags [DF], proto TCP (6), length 145)
    160.79.104.10.443 > 172.25.186.179.55410: Flags [P.], cksum 0x845f (correct), seq 5058:5151, ack 5087, win 35, options [nop,nop,TS val 1201571769 ecr 2464146664], length 93
09:04:05.768582 IP (tos 0x0, ttl 64, id 0, offset 0, flags [DF], proto TCP (6), length 52)
    172.25.186.179.55410 > 160.79.104.10.443: Flags [.], cksum 0x4325 (correct), ack 5151, win 9090, options [nop,nop,TS val 2464146681 ecr 1201571769], length 0
09:04:05.781626 IP (tos 0x0, ttl 54, id 35036, offset 0, flags [DF], proto TCP (6), length 85)
    160.79.104.10.443 > 172.25.186.179.55410: Flags [P.], cksum 0xc3a9 (correct), seq 5151:5184, ack 5087, win 35, options [nop,nop,TS val 1201571782 ecr 2464146681], length 33
09:04:05.781627 IP (tos 0x0, ttl 54, id 35037, offset 0, flags [DF], proto TCP (6), length 83)
    160.79.104.10.443 > 172.25.186.179.55410: Flags [P.], cksum 0x39a0 (correct), seq 5184:5215, ack 5087, win 35, options [nop,nop,TS val 1201571782 ecr 2464146681], length 31
09:04:05.781784 IP (tos 0x0, ttl 64, id 0, offset 0, flags [DF], proto TCP (6), length 52)
    172.25.186.179.55410 > 160.79.104.10.443: Flags [.], cksum 0x42cb (correct), ack 5215, win 9090, options [nop,nop,TS val 2464146694 ecr 1201571782], length 0
09:04:05.797563 IP (tos 0x0, ttl 54, id 35038, offset 0, flags [DF], proto TCP (6), length 104)
    160.79.104.10.443 > 172.25.186.179.55410: Flags [P.], cksum 0x5217 (correct), seq 5215:5267, ack 5087, win 35, options [nop,nop,TS val 1201571798 ecr 2464146694], length 52
09:04:05.797733 IP (tos 0x0, ttl 64, id 0, offset 0, flags [DF], proto TCP (6), length 52)
    172.25.186.179.55410 > 160.79.104.10.443: Flags [.], cksum 0x4277 (correct), ack 5267, win 9090, options [nop,nop,TS val 2464146710 ecr 1201571798], length 0
09:04:05.857634 IP (tos 0x0, ttl 54, id 35039, offset 0, flags [DF], proto TCP (6), length 103)
