LLM_IP CHATGPT 172.64.155.209

Capturing on 'Wi-Fi' IP (tos 0x0, ttl , id , offset 0, flags [], proto Proto (), length )
    . > .: Flags [.], cksum , , , , length 
00:11:42.791613 IP (tos 0x00, ttl 242, id 0x4e47, offset 0, flags [0x02], proto TCP (6), length 79)
    140.82.112.22.443 > 192.168.4.68.65429: Flags [.], cksum 0xa3cd, seq 1, ack 1, win 68, length 39
00:11:42.792723 IP (tos 0x00, ttl 128, id 0xd479, offset 0, flags [0x02], proto TCP (6), length 40)
    192.168.4.68.65429 > 140.82.112.22.443: Flags [.], cksum 0xc16f, seq 1, ack 40, win 251, length 0
00:11:42.799835 IP (tos 0x00, ttl 242, id 0x4e48, offset 0, flags [0x02], proto TCP (6), length 64)
    140.82.112.22.443 > 192.168.4.68.65429: Flags [.], cksum 0x3f6d, seq 40, ack 2, win 68, length 24
00:11:42.799835 IP (tos 0x00, ttl 242, id 0x4e49, offset 0, flags [0x02], proto TCP (6), length 40)
    140.82.112.22.443 > 192.168.4.68.65429: Flags [.], cksum 0x0c14, seq 64, ack 2, win 68, length 0
00:11:42.800041 IP (tos 0x00, ttl 128, id 0xd47a, offset 0, flags [0x02], proto TCP (6), length 40)
    192.168.4.68.65429 > 140.82.112.22.443: Flags [.], cksum 0xc16f, seq 2, ack 64, win 0, length 0
00:11:44.752299 IP (tos 0x00, ttl 128, id 0x64ab, offset 0, flags [0x00], proto Proto (17), length 57)
    192.168.4.68. > 192.168.4.72.: Flags [.], cksum , , , , length 
00:11:44.752568 IP (tos 0x00, ttl 128, id 0x64ac, offset 0, flags [0x00], proto Proto (17), length 57)
    192.168.4.68. > 192.168.4.72.: Flags [.], cksum , , , , length 
00:11:44.753263 IP (tos 0x00, ttl 128, id 0x64ad, offset 0, flags [0x00], proto Proto (17), length 57)
    192.168.4.68. > 192.168.4.72.: Flags [.], cksum , , , , length 
00:11:44.754625 IP (tos 0x00, ttl 128, id 0xf4d0, offset 0, flags [0x02], proto TCP (6), length 52)
    192.168.4.68.62406 > 172.64.155.209.443: Flags [.], cksum 0x0d25, seq 0, ack 0, win 65535, length 0
00:11:44.763682 IP (tos 0x00, ttl 64, id 0xadde, offset 0, flags [0x02], proto Proto (17), length 146)
    192.168.4.72. > 192.168.4.68.: Flags [.], cksum , , , , length 
00:11:44.766153 IP (tos 0x00, ttl 52, id 0x0000, offset 0, flags [0x02], proto TCP (6), length 52)
    172.64.155.209.443 > 192.168.4.68.62406: Flags [.], cksum 0xaf8b, seq 0, ack 1, win 65535, length 0
00:11:44.766153 IP (tos 0x00, ttl 64, id 0xaddf, offset 0, flags [0x02], proto Proto (17), length 89)
    192.168.4.72. > 192.168.4.68.: Flags [.], cksum , , , , length 
00:11:44.766428 IP (tos 0x00, ttl 128, id 0xf4d1, offset 0, flags [0x02], proto TCP (6), length 40)
    192.168.4.68.62406 > 172.64.155.209.443: Flags [.], cksum 0x0d19, seq 1, ack 1, win 255, length 0
00:11:44.767278 IP (tos 0x00, ttl 128, id 0xf4d2, offset 0, flags [0x02], proto TCP (6), length 1440)
    192.168.4.68.62406 > 172.64.155.209.443: Flags [.], cksum 0x1291, seq 1, ack 1, win 255, length 1400
00:11:44.767278 IP (tos 0x00, ttl 128, id 0xf4d3, offset 0, flags [0x02], proto TCP (6), length 536)
    192.168.4.68.62406 > 172.64.155.209.443: Flags [.], cksum 0x0f09, seq 1401, ack 1, win 255, length 496
00:11:44.768238 IP (tos 0x00, ttl 128, id 0x64ae, offset 0, flags [0x00], proto Proto (17), length 57)
    192.168.4.68. > 192.168.4.72.: Flags [.], cksum , , , , length 
00:11:44.770637 IP (tos 0x00, ttl 64, id 0xade0, offset 0, flags [0x02], proto Proto (17), length 113)
    192.168.4.72. > 192.168.4.68.: Flags [.], cksum , , , , length 
00:11:44.774568 IP (tos 0x00, ttl 52, id 0x5248, offset 0, flags [0x02], proto TCP (6), length 40)
    172.64.155.209.443 > 192.168.4.68.62406: Flags [.], cksum 0xea9f, seq 1, ack 1401, win 16, length 0
00:11:44.774568 IP (tos 0x00, ttl 52, id 0x5249, offset 0, flags [0x02], proto TCP (6), length 40)
    172.64.155.209.443 > 192.168.4.68.62406: Flags [.], cksum 0xe8af, seq 1, ack 1897, win 16, length 0
00:11:44.774568 IP (tos 0x00, ttl 64, id 0xade1, offset 0, flags [0x02], proto Proto (17), length 89)
    192.168.4.72. > 192.168.4.68.: Flags [.], cksum , , , , length 
00:11:44.775903 IP (tos 0x00, ttl 128, id 0x64af, offset 0, flags [0x00], proto Proto (17), length 57)
    192.168.4.68. > 192.168.4.72.: Flags [.], cksum , , , , length 
00:11:44.777157 IP (tos 0x00, ttl 52, id 0x524a, offset 0, flags [0x02], proto TCP (6), length 1500)
    172.64.155.209.443 > 192.168.4.68.62406: Flags [.], cksum 0x8db7, seq 1, ack 1897, win 16, length 1460
00:11:44.777157 IP (tos 0x00, ttl 52, id 0x524b, offset 0, flags [0x02], proto TCP (6), length 1500)
    172.64.155.209.443 > 192.168.4.68.62406: Flags [.], cksum 0x55ac, seq 1461, ack 1897, win 16, length 1460
00:11:44.777157 IP (tos 0x00, ttl 52, id 0x524c, offset 0, flags [0x02], proto TCP (6), length 595)
    172.64.155.209.443 > 192.168.4.68.62406: Flags [.], cksum 0xc492, seq 2921, ack 1897, win 16, length 555
00:11:44.777468 IP (tos 0x00, ttl 128, id 0xf4d4, offset 0, flags [0x02], proto TCP (6), length 40)
    192.168.4.68.62406 > 172.64.155.209.443: Flags [.], cksum 0x0d19, seq 1897, ack 2921, win 255, length 0
00:11:44.780605 IP (tos 0x00, ttl 128, id 0xf4d5, offset 0, flags [0x02], proto TCP (6), length 104)
    192.168.4.68.62406 > 172.64.155.209.443: Flags [.], cksum 0x0d59, seq 1897, ack 3476, win 253, length 64
00:11:44.781356 IP (tos 0x00, ttl 128, id 0xf4d6, offset 0, flags [0x02], proto TCP (6), length 132)
    192.168.4.68.62406 > 172.64.155.209.443: Flags [.], cksum 0x0d75, seq 1961, ack 3476, win 253, length 92
00:11:44.781438 IP (tos 0x00, ttl 128, id 0xf4d7, offset 0, flags [0x02], proto TCP (6), length 1440)
    192.168.4.68.62406 > 172.64.155.209.443: Flags [.], cksum 0x1291, seq 2053, ack 3476, win 253, length 1400
00:11:44.781438 IP (tos 0x00, ttl 128, id 0xf4d8, offset 0, flags [0x02], proto TCP (6), length 67)
    192.168.4.68.62406 > 172.64.155.209.443: Flags [.], cksum 0x0d34, seq 3453, ack 3476, win 253, length 27
00:11:44.782099 IP (tos 0x00, ttl 64, id 0xade3, offset 0, flags [0x02], proto Proto (17), length 113)
    192.168.4.72. > 192.168.4.68.: Flags [.], cksum , , , , length 
00:11:44.787429 IP (tos 0x00, ttl 52, id 0x524d, offset 0, flags [0x02], proto TCP (6), length 568)
    172.64.155.209.443 > 192.168.4.68.62406: Flags [.], cksum 0xf80c, seq 3476, ack 1961, win 16, length 528
00:11:44.787429 IP (tos 0x00, ttl 52, id 0x524e, offset 0, flags [0x02], proto TCP (6), length 40)
    172.64.155.209.443 > 192.168.4.68.62406: Flags [.], cksum 0xd2f8, seq 4004, ack 3453, win 16, length 0
00:11:44.787429 IP (tos 0x00, ttl 52, id 0x524f, offset 0, flags [0x02], proto TCP (6), length 71)
    172.64.155.209.443 > 192.168.4.68.62406: Flags [.], cksum 0xc95e, seq 4004, ack 3480, win 16, length 31
00:11:44.787681 IP (tos 0x00, ttl 128, id 0xf4d9, offset 0, flags [0x02], proto TCP (6), length 40)
    192.168.4.68.62406 > 172.64.155.209.443: Flags [.], cksum 0x0d19, seq 3480, ack 4035, win 251, length 0
00:11:44.788414 IP (tos 0x00, ttl 128, id 0xf4da, offset 0, flags [0x02], proto TCP (6), length 71)
    192.168.4.68.62406 > 172.64.155.209.443: Flags [.], cksum 0x0d38, seq 3480, ack 4035, win 251, length 31
00:11:44.799005 IP (tos 0x00, ttl 52, id 0x5250, offset 0, flags [0x02], proto TCP (6), length 1431)
    172.64.155.209.443 > 192.168.4.68.62406: Flags [.], cksum 0xa1ec, seq 4035, ack 3511, win 16, length 1391
00:11:44.799005 IP (tos 0x00, ttl 52, id 0x5251, offset 0, flags [0x02], proto TCP (6), length 1065)
    172.64.155.209.443 > 192.168.4.68.62406: Flags [.], cksum 0xe503, seq 5426, ack 3511, win 16, length 1025
00:11:44.799323 IP (tos 0x00, ttl 128, id 0xf4db, offset 0, flags [0x02], proto TCP (6), length 40)
    192.168.4.68.62406 > 172.64.155.209.443: Flags [.], cksum 0x0d19, seq 3511, ack 6451, win 255, length 0
00:11:44.808826 IP (tos 0x00, ttl 128, id 0x64b0, offset 0, flags [0x00], proto Proto (17), length 57)
    192.168.4.68. > 192.168.4.72.: Flags [.], cksum , , , , length 
00:11:44.809301 IP (tos 0x00, ttl 128, id 0x64b1, offset 0, flags [0x00], proto Proto (17), length 57)
    192.168.4.68. > 192.168.4.72.: Flags [.], cksum , , , , length 
00:11:44.815097 IP (tos 0x00, ttl 64, id 0xade6, offset 0, flags [0x02], proto Proto (17), length 113)
    192.168.4.72. > 192.168.4.68.: Flags [.], cksum , , , , length 
00:11:44.817283 IP (tos 0x00, ttl 64, id 0xade7, offset 0, flags [0x02], proto Proto (17), length 89)
    192.168.4.72. > 192.168.4.68.: Flags [.], cksum , , , , length 
00:11:44.819850 IP (tos 0x00, ttl 128, id 0x64b2, offset 0, flags [0x00], proto Proto (17), length 57)
    192.168.4.68. > 192.168.4.72.: Flags [.], cksum , , , , length 
00:11:44.825086 IP (tos 0x00, ttl 64, id 0xade9, offset 0, flags [0x02], proto Proto (17), length 89)
    192.168.4.72. > 192.168.4.68.: Flags [.], cksum , , , , length 
00:11:44.825949 IP (tos 0x00, ttl 128, id 0x64b3, offset 0, flags [0x00], proto Proto (17), length 57)
    192.168.4.68. > 192.168.4.72.: Flags [.], cksum , , , , length 
00:11:44.831302 IP (tos 0x00, ttl 64, id 0xadea, offset 0, flags [0x02], proto Proto (17), length 113)
    192.168.4.72. > 192.168.4.68.: Flags [.], cksum , , , , length 
00:11:45.044316 IP (tos 0x00, ttl 52, id 0x5252, offset 0, flags [0x02], proto TCP (6), length 1431)
    172.64.155.209.443 > 192.168.4.68.62406: Flags [.], cksum 0xf3c8, seq 6451, ack 3511, win 16, length 1391
00:11:45.044316 IP (tos 0x00, ttl 52, id 0x5253, offset 0, flags [0x02], proto TCP (6), length 1431)
    172.64.155.209.443 > 192.168.4.68.62406: Flags [.], cksum 0xaae5, seq 7842, ack 3511, win 16, length 1391
00:11:45.044316 IP (tos 0x00, ttl 52, id 0x5254, offset 0, flags [0x02], proto TCP (6), length 1431)
    172.64.155.209.443 > 192.168.4.68.62406: Flags [.], cksum 0x556a, seq 9233, ack 3511, win 16, length 1391
00:11:45.044316 IP (tos 0x00, ttl 52, id 0x5255, offset 0, flags [0x02], proto TCP (6), length 1431)
    172.64.155.209.443 > 192.168.4.68.62406: Flags [.], cksum 0xd52a, seq 10624, ack 3511, win 16, length 1391
00:11:45.044316 IP (tos 0x00, ttl 52, id 0x5256, offset 0, flags [0x02], proto TCP (6), length 1138)
    172.64.155.209.443 > 192.168.4.68.62406: Flags [.], cksum 0xa791, seq 12015, ack 3511, win 16, length 1098
00:11:45.044316 IP (tos 0x00, ttl 52, id 0x5257, offset 0, flags [0x02], proto TCP (6), length 1226)
    172.64.155.209.443 > 192.168.4.68.62406: Flags [.], cksum 0x6a7c, seq 13113, ack 3511, win 16, length 1186
00:11:45.044316 IP (tos 0x00, ttl 52, id 0x5258, offset 0, flags [0x02], proto TCP (6), length 1431)
    172.64.155.209.443 > 192.168.4.68.62406: Flags [.], cksum 0xe54f, seq 14299, ack 3511, win 16, length 1391
00:11:45.044316 IP (tos 0x00, ttl 52, id 0x5259, offset 0, flags [0x02], proto TCP (6), length 1431)
    172.64.155.209.443 > 192.168.4.68.62406: Flags [.], cksum 0x07ed, seq 15690, ack 3511, win 16, length 1391
00:11:45.044316 IP (tos 0x00, ttl 52, id 0x525a, offset 0, flags [0x02], proto TCP (6), length 1431)
    172.64.155.209.443 > 192.168.4.68.62406: Flags [.], cksum 0xb840, seq 17081, ack 3511, win 16, length 1391
00:11:45.044316 IP (tos 0x00, ttl 52, id 0x525b, offset 0, flags [0x02], proto TCP (6), length 1431)
    172.64.155.209.443 > 192.168.4.68.62406: Flags [.], cksum 0xfb68, seq 18472, ack 3511, win 16, length 1391
00:11:45.044316 IP (tos 0x00, ttl 52, id 0x525c, offset 0, flags [0x02], proto TCP (6), length 227)
    172.64.155.209.443 > 192.168.4.68.62406: Flags [.], cksum 0x6941, seq 19863, ack 3511, win 16, length 187
00:11:45.044316 IP (tos 0x00, ttl 52, id 0x525d, offset 0, flags [0x02], proto TCP (6), length 1431)
    172.64.155.209.443 > 192.168.4.68.62406: Flags [.], cksum 0xd3b7, seq 20050, ack 3511, win 16, length 1391
00:11:45.044316 IP (tos 0x00, ttl 52, id 0x525e, offset 0, flags [0x02], proto TCP (6), length 1431)
    172.64.155.209.443 > 192.168.4.68.62406: Flags [.], cksum 0x1b20, seq 21441, ack 3511, win 16, length 1391
00:11:45.044316 IP (tos 0x00, ttl 52, id 0x525f, offset 0, flags [0x02], proto TCP (6), length 1152)
    172.64.155.209.443 > 192.168.4.68.62406: Flags [.], cksum 0x5ad7, seq 22832, ack 3511, win 16, length 1112
00:11:45.044316 IP (tos 0x00, ttl 52, id 0x5260, offset 0, flags [0x02], proto TCP (6), length 1431)
    172.64.155.209.443 > 192.168.4.68.62406: Flags [.], cksum 0x2ff4, seq 23944, ack 3511, win 16, length 1391
00:11:45.044316 IP (tos 0x00, ttl 52, id 0x5261, offset 0, flags [0x02], proto TCP (6), length 1431)
    172.64.155.209.443 > 192.168.4.68.62406: Flags [.], cksum 0x502c, seq 25335, ack 3511, win 16, length 1391
00:11:45.044316 IP (tos 0x00, ttl 52, id 0x5262, offset 0, flags [0x02], proto TCP (6), length 1500)
    172.64.155.209.443 > 192.168.4.68.62406: Flags [.], cksum 0xca9c, seq 26726, ack 3511, win 16, length 1460
00:11:45.044316 IP (tos 0x00, ttl 52, id 0x5263, offset 0, flags [0x02], proto TCP (6), length 1362)
    172.64.155.209.443 > 192.168.4.68.62406: Flags [.], cksum 0x6c8e, seq 28186, ack 3511, win 16, length 1322
00:11:45.044316 IP (tos 0x00, ttl 52, id 0x5264, offset 0, flags [0x02], proto TCP (6), length 1431)
    172.64.155.209.443 > 192.168.4.68.62406: Flags [.], cksum 0xb732, seq 29508, ack 3511, win 16, length 1391
00:11:45.044316 IP (tos 0x00, ttl 52, id 0x5265, offset 0, flags [0x02], proto TCP (6), length 1431)
    172.64.155.209.443 > 192.168.4.68.62406: Flags [.], cksum 0x28cb, seq 30899, ack 3511, win 16, length 1391
00:11:45.044316 IP (tos 0x00, ttl 52, id 0x5266, offset 0, flags [0x02], proto TCP (6), length 1431)
    172.64.155.209.443 > 192.168.4.68.62406: Flags [.], cksum 0x75fc, seq 32290, ack 3511, win 16, length 1391
00:11:45.044316 IP (tos 0x00, ttl 52, id 0x5267, offset 0, flags [0x02], proto TCP (6), length 1431)
    172.64.155.209.443 > 192.168.4.68.62406: Flags [.], cksum 0x7606, seq 33681, ack 3511, win 16, length 1391
00:11:45.044316 IP (tos 0x00, ttl 52, id 0x5268, offset 0, flags [0x02], proto TCP (6), length 258)
    172.64.155.209.443 > 192.168.4.68.62406: Flags [.], cksum 0x85ac, seq 35072, ack 3511, win 16, length 218
00:11:45.044316 IP (tos 0x00, ttl 52, id 0x5269, offset 0, flags [0x02], proto TCP (6), length 1431)
    172.64.155.209.443 > 192.168.4.68.62406: Flags [.], cksum 0x22d0, seq 35290, ack 3511, win 16, length 1391
00:11:45.044316 IP (tos 0x00, ttl 52, id 0x526a, offset 0, flags [0x02], proto TCP (6), length 1431)
    172.64.155.209.443 > 192.168.4.68.62406: Flags [.], cksum 0x1ad2, seq 36681, ack 3511, win 16, length 1391
00:11:45.044316 IP (tos 0x00, ttl 52, id 0x526b, offset 0, flags [0x02], proto TCP (6), length 1431)
    172.64.155.209.443 > 192.168.4.68.62406: Flags [.], cksum 0xae8c, seq 38072, ack 3511, win 16, length 1391
00:11:45.044316 IP (tos 0x00, ttl 52, id 0x526c, offset 0, flags [0x02], proto TCP (6), length 1431)
    172.64.155.209.443 > 192.168.4.68.62406: Flags [.], cksum 0xd707, seq 39463, ack 3511, win 16, length 1391
00:11:45.044316 IP (tos 0x00, ttl 52, id 0x526d, offset 0, flags [0x02], proto TCP (6), length 1431)
    172.64.155.209.443 > 192.168.4.68.62406: Flags [.], cksum 0x3a9d, seq 40854, ack 3511, win 16, length 1391
00:11:45.044316 IP (tos 0x00, ttl 52, id 0x526e, offset 0, flags [0x02], proto TCP (6), length 1431)
    172.64.155.209.443 > 192.168.4.68.62406: Flags [.], cksum 0xba6a, seq 42245, ack 3511, win 16, length 1391
00:11:45.044316 IP (tos 0x00, ttl 52, id 0x526f, offset 0, flags [0x02], proto TCP (6), length 1431)
    172.64.155.209.443 > 192.168.4.68.62406: Flags [.], cksum 0x1915, seq 43636, ack 3511, win 16, length 1391
00:11:45.044316 IP (tos 0x00, ttl 52, id 0x5270, offset 0, flags [0x02], proto TCP (6), length 135)
    172.64.155.209.443 > 192.168.4.68.62406: Flags [.], cksum 0xcf6f, seq 45027, ack 3511, win 16, length 95
00:11:45.044316 IP (tos 0x00, ttl 52, id 0x5271, offset 0, flags [0x02], proto TCP (6), length 135)
    172.64.155.209.443 > 192.168.4.68.62406: Flags [.], cksum 0xcf6f, seq 45027, ack 3511, win 16, length 95
00:11:45.046433 IP (tos 0x00, ttl 128, id 0xf4dc, offset 0, flags [0x02], proto TCP (6), length 40)
    192.168.4.68.62406 > 172.64.155.209.443: Flags [.], cksum 0x0d19, seq 3511, ack 12015, win 255, length 0
00:11:45.046574 IP (tos 0x00, ttl 128, id 0xf4dd, offset 0, flags [0x02], proto TCP (6), length 40)
    192.168.4.68.62406 > 172.64.155.209.443: Flags [.], cksum 0x0d19, seq 3511, ack 14299, win 255, length 0
00:11:45.046625 IP (tos 0x00, ttl 128, id 0xf4de, offset 0, flags [0x02], proto TCP (6), length 40)
    192.168.4.68.62406 > 172.64.155.209.443: Flags [.], cksum 0x0d19, seq 3511, ack 19863, win 255, length 0
00:11:45.046683 IP (tos 0x00, ttl 128, id 0xf4df, offset 0, flags [0x02], proto TCP (6), length 40)
    192.168.4.68.62406 > 172.64.155.209.443: Flags [.], cksum 0x0d19, seq 3511, ack 22832, win 255, length 0
00:11:45.046401 IP (tos 0x00, ttl 52, id 0x5272, offset 0, flags [0x02], proto TCP (6), length 1431)
    172.64.155.209.443 > 192.168.4.68.62406: Flags [.], cksum 0x3e67, seq 45122, ack 3511, win 16, length 1391
00:11:45.046401 IP (tos 0x00, ttl 52, id 0x5273, offset 0, flags [0x02], proto TCP (6), length 1431)
    172.64.155.209.443 > 192.168.4.68.62406: Flags [.], cksum 0x910e, seq 46513, ack 3511, win 16, length 1391
00:11:45.046401 IP (tos 0x00, ttl 52, id 0x5274, offset 0, flags [0x02], proto TCP (6), length 1431)
    172.64.155.209.443 > 192.168.4.68.62406: Flags [.], cksum 0xc64e, seq 47904, ack 3511, win 16, length 1391
00:11:45.046401 IP (tos 0x00, ttl 52, id 0x5275, offset 0, flags [0x02], proto TCP (6), length 1431)
    172.64.155.209.443 > 192.168.4.68.62406: Flags [.], cksum 0x2445, seq 49295, ack 3511, win 16, length 1391
00:11:45.046731 IP (tos 0x00, ttl 128, id 0xf4e0, offset 0, flags [0x02], proto TCP (6), length 40)
    192.168.4.68.62406 > 172.64.155.209.443: Flags [.], cksum 0x0d19, seq 3511, ack 23944, win 251, length 0
00:11:45.046401 IP (tos 0x00, ttl 52, id 0x5276, offset 0, flags [0x02], proto TCP (6), length 1431)
    172.64.155.209.443 > 192.168.4.68.62406: Flags [.], cksum 0x9d5f, seq 50686, ack 3511, win 16, length 1391
00:11:45.046401 IP (tos 0x00, ttl 52, id 0x5277, offset 0, flags [0x02], proto TCP (6), length 1431)
    172.64.155.209.443 > 192.168.4.68.62406: Flags [.], cksum 0x8547, seq 52077, ack 3511, win 16, length 1391
00:11:45.046401 IP (tos 0x00, ttl 52, id 0x5278, offset 0, flags [0x02], proto TCP (6), length 1500)
    172.64.155.209.443 > 192.168.4.68.62406: Flags [.], cksum 0x5884, seq 53468, ack 3511, win 16, length 1460
00:11:45.046401 IP (tos 0x00, ttl 52, id 0x5279, offset 0, flags [0x02], proto TCP (6), length 1500)
    172.64.155.209.443 > 192.168.4.68.62406: Flags [.], cksum 0x8819, seq 54928, ack 3511, win 16, length 1460
00:11:45.046786 IP (tos 0x00, ttl 128, id 0xf4e1, offset 0, flags [0x02], proto TCP (6), length 40)
    192.168.4.68.62406 > 172.64.155.209.443: Flags [.], cksum 0x0d19, seq 3511, ack 26726, win 255, length 0
00:11:45.046401 IP (tos 0x00, ttl 52, id 0x527a, offset 0, flags [0x02], proto TCP (6), length 1500)
    172.64.155.209.443 > 192.168.4.68.62406: Flags [.], cksum 0xe139, seq 56388, ack 3511, win 16, length 1460
00:11:45.046401 IP (tos 0x00, ttl 52, id 0x527b, offset 0, flags [0x02], proto TCP (6), length 1500)
    172.64.155.209.443 > 192.168.4.68.62406: Flags [.], cksum 0x0416, seq 57848, ack 3511, win 16, length 1460
00:11:45.046401 IP (tos 0x00, ttl 52, id 0x527c, offset 0, flags [0x02], proto TCP (6), length 615)
    172.64.155.209.443 > 192.168.4.68.62406: Flags [.], cksum 0xf794, seq 59308, ack 3511, win 16, length 575
00:11:45.046841 IP (tos 0x00, ttl 128, id 0xf4e2, offset 0, flags [0x02], proto TCP (6), length 40)
    192.168.4.68.62406 > 172.64.155.209.443: Flags [.], cksum 0x0d19, seq 3511, ack 29508, win 255, length 0
00:11:45.046904 IP (tos 0x00, ttl 128, id 0xf4e3, offset 0, flags [0x02], proto TCP (6), length 40)
    192.168.4.68.62406 > 172.64.155.209.443: Flags [.], cksum 0x0d19, seq 3511, ack 35072, win 255, length 0
00:11:45.047067 IP (tos 0x00, ttl 128, id 0xf4e4, offset 0, flags [0x02], proto TCP (6), length 40)
    192.168.4.68.62406 > 172.64.155.209.443: Flags [.], cksum 0x0d19, seq 3511, ack 45027, win 255, length 0
00:11:45.047124 IP (tos 0x00, ttl 128, id 0xf4e5, offset 0, flags [0x02], proto TCP (6), length 52)
    192.168.4.68.62406 > 172.64.155.209.443: Flags [.], cksum 0x0d25, seq 3511, ack 45122, win 255, length 0
00:11:45.047191 IP (tos 0x00, ttl 128, id 0xf4e6, offset 0, flags [0x02], proto TCP (6), length 40)
    192.168.4.68.62406 > 172.64.155.209.443: Flags [.], cksum 0x0d19, seq 3511, ack 53468, win 255, length 0
00:11:45.047245 IP (tos 0x00, ttl 128, id 0xf4e7, offset 0, flags [0x02], proto TCP (6), length 40)
    192.168.4.68.62406 > 172.64.155.209.443: Flags [.], cksum 0x0d19, seq 3511, ack 59308, win 255, length 0
00:11:45.047300 IP (tos 0x00, ttl 128, id 0xf4e8, offset 0, flags [0x02], proto TCP (6), length 40)
    192.168.4.68.62406 > 172.64.155.209.443: Flags [.], cksum 0x0d19, seq 3511, ack 59883, win 253, length 0
00:11:45.056189 IP (tos 0x00, ttl 52, id 0x527d, offset 0, flags [0x02], proto TCP (6), length 1500)
    172.64.155.209.443 > 192.168.4.68.62406: Flags [.], cksum 0x096b, seq 59883, ack 3511, win 16, length 1460
00:11:45.056189 IP (tos 0x00, ttl 52, id 0x527e, offset 0, flags [0x02], proto TCP (6), length 1500)
    172.64.155.209.443 > 192.168.4.68.62406: Flags [.], cksum 0xa876, seq 61343, ack 3511, win 16, length 1460
00:11:45.056189 IP (tos 0x00, ttl 52, id 0x527f, offset 0, flags [0x02], proto TCP (6), length 1500)
    172.64.155.209.443 > 192.168.4.68.62406: Flags [.], cksum 0x4c1a, seq 62803, ack 3511, win 16, length 1460
00:11:45.056189 IP (tos 0x00, ttl 52, id 0x5280, offset 0, flags [0x02], proto TCP (6), length 1500)
    172.64.155.209.443 > 192.168.4.68.62406: Flags [.], cksum 0x55e6, seq 64263, ack 3511, win 16, length 1460
00:11:45.056189 IP (tos 0x00, ttl 52, id 0x5281, offset 0, flags [0x02], proto TCP (6), length 1500)
    172.64.155.209.443 > 192.168.4.68.62406: Flags [.], cksum 0x8ab7, seq 65723, ack 3511, win 16, length 1460
00:11:45.056189 IP (tos 0x00, ttl 52, id 0x5282, offset 0, flags [0x02], proto TCP (6), length 1500)
    172.64.155.209.443 > 192.168.4.68.62406: Flags [.], cksum 0x0ff4, seq 67183, ack 3511, win 16, length 1460
00:11:45.056189 IP (tos 0x00, ttl 52, id 0x5283, offset 0, flags [0x02], proto TCP (6), length 1500)
    172.64.155.209.443 > 192.168.4.68.62406: Flags [.], cksum 0x20f7, seq 68643, ack 3511, win 16, length 1460
00:11:45.056189 IP (tos 0x00, ttl 52, id 0x5284, offset 0, flags [0x02], proto TCP (6), length 1500)
    172.64.155.209.443 > 192.168.4.68.62406: Flags [.], cksum 0x38ae, seq 70103, ack 3511, win 16, length 1460
00:11:45.056189 IP (tos 0x00, ttl 52, id 0x5285, offset 0, flags [0x02], proto TCP (6), length 1064)
    172.64.155.209.443 > 192.168.4.68.62406: Flags [.], cksum 0x7927, seq 71563, ack 3511, win 16, length 1024
00:11:45.056952 IP (tos 0x00, ttl 128, id 0xf4e9, offset 0, flags [0x02], proto TCP (6), length 40)
    192.168.4.68.62406 > 172.64.155.209.443: Flags [.], cksum 0x0d19, seq 3511, ack 71563, win 511, length 0
00:11:45.099445 IP (tos 0x00, ttl 128, id 0x64b4, offset 0, flags [0x00], proto Proto (17), length 70)
    192.168.4.68. > 192.168.4.72.: Flags [.], cksum , , , , length 
00:11:45.099719 IP (tos 0x00, ttl 128, id 0x64b5, offset 0, flags [0x00], proto Proto (17), length 70)
    192.168.4.68. > 192.168.4.72.: Flags [.], cksum , , , , length 
00:11:45.100044 IP (tos 0x00, ttl 128, id 0x64b6, offset 0, flags [0x00], proto Proto (17), length 70)
    192.168.4.68. > 192.168.4.72.: Flags [.], cksum , , , , length 
00:11:45.104959 IP (tos 0x00, ttl 128, id 0xf4ea, offset 0, flags [0x02], proto TCP (6), length 40)
    192.168.4.68.62406 > 172.64.155.209.443: Flags [.], cksum 0x0d19, seq 3511, ack 72587, win 507, length 0
00:11:45.108287 IP (tos 0x00, ttl 64, id 0xae06, offset 0, flags [0x02], proto Proto (17), length 86)
    192.168.4.72. > 192.168.4.68.: Flags [.], cksum , , , , length 
00:11:45.108287 IP (tos 0x00, ttl 64, id 0xae07, offset 0, flags [0x02], proto Proto (17), length 98)
    192.168.4.72. > 192.168.4.68.: Flags [.], cksum , , , , length 
00:11:45.108287 IP (tos 0x00, ttl 64, id 0xae08, offset 0, flags [0x02], proto Proto (17), length 70)
    192.168.4.72. > 192.168.4.68.: Flags [.], cksum , , , , length 
00:11:45.116150 IP (tos 0x00, ttl 128, id 0x64b7, offset 0, flags [0x00], proto Proto (17), length 60)
    192.168.4.68. > 192.168.4.72.: Flags [.], cksum , , , , length 
00:11:45.116223 IP (tos 0x00, ttl 128, id 0x64b8, offset 0, flags [0x00], proto Proto (17), length 60)
    192.168.4.68. > 192.168.4.72.: Flags [.], cksum , , , , length 
00:11:45.116358 IP (tos 0x00, ttl 128, id 0x64b9, offset 0, flags [0x00], proto Proto (17), length 60)
    192.168.4.68. > 192.168.4.72.: Flags [.], cksum , , , , length 
00:11:45.124204 IP (tos 0x00, ttl 64, id 0xae09, offset 0, flags [0x02], proto Proto (17), length 116)
    192.168.4.72. > 192.168.4.68.: Flags [.], cksum , , , , length 
00:11:45.125821 IP (tos 0x00, ttl 64, id 0xae0a, offset 0, flags [0x02], proto Proto (17), length 149)
    192.168.4.72. > 192.168.4.68.: Flags [.], cksum , , , , length 
00:11:45.127749 IP (tos 0x00, ttl 64, id 0xae0b, offset 0, flags [0x02], proto Proto (17), length 92)
    192.168.4.72. > 192.168.4.68.: Flags [.], cksum , , , , length 
00:11:45.129017 IP (tos 0x00, ttl 128, id 0x64ba, offset 0, flags [0x00], proto Proto (17), length 60)
    192.168.4.68. > 192.168.4.72.: Flags [.], cksum , , , , length 
00:11:45.136390 IP (tos 0x00, ttl 64, id 0xae0c, offset 0, flags [0x02], proto Proto (17), length 92)
    192.168.4.72. > 192.168.4.68.: Flags [.], cksum , , , , length 
00:11:45.137642 IP (tos 0x00, ttl 128, id 0x64bb, offset 0, flags [0x00], proto Proto (17), length 60)
    192.168.4.68. > 192.168.4.72.: Flags [.], cksum , , , , length 
00:11:45.144055 IP (tos 0x00, ttl 64, id 0xae0e, offset 0, flags [0x02], proto Proto (17), length 116)
    192.168.4.72. > 192.168.4.68.: Flags [.], cksum , , , , length 
00:11:45.210167 IP (tos 0x00, ttl 52, id 0x5286, offset 0, flags [0x02], proto TCP (6), length 1500)
    172.64.155.209.443 > 192.168.4.68.62406: Flags [.], cksum 0x39ce, seq 72587, ack 3511, win 16, length 1460
00:11:45.210167 IP (tos 0x00, ttl 52, id 0x5287, offset 0, flags [0x02], proto TCP (6), length 407)
    172.64.155.209.443 > 192.168.4.68.62406: Flags [.], cksum 0x5e23, seq 74047, ack 3511, win 16, length 367
00:11:45.210167 IP (tos 0x00, ttl 52, id 0x5288, offset 0, flags [0x02], proto TCP (6), length 72)
    172.64.155.209.443 > 192.168.4.68.62406: Flags [.], cksum 0x989f, seq 74414, ack 3511, win 16, length 32
00:11:45.210167 IP (tos 0x00, ttl 52, id 0x5289, offset 0, flags [0x02], proto TCP (6), length 71)
    172.64.155.209.443 > 192.168.4.68.62406: Flags [.], cksum 0xa0d9, seq 74446, ack 3511, win 16, length 31
00:11:45.210433 IP (tos 0x00, ttl 128, id 0xf4eb, offset 0, flags [0x02], proto TCP (6), length 40)
    192.168.4.68.62406 > 172.64.155.209.443: Flags [.], cksum 0x0d19, seq 3511, ack 74414, win 511, length 0
00:11:45.210482 IP (tos 0x00, ttl 128, id 0xf4ec, offset 0, flags [0x02], proto TCP (6), length 40)
    192.168.4.68.62406 > 172.64.155.209.443: Flags [.], cksum 0x0d19, seq 3511, ack 74477, win 511, length 0
00:11:45.215981 IP (tos 0x00, ttl 128, id 0xf4ed, offset 0, flags [0x02], proto TCP (6), length 421)
    192.168.4.68.62406 > 172.64.155.209.443: Flags [.], cksum 0x0e96, seq 3511, ack 74477, win 511, length 381
00:11:45.216584 IP (tos 0x00, ttl 128, id 0xf4ee, offset 0, flags [0x02], proto TCP (6), length 75)
    192.168.4.68.62406 > 172.64.155.209.443: Flags [.], cksum 0x0d3c, seq 3892, ack 74477, win 511, length 35
00:11:45.217351 IP (tos 0x00, ttl 128, id 0xf4ef, offset 0, flags [0x02], proto TCP (6), length 140)
    192.168.4.68.62406 > 172.64.155.209.443: Flags [.], cksum 0x0d7d, seq 3927, ack 74477, win 511, length 100
00:11:45.217458 IP (tos 0x00, ttl 128, id 0xf4f0, offset 0, flags [0x02], proto TCP (6), length 75)
    192.168.4.68.62406 > 172.64.155.209.443: Flags [.], cksum 0x0d3c, seq 4027, ack 74477, win 511, length 35
00:11:45.223786 IP (tos 0x00, ttl 52, id 0x528a, offset 0, flags [0x02], proto TCP (6), length 40)
    172.64.155.209.443 > 192.168.4.68.62406: Flags [.], cksum 0xbdd4, seq 74477, ack 3927, win 16, length 0
00:11:45.225147 IP (tos 0x00, ttl 52, id 0x528b, offset 0, flags [0x02], proto TCP (6), length 40)
    172.64.155.209.443 > 192.168.4.68.62406: Flags [.], cksum 0xbd4d, seq 74477, ack 4062, win 16, length 0
00:11:45.241701 IP (tos 0x00, ttl 128, id 0x64bc, offset 0, flags [0x00], proto Proto (17), length 83)
    192.168.4.68. > 192.168.4.72.: Flags [.], cksum , , , , length 
00:11:45.242055 IP (tos 0x00, ttl 128, id 0x64bd, offset 0, flags [0x00], proto Proto (17), length 83)
    192.168.4.68. > 192.168.4.72.: Flags [.], cksum , , , , length 
00:11:45.243072 IP (tos 0x00, ttl 128, id 0x53cf, offset 0, flags [0x02], proto TCP (6), length 52)
    192.168.4.68.62407 > 151.101.129.91.443: Flags [.], cksum 0xddd3, seq 0, ack 0, win 65535, length 0
00:11:45.243415 IP (tos 0x00, ttl 128, id 0x53d0, offset 0, flags [0x02], proto TCP (6), length 192)
    192.168.4.68.59274 > 151.101.129.91.443: Flags [.], cksum 0xde5f, seq 1, ack 1, win 251, length 152
00:11:45.248489 IP (tos 0x00, ttl 128, id 0x13b1, offset 0, flags [0x02], proto TCP (6), length 91)
    192.168.4.68.61620 > 52.112.86.213.443: Flags [.], cksum 0x507f, seq 1, ack 1, win 253, length 51
00:11:45.250312 IP (tos 0x00, ttl 54, id 0x0000, offset 0, flags [0x02], proto TCP (6), length 52)
    151.101.129.91.443 > 192.168.4.68.62407: Flags [.], cksum 0xfc98, seq 0, ack 1, win 65535, length 0
00:11:45.250312 IP (tos 0x00, ttl 54, id 0x2ad1, offset 0, flags [0x02], proto TCP (6), length 40)
    151.101.129.91.443 > 192.168.4.68.59274: Flags [.], cksum 0x0e4a, seq 1, ack 153, win 292, length 0
00:11:45.250615 IP (tos 0x00, ttl 128, id 0x53d1, offset 0, flags [0x02], proto TCP (6), length 40)
    192.168.4.68.62407 > 151.101.129.91.443: Flags [.], cksum 0xddc7, seq 1, ack 1, win 255, length 0
00:11:45.251450 IP (tos 0x00, ttl 128, id 0x53d2, offset 0, flags [0x02], proto TCP (6), length 1500)
    192.168.4.68.62407 > 151.101.129.91.443: Flags [.], cksum 0xe37b, seq 1, ack 1, win 255, length 1460
00:11:45.251450 IP (tos 0x00, ttl 128, id 0x53d3, offset 0, flags [0x02], proto TCP (6), length 502)
    192.168.4.68.62407 > 151.101.129.91.443: Flags [.], cksum 0xdf95, seq 1461, ack 1, win 255, length 462
00:11:45.251783 IP (tos 0x00, ttl 54, id 0x2ad2, offset 0, flags [0x02], proto TCP (6), length 366)
    151.101.129.91.443 > 192.168.4.68.59274: Flags [.], cksum 0x9ed6, seq 1, ack 153, win 292, length 326
00:11:45.251783 IP (tos 0x00, ttl 54, id 0x2ad3, offset 0, flags [0x02], proto TCP (6), length 305)
    151.101.129.91.443 > 192.168.4.68.59274: Flags [.], cksum 0xef02, seq 327, ack 153, win 292, length 265
00:11:45.252085 IP (tos 0x00, ttl 128, id 0x53d4, offset 0, flags [0x02], proto TCP (6), length 40)
    192.168.4.68.59274 > 151.101.129.91.443: Flags [.], cksum 0xddc7, seq 153, ack 592, win 255, length 0
00:11:45.253811 IP (tos 0x00, ttl 64, id 0xae1f, offset 0, flags [0x02], proto Proto (17), length 183)
    192.168.4.72. > 192.168.4.68.: Flags [.], cksum , , , , length 
00:11:45.255269 IP (tos 0x00, ttl 128, id 0x64be, offset 0, flags [0x00], proto Proto (17), length 68)
    192.168.4.68. > 192.168.4.72.: Flags [.], cksum , , , , length 
00:11:45.260763 IP (tos 0x00, ttl 64, id 0xae21, offset 0, flags [0x02], proto Proto (17), length 231)
    192.168.4.72. > 192.168.4.68.: Flags [.], cksum , , , , length 
00:11:45.262316 IP (tos 0x00, ttl 54, id 0xe0bd, offset 0, flags [0x02], proto TCP (6), length 40)
    151.101.129.91.443 > 192.168.4.68.62407: Flags [.], cksum 0x34d1, seq 1, ack 1923, win 282, length 0
00:11:45.265260 IP (tos 0x00, ttl 54, id 0xe0be, offset 0, flags [0x02], proto TCP (6), length 1496)
    151.101.129.91.443 > 192.168.4.68.62407: Flags [.], cksum 0x17d0, seq 1, ack 1923, win 282, length 1456
00:11:45.265260 IP (tos 0x00, ttl 54, id 0xe0bf, offset 0, flags [0x02], proto TCP (6), length 1496)
    151.101.129.91.443 > 192.168.4.68.62407: Flags [.], cksum 0xddf3, seq 1457, ack 1923, win 282, length 1456
00:11:45.265260 IP (tos 0x00, ttl 54, id 0xe0c0, offset 0, flags [0x02], proto TCP (6), length 1496)
    151.101.129.91.443 > 192.168.4.68.62407: Flags [.], cksum 0x873f, seq 2913, ack 1923, win 282, length 1456
00:11:45.265260 IP (tos 0x00, ttl 54, id 0xe0c1, offset 0, flags [0x02], proto TCP (6), length 197)
    151.101.129.91.443 > 192.168.4.68.62407: Flags [.], cksum 0x6aff, seq 4369, ack 1923, win 282, length 157
00:11:45.265575 IP (tos 0x00, ttl 128, id 0x53d5, offset 0, flags [0x02], proto TCP (6), length 40)
    192.168.4.68.62407 > 151.101.129.91.443: Flags [.], cksum 0xddc7, seq 1923, ack 4369, win 255, length 0
00:11:45.265758 IP (tos 0x00, ttl 128, id 0x53d6, offset 0, flags [0x02], proto TCP (6), length 40)
    192.168.4.68.62407 > 151.101.129.91.443: Flags [.], cksum 0xddc7, seq 1923, ack 4526, win 255, length 0
00:11:45.268177 IP (tos 0x00, ttl 128, id 0x53d7, offset 0, flags [0x02], proto TCP (6), length 104)
    192.168.4.68.62407 > 151.101.129.91.443: Flags [.], cksum 0xde07, seq 1923, ack 4526, win 255, length 64
00:11:45.268720 IP (tos 0x00, ttl 128, id 0x53d8, offset 0, flags [0x02], proto TCP (6), length 149)
    192.168.4.68.62407 > 151.101.129.91.443: Flags [.], cksum 0xde34, seq 1987, ack 4526, win 255, length 109
00:11:45.269705 IP (tos 0x00, ttl 128, id 0x53d9, offset 0, flags [0x02], proto TCP (6), length 64)
    192.168.4.68.62407 > 151.101.129.91.443: Flags [.], cksum 0xdddf, seq 2096, ack 4526, win 255, length 24
00:11:45.269772 IP (tos 0x00, ttl 128, id 0x53da, offset 0, flags [0x02], proto TCP (6), length 40)
    192.168.4.68.62407 > 151.101.129.91.443: Flags [.], cksum 0xddc7, seq 2120, ack 4526, win 255, length 0
00:11:45.274360 IP (tos 0x00, ttl 54, id 0xe0c2, offset 0, flags [0x02], proto TCP (6), length 40)
    151.101.129.91.443 > 192.168.4.68.62407: Flags [.], cksum 0x22e4, seq 4526, ack 1987, win 282, length 0
00:11:45.274360 IP (tos 0x00, ttl 64, id 0xae24, offset 0, flags [0x02], proto Proto (17), length 132)
    192.168.4.72. > 192.168.4.68.: Flags [.], cksum , , , , length 
00:11:45.275318 IP (tos 0x00, ttl 128, id 0x64bf, offset 0, flags [0x00], proto Proto (17), length 68)
    192.168.4.68. > 192.168.4.72.: Flags [.], cksum , , , , length 
00:11:45.275763 IP (tos 0x00, ttl 54, id 0xe0c3, offset 0, flags [0x02], proto TCP (6), length 40)
    151.101.129.91.443 > 192.168.4.68.62407: Flags [.], cksum 0x2277, seq 4526, ack 2096, win 282, length 0
00:11:45.275763 IP (tos 0x00, ttl 54, id 0xe0c4, offset 0, flags [0x02], proto TCP (6), length 105)
    151.101.129.91.443 > 192.168.4.68.62407: Flags [.], cksum 0xf541, seq 4526, ack 2096, win 282, length 65
00:11:45.276064 IP (tos 0x00, ttl 128, id 0x53db, offset 0, flags [0x02], proto TCP (6), length 40)
    192.168.4.68.62407 > 151.101.129.91.443: Flags [.], cksum 0xddc7, seq 2121, ack 4591, win 0, length 0
00:11:45.278016 IP (tos 0x00, ttl 54, id 0xe0c5, offset 0, flags [0x02], proto TCP (6), length 40)
    151.101.129.91.443 > 192.168.4.68.62407: Flags [.], cksum 0x221e, seq 4591, ack 2120, win 282, length 0
00:11:45.278016 IP (tos 0x00, ttl 54, id 0xe0c6, offset 0, flags [0x02], proto TCP (6), length 40)
    151.101.129.91.443 > 192.168.4.68.62407: Flags [.], cksum 0x221d, seq 4591, ack 2121, win 282, length 0
00:11:45.278016 IP (tos 0x00, ttl 54, id 0xe0c7, offset 0, flags [0x02], proto TCP (6), length 64)
    151.101.129.91.443 > 192.168.4.68.62407: Flags [.], cksum 0xe765, seq 4591, ack 2121, win 282, length 24
00:11:45.278016 IP (tos 0x00, ttl 54, id 0xe0c8, offset 0, flags [0x02], proto TCP (6), length 40)
    151.101.129.91.443 > 192.168.4.68.62407: Flags [.], cksum 0x2204, seq 4615, ack 2121, win 282, length 0
00:11:45.281721 IP (tos 0x00, ttl 64, id 0xae25, offset 0, flags [0x02], proto Proto (17), length 180)
    192.168.4.72. > 192.168.4.68.: Flags [.], cksum , , , , length 
00:11:45.318712 IP (tos 0x00, ttl 107, id 0xb09d, offset 0, flags [0x02], proto TCP (6), length 80)
    52.112.86.213.443 > 192.168.4.68.61620: Flags [.], cksum 0x833c, seq 1, ack 52, win 16380, length 40
00:11:45.373950 IP (tos 0x00, ttl 128, id 0x13b2, offset 0, flags [0x02], proto TCP (6), length 40)
    192.168.4.68.61620 > 52.112.86.213.443: Flags [.], cksum 0x504c, seq 52, ack 41, win 253, length 0
00:11:45.400355 IP (tos 0x00, ttl 128, id 0x7819, offset 0, flags [0x02], proto TCP (6), length 91)
    192.168.4.68.60463 > 13.91.58.244.443: Flags [.], cksum 0x0d89, seq 1, ack 1, win 254, length 51
00:11:45.471177 IP (tos 0x00, ttl 107, id 0x7d86, offset 0, flags [0x02], proto TCP (6), length 80)
    13.91.58.244.443 > 192.168.4.68.60463: Flags [.], cksum 0x9e34, seq 1, ack 52, win 16383, length 40
00:11:45.526401 IP (tos 0x00, ttl 128, id 0x781a, offset 0, flags [0x02], proto TCP (6), length 40)
    192.168.4.68.60463 > 13.91.58.244.443: Flags [.], cksum 0x0d56, seq 52, ack 41, win 254, length 0
00:11:45.541893 IP (tos 0x00, ttl 128, id 0x4116, offset 0, flags [0x02], proto TCP (6), length 150)
    192.168.4.68.53103 > 192.168.4.43.8009: Flags [.], cksum 0x8a48, seq 1, ack 1, win 252, length 110
00:11:45.551510 IP (tos 0x00, ttl 64, id 0x90cb, offset 0, flags [0x00], proto TCP (6), length 40)
    192.168.4.43.8009 > 192.168.4.68.53103: Flags [.], cksum 0xdad4, seq 1, ack 111, win 4095, length 0
00:11:45.551510 IP (tos 0x00, ttl 64, id 0x1342, offset 0, flags [0x00], proto TCP (6), length 150)
    192.168.4.43.8009 > 192.168.4.68.53103: Flags [.], cksum 0x488b, seq 1, ack 111, win 4096, length 110
00:11:45.603571 IP (tos 0x00, ttl 128, id 0x4117, offset 0, flags [0x02], proto TCP (6), length 40)
    192.168.4.68.53103 > 192.168.4.43.8009: Flags [.], cksum 0x89da, seq 111, ack 111, win 252, length 0
00:11:45.719158 IP (tos 0x00, ttl 128, id 0x64c0, offset 0, flags [0x00], proto Proto (17), length 74)
    192.168.4.68. > 192.168.4.72.: Flags [.], cksum , , , , length 
00:11:45.719158 IP (tos 0x00, ttl 128, id 0x64c1, offset 0, flags [0x00], proto Proto (17), length 74)
    192.168.4.68. > 192.168.4.72.: Flags [.], cksum , , , , length 
00:11:45.719312 IP (tos 0x00, ttl 128, id 0x64c2, offset 0, flags [0x00], proto Proto (17), length 74)
    192.168.4.68. > 192.168.4.72.: Flags [.], cksum , , , , length 
00:11:45.728061 IP (tos 0x00, ttl 64, id 0xae2e, offset 0, flags [0x02], proto Proto (17), length 90)
    192.168.4.72. > 192.168.4.68.: Flags [.], cksum , , , , length 
00:11:45.729922 IP (tos 0x00, ttl 64, id 0xae2f, offset 0, flags [0x02], proto Proto (17), length 102)
    192.168.4.72. > 192.168.4.68.: Flags [.], cksum , , , , length 
00:11:45.731623 IP (tos 0x00, ttl 64, id 0xae30, offset 0, flags [0x02], proto Proto (17), length 74)
    192.168.4.72. > 192.168.4.68.: Flags [.], cksum , , , , length 
00:11:45.736878 IP (tos 0x00, ttl 128, id 0x0584, offset 0, flags [0x02], proto TCP (6), length 79)
    192.168.4.68.59272 > 34.107.243.93.443: Flags [.], cksum 0xdaf6, seq 1, ack 1, win 252, length 39
00:11:45.737051 IP (tos 0x00, ttl 128, id 0x53dc, offset 0, flags [0x02], proto TCP (6), length 86)
    192.168.4.68.59274 > 151.101.129.91.443: Flags [.], cksum 0xddf5, seq 153, ack 592, win 255, length 46
00:11:45.737194 IP (tos 0x00, ttl 128, id 0xf4f1, offset 0, flags [0x02], proto TCP (6), length 79)
    192.168.4.68.62406 > 172.64.155.209.443: Flags [.], cksum 0x0d40, seq 4062, ack 74477, win 511, length 39
00:11:45.737835 IP (tos 0x00, ttl 128, id 0xf4f2, offset 0, flags [0x02], proto TCP (6), length 64)
    192.168.4.68.62406 > 172.64.155.209.443: Flags [.], cksum 0x0d31, seq 4101, ack 74477, win 511, length 24
00:11:45.737912 IP (tos 0x00, ttl 128, id 0xf4f3, offset 0, flags [0x02], proto TCP (6), length 40)
    192.168.4.68.62406 > 172.64.155.209.443: Flags [.], cksum 0x0d19, seq 4125, ack 74477, win 511, length 0
00:11:45.738169 IP (tos 0x00, ttl 128, id 0x53dd, offset 0, flags [0x02], proto TCP (6), length 71)
