LLM_IP CHATGPT 172.64.155.209
LLM_IP GEMINI 172.253.62.101
LLM_IP GEMINI 172.253.62.113

Capturing on 'Wi-Fi' IP (tos 0x0, ttl , id , offset 0, flags [], proto Proto (), length )
    . > .: Flags [.], cksum , , , , length 
00:12:31.940908 IP (tos 0x00, ttl 255, id 0xe46e, offset 0, flags [0x00], proto Proto (17), length 306)
    192.168.4.47. > 224.0.0.251.: Flags [.], cksum , , , , length 
00:12:34.763281 IP (tos 0x00, ttl 1, id 0xaca0, offset 0, flags [0x00], proto Proto (17), length 117)
    192.168.4.68. > 224.0.0.251.: Flags [.], cksum , , , , length 
00:12:35.373994 IP (tos 0x00, ttl 128, id 0x04ab, offset 0, flags [0x02], proto TCP (6), length 41)
    192.168.4.68.52133 > 64.233.180.95.443: Flags [.], cksum 0xba50, seq 1, ack 1, win 255, length 1
00:12:35.380352 IP (tos 0x00, ttl 52, id 0x83bb, offset 0, flags [0x02], proto TCP (6), length 64)
    104.18.39.21.443 > 192.168.4.68.62405: Flags [.], cksum 0x9df9, seq 1, ack 1, win 19, length 24
00:12:35.380839 IP (tos 0x00, ttl 128, id 0x1072, offset 0, flags [0x02], proto TCP (6), length 68)
    192.168.4.68.62405 > 104.18.39.21.443: Flags [.], cksum 0x544a, seq 1, ack 25, win 255, length 28
00:12:35.386305 IP (tos 0x00, ttl 117, id 0x761c, offset 0, flags [0x00], proto TCP (6), length 52)
    64.233.180.95.443 > 192.168.4.68.52133: Flags [.], cksum 0xdfb1, seq 1, ack 2, win 1023, length 0
00:12:35.387903 IP (tos 0x00, ttl 52, id 0x83bc, offset 0, flags [0x02], proto TCP (6), length 40)
    104.18.39.21.443 > 192.168.4.68.62405: Flags [.], cksum 0x61b7, seq 25, ack 29, win 19, length 0
00:12:35.551931 IP (tos 0x00, ttl 128, id 0xf770, offset 0, flags [0x02], proto TCP (6), length 133)
    192.168.4.68.62408 > 172.64.155.209.443: Flags [.], cksum 0x0d76, seq 1, ack 1, win 4091, length 93
00:12:35.552602 IP (tos 0x00, ttl 128, id 0xf771, offset 0, flags [0x02], proto TCP (6), length 1162)
    192.168.4.68.62408 > 172.64.155.209.443: Flags [.], cksum 0x117b, seq 94, ack 1, win 4091, length 1122
00:12:35.563529 IP (tos 0x00, ttl 52, id 0xe134, offset 0, flags [0x02], proto TCP (6), length 40)
    172.64.155.209.443 > 192.168.4.68.62408: Flags [.], cksum 0x609f, seq 1, ack 94, win 25, length 0
00:12:35.564897 IP (tos 0x00, ttl 52, id 0xe135, offset 0, flags [0x02], proto TCP (6), length 40)
    172.64.155.209.443 > 192.168.4.68.62408: Flags [.], cksum 0x5c3d, seq 1, ack 1216, win 25, length 0
00:12:35.650285 IP (tos 0x00, ttl 52, id 0xe136, offset 0, flags [0x02], proto TCP (6), length 362)
    172.64.155.209.443 > 192.168.4.68.62408: Flags [.], cksum 0x78a2, seq 1, ack 1216, win 25, length 322
00:12:35.650285 IP (tos 0x00, ttl 52, id 0xe137, offset 0, flags [0x02], proto TCP (6), length 87)
    172.64.155.209.443 > 192.168.4.68.62408: Flags [.], cksum 0xb31e, seq 323, ack 1216, win 25, length 47
00:12:35.650285 IP (tos 0x00, ttl 52, id 0xe138, offset 0, flags [0x02], proto TCP (6), length 71)
    172.64.155.209.443 > 192.168.4.68.62408: Flags [.], cksum 0xe2aa, seq 370, ack 1216, win 25, length 31
00:12:35.650658 IP (tos 0x00, ttl 128, id 0xf772, offset 0, flags [0x02], proto TCP (6), length 40)
    192.168.4.68.62408 > 172.64.155.209.443: Flags [.], cksum 0x0d19, seq 1216, ack 370, win 4095, length 0
00:12:35.700922 IP (tos 0x00, ttl 128, id 0xf773, offset 0, flags [0x02], proto TCP (6), length 40)
    192.168.4.68.62408 > 172.64.155.209.443: Flags [.], cksum 0x0d19, seq 1216, ack 401, win 4095, length 0
00:12:35.798179 IP (tos 0x00, ttl 128, id 0x412a, offset 0, flags [0x02], proto TCP (6), length 150)
    192.168.4.68.53103 > 192.168.4.43.8009: Flags [.], cksum 0x8a48, seq 1, ack 1, win 254, length 110
00:12:35.837134 IP (tos 0x00, ttl 64, id 0xdb05, offset 0, flags [0x00], proto TCP (6), length 40)
    192.168.4.43.8009 > 192.168.4.68.53103: Flags [.], cksum 0xd23c, seq 1, ack 111, win 4095, length 0
00:12:35.838587 IP (tos 0x00, ttl 64, id 0x8ffe, offset 0, flags [0x00], proto TCP (6), length 150)
    192.168.4.43.8009 > 192.168.4.68.53103: Flags [.], cksum 0xcaa0, seq 1, ack 111, win 4096, length 110
00:12:35.883436 IP (tos 0x00, ttl 128, id 0x412b, offset 0, flags [0x02], proto TCP (6), length 40)
    192.168.4.68.53103 > 192.168.4.43.8009: Flags [.], cksum 0x89da, seq 111, ack 111, win 253, length 0
00:12:36.037119 IP (tos 0x00, ttl 255, id 0x8ef3, offset 0, flags [0x00], proto Proto (17), length 858)
    192.168.4.43. > 224.0.0.251.: Flags [.], cksum , , , , length 
00:12:36.642089 IP (tos 0x00, ttl 128, id 0xf774, offset 0, flags [0x02], proto TCP (6), length 79)
    192.168.4.68.62408 > 172.64.155.209.443: Flags [.], cksum 0x0d40, seq 1216, ack 401, win 4095, length 39
00:12:36.643055 IP (tos 0x00, ttl 128, id 0x64cf, offset 0, flags [0x00], proto Proto (17), length 57)
    192.168.4.68. > 192.168.4.72.: Flags [.], cksum , , , , length 
00:12:36.643335 IP (tos 0x00, ttl 128, id 0xf775, offset 0, flags [0x02], proto TCP (6), length 64)
    192.168.4.68.62408 > 172.64.155.209.443: Flags [.], cksum 0x0d31, seq 1255, ack 401, win 4095, length 24
00:12:36.643495 IP (tos 0x00, ttl 128, id 0xf776, offset 0, flags [0x02], proto TCP (6), length 40)
    192.168.4.68.62408 > 172.64.155.209.443: Flags [.], cksum 0x0d19, seq 1279, ack 401, win 4095, length 0
00:12:36.644878 IP (tos 0x00, ttl 128, id 0xf777, offset 0, flags [0x02], proto TCP (6), length 52)
    192.168.4.68.55337 > 172.64.155.209.443: Flags [.], cksum 0x0d25, seq 0, ack 0, win 65535, length 0
00:12:36.653076 IP (tos 0x00, ttl 64, id 0xd5e5, offset 0, flags [0x02], proto Proto (17), length 146)
    192.168.4.72. > 192.168.4.68.: Flags [.], cksum , , , , length 
00:12:36.655024 IP (tos 0x00, ttl 52, id 0xe139, offset 0, flags [0x02], proto TCP (6), length 40)
    172.64.155.209.443 > 192.168.4.68.62408: Flags [.], cksum 0x5a86, seq 401, ack 1255, win 25, length 0
00:12:36.655024 IP (tos 0x00, ttl 52, id 0xe13a, offset 0, flags [0x02], proto TCP (6), length 40)
    172.64.155.209.443 > 192.168.4.68.62408: Flags [.], cksum 0x5a6e, seq 401, ack 1279, win 25, length 0
00:12:36.655024 IP (tos 0x00, ttl 52, id 0xe13b, offset 0, flags [0x02], proto TCP (6), length 40)
    172.64.155.209.443 > 192.168.4.68.62408: Flags [.], cksum 0x5a6c, seq 401, ack 1280, win 25, length 0
00:12:36.655312 IP (tos 0x00, ttl 128, id 0xf778, offset 0, flags [0x02], proto TCP (6), length 40)
    192.168.4.68.62408 > 172.64.155.209.443: Flags [.], cksum 0x0d19, seq 1280, ack 402, win 4095, length 0
00:12:36.656423 IP (tos 0x00, ttl 52, id 0x0000, offset 0, flags [0x02], proto TCP (6), length 52)
    172.64.155.209.443 > 192.168.4.68.55337: Flags [.], cksum 0x87fd, seq 0, ack 1, win 65535, length 0
00:12:36.656775 IP (tos 0x00, ttl 128, id 0xf779, offset 0, flags [0x02], proto TCP (6), length 40)
    192.168.4.68.55337 > 172.64.155.209.443: Flags [.], cksum 0x0d19, seq 1, ack 1, win 255, length 0
00:12:36.657967 IP (tos 0x00, ttl 128, id 0xf77a, offset 0, flags [0x02], proto TCP (6), length 1440)
    192.168.4.68.55337 > 172.64.155.209.443: Flags [.], cksum 0x1291, seq 1, ack 1, win 255, length 1400
00:12:36.657967 IP (tos 0x00, ttl 128, id 0xf77b, offset 0, flags [0x02], proto TCP (6), length 1031)
    192.168.4.68.55337 > 172.64.155.209.443: Flags [.], cksum 0x10f8, seq 1401, ack 1, win 255, length 991
00:12:36.658658 IP (tos 0x00, ttl 128, id 0xf77c, offset 0, flags [0x02], proto TCP (6), length 46)
    192.168.4.68.55337 > 172.64.155.209.443: Flags [.], cksum 0x0d1f, seq 2392, ack 1, win 255, length 6
00:12:36.658723 IP (tos 0x00, ttl 128, id 0xf77d, offset 0, flags [0x02], proto TCP (6), length 1440)
    192.168.4.68.55337 > 172.64.155.209.443: Flags [.], cksum 0x1291, seq 2398, ack 1, win 255, length 1400
00:12:36.658723 IP (tos 0x00, ttl 128, id 0xf77e, offset 0, flags [0x02], proto TCP (6), length 454)
    192.168.4.68.55337 > 172.64.155.209.443: Flags [.], cksum 0x0eb7, seq 3798, ack 1, win 255, length 414
00:12:36.664391 IP (tos 0x00, ttl 52, id 0x6f61, offset 0, flags [0x02], proto TCP (6), length 40)
    172.64.155.209.443 > 192.168.4.68.55337: Flags [.], cksum 0xbf32, seq 1, ack 2392, win 16, length 0
00:12:36.669998 IP (tos 0x00, ttl 52, id 0x6f62, offset 0, flags [0x02], proto TCP (6), length 1500)
    172.64.155.209.443 > 192.168.4.68.55337: Flags [.], cksum 0xe38d, seq 1, ack 2392, win 16, length 1460
00:12:36.669998 IP (tos 0x00, ttl 52, id 0x6f63, offset 0, flags [0x02], proto TCP (6), length 425)
    172.64.155.209.443 > 192.168.4.68.55337: Flags [.], cksum 0xc38c, seq 1461, ack 2392, win 16, length 385
00:12:36.669998 IP (tos 0x00, ttl 52, id 0x6f64, offset 0, flags [0x02], proto TCP (6), length 102)
    172.64.155.209.443 > 192.168.4.68.55337: Flags [.], cksum 0x475f, seq 1846, ack 2392, win 16, length 62
00:12:36.669998 IP (tos 0x00, ttl 52, id 0x6f65, offset 0, flags [0x02], proto TCP (6), length 40)
    172.64.155.209.443 > 192.168.4.68.55337: Flags [.], cksum 0xb0a3, seq 1908, ack 4212, win 16, length 0
00:12:36.669998 IP (tos 0x00, ttl 52, id 0x6f66, offset 0, flags [0x02], proto TCP (6), length 71)
    172.64.155.209.443 > 192.168.4.68.55337: Flags [.], cksum 0xd888, seq 1908, ack 4212, win 16, length 31
00:12:36.670252 IP (tos 0x00, ttl 128, id 0xf77f, offset 0, flags [0x02], proto TCP (6), length 40)
    192.168.4.68.55337 > 172.64.155.209.443: Flags [.], cksum 0x0d19, seq 4212, ack 1939, win 255, length 0
00:12:36.671233 IP (tos 0x00, ttl 128, id 0xf780, offset 0, flags [0x02], proto TCP (6), length 124)
    192.168.4.68.55337 > 172.64.155.209.443: Flags [.], cksum 0x0d6d, seq 4212, ack 1939, win 255, length 84
00:12:36.672540 IP (tos 0x00, ttl 128, id 0xf781, offset 0, flags [0x02], proto TCP (6), length 71)
    192.168.4.68.55337 > 172.64.155.209.443: Flags [.], cksum 0x0d38, seq 4296, ack 1939, win 255, length 31
00:12:36.679185 IP (tos 0x00, ttl 52, id 0x6f67, offset 0, flags [0x02], proto TCP (6), length 40)
    172.64.155.209.443 > 192.168.4.68.55337: Flags [.], cksum 0xb011, seq 1939, ack 4327, win 16, length 0
00:12:36.693968 IP (tos 0x00, ttl 52, id 0x6f68, offset 0, flags [0x02], proto TCP (6), length 1431)
    172.64.155.209.443 > 192.168.4.68.55337: Flags [.], cksum 0x3467, seq 1939, ack 4327, win 16, length 1391
00:12:36.693968 IP (tos 0x00, ttl 52, id 0x6f69, offset 0, flags [0x02], proto TCP (6), length 1065)
    172.64.155.209.443 > 192.168.4.68.55337: Flags [.], cksum 0x4779, seq 3330, ack 4327, win 16, length 1025
00:12:36.694432 IP (tos 0x00, ttl 128, id 0xf782, offset 0, flags [0x02], proto TCP (6), length 40)
    192.168.4.68.55337 > 172.64.155.209.443: Flags [.], cksum 0x0d19, seq 4327, ack 4355, win 255, length 0
00:12:36.961937 IP (tos 0x00, ttl 52, id 0x6f6a, offset 0, flags [0x02], proto TCP (6), length 1431)
    172.64.155.209.443 > 192.168.4.68.55337: Flags [.], cksum 0x9802, seq 4355, ack 4327, win 16, length 1391
00:12:36.961937 IP (tos 0x00, ttl 52, id 0x6f6b, offset 0, flags [0x02], proto TCP (6), length 1500)
    172.64.155.209.443 > 192.168.4.68.55337: Flags [.], cksum 0x4c2d, seq 5746, ack 4327, win 16, length 1460
00:12:36.961937 IP (tos 0x00, ttl 52, id 0x6f6c, offset 0, flags [0x02], proto TCP (6), length 1362)
    172.64.155.209.443 > 192.168.4.68.55337: Flags [.], cksum 0x95ad, seq 7206, ack 4327, win 16, length 1322
00:12:36.961937 IP (tos 0x00, ttl 52, id 0x6f6d, offset 0, flags [0x02], proto TCP (6), length 1500)
    172.64.155.209.443 > 192.168.4.68.55337: Flags [.], cksum 0xd8a8, seq 8528, ack 4327, win 16, length 1460
00:12:36.961937 IP (tos 0x00, ttl 52, id 0x6f6e, offset 0, flags [0x02], proto TCP (6), length 1500)
    172.64.155.209.443 > 192.168.4.68.55337: Flags [.], cksum 0x31c6, seq 9988, ack 4327, win 16, length 1460
00:12:36.961937 IP (tos 0x00, ttl 52, id 0x6f6f, offset 0, flags [0x02], proto TCP (6), length 718)
    172.64.155.209.443 > 192.168.4.68.55337: Flags [.], cksum 0x8d29, seq 11448, ack 4327, win 16, length 678
00:12:36.961937 IP (tos 0x00, ttl 52, id 0x6f70, offset 0, flags [0x02], proto TCP (6), length 1500)
    172.64.155.209.443 > 192.168.4.68.55337: Flags [.], cksum 0x9f22, seq 12126, ack 4327, win 16, length 1460
00:12:36.961937 IP (tos 0x00, ttl 52, id 0x6f71, offset 0, flags [0x02], proto TCP (6), length 832)
    172.64.155.209.443 > 192.168.4.68.55337: Flags [.], cksum 0x3c39, seq 13586, ack 4327, win 16, length 792
00:12:36.961937 IP (tos 0x00, ttl 52, id 0x6f72, offset 0, flags [0x02], proto TCP (6), length 1431)
    172.64.155.209.443 > 192.168.4.68.55337: Flags [.], cksum 0x6678, seq 14378, ack 4327, win 16, length 1391
00:12:36.961937 IP (tos 0x00, ttl 52, id 0x6f73, offset 0, flags [0x02], proto TCP (6), length 287)
    172.64.155.209.443 > 192.168.4.68.55337: Flags [.], cksum 0x3aa0, seq 15769, ack 4327, win 16, length 247
00:12:36.961937 IP (tos 0x00, ttl 52, id 0x6f74, offset 0, flags [0x02], proto TCP (6), length 1431)
    172.64.155.209.443 > 192.168.4.68.55337: Flags [.], cksum 0xd26f, seq 16016, ack 4327, win 16, length 1391
00:12:36.961937 IP (tos 0x00, ttl 52, id 0x6f75, offset 0, flags [0x02], proto TCP (6), length 1431)
    172.64.155.209.443 > 192.168.4.68.55337: Flags [.], cksum 0xcbe1, seq 17407, ack 4327, win 16, length 1391
00:12:36.961937 IP (tos 0x00, ttl 52, id 0x6f76, offset 0, flags [0x02], proto TCP (6), length 1500)
    172.64.155.209.443 > 192.168.4.68.55337: Flags [.], cksum 0xd560, seq 18798, ack 4327, win 16, length 1460
00:12:36.961937 IP (tos 0x00, ttl 52, id 0x6f77, offset 0, flags [0x02], proto TCP (6), length 1362)
    172.64.155.209.443 > 192.168.4.68.55337: Flags [.], cksum 0x3879, seq 20258, ack 4327, win 16, length 1322
00:12:36.961937 IP (tos 0x00, ttl 52, id 0x6f78, offset 0, flags [0x02], proto TCP (6), length 1500)
    172.64.155.209.443 > 192.168.4.68.55337: Flags [.], cksum 0x9be7, seq 21580, ack 4327, win 16, length 1460
00:12:36.961937 IP (tos 0x00, ttl 52, id 0x6f79, offset 0, flags [0x02], proto TCP (6), length 1500)
    172.64.155.209.443 > 192.168.4.68.55337: Flags [.], cksum 0x71ee, seq 23040, ack 4327, win 16, length 1460
00:12:36.961937 IP (tos 0x00, ttl 52, id 0x6f7a, offset 0, flags [0x02], proto TCP (6), length 1500)
    172.64.155.209.443 > 192.168.4.68.55337: Flags [.], cksum 0x76e6, seq 24500, ack 4327, win 16, length 1460
00:12:36.961937 IP (tos 0x00, ttl 52, id 0x6f7b, offset 0, flags [0x02], proto TCP (6), length 1224)
    172.64.155.209.443 > 192.168.4.68.55337: Flags [.], cksum 0xb8b0, seq 25960, ack 4327, win 16, length 1184
00:12:36.961937 IP (tos 0x00, ttl 52, id 0x6f7c, offset 0, flags [0x02], proto TCP (6), length 1500)
    172.64.155.209.443 > 192.168.4.68.55337: Flags [.], cksum 0x1532, seq 27144, ack 4327, win 16, length 1460
00:12:36.961937 IP (tos 0x00, ttl 52, id 0x6f7d, offset 0, flags [0x02], proto TCP (6), length 1241)
    172.64.155.209.443 > 192.168.4.68.55337: Flags [.], cksum 0x6994, seq 28604, ack 4327, win 16, length 1201
00:12:36.961937 IP (tos 0x00, ttl 52, id 0x6f7e, offset 0, flags [0x02], proto TCP (6), length 1431)
    172.64.155.209.443 > 192.168.4.68.55337: Flags [.], cksum 0x9784, seq 29805, ack 4327, win 16, length 1391
00:12:36.961937 IP (tos 0x00, ttl 52, id 0x6f7f, offset 0, flags [0x02], proto TCP (6), length 1431)
    172.64.155.209.443 > 192.168.4.68.55337: Flags [.], cksum 0x18e8, seq 31196, ack 4327, win 16, length 1391
00:12:36.961937 IP (tos 0x00, ttl 52, id 0x6f80, offset 0, flags [0x02], proto TCP (6), length 1500)
    172.64.155.209.443 > 192.168.4.68.55337: Flags [.], cksum 0x3fa9, seq 32587, ack 4327, win 16, length 1460
00:12:36.961937 IP (tos 0x00, ttl 52, id 0x6f81, offset 0, flags [0x02], proto TCP (6), length 1362)
    172.64.155.209.443 > 192.168.4.68.55337: Flags [.], cksum 0x6f16, seq 34047, ack 4327, win 16, length 1322
00:12:36.961937 IP (tos 0x00, ttl 52, id 0x6f82, offset 0, flags [0x02], proto TCP (6), length 644)
    172.64.155.209.443 > 192.168.4.68.55337: Flags [.], cksum 0x1546, seq 35369, ack 4327, win 16, length 604
00:12:36.961937 IP (tos 0x00, ttl 52, id 0x6f83, offset 0, flags [0x02], proto TCP (6), length 644)
    172.64.155.209.443 > 192.168.4.68.55337: Flags [.], cksum 0x1546, seq 35369, ack 4327, win 16, length 604
00:12:36.961937 IP (tos 0x00, ttl 52, id 0x6f84, offset 0, flags [0x02], proto TCP (6), length 1431)
    172.64.155.209.443 > 192.168.4.68.55337: Flags [.], cksum 0x746f, seq 35973, ack 4327, win 16, length 1391
00:12:36.961937 IP (tos 0x00, ttl 52, id 0x6f85, offset 0, flags [0x02], proto TCP (6), length 277)
    172.64.155.209.443 > 192.168.4.68.55337: Flags [.], cksum 0x711e, seq 37364, ack 4327, win 16, length 237
00:12:36.961937 IP (tos 0x00, ttl 52, id 0x6f86, offset 0, flags [0x02], proto TCP (6), length 1431)
    172.64.155.209.443 > 192.168.4.68.55337: Flags [.], cksum 0x0888, seq 37601, ack 4327, win 16, length 1391
00:12:36.961937 IP (tos 0x00, ttl 52, id 0x6f87, offset 0, flags [0x02], proto TCP (6), length 1431)
    172.64.155.209.443 > 192.168.4.68.55337: Flags [.], cksum 0xa34d, seq 38992, ack 4327, win 16, length 1391
00:12:36.961937 IP (tos 0x00, ttl 52, id 0x6f88, offset 0, flags [0x02], proto TCP (6), length 1500)
    172.64.155.209.443 > 192.168.4.68.55337: Flags [.], cksum 0xea4a, seq 40383, ack 4327, win 16, length 1460
00:12:36.961937 IP (tos 0x00, ttl 52, id 0x6f89, offset 0, flags [0x02], proto TCP (6), length 1362)
    172.64.155.209.443 > 192.168.4.68.55337: Flags [.], cksum 0x4a55, seq 41843, ack 4327, win 16, length 1322
00:12:36.965927 IP (tos 0x00, ttl 128, id 0xf783, offset 0, flags [0x02], proto TCP (6), length 40)
    192.168.4.68.55337 > 172.64.155.209.443: Flags [.], cksum 0x0d19, seq 4327, ack 7206, win 255, length 0
00:12:36.966049 IP (tos 0x00, ttl 128, id 0xf784, offset 0, flags [0x02], proto TCP (6), length 40)
    192.168.4.68.55337 > 172.64.155.209.443: Flags [.], cksum 0x0d19, seq 4327, ack 11448, win 255, length 0
00:12:36.966082 IP (tos 0x00, ttl 128, id 0xf785, offset 0, flags [0x02], proto TCP (6), length 40)
    192.168.4.68.55337 > 172.64.155.209.443: Flags [.], cksum 0x0d19, seq 4327, ack 12126, win 253, length 0
00:12:36.966203 IP (tos 0x00, ttl 128, id 0xf786, offset 0, flags [0x02], proto TCP (6), length 40)
    192.168.4.68.55337 > 172.64.155.209.443: Flags [.], cksum 0x0d19, seq 4327, ack 14378, win 255, length 0
00:12:36.966258 IP (tos 0x00, ttl 128, id 0xf787, offset 0, flags [0x02], proto TCP (6), length 40)
    192.168.4.68.55337 > 172.64.155.209.443: Flags [.], cksum 0x0d19, seq 4327, ack 16016, win 255, length 0
00:12:36.966317 IP (tos 0x00, ttl 128, id 0xf788, offset 0, flags [0x02], proto TCP (6), length 40)
    192.168.4.68.55337 > 172.64.155.209.443: Flags [.], cksum 0x0d19, seq 4327, ack 18798, win 255, length 0
00:12:36.966383 IP (tos 0x00, ttl 128, id 0xf789, offset 0, flags [0x02], proto TCP (6), length 40)
    192.168.4.68.55337 > 172.64.155.209.443: Flags [.], cksum 0x0d19, seq 4327, ack 21580, win 255, length 0
00:12:36.966439 IP (tos 0x00, ttl 128, id 0xf78a, offset 0, flags [0x02], proto TCP (6), length 40)
    192.168.4.68.55337 > 172.64.155.209.443: Flags [.], cksum 0x0d19, seq 4327, ack 25960, win 255, length 0
00:12:36.966501 IP (tos 0x00, ttl 128, id 0xf78b, offset 0, flags [0x02], proto TCP (6), length 40)
    192.168.4.68.55337 > 172.64.155.209.443: Flags [.], cksum 0x0d19, seq 4327, ack 27144, win 251, length 0
00:12:36.966568 IP (tos 0x00, ttl 128, id 0xf78c, offset 0, flags [0x02], proto TCP (6), length 40)
    192.168.4.68.55337 > 172.64.155.209.443: Flags [.], cksum 0x0d19, seq 4327, ack 29805, win 255, length 0
00:12:36.966073 IP (tos 0x00, ttl 52, id 0x6f8a, offset 0, flags [0x02], proto TCP (6), length 1500)
    172.64.155.209.443 > 192.168.4.68.55337: Flags [.], cksum 0xe25a, seq 43165, ack 4327, win 16, length 1460
00:12:36.966073 IP (tos 0x00, ttl 52, id 0x6f8b, offset 0, flags [0x02], proto TCP (6), length 1500)
    172.64.155.209.443 > 192.168.4.68.55337: Flags [.], cksum 0xead5, seq 44625, ack 4327, win 16, length 1460
00:12:36.966073 IP (tos 0x00, ttl 52, id 0x6f8c, offset 0, flags [0x02], proto TCP (6), length 200)
    172.64.155.209.443 > 192.168.4.68.55337: Flags [.], cksum 0x975e, seq 46085, ack 4327, win 16, length 160
00:12:36.966619 IP (tos 0x00, ttl 128, id 0xf78d, offset 0, flags [0x02], proto TCP (6), length 40)
    192.168.4.68.55337 > 172.64.155.209.443: Flags [.], cksum 0x0d19, seq 4327, ack 32587, win 255, length 0
00:12:36.966073 IP (tos 0x00, ttl 52, id 0x6f8d, offset 0, flags [0x02], proto TCP (6), length 1431)
    172.64.155.209.443 > 192.168.4.68.55337: Flags [.], cksum 0x012f, seq 46245, ack 4327, win 16, length 1391
00:12:36.966073 IP (tos 0x00, ttl 52, id 0x6f8e, offset 0, flags [0x02], proto TCP (6), length 1500)
    172.64.155.209.443 > 192.168.4.68.55337: Flags [.], cksum 0x8743, seq 47636, ack 4327, win 16, length 1460
00:12:36.966073 IP (tos 0x00, ttl 52, id 0x6f8f, offset 0, flags [0x02], proto TCP (6), length 1500)
    172.64.155.209.443 > 192.168.4.68.55337: Flags [.], cksum 0x3036, seq 49096, ack 4327, win 16, length 1460
00:12:36.966073 IP (tos 0x00, ttl 52, id 0x6f90, offset 0, flags [0x02], proto TCP (6), length 1500)
    172.64.155.209.443 > 192.168.4.68.55337: Flags [.], cksum 0x42f4, seq 50556, ack 4327, win 16, length 1460
00:12:36.966679 IP (tos 0x00, ttl 128, id 0xf78e, offset 0, flags [0x02], proto TCP (6), length 40)
    192.168.4.68.55337 > 172.64.155.209.443: Flags [.], cksum 0x0d19, seq 4327, ack 35369, win 255, length 0
00:12:36.966073 IP (tos 0x00, ttl 52, id 0x6f91, offset 0, flags [0x02], proto TCP (6), length 1302)
    172.64.155.209.443 > 192.168.4.68.55337: Flags [.], cksum 0x28e4, seq 52016, ack 4327, win 16, length 1262
00:12:36.966073 IP (tos 0x00, ttl 52, id 0x6f92, offset 0, flags [0x02], proto TCP (6), length 1500)
    172.64.155.209.443 > 192.168.4.68.55337: Flags [.], cksum 0xc170, seq 53278, ack 4327, win 16, length 1460
00:12:36.966073 IP (tos 0x00, ttl 52, id 0x6f93, offset 0, flags [0x02], proto TCP (6), length 1500)
    172.64.155.209.443 > 192.168.4.68.55337: Flags [.], cksum 0x2ef9, seq 54738, ack 4327, win 16, length 1460
00:12:36.966073 IP (tos 0x00, ttl 52, id 0x6f94, offset 0, flags [0x02], proto TCP (6), length 1500)
    172.64.155.209.443 > 192.168.4.68.55337: Flags [.], cksum 0xe9dc, seq 56198, ack 4327, win 16, length 1460
00:12:36.966749 IP (tos 0x00, ttl 128, id 0xf78f, offset 0, flags [0x02], proto TCP (6), length 52)
    192.168.4.68.55337 > 172.64.155.209.443: Flags [.], cksum 0x0d25, seq 4327, ack 35973, win 253, length 0
00:12:36.966073 IP (tos 0x00, ttl 52, id 0x6f95, offset 0, flags [0x02], proto TCP (6), length 1500)
    172.64.155.209.443 > 192.168.4.68.55337: Flags [.], cksum 0xb88a, seq 57658, ack 4327, win 16, length 1460
00:12:36.966073 IP (tos 0x00, ttl 52, id 0x6f96, offset 0, flags [0x02], proto TCP (6), length 1500)
    172.64.155.209.443 > 192.168.4.68.55337: Flags [.], cksum 0x802a, seq 59118, ack 4327, win 16, length 1460
00:12:36.966805 IP (tos 0x00, ttl 128, id 0xf790, offset 0, flags [0x02], proto TCP (6), length 40)
    192.168.4.68.55337 > 172.64.155.209.443: Flags [.], cksum 0x0d19, seq 4327, ack 37364, win 255, length 0
00:12:36.967185 IP (tos 0x00, ttl 128, id 0xf791, offset 0, flags [0x02], proto TCP (6), length 40)
    192.168.4.68.55337 > 172.64.155.209.443: Flags [.], cksum 0x0d19, seq 4327, ack 40383, win 255, length 0
00:12:36.967223 IP (tos 0x00, ttl 128, id 0xf792, offset 0, flags [0x02], proto TCP (6), length 40)
    192.168.4.68.55337 > 172.64.155.209.443: Flags [.], cksum 0x0d19, seq 4327, ack 41843, win 255, length 0
00:12:36.967270 IP (tos 0x00, ttl 128, id 0xf793, offset 0, flags [0x02], proto TCP (6), length 40)
    192.168.4.68.55337 > 172.64.155.209.443: Flags [.], cksum 0x0d19, seq 4327, ack 46085, win 255, length 0
00:12:36.967301 IP (tos 0x00, ttl 128, id 0xf794, offset 0, flags [0x02], proto TCP (6), length 40)
    192.168.4.68.55337 > 172.64.155.209.443: Flags [.], cksum 0x0d19, seq 4327, ack 46245, win 255, length 0
00:12:36.967346 IP (tos 0x00, ttl 128, id 0xf795, offset 0, flags [0x02], proto TCP (6), length 40)
    192.168.4.68.55337 > 172.64.155.209.443: Flags [.], cksum 0x0d19, seq 4327, ack 52016, win 255, length 0
00:12:36.967318 IP (tos 0x00, ttl 52, id 0x6f97, offset 0, flags [0x02], proto TCP (6), length 60)
    172.64.155.209.443 > 192.168.4.68.55337: Flags [.], cksum 0x32f8, seq 60578, ack 4327, win 16, length 20
00:12:36.967412 IP (tos 0x00, ttl 128, id 0xf796, offset 0, flags [0x02], proto TCP (6), length 40)
    192.168.4.68.55337 > 172.64.155.209.443: Flags [.], cksum 0x0d19, seq 4327, ack 60578, win 255, length 0
00:12:36.976413 IP (tos 0x00, ttl 52, id 0x6f98, offset 0, flags [0x02], proto TCP (6), length 1500)
    172.64.155.209.443 > 192.168.4.68.55337: Flags [.], cksum 0x1ff3, seq 60598, ack 4327, win 16, length 1460
00:12:36.976413 IP (tos 0x00, ttl 52, id 0x6f99, offset 0, flags [0x02], proto TCP (6), length 1500)
    172.64.155.209.443 > 192.168.4.68.55337: Flags [.], cksum 0x96ab, seq 62058, ack 4327, win 16, length 1460
00:12:36.976413 IP (tos 0x00, ttl 52, id 0x6f9a, offset 0, flags [0x02], proto TCP (6), length 1500)
    172.64.155.209.443 > 192.168.4.68.55337: Flags [.], cksum 0x6b9e, seq 63518, ack 4327, win 16, length 1460
00:12:36.976413 IP (tos 0x00, ttl 52, id 0x6f9b, offset 0, flags [0x02], proto TCP (6), length 1500)
    172.64.155.209.443 > 192.168.4.68.55337: Flags [.], cksum 0xfe2a, seq 64978, ack 4327, win 16, length 1460
00:12:36.976413 IP (tos 0x00, ttl 52, id 0x6f9c, offset 0, flags [0x02], proto TCP (6), length 1500)
    172.64.155.209.443 > 192.168.4.68.55337: Flags [.], cksum 0xcb03, seq 66438, ack 4327, win 16, length 1460
00:12:36.976413 IP (tos 0x00, ttl 52, id 0x6f9d, offset 0, flags [0x02], proto TCP (6), length 1500)
    172.64.155.209.443 > 192.168.4.68.55337: Flags [.], cksum 0x2c40, seq 67898, ack 4327, win 16, length 1460
00:12:36.976413 IP (tos 0x00, ttl 52, id 0x6f9e, offset 0, flags [0x02], proto TCP (6), length 551)
    172.64.155.209.443 > 192.168.4.68.55337: Flags [.], cksum 0x9b55, seq 69358, ack 4327, win 16, length 511
00:12:36.976849 IP (tos 0x00, ttl 128, id 0xf797, offset 0, flags [0x02], proto TCP (6), length 40)
    192.168.4.68.55337 > 172.64.155.209.443: Flags [.], cksum 0x0d19, seq 4327, ack 69358, win 511, length 0
00:12:36.976972 IP (tos 0x00, ttl 128, id 0xf798, offset 0, flags [0x02], proto TCP (6), length 40)
    192.168.4.68.55337 > 172.64.155.209.443: Flags [.], cksum 0x0d19, seq 4327, ack 69869, win 509, length 0
00:12:36.984799 IP (tos 0x00, ttl 128, id 0xf799, offset 0, flags [0x02], proto TCP (6), length 332)
    192.168.4.68.55337 > 172.64.155.209.443: Flags [.], cksum 0x0e3d, seq 4327, ack 69869, win 509, length 292
00:12:36.984976 IP (tos 0x00, ttl 128, id 0xf79a, offset 0, flags [0x02], proto TCP (6), length 216)
    192.168.4.68.55337 > 172.64.155.209.443: Flags [.], cksum 0x0dc9, seq 4619, ack 69869, win 509, length 176
00:12:36.985355 IP (tos 0x00, ttl 128, id 0xf79b, offset 0, flags [0x02], proto TCP (6), length 52)
    192.168.4.68.55338 > 172.64.155.209.443: Flags [.], cksum 0x0d25, seq 0, ack 0, win 65535, length 0
00:12:36.985466 IP (tos 0x00, ttl 128, id 0xf79c, offset 0, flags [0x02], proto TCP (6), length 1118)
    192.168.4.68.55337 > 172.64.155.209.443: Flags [.], cksum 0x114f, seq 4795, ack 69869, win 509, length 1078
00:12:36.993554 IP (tos 0x00, ttl 52, id 0x6f9f, offset 0, flags [0x02], proto TCP (6), length 40)
    172.64.155.209.443 > 192.168.4.68.55337: Flags [.], cksum 0xa0ac, seq 69869, ack 5873, win 16, length 0
00:12:36.993554 IP (tos 0x00, ttl 52, id 0x0000, offset 0, flags [0x02], proto TCP (6), length 52)
    172.64.155.209.443 > 192.168.4.68.55338: Flags [.], cksum 0x7e99, seq 0, ack 1, win 65535, length 0
00:12:36.994109 IP (tos 0x00, ttl 128, id 0xf79d, offset 0, flags [0x02], proto TCP (6), length 40)
    192.168.4.68.55338 > 172.64.155.209.443: Flags [.], cksum 0x0d19, seq 1, ack 1, win 255, length 0
00:12:36.995144 IP (tos 0x00, ttl 128, id 0xf79e, offset 0, flags [0x02], proto TCP (6), length 1440)
    192.168.4.68.55338 > 172.64.155.209.443: Flags [.], cksum 0x1291, seq 1, ack 1, win 255, length 1400
00:12:36.995144 IP (tos 0x00, ttl 128, id 0xf79f, offset 0, flags [0x02], proto TCP (6), length 1034)
    192.168.4.68.55338 > 172.64.155.209.443: Flags [.], cksum 0x10fb, seq 1401, ack 1, win 255, length 994
00:12:36.995495 IP (tos 0x00, ttl 128, id 0xf7a0, offset 0, flags [0x02], proto TCP (6), length 46)
    192.168.4.68.55338 > 172.64.155.209.443: Flags [.], cksum 0x0d1f, seq 2395, ack 1, win 255, length 6
00:12:36.995553 IP (tos 0x00, ttl 128, id 0xf7a1, offset 0, flags [0x02], proto TCP (6), length 132)
    192.168.4.68.55338 > 172.64.155.209.443: Flags [.], cksum 0x0d75, seq 2401, ack 1, win 255, length 92
00:12:37.003523 IP (tos 0x00, ttl 52, id 0xf107, offset 0, flags [0x02], proto TCP (6), length 40)
    172.64.155.209.443 > 192.168.4.68.55338: Flags [.], cksum 0xb5cb, seq 1, ack 2395, win 16, length 0
00:12:37.003523 IP (tos 0x00, ttl 52, id 0xf108, offset 0, flags [0x02], proto TCP (6), length 40)
    172.64.155.209.443 > 192.168.4.68.55338: Flags [.], cksum 0xb5c5, seq 1, ack 2401, win 16, length 0
00:12:37.003523 IP (tos 0x00, ttl 52, id 0xf109, offset 0, flags [0x02], proto TCP (6), length 40)
    172.64.155.209.443 > 192.168.4.68.55338: Flags [.], cksum 0xb569, seq 1, ack 2493, win 16, length 0
00:12:37.003523 IP (tos 0x00, ttl 52, id 0xf10a, offset 0, flags [0x02], proto TCP (6), length 1500)
    172.64.155.209.443 > 192.168.4.68.55338: Flags [.], cksum 0xeed8, seq 1, ack 2493, win 16, length 1460
00:12:37.003523 IP (tos 0x00, ttl 52, id 0xf10b, offset 0, flags [0x02], proto TCP (6), length 425)
    172.64.155.209.443 > 192.168.4.68.55338: Flags [.], cksum 0x6cff, seq 1461, ack 2493, win 16, length 385
00:12:37.003523 IP (tos 0x00, ttl 52, id 0xf10c, offset 0, flags [0x02], proto TCP (6), length 111)
    172.64.155.209.443 > 192.168.4.68.55338: Flags [.], cksum 0x0a80, seq 1846, ack 2493, win 16, length 71
00:12:37.004077 IP (tos 0x00, ttl 128, id 0xf7a2, offset 0, flags [0x02], proto TCP (6), length 40)
    192.168.4.68.55338 > 172.64.155.209.443: Flags [.], cksum 0x0d19, seq 2493, ack 1846, win 255, length 0
00:12:37.005089 IP (tos 0x00, ttl 128, id 0xf7a3, offset 0, flags [0x02], proto TCP (6), length 124)
    192.168.4.68.55338 > 172.64.155.209.443: Flags [.], cksum 0x0d6d, seq 2493, ack 1917, win 255, length 84
00:12:37.005766 IP (tos 0x00, ttl 128, id 0xf7a4, offset 0, flags [0x02], proto TCP (6), length 79)
    192.168.4.68.55338 > 172.64.155.209.443: Flags [.], cksum 0x0d40, seq 2577, ack 1917, win 255, length 39
00:12:37.006832 IP (tos 0x00, ttl 128, id 0xf7a5, offset 0, flags [0x02], proto TCP (6), length 64)
    192.168.4.68.55338 > 172.64.155.209.443: Flags [.], cksum 0x0d31, seq 2616, ack 1917, win 255, length 24
00:12:37.006912 IP (tos 0x00, ttl 128, id 0xf7a6, offset 0, flags [0x02], proto TCP (6), length 40)
    192.168.4.68.55338 > 172.64.155.209.443: Flags [.], cksum 0x0d19, seq 2640, ack 1917, win 255, length 0
00:12:37.012006 IP (tos 0x00, ttl 128, id 0x64d0, offset 0, flags [0x00], proto Proto (17), length 70)
    192.168.4.68. > 192.168.4.72.: Flags [.], cksum , , , , length 
00:12:37.012409 IP (tos 0x00, ttl 128, id 0x64d1, offset 0, flags [0x00], proto Proto (17), length 70)
    192.168.4.68. > 192.168.4.72.: Flags [.], cksum , , , , length 
00:12:37.012733 IP (tos 0x00, ttl 52, id 0xf10d, offset 0, flags [0x02], proto TCP (6), length 40)
    172.64.155.209.443 > 192.168.4.68.55338: Flags [.], cksum 0xad72, seq 1917, ack 2616, win 16, length 0
00:12:37.014834 IP (tos 0x00, ttl 52, id 0xf10e, offset 0, flags [0x02], proto TCP (6), length 40)
    172.64.155.209.443 > 192.168.4.68.55338: Flags [.], cksum 0xad58, seq 1917, ack 2641, win 16, length 0
00:12:37.015074 IP (tos 0x00, ttl 128, id 0xf7a7, offset 0, flags [0x02], proto TCP (6), length 40)
    192.168.4.68.55338 > 172.64.155.209.443: Flags [.], cksum 0x0d19, seq 2641, ack 1918, win 255, length 0
00:12:37.017994 IP (tos 0x00, ttl 64, id 0xd60c, offset 0, flags [0x02], proto Proto (17), length 98)
    192.168.4.72. > 192.168.4.68.: Flags [.], cksum , , , , length 
00:12:37.019565 IP (tos 0x00, ttl 64, id 0xd60d, offset 0, flags [0x02], proto Proto (17), length 86)
    192.168.4.72. > 192.168.4.68.: Flags [.], cksum , , , , length 
00:12:37.021646 IP (tos 0x00, ttl 52, id 0x6fa0, offset 0, flags [0x02], proto TCP (6), length 554)
    172.64.155.209.443 > 192.168.4.68.55337: Flags [.], cksum 0xb8b7, seq 69869, ack 5873, win 16, length 514
00:12:37.021646 IP (tos 0x00, ttl 52, id 0x6fa1, offset 0, flags [0x02], proto TCP (6), length 87)
    172.64.155.209.443 > 192.168.4.68.55337: Flags [.], cksum 0xdc2a, seq 70383, ack 5873, win 16, length 47
00:12:37.021646 IP (tos 0x00, ttl 52, id 0x6fa2, offset 0, flags [0x02], proto TCP (6), length 71)
    172.64.155.209.443 > 192.168.4.68.55337: Flags [.], cksum 0xa789, seq 70430, ack 5873, win 16, length 31
00:12:37.021924 IP (tos 0x00, ttl 128, id 0xf7a8, offset 0, flags [0x02], proto TCP (6), length 40)
    192.168.4.68.55337 > 172.64.155.209.443: Flags [.], cksum 0x0d19, seq 5873, ack 70430, win 507, length 0
00:12:37.069339 IP (tos 0x00, ttl 128, id 0xf7a9, offset 0, flags [0x02], proto TCP (6), length 40)
    192.168.4.68.55337 > 172.64.155.209.443: Flags [.], cksum 0x0d19, seq 5873, ack 70461, win 507, length 0
00:12:37.110019 IP (tos 0x00, ttl 128, id 0xf7aa, offset 0, flags [0x02], proto TCP (6), length 221)
    192.168.4.68.55337 > 172.64.155.209.443: Flags [.], cksum 0x0dce, seq 5873, ack 70461, win 507, length 181
00:12:37.110635 IP (tos 0x00, ttl 128, id 0xf7ab, offset 0, flags [0x02], proto TCP (6), length 143)
    192.168.4.68.55337 > 172.64.155.209.443: Flags [.], cksum 0x0d80, seq 6054, ack 70461, win 507, length 103
00:12:37.111005 IP (tos 0x00, ttl 128, id 0xf7ac, offset 0, flags [0x02], proto TCP (6), length 143)
    192.168.4.68.55337 > 172.64.155.209.443: Flags [.], cksum 0x0d80, seq 6157, ack 70461, win 507, length 103
00:12:37.111768 IP (tos 0x00, ttl 128, id 0xf7ad, offset 0, flags [0x02], proto TCP (6), length 143)
    192.168.4.68.55337 > 172.64.155.209.443: Flags [.], cksum 0x0d80, seq 6260, ack 70461, win 507, length 103
00:12:37.112365 IP (tos 0x00, ttl 128, id 0xf7ae, offset 0, flags [0x02], proto TCP (6), length 143)
    192.168.4.68.55337 > 172.64.155.209.443: Flags [.], cksum 0x0d80, seq 6363, ack 70461, win 507, length 103
00:12:37.113103 IP (tos 0x00, ttl 128, id 0xf7af, offset 0, flags [0x02], proto TCP (6), length 142)
    192.168.4.68.55337 > 172.64.155.209.443: Flags [.], cksum 0x0d7f, seq 6466, ack 70461, win 507, length 102
00:12:37.114508 IP (tos 0x00, ttl 128, id 0xf7b0, offset 0, flags [0x02], proto TCP (6), length 143)
    192.168.4.68.55337 > 172.64.155.209.443: Flags [.], cksum 0x0d80, seq 6568, ack 70461, win 507, length 103
00:12:37.115170 IP (tos 0x00, ttl 128, id 0xf7b1, offset 0, flags [0x02], proto TCP (6), length 142)
    192.168.4.68.55337 > 172.64.155.209.443: Flags [.], cksum 0x0d7f, seq 6671, ack 70461, win 507, length 102
00:12:37.115638 IP (tos 0x00, ttl 128, id 0xf7b2, offset 0, flags [0x02], proto TCP (6), length 143)
    192.168.4.68.55337 > 172.64.155.209.443: Flags [.], cksum 0x0d80, seq 6773, ack 70461, win 507, length 103
00:12:37.116214 IP (tos 0x00, ttl 128, id 0xf7b3, offset 0, flags [0x02], proto TCP (6), length 143)
    192.168.4.68.55337 > 172.64.155.209.443: Flags [.], cksum 0x0d80, seq 6876, ack 70461, win 507, length 103
00:12:37.117111 IP (tos 0x00, ttl 128, id 0xf7b4, offset 0, flags [0x02], proto TCP (6), length 143)
    192.168.4.68.55337 > 172.64.155.209.443: Flags [.], cksum 0x0d80, seq 6979, ack 70461, win 507, length 103
00:12:37.117754 IP (tos 0x00, ttl 128, id 0xf7b5, offset 0, flags [0x02], proto TCP (6), length 143)
    192.168.4.68.55337 > 172.64.155.209.443: Flags [.], cksum 0x0d80, seq 7082, ack 70461, win 507, length 103
00:12:37.118967 IP (tos 0x00, ttl 128, id 0xf7b6, offset 0, flags [0x02], proto TCP (6), length 143)
    192.168.4.68.55337 > 172.64.155.209.443: Flags [.], cksum 0x0d80, seq 7185, ack 70461, win 507, length 103
00:12:37.119116 IP (tos 0x00, ttl 52, id 0x6fa3, offset 0, flags [0x02], proto TCP (6), length 40)
    172.64.155.209.443 > 192.168.4.68.55337: Flags [.], cksum 0x9c0b, seq 70461, ack 6466, win 16, length 0
00:12:37.119783 IP (tos 0x00, ttl 128, id 0xf7b7, offset 0, flags [0x02], proto TCP (6), length 143)
    192.168.4.68.55337 > 172.64.155.209.443: Flags [.], cksum 0x0d80, seq 7288, ack 70461, win 507, length 103
00:12:37.121094 IP (tos 0x00, ttl 128, id 0xf7b8, offset 0, flags [0x02], proto TCP (6), length 143)
    192.168.4.68.55337 > 172.64.155.209.443: Flags [.], cksum 0x0d80, seq 7391, ack 70461, win 507, length 103
00:12:37.121216 IP (tos 0x00, ttl 52, id 0x6fa4, offset 0, flags [0x02], proto TCP (6), length 40)
    172.64.155.209.443 > 192.168.4.68.55337: Flags [.], cksum 0x9ad8, seq 70461, ack 6773, win 16, length 0
00:12:37.122498 IP (tos 0x00, ttl 52, id 0x6fa5, offset 0, flags [0x02], proto TCP (6), length 40)
    172.64.155.209.443 > 192.168.4.68.55337: Flags [.], cksum 0x9a0a, seq 70461, ack 6979, win 16, length 0
00:12:37.123549 IP (tos 0x00, ttl 128, id 0xf7b9, offset 0, flags [0x02], proto TCP (6), length 143)
    192.168.4.68.55337 > 172.64.155.209.443: Flags [.], cksum 0x0d80, seq 7494, ack 70461, win 507, length 103
00:12:37.124391 IP (tos 0x00, ttl 128, id 0xf7ba, offset 0, flags [0x02], proto TCP (6), length 143)
    192.168.4.68.55337 > 172.64.155.209.443: Flags [.], cksum 0x0d80, seq 7597, ack 70461, win 507, length 103
00:12:37.125148 IP (tos 0x00, ttl 52, id 0x6fa6, offset 0, flags [0x02], proto TCP (6), length 40)
    172.64.155.209.443 > 192.168.4.68.55337: Flags [.], cksum 0x98d5, seq 70461, ack 7288, win 16, length 0
00:12:37.125328 IP (tos 0x00, ttl 128, id 0xf7bb, offset 0, flags [0x02], proto TCP (6), length 143)
    192.168.4.68.55337 > 172.64.155.209.443: Flags [.], cksum 0x0d80, seq 7700, ack 70461, win 507, length 103
00:12:37.125729 IP (tos 0x00, ttl 128, id 0xf7bc, offset 0, flags [0x02], proto TCP (6), length 143)
    192.168.4.68.55337 > 172.64.155.209.443: Flags [.], cksum 0x0d80, seq 7803, ack 70461, win 507, length 103
00:12:37.127013 IP (tos 0x00, ttl 128, id 0xf7bd, offset 0, flags [0x02], proto TCP (6), length 143)
    192.168.4.68.55337 > 172.64.155.209.443: Flags [.], cksum 0x0d80, seq 7906, ack 70461, win 507, length 103
00:12:37.127250 IP (tos 0x00, ttl 52, id 0x6fa7, offset 0, flags [0x02], proto TCP (6), length 40)
    172.64.155.209.443 > 192.168.4.68.55337: Flags [.], cksum 0x9807, seq 70461, ack 7494, win 16, length 0
00:12:37.128164 IP (tos 0x00, ttl 128, id 0xf7be, offset 0, flags [0x02], proto TCP (6), length 143)
    192.168.4.68.55337 > 172.64.155.209.443: Flags [.], cksum 0x0d80, seq 8009, ack 70461, win 507, length 103
00:12:37.129850 IP (tos 0x00, ttl 128, id 0xf7bf, offset 0, flags [0x02], proto TCP (6), length 143)
    192.168.4.68.55337 > 172.64.155.209.443: Flags [.], cksum 0x0d80, seq 8112, ack 70461, win 507, length 103
00:12:37.130249 IP (tos 0x00, ttl 128, id 0xf7c0, offset 0, flags [0x02], proto TCP (6), length 143)
    192.168.4.68.55337 > 172.64.155.209.443: Flags [.], cksum 0x0d80, seq 8215, ack 70461, win 507, length 103
00:12:37.130990 IP (tos 0x00, ttl 128, id 0xf7c1, offset 0, flags [0x02], proto TCP (6), length 143)
    192.168.4.68.55337 > 172.64.155.209.443: Flags [.], cksum 0x0d80, seq 8318, ack 70461, win 507, length 103
00:12:37.132370 IP (tos 0x00, ttl 52, id 0x6fa8, offset 0, flags [0x02], proto TCP (6), length 40)
    172.64.155.209.443 > 192.168.4.68.55337: Flags [.], cksum 0x9739, seq 70461, ack 7700, win 16, length 0
00:12:37.132370 IP (tos 0x00, ttl 52, id 0x6fa9, offset 0, flags [0x02], proto TCP (6), length 40)
    172.64.155.209.443 > 192.168.4.68.55337: Flags [.], cksum 0x966b, seq 70461, ack 7906, win 16, length 0
00:12:37.133513 IP (tos 0x00, ttl 128, id 0xf7c2, offset 0, flags [0x02], proto TCP (6), length 143)
