Dec 16, 2025 19:31:05.618919000 Eastern Standard Time | TLSv1.2 | 172.25.100.196 -> 142.251.167.190 | Len:186 | Application Data
Dec 16, 2025 19:31:05.619109000 Eastern Standard Time | TLSv1.2 | 172.25.100.196 -> 142.251.167.190 | Len:1191 | Application Data
Dec 16, 2025 19:31:05.619282000 Eastern Standard Time | TCP | 172.25.100.196 -> 142.251.167.190 | Len:1436 | 64176 → 443 [ACK] Seq=2652 Ack=1 Win=251 Len=1382
Dec 16, 2025 19:31:05.619282000 Eastern Standard Time | TCP | 172.25.100.196 -> 142.251.167.190 | Len:1436 | 64176 → 443 [ACK] Seq=4034 Ack=1 Win=251 Len=1382
Dec 16, 2025 19:31:05.619282000 Eastern Standard Time | TLSv1.2 | 172.25.100.196 -> 142.251.167.190 | Len:1073 | Application Data
Dec 16, 2025 19:31:05.632887000 Eastern Standard Time | TCP | 142.251.167.190 -> 172.25.100.196 | Len:56 | 443 → 64176 [ACK] Seq=1 Ack=133 Win=563 Len=0
Dec 16, 2025 19:31:05.632887000 Eastern Standard Time | TCP | 142.251.167.190 -> 172.25.100.196 | Len:56 | 443 → 64176 [ACK] Seq=1 Ack=1270 Win=559 Len=0
Dec 16, 2025 19:31:05.632887000 Eastern Standard Time | TCP | 142.251.167.190 -> 172.25.100.196 | Len:56 | 443 → 64176 [ACK] Seq=1 Ack=2652 Win=554 Len=0
Dec 16, 2025 19:31:05.632887000 Eastern Standard Time | TCP | 142.251.167.190 -> 172.25.100.196 | Len:56 | 443 → 64176 [ACK] Seq=1 Ack=4034 Win=549 Len=0
Dec 16, 2025 19:31:05.636287000 Eastern Standard Time | TCP | 142.251.167.190 -> 172.25.100.196 | Len:56 | 443 → 64176 [ACK] Seq=1 Ack=5416 Win=544 Len=0
Dec 16, 2025 19:31:05.636287000 Eastern Standard Time | TCP | 142.251.167.190 -> 172.25.100.196 | Len:56 | 443 → 64176 [ACK] Seq=1 Ack=6435 Win=541 Len=0
Dec 16, 2025 19:31:05.657499000 Eastern Standard Time | TLSv1.2 | 142.251.167.190 -> 172.25.100.196 | Len:122 | Application Data
Dec 16, 2025 19:31:05.657499000 Eastern Standard Time | TLSv1.2 | 142.251.167.190 -> 172.25.100.196 | Len:1436 | Application Data
Dec 16, 2025 19:31:05.657499000 Eastern Standard Time | TLSv1.2 | 142.251.167.190 -> 172.25.100.196 | Len:1155 | Application Data
Dec 16, 2025 19:31:05.657499000 Eastern Standard Time | TLSv1.2 | 142.251.167.190 -> 172.25.100.196 | Len:85 | Application Data
Dec 16, 2025 19:31:05.657499000 Eastern Standard Time | TLSv1.2 | 142.251.167.190 -> 172.25.100.196 | Len:93 | Application Data
Dec 16, 2025 19:31:05.657931000 Eastern Standard Time | TCP | 172.25.100.196 -> 142.251.167.190 | Len:54 | 64176 → 443 [ACK] Seq=6435 Ack=1451 Win=255 Len=0
Dec 16, 2025 19:31:05.658066000 Eastern Standard Time | TCP | 172.25.100.196 -> 142.251.167.190 | Len:54 | 64176 → 443 [ACK] Seq=6435 Ack=2583 Win=251 Len=0
Dec 16, 2025 19:31:05.658638000 Eastern Standard Time | TLSv1.2 | 172.25.100.196 -> 142.251.167.190 | Len:93 | Application Data
Dec 16, 2025 19:31:05.676696000 Eastern Standard Time | TCP | 142.251.167.190 -> 172.25.100.196 | Len:56 | 443 → 64176 [ACK] Seq=2622 Ack=6474 Win=541 Len=0
Dec 16, 2025 19:31:06.093393000 Eastern Standard Time | TCP | 142.251.16.94 -> 172.25.100.196 | Len:66 | 443 → 50903 [ACK] Seq=1 Ack=2 Win=1044 Len=0 SLE=1 SRE=2
Dec 16, 2025 19:31:06.767029000 Eastern Standard Time | TCP | 172.253.122.95 -> 172.25.100.196 | Len:66 | 443 → 64333 [ACK] Seq=1 Ack=2 Win=1043 Len=0 SLE=1 SRE=2
Dec 16, 2025 19:31:06.790636000 Eastern Standard Time | TCP | 23.212.251.87 -> 172.25.100.196 | Len:66 | 443 → 59646 [ACK] Seq=1 Ack=2 Win=555 Len=0 SLE=1 SRE=2
Dec 16, 2025 19:31:08.190153000 Eastern Standard Time | TLSv1.2 | 172.25.100.196 -> 142.251.16.94 | Len:143 | Application Data
Dec 16, 2025 19:31:08.190319000 Eastern Standard Time | TLSv1.2 | 172.25.100.196 -> 142.251.16.94 | Len:93 | Application Data
Dec 16, 2025 19:31:08.202995000 Eastern Standard Time | TCP | 142.251.16.94 -> 172.25.100.196 | Len:56 | 443 → 60129 [ACK] Seq=1 Ack=90 Win=1043 Len=0
Dec 16, 2025 19:31:08.202995000 Eastern Standard Time | TCP | 142.251.16.94 -> 172.25.100.196 | Len:56 | 443 → 60129 [ACK] Seq=1 Ack=129 Win=1043 Len=0
Dec 16, 2025 19:31:08.202995000 Eastern Standard Time | TLSv1.2 | 142.251.16.94 -> 172.25.100.196 | Len:93 | Application Data
Dec 16, 2025 19:31:08.202995000 Eastern Standard Time | TLSv1.2 | 142.251.16.94 -> 172.25.100.196 | Len:126 | Application Data
Dec 16, 2025 19:31:08.203391000 Eastern Standard Time | TCP | 172.25.100.196 -> 142.251.16.94 | Len:54 | 60129 → 443 [ACK] Seq=129 Ack=112 Win=253 Len=0
Dec 16, 2025 19:31:08.205735000 Eastern Standard Time | TLSv1.2 | 142.251.16.94 -> 172.25.100.196 | Len:128 | Application Data
Dec 16, 2025 19:31:08.205735000 Eastern Standard Time | TLSv1.2 | 142.251.16.94 -> 172.25.100.196 | Len:85 | Application Data
Dec 16, 2025 19:31:08.205735000 Eastern Standard Time | TLSv1.2 | 142.251.16.94 -> 172.25.100.196 | Len:93 | Application Data
Dec 16, 2025 19:31:08.205997000 Eastern Standard Time | TCP | 172.25.100.196 -> 142.251.16.94 | Len:54 | 60129 → 443 [ACK] Seq=129 Ack=217 Win=253 Len=0
Dec 16, 2025 19:31:08.206794000 Eastern Standard Time | TLSv1.2 | 172.25.100.196 -> 142.251.16.94 | Len:89 | Application Data
Dec 16, 2025 19:31:08.206889000 Eastern Standard Time | TLSv1.2 | 172.25.100.196 -> 142.251.16.94 | Len:93 | Application Data
Dec 16, 2025 19:31:08.217617000 Eastern Standard Time | TCP | 142.251.16.94 -> 172.25.100.196 | Len:56 | 443 → 60129 [ACK] Seq=256 Ack=203 Win=1043 Len=0
Dec 16, 2025 19:31:08.987709000 Eastern Standard Time | TLSv1.2 | 172.25.100.196 -> 20.50.73.10 | Len:173 | Application Data
Dec 16, 2025 19:31:08.987886000 Eastern Standard Time | TCP | 172.25.100.196 -> 20.50.73.10 | Len:1436 | 63470 → 443 [ACK] Seq=1502 Ack=1 Win=252 Len=1382
Dec 16, 2025 19:31:08.987886000 Eastern Standard Time | TCP | 172.25.100.196 -> 20.50.73.10 | Len:1436 | 63470 → 443 [ACK] Seq=2884 Ack=1 Win=252 Len=1382
Dec 16, 2025 19:31:08.987886000 Eastern Standard Time | TCP | 172.25.100.196 -> 20.50.73.10 | Len:1436 | 63470 → 443 [ACK] Seq=4266 Ack=1 Win=252 Len=1382
Dec 16, 2025 19:31:08.987886000 Eastern Standard Time | TCP | 172.25.100.196 -> 20.50.73.10 | Len:1436 | 63470 → 443 [ACK] Seq=5648 Ack=1 Win=252 Len=1382
Dec 16, 2025 19:31:08.987886000 Eastern Standard Time | TCP | 172.25.100.196 -> 20.50.73.10 | Len:1436 | 63470 → 443 [ACK] Seq=7030 Ack=1 Win=252 Len=1382
Dec 16, 2025 19:31:08.987886000 Eastern Standard Time | TCP | 172.25.100.196 -> 20.50.73.10 | Len:1436 | 63470 → 443 [ACK] Seq=8412 Ack=1 Win=252 Len=1382
Dec 16, 2025 19:31:08.987886000 Eastern Standard Time | TCP | 172.25.100.196 -> 20.50.73.10 | Len:1436 | 63470 → 443 [ACK] Seq=9794 Ack=1 Win=252 Len=1382
Dec 16, 2025 19:31:08.987886000 Eastern Standard Time | TCP | 172.25.100.196 -> 20.50.73.10 | Len:1436 | 63470 → 443 [ACK] Seq=11176 Ack=1 Win=252 Len=1382
Dec 16, 2025 19:31:08.987886000 Eastern Standard Time | TCP | 172.25.100.196 -> 20.50.73.10 | Len:1436 | 63470 → 443 [ACK] Seq=12558 Ack=1 Win=252 Len=1382
Dec 16, 2025 19:31:08.987886000 Eastern Standard Time | TLSv1.2 | 172.25.100.196 -> 20.50.73.10 | Len:574 | Application Data
Dec 16, 2025 19:31:09.077911000 Eastern Standard Time | TCP | 20.50.73.10 -> 172.25.100.196 | Len:56 | 443 → 63470 [ACK] Seq=1 Ack=1502 Win=16384 Len=0
Dec 16, 2025 19:31:09.077911000 Eastern Standard Time | TCP | 20.50.73.10 -> 172.25.100.196 | Len:56 | 443 → 63470 [ACK] Seq=1 Ack=4266 Win=16384 Len=0
Dec 16, 2025 19:31:09.077911000 Eastern Standard Time | TCP | 20.50.73.10 -> 172.25.100.196 | Len:56 | 443 → 63470 [ACK] Seq=1 Ack=7030 Win=16384 Len=0
Dec 16, 2025 19:31:09.077911000 Eastern Standard Time | TCP | 20.50.73.10 -> 172.25.100.196 | Len:56 | 443 → 63470 [ACK] Seq=1 Ack=9794 Win=16384 Len=0
Dec 16, 2025 19:31:09.077911000 Eastern Standard Time | TCP | 20.50.73.10 -> 172.25.100.196 | Len:56 | 443 → 63470 [ACK] Seq=1 Ack=12558 Win=16384 Len=0
Dec 16, 2025 19:31:09.077911000 Eastern Standard Time | TCP | 20.50.73.10 -> 172.25.100.196 | Len:56 | 443 → 63470 [ACK] Seq=1 Ack=14460 Win=16384 Len=0
Dec 16, 2025 19:31:09.122177000 Eastern Standard Time | TLSv1.2 | 20.50.73.10 -> 172.25.100.196 | Len:153 | Application Data
Dec 16, 2025 19:31:09.123650000 Eastern Standard Time | TLSv1.2 | 172.25.100.196 -> 20.50.73.10 | Len:89 | Application Data
Dec 16, 2025 19:31:09.270575000 Eastern Standard Time | TCP | 20.50.73.10 -> 172.25.100.196 | Len:56 | 443 → 63470 [ACK] Seq=100 Ack=14495 Win=16384 Len=0
Dec 16, 2025 19:31:09.784189000 Eastern Standard Time | TLSv1.2 | 172.25.100.196 -> 172.64.41.4 | Len:110 | Application Data
Dec 16, 2025 19:31:09.784323000 Eastern Standard Time | TLSv1.2 | 172.25.100.196 -> 172.64.41.4 | Len:213 | Application Data
Dec 16, 2025 19:31:09.784969000 Eastern Standard Time | TLSv1.2 | 172.25.100.196 -> 172.64.41.4 | Len:110 | Application Data
Dec 16, 2025 19:31:09.785026000 Eastern Standard Time | TLSv1.2 | 172.25.100.196 -> 172.64.41.4 | Len:213 | Application Data
Dec 16, 2025 19:31:09.791438000 Eastern Standard Time | TCP | 172.64.41.4 -> 172.25.100.196 | Len:56 | 443 → 64167 [ACK] Seq=1 Ack=431 Win=16 Len=0
Dec 16, 2025 19:31:09.794139000 Eastern Standard Time | TLSv1.2 | 172.64.41.4 -> 172.25.100.196 | Len:134 | Application Data
Dec 16, 2025 19:31:09.794139000 Eastern Standard Time | TLSv1.2 | 172.64.41.4 -> 172.25.100.196 | Len:553 | Application Data
Dec 16, 2025 19:31:09.794247000 Eastern Standard Time | TCP | 172.25.100.196 -> 172.64.41.4 | Len:54 | 64167 → 443 [ACK] Seq=431 Ack=580 Win=253 Len=0
Dec 16, 2025 19:31:09.794676000 Eastern Standard Time | TLSv1.2 | 172.64.41.4 -> 172.25.100.196 | Len:111 | Application Data
Dec 16, 2025 19:31:09.794676000 Eastern Standard Time | TLSv1.2 | 172.64.41.4 -> 172.25.100.196 | Len:553 | Application Data
Dec 16, 2025 19:31:09.794752000 Eastern Standard Time | TCP | 172.25.100.196 -> 172.64.41.4 | Len:54 | 64167 → 443 [ACK] Seq=431 Ack=1136 Win=251 Len=0
Dec 16, 2025 19:31:09.796267000 Eastern Standard Time | TCP | 172.25.100.196 -> 151.101.129.91 | Len:66 | 63018 → 443 [SYN] Seq=0 Win=65535 Len=0 MSS=1460 WS=256 SACK_PERM
Dec 16, 2025 19:31:09.802571000 Eastern Standard Time | TCP | 151.101.129.91 -> 172.25.100.196 | Len:66 | 443 → 63018 [SYN, ACK] Seq=0 Ack=1 Win=65535 Len=0 MSS=1382 SACK_PERM WS=512
Dec 16, 2025 19:31:09.802702000 Eastern Standard Time | TCP | 172.25.100.196 -> 151.101.129.91 | Len:54 | 63018 → 443 [ACK] Seq=1 Ack=1 Win=65280 Len=0
Dec 16, 2025 19:31:09.803145000 Eastern Standard Time | TLSv1.2 | 172.25.100.196 -> 151.101.129.91 | Len:584 | Client Hello (SNI=merino.services.mozilla.com)
Dec 16, 2025 19:31:09.811563000 Eastern Standard Time | TCP | 151.101.129.91 -> 172.25.100.196 | Len:56 | 443 → 63018 [ACK] Seq=1 Ack=1913 Win=150016 Len=0
Dec 16, 2025 19:31:09.811819000 Eastern Standard Time | TLSv1.3 | 151.101.129.91 -> 172.25.100.196 | Len:1436 | Server Hello, Change Cipher Spec, Encrypted Extensions
Dec 16, 2025 19:31:09.815343000 Eastern Standard Time | TCP | 151.101.129.91 -> 172.25.100.196 | Len:1436 | 443 → 63018 [ACK] Seq=1383 Ack=1913 Win=150016 Len=1382
Dec 16, 2025 19:31:09.815343000 Eastern Standard Time | TLSv1.3 | 151.101.129.91 -> 172.25.100.196 | Len:1436 | Certificate
Dec 16, 2025 19:31:09.815343000 Eastern Standard Time | TLSv1.3 | 151.101.129.91 -> 172.25.100.196 | Len:368 | Certificate Verify, Finished, New Session Ticket
Dec 16, 2025 19:31:09.815463000 Eastern Standard Time | TCP | 172.25.100.196 -> 151.101.129.91 | Len:54 | 63018 → 443 [ACK] Seq=1913 Ack=4147 Win=65280 Len=0
Dec 16, 2025 19:31:09.815492000 Eastern Standard Time | TCP | 172.25.100.196 -> 151.101.129.91 | Len:54 | 63018 → 443 [ACK] Seq=1913 Ack=4461 Win=65024 Len=0
Dec 16, 2025 19:31:09.818630000 Eastern Standard Time | TLSv1.3 | 172.25.100.196 -> 151.101.129.91 | Len:118 | Change Cipher Spec, Finished
Dec 16, 2025 19:31:09.819409000 Eastern Standard Time | HTTP2 | 172.25.100.196 -> 151.101.129.91 | Len:146 | Magic, SETTINGS[0], WINDOW_UPDATE[0]
Dec 16, 2025 19:31:09.819457000 Eastern Standard Time | HTTP2 | 172.25.100.196 -> 151.101.129.91 | Len:370 | HEADERS[3]: GET /api/v1/suggest?q=&providers=accuweather&request_type=weather&source=newtab&country=US&region=VA&city=Charlottesville&sid=1d8c0506-124e-4fd8-bebb-cf761ae9804c&seq=0, WINDOW_UPDATE[3]
Dec 16, 2025 19:31:09.825805000 Eastern Standard Time | TCP | 151.101.129.91 -> 172.25.100.196 | Len:56 | 443 → 63018 [ACK] Seq=4461 Ack=1977 Win=150016 Len=0
Dec 16, 2025 19:31:09.830102000 Eastern Standard Time | TCP | 151.101.129.91 -> 172.25.100.196 | Len:56 | 443 → 63018 [ACK] Seq=4461 Ack=2069 Win=150016 Len=0
Dec 16, 2025 19:31:09.830102000 Eastern Standard Time | HTTP2 | 151.101.129.91 -> 172.25.100.196 | Len:119 | SETTINGS[0], WINDOW_UPDATE[0], SETTINGS[0]
Dec 16, 2025 19:31:09.830102000 Eastern Standard Time | TCP | 151.101.129.91 -> 172.25.100.196 | Len:56 | 443 → 63018 [ACK] Seq=4526 Ack=2385 Win=153088 Len=0
Dec 16, 2025 19:31:09.830537000 Eastern Standard Time | HTTP2 | 172.25.100.196 -> 151.101.129.91 | Len:85 | SETTINGS[0]
Dec 16, 2025 19:31:09.838104000 Eastern Standard Time | TCP | 151.101.129.91 -> 172.25.100.196 | Len:56 | 443 → 63018 [ACK] Seq=4526 Ack=2416 Win=153088 Len=0
Dec 16, 2025 19:31:09.922905000 Eastern Standard Time | TCP | 192.178.155.100 -> 172.25.100.196 | Len:66 | 443 → 64155 [ACK] Seq=1 Ack=2 Win=1047 Len=0 SLE=1 SRE=2
Dec 16, 2025 19:31:09.987180000 Eastern Standard Time | HTTP2/JSON | 151.101.129.91 -> 172.25.100.196 | Len:1264 | HEADERS[3]: 200 OK, DATA[3], JSON (application/json)
    [PAYLOAD]:
    {"suggestions":[{"title":"Weather for Charlottesville","url":"https://www.accuweather.com/en/us/charlottesville-va/22902/current-weather/331243?lang=en-us&partner=web_mozilla_adc","provider":"accuweather","is_sponsored":false,"score":0.3,"city_name":"Charlottesville","region_code":"VA","current_conditions":{"url":"https://www.accuweather.com/en/us/charlottesville-va/22902/current-weather/331243?lang=en-us&partner=web_mozilla_adc","summary":"Clear","icon_id":33,"temperature":{"c":2,"f":36}},"forecast":{"url":"https://www.accuweather.com/en/us/charlottesville-va/22902/daily-weather-forecast/331243?lang=en-us&partner=web_mozilla_adc","summary":"A break in the cold will be followed by rain later this week","high":{"c":8,"f":46},"low":{"c":-1,"f":31}}}],"request_id":"7706c007430b4c5a8db50ced6a07213f","client_variants":[],"server_variants":[]}
    ------------------------------------------------------------
Dec 16, 2025 19:31:10.031264000 Eastern Standard Time | TCP | 172.25.100.196 -> 151.101.129.91 | Len:54 | 63018 → 443 [ACK] Seq=2416 Ack=5736 Win=65280 Len=0
Dec 16, 2025 19:31:10.187683000 Eastern Standard Time | TLSv1.2 | 52.96.111.34 -> 172.25.100.196 | Len:95 | Application Data
Dec 16, 2025 19:31:10.201185000 Eastern Standard Time | TLSv1.2 | 172.25.100.196 -> 52.96.111.34 | Len:89 | Application Data
Dec 16, 2025 19:31:10.201334000 Eastern Standard Time | TLSv1.2 | 172.25.100.196 -> 52.96.111.34 | Len:89 | Application Data
Dec 16, 2025 19:31:10.211564000 Eastern Standard Time | TCP | 52.96.111.34 -> 172.25.100.196 | Len:56 | 443 → 57334 [ACK] Seq=42 Ack=71 Win=1014 Len=0
Dec 16, 2025 19:31:10.772432000 Eastern Standard Time | TLSv1.2 | 140.82.114.26 -> 172.25.100.196 | Len:79 | Application Data
Dec 16, 2025 19:31:10.772966000 Eastern Standard Time | TLSv1.2 | 172.25.100.196 -> 140.82.114.26 | Len:83 | Application Data
Dec 16, 2025 19:31:10.783363000 Eastern Standard Time | TCP | 140.82.114.26 -> 172.25.100.196 | Len:56 | 443 → 50181 [ACK] Seq=26 Ack=30 Win=74 Len=0
Dec 16, 2025 19:31:10.810740000 Eastern Standard Time | TCP | 172.25.100.196 -> 142.251.16.100 | Len:1436 | 51974 → 443 [ACK] Seq=1383 Ack=1 Win=251 Len=1382
Dec 16, 2025 19:31:10.810740000 Eastern Standard Time | TCP | 172.25.100.196 -> 142.251.16.100 | Len:1436 | 51974 → 443 [ACK] Seq=2765 Ack=1 Win=251 Len=1382
Dec 16, 2025 19:31:10.810740000 Eastern Standard Time | TLSv1.2 | 172.25.100.196 -> 142.251.16.100 | Len:416 | Application Data
Dec 16, 2025 19:31:10.810877000 Eastern Standard Time | TLSv1.2 | 172.25.100.196 -> 142.251.16.100 | Len:93 | Application Data
Dec 16, 2025 19:31:10.810921000 Eastern Standard Time | TLSv1.2 | 172.25.100.196 -> 142.251.16.100 | Len:252 | Application Data
Dec 16, 2025 19:31:10.842053000 Eastern Standard Time | TCP | 142.251.16.100 -> 172.25.100.196 | Len:56 | 443 → 51974 [ACK] Seq=1 Ack=1383 Win=1586 Len=0
Dec 16, 2025 19:31:10.842053000 Eastern Standard Time | TCP | 142.251.16.100 -> 172.25.100.196 | Len:56 | 443 → 51974 [ACK] Seq=1 Ack=2765 Win=1597 Len=0
Dec 16, 2025 19:31:10.842053000 Eastern Standard Time | TCP | 142.251.16.100 -> 172.25.100.196 | Len:66 | [TCP Dup ACK 121#1] 443 → 51974 [ACK] Seq=1 Ack=2765 Win=1608 Len=0 SLE=4147 SRE=4509
Dec 16, 2025 19:31:10.842053000 Eastern Standard Time | TCP | 142.251.16.100 -> 172.25.100.196 | Len:56 | 443 → 51974 [ACK] Seq=1 Ack=4509 Win=1619 Len=0
Dec 16, 2025 19:31:10.842053000 Eastern Standard Time | TCP | 142.251.16.100 -> 172.25.100.196 | Len:56 | 443 → 51974 [ACK] Seq=1 Ack=4548 Win=1619 Len=0
Dec 16, 2025 19:31:10.842053000 Eastern Standard Time | TCP | 142.251.16.100 -> 172.25.100.196 | Len:56 | 443 → 51974 [ACK] Seq=1 Ack=4746 Win=1630 Len=0
Dec 16, 2025 19:31:10.842053000 Eastern Standard Time | TLSv1.2 | 142.251.16.100 -> 172.25.100.196 | Len:93 | Application Data
Dec 16, 2025 19:31:10.891208000 Eastern Standard Time | TCP | 172.25.100.196 -> 142.251.16.100 | Len:54 | 51974 → 443 [ACK] Seq=4746 Ack=40 Win=251 Len=0
Dec 16, 2025 19:31:10.960718000 Eastern Standard Time | TLSv1.2 | 142.251.16.100 -> 172.25.100.196 | Len:586 | Application Data
Dec 16, 2025 19:31:10.960718000 Eastern Standard Time | TLSv1.2 | 142.251.16.100 -> 172.25.100.196 | Len:324 | Application Data
Dec 16, 2025 19:31:10.960718000 Eastern Standard Time | TLSv1.2 | 142.251.16.100 -> 172.25.100.196 | Len:346 | Application Data
Dec 16, 2025 19:31:10.960718000 Eastern Standard Time | TLSv1.2 | 142.251.16.100 -> 172.25.100.196 | Len:85 | Application Data
Dec 16, 2025 19:31:10.960718000 Eastern Standard Time | TLSv1.2 | 142.251.16.100 -> 172.25.100.196 | Len:93 | Application Data
Dec 16, 2025 19:31:10.961075000 Eastern Standard Time | TCP | 172.25.100.196 -> 142.251.16.100 | Len:54 | 51974 → 443 [ACK] Seq=4746 Ack=842 Win=255 Len=0
Dec 16, 2025 19:31:10.961143000 Eastern Standard Time | TCP | 172.25.100.196 -> 142.251.16.100 | Len:54 | 51974 → 443 [ACK] Seq=4746 Ack=1165 Win=254 Len=0
Dec 16, 2025 19:31:10.961889000 Eastern Standard Time | TLSv1.2 | 172.25.100.196 -> 142.251.16.100 | Len:89 | Application Data
Dec 16, 2025 19:31:10.961995000 Eastern Standard Time | TLSv1.2 | 172.25.100.196 -> 142.251.16.100 | Len:93 | Application Data
Dec 16, 2025 19:31:10.983778000 Eastern Standard Time | TCP | 142.251.16.100 -> 172.25.100.196 | Len:56 | 443 → 51974 [ACK] Seq=1204 Ack=4820 Win=1630 Len=0
Dec 16, 2025 19:31:11.330715000 Eastern Standard Time | TCP | 172.25.100.196 -> 142.251.167.101 | Len:1436 | 50651 → 443 [ACK] Seq=1383 Ack=1 Win=252 Len=1382
Dec 16, 2025 19:31:11.330715000 Eastern Standard Time | TLSv1.2 | 172.25.100.196 -> 142.251.167.101 | Len:1380 | Application Data
Dec 16, 2025 19:31:11.330834000 Eastern Standard Time | TLSv1.2 | 172.25.100.196 -> 142.251.167.101 | Len:93 | Application Data
Dec 16, 2025 19:31:11.330874000 Eastern Standard Time | TLSv1.2 | 172.25.100.196 -> 142.251.167.101 | Len:1174 | Application Data
Dec 16, 2025 19:31:11.347328000 Eastern Standard Time | TCP | 142.251.167.101 -> 172.25.100.196 | Len:56 | 443 → 50651 [ACK] Seq=1 Ack=2765 Win=531 Len=0
Dec 16, 2025 19:31:11.347328000 Eastern Standard Time | TCP | 142.251.167.101 -> 172.25.100.196 | Len:66 | [TCP Dup ACK 143#1] 443 → 50651 [ACK] Seq=1 Ack=2765 Win=535 Len=0 SLE=4091 SRE=4130
Dec 16, 2025 19:31:11.347328000 Eastern Standard Time | TCP | 142.251.167.101 -> 172.25.100.196 | Len:56 | 443 → 50651 [ACK] Seq=1 Ack=4130 Win=530 Len=0
Dec 16, 2025 19:31:11.347328000 Eastern Standard Time | TLSv1.2 | 142.251.167.101 -> 172.25.100.196 | Len:93 | Application Data
Dec 16, 2025 19:31:11.368602000 Eastern Standard Time | TLSv1.2 | 142.251.167.101 -> 172.25.100.196 | Len:591 | Application Data
Dec 16, 2025 19:31:11.368602000 Eastern Standard Time | TLSv1.2 | 142.251.167.101 -> 172.25.100.196 | Len:260 | Application Data
Dec 16, 2025 19:31:11.368602000 Eastern Standard Time | TLSv1.2 | 142.251.167.101 -> 172.25.100.196 | Len:85 | Application Data
Dec 16, 2025 19:31:11.368602000 Eastern Standard Time | TLSv1.2 | 142.251.167.101 -> 172.25.100.196 | Len:93 | Application Data
Dec 16, 2025 19:31:11.368777000 Eastern Standard Time | TCP | 172.25.100.196 -> 142.251.167.101 | Len:54 | 50651 → 443 [ACK] Seq=5250 Ack=577 Win=255 Len=0
Dec 16, 2025 19:31:11.368858000 Eastern Standard Time | TCP | 172.25.100.196 -> 142.251.167.101 | Len:54 | 50651 → 443 [ACK] Seq=5250 Ack=814 Win=255 Len=0
Dec 16, 2025 19:31:11.369435000 Eastern Standard Time | TLSv1.2 | 172.25.100.196 -> 142.251.167.101 | Len:89 | Application Data
Dec 16, 2025 19:31:11.369496000 Eastern Standard Time | TLSv1.2 | 172.25.100.196 -> 142.251.167.101 | Len:93 | Application Data
Dec 16, 2025 19:31:11.383652000 Eastern Standard Time | TCP | 142.251.167.101 -> 172.25.100.196 | Len:56 | 443 → 50651 [ACK] Seq=853 Ack=5324 Win=536 Len=0
Dec 16, 2025 19:31:11.918129000 Eastern Standard Time | TLSv1.2 | 172.25.100.196 -> 172.64.41.4 | Len:93 | Application Data
Dec 16, 2025 19:31:11.918233000 Eastern Standard Time | TLSv1.2 | 172.25.100.196 -> 216.239.38.178 | Len:93 | Application Data
Dec 16, 2025 19:31:11.918281000 Eastern Standard Time | HTTP2 | 172.25.100.196 -> 151.101.129.91 | Len:93 | GOAWAY[0]
Dec 16, 2025 19:31:11.918337000 Eastern Standard Time | TLSv1.2 | 172.25.100.196 -> 172.64.155.209 | Len:93 | Application Data
Dec 16, 2025 19:31:11.918377000 Eastern Standard Time | TLSv1.2 | 172.25.100.196 -> 142.251.167.190 | Len:93 | Application Data
Dec 16, 2025 19:31:11.918425000 Eastern Standard Time | TLSv1.2 | 172.25.100.196 -> 74.125.136.97 | Len:93 | Application Data
Dec 16, 2025 19:31:11.918637000 Eastern Standard Time | TLSv1.3 | 172.25.100.196 -> 151.101.129.91 | Len:78 | Alert (Level: Warning, Description: Close Notify)
Dec 16, 2025 19:31:11.918667000 Eastern Standard Time | TCP | 172.25.100.196 -> 151.101.129.91 | Len:54 | 63018 → 443 [FIN, ACK] Seq=2479 Ack=5736 Win=65280 Len=0
Dec 16, 2025 19:31:11.918817000 Eastern Standard Time | TLSv1.2 | 172.25.100.196 -> 74.125.136.97 | Len:78 | Application Data
Dec 16, 2025 19:31:11.918840000 Eastern Standard Time | TCP | 172.25.100.196 -> 74.125.136.97 | Len:54 | 64175 → 443 [FIN, ACK] Seq=64 Ack=1 Win=251 Len=0
Dec 16, 2025 19:31:11.919009000 Eastern Standard Time | TLSv1.2 | 172.25.100.196 -> 216.239.38.178 | Len:78 | Application Data
Dec 16, 2025 19:31:11.919031000 Eastern Standard Time | TCP | 172.25.100.196 -> 216.239.38.178 | Len:54 | 64174 → 443 [FIN, ACK] Seq=64 Ack=1 Win=255 Len=0
Dec 16, 2025 19:31:11.919197000 Eastern Standard Time | TLSv1.2 | 172.25.100.196 -> 142.251.167.190 | Len:78 | Application Data
Dec 16, 2025 19:31:11.919218000 Eastern Standard Time | TCP | 172.25.100.196 -> 142.251.167.190 | Len:54 | 64176 → 443 [FIN, ACK] Seq=6537 Ack=2622 Win=251 Len=0
Dec 16, 2025 19:31:11.919393000 Eastern Standard Time | TLSv1.2 | 172.25.100.196 -> 172.64.155.209 | Len:78 | Application Data
Dec 16, 2025 19:31:11.919418000 Eastern Standard Time | TCP | 172.25.100.196 -> 172.64.155.209 | Len:54 | 64169 → 443 [FIN, ACK] Seq=64 Ack=1 Win=4091 Len=0
Dec 16, 2025 19:31:11.919612000 Eastern Standard Time | TLSv1.2 | 172.25.100.196 -> 172.64.41.4 | Len:78 | Application Data
Dec 16, 2025 19:31:11.919637000 Eastern Standard Time | TCP | 172.25.100.196 -> 172.64.41.4 | Len:54 | 64167 → 443 [FIN, ACK] Seq=494 Ack=1136 Win=251 Len=0
Dec 16, 2025 19:31:11.922687000 Eastern Standard Time | TCP | 172.25.100.196 -> 172.64.41.4 | Len:66 | 63019 → 443 [SYN] Seq=0 Win=65535 Len=0 MSS=1460 WS=256 SACK_PERM
Dec 16, 2025 19:31:11.927395000 Eastern Standard Time | TCP | 172.64.155.209 -> 172.25.100.196 | Len:56 | 443 → 64169 [ACK] Seq=1 Ack=65 Win=15 Len=0
Dec 16, 2025 19:31:11.927395000 Eastern Standard Time | TCP | 151.101.129.91 -> 172.25.100.196 | Len:56 | 443 → 63018 [ACK] Seq=5736 Ack=2455 Win=153088 Len=0
Dec 16, 2025 19:31:11.927395000 Eastern Standard Time | TCP | 151.101.129.91 -> 172.25.100.196 | Len:56 | 443 → 63018 [ACK] Seq=5736 Ack=2479 Win=153088 Len=0
Dec 16, 2025 19:31:11.927395000 Eastern Standard Time | TCP | 151.101.129.91 -> 172.25.100.196 | Len:56 | 443 → 63018 [ACK] Seq=5736 Ack=2480 Win=153088 Len=0
Dec 16, 2025 19:31:11.927395000 Eastern Standard Time | TCP | 172.64.41.4 -> 172.25.100.196 | Len:56 | 443 → 64167 [ACK] Seq=1136 Ack=495 Win=16 Len=0
Dec 16, 2025 19:31:11.927395000 Eastern Standard Time | TLSv1.3 | 151.101.129.91 -> 172.25.100.196 | Len:78 | Alert (Level: Warning, Description: Close Notify)
Dec 16, 2025 19:31:11.927395000 Eastern Standard Time | TCP | 151.101.129.91 -> 172.25.100.196 | Len:56 | 443 → 63018 [FIN, ACK] Seq=5760 Ack=2480 Win=153088 Len=0
Dec 16, 2025 19:31:11.927395000 Eastern Standard Time | TCP | 172.64.155.209 -> 172.25.100.196 | Len:56 | 443 → 64169 [FIN, ACK] Seq=1 Ack=65 Win=15 Len=0
Dec 16, 2025 19:31:11.927890000 Eastern Standard Time | TCP | 172.25.100.196 -> 172.64.155.209 | Len:54 | 64169 → 443 [ACK] Seq=65 Ack=2 Win=4091 Len=0
Dec 16, 2025 19:31:11.927979000 Eastern Standard Time | TCP | 172.25.100.196 -> 151.101.129.91 | Len:54 | 63018 → 443 [RST, ACK] Seq=2480 Ack=5760 Win=0 Len=0
Dec 16, 2025 19:31:11.928200000 Eastern Standard Time | TCP | 172.64.41.4 -> 172.25.100.196 | Len:56 | 443 → 64167 [FIN, ACK] Seq=1136 Ack=495 Win=16 Len=0
Dec 16, 2025 19:31:11.928304000 Eastern Standard Time | TCP | 172.25.100.196 -> 172.64.41.4 | Len:54 | 64167 → 443 [ACK] Seq=495 Ack=1137 Win=251 Len=0
Dec 16, 2025 19:31:11.929032000 Eastern Standard Time | TCP | 172.64.41.4 -> 172.25.100.196 | Len:66 | 443 → 63019 [SYN, ACK] Seq=0 Ack=1 Win=65535 Len=0 MSS=1382 SACK_PERM WS=8192
Dec 16, 2025 19:31:11.929207000 Eastern Standard Time | TCP | 172.25.100.196 -> 172.64.41.4 | Len:54 | 63019 → 443 [ACK] Seq=1 Ack=1 Win=65280 Len=0
Dec 16, 2025 19:31:11.929899000 Eastern Standard Time | TLSv1.2 | 172.25.100.196 -> 172.64.41.4 | Len:1078 | Client Hello (SNI=mozilla.cloudflare-dns.com)
Dec 16, 2025 19:31:11.930248000 Eastern Standard Time | TLSv1.3 | 172.25.100.196 -> 172.64.41.4 | Len:60 | Change Cipher Spec
Dec 16, 2025 19:31:11.930323000 Eastern Standard Time | HTTP2 | 172.25.100.196 -> 172.64.41.4 | Len:146 | Magic, SETTINGS[0], WINDOW_UPDATE[0]
Dec 16, 2025 19:31:11.930716000 Eastern Standard Time | TCP | 142.251.167.190 -> 172.25.100.196 | Len:56 | 443 → 64176 [ACK] Seq=2622 Ack=6513 Win=541 Len=0
Dec 16, 2025 19:31:11.930716000 Eastern Standard Time | TCP | 142.251.167.190 -> 172.25.100.196 | Len:56 | 443 → 64176 [ACK] Seq=2622 Ack=6537 Win=541 Len=0
Dec 16, 2025 19:31:11.930716000 Eastern Standard Time | TCP | 142.251.167.190 -> 172.25.100.196 | Len:56 | 443 → 64176 [FIN, ACK] Seq=2622 Ack=6538 Win=541 Len=0
Dec 16, 2025 19:31:11.930716000 Eastern Standard Time | TCP | 216.239.38.178 -> 172.25.100.196 | Len:56 | 443 → 64174 [ACK] Seq=1 Ack=64 Win=1043 Len=0
Dec 16, 2025 19:31:11.930920000 Eastern Standard Time | TCP | 172.25.100.196 -> 142.251.167.190 | Len:54 | 64176 → 443 [ACK] Seq=6538 Ack=2623 Win=251 Len=0
Dec 16, 2025 19:31:11.931153000 Eastern Standard Time | TCP | 216.239.38.178 -> 172.25.100.196 | Len:56 | 443 → 64174 [FIN, ACK] Seq=1 Ack=65 Win=1043 Len=0
Dec 16, 2025 19:31:11.931266000 Eastern Standard Time | TCP | 172.25.100.196 -> 216.239.38.178 | Len:54 | 64174 → 443 [ACK] Seq=65 Ack=2 Win=255 Len=0
Dec 16, 2025 19:31:11.936150000 Eastern Standard Time | TCP | 172.64.41.4 -> 172.25.100.196 | Len:56 | 443 → 63019 [ACK] Seq=1 Ack=2407 Win=139264 Len=0
Dec 16, 2025 19:31:11.936150000 Eastern Standard Time | TCP | 172.64.41.4 -> 172.25.100.196 | Len:56 | 443 → 63019 [ACK] Seq=1 Ack=2413 Win=139264 Len=0
Dec 16, 2025 19:31:11.936150000 Eastern Standard Time | TCP | 172.64.41.4 -> 172.25.100.196 | Len:56 | 443 → 63019 [ACK] Seq=1 Ack=2505 Win=139264 Len=0
Dec 16, 2025 19:31:11.937912000 Eastern Standard Time | TLSv1.3 | 172.64.41.4 -> 172.25.100.196 | Len:1436 | Server Hello, Change Cipher Spec, Encrypted Extensions, Finished
Dec 16, 2025 19:31:11.937912000 Eastern Standard Time | TLSv1.3 | 172.64.41.4 -> 172.25.100.196 | Len:517 | New Session Ticket, New Session Ticket
Dec 16, 2025 19:31:11.937912000 Eastern Standard Time | HTTP2 | 172.64.41.4 -> 172.25.100.196 | Len:125 | SETTINGS[0], WINDOW_UPDATE[0], SETTINGS[0]
Dec 16, 2025 19:31:11.938039000 Eastern Standard Time | TCP | 172.25.100.196 -> 172.64.41.4 | Len:54 | 63019 → 443 [ACK] Seq=2505 Ack=1917 Win=65280 Len=0
Dec 16, 2025 19:31:11.938620000 Eastern Standard Time | TLSv1.3 | 172.25.100.196 -> 172.64.41.4 | Len:138 | End of Early Data, Finished
Dec 16, 2025 19:31:11.939829000 Eastern Standard Time | HTTP2 | 172.25.100.196 -> 172.64.41.4 | Len:85 | SETTINGS[0]
Dec 16, 2025 19:31:11.940085000 Eastern Standard Time | HTTP2 | 172.25.100.196 -> 172.64.41.4 | Len:205 | HEADERS[3]: POST /dns-query
Dec 16, 2025 19:31:11.940114000 Eastern Standard Time | DoH | 172.25.100.196 -> 172.64.41.4 | Len:213 | Standard query 0x0000 AAAA chatgpt.com OPT
Dec 16, 2025 19:31:11.940265000 Eastern Standard Time | HTTP2 | 172.25.100.196 -> 172.64.41.4 | Len:110 | HEADERS[5]: POST /dns-query
Dec 16, 2025 19:31:11.940288000 Eastern Standard Time | DoH | 172.25.100.196 -> 172.64.41.4 | Len:213 | Standard query 0x0000 A chatgpt.com OPT
Dec 16, 2025 19:31:11.940322000 Eastern Standard Time | HTTP2 | 172.25.100.196 -> 172.64.41.4 | Len:110 | HEADERS[7]: POST /dns-query
Dec 16, 2025 19:31:11.940342000 Eastern Standard Time | DoH | 172.25.100.196 -> 172.64.41.4 | Len:213 | Standard query 0x0000 HTTPS chatgpt.com OPT
Dec 16, 2025 19:31:11.943566000 Eastern Standard Time | TCP | 74.125.136.97 -> 172.25.100.196 | Len:56 | 443 → 64175 [ACK] Seq=1 Ack=65 Win=1047 Len=0
Dec 16, 2025 19:31:11.943566000 Eastern Standard Time | TCP | 74.125.136.97 -> 172.25.100.196 | Len:56 | 443 → 64175 [FIN, ACK] Seq=1 Ack=65 Win=1047 Len=0
Dec 16, 2025 19:31:11.943772000 Eastern Standard Time | TCP | 172.25.100.196 -> 74.125.136.97 | Len:54 | 64175 → 443 [ACK] Seq=65 Ack=2 Win=251 Len=0
Dec 16, 2025 19:31:11.952087000 Eastern Standard Time | TCP | 172.64.41.4 -> 172.25.100.196 | Len:56 | 443 → 63019 [ACK] Seq=1917 Ack=3360 Win=147456 Len=0
Dec 16, 2025 19:31:11.952087000 Eastern Standard Time | HTTP2 | 172.64.41.4 -> 172.25.100.196 | Len:219 | HEADERS[3]: 200 OK
Dec 16, 2025 19:31:11.952087000 Eastern Standard Time | DoH | 172.64.41.4 -> 172.25.100.196 | Len:553 | Standard query response 0x0000 AAAA chatgpt.com AAAA 2a06:98c1:310b::ac40:9bd1 AAAA 2a06:98c1:3100::6812:202f OPT
Dec 16, 2025 19:31:11.952087000 Eastern Standard Time | HTTP2 | 172.64.41.4 -> 172.25.100.196 | Len:111 | HEADERS[5]: 200 OK
Dec 16, 2025 19:31:11.952087000 Eastern Standard Time | DoH | 172.64.41.4 -> 172.25.100.196 | Len:553 | Standard query response 0x0000 A chatgpt.com A 172.64.155.209 A 104.18.32.47 OPT
Dec 16, 2025 19:31:11.952323000 Eastern Standard Time | TCP | 172.25.100.196 -> 172.64.41.4 | Len:54 | 63019 → 443 [ACK] Seq=3360 Ack=3137 Win=64256 Len=0
Dec 16, 2025 19:31:11.952908000 Eastern Standard Time | HTTP2 | 172.64.41.4 -> 172.25.100.196 | Len:111 | HEADERS[7]: 200 OK
Dec 16, 2025 19:31:11.952908000 Eastern Standard Time | DoH | 172.64.41.4 -> 172.25.100.196 | Len:553 | Standard query response 0x0000 HTTPS chatgpt.com SOA hassan.ns.cloudflare.com OPT
Dec 16, 2025 19:31:11.953020000 Eastern Standard Time | TCP | 172.25.100.196 -> 172.64.41.4 | Len:54 | 63019 → 443 [ACK] Seq=3360 Ack=3693 Win=65280 Len=0
Dec 16, 2025 19:31:11.957692000 Eastern Standard Time | HTTP2 | 172.25.100.196 -> 172.64.41.4 | Len:110 | HEADERS[9]: POST /dns-query
Dec 16, 2025 19:31:11.957783000 Eastern Standard Time | DoH | 172.25.100.196 -> 172.64.41.4 | Len:213 | Standard query 0x0000 AAAA chatgpt.com OPT
Dec 16, 2025 19:31:11.965347000 Eastern Standard Time | TCP | 172.64.41.4 -> 172.25.100.196 | Len:56 | 443 → 63019 [ACK] Seq=3693 Ack=3575 Win=155648 Len=0
Dec 16, 2025 19:31:11.966241000 Eastern Standard Time | HTTP2 | 172.64.41.4 -> 172.25.100.196 | Len:111 | HEADERS[9]: 200 OK
Dec 16, 2025 19:31:11.966241000 Eastern Standard Time | DoH | 172.64.41.4 -> 172.25.100.196 | Len:553 | Standard query response 0x0000 AAAA chatgpt.com AAAA 2a06:98c1:310b::ac40:9bd1 AAAA 2a06:98c1:3100::6812:202f OPT
Dec 16, 2025 19:31:11.966471000 Eastern Standard Time | TCP | 172.25.100.196 -> 172.64.41.4 | Len:54 | 63019 → 443 [ACK] Seq=3575 Ack=4249 Win=64768 Len=0
Dec 16, 2025 19:31:12.058203000 Eastern Standard Time | HTTP2 | 172.25.100.196 -> 172.64.41.4 | Len:110 | HEADERS[11]: POST /dns-query
Dec 16, 2025 19:31:12.058402000 Eastern Standard Time | DoH | 172.25.100.196 -> 172.64.41.4 | Len:213 | Standard query 0x0000 A chatgpt.com OPT
Dec 16, 2025 19:31:12.069308000 Eastern Standard Time | TCP | 172.64.41.4 -> 172.25.100.196 | Len:56 | 443 → 63019 [ACK] Seq=4249 Ack=3790 Win=155648 Len=0
Dec 16, 2025 19:31:12.069308000 Eastern Standard Time | HTTP2 | 172.64.41.4 -> 172.25.100.196 | Len:111 | HEADERS[11]: 200 OK
Dec 16, 2025 19:31:12.069308000 Eastern Standard Time | DoH | 172.64.41.4 -> 172.25.100.196 | Len:553 | Standard query response 0x0000 A chatgpt.com A 172.64.155.209 A 104.18.32.47 OPT
Dec 16, 2025 19:31:12.069610000 Eastern Standard Time | TCP | 172.25.100.196 -> 172.64.41.4 | Len:54 | 63019 → 443 [ACK] Seq=3790 Ack=4805 Win=64256 Len=0
Dec 16, 2025 19:31:12.071605000 Eastern Standard Time | TCP | 172.25.100.196 -> 104.18.32.47 | Len:66 | 63020 → 443 [SYN] Seq=0 Win=65535 Len=0 MSS=1460 WS=256 SACK_PERM
Dec 16, 2025 19:31:12.078287000 Eastern Standard Time | TCP | 104.18.32.47 -> 172.25.100.196 | Len:66 | 443 → 63020 [SYN, ACK] Seq=0 Ack=1 Win=65535 Len=0 MSS=1382 SACK_PERM WS=8192
Dec 16, 2025 19:31:12.078459000 Eastern Standard Time | TCP | 172.25.100.196 -> 104.18.32.47 | Len:54 | 63020 → 443 [ACK] Seq=1 Ack=1 Win=65280 Len=0
Dec 16, 2025 19:31:12.079264000 Eastern Standard Time | TLSv1.2 | 172.25.100.196 -> 104.18.32.47 | Len:1063 | Client Hello (SNI=chatgpt.com)
Dec 16, 2025 19:31:12.079420000 Eastern Standard Time | TLSv1.3 | 172.25.100.196 -> 104.18.32.47 | Len:60 | Change Cipher Spec
Dec 16, 2025 19:31:12.079595000 Eastern Standard Time | HTTP2 | 172.25.100.196 -> 104.18.32.47 | Len:485 | Magic, SETTINGS[0], WINDOW_UPDATE[0], HEADERS[3]: GET /, WINDOW_UPDATE[3]
Dec 16, 2025 19:31:12.086122000 Eastern Standard Time | TCP | 104.18.32.47 -> 172.25.100.196 | Len:56 | 443 → 63020 [ACK] Seq=1 Ack=2392 Win=131072 Len=0
Dec 16, 2025 19:31:12.086122000 Eastern Standard Time | TCP | 104.18.32.47 -> 172.25.100.196 | Len:56 | 443 → 63020 [ACK] Seq=1 Ack=2398 Win=131072 Len=0
Dec 16, 2025 19:31:12.086122000 Eastern Standard Time | TCP | 104.18.32.47 -> 172.25.100.196 | Len:56 | 443 → 63020 [ACK] Seq=1 Ack=3780 Win=131072 Len=0
Dec 16, 2025 19:31:12.086122000 Eastern Standard Time | TCP | 104.18.32.47 -> 172.25.100.196 | Len:56 | 443 → 63020 [ACK] Seq=1 Ack=4211 Win=131072 Len=0
Dec 16, 2025 19:31:12.092110000 Eastern Standard Time | TLSv1.3 | 104.18.32.47 -> 172.25.100.196 | Len:1436 | Server Hello, Change Cipher Spec, Encrypted Extensions, Finished
Dec 16, 2025 19:31:12.092110000 Eastern Standard Time | TLSv1.3 | 104.18.32.47 -> 172.25.100.196 | Len:517 | New Session Ticket, New Session Ticket
Dec 16, 2025 19:31:12.092110000 Eastern Standard Time | HTTP2 | 104.18.32.47 -> 172.25.100.196 | Len:125 | SETTINGS[0], WINDOW_UPDATE[0], SETTINGS[0]
Dec 16, 2025 19:31:12.092335000 Eastern Standard Time | TCP | 172.25.100.196 -> 104.18.32.47 | Len:54 | 63020 → 443 [ACK] Seq=4211 Ack=1917 Win=65280 Len=0
Dec 16, 2025 19:31:12.093586000 Eastern Standard Time | TLSv1.3 | 172.25.100.196 -> 104.18.32.47 | Len:138 | End of Early Data, Finished
Dec 16, 2025 19:31:12.094234000 Eastern Standard Time | HTTP2 | 172.25.100.196 -> 104.18.32.47 | Len:85 | SETTINGS[0]
Dec 16, 2025 19:31:12.100048000 Eastern Standard Time | TCP | 104.18.32.47 -> 172.25.100.196 | Len:56 | 443 → 63020 [ACK] Seq=1917 Ack=4326 Win=131072 Len=0
Dec 16, 2025 19:31:12.296483000 Eastern Standard Time | TLSv1.3 | 104.18.32.47 -> 172.25.100.196 | Len:63 | [TLS segment of a reassembled PDU]
Dec 16, 2025 19:31:12.296483000 Eastern Standard Time | TLSv1.3 | 104.18.32.47 -> 172.25.100.196 | Len:63 | [TLS segment of a reassembled PDU]
Dec 16, 2025 19:31:12.296483000 Eastern Standard Time | TLSv1.3 | 104.18.32.47 -> 172.25.100.196 | Len:63 | [TLS segment of a reassembled PDU]
Dec 16, 2025 19:31:12.296483000 Eastern Standard Time | TLSv1.3 | 104.18.32.47 -> 172.25.100.196 | Len:63 | [TLS segment of a reassembled PDU]
Dec 16, 2025 19:31:12.296483000 Eastern Standard Time | HTTP2 | 104.18.32.47 -> 172.25.100.196 | Len:452 | HEADERS[3]: 200 OK
Dec 16, 2025 19:31:12.296483000 Eastern Standard Time | HTTP2 | 104.18.32.47 -> 172.25.100.196 | Len:1296 | DATA[3]
Dec 16, 2025 19:31:12.296483000 Eastern Standard Time | TLSv1.3 | 104.18.32.47 -> 172.25.100.196 | Len:63 | [TLS segment of a reassembled PDU]
Dec 16, 2025 19:31:12.296483000 Eastern Standard Time | TLSv1.3 | 104.18.32.47 -> 172.25.100.196 | Len:63 | [TLS segment of a reassembled PDU]
Dec 16, 2025 19:31:12.296483000 Eastern Standard Time | TLSv1.3 | 104.18.32.47 -> 172.25.100.196 | Len:63 | [TLS segment of a reassembled PDU]
Dec 16, 2025 19:31:12.296483000 Eastern Standard Time | TLSv1.3 | 104.18.32.47 -> 172.25.100.196 | Len:63 | [TLS segment of a reassembled PDU]
Dec 16, 2025 19:31:12.296483000 Eastern Standard Time | HTTP2 | 104.18.32.47 -> 172.25.100.196 | Len:191 | DATA[3]
Dec 16, 2025 19:31:12.297442000 Eastern Standard Time | TCP | 172.25.100.196 -> 104.18.32.47 | Len:54 | 63020 → 443 [ACK] Seq=4326 Ack=3308 Win=65280 Len=0
Dec 16, 2025 19:31:12.297539000 Eastern Standard Time | TCP | 172.25.100.196 -> 104.18.32.47 | Len:54 | 63020 → 443 [ACK] Seq=4326 Ack=4699 Win=65280 Len=0
Dec 16, 2025 19:31:12.297587000 Eastern Standard Time | TCP | 172.25.100.196 -> 104.18.32.47 | Len:54 | 63020 → 443 [ACK] Seq=4326 Ack=6090 Win=65280 Len=0
Dec 16, 2025 19:31:12.297632000 Eastern Standard Time | TCP | 172.25.100.196 -> 104.18.32.47 | Len:54 | 63020 → 443 [ACK] Seq=4326 Ack=7481 Win=65280 Len=0
Dec 16, 2025 19:31:12.297681000 Eastern Standard Time | TCP | 172.25.100.196 -> 104.18.32.47 | Len:54 | 63020 → 443 [ACK] Seq=4326 Ack=9121 Win=65280 Len=0
Dec 16, 2025 19:31:12.297768000 Eastern Standard Time | TCP | 172.25.100.196 -> 104.18.32.47 | Len:54 | 63020 → 443 [ACK] Seq=4326 Ack=10512 Win=65280 Len=0
Dec 16, 2025 19:31:12.297816000 Eastern Standard Time | TCP | 172.25.100.196 -> 104.18.32.47 | Len:54 | 63020 → 443 [ACK] Seq=4326 Ack=11903 Win=65280 Len=0
Dec 16, 2025 19:31:12.297865000 Eastern Standard Time | TCP | 172.25.100.196 -> 104.18.32.47 | Len:54 | 63020 → 443 [ACK] Seq=4326 Ack=13294 Win=65280 Len=0
Dec 16, 2025 19:31:12.297909000 Eastern Standard Time | TCP | 172.25.100.196 -> 104.18.32.47 | Len:54 | 63020 → 443 [ACK] Seq=4326 Ack=14685 Win=65280 Len=0
Dec 16, 2025 19:31:12.302781000 Eastern Standard Time | TLSv1.3 | 104.18.32.47 -> 172.25.100.196 | Len:63 | [TLS segment of a reassembled PDU]
Dec 16, 2025 19:31:12.302781000 Eastern Standard Time | TLSv1.3 | 104.18.32.47 -> 172.25.100.196 | Len:63 | [TLS segment of a reassembled PDU]
Dec 16, 2025 19:31:12.302781000 Eastern Standard Time | TLSv1.3 | 104.18.32.47 -> 172.25.100.196 | Len:1436 | [TLS segment of a reassembled PDU]
Dec 16, 2025 19:31:12.302781000 Eastern Standard Time | TLSv1.3 | 104.18.32.47 -> 172.25.100.196 | Len:72 | [TLS segment of a reassembled PDU]
Dec 16, 2025 19:31:12.302781000 Eastern Standard Time | TLSv1.3 | 104.18.32.47 -> 172.25.100.196 | Len:63 | [TLS segment of a reassembled PDU]
Dec 16, 2025 19:31:12.303342000 Eastern Standard Time | TCP | 172.25.100.196 -> 104.18.32.47 | Len:54 | 63020 → 443 [ACK] Seq=4326 Ack=16204 Win=65280 Len=0
Dec 16, 2025 19:31:12.303427000 Eastern Standard Time | TCP | 172.25.100.196 -> 104.18.32.47 | Len:54 | 63020 → 443 [ACK] Seq=4326 Ack=17595 Win=65280 Len=0
Dec 16, 2025 19:31:12.303483000 Eastern Standard Time | TCP | 172.25.100.196 -> 104.18.32.47 | Len:54 | 63020 → 443 [ACK] Seq=4326 Ack=20368 Win=65280 Len=0
