LLM_IP CLAUDE 160.79.104.10

Capturing on 'Wi-Fi' IP (tos 0x0, ttl , id , offset 0, flags [], proto Proto (), length )
    . > .: Flags [.], cksum , , , , length 
00:13:45.244674 IP (tos 0x00, ttl 128, id 0x13b7, offset 0, flags [0x02], proto TCP (6), length 91)
    192.168.4.68.61620 > 52.112.86.213.443: Flags [.], cksum 0x507f, seq 1, ack 1, win 253, length 51
00:13:45.325172 IP (tos 0x00, ttl 107, id 0xb0a0, offset 0, flags [0x02], proto TCP (6), length 80)
    52.112.86.213.443 > 192.168.4.68.61620: Flags [.], cksum 0x4f44, seq 1, ack 52, win 16385, length 40
00:13:45.367647 IP (tos 0x00, ttl 255, id 0x50cc, offset 0, flags [0x00], proto Proto (17), length 658)
    192.168.4.43. > 224.0.0.251.: Flags [.], cksum , , , , length 
00:13:45.378360 IP (tos 0x00, ttl 128, id 0x13b8, offset 0, flags [0x02], proto TCP (6), length 40)
    192.168.4.68.61620 > 52.112.86.213.443: Flags [.], cksum 0x504c, seq 52, ack 41, win 252, length 0
00:13:45.406739 IP (tos 0x00, ttl 128, id 0x781f, offset 0, flags [0x02], proto TCP (6), length 91)
    192.168.4.68.60463 > 13.91.58.244.443: Flags [.], cksum 0x0d89, seq 1, ack 1, win 254, length 51
00:13:45.480953 IP (tos 0x00, ttl 107, id 0x7d89, offset 0, flags [0x02], proto TCP (6), length 80)
    13.91.58.244.443 > 192.168.4.68.60463: Flags [.], cksum 0x5fdc, seq 1, ack 52, win 16382, length 40
00:13:45.526205 IP (tos 0x00, ttl 128, id 0x7820, offset 0, flags [0x02], proto TCP (6), length 40)
    192.168.4.68.60463 > 13.91.58.244.443: Flags [.], cksum 0x0d56, seq 52, ack 41, win 254, length 0
00:13:46.249807 IP (tos 0x00, ttl 128, id 0x4146, offset 0, flags [0x02], proto TCP (6), length 150)
    192.168.4.68.53103 > 192.168.4.43.8009: Flags [.], cksum 0x8a48, seq 1, ack 1, win 254, length 110
00:13:46.258724 IP (tos 0x00, ttl 64, id 0x6238, offset 0, flags [0x00], proto TCP (6), length 40)
    192.168.4.43.8009 > 192.168.4.68.53103: Flags [.], cksum 0xc634, seq 1, ack 111, win 4095, length 0
00:13:46.261608 IP (tos 0x00, ttl 64, id 0x9068, offset 0, flags [0x00], proto TCP (6), length 150)
    192.168.4.43.8009 > 192.168.4.68.53103: Flags [.], cksum 0xe0aa, seq 1, ack 111, win 4096, length 110
00:13:46.264656 IP (tos 0x00, ttl 116, id 0xf847, offset 0, flags [0x00], proto TCP (6), length 67)
    34.120.52.64.443 > 192.168.4.68.57073: Flags [.], cksum 0x3e2b, seq 1, ack 1, win 1043, length 27
00:13:46.265706 IP (tos 0x00, ttl 128, id 0x1838, offset 0, flags [0x02], proto TCP (6), length 71)
    192.168.4.68.57073 > 34.120.52.64.443: Flags [.], cksum 0x1bde, seq 1, ack 28, win 254, length 31
00:13:46.273759 IP (tos 0x00, ttl 116, id 0xf848, offset 0, flags [0x00], proto TCP (6), length 40)
    34.120.52.64.443 > 192.168.4.68.57073: Flags [.], cksum 0x070d, seq 28, ack 32, win 1043, length 0
00:13:46.297414 IP (tos 0x00, ttl 128, id 0xd8d6, offset 0, flags [0x02], proto TCP (6), length 41)
    192.168.4.68.59807 > 64.233.180.102.443: Flags [.], cksum 0xba57, seq 1, ack 1, win 255, length 1
00:13:46.305001 IP (tos 0x00, ttl 116, id 0x18ca, offset 0, flags [0x00], proto TCP (6), length 52)
    64.233.180.102.443 > 192.168.4.68.59807: Flags [.], cksum 0xeec7, seq 1, ack 2, win 1035, length 0
00:13:46.306852 IP (tos 0x00, ttl 128, id 0x4147, offset 0, flags [0x02], proto TCP (6), length 40)
    192.168.4.68.53103 > 192.168.4.43.8009: Flags [.], cksum 0x89da, seq 111, ack 111, win 253, length 0
00:13:46.477070 IP (tos 0x02, ttl 128, id 0x6238, offset 0, flags [0x02], proto Proto (17), length 1280)
    192.168.4.68. > 172.253.62.113.: Flags [.], cksum , , , , length 
00:13:46.477173 IP (tos 0x02, ttl 128, id 0x6239, offset 0, flags [0x02], proto Proto (17), length 1280)
    192.168.4.68. > 172.253.62.113.: Flags [.], cksum , , , , length 
00:13:46.477215 IP (tos 0x02, ttl 128, id 0x623a, offset 0, flags [0x02], proto Proto (17), length 737)
    192.168.4.68. > 172.253.62.113.: Flags [.], cksum , , , , length 
00:13:46.485868 IP (tos 0x00, ttl 128, id 0x6586, offset 0, flags [0x00], proto Proto (17), length 61)
    192.168.4.68. > 192.168.4.72.: Flags [.], cksum , , , , length 
00:13:46.486061 IP (tos 0x00, ttl 128, id 0x6587, offset 0, flags [0x00], proto Proto (17), length 61)
    192.168.4.68. > 192.168.4.72.: Flags [.], cksum , , , , length 
00:13:46.490078 IP (tos 0x00, ttl 54, id 0x0000, offset 0, flags [0x02], proto Proto (17), length 66)
    172.253.62.113. > 192.168.4.68.: Flags [.], cksum , , , , length 
00:13:46.490615 IP (tos 0x02, ttl 128, id 0x623b, offset 0, flags [0x02], proto Proto (17), length 60)
    192.168.4.68. > 172.253.62.113.: Flags [.], cksum , , , , length 
00:13:46.492818 IP (tos 0x00, ttl 64, id 0xfdbc, offset 0, flags [0x02], proto Proto (17), length 77)
    192.168.4.72. > 192.168.4.68.: Flags [.], cksum , , , , length 
00:13:46.494846 IP (tos 0x00, ttl 64, id 0xfdbd, offset 0, flags [0x02], proto Proto (17), length 89)
    192.168.4.72. > 192.168.4.68.: Flags [.], cksum , , , , length 
00:13:46.517308 IP (tos 0x00, ttl 128, id 0xcefb, offset 0, flags [0x02], proto TCP (6), length 190)
    192.168.4.68.63217 > 34.120.208.123.443: Flags [.], cksum 0xb890, seq 1, ack 1, win 253, length 150
00:13:46.517446 IP (tos 0x00, ttl 128, id 0xcefc, offset 0, flags [0x02], proto TCP (6), length 1452)
    192.168.4.68.63217 > 34.120.208.123.443: Flags [.], cksum 0xbd7e, seq 151, ack 1, win 253, length 1412
00:13:46.517446 IP (tos 0x00, ttl 128, id 0xcefd, offset 0, flags [0x02], proto TCP (6), length 64)
    192.168.4.68.63217 > 34.120.208.123.443: Flags [.], cksum 0xb812, seq 1563, ack 1, win 253, length 24
00:13:46.517607 IP (tos 0x00, ttl 128, id 0xcefe, offset 0, flags [0x02], proto TCP (6), length 314)
    192.168.4.68.63217 > 34.120.208.123.443: Flags [.], cksum 0xb90c, seq 1587, ack 1, win 253, length 274
00:13:46.525618 IP (tos 0x00, ttl 117, id 0x27b8, offset 0, flags [0x00], proto TCP (6), length 40)
    34.120.208.123.443 > 192.168.4.68.63217: Flags [.], cksum 0x73bf, seq 1, ack 151, win 1017, length 0
00:13:46.525618 IP (tos 0x00, ttl 117, id 0x27b9, offset 0, flags [0x00], proto TCP (6), length 40)
    34.120.208.123.443 > 192.168.4.68.63217: Flags [.], cksum 0x6e28, seq 1, ack 1587, win 1012, length 0
00:13:46.525618 IP (tos 0x00, ttl 117, id 0x27ba, offset 0, flags [0x00], proto TCP (6), length 40)
    34.120.208.123.443 > 192.168.4.68.63217: Flags [.], cksum 0x6d17, seq 1, ack 1861, win 1011, length 0
00:13:46.563558 IP (tos 0x00, ttl 54, id 0x0000, offset 0, flags [0x02], proto Proto (17), length 712)
    172.253.62.113. > 192.168.4.68.: Flags [.], cksum , , , , length 
00:13:46.563558 IP (tos 0x00, ttl 54, id 0x0000, offset 0, flags [0x02], proto Proto (17), length 88)
    172.253.62.113. > 192.168.4.68.: Flags [.], cksum , , , , length 
00:13:46.563558 IP (tos 0x00, ttl 54, id 0x0000, offset 0, flags [0x02], proto Proto (17), length 234)
    172.253.62.113. > 192.168.4.68.: Flags [.], cksum , , , , length 
00:13:46.564223 IP (tos 0x02, ttl 128, id 0x623c, offset 0, flags [0x02], proto Proto (17), length 66)
    192.168.4.68. > 172.253.62.113.: Flags [.], cksum , , , , length 
00:13:46.575379 IP (tos 0x00, ttl 54, id 0x0000, offset 0, flags [0x02], proto Proto (17), length 61)
    172.253.62.113. > 192.168.4.68.: Flags [.], cksum , , , , length 
00:13:46.609688 IP (tos 0x00, ttl 117, id 0x27bb, offset 0, flags [0x00], proto TCP (6), length 108)
    34.120.208.123.443 > 192.168.4.68.63217: Flags [.], cksum 0x34a7, seq 1, ack 1861, win 1011, length 68
00:13:46.609688 IP (tos 0x00, ttl 117, id 0x27bc, offset 0, flags [0x00], proto TCP (6), length 233)
    34.120.208.123.443 > 192.168.4.68.63217: Flags [.], cksum 0x2444, seq 69, ack 1861, win 1011, length 193
00:13:46.609688 IP (tos 0x00, ttl 117, id 0x27bd, offset 0, flags [0x00], proto TCP (6), length 79)
    34.120.208.123.443 > 192.168.4.68.63217: Flags [.], cksum 0xdd32, seq 262, ack 1861, win 1011, length 39
00:13:46.609959 IP (tos 0x00, ttl 128, id 0xceff, offset 0, flags [0x02], proto TCP (6), length 40)
    192.168.4.68.63217 > 34.120.208.123.443: Flags [.], cksum 0xb7fa, seq 1861, ack 262, win 252, length 0
00:13:46.610230 IP (tos 0x00, ttl 128, id 0xcf00, offset 0, flags [0x02], proto TCP (6), length 79)
    192.168.4.68.63217 > 34.120.208.123.443: Flags [.], cksum 0xb821, seq 1861, ack 301, win 252, length 39
00:13:46.618793 IP (tos 0x00, ttl 117, id 0x27be, offset 0, flags [0x00], proto TCP (6), length 40)
    34.120.208.123.443 > 192.168.4.68.63217: Flags [.], cksum 0x6bc4, seq 301, ack 1900, win 1011, length 0
00:13:46.618894 IP (tos 0x00, ttl 128, id 0xcf01, offset 0, flags [0x02], proto TCP (6), length 166)
    192.168.4.68.63217 > 34.120.208.123.443: Flags [.], cksum 0xb878, seq 1900, ack 301, win 252, length 126
00:13:46.618980 IP (tos 0x00, ttl 128, id 0xcf02, offset 0, flags [0x02], proto TCP (6), length 1452)
    192.168.4.68.63217 > 34.120.208.123.443: Flags [.], cksum 0xbd7e, seq 2026, ack 301, win 252, length 1412
00:13:46.618980 IP (tos 0x00, ttl 128, id 0xcf03, offset 0, flags [0x02], proto TCP (6), length 64)
    192.168.4.68.63217 > 34.120.208.123.443: Flags [.], cksum 0xb812, seq 3438, ack 301, win 252, length 24
00:13:46.619139 IP (tos 0x00, ttl 128, id 0xcf04, offset 0, flags [0x02], proto TCP (6), length 219)
    192.168.4.68.63217 > 34.120.208.123.443: Flags [.], cksum 0xb8ad, seq 3462, ack 301, win 252, length 179
00:13:46.625235 IP (tos 0x00, ttl 117, id 0x27bf, offset 0, flags [0x00], proto TCP (6), length 40)
    34.120.208.123.443 > 192.168.4.68.63217: Flags [.], cksum 0x6b46, seq 301, ack 2026, win 1011, length 0
00:13:46.625235 IP (tos 0x00, ttl 117, id 0x27c0, offset 0, flags [0x00], proto TCP (6), length 40)
    34.120.208.123.443 > 192.168.4.68.63217: Flags [.], cksum 0x65af, seq 301, ack 3462, win 1006, length 0
00:13:46.625235 IP (tos 0x00, ttl 117, id 0x27c1, offset 0, flags [0x00], proto TCP (6), length 40)
    34.120.208.123.443 > 192.168.4.68.63217: Flags [.], cksum 0x64fc, seq 301, ack 3641, win 1006, length 0
00:13:46.722865 IP (tos 0x00, ttl 128, id 0x6588, offset 0, flags [0x00], proto Proto (17), length 65)
    192.168.4.68. > 192.168.4.72.: Flags [.], cksum , , , , length 
00:13:46.723035 IP (tos 0x00, ttl 128, id 0x6589, offset 0, flags [0x00], proto Proto (17), length 65)
    192.168.4.68. > 192.168.4.72.: Flags [.], cksum , , , , length 
00:13:46.728029 IP (tos 0x00, ttl 64, id 0xfde2, offset 0, flags [0x02], proto Proto (17), length 81)
    192.168.4.72. > 192.168.4.68.: Flags [.], cksum , , , , length 
00:13:46.729925 IP (tos 0x00, ttl 64, id 0xfde3, offset 0, flags [0x02], proto Proto (17), length 93)
    192.168.4.72. > 192.168.4.68.: Flags [.], cksum , , , , length 
00:13:46.737922 IP (tos 0x00, ttl 128, id 0x29fd, offset 0, flags [0x02], proto Proto (17), length 1280)
    192.168.4.68. > 142.251.16.99.: Flags [.], cksum , , , , length 
00:13:46.738080 IP (tos 0x00, ttl 128, id 0x29fe, offset 0, flags [0x02], proto Proto (17), length 1280)
    192.168.4.68. > 142.251.16.99.: Flags [.], cksum , , , , length 
00:13:46.738162 IP (tos 0x00, ttl 128, id 0x29ff, offset 0, flags [0x02], proto Proto (17), length 1280)
    192.168.4.68. > 142.251.16.99.: Flags [.], cksum , , , , length 
00:13:46.745715 IP (tos 0x02, ttl 128, id 0xba71, offset 0, flags [0x02], proto Proto (17), length 1280)
    192.168.4.68. > 172.253.115.101.: Flags [.], cksum , , , , length 
00:13:46.745718 IP (tos 0x00, ttl 54, id 0x0000, offset 0, flags [0x02], proto Proto (17), length 71)
    142.251.16.99. > 192.168.4.68.: Flags [.], cksum , , , , length 
00:13:46.745718 IP (tos 0x00, ttl 54, id 0x0000, offset 0, flags [0x02], proto Proto (17), length 71)
    142.251.16.99. > 192.168.4.68.: Flags [.], cksum , , , , length 
00:13:46.745832 IP (tos 0x02, ttl 128, id 0xba72, offset 0, flags [0x02], proto Proto (17), length 1280)
    192.168.4.68. > 172.253.115.101.: Flags [.], cksum , , , , length 
00:13:46.745884 IP (tos 0x02, ttl 128, id 0xba73, offset 0, flags [0x02], proto Proto (17), length 629)
    192.168.4.68. > 172.253.115.101.: Flags [.], cksum , , , , length 
00:13:46.760049 IP (tos 0x00, ttl 54, id 0x0000, offset 0, flags [0x02], proto Proto (17), length 1280)
    142.251.16.99. > 192.168.4.68.: Flags [.], cksum , , , , length 
00:13:46.760049 IP (tos 0x00, ttl 54, id 0x0000, offset 0, flags [0x02], proto Proto (17), length 1280)
    142.251.16.99. > 192.168.4.68.: Flags [.], cksum , , , , length 
00:13:46.760049 IP (tos 0x00, ttl 54, id 0x0000, offset 0, flags [0x02], proto Proto (17), length 1280)
    142.251.16.99. > 192.168.4.68.: Flags [.], cksum , , , , length 
00:13:46.760049 IP (tos 0x00, ttl 54, id 0x0000, offset 0, flags [0x02], proto Proto (17), length 342)
    142.251.16.99. > 192.168.4.68.: Flags [.], cksum , , , , length 
00:13:46.760049 IP (tos 0x00, ttl 54, id 0x0000, offset 0, flags [0x02], proto Proto (17), length 645)
    142.251.16.99. > 192.168.4.68.: Flags [.], cksum , , , , length 
00:13:46.760049 IP (tos 0x00, ttl 54, id 0x0000, offset 0, flags [0x02], proto Proto (17), length 61)
    172.253.115.101. > 192.168.4.68.: Flags [.], cksum , , , , length 
00:13:46.760049 IP (tos 0x00, ttl 117, id 0x27c2, offset 0, flags [0x00], proto TCP (6), length 108)
    34.120.208.123.443 > 192.168.4.68.63217: Flags [.], cksum 0xc695, seq 301, ack 3641, win 1006, length 68
00:13:46.760049 IP (tos 0x00, ttl 117, id 0x27c3, offset 0, flags [0x00], proto TCP (6), length 132)
    34.120.208.123.443 > 192.168.4.68.63217: Flags [.], cksum 0xdb33, seq 369, ack 3641, win 1006, length 92
00:13:46.760049 IP (tos 0x00, ttl 117, id 0x27c4, offset 0, flags [0x00], proto TCP (6), length 79)
    34.120.208.123.443 > 192.168.4.68.63217: Flags [.], cksum 0x97b2, seq 461, ack 3641, win 1006, length 39
00:13:46.760587 IP (tos 0x00, ttl 128, id 0xcf05, offset 0, flags [0x02], proto TCP (6), length 40)
    192.168.4.68.63217 > 34.120.208.123.443: Flags [.], cksum 0xb7fa, seq 3641, ack 461, win 251, length 0
00:13:46.760775 IP (tos 0x02, ttl 128, id 0xba74, offset 0, flags [0x02], proto Proto (17), length 59)
    192.168.4.68. > 172.253.115.101.: Flags [.], cksum , , , , length 
00:13:46.761047 IP (tos 0x00, ttl 128, id 0xcf06, offset 0, flags [0x02], proto TCP (6), length 79)
    192.168.4.68.63217 > 34.120.208.123.443: Flags [.], cksum 0xb821, seq 3641, ack 500, win 251, length 39
00:13:46.763189 IP (tos 0x00, ttl 128, id 0x2a00, offset 0, flags [0x02], proto Proto (17), length 186)
    192.168.4.68. > 142.251.16.99.: Flags [.], cksum , , , , length 
00:13:46.766276 IP (tos 0x00, ttl 128, id 0xcf07, offset 0, flags [0x02], proto TCP (6), length 161)
    192.168.4.68.63217 > 34.120.208.123.443: Flags [.], cksum 0xb873, seq 3680, ack 500, win 251, length 121
00:13:46.766353 IP (tos 0x00, ttl 128, id 0xcf08, offset 0, flags [0x02], proto TCP (6), length 1452)
    192.168.4.68.63217 > 34.120.208.123.443: Flags [.], cksum 0xbd7e, seq 3801, ack 500, win 251, length 1412
00:13:46.766353 IP (tos 0x00, ttl 128, id 0xcf09, offset 0, flags [0x02], proto TCP (6), length 64)
    192.168.4.68.63217 > 34.120.208.123.443: Flags [.], cksum 0xb812, seq 5213, ack 500, win 251, length 24
00:13:46.766434 IP (tos 0x00, ttl 128, id 0xcf0a, offset 0, flags [0x02], proto TCP (6), length 219)
    192.168.4.68.63217 > 34.120.208.123.443: Flags [.], cksum 0xb8ad, seq 5237, ack 500, win 251, length 179
00:13:46.769134 IP (tos 0x00, ttl 117, id 0x27c5, offset 0, flags [0x00], proto TCP (6), length 40)
    34.120.208.123.443 > 192.168.4.68.63217: Flags [.], cksum 0x640e, seq 500, ack 3680, win 1006, length 0
00:13:46.770842 IP (tos 0x00, ttl 128, id 0x2a01, offset 0, flags [0x02], proto Proto (17), length 1280)
    192.168.4.68. > 142.251.16.99.: Flags [.], cksum , , , , length 
00:13:46.770960 IP (tos 0x00, ttl 128, id 0x2a02, offset 0, flags [0x02], proto Proto (17), length 1280)
    192.168.4.68. > 142.251.16.99.: Flags [.], cksum , , , , length 
00:13:46.771028 IP (tos 0x00, ttl 128, id 0x2a03, offset 0, flags [0x02], proto Proto (17), length 1280)
    192.168.4.68. > 142.251.16.99.: Flags [.], cksum , , , , length 
00:13:46.771769 IP (tos 0x00, ttl 128, id 0x2a04, offset 0, flags [0x02], proto Proto (17), length 225)
    192.168.4.68. > 142.251.16.99.: Flags [.], cksum , , , , length 
00:13:46.773274 IP (tos 0x00, ttl 117, id 0x27c6, offset 0, flags [0x00], proto TCP (6), length 40)
    34.120.208.123.443 > 192.168.4.68.63217: Flags [.], cksum 0x6395, seq 500, ack 3801, win 1006, length 0
00:13:46.773274 IP (tos 0x00, ttl 117, id 0x27c7, offset 0, flags [0x00], proto TCP (6), length 40)
    34.120.208.123.443 > 192.168.4.68.63217: Flags [.], cksum 0x5dfe, seq 500, ack 5237, win 1001, length 0
00:13:46.773274 IP (tos 0x00, ttl 117, id 0x27c8, offset 0, flags [0x00], proto TCP (6), length 40)
    34.120.208.123.443 > 192.168.4.68.63217: Flags [.], cksum 0x5d4b, seq 500, ack 5416, win 1001, length 0
00:13:46.773274 IP (tos 0x00, ttl 54, id 0x0000, offset 0, flags [0x02], proto Proto (17), length 158)
    142.251.16.99. > 192.168.4.68.: Flags [.], cksum , , , , length 
00:13:46.773770 IP (tos 0x02, ttl 128, id 0x2a05, offset 0, flags [0x02], proto Proto (17), length 59)
    192.168.4.68. > 142.251.16.99.: Flags [.], cksum , , , , length 
00:13:46.778832 IP (tos 0x00, ttl 54, id 0x0000, offset 0, flags [0x02], proto Proto (17), length 71)
    142.251.16.99. > 192.168.4.68.: Flags [.], cksum , , , , length 
00:13:46.778832 IP (tos 0x00, ttl 54, id 0x0000, offset 0, flags [0x02], proto Proto (17), length 71)
    142.251.16.99. > 192.168.4.68.: Flags [.], cksum , , , , length 
00:13:46.778832 IP (tos 0x00, ttl 54, id 0x0000, offset 0, flags [0x02], proto Proto (17), length 1280)
    142.251.16.99. > 192.168.4.68.: Flags [.], cksum , , , , length 
00:13:46.778832 IP (tos 0x00, ttl 54, id 0x0000, offset 0, flags [0x02], proto Proto (17), length 1280)
    142.251.16.99. > 192.168.4.68.: Flags [.], cksum , , , , length 
00:13:46.778832 IP (tos 0x00, ttl 54, id 0x0000, offset 0, flags [0x02], proto Proto (17), length 58)
    172.253.115.101. > 192.168.4.68.: Flags [.], cksum , , , , length 
00:13:46.781069 IP (tos 0x00, ttl 54, id 0x0000, offset 0, flags [0x02], proto Proto (17), length 1280)
    142.251.16.99. > 192.168.4.68.: Flags [.], cksum , , , , length 
00:13:46.781069 IP (tos 0x00, ttl 54, id 0x0000, offset 0, flags [0x02], proto Proto (17), length 339)
    142.251.16.99. > 192.168.4.68.: Flags [.], cksum , , , , length 
00:13:46.781069 IP (tos 0x00, ttl 54, id 0x0000, offset 0, flags [0x02], proto Proto (17), length 645)
    142.251.16.99. > 192.168.4.68.: Flags [.], cksum , , , , length 
00:13:46.781069 IP (tos 0x00, ttl 54, id 0x0000, offset 0, flags [0x02], proto Proto (17), length 56)
    142.251.16.99. > 192.168.4.68.: Flags [.], cksum , , , , length 
00:13:46.781069 IP (tos 0x00, ttl 54, id 0x0000, offset 0, flags [0x02], proto Proto (17), length 703)
    172.253.115.101. > 192.168.4.68.: Flags [.], cksum , , , , length 
00:13:46.781069 IP (tos 0x00, ttl 54, id 0x0000, offset 0, flags [0x02], proto Proto (17), length 108)
    172.253.115.101. > 192.168.4.68.: Flags [.], cksum , , , , length 
00:13:46.783090 IP (tos 0x00, ttl 128, id 0x2a06, offset 0, flags [0x02], proto Proto (17), length 185)
    192.168.4.68. > 142.251.16.99.: Flags [.], cksum , , , , length 
00:13:46.783750 IP (tos 0x02, ttl 128, id 0xba75, offset 0, flags [0x02], proto Proto (17), length 64)
    192.168.4.68. > 172.253.115.101.: Flags [.], cksum , , , , length 
00:13:46.791037 IP (tos 0x00, ttl 54, id 0x0000, offset 0, flags [0x02], proto Proto (17), length 151)
    142.251.16.99. > 192.168.4.68.: Flags [.], cksum , , , , length 
00:13:46.801384 IP (tos 0x00, ttl 54, id 0x0000, offset 0, flags [0x02], proto Proto (17), length 1276)
    142.251.16.99. > 192.168.4.68.: Flags [.], cksum , , , , length 
00:13:46.801384 IP (tos 0x00, ttl 54, id 0x0000, offset 0, flags [0x02], proto Proto (17), length 225)
    142.251.16.99. > 192.168.4.68.: Flags [.], cksum , , , , length 
00:13:46.802190 IP (tos 0x02, ttl 128, id 0x2a07, offset 0, flags [0x02], proto Proto (17), length 64)
    192.168.4.68. > 142.251.16.99.: Flags [.], cksum , , , , length 
00:13:46.803833 IP (tos 0x00, ttl 54, id 0x0000, offset 0, flags [0x02], proto Proto (17), length 56)
    142.251.16.99. > 192.168.4.68.: Flags [.], cksum , , , , length 
00:13:46.803833 IP (tos 0x00, ttl 54, id 0x0000, offset 0, flags [0x02], proto Proto (17), length 114)
    142.251.16.99. > 192.168.4.68.: Flags [.], cksum , , , , length 
00:13:46.804251 IP (tos 0x02, ttl 128, id 0x2a08, offset 0, flags [0x02], proto Proto (17), length 59)
    192.168.4.68. > 142.251.16.99.: Flags [.], cksum , , , , length 
00:13:46.816041 IP (tos 0x00, ttl 128, id 0x658a, offset 0, flags [0x00], proto Proto (17), length 72)
    192.168.4.68. > 192.168.4.72.: Flags [.], cksum , , , , length 
00:13:46.816296 IP (tos 0x00, ttl 128, id 0x658b, offset 0, flags [0x00], proto Proto (17), length 72)
    192.168.4.68. > 192.168.4.72.: Flags [.], cksum , , , , length 
00:13:46.817555 IP (tos 0x00, ttl 54, id 0x0000, offset 0, flags [0x02], proto Proto (17), length 58)
    172.253.115.101. > 192.168.4.68.: Flags [.], cksum , , , , length 
00:13:46.823751 IP (tos 0x00, ttl 64, id 0xfdf4, offset 0, flags [0x02], proto Proto (17), length 184)
    192.168.4.72. > 192.168.4.68.: Flags [.], cksum , , , , length 
00:13:46.829496 IP (tos 0x00, ttl 64, id 0xfdf5, offset 0, flags [0x02], proto Proto (17), length 168)
    192.168.4.72. > 192.168.4.68.: Flags [.], cksum , , , , length 
00:13:46.834681 IP (tos 0x00, ttl 54, id 0x0000, offset 0, flags [0x02], proto Proto (17), length 58)
    142.251.16.99. > 192.168.4.68.: Flags [.], cksum , , , , length 
00:13:46.893209 IP (tos 0x02, ttl 128, id 0x2a09, offset 0, flags [0x02], proto Proto (17), length 215)
    192.168.4.68. > 142.251.16.99.: Flags [.], cksum , , , , length 
00:13:46.899630 IP (tos 0x00, ttl 117, id 0x27c9, offset 0, flags [0x00], proto TCP (6), length 108)
    34.120.208.123.443 > 192.168.4.68.63217: Flags [.], cksum 0x2d9c, seq 500, ack 5416, win 1001, length 68
00:13:46.899630 IP (tos 0x00, ttl 117, id 0x27ca, offset 0, flags [0x00], proto TCP (6), length 140)
    34.120.208.123.443 > 192.168.4.68.63217: Flags [.], cksum 0x6df7, seq 568, ack 5416, win 1001, length 100
00:13:46.899630 IP (tos 0x00, ttl 117, id 0x27cb, offset 0, flags [0x00], proto TCP (6), length 79)
    34.120.208.123.443 > 192.168.4.68.63217: Flags [.], cksum 0x6c38, seq 668, ack 5416, win 1001, length 39
00:13:46.899914 IP (tos 0x00, ttl 128, id 0xcf0b, offset 0, flags [0x02], proto TCP (6), length 40)
    192.168.4.68.63217 > 34.120.208.123.443: Flags [.], cksum 0xb7fa, seq 5416, ack 668, win 251, length 0
00:13:46.900288 IP (tos 0x00, ttl 128, id 0xcf0c, offset 0, flags [0x02], proto TCP (6), length 79)
    192.168.4.68.63217 > 34.120.208.123.443: Flags [.], cksum 0xb821, seq 5416, ack 707, win 251, length 39
00:13:46.906718 IP (tos 0x00, ttl 117, id 0x27cc, offset 0, flags [0x00], proto TCP (6), length 40)
    34.120.208.123.443 > 192.168.4.68.63217: Flags [.], cksum 0x5c55, seq 707, ack 5455, win 1001, length 0
00:13:46.925900 IP (tos 0x00, ttl 54, id 0x0000, offset 0, flags [0x02], proto Proto (17), length 58)
    142.251.16.99. > 192.168.4.68.: Flags [.], cksum , , , , length 
00:13:46.934973 IP (tos 0x00, ttl 54, id 0x0000, offset 0, flags [0x02], proto Proto (17), length 1217)
    142.251.16.99. > 192.168.4.68.: Flags [.], cksum , , , , length 
00:13:46.935767 IP (tos 0x02, ttl 128, id 0x2a0a, offset 0, flags [0x02], proto Proto (17), length 64)
    192.168.4.68. > 142.251.16.99.: Flags [.], cksum , , , , length 
00:13:46.937376 IP (tos 0x00, ttl 54, id 0x0000, offset 0, flags [0x02], proto Proto (17), length 56)
    142.251.16.99. > 192.168.4.68.: Flags [.], cksum , , , , length 
00:13:46.937376 IP (tos 0x00, ttl 54, id 0x0000, offset 0, flags [0x02], proto Proto (17), length 295)
    142.251.16.99. > 192.168.4.68.: Flags [.], cksum , , , , length 
00:13:46.937901 IP (tos 0x02, ttl 128, id 0x2a0b, offset 0, flags [0x02], proto Proto (17), length 59)
    192.168.4.68. > 142.251.16.99.: Flags [.], cksum , , , , length 
00:13:46.952615 IP (tos 0x00, ttl 128, id 0x7431, offset 0, flags [0x02], proto TCP (6), length 52)
    192.168.4.68.63245 > 142.250.31.138.443: Flags [.], cksum 0x7397, seq 0, ack 0, win 65535, length 0
00:13:46.959718 IP (tos 0x00, ttl 117, id 0x0000, offset 0, flags [0x02], proto TCP (6), length 52)
    142.250.31.138.443 > 192.168.4.68.63245: Flags [.], cksum 0xf6bd, seq 0, ack 1, win 65535, length 0
00:13:46.969575 IP (tos 0x00, ttl 54, id 0x0000, offset 0, flags [0x02], proto Proto (17), length 58)
    142.251.16.99. > 192.168.4.68.: Flags [.], cksum , , , , length 
00:13:47.070803 IP (tos 0x00, ttl 128, id 0xa580, offset 0, flags [0x02], proto TCP (6), length 41)
    192.168.4.68.49234 > 140.82.113.25.443: Flags [.], cksum 0xc273, seq 1, ack 1, win 254, length 1
00:13:47.082689 IP (tos 0x00, ttl 242, id 0x28a6, offset 0, flags [0x02], proto TCP (6), length 52)
    140.82.113.25.443 > 192.168.4.68.49234: Flags [.], cksum 0x888a, seq 1, ack 2, win 74, length 0
00:13:47.111755 IP (tos 0x02, ttl 128, id 0x2a0c, offset 0, flags [0x02], proto Proto (17), length 215)
    192.168.4.68. > 142.251.16.99.: Flags [.], cksum , , , , length 
00:13:47.145548 IP (tos 0x00, ttl 54, id 0x0000, offset 0, flags [0x02], proto Proto (17), length 58)
    142.251.16.99. > 192.168.4.68.: Flags [.], cksum , , , , length 
00:13:47.150043 IP (tos 0x00, ttl 54, id 0x0000, offset 0, flags [0x02], proto Proto (17), length 1276)
    142.251.16.99. > 192.168.4.68.: Flags [.], cksum , , , , length 
00:13:47.150043 IP (tos 0x00, ttl 54, id 0x0000, offset 0, flags [0x02], proto Proto (17), length 130)
    142.251.16.99. > 192.168.4.68.: Flags [.], cksum , , , , length 
00:13:47.150686 IP (tos 0x02, ttl 128, id 0x2a0d, offset 0, flags [0x02], proto Proto (17), length 64)
    192.168.4.68. > 142.251.16.99.: Flags [.], cksum , , , , length 
00:13:47.152441 IP (tos 0x00, ttl 54, id 0x0000, offset 0, flags [0x02], proto Proto (17), length 56)
    142.251.16.99. > 192.168.4.68.: Flags [.], cksum , , , , length 
00:13:47.152441 IP (tos 0x00, ttl 54, id 0x0000, offset 0, flags [0x02], proto Proto (17), length 227)
    142.251.16.99. > 192.168.4.68.: Flags [.], cksum , , , , length 
00:13:47.152837 IP (tos 0x02, ttl 128, id 0x2a0e, offset 0, flags [0x02], proto Proto (17), length 59)
    192.168.4.68. > 142.251.16.99.: Flags [.], cksum , , , , length 
00:13:47.164562 IP (tos 0x00, ttl 128, id 0x7432, offset 0, flags [0x02], proto TCP (6), length 52)
    192.168.4.68.63246 > 142.250.31.138.443: Flags [.], cksum 0x7397, seq 0, ack 0, win 65535, length 0
00:13:47.171436 IP (tos 0x00, ttl 116, id 0x0000, offset 0, flags [0x02], proto TCP (6), length 52)
    142.250.31.138.443 > 192.168.4.68.63246: Flags [.], cksum 0x7c0d, seq 0, ack 1, win 65535, length 0
00:13:47.171628 IP (tos 0x00, ttl 128, id 0x7433, offset 0, flags [0x02], proto TCP (6), length 40)
    192.168.4.68.63246 > 142.250.31.138.443: Flags [.], cksum 0x738b, seq 1, ack 1, win 255, length 0
00:13:47.172318 IP (tos 0x00, ttl 128, id 0x7434, offset 0, flags [0x02], proto TCP (6), length 1452)
    192.168.4.68.63246 > 142.250.31.138.443: Flags [.], cksum 0x790f, seq 1, ack 1, win 255, length 1412
00:13:47.172318 IP (tos 0x00, ttl 128, id 0x7435, offset 0, flags [0x02], proto TCP (6), length 1110)
    192.168.4.68.63246 > 142.250.31.138.443: Flags [.], cksum 0x77b9, seq 1413, ack 1, win 255, length 1070
00:13:47.172637 IP (tos 0x00, ttl 128, id 0x7436, offset 0, flags [0x02], proto TCP (6), length 46)
    192.168.4.68.63246 > 142.250.31.138.443: Flags [.], cksum 0x7391, seq 2483, ack 1, win 255, length 6
00:13:47.172848 IP (tos 0x00, ttl 128, id 0x7437, offset 0, flags [0x02], proto TCP (6), length 464)
    192.168.4.68.63246 > 142.250.31.138.443: Flags [.], cksum 0x7533, seq 2489, ack 1, win 255, length 424
00:13:47.179568 IP (tos 0x00, ttl 116, id 0xd898, offset 0, flags [0x00], proto TCP (6), length 40)
    142.250.31.138.443 > 192.168.4.68.63246: Flags [.], cksum 0xb314, seq 1, ack 1413, win 1048, length 0
00:13:47.179568 IP (tos 0x00, ttl 116, id 0xd899, offset 0, flags [0x00], proto TCP (6), length 40)
    142.250.31.138.443 > 192.168.4.68.63246: Flags [.], cksum 0xaeea, seq 1, ack 2483, win 1044, length 0
00:13:47.179568 IP (tos 0x00, ttl 116, id 0xd89a, offset 0, flags [0x00], proto TCP (6), length 40)
    142.250.31.138.443 > 192.168.4.68.63246: Flags [.], cksum 0xaee4, seq 1, ack 2489, win 1044, length 0
00:13:47.179568 IP (tos 0x00, ttl 116, id 0xd89b, offset 0, flags [0x00], proto TCP (6), length 40)
    142.250.31.138.443 > 192.168.4.68.63246: Flags [.], cksum 0xad3d, seq 1, ack 2913, win 1043, length 0
00:13:47.181162 IP (tos 0x00, ttl 116, id 0xd89c, offset 0, flags [0x00], proto TCP (6), length 1452)
    142.250.31.138.443 > 192.168.4.68.63246: Flags [.], cksum 0xf25d, seq 1, ack 2913, win 1043, length 1412
00:13:47.181162 IP (tos 0x00, ttl 116, id 0xd89d, offset 0, flags [0x00], proto TCP (6), length 486)
    142.250.31.138.443 > 192.168.4.68.63246: Flags [.], cksum 0x7aaa, seq 1413, ack 2913, win 1043, length 446
00:13:47.181162 IP (tos 0x00, ttl 116, id 0xd89e, offset 0, flags [0x00], proto TCP (6), length 102)
    142.250.31.138.443 > 192.168.4.68.63246: Flags [.], cksum 0xd743, seq 1859, ack 2913, win 1043, length 62
00:13:47.181162 IP (tos 0x00, ttl 116, id 0xd89f, offset 0, flags [0x00], proto TCP (6), length 71)
    142.250.31.138.443 > 192.168.4.68.63246: Flags [.], cksum 0xec9e, seq 1921, ack 2913, win 1043, length 31
00:13:47.181671 IP (tos 0x00, ttl 128, id 0x7438, offset 0, flags [0x02], proto TCP (6), length 40)
    192.168.4.68.63246 > 142.250.31.138.443: Flags [.], cksum 0x738b, seq 2913, ack 1859, win 255, length 0
00:13:47.181878 IP (tos 0x00, ttl 128, id 0x7439, offset 0, flags [0x02], proto TCP (6), length 40)
    192.168.4.68.63246 > 142.250.31.138.443: Flags [.], cksum 0x738b, seq 2913, ack 1952, win 255, length 0
00:13:47.182545 IP (tos 0x00, ttl 116, id 0xd8a0, offset 0, flags [0x00], proto TCP (6), length 571)
    142.250.31.138.443 > 192.168.4.68.63246: Flags [.], cksum 0xb459, seq 1952, ack 2913, win 1043, length 531
00:13:47.182545 IP (tos 0x00, ttl 116, id 0xd8a1, offset 0, flags [0x00], proto TCP (6), length 1452)
    142.250.31.138.443 > 192.168.4.68.63246: Flags [.], cksum 0x146b, seq 2483, ack 2913, win 1043, length 1412
00:13:47.182545 IP (tos 0x00, ttl 116, id 0xd8a2, offset 0, flags [0x00], proto TCP (6), length 1452)
    142.250.31.138.443 > 192.168.4.68.63246: Flags [.], cksum 0x5d8e, seq 3895, ack 2913, win 1043, length 1412
00:13:47.182545 IP (tos 0x00, ttl 116, id 0xd8a3, offset 0, flags [0x00], proto TCP (6), length 1452)
    142.250.31.138.443 > 192.168.4.68.63246: Flags [.], cksum 0x5a8a, seq 5307, ack 2913, win 1043, length 1412
00:13:47.182545 IP (tos 0x00, ttl 116, id 0xd8a4, offset 0, flags [0x00], proto TCP (6), length 1452)
    142.250.31.138.443 > 192.168.4.68.63246: Flags [.], cksum 0x65ec, seq 6719, ack 2913, win 1043, length 1412
00:13:47.182545 IP (tos 0x00, ttl 116, id 0xd8a5, offset 0, flags [0x00], proto TCP (6), length 183)
    142.250.31.138.443 > 192.168.4.68.63246: Flags [.], cksum 0x60e8, seq 8131, ack 2913, win 1043, length 143
00:13:47.182715 IP (tos 0x00, ttl 128, id 0x743a, offset 0, flags [0x02], proto TCP (6), length 124)
    192.168.4.68.63246 > 142.250.31.138.443: Flags [.], cksum 0x73df, seq 2913, ack 1952, win 255, length 84
00:13:47.182849 IP (tos 0x00, ttl 128, id 0x743b, offset 0, flags [0x02], proto TCP (6), length 40)
    192.168.4.68.63246 > 142.250.31.138.443: Flags [.], cksum 0x738b, seq 2997, ack 8131, win 255, length 0
00:13:47.182940 IP (tos 0x00, ttl 128, id 0x743c, offset 0, flags [0x02], proto TCP (6), length 40)
    192.168.4.68.63246 > 142.250.31.138.443: Flags [.], cksum 0x738b, seq 2997, ack 8274, win 255, length 0
00:13:47.183964 IP (tos 0x00, ttl 128, id 0x743d, offset 0, flags [0x02], proto TCP (6), length 71)
    192.168.4.68.63246 > 142.250.31.138.443: Flags [.], cksum 0x73aa, seq 2997, ack 8274, win 255, length 31
00:13:47.184457 IP (tos 0x00, ttl 54, id 0x0000, offset 0, flags [0x02], proto Proto (17), length 58)
    142.251.16.99. > 192.168.4.68.: Flags [.], cksum , , , , length 
00:13:47.184780 IP (tos 0x00, ttl 128, id 0x743e, offset 0, flags [0x02], proto TCP (6), length 79)
    192.168.4.68.63246 > 142.250.31.138.443: Flags [.], cksum 0x73b2, seq 3028, ack 8274, win 255, length 39
00:13:47.187704 IP (tos 0x00, ttl 128, id 0x743f, offset 0, flags [0x02], proto TCP (6), length 79)
    192.168.4.68.63246 > 142.250.31.138.443: Flags [.], cksum 0x73b2, seq 3067, ack 8274, win 255, length 39
00:13:47.187996 IP (tos 0x00, ttl 128, id 0x7440, offset 0, flags [0x02], proto Proto (17), length 1280)
    192.168.4.68. > 142.250.31.138.: Flags [.], cksum , , , , length 
00:13:47.188188 IP (tos 0x00, ttl 128, id 0x7441, offset 0, flags [0x02], proto Proto (17), length 1280)
    192.168.4.68. > 142.250.31.138.: Flags [.], cksum , , , , length 
00:13:47.188261 IP (tos 0x00, ttl 128, id 0x7442, offset 0, flags [0x02], proto Proto (17), length 1280)
    192.168.4.68. > 142.250.31.138.: Flags [.], cksum , , , , length 
00:13:47.189021 IP (tos 0x00, ttl 128, id 0x7443, offset 0, flags [0x02], proto TCP (6), length 64)
    192.168.4.68.63246 > 142.250.31.138.443: Flags [.], cksum 0x73a3, seq 3106, ack 8274, win 255, length 24
00:13:47.189060 IP (tos 0x00, ttl 128, id 0x7444, offset 0, flags [0x02], proto TCP (6), length 40)
    192.168.4.68.63246 > 142.250.31.138.443: Flags [.], cksum 0x738b, seq 3130, ack 8274, win 255, length 0
00:13:47.190677 IP (tos 0x00, ttl 116, id 0xd8a6, offset 0, flags [0x00], proto TCP (6), length 40)
    142.250.31.138.443 > 192.168.4.68.63246: Flags [.], cksum 0x8c79, seq 8274, ack 3028, win 1043, length 0
00:13:47.194432 IP (tos 0x00, ttl 116, id 0xd8a7, offset 0, flags [0x00], proto TCP (6), length 40)
    142.250.31.138.443 > 192.168.4.68.63246: Flags [.], cksum 0x8c2b, seq 8274, ack 3106, win 1043, length 0
00:13:47.194432 IP (tos 0x00, ttl 54, id 0x0000, offset 0, flags [0x02], proto Proto (17), length 71)
    142.250.31.138. > 192.168.4.68.: Flags [.], cksum , , , , length 
00:13:47.196540 IP (tos 0x00, ttl 116, id 0xd8a8, offset 0, flags [0x00], proto TCP (6), length 40)
    142.250.31.138.443 > 192.168.4.68.63246: Flags [.], cksum 0x8c11, seq 8274, ack 3131, win 1043, length 0
00:13:47.196540 IP (tos 0x00, ttl 54, id 0x0000, offset 0, flags [0x02], proto Proto (17), length 71)
    142.250.31.138. > 192.168.4.68.: Flags [.], cksum , , , , length 
00:13:47.196769 IP (tos 0x00, ttl 128, id 0x7445, offset 0, flags [0x02], proto TCP (6), length 40)
    192.168.4.68.63246 > 142.250.31.138.443: Flags [.], cksum 0x738b, seq 3131, ack 8275, win 255, length 0
00:13:47.198719 IP (tos 0x00, ttl 54, id 0x0000, offset 0, flags [0x02], proto Proto (17), length 1280)
    142.250.31.138. > 192.168.4.68.: Flags [.], cksum , , , , length 
00:13:47.198719 IP (tos 0x00, ttl 54, id 0x0000, offset 0, flags [0x02], proto Proto (17), length 1280)
    142.250.31.138. > 192.168.4.68.: Flags [.], cksum , , , , length 
00:13:47.198719 IP (tos 0x00, ttl 54, id 0x0000, offset 0, flags [0x02], proto Proto (17), length 1280)
    142.250.31.138. > 192.168.4.68.: Flags [.], cksum , , , , length 
00:13:47.198719 IP (tos 0x00, ttl 54, id 0x0000, offset 0, flags [0x02], proto Proto (17), length 346)
    142.250.31.138. > 192.168.4.68.: Flags [.], cksum , , , , length 
00:13:47.198719 IP (tos 0x00, ttl 54, id 0x0000, offset 0, flags [0x02], proto Proto (17), length 645)
    142.250.31.138. > 192.168.4.68.: Flags [.], cksum , , , , length 
00:13:47.200789 IP (tos 0x00, ttl 128, id 0x7446, offset 0, flags [0x02], proto Proto (17), length 257)
    192.168.4.68. > 142.250.31.138.: Flags [.], cksum , , , , length 
00:13:47.209084 IP (tos 0x00, ttl 54, id 0x0000, offset 0, flags [0x02], proto Proto (17), length 158)
    142.250.31.138. > 192.168.4.68.: Flags [.], cksum , , , , length 
00:13:47.209814 IP (tos 0x02, ttl 128, id 0x7447, offset 0, flags [0x02], proto Proto (17), length 59)
    192.168.4.68. > 142.250.31.138.: Flags [.], cksum , , , , length 
00:13:47.266540 IP (tos 0x00, ttl 117, id 0x0000, offset 0, flags [0x02], proto TCP (6), length 52)
    142.250.31.138.443 > 192.168.4.68.63245: Flags [.], cksum 0xf6bd, seq 0, ack 1, win 65535, length 0
00:13:47.627789 IP (tos 0x02, ttl 128, id 0x2a0f, offset 0, flags [0x02], proto Proto (17), length 216)
    192.168.4.68. > 142.251.16.99.: Flags [.], cksum , , , , length 
00:13:47.630897 IP (tos 0x02, ttl 128, id 0x2a10, offset 0, flags [0x02], proto Proto (17), length 63)
    192.168.4.68. > 142.251.16.99.: Flags [.], cksum , , , , length 
00:13:47.639060 IP (tos 0x00, ttl 54, id 0x0000, offset 0, flags [0x02], proto Proto (17), length 62)
    142.251.16.99. > 192.168.4.68.: Flags [.], cksum , , , , length 
00:13:47.639424 IP (tos 0x02, ttl 128, id 0x2a11, offset 0, flags [0x02], proto Proto (17), length 59)
    192.168.4.68. > 142.251.16.99.: Flags [.], cksum , , , , length 
00:13:47.694748 IP (tos 0x02, ttl 128, id 0x2a12, offset 0, flags [0x02], proto Proto (17), length 217)
    192.168.4.68. > 142.251.16.99.: Flags [.], cksum , , , , length 
00:13:47.726605 IP (tos 0x00, ttl 54, id 0x0000, offset 0, flags [0x02], proto Proto (17), length 58)
    142.251.16.99. > 192.168.4.68.: Flags [.], cksum , , , , length 
00:13:47.735220 IP (tos 0x00, ttl 54, id 0x0000, offset 0, flags [0x02], proto Proto (17), length 1220)
    142.251.16.99. > 192.168.4.68.: Flags [.], cksum , , , , length 
00:13:47.735985 IP (tos 0x02, ttl 128, id 0x2a13, offset 0, flags [0x02], proto Proto (17), length 64)
    192.168.4.68. > 142.251.16.99.: Flags [.], cksum , , , , length 
00:13:47.737807 IP (tos 0x00, ttl 54, id 0x0000, offset 0, flags [0x02], proto Proto (17), length 56)
    142.251.16.99. > 192.168.4.68.: Flags [.], cksum , , , , length 
00:13:47.737807 IP (tos 0x00, ttl 54, id 0x0000, offset 0, flags [0x02], proto Proto (17), length 106)
    142.251.16.99. > 192.168.4.68.: Flags [.], cksum , , , , length 
00:13:47.738466 IP (tos 0x02, ttl 128, id 0x2a14, offset 0, flags [0x02], proto Proto (17), length 59)
    192.168.4.68. > 142.251.16.99.: Flags [.], cksum , , , , length 
00:13:47.770125 IP (tos 0x00, ttl 54, id 0x0000, offset 0, flags [0x02], proto Proto (17), length 58)
    142.251.16.99. > 192.168.4.68.: Flags [.], cksum , , , , length 
00:13:47.778334 IP (tos 0x02, ttl 128, id 0x2a15, offset 0, flags [0x02], proto Proto (17), length 1280)
    192.168.4.68. > 142.251.16.99.: Flags [.], cksum , , , , length 
00:13:47.778447 IP (tos 0x02, ttl 128, id 0x2a16, offset 0, flags [0x02], proto Proto (17), length 1072)
    192.168.4.68. > 142.251.16.99.: Flags [.], cksum , , , , length 
00:13:47.789482 IP (tos 0x00, ttl 54, id 0x0000, offset 0, flags [0x02], proto Proto (17), length 61)
    142.251.16.99. > 192.168.4.68.: Flags [.], cksum , , , , length 
00:13:47.789927 IP (tos 0x02, ttl 128, id 0x2a17, offset 0, flags [0x02], proto Proto (17), length 59)
    192.168.4.68. > 142.251.16.99.: Flags [.], cksum , , , , length 
00:13:47.826757 IP (tos 0x00, ttl 54, id 0x0000, offset 0, flags [0x02], proto Proto (17), length 998)
    142.251.16.99. > 192.168.4.68.: Flags [.], cksum , , , , length 
00:13:47.827565 IP (tos 0x02, ttl 128, id 0x2a18, offset 0, flags [0x02], proto Proto (17), length 64)
    192.168.4.68. > 142.251.16.99.: Flags [.], cksum , , , , length 
00:13:47.836882 IP (tos 0x00, ttl 128, id 0x658c, offset 0, flags [0x00], proto Proto (17), length 65)
    192.168.4.68. > 192.168.4.72.: Flags [.], cksum , , , , length 
00:13:47.836928 IP (tos 0x00, ttl 128, id 0x658d, offset 0, flags [0x00], proto Proto (17), length 65)
    192.168.4.68. > 192.168.4.72.: Flags [.], cksum , , , , length 
00:13:47.837153 IP (tos 0x00, ttl 128, id 0x658e, offset 0, flags [0x00], proto Proto (17), length 65)
