Capturing on 'Wi-Fi' |  |  ->  | 
Dec 16, 2025 20:14:01.242418000 Eastern Standard Time | SSL | 172.25.100.196 -> 142.251.167.138 | 
Dec 16, 2025 20:14:01.252858000 Eastern Standard Time | TCP | 142.251.167.138 -> 172.25.100.196 | 443 → 52834 [ACK] Seq=1 Ack=2 Win=976 Len=0 SLE=1 SRE=2
Dec 16, 2025 20:14:01.750728000 Eastern Standard Time | TLSv1.2 | 172.25.100.196 -> 52.112.86.213 | Application Data
Dec 16, 2025 20:14:01.852114000 Eastern Standard Time | TLSv1.2 | 52.112.86.213 -> 172.25.100.196 | Application Data
Dec 16, 2025 20:14:01.896844000 Eastern Standard Time | TCP | 172.25.100.196 -> 52.112.86.213 | 59289 → 443 [ACK] Seq=52 Ack=41 Win=252 Len=0
Dec 16, 2025 20:14:02.928035000 Eastern Standard Time | TLSv1.2 | 172.25.100.196 -> 151.101.193.91 | Application Data
Dec 16, 2025 20:14:02.928532000 Eastern Standard Time | TLSv1.2 | 172.25.100.196 -> 34.36.137.203 | Application Data
Dec 16, 2025 20:14:02.928873000 Eastern Standard Time | TLSv1.2 | 172.25.100.196 -> 34.36.137.203 | Application Data
Dec 16, 2025 20:14:02.928975000 Eastern Standard Time | TCP | 172.25.100.196 -> 34.36.137.203 | 50466 → 443 [FIN, ACK] Seq=64 Ack=1 Win=253 Len=0
Dec 16, 2025 20:14:02.929204000 Eastern Standard Time | TLSv1.2 | 172.25.100.196 -> 151.101.193.91 | Application Data
Dec 16, 2025 20:14:02.929259000 Eastern Standard Time | TCP | 172.25.100.196 -> 151.101.193.91 | 52835 → 443 [FIN, ACK] Seq=64 Ack=1 Win=2045 Len=0
Dec 16, 2025 20:14:02.949986000 Eastern Standard Time | TCP | 151.101.193.91 -> 172.25.100.196 | 443 → 52835 [ACK] Seq=1 Ack=40 Win=278 Len=0
Dec 16, 2025 20:14:02.949986000 Eastern Standard Time | TCP | 151.101.193.91 -> 172.25.100.196 | 443 → 52835 [ACK] Seq=1 Ack=64 Win=278 Len=0
Dec 16, 2025 20:14:02.949986000 Eastern Standard Time | TCP | 151.101.193.91 -> 172.25.100.196 | 443 → 52835 [ACK] Seq=1 Ack=65 Win=278 Len=0
Dec 16, 2025 20:14:02.949986000 Eastern Standard Time | TLSv1.2 | 151.101.193.91 -> 172.25.100.196 | Application Data
Dec 16, 2025 20:14:02.949986000 Eastern Standard Time | TCP | 151.101.193.91 -> 172.25.100.196 | 443 → 52835 [FIN, ACK] Seq=25 Ack=65 Win=278 Len=0
Dec 16, 2025 20:14:02.950162000 Eastern Standard Time | TCP | 172.25.100.196 -> 151.101.193.91 | 52835 → 443 [RST, ACK] Seq=65 Ack=25 Win=0 Len=0
Dec 16, 2025 20:14:02.953834000 Eastern Standard Time | TCP | 34.36.137.203 -> 172.25.100.196 | 443 → 50466 [ACK] Seq=1 Ack=64 Win=1008 Len=0
Dec 16, 2025 20:14:02.953834000 Eastern Standard Time | TCP | 34.36.137.203 -> 172.25.100.196 | 443 → 50466 [FIN, ACK] Seq=1 Ack=65 Win=1008 Len=0
Dec 16, 2025 20:14:02.953995000 Eastern Standard Time | TCP | 172.25.100.196 -> 34.36.137.203 | 50466 → 443 [ACK] Seq=65 Ack=2 Win=253 Len=0
Dec 16, 2025 20:14:04.762749000 Eastern Standard Time | TLSv1.2 | 35.204.170.125 -> 172.25.100.196 | Application Data
Dec 16, 2025 20:14:04.762749000 Eastern Standard Time | TLSv1.2 | 35.204.170.125 -> 172.25.100.196 | Application Data
Dec 16, 2025 20:14:04.762749000 Eastern Standard Time | TCP | 35.204.170.125 -> 172.25.100.196 | 443 → 56313 [FIN, ACK] Seq=64 Ack=1 Win=333 Len=0
Dec 16, 2025 20:14:04.762993000 Eastern Standard Time | TCP | 172.25.100.196 -> 35.204.170.125 | 56313 → 443 [ACK] Seq=1 Ack=64 Win=255 Len=0
Dec 16, 2025 20:14:04.763099000 Eastern Standard Time | TCP | 172.25.100.196 -> 35.204.170.125 | 56313 → 443 [ACK] Seq=1 Ack=65 Win=255 Len=0
Dec 16, 2025 20:14:04.763896000 Eastern Standard Time | TCP | 172.25.100.196 -> 35.204.170.125 | 56313 → 443 [FIN, ACK] Seq=1 Ack=65 Win=255 Len=0
Dec 16, 2025 20:14:04.861324000 Eastern Standard Time | TCP | 35.204.170.125 -> 172.25.100.196 | 443 → 56313 [ACK] Seq=65 Ack=2 Win=333 Len=0
Dec 16, 2025 20:14:04.905130000 Eastern Standard Time | TLSv1.2 | 172.25.100.196 -> 20.42.65.84 | Application Data
Dec 16, 2025 20:14:04.905302000 Eastern Standard Time | TLSv1.2 | 172.25.100.196 -> 20.42.65.84 | Application Data
Dec 16, 2025 20:14:04.905382000 Eastern Standard Time | TLSv1.2 | 172.25.100.196 -> 20.42.65.84 | 
Dec 16, 2025 20:14:04.905382000 Eastern Standard Time | TCP | 172.25.100.196 -> 20.42.65.84 | 55706 → 443 [ACK] Seq=1540 Ack=1 Win=253 Len=1382
Dec 16, 2025 20:14:04.905382000 Eastern Standard Time | TCP | 172.25.100.196 -> 20.42.65.84 | 55706 → 443 [ACK] Seq=2922 Ack=1 Win=253 Len=1382
Dec 16, 2025 20:14:04.905382000 Eastern Standard Time | TCP | 172.25.100.196 -> 20.42.65.84 | 55706 → 443 [ACK] Seq=4304 Ack=1 Win=253 Len=1382
Dec 16, 2025 20:14:04.905382000 Eastern Standard Time | TCP | 172.25.100.196 -> 20.42.65.84 | 55706 → 443 [ACK] Seq=5686 Ack=1 Win=253 Len=1382
Dec 16, 2025 20:14:04.905382000 Eastern Standard Time | TCP | 172.25.100.196 -> 20.42.65.84 | 55706 → 443 [ACK] Seq=7068 Ack=1 Win=253 Len=1382
Dec 16, 2025 20:14:04.905382000 Eastern Standard Time | TCP | 172.25.100.196 -> 20.42.65.84 | 55706 → 443 [ACK] Seq=8450 Ack=1 Win=253 Len=1382
Dec 16, 2025 20:14:04.905382000 Eastern Standard Time | TLSv1.2 | 172.25.100.196 -> 20.42.65.84 | Application Data
Dec 16, 2025 20:14:04.910408000 Eastern Standard Time | SSL | 172.25.100.196 -> 20.189.173.11 | 
Dec 16, 2025 20:14:04.915872000 Eastern Standard Time | TCP | 20.42.65.84 -> 172.25.100.196 | 443 → 55706 [ACK] Seq=1 Ack=158 Win=16383 Len=0
Dec 16, 2025 20:14:04.915872000 Eastern Standard Time | TCP | 20.42.65.84 -> 172.25.100.196 | 443 → 55706 [ACK] Seq=1 Ack=2922 Win=16384 Len=0
Dec 16, 2025 20:14:04.915872000 Eastern Standard Time | TCP | 20.42.65.84 -> 172.25.100.196 | 443 → 55706 [ACK] Seq=1 Ack=5686 Win=16384 Len=0
Dec 16, 2025 20:14:04.915872000 Eastern Standard Time | TCP | 20.42.65.84 -> 172.25.100.196 | 443 → 55706 [ACK] Seq=1 Ack=8450 Win=16384 Len=0
Dec 16, 2025 20:14:04.915872000 Eastern Standard Time | TCP | 20.42.65.84 -> 172.25.100.196 | [TCP Dup ACK 42#1] 443 → 55706 [ACK] Seq=1 Ack=8450 Win=16384 Len=0 SLE=9832 SRE=10010
Dec 16, 2025 20:14:04.915872000 Eastern Standard Time | TCP | 20.42.65.84 -> 172.25.100.196 | 443 → 55706 [ACK] Seq=1 Ack=10010 Win=16384 Len=0
Dec 16, 2025 20:14:04.918417000 Eastern Standard Time | TLSv1.2 | 20.42.65.84 -> 172.25.100.196 | Application Data
Dec 16, 2025 20:14:04.918417000 Eastern Standard Time | TLSv1.2 | 20.42.65.84 -> 172.25.100.196 | Application Data
Dec 16, 2025 20:14:04.918564000 Eastern Standard Time | TCP | 172.25.100.196 -> 20.42.65.84 | 55706 → 443 [ACK] Seq=10010 Ack=75 Win=253 Len=0
Dec 16, 2025 20:14:04.949994000 Eastern Standard Time | TLSv1.2 | 20.42.65.84 -> 172.25.100.196 | Application Data
Dec 16, 2025 20:14:04.951354000 Eastern Standard Time | TLSv1.2 | 172.25.100.196 -> 20.42.65.84 | Application Data
Dec 16, 2025 20:14:04.983621000 Eastern Standard Time | TCP | 20.189.173.11 -> 172.25.100.196 | 443 → 65256 [ACK] Seq=1 Ack=2 Win=16384 Len=0 SLE=1 SRE=2
Dec 16, 2025 20:14:05.175877000 Eastern Standard Time | TCP | 20.42.65.84 -> 172.25.100.196 | 443 → 55706 [ACK] Seq=169 Ack=10045 Win=16384 Len=0
Dec 16, 2025 20:14:05.208361000 Eastern Standard Time | DNS | 172.25.100.196 -> 128.143.3.7 | Standard query 0xbf93 HTTPS waa-pa.clients6.google.com
Dec 16, 2025 20:14:05.208579000 Eastern Standard Time | DNS | 172.25.100.196 -> 128.143.3.7 | Standard query 0x82e8 A waa-pa.clients6.google.com
Dec 16, 2025 20:14:05.208941000 Eastern Standard Time | SSL | 172.25.100.196 -> 142.251.167.138 | Continuation Data
Dec 16, 2025 20:14:05.208941000 Eastern Standard Time | SSL | 172.25.100.196 -> 142.251.167.138 | Continuation Data
Dec 16, 2025 20:14:05.208941000 Eastern Standard Time | SSL | 172.25.100.196 -> 142.251.167.138 | Continuation Data
Dec 16, 2025 20:14:05.209032000 Eastern Standard Time | TLSv1.2 | 172.25.100.196 -> 142.251.167.138 | Application Data
Dec 16, 2025 20:14:05.209066000 Eastern Standard Time | TLSv1.2 | 172.25.100.196 -> 142.251.167.138 | 
Dec 16, 2025 20:14:05.209066000 Eastern Standard Time | TLSv1.2 | 172.25.100.196 -> 142.251.167.138 | Application Data
Dec 16, 2025 20:14:05.222466000 Eastern Standard Time | DNS | 128.143.3.7 -> 172.25.100.196 | Standard query response 0xbf93 HTTPS waa-pa.clients6.google.com SOA ns1.google.com
Dec 16, 2025 20:14:05.222466000 Eastern Standard Time | DNS | 128.143.3.7 -> 172.25.100.196 | Standard query response 0x82e8 A waa-pa.clients6.google.com A 172.253.62.95
Dec 16, 2025 20:14:05.223131000 Eastern Standard Time | TCP | 172.25.100.196 -> 172.253.62.95 | 49260 → 443 [SYN] Seq=0 Win=65535 Len=0 MSS=1460 WS=256 SACK_PERM
Dec 16, 2025 20:14:05.230714000 Eastern Standard Time | TCP | 142.251.167.138 -> 172.25.100.196 | 443 → 52834 [ACK] Seq=1 Ack=1384 Win=971 Len=0
Dec 16, 2025 20:14:05.230714000 Eastern Standard Time | TCP | 142.251.167.138 -> 172.25.100.196 | 443 → 52834 [ACK] Seq=1 Ack=2766 Win=966 Len=0
Dec 16, 2025 20:14:05.230714000 Eastern Standard Time | TCP | 142.251.167.138 -> 172.25.100.196 | [TCP Dup ACK 64#1] 443 → 52834 [ACK] Seq=1 Ack=2766 Win=966 Len=0 SLE=3936 SRE=3975
Dec 16, 2025 20:14:05.230714000 Eastern Standard Time | TCP | 142.251.167.138 -> 172.25.100.196 | 443 → 52834 [ACK] Seq=1 Ack=3975 Win=962 Len=0
Dec 16, 2025 20:14:05.230714000 Eastern Standard Time | TCP | 142.251.167.138 -> 172.25.100.196 | [TCP Dup ACK 66#1] 443 → 52834 [ACK] Seq=1 Ack=3975 Win=962 Len=0 SLE=5357 SRE=5607
Dec 16, 2025 20:14:05.230714000 Eastern Standard Time | TCP | 142.251.167.138 -> 172.25.100.196 | 443 → 52834 [ACK] Seq=1 Ack=5607 Win=956 Len=0
Dec 16, 2025 20:14:05.230940000 Eastern Standard Time | TLSv1.2 | 142.251.167.138 -> 172.25.100.196 | Application Data
Dec 16, 2025 20:14:05.239443000 Eastern Standard Time | TCP | 172.253.62.95 -> 172.25.100.196 | 443 → 49260 [SYN, ACK] Seq=0 Ack=1 Win=65535 Len=0 MSS=1382 SACK_PERM WS=256
Dec 16, 2025 20:14:05.239613000 Eastern Standard Time | TCP | 172.25.100.196 -> 172.253.62.95 | 49260 → 443 [ACK] Seq=1 Ack=1 Win=65280 Len=0
Dec 16, 2025 20:14:05.240932000 Eastern Standard Time | SSL | 172.25.100.196 -> 172.253.62.95 | 
Dec 16, 2025 20:14:05.240932000 Eastern Standard Time | TLSv1.2 | 172.25.100.196 -> 172.253.62.95 | Client Hello (SNI=waa-pa.clients6.google.com)
Dec 16, 2025 20:14:05.251751000 Eastern Standard Time | TCP | 172.253.62.95 -> 172.25.100.196 | 443 → 49260 [ACK] Seq=1 Ack=1383 Win=268544 Len=0
Dec 16, 2025 20:14:05.251751000 Eastern Standard Time | TCP | 172.253.62.95 -> 172.25.100.196 | 443 → 49260 [ACK] Seq=1 Ack=2324 Win=267776 Len=0
Dec 16, 2025 20:14:05.253849000 Eastern Standard Time | TLSv1.3 | 172.253.62.95 -> 172.25.100.196 | Server Hello, Change Cipher Spec
Dec 16, 2025 20:14:05.253849000 Eastern Standard Time | TLSv1.3 | 172.253.62.95 -> 172.25.100.196 | Application Data
Dec 16, 2025 20:14:05.254036000 Eastern Standard Time | TCP | 172.25.100.196 -> 172.253.62.95 | 49260 → 443 [ACK] Seq=2324 Ack=1492 Win=65280 Len=0
Dec 16, 2025 20:14:05.255134000 Eastern Standard Time | TLSv1.2 | 142.251.167.138 -> 172.25.100.196 | Application Data
Dec 16, 2025 20:14:05.255134000 Eastern Standard Time | TLSv1.2 | 142.251.167.138 -> 172.25.100.196 | Application Data
Dec 16, 2025 20:14:05.255134000 Eastern Standard Time | TLSv1.2 | 142.251.167.138 -> 172.25.100.196 | Application Data
Dec 16, 2025 20:14:05.255134000 Eastern Standard Time | TLSv1.2 | 142.251.167.138 -> 172.25.100.196 | Application Data
Dec 16, 2025 20:14:05.255319000 Eastern Standard Time | TCP | 172.25.100.196 -> 142.251.167.138 | 52834 → 443 [ACK] Seq=5607 Ack=582 Win=252 Len=0
Dec 16, 2025 20:14:05.255403000 Eastern Standard Time | TCP | 172.25.100.196 -> 142.251.167.138 | 52834 → 443 [ACK] Seq=5607 Ack=1007 Win=255 Len=0
Dec 16, 2025 20:14:05.255743000 Eastern Standard Time | TLSv1.3 | 172.25.100.196 -> 172.253.62.95 | Change Cipher Spec, Application Data
Dec 16, 2025 20:14:05.256014000 Eastern Standard Time | TLSv1.3 | 172.25.100.196 -> 172.253.62.95 | Application Data
Dec 16, 2025 20:14:05.256563000 Eastern Standard Time | TLSv1.3 | 172.25.100.196 -> 172.253.62.95 | Application Data
Dec 16, 2025 20:14:05.257052000 Eastern Standard Time | TLSv1.2 | 172.25.100.196 -> 142.251.167.138 | Application Data
Dec 16, 2025 20:14:05.257129000 Eastern Standard Time | TLSv1.2 | 172.25.100.196 -> 142.251.167.138 | Application Data
Dec 16, 2025 20:14:05.266883000 Eastern Standard Time | TCP | 142.251.167.138 -> 172.25.100.196 | 443 → 52834 [ACK] Seq=1046 Ack=5681 Win=956 Len=0
Dec 16, 2025 20:14:05.267246000 Eastern Standard Time | TLSv1.3 | 172.253.62.95 -> 172.25.100.196 | Application Data, Application Data
Dec 16, 2025 20:14:05.267516000 Eastern Standard Time | TLSv1.3 | 172.25.100.196 -> 172.253.62.95 | Application Data
Dec 16, 2025 20:14:05.268153000 Eastern Standard Time | TLSv1.3 | 172.253.62.95 -> 172.25.100.196 | Application Data
Dec 16, 2025 20:14:05.269206000 Eastern Standard Time | TLSv1.3 | 172.253.62.95 -> 172.25.100.196 | Application Data
Dec 16, 2025 20:14:05.269206000 Eastern Standard Time | TLSv1.3 | 172.253.62.95 -> 172.25.100.196 | Application Data
Dec 16, 2025 20:14:05.269206000 Eastern Standard Time | TLSv1.3 | 172.253.62.95 -> 172.25.100.196 | Application Data
Dec 16, 2025 20:14:05.269362000 Eastern Standard Time | TCP | 172.25.100.196 -> 172.253.62.95 | 49260 → 443 [ACK] Seq=2969 Ack=2927 Win=65280 Len=0
Dec 16, 2025 20:14:05.269462000 Eastern Standard Time | TCP | 172.25.100.196 -> 172.253.62.95 | 49260 → 443 [ACK] Seq=2969 Ack=2997 Win=65280 Len=0
Dec 16, 2025 20:14:05.269577000 Eastern Standard Time | TLSv1.3 | 172.25.100.196 -> 172.253.62.95 | Application Data
Dec 16, 2025 20:14:05.271710000 Eastern Standard Time | TCP | 172.25.100.196 -> 172.253.62.95 | 63231 → 443 [SYN] Seq=0 Win=65535 Len=0 MSS=1460 WS=256 SACK_PERM
Dec 16, 2025 20:14:05.280364000 Eastern Standard Time | TCP | 172.253.62.95 -> 172.25.100.196 | 443 → 49260 [ACK] Seq=2997 Ack=3008 Win=267264 Len=0
Dec 16, 2025 20:14:05.282325000 Eastern Standard Time | TCP | 172.253.62.95 -> 172.25.100.196 | 443 → 63231 [SYN, ACK] Seq=0 Ack=1 Win=65535 Len=0 MSS=1382 SACK_PERM WS=256
Dec 16, 2025 20:14:05.282484000 Eastern Standard Time | TCP | 172.25.100.196 -> 172.253.62.95 | 63231 → 443 [ACK] Seq=1 Ack=1 Win=65280 Len=0
Dec 16, 2025 20:14:05.283398000 Eastern Standard Time | SSL | 172.25.100.196 -> 172.253.62.95 | 
Dec 16, 2025 20:14:05.283398000 Eastern Standard Time | TLSv1.2 | 172.25.100.196 -> 172.253.62.95 | Client Hello (SNI=waa-pa.clients6.google.com)
Dec 16, 2025 20:14:05.294280000 Eastern Standard Time | TCP | 172.253.62.95 -> 172.25.100.196 | 443 → 63231 [ACK] Seq=1 Ack=1383 Win=268544 Len=0
Dec 16, 2025 20:14:05.294280000 Eastern Standard Time | TCP | 172.253.62.95 -> 172.25.100.196 | 443 → 63231 [ACK] Seq=1 Ack=2260 Win=267776 Len=0
Dec 16, 2025 20:14:05.295751000 Eastern Standard Time | TLSv1.3 | 172.253.62.95 -> 172.25.100.196 | Server Hello, Change Cipher Spec
Dec 16, 2025 20:14:05.295751000 Eastern Standard Time | TLSv1.3 | 172.253.62.95 -> 172.25.100.196 | Application Data
Dec 16, 2025 20:14:05.295996000 Eastern Standard Time | TCP | 172.25.100.196 -> 172.253.62.95 | 63231 → 443 [ACK] Seq=2260 Ack=1492 Win=65280 Len=0
Dec 16, 2025 20:14:05.296488000 Eastern Standard Time | TLSv1.3 | 172.25.100.196 -> 172.253.62.95 | Change Cipher Spec, Application Data
Dec 16, 2025 20:14:05.296639000 Eastern Standard Time | TLSv1.3 | 172.25.100.196 -> 172.253.62.95 | Application Data
Dec 16, 2025 20:14:05.296798000 Eastern Standard Time | TLSv1.3 | 172.25.100.196 -> 172.253.62.95 | 
Dec 16, 2025 20:14:05.296798000 Eastern Standard Time | TCP | 172.25.100.196 -> 172.253.62.95 | 63231 → 443 [ACK] Seq=3824 Ack=1492 Win=65280 Len=1382
Dec 16, 2025 20:14:05.296798000 Eastern Standard Time | TLSv1.3 | 172.25.100.196 -> 172.253.62.95 | Application Data
Dec 16, 2025 20:14:05.296880000 Eastern Standard Time | TLSv1.3 | 172.25.100.196 -> 172.253.62.95 | 
Dec 16, 2025 20:14:05.296880000 Eastern Standard Time | TLSv1.3 | 172.25.100.196 -> 172.253.62.95 | Application Data
Dec 16, 2025 20:14:05.307227000 Eastern Standard Time | TLSv1.3 | 172.253.62.95 -> 172.25.100.196 | Application Data, Application Data
Dec 16, 2025 20:14:05.307809000 Eastern Standard Time | TCP | 172.253.62.95 -> 172.25.100.196 | 443 → 63231 [ACK] Seq=2492 Ack=3824 Win=266496 Len=0
Dec 16, 2025 20:14:05.307809000 Eastern Standard Time | TLSv1.3 | 172.253.62.95 -> 172.25.100.196 | Application Data
Dec 16, 2025 20:14:05.307809000 Eastern Standard Time | TCP | 172.253.62.95 -> 172.25.100.196 | 443 → 63231 [ACK] Seq=2523 Ack=6221 Win=264192 Len=0
Dec 16, 2025 20:14:05.307809000 Eastern Standard Time | TCP | 172.253.62.95 -> 172.25.100.196 | [TCP Dup ACK 121#1] 443 → 63231 [ACK] Seq=2523 Ack=6221 Win=264192 Len=0 SLE=7603 SRE=8102
Dec 16, 2025 20:14:05.307809000 Eastern Standard Time | TCP | 172.253.62.95 -> 172.25.100.196 | 443 → 63231 [ACK] Seq=2523 Ack=8102 Win=262400 Len=0
Dec 16, 2025 20:14:05.308006000 Eastern Standard Time | TCP | 172.25.100.196 -> 172.253.62.95 | 63231 → 443 [ACK] Seq=8102 Ack=2523 Win=64256 Len=0
Dec 16, 2025 20:14:05.309427000 Eastern Standard Time | TLSv1.3 | 172.25.100.196 -> 172.253.62.95 | Application Data
Dec 16, 2025 20:14:05.318471000 Eastern Standard Time | TLSv1.3 | 172.253.62.95 -> 172.25.100.196 | Application Data
Dec 16, 2025 20:14:05.318471000 Eastern Standard Time | TLSv1.3 | 172.253.62.95 -> 172.25.100.196 | Application Data
Dec 16, 2025 20:14:05.318471000 Eastern Standard Time | TLSv1.3 | 172.253.62.95 -> 172.25.100.196 | Application Data
Dec 16, 2025 20:14:05.318471000 Eastern Standard Time | TLSv1.3 | 172.253.62.95 -> 172.25.100.196 | Application Data
Dec 16, 2025 20:14:05.318762000 Eastern Standard Time | TCP | 172.25.100.196 -> 172.253.62.95 | 63231 → 443 [ACK] Seq=8133 Ack=3818 Win=65280 Len=0
Dec 16, 2025 20:14:05.318866000 Eastern Standard Time | TCP | 172.25.100.196 -> 172.253.62.95 | 63231 → 443 [ACK] Seq=8133 Ack=3878 Win=65280 Len=0
Dec 16, 2025 20:14:05.318918000 Eastern Standard Time | TCP | 172.25.100.196 -> 172.253.62.95 | 63231 → 443 [ACK] Seq=8133 Ack=3948 Win=65280 Len=0
Dec 16, 2025 20:14:05.319038000 Eastern Standard Time | TLSv1.3 | 172.25.100.196 -> 172.253.62.95 | Application Data
Dec 16, 2025 20:14:05.325004000 Eastern Standard Time | TCP | 172.253.62.95 -> 172.25.100.196 | 443 → 63231 [ACK] Seq=3948 Ack=8133 Win=262400 Len=0
Dec 16, 2025 20:14:05.329295000 Eastern Standard Time | TCP | 172.253.62.95 -> 172.25.100.196 | 443 → 63231 [ACK] Seq=3948 Ack=8172 Win=262400 Len=0
Dec 16, 2025 20:14:05.396010000 Eastern Standard Time | TLSv1.2 | 172.25.100.196 -> 172.64.41.4 | Application Data
Dec 16, 2025 20:14:05.396086000 Eastern Standard Time | TLSv1.2 | 172.25.100.196 -> 172.64.41.4 | Application Data
Dec 16, 2025 20:14:05.397728000 Eastern Standard Time | TLSv1.2 | 172.25.100.196 -> 142.251.167.95 | Application Data
Dec 16, 2025 20:14:05.399653000 Eastern Standard Time | TLSv1.2 | 172.25.100.196 -> 172.64.41.4 | Application Data
Dec 16, 2025 20:14:05.399696000 Eastern Standard Time | TLSv1.2 | 172.25.100.196 -> 172.64.41.4 | Application Data
Dec 16, 2025 20:14:05.400690000 Eastern Standard Time | TCP | 172.64.41.4 -> 172.25.100.196 | 443 → 55708 [ACK] Seq=1 Ack=216 Win=327 Len=0
Dec 16, 2025 20:14:05.403307000 Eastern Standard Time | TLSv1.2 | 172.64.41.4 -> 172.25.100.196 | Application Data
Dec 16, 2025 20:14:05.403307000 Eastern Standard Time | TLSv1.2 | 172.64.41.4 -> 172.25.100.196 | Application Data
Dec 16, 2025 20:14:05.403526000 Eastern Standard Time | TCP | 172.25.100.196 -> 172.64.41.4 | 55708 → 443 [ACK] Seq=431 Ack=580 Win=251 Len=0
Dec 16, 2025 20:14:05.404779000 Eastern Standard Time | TCP | 172.64.41.4 -> 172.25.100.196 | 443 → 55708 [ACK] Seq=580 Ack=431 Win=327 Len=0
Dec 16, 2025 20:14:05.407110000 Eastern Standard Time | TLSv1.2 | 172.64.41.4 -> 172.25.100.196 | Application Data
Dec 16, 2025 20:14:05.407110000 Eastern Standard Time | TLSv1.2 | 172.64.41.4 -> 172.25.100.196 | Application Data
Dec 16, 2025 20:14:05.407309000 Eastern Standard Time | TCP | 172.25.100.196 -> 172.64.41.4 | 55708 → 443 [ACK] Seq=431 Ack=1136 Win=255 Len=0
Dec 16, 2025 20:14:05.413665000 Eastern Standard Time | TCP | 142.251.167.95 -> 172.25.100.196 | 443 → 50478 [ACK] Seq=1 Ack=243 Win=1037 Len=0
Dec 16, 2025 20:14:05.424874000 Eastern Standard Time | TLSv1.2 | 142.251.167.95 -> 172.25.100.196 | Application Data
Dec 16, 2025 20:14:05.424874000 Eastern Standard Time | TLSv1.2 | 142.251.167.95 -> 172.25.100.196 | Application Data
Dec 16, 2025 20:14:05.424874000 Eastern Standard Time | TLSv1.2 | 142.251.167.95 -> 172.25.100.196 | Application Data
Dec 16, 2025 20:14:05.425180000 Eastern Standard Time | TCP | 172.25.100.196 -> 142.251.167.95 | 50478 → 443 [ACK] Seq=243 Ack=234 Win=252 Len=0
Dec 16, 2025 20:14:05.425385000 Eastern Standard Time | TLSv1.2 | 172.25.100.196 -> 142.251.167.95 | Application Data
Dec 16, 2025 20:14:05.426226000 Eastern Standard Time | TLSv1.2 | 172.25.100.196 -> 142.251.167.95 | Application Data
Dec 16, 2025 20:14:05.426263000 Eastern Standard Time | TLSv1.2 | 172.25.100.196 -> 142.251.167.95 | Application Data
Dec 16, 2025 20:14:05.436348000 Eastern Standard Time | TCP | 142.251.167.95 -> 172.25.100.196 | 443 → 50478 [ACK] Seq=273 Ack=456 Win=1037 Len=0
Dec 16, 2025 20:14:05.441076000 Eastern Standard Time | TCP | 142.251.167.95 -> 172.25.100.196 | 443 → 50478 [ACK] Seq=273 Ack=499 Win=1037 Len=0
Dec 16, 2025 20:14:05.451111000 Eastern Standard Time | TLSv1.2 | 142.251.167.95 -> 172.25.100.196 | Application Data
Dec 16, 2025 20:14:05.451111000 Eastern Standard Time | TLSv1.2 | 142.251.167.95 -> 172.25.100.196 | Application Data
Dec 16, 2025 20:14:05.451111000 Eastern Standard Time | TLSv1.2 | 142.251.167.95 -> 172.25.100.196 | Application Data
Dec 16, 2025 20:14:05.451111000 Eastern Standard Time | TLSv1.2 | 142.251.167.95 -> 172.25.100.196 | Application Data
Dec 16, 2025 20:14:05.451419000 Eastern Standard Time | TCP | 172.25.100.196 -> 142.251.167.95 | 50478 → 443 [ACK] Seq=499 Ack=379 Win=251 Len=0
Dec 16, 2025 20:14:05.451516000 Eastern Standard Time | TCP | 172.25.100.196 -> 142.251.167.95 | 50478 → 443 [ACK] Seq=499 Ack=449 Win=251 Len=0
Dec 16, 2025 20:14:05.451632000 Eastern Standard Time | TLSv1.2 | 172.25.100.196 -> 142.251.167.95 | Application Data
Dec 16, 2025 20:14:05.467910000 Eastern Standard Time | TCP | 142.251.167.95 -> 172.25.100.196 | 443 → 50478 [ACK] Seq=449 Ack=538 Win=1037 Len=0
Dec 16, 2025 20:14:05.849165000 Eastern Standard Time | TLSv1.2 | 140.82.114.25 -> 172.25.100.196 | Application Data
Dec 16, 2025 20:14:05.849491000 Eastern Standard Time | TLSv1.2 | 172.25.100.196 -> 140.82.114.25 | Application Data
Dec 16, 2025 20:14:05.859183000 Eastern Standard Time | TCP | 140.82.114.25 -> 172.25.100.196 | 443 → 62899 [ACK] Seq=26 Ack=30 Win=74 Len=0
Dec 16, 2025 20:14:06.544749000 Eastern Standard Time | TLSv1.2 | 172.25.100.196 -> 34.111.211.209 | Application Data
Dec 16, 2025 20:14:06.556838000 Eastern Standard Time | TLSv1.2 | 34.111.211.209 -> 172.25.100.196 | Application Data
Dec 16, 2025 20:14:06.608155000 Eastern Standard Time | TCP | 172.25.100.196 -> 34.111.211.209 | 50469 → 443 [ACK] Seq=40 Ack=40 Win=508 Len=0
Dec 16, 2025 20:14:06.900991000 Eastern Standard Time | TLSv1.2 | 142.251.167.95 -> 172.25.100.196 | Application Data
Dec 16, 2025 20:14:06.900991000 Eastern Standard Time | TLSv1.2 | 142.251.167.95 -> 172.25.100.196 | Application Data
Dec 16, 2025 20:14:06.900991000 Eastern Standard Time | TLSv1.2 | 142.251.167.95 -> 172.25.100.196 | Application Data
Dec 16, 2025 20:14:06.901249000 Eastern Standard Time | TCP | 172.25.100.196 -> 142.251.167.95 | 50478 → 443 [ACK] Seq=538 Ack=604 Win=250 Len=0
Dec 16, 2025 20:14:06.901407000 Eastern Standard Time | TLSv1.2 | 172.25.100.196 -> 142.251.167.95 | Application Data
Dec 16, 2025 20:14:06.911796000 Eastern Standard Time | TCP | 142.251.167.95 -> 172.25.100.196 | 443 → 50478 [ACK] Seq=643 Ack=577 Win=1037 Len=0
Dec 16, 2025 20:14:06.930029000 Eastern Standard Time | TLSv1.2 | 172.25.100.196 -> 142.251.167.95 | Application Data
Dec 16, 2025 20:14:06.940263000 Eastern Standard Time | TCP | 142.251.167.95 -> 172.25.100.196 | 443 → 50478 [ACK] Seq=643 Ack=818 Win=1037 Len=0
Dec 16, 2025 20:14:06.954042000 Eastern Standard Time | TLSv1.2 | 142.251.167.95 -> 172.25.100.196 | Application Data
Dec 16, 2025 20:14:06.954042000 Eastern Standard Time | TLSv1.2 | 142.251.167.95 -> 172.25.100.196 | Application Data
Dec 16, 2025 20:14:06.954286000 Eastern Standard Time | TCP | 172.25.100.196 -> 142.251.167.95 | 50478 → 443 [ACK] Seq=818 Ack=759 Win=255 Len=0
Dec 16, 2025 20:14:07.270285000 Eastern Standard Time | TLSv1.2 | 172.25.100.196 -> 13.91.58.244 | Application Data
Dec 16, 2025 20:14:07.341935000 Eastern Standard Time | TLSv1.2 | 13.91.58.244 -> 172.25.100.196 | Application Data
Dec 16, 2025 20:14:07.391186000 Eastern Standard Time | TCP | 172.25.100.196 -> 13.91.58.244 | 60885 → 443 [ACK] Seq=52 Ack=41 Win=253 Len=0
Dec 16, 2025 20:14:07.495810000 Eastern Standard Time | TLSv1.2 | 34.120.52.64 -> 172.25.100.196 | Application Data
Dec 16, 2025 20:14:07.496469000 Eastern Standard Time | TLSv1.2 | 172.25.100.196 -> 34.120.52.64 | Application Data
Dec 16, 2025 20:14:07.506920000 Eastern Standard Time | TCP | 34.120.52.64 -> 172.25.100.196 | 443 → 59815 [ACK] Seq=28 Ack=32 Win=1043 Len=0
Dec 16, 2025 20:14:08.517970000 Eastern Standard Time | SSL | 172.25.100.196 -> 104.18.32.47 | 
Dec 16, 2025 20:14:08.524925000 Eastern Standard Time | TCP | 104.18.32.47 -> 172.25.100.196 | 443 → 56766 [ACK] Seq=1 Ack=2 Win=16 Len=0 SLE=1 SRE=2
Dec 16, 2025 20:14:08.694700000 Eastern Standard Time | TCP | 172.25.100.196 -> 142.251.163.101 | 63232 → 443 [SYN] Seq=0 Win=65535 Len=0 MSS=1460 WS=256 SACK_PERM
Dec 16, 2025 20:14:08.696988000 Eastern Standard Time | TLSv1.2 | 172.25.100.196 -> 172.64.41.4 | Application Data
Dec 16, 2025 20:14:08.697067000 Eastern Standard Time | TLSv1.2 | 172.25.100.196 -> 172.64.41.4 | Application Data
Dec 16, 2025 20:14:08.702251000 Eastern Standard Time | TCP | 172.64.41.4 -> 172.25.100.196 | 443 → 55708 [ACK] Seq=1136 Ack=646 Win=328 Len=0
Dec 16, 2025 20:14:08.704602000 Eastern Standard Time | TCP | 142.251.163.101 -> 172.25.100.196 | 443 → 63232 [SYN, ACK] Seq=0 Ack=1 Win=65535 Len=0 MSS=1382 SACK_PERM WS=256
Dec 16, 2025 20:14:08.704746000 Eastern Standard Time | TCP | 172.25.100.196 -> 142.251.163.101 | 63232 → 443 [ACK] Seq=1 Ack=1 Win=65280 Len=0
Dec 16, 2025 20:14:08.705530000 Eastern Standard Time | SSL | 172.25.100.196 -> 142.251.163.101 | 
Dec 16, 2025 20:14:08.705530000 Eastern Standard Time | TLSv1.2 | 172.25.100.196 -> 142.251.163.101 | Client Hello (SNI=gemini.google.com)

[!!!] TARGET IDENTIFIED: gemini.google.com (Stream 16)
Dec 16, 2025 20:14:08.705814000 Eastern Standard Time | TLSv1.3 | 172.25.100.196 -> 142.251.163.101 | Change Cipher Spec
Dec 16, 2025 20:14:08.706038000 Eastern Standard Time | HTTP2 | 172.25.100.196 -> 142.251.163.101 | Magic, SETTINGS[0], WINDOW_UPDATE[0]
Dec 16, 2025 20:14:08.707208000 Eastern Standard Time | TLSv1.2 | 172.64.41.4 -> 172.25.100.196 | Application Data
Dec 16, 2025 20:14:08.707208000 Eastern Standard Time | TLSv1.2 | 172.64.41.4 -> 172.25.100.196 | Application Data
Dec 16, 2025 20:14:08.707345000 Eastern Standard Time | TCP | 172.25.100.196 -> 172.64.41.4 | 55708 → 443 [ACK] Seq=646 Ack=1715 Win=253 Len=0
Dec 16, 2025 20:14:08.708434000 Eastern Standard Time | TCP | 172.25.100.196 -> 64.233.180.102 | 63233 → 443 [SYN] Seq=0 Win=65535 Len=0 MSS=1460 WS=256 SACK_PERM
Dec 16, 2025 20:14:08.709221000 Eastern Standard Time | TLSv1.2 | 172.25.100.196 -> 172.64.41.4 | Application Data
Dec 16, 2025 20:14:08.709273000 Eastern Standard Time | TLSv1.2 | 172.25.100.196 -> 172.64.41.4 | Application Data
Dec 16, 2025 20:14:08.714205000 Eastern Standard Time | TCP | 172.64.41.4 -> 172.25.100.196 | 443 → 55708 [ACK] Seq=1715 Ack=861 Win=328 Len=0
Dec 16, 2025 20:14:08.715770000 Eastern Standard Time | TCP | 142.251.163.101 -> 172.25.100.196 | 443 → 63232 [ACK] Seq=1 Ack=1383 Win=268544 Len=0
Dec 16, 2025 20:14:08.715770000 Eastern Standard Time | TCP | 142.251.163.101 -> 172.25.100.196 | [TCP Dup ACK 209#1] 443 → 63232 [ACK] Seq=1 Ack=1383 Win=268544 Len=0 SLE=2474 SRE=2480
Dec 16, 2025 20:14:08.715770000 Eastern Standard Time | TCP | 142.251.163.101 -> 172.25.100.196 | 443 → 63232 [ACK] Seq=1 Ack=2480 Win=267520 Len=0
Dec 16, 2025 20:14:08.715770000 Eastern Standard Time | TCP | 142.251.163.101 -> 172.25.100.196 | 443 → 63232 [ACK] Seq=1 Ack=2572 Win=267520 Len=0
Dec 16, 2025 20:14:08.715770000 Eastern Standard Time | TLSv1.2 | 172.64.41.4 -> 172.25.100.196 | Application Data
Dec 16, 2025 20:14:08.715770000 Eastern Standard Time | TLSv1.2 | 172.64.41.4 -> 172.25.100.196 | Application Data
Dec 16, 2025 20:14:08.716107000 Eastern Standard Time | TCP | 172.25.100.196 -> 172.64.41.4 | 55708 → 443 [ACK] Seq=861 Ack=2271 Win=251 Len=0
Dec 16, 2025 20:14:08.716685000 Eastern Standard Time | TLSv1.3 | 142.251.163.101 -> 172.25.100.196 | Server Hello, Change Cipher Spec, Encrypted Extensions, Finished
Dec 16, 2025 20:14:08.716685000 Eastern Standard Time | TLSv1.3 | 142.251.163.101 -> 172.25.100.196 | New Session Ticket, New Session Ticket
Dec 16, 2025 20:14:08.716685000 Eastern Standard Time | HTTP2 | 142.251.163.101 -> 172.25.100.196 | SETTINGS[0], WINDOW_UPDATE[0]
Dec 16, 2025 20:14:08.716685000 Eastern Standard Time | HTTP2 | 142.251.163.101 -> 172.25.100.196 | SETTINGS[0]
Dec 16, 2025 20:14:08.716916000 Eastern Standard Time | TCP | 172.25.100.196 -> 142.251.163.101 | 63232 → 443 [ACK] Seq=2572 Ack=1859 Win=65280 Len=0
Dec 16, 2025 20:14:08.716972000 Eastern Standard Time | TCP | 172.25.100.196 -> 142.251.163.101 | 63232 → 443 [ACK] Seq=2572 Ack=1952 Win=65280 Len=0
Dec 16, 2025 20:14:08.717809000 Eastern Standard Time | TLSv1.3 | 172.25.100.196 -> 142.251.163.101 | End of Early Data, Finished
Dec 16, 2025 20:14:08.718280000 Eastern Standard Time | TCP | 64.233.180.102 -> 172.25.100.196 | 443 → 63233 [SYN, ACK] Seq=0 Ack=1 Win=65535 Len=0 MSS=1382 SACK_PERM WS=256
Dec 16, 2025 20:14:08.718405000 Eastern Standard Time | TCP | 172.25.100.196 -> 64.233.180.102 | 63233 → 443 [ACK] Seq=1 Ack=1 Win=65280 Len=0
Dec 16, 2025 20:14:08.719270000 Eastern Standard Time | HTTP2 | 172.25.100.196 -> 142.251.163.101 | SETTINGS[0]
Dec 16, 2025 20:14:08.720222000 Eastern Standard Time | TLSv1.3 | 172.25.100.196 -> 142.251.163.101 | 
Dec 16, 2025 20:14:08.720222000 Eastern Standard Time | HTTP2 | 172.25.100.196 -> 142.251.163.101 | HEADERS[3]: POST /_/BardChatUi/data/assistant.lamda.BardFrontendService/StreamGenerate?bl=boq_assistant-bard-web-server_20251215.06_p1&f.sid=8019382471012285577&hl=en-US&_reqid=2272605&rt=c, WINDOW_UPDATE[3]
Dec 16, 2025 20:14:08.720366000 Eastern Standard Time | TLSv1.3 | 172.25.100.196 -> 142.251.163.101 | 
Dec 16, 2025 20:14:08.720366000 Eastern Standard Time | HTTP2 | 172.25.100.196 -> 142.251.163.101 | DATA[3] (application/x-www-form-urlencoded)
    [LLM PAYLOAD]:
    f.req=%5Bnull%2C%22%5B%5B%5C%22penguin%5C%22%2C0%2Cnull%2Cnull%2Cnull%2Cnull%2C0%5D%2C%5B%5C%22en-US%5C%22%5D%2C%5B%5C%22%5C%22%2C%5C%22%5C%22%2C%5C%22%5C%22%2Cnull%2Cnull%2Cnull%2Cnull%2Cnull%2Cnull%2C%5C%22%5C%22%5D%2C%5C%22!MDOlM2vNAAZT9fabc_VChhZwZh_ARKw7ADQBEArZ1I-D5aHyyMLNgrAixnL1UYbQ722uy7kA8sfcBEQPiMgakMQpWGxHYqCrkuuhR7E1AgAAAFZSAAAABGgBB34APyEzDv69BX7kC5lBJToVbBBO3EhXFC1W2qziWIL3ZjnLGFR0QpeJT3gUECXuD6-xx7w-H2kK2wf4egVkU1YnqZkDPpn1o2m75qSgaOYwSzAvbFppSYP8buwG1Pvrq2a4VgHvInRuDOsbkgEjfj8-k1la-8xAInBvF6WWPYjUXMUUZC1jPk72NYDp52SnBSNA6iNjqClCu650YzVj8vzY6sa7qVKCQSE5EHyGMyZH6KsATF_fU2hjSMA2K59wgryaQM1Cni7X9S2nNnxQrdLx5BQPV-Tp86r-SDwyZqmk_wAO1omTse0i924w_Hiy_9FIoO_Jm01CTd4aBfSsK8aHHiHMk-hpEUuEvzoLJ6Pf9yrzrkZU-Obpz2YECvm2BHaXnz8jLBNi9h5dddTG45fMdex3noCV2UhzFXtIUNe166uOhum9WtyrEmLrN5FqyJacuPc18xWOC1UVsHNz_Rg1uJESIlRfL9Xr-V0wC1K0n2u_YfLMTrR7xKaIasiWJEAz_bGLtq2LgYxP4leJR2877PLQz0X6NSVwsUXMlMua8xxUErTvRDXYQ_w1NRcxHBeGH_fiKtZNDEBi5w9hLzb7B8RV7rsgju1iyT_V8IV53boyUQswaXu2qYJQrpYHTzZj96B7qIEkxOe3a6TLiqUrQB1WM8oV0HP9ogHD3TqQGqzplvDh8TEz_BuOT24HQdMA9AaZoZxc3RJeg0brp0YoFnaz59jO4fI7AqG2-x3XSmjW7Q7ofaIgvIRuH6JoJmkctbMx1hhylCag6XTWJWBDKXKTokpsowFMBpAr5G3-eADA1jvok3Si35wDNnG7TEiBz7Tqon4dI-Nzsmc7R5oIPkX0F0MsQM4a_fQRObxYormJOQBLm6r9pfF-yL33kqzo9Z9fz4uOW4utVuq8QXcj7B--NYGdB77a5IF4ajvESyQ_iteZXfErfwg6t2VPKb3c4S5g7SgHIS1mEzCz_DW3w-RrhW7z2jtjvpGIobiUN5-YLdMcycf67pFBiXjPkEBjkYEaOZojiXGn2cOh6hvAT-KFkfII-6zuZ1bmEhRDwxuW366-Mwaay-oP888wkc3xo9AM4P_TBDgSR0AyT6JAGZboMVdN4Bof4z6W7x8lzB0ZfGvYp7JQOvs6iaaZLJbj-W5qdIfTg9LX1WvyTI80nR4xRuHMdMpj8PlwBLRJcJl2%5C%22%2C%5C%224838d3ce3ac47d4f11e76d904bebf10c%5C%22%2Cnull%2C%5B1%5D%2C1%2Cnull%2Cnull%2C1%2C0%2Cnull%2Cnull%2Cnull%2Cnull%2Cnull%2C%5B%5B0%5D%5D%2C0%2Cnull%2Cnull%2Cnull%2Cnull%2Cnull%2Cnull%2Cnull%2Cnull%2C1%2Cnull%2Cnull%2C%5B4%5D%2Cnull%2Cnull%2Cnull%2Cnull%2Cnull%2Cnull%2Cnull%2Cnull%2Cnull%2Cnull%2C%5B2%5D%2Cnull%2Cnull%2Cnull%2Cnull%2Cnull%2Cnull%2Cnull%2Cnull%2Cnull%2Cnull%2Cnull%2C0%2Cnull%2Cnull%2Cnull%2Cnull%2Cnull%2C%5C%22F198DB62-E095-4BFC-A40A-AF1C6C25BD9B%5C%22%2Cnull%2C%5B%5D%2Cnull%2Cnull%2Cnull%2Cnull%2Cnull%2Cnull%2Cnull%2Cnull%2Cnull%2Cnull%2Cnull%2Cnull%2Cnull%2Cnull%2Cnull%2Cnull%2Cnull%2Cnull%2Cnull%2Cnull%2Cnull%2Cnull%2Cnull%2Cnull%2Cnull%2Cnull%2Cnull%2Cnull%2Cnull%2Cnull%2Cnull%2Cnull%2Cnull%2Cnull%2Cnull%2Cnull%2Cnull%2Cnull%2C%5B%5D%5D%22%5D&
    ------------------------------------------------------------
Dec 16, 2025 20:14:08.720924000 Eastern Standard Time | SSL | 172.25.100.196 -> 64.233.180.102 | 
Dec 16, 2025 20:14:08.720924000 Eastern Standard Time | TLSv1.2 | 172.25.100.196 -> 64.233.180.102 | Client Hello (SNI=play.google.com)
Dec 16, 2025 20:14:08.721110000 Eastern Standard Time | TLSv1.3 | 172.25.100.196 -> 64.233.180.102 | Change Cipher Spec
Dec 16, 2025 20:14:08.721282000 Eastern Standard Time | HTTP2 | 172.25.100.196 -> 64.233.180.102 | Magic, SETTINGS[0], WINDOW_UPDATE[0]
Dec 16, 2025 20:14:08.728940000 Eastern Standard Time | TCP | 142.251.163.101 -> 172.25.100.196 | 443 → 63232 [ACK] Seq=1952 Ack=2687 Win=267520 Len=0
Dec 16, 2025 20:14:08.729827000 Eastern Standard Time | TCP | 142.251.163.101 -> 172.25.100.196 | [TCP Dup ACK 234#1] 443 → 63232 [ACK] Seq=1952 Ack=2687 Win=267520 Len=0 SLE=4069 SRE=4342
Dec 16, 2025 20:14:08.729827000 Eastern Standard Time | TCP | 142.251.163.101 -> 172.25.100.196 | 443 → 63232 [ACK] Seq=1952 Ack=4342 Win=265984 Len=0
Dec 16, 2025 20:14:08.729827000 Eastern Standard Time | TCP | 142.251.163.101 -> 172.25.100.196 | 443 → 63232 [ACK] Seq=1952 Ack=6703 Win=263680 Len=0
Dec 16, 2025 20:14:08.730834000 Eastern Standard Time | TCP | 64.233.180.102 -> 172.25.100.196 | 443 → 63233 [ACK] Seq=1 Ack=1383 Win=268544 Len=0
Dec 16, 2025 20:14:08.730834000 Eastern Standard Time | TCP | 64.233.180.102 -> 172.25.100.196 | 443 → 63233 [ACK] Seq=1 Ack=2472 Win=267520 Len=0
Dec 16, 2025 20:14:08.730834000 Eastern Standard Time | TCP | 64.233.180.102 -> 172.25.100.196 | 443 → 63233 [ACK] Seq=1 Ack=2478 Win=267520 Len=0
Dec 16, 2025 20:14:08.730834000 Eastern Standard Time | TCP | 64.233.180.102 -> 172.25.100.196 | 443 → 63233 [ACK] Seq=1 Ack=2570 Win=267520 Len=0
Dec 16, 2025 20:14:08.733429000 Eastern Standard Time | TLSv1.3 | 64.233.180.102 -> 172.25.100.196 | Server Hello, Change Cipher Spec, Encrypted Extensions, Finished
Dec 16, 2025 20:14:08.733429000 Eastern Standard Time | TLSv1.3 | 64.233.180.102 -> 172.25.100.196 | New Session Ticket, New Session Ticket
Dec 16, 2025 20:14:08.733429000 Eastern Standard Time | HTTP2 | 64.233.180.102 -> 172.25.100.196 | SETTINGS[0], WINDOW_UPDATE[0]
Dec 16, 2025 20:14:08.733429000 Eastern Standard Time | HTTP2 | 64.233.180.102 -> 172.25.100.196 | SETTINGS[0]
Dec 16, 2025 20:14:08.733596000 Eastern Standard Time | TCP | 172.25.100.196 -> 64.233.180.102 | 63233 → 443 [ACK] Seq=2570 Ack=1859 Win=65280 Len=0
Dec 16, 2025 20:14:08.733675000 Eastern Standard Time | TCP | 172.25.100.196 -> 64.233.180.102 | 63233 → 443 [ACK] Seq=2570 Ack=1952 Win=65280 Len=0
Dec 16, 2025 20:14:08.734042000 Eastern Standard Time | TLSv1.3 | 172.25.100.196 -> 64.233.180.102 | End of Early Data, Finished
Dec 16, 2025 20:14:08.734696000 Eastern Standard Time | HTTP2 | 172.25.100.196 -> 64.233.180.102 | SETTINGS[0]
Dec 16, 2025 20:14:08.735123000 Eastern Standard Time | HTTP2 | 172.25.100.196 -> 64.233.180.102 | HEADERS[3]: POST /log?hasfast=true&authuser=0&format=json, WINDOW_UPDATE[3]
Dec 16, 2025 20:14:08.735147000 Eastern Standard Time | HTTP2 | 172.25.100.196 -> 64.233.180.102 | DATA[3] (text/plain)
Dec 16, 2025 20:14:08.737701000 Eastern Standard Time | TLSv1.2 | 172.25.100.196 -> 172.64.41.4 | Application Data
Dec 16, 2025 20:14:08.737777000 Eastern Standard Time | TLSv1.2 | 172.25.100.196 -> 172.64.41.4 | Application Data
Dec 16, 2025 20:14:08.738299000 Eastern Standard Time | TLSv1.2 | 172.25.100.196 -> 172.64.41.4 | Application Data
Dec 16, 2025 20:14:08.738348000 Eastern Standard Time | TLSv1.2 | 172.25.100.196 -> 172.64.41.4 | Application Data
Dec 16, 2025 20:14:08.738747000 Eastern Standard Time | TLSv1.2 | 172.25.100.196 -> 172.64.41.4 | Application Data
Dec 16, 2025 20:14:08.738790000 Eastern Standard Time | TLSv1.2 | 172.25.100.196 -> 172.64.41.4 | Application Data
Dec 16, 2025 20:14:08.742655000 Eastern Standard Time | TCP | 172.64.41.4 -> 172.25.100.196 | 443 → 55708 [ACK] Seq=2271 Ack=1076 Win=328 Len=0
Dec 16, 2025 20:14:08.743431000 Eastern Standard Time | TCP | 172.64.41.4 -> 172.25.100.196 | 443 → 55708 [ACK] Seq=2271 Ack=1291 Win=329 Len=0
Dec 16, 2025 20:14:08.743431000 Eastern Standard Time | TCP | 172.64.41.4 -> 172.25.100.196 | 443 → 55708 [ACK] Seq=2271 Ack=1506 Win=329 Len=0
Dec 16, 2025 20:14:08.743683000 Eastern Standard Time | TLSv1.2 | 172.64.41.4 -> 172.25.100.196 | Application Data
Dec 16, 2025 20:14:08.743683000 Eastern Standard Time | TLSv1.2 | 172.64.41.4 -> 172.25.100.196 | Application Data
Dec 16, 2025 20:14:08.743820000 Eastern Standard Time | TCP | 172.25.100.196 -> 172.64.41.4 | 55708 → 443 [ACK] Seq=1506 Ack=2827 Win=255 Len=0
Dec 16, 2025 20:14:08.744390000 Eastern Standard Time | TLSv1.2 | 172.64.41.4 -> 172.25.100.196 | Application Data
Dec 16, 2025 20:14:08.744390000 Eastern Standard Time | TLSv1.2 | 172.64.41.4 -> 172.25.100.196 | Application Data
Dec 16, 2025 20:14:08.744550000 Eastern Standard Time | TCP | 172.25.100.196 -> 172.64.41.4 | 55708 → 443 [ACK] Seq=1506 Ack=3383 Win=253 Len=0
Dec 16, 2025 20:14:08.744808000 Eastern Standard Time | TLSv1.2 | 172.64.41.4 -> 172.25.100.196 | Application Data
Dec 16, 2025 20:14:08.744808000 Eastern Standard Time | TCP | 64.233.180.102 -> 172.25.100.196 | 443 → 63233 [ACK] Seq=1952 Ack=2685 Win=267520 Len=0
Dec 16, 2025 20:14:08.744808000 Eastern Standard Time | TCP | 64.233.180.102 -> 172.25.100.196 | 443 → 63233 [ACK] Seq=1952 Ack=4219 Win=266240 Len=0
Dec 16, 2025 20:14:08.745868000 Eastern Standard Time | TLSv1.2 | 172.64.41.4 -> 172.25.100.196 | Application Data
Dec 16, 2025 20:14:08.745973000 Eastern Standard Time | TCP | 172.25.100.196 -> 172.64.41.4 | 55708 → 443 [ACK] Seq=1506 Ack=3939 Win=251 Len=0
Dec 16, 2025 20:14:08.747651000 Eastern Standard Time | TCP | 172.25.100.196 -> 64.233.185.94 | 63236 → 443 [SYN] Seq=0 Win=65535 Len=0 MSS=1460 WS=256 SACK_PERM
Dec 16, 2025 20:14:08.747966000 Eastern Standard Time | TCP | 172.25.100.196 -> 64.233.185.94 | 63237 → 443 [SYN] Seq=0 Win=65535 Len=0 MSS=1460 WS=256 SACK_PERM
Dec 16, 2025 20:14:08.756646000 Eastern Standard Time | HTTP2 | 64.233.180.102 -> 172.25.100.196 | HEADERS[3]: 200 OK
Dec 16, 2025 20:14:08.756646000 Eastern Standard Time | HTTP2 | 64.233.180.102 -> 172.25.100.196 | DATA[3]
Dec 16, 2025 20:14:08.756646000 Eastern Standard Time | HTTP2 | 64.233.180.102 -> 172.25.100.196 | DATA[3] (text/plain)
Dec 16, 2025 20:14:08.756646000 Eastern Standard Time | HTTP2 | 64.233.180.102 -> 172.25.100.196 | PING[0]
Dec 16, 2025 20:14:08.756852000 Eastern Standard Time | TCP | 172.25.100.196 -> 64.233.180.102 | 63233 → 443 [ACK] Seq=4219 Ack=2632 Win=64512 Len=0
Dec 16, 2025 20:14:08.756962000 Eastern Standard Time | TCP | 172.25.100.196 -> 64.233.180.102 | 63233 → 443 [ACK] Seq=4219 Ack=2702 Win=64512 Len=0
Dec 16, 2025 20:14:08.757037000 Eastern Standard Time | HTTP2 | 172.25.100.196 -> 64.233.180.102 | PING[0]
