tcpdump: listening on en0, link-type EN10MB (Ethernet), snapshot length 96 bytes
13:36:24.027508 IP6 (class 0x02, flowlabel 0x00525, hlim 64, next-header UDP (17) payload length: 1208) 2601:5cf:407e:8160:947e:4e9:57ab:10dd.64728 > 2620:149:a41:880::2:8.443: quic, initial, dcid faa295b5c6addf41, length 1182 [|quic]
13:36:24.051070 IP6 (flowlabel 0x4d51c, hlim 49, next-header ICMPv6 (58) payload length: 1240) 2620:149:a41:880::2:8 > 2601:5cf:407e:8160:947e:4e9:57ab:10dd: ICMP6, destination unreachable, unreachable port [|icmp6]
13:36:24.083743 IP6 (class 0x02, flowlabel 0x00525, hlim 64, next-header UDP (17) payload length: 1208) 2601:5cf:407e:8160:947e:4e9:57ab:10dd.64728 > 2620:149:a41:880::2:8.443: quic, initial, dcid faa295b5c6addf41, length 1182 [|quic]
13:36:24.103301 IP6 (flowlabel 0x4d51c, hlim 49, next-header ICMPv6 (58) payload length: 1240) 2620:149:a41:880::2:8 > 2601:5cf:407e:8160:947e:4e9:57ab:10dd: ICMP6, destination unreachable, unreachable port [|icmp6]
13:36:24.135104 IP6 (class 0x02, flowlabel 0xa253a, hlim 64, next-header UDP (17) payload length: 1208) 2601:5cf:407e:8160:947e:4e9:57ab:10dd.65448 > 2620:149:a41:880::13.443: quic, initial, dcid cf6f451f5d1999de, length 1182 [|quic]
13:36:24.138251 IP6 (flowlabel 0xc60d6, hlim 64, next-header TCP (6) payload length: 44) 2601:5cf:407e:8160:947e:4e9:57ab:10dd.52637 > 2620:149:a41:880::2:8.443: Flags [S], seq 1050617871, win 65535, options [mss 1440,nop,wscale 6,nop,nop,TS val 1612874866 ecr 0,sackOK, [|tcp]
13:36:24.152231 IP6 (flowlabel 0x3a7cc, hlim 49, next-header TCP (6) payload length: 40) 2620:149:a41:880::2:8.443 > 2601:5cf:407e:8160:947e:4e9:57ab:10dd.52637: Flags [S.], cksum 0x360d (correct), seq 3200708345, ack 1050617872, win 32844, options [mss 1440,sackOK,TS val 4016877577 ecr 1612874866,nop,wscale 11], length 0
13:36:24.152746 IP6 (flowlabel 0xc60d6, hlim 64, next-header TCP (6) payload length: 32) 2601:5cf:407e:8160:947e:4e9:57ab:10dd.52637 > 2620:149:a41:880::2:8.443: Flags [.], cksum 0xdd01 (correct), ack 1, win 2053, options [nop,nop,TS val 1612874881 ecr 4016877577], length 0
13:36:24.152749 IP6 (flowlabel 0xc60d6, hlim 64, next-header TCP (6) payload length: 549) 2601:5cf:407e:8160:947e:4e9:57ab:10dd.52637 > 2620:149:a41:880::2:8.443: Flags [P.], seq 1:518, ack 1, win 2053, options [nop,nop,TS val 1612874881 ecr 4016877577], length 517
13:36:24.179067 IP6 (flowlabel 0x3a7cc, hlim 49, next-header TCP (6) payload length: 32) 2620:149:a41:880::2:8.443 > 2601:5cf:407e:8160:947e:4e9:57ab:10dd.52637: Flags [.], cksum 0xe2d7 (correct), ack 518, win 16, options [nop,nop,TS val 4016877603 ecr 1612874881], length 0
13:36:24.181117 IP6 (flowlabel 0x3a7cc, hlim 49, next-header TCP (6) payload length: 1460) 2620:149:a41:880::2:8.443 > 2601:5cf:407e:8160:947e:4e9:57ab:10dd.52637: Flags [.], seq 1:1429, ack 518, win 16, options [nop,nop,TS val 4016877604 ecr 1612874881], length 1428
13:36:24.181603 IP6 (flowlabel 0xc60d6, hlim 64, next-header TCP (6) payload length: 32) 2601:5cf:407e:8160:947e:4e9:57ab:10dd.52637 > 2620:149:a41:880::2:8.443: Flags [.], cksum 0xd546 (correct), ack 1429, win 2031, options [nop,nop,TS val 1612874910 ecr 4016877604], length 0
13:36:24.184965 IP6 (flowlabel 0x3a7cc, hlim 49, next-header TCP (6) payload length: 1460) 2620:149:a41:880::2:8.443 > 2601:5cf:407e:8160:947e:4e9:57ab:10dd.52637: Flags [P.], seq 1429:2857, ack 518, win 16, options [nop,nop,TS val 4016877604 ecr 1612874881], length 1428
13:36:24.184970 IP6 (flowlabel 0x3a7cc, hlim 49, next-header TCP (6) payload length: 765) 2620:149:a41:880::2:8.443 > 2601:5cf:407e:8160:947e:4e9:57ab:10dd.52637: Flags [P.], seq 2857:3590, ack 518, win 16, options [nop,nop,TS val 4016877604 ecr 1612874881], length 733
13:36:24.185438 IP6 (flowlabel 0xc60d6, hlim 64, next-header TCP (6) payload length: 32) 2601:5cf:407e:8160:947e:4e9:57ab:10dd.52637 > 2620:149:a41:880::2:8.443: Flags [.], cksum 0xcce2 (correct), ack 3590, win 2015, options [nop,nop,TS val 1612874913 ecr 4016877604], length 0
13:36:24.191933 IP6 (class 0x02, flowlabel 0x00525, hlim 64, next-header UDP (17) payload length: 1208) 2601:5cf:407e:8160:947e:4e9:57ab:10dd.64728 > 2620:149:a41:880::2:8.443: quic, initial, dcid faa295b5c6addf41, length 1182 [|quic]
13:36:24.200385 IP6 (flowlabel 0xc60d6, hlim 64, next-header TCP (6) payload length: 112) 2601:5cf:407e:8160:947e:4e9:57ab:10dd.52637 > 2620:149:a41:880::2:8.443: Flags [P.], seq 518:598, ack 3590, win 2048, options [nop,nop,TS val 1612874929 ecr 4016877604], length 80
13:36:24.210036 IP6 (flowlabel 0xc60d6, hlim 64, next-header TCP (6) payload length: 1394) 2601:5cf:407e:8160:947e:4e9:57ab:10dd.52637 > 2620:149:a41:880::2:8.443: Flags [P.], seq 598:1960, ack 3590, win 2048, options [nop,nop,TS val 1612874938 ecr 4016877604], length 1362
13:36:24.210259 IP6 (flowlabel 0xc60d6, hlim 64, next-header TCP (6) payload length: 844) 2601:5cf:407e:8160:947e:4e9:57ab:10dd.52637 > 2620:149:a41:880::2:8.443: Flags [P.], seq 1960:2772, ack 3590, win 2048, options [nop,nop,TS val 1612874938 ecr 4016877604], length 812
13:36:24.210365 IP6 (flowlabel 0xc60d6, hlim 64, next-header TCP (6) payload length: 63) 2601:5cf:407e:8160:947e:4e9:57ab:10dd.52637 > 2620:149:a41:880::2:8.443: Flags [P.], seq 2772:2803, ack 3590, win 2048, options [nop,nop,TS val 1612874938 ecr 4016877604], length 31
13:36:24.220138 IP6 (flowlabel 0x3a7cc, hlim 49, next-header TCP (6) payload length: 335) 2620:149:a41:880::2:8.443 > 2601:5cf:407e:8160:947e:4e9:57ab:10dd.52637: Flags [P.], seq 3590:3893, ack 598, win 16, options [nop,nop,TS val 4016877639 ecr 1612874929], length 303
13:36:24.220141 IP6 (flowlabel 0x3a7cc, hlim 49, next-header TCP (6) payload length: 335) 2620:149:a41:880::2:8.443 > 2601:5cf:407e:8160:947e:4e9:57ab:10dd.52637: Flags [P.], seq 3893:4196, ack 598, win 16, options [nop,nop,TS val 4016877640 ecr 1612874929], length 303
13:36:24.220144 IP6 (flowlabel 0x3a7cc, hlim 49, next-header TCP (6) payload length: 94) 2620:149:a41:880::2:8.443 > 2601:5cf:407e:8160:947e:4e9:57ab:10dd.52637: Flags [P.], seq 4196:4258, ack 598, win 16, options [nop,nop,TS val 4016877640 ecr 1612874929], length 62
13:36:24.220407 IP6 (flowlabel 0xc60d6, hlim 64, next-header TCP (6) payload length: 32) 2601:5cf:407e:8160:947e:4e9:57ab:10dd.52637 > 2620:149:a41:880::2:8.443: Flags [.], cksum 0xc0fa (correct), ack 4258, win 2038, options [nop,nop,TS val 1612874949 ecr 4016877640], length 0
13:36:24.220509 IP6 (flowlabel 0xc60d6, hlim 64, next-header TCP (6) payload length: 63) 2601:5cf:407e:8160:947e:4e9:57ab:10dd.52637 > 2620:149:a41:880::2:8.443: Flags [P.], seq 2803:2834, ack 4258, win 2048, options [nop,nop,TS val 1612874949 ecr 4016877640], length 31
13:36:24.237068 IP6 (flowlabel 0x3a7cc, hlim 49, next-header TCP (6) payload length: 32) 2620:149:a41:880::2:8.443 > 2601:5cf:407e:8160:947e:4e9:57ab:10dd.52637: Flags [.], cksum 0xc8f4 (correct), ack 2772, win 16, options [nop,nop,TS val 4016877662 ecr 1612874938], length 0
13:36:24.238734 IP6 (flowlabel 0x3a7cc, hlim 49, next-header TCP (6) payload length: 63) 2620:149:a41:880::2:8.443 > 2601:5cf:407e:8160:947e:4e9:57ab:10dd.52637: Flags [P.], seq 4258:4289, ack 2803, win 16, options [nop,nop,TS val 4016877662 ecr 1612874938], length 31
13:36:24.238846 IP6 (flowlabel 0xc60d6, hlim 64, next-header TCP (6) payload length: 32) 2601:5cf:407e:8160:947e:4e9:57ab:10dd.52637 > 2620:149:a41:880::2:8.443: Flags [.], cksum 0xc08a (correct), ack 4289, win 2048, options [nop,nop,TS val 1612874967 ecr 4016877662], length 0
13:36:24.268902 IP6 (flowlabel 0xc60d6, hlim 64, next-header TCP (6) payload length: 63) 2601:5cf:407e:8160:947e:4e9:57ab:10dd.52637 > 2620:149:a41:880::2:8.443: Flags [P.], seq 2803:2834, ack 4289, win 2048, options [nop,nop,TS val 1612874997 ecr 4016877662], length 31
13:36:24.286052 IP6 (flowlabel 0x3a7cc, hlim 49, next-header TCP (6) payload length: 44) 2620:149:a41:880::2:8.443 > 2601:5cf:407e:8160:947e:4e9:57ab:10dd.52637: Flags [.], ack 2834, win 16, options [nop,nop,TS val 4016877711 ecr 1612874997,nop,nop,sack 1  [|tcp]>
13:36:24.452842 IP6 (flowlabel 0x3a7cc, hlim 49, next-header TCP (6) payload length: 1460) 2620:149:a41:880::2:8.443 > 2601:5cf:407e:8160:947e:4e9:57ab:10dd.52637: Flags [.], seq 4289:5717, ack 2834, win 16, options [nop,nop,TS val 4016877876 ecr 1612874997], length 1428
13:36:24.452957 IP6 (flowlabel 0xc60d6, hlim 64, next-header TCP (6) payload length: 32) 2601:5cf:407e:8160:947e:4e9:57ab:10dd.52637 > 2620:149:a41:880::2:8.443: Flags [.], cksum 0xb960 (correct), ack 5717, win 2026, options [nop,nop,TS val 1612875181 ecr 4016877876], length 0
13:36:24.454422 IP6 (flowlabel 0x3a7cc, hlim 49, next-header TCP (6) payload length: 356) 2620:149:a41:880::2:8.443 > 2601:5cf:407e:8160:947e:4e9:57ab:10dd.52637: Flags [P.], seq 5717:6041, ack 2834, win 16, options [nop,nop,TS val 4016877876 ecr 1612874997], length 324
13:36:24.454523 IP6 (flowlabel 0xc60d6, hlim 64, next-header TCP (6) payload length: 32) 2601:5cf:407e:8160:947e:4e9:57ab:10dd.52637 > 2620:149:a41:880::2:8.443: Flags [.], cksum 0xb809 (correct), ack 6041, win 2043, options [nop,nop,TS val 1612875183 ecr 4016877876], length 0
13:36:24.608491 IP6 (flowlabel 0x30a00, hlim 255, next-header UDP (17) payload length: 52) fe80::10aa:d4f8:a46a:7d1d.5353 > fe80::48e:8d82:cc1:8de6.5353: 0 [|domain]
13:36:24.626247 IP6 (flowlabel 0x5fc09, hlim 64, next-header TCP (6) payload length: 244) 2601:5cf:407e:8160:947e:4e9:57ab:10dd.52634 > 2620:149:a41:880::2:8.443: Flags [P.], seq 3435093092:3435093304, ack 191069704, win 2048, options [nop,nop,TS val 4070522012 ecr 3038404902], length 212
13:36:24.626489 IP6 (flowlabel 0x5fc09, hlim 64, next-header TCP (6) payload length: 648) 2601:5cf:407e:8160:947e:4e9:57ab:10dd.52634 > 2620:149:a41:880::2:8.443: Flags [P.], seq 212:828, ack 1, win 2048, options [nop,nop,TS val 4070522012 ecr 3038404902], length 616
13:36:24.626616 IP6 (flowlabel 0x5fc09, hlim 64, next-header TCP (6) payload length: 63) 2601:5cf:407e:8160:947e:4e9:57ab:10dd.52634 > 2620:149:a41:880::2:8.443: Flags [P.], seq 828:859, ack 1, win 2048, options [nop,nop,TS val 4070522012 ecr 3038404902], length 31
13:36:24.641711 IP6 (flowlabel 0xccfa0, hlim 49, next-header TCP (6) payload length: 32) 2620:149:a41:880::2:8.443 > 2601:5cf:407e:8160:947e:4e9:57ab:10dd.52634: Flags [.], cksum 0x7f3d (correct), ack 212, win 42, options [nop,nop,TS val 3038406259 ecr 4070522012], length 0
13:36:24.650236 IP6 (flowlabel 0xccfa0, hlim 49, next-header TCP (6) payload length: 32) 2620:149:a41:880::2:8.443 > 2601:5cf:407e:8160:947e:4e9:57ab:10dd.52634: Flags [.], cksum 0x7ccc (correct), ack 828, win 42, options [nop,nop,TS val 3038406268 ecr 4070522012], length 0
13:36:24.650238 IP6 (flowlabel 0xccfa0, hlim 49, next-header TCP (6) payload length: 32) 2620:149:a41:880::2:8.443 > 2601:5cf:407e:8160:947e:4e9:57ab:10dd.52634: Flags [.], cksum 0x7cad (correct), ack 859, win 42, options [nop,nop,TS val 3038406268 ecr 4070522012], length 0
13:36:24.688230 IP6 (flowlabel 0x30a00, hlim 255, next-header UDP (17) payload length: 66) fe80::10aa:d4f8:a46a:7d1d.5353 > ff02::fb.5353: 0 [2q] [|domain]
13:36:24.793352 IP6 (flowlabel 0xccfa0, hlim 49, next-header TCP (6) payload length: 664) 2620:149:a41:880::2:8.443 > 2601:5cf:407e:8160:947e:4e9:57ab:10dd.52634: Flags [P.], seq 1:633, ack 859, win 42, options [nop,nop,TS val 3038406407 ecr 4070522012], length 632
13:36:24.793612 IP6 (flowlabel 0x5fc09, hlim 64, next-header TCP (6) payload length: 32) 2601:5cf:407e:8160:947e:4e9:57ab:10dd.52634 > 2620:149:a41:880::2:8.443: Flags [.], cksum 0x7136 (correct), ack 633, win 2039, options [nop,nop,TS val 4070522179 ecr 3038406407], length 0
13:36:24.823438 IP6 (flowlabel 0x5fc09, hlim 64, next-header TCP (6) payload length: 150) 2601:5cf:407e:8160:947e:4e9:57ab:10dd.52634 > 2620:149:a41:880::2:8.443: Flags [P.], seq 859:977, ack 633, win 2048, options [nop,nop,TS val 4070522209 ecr 3038406407], length 118
13:36:24.823713 IP6 (flowlabel 0x5fc09, hlim 64, next-header TCP (6) payload length: 1460) 2601:5cf:407e:8160:947e:4e9:57ab:10dd.52634 > 2620:149:a41:880::2:8.443: Flags [.], seq 977:2405, ack 633, win 2048, options [nop,nop,TS val 4070522209 ecr 3038406407], length 1428
13:36:24.823727 IP6 (flowlabel 0x5fc09, hlim 64, next-header TCP (6) payload length: 652) 2601:5cf:407e:8160:947e:4e9:57ab:10dd.52634 > 2620:149:a41:880::2:8.443: Flags [P.], seq 2405:3025, ack 633, win 2048, options [nop,nop,TS val 4070522209 ecr 3038406407], length 620
13:36:24.823743 IP6 (flowlabel 0x5fc09, hlim 64, next-header TCP (6) payload length: 96) 2601:5cf:407e:8160:947e:4e9:57ab:10dd.52634 > 2620:149:a41:880::2:8.443: Flags [P.], seq 3025:3089, ack 633, win 2048, options [nop,nop,TS val 4070522209 ecr 3038406407], length 64
13:36:24.823868 IP6 (flowlabel 0x5fc09, hlim 64, next-header TCP (6) payload length: 63) 2601:5cf:407e:8160:947e:4e9:57ab:10dd.52634 > 2620:149:a41:880::2:8.443: Flags [P.], seq 3089:3120, ack 633, win 2048, options [nop,nop,TS val 4070522209 ecr 3038406407], length 31
13:36:24.839786 IP6 (flowlabel 0xccfa0, hlim 49, next-header TCP (6) payload length: 32) 2620:149:a41:880::2:8.443 > 2601:5cf:407e:8160:947e:4e9:57ab:10dd.52634: Flags [.], cksum 0x783c (correct), ack 977, win 42, options [nop,nop,TS val 3038406458 ecr 4070522209], length 0
13:36:24.844918 IP6 (flowlabel 0xccfa0, hlim 49, next-header TCP (6) payload length: 32) 2620:149:a41:880::2:8.443 > 2601:5cf:407e:8160:947e:4e9:57ab:10dd.52634: Flags [.], cksum 0x7038 (correct), ack 3025, win 41, options [nop,nop,TS val 3038406463 ecr 4070522209], length 0
13:36:24.844922 IP6 (flowlabel 0xccfa0, hlim 49, next-header TCP (6) payload length: 32) 2620:149:a41:880::2:8.443 > 2601:5cf:407e:8160:947e:4e9:57ab:10dd.52634: Flags [.], cksum 0x6ff8 (correct), ack 3089, win 41, options [nop,nop,TS val 3038406463 ecr 4070522209], length 0
13:36:24.845258 IP6 (flowlabel 0xccfa0, hlim 49, next-header TCP (6) payload length: 32) 2620:149:a41:880::2:8.443 > 2601:5cf:407e:8160:947e:4e9:57ab:10dd.52634: Flags [.], cksum 0x6fd9 (correct), ack 3120, win 41, options [nop,nop,TS val 3038406463 ecr 4070522209], length 0
13:36:24.995203 IP6 (flowlabel 0x30a00, hlim 255, next-header UDP (17) payload length: 52) fe80::10aa:d4f8:a46a:7d1d.5353 > ff02::fb.5353: 0 [|domain]
13:36:25.081758 IP6 (flowlabel 0x00b00, hlim 255, next-header UDP (17) payload length: 44) fe80::1018:6bca:efd6:7d23.5353 > ff02::fb.5353: 0 [|domain]
13:36:25.187074 IP6 (flowlabel 0xf0800, hlim 255, next-header UDP (17) payload length: 485) fe80::48e:8d82:cc1:8de6.5353 > ff02::fb.5353: 0*- [0q] 2/0/8 _companion-link._tcp. [|domain]
13:36:25.507365 IP6 (flowlabel 0x0302e, hlim 255, next-header ICMPv6 (58) payload length: 136) fe80::aa70:5dff:feea:b5bd > ff02::1: ICMP6, router advertisement, length 136
	hop limit 64, Flags [managed, other stateful], pref medium, router lifetime 180s, reachable time 0ms, retrans timer 0ms [|icmp6]
13:36:25.804450 IP6 (flowlabel 0xc60d6, hlim 64, next-header TCP (6) payload length: 71) 2601:5cf:407e:8160:947e:4e9:57ab:10dd.52637 > 2620:149:a41:880::2:8.443: Flags [P.], seq 2834:2873, ack 6041, win 2048, options [nop,nop,TS val 1612876533 ecr 4016877876], length 39
13:36:25.804909 IP6 (flowlabel 0xc60d6, hlim 64, next-header TCP (6) payload length: 56) 2601:5cf:407e:8160:947e:4e9:57ab:10dd.52637 > 2620:149:a41:880::2:8.443: Flags [P.], seq 2873:2897, ack 6041, win 2048, options [nop,nop,TS val 1612876533 ecr 4016877876], length 24
13:36:25.805808 IP6 (flowlabel 0xc60d6, hlim 64, next-header TCP (6) payload length: 32) 2601:5cf:407e:8160:947e:4e9:57ab:10dd.52637 > 2620:149:a41:880::2:8.443: Flags [F.], cksum 0xb27d (correct), seq 2897, ack 6041, win 2048, options [nop,nop,TS val 1612876534 ecr 4016877876], length 0
13:36:25.823398 IP6 (flowlabel 0x3a7cc, hlim 49, next-header TCP (6) payload length: 32) 2620:149:a41:880::2:8.443 > 2601:5cf:407e:8160:947e:4e9:57ab:10dd.52637: Flags [.], cksum 0xb52c (correct), ack 2873, win 16, options [nop,nop,TS val 4016879247 ecr 1612876533], length 0
13:36:25.824969 IP6 (flowlabel 0x3a7cc, hlim 49, next-header TCP (6) payload length: 32) 2620:149:a41:880::2:8.443 > 2601:5cf:407e:8160:947e:4e9:57ab:10dd.52637: Flags [.], cksum 0xb514 (correct), ack 2897, win 16, options [nop,nop,TS val 4016879247 ecr 1612876533], length 0
13:36:25.824973 IP6 (flowlabel 0x3a7cc, hlim 49, next-header TCP (6) payload length: 32) 2620:149:a41:880::2:8.443 > 2601:5cf:407e:8160:947e:4e9:57ab:10dd.52637: Flags [F.], cksum 0xb511 (correct), seq 6041, ack 2898, win 16, options [nop,nop,TS val 4016879247 ecr 1612876534], length 0
13:36:25.825090 IP6 (flowlabel 0xc60d6, hlim 64, next-header TCP (6) payload length: 32) 2601:5cf:407e:8160:947e:4e9:57ab:10dd.52637 > 2620:149:a41:880::2:8.443: Flags [.], cksum 0xad0e (correct), ack 6042, win 2048, options [nop,nop,TS val 1612876553 ecr 4016879247], length 0
13:36:25.997726 IP6 (flowlabel 0xccfa0, hlim 49, next-header TCP (6) payload length: 1460) 2620:149:a41:880::2:8.443 > 2601:5cf:407e:8160:947e:4e9:57ab:10dd.52634: Flags [.], seq 633:2061, ack 3120, win 42, options [nop,nop,TS val 3038407616 ecr 4070522209], length 1428
13:36:25.997731 IP6 (flowlabel 0xccfa0, hlim 49, next-header TCP (6) payload length: 437) 2620:149:a41:880::2:8.443 > 2601:5cf:407e:8160:947e:4e9:57ab:10dd.52634: Flags [P.], seq 2061:2466, ack 3120, win 42, options [nop,nop,TS val 3038407616 ecr 4070522209], length 405
13:36:25.997734 IP6 (flowlabel 0xccfa0, hlim 49, next-header TCP (6) payload length: 63) 2620:149:a41:880::2:8.443 > 2601:5cf:407e:8160:947e:4e9:57ab:10dd.52634: Flags [P.], seq 2466:2497, ack 3120, win 42, options [nop,nop,TS val 3038407616 ecr 4070522209], length 31
13:36:25.998049 IP6 (flowlabel 0x5fc09, hlim 64, next-header TCP (6) payload length: 32) 2601:5cf:407e:8160:947e:4e9:57ab:10dd.52634 > 2620:149:a41:880::2:8.443: Flags [.], cksum 0x57c0 (correct), ack 2497, win 2019, options [nop,nop,TS val 4070523383 ecr 3038407616], length 0
13:36:26.038213 IP6 (flowlabel 0x5fc09, hlim 64, next-header TCP (6) payload length: 225) 2601:5cf:407e:8160:947e:4e9:57ab:10dd.52634 > 2620:149:a41:880::2:8.443: Flags [P.], seq 3120:3313, ack 2497, win 2048, options [nop,nop,TS val 4070523424 ecr 3038407616], length 193
13:36:26.038473 IP6 (flowlabel 0x5fc09, hlim 64, next-header TCP (6) payload length: 914) 2601:5cf:407e:8160:947e:4e9:57ab:10dd.52634 > 2620:149:a41:880::2:8.443: Flags [P.], seq 3313:4195, ack 2497, win 2048, options [nop,nop,TS val 4070523424 ecr 3038407616], length 882
13:36:26.038596 IP6 (flowlabel 0x5fc09, hlim 64, next-header TCP (6) payload length: 63) 2601:5cf:407e:8160:947e:4e9:57ab:10dd.52634 > 2620:149:a41:880::2:8.443: Flags [P.], seq 4195:4226, ack 2497, win 2048, options [nop,nop,TS val 4070523424 ecr 3038407616], length 31
13:36:26.062043 IP6 (flowlabel 0xccfa0, hlim 49, next-header TCP (6) payload length: 32) 2620:149:a41:880::2:8.443 > 2601:5cf:407e:8160:947e:4e9:57ab:10dd.52634: Flags [.], cksum 0x5e4f (correct), ack 3313, win 42, options [nop,nop,TS val 3038407680 ecr 4070523424], length 0
13:36:26.071583 IP6 (flowlabel 0xccfa0, hlim 49, next-header TCP (6) payload length: 32) 2620:149:a41:880::2:8.443 > 2601:5cf:407e:8160:947e:4e9:57ab:10dd.52634: Flags [.], cksum 0x5ad4 (correct), ack 4195, win 42, options [nop,nop,TS val 3038407689 ecr 4070523424], length 0
13:36:26.071585 IP6 (flowlabel 0xccfa0, hlim 49, next-header TCP (6) payload length: 32) 2620:149:a41:880::2:8.443 > 2601:5cf:407e:8160:947e:4e9:57ab:10dd.52634: Flags [.], cksum 0x5ab5 (correct), ack 4226, win 42, options [nop,nop,TS val 3038407689 ecr 4070523424], length 0
13:36:26.209917 IP6 (flowlabel 0xccfa0, hlim 49, next-header TCP (6) payload length: 1460) 2620:149:a41:880::2:8.443 > 2601:5cf:407e:8160:947e:4e9:57ab:10dd.52634: Flags [.], seq 2497:3925, ack 4226, win 42, options [nop,nop,TS val 3038407826 ecr 4070523424], length 1428
13:36:26.209922 IP6 (flowlabel 0xccfa0, hlim 49, next-header TCP (6) payload length: 1460) 2620:149:a41:880::2:8.443 > 2601:5cf:407e:8160:947e:4e9:57ab:10dd.52634: Flags [P.], seq 3925:5353, ack 4226, win 42, options [nop,nop,TS val 3038407826 ecr 4070523424], length 1428
13:36:26.209925 IP6 (flowlabel 0xccfa0, hlim 49, next-header TCP (6) payload length: 1460) 2620:149:a41:880::2:8.443 > 2601:5cf:407e:8160:947e:4e9:57ab:10dd.52634: Flags [.], seq 5353:6781, ack 4226, win 42, options [nop,nop,TS val 3038407827 ecr 4070523424], length 1428
13:36:26.209928 IP6 (flowlabel 0xccfa0, hlim 49, next-header TCP (6) payload length: 729) 2620:149:a41:880::2:8.443 > 2601:5cf:407e:8160:947e:4e9:57ab:10dd.52634: Flags [P.], seq 6781:7478, ack 4226, win 42, options [nop,nop,TS val 3038407827 ecr 4070523424], length 697
13:36:26.210279 IP6 (flowlabel 0x5fc09, hlim 64, next-header TCP (6) payload length: 32) 2601:5cf:407e:8160:947e:4e9:57ab:10dd.52634 > 2620:149:a41:880::2:8.443: Flags [.], cksum 0x3e82 (correct), ack 7478, win 1971, options [nop,nop,TS val 4070523595 ecr 3038407827], length 0
13:36:26.210285 IP6 (flowlabel 0x5fc09, hlim 64, next-header TCP (6) payload length: 32) 2601:5cf:407e:8160:947e:4e9:57ab:10dd.52634 > 2620:149:a41:880::2:8.443: Flags [.], cksum 0x3e35 (correct), ack 7478, win 2048, options [nop,nop,TS val 4070523595 ecr 3038407827], length 0
13:36:26.506722 IP6 (flowlabel 0x5fc09, hlim 64, next-header TCP (6) payload length: 168) 2601:5cf:407e:8160:947e:4e9:57ab:10dd.52634 > 2620:149:a41:880::2:8.443: Flags [P.], seq 4226:4362, ack 7478, win 2048, options [nop,nop,TS val 4070523892 ecr 3038407827], length 136
13:36:26.506990 IP6 (flowlabel 0x5fc09, hlim 64, next-header TCP (6) payload length: 916) 2601:5cf:407e:8160:947e:4e9:57ab:10dd.52634 > 2620:149:a41:880::2:8.443: Flags [P.], seq 4362:5246, ack 7478, win 2048, options [nop,nop,TS val 4070523892 ecr 3038407827], length 884
13:36:26.507120 IP6 (flowlabel 0x5fc09, hlim 64, next-header TCP (6) payload length: 63) 2601:5cf:407e:8160:947e:4e9:57ab:10dd.52634 > 2620:149:a41:880::2:8.443: Flags [P.], seq 5246:5277, ack 7478, win 2048, options [nop,nop,TS val 4070523892 ecr 3038407827], length 31
13:36:26.524456 IP6 (flowlabel 0xccfa0, hlim 49, next-header TCP (6) payload length: 32) 2620:149:a41:880::2:8.443 > 2601:5cf:407e:8160:947e:4e9:57ab:10dd.52634: Flags [.], cksum 0x431f (correct), ack 4362, win 42, options [nop,nop,TS val 3038408142 ecr 4070523892], length 0
13:36:26.532923 IP6 (flowlabel 0xccfa0, hlim 49, next-header TCP (6) payload length: 32) 2620:149:a41:880::2:8.443 > 2601:5cf:407e:8160:947e:4e9:57ab:10dd.52634: Flags [.], cksum 0x3fa2 (correct), ack 5246, win 42, options [nop,nop,TS val 3038408151 ecr 4070523892], length 0
13:36:26.532926 IP6 (flowlabel 0xccfa0, hlim 49, next-header TCP (6) payload length: 32) 2620:149:a41:880::2:8.443 > 2601:5cf:407e:8160:947e:4e9:57ab:10dd.52634: Flags [.], cksum 0x3f83 (correct), ack 5277, win 42, options [nop,nop,TS val 3038408151 ecr 4070523892], length 0
13:36:26.592953 IP6 (hlim 255, next-header ICMPv6 (58) payload length: 32) fe80::aa70:5dff:feea:b5bd > 2601:5cf:407e:8160:947e:4e9:57ab:10dd: [icmp6 sum ok] ICMP6, neighbor solicitation, length 32, who has 2601:5cf:407e:8160:947e:4e9:57ab:10dd
	  source link-address option (1), length 8 (1): a8:70:5d:ea:b5:bd
13:36:26.593080 IP6 (hlim 255, next-header ICMPv6 (58) payload length: 24) fe80::48e:8d82:cc1:8de6 > fe80::aa70:5dff:feea:b5bd: [icmp6 sum ok] ICMP6, neighbor advertisement, length 24, tgt is 2601:5cf:407e:8160:947e:4e9:57ab:10dd, Flags [solicited]
13:36:26.697130 IP6 (flowlabel 0xccfa0, hlim 49, next-header TCP (6) payload length: 686) 2620:149:a41:880::2:8.443 > 2601:5cf:407e:8160:947e:4e9:57ab:10dd.52634: Flags [P.], seq 7478:8132, ack 5277, win 42, options [nop,nop,TS val 3038408315 ecr 4070523892], length 654
13:36:26.697250 IP6 (flowlabel 0x5fc09, hlim 64, next-header TCP (6) payload length: 32) 2601:5cf:407e:8160:947e:4e9:57ab:10dd.52634 > 2620:149:a41:880::2:8.443: Flags [.], cksum 0x33c6 (correct), ack 8132, win 2038, options [nop,nop,TS val 4070524083 ecr 3038408315], length 0
13:36:28.175619 IP6 (flowlabel 0xc0900, hlim 64, next-header TCP (6) payload length: 20) fe80::4d:2cb8:5deb:85d6.50586 > fe80::48e:8d82:cc1:8de6.64105: Flags [.], cksum 0x1d1a (correct), ack 2920150003, win 2048, length 0
13:36:28.175852 IP6 (flowlabel 0x70f00, hlim 64, next-header TCP (6) payload length: 32) fe80::48e:8d82:cc1:8de6.64105 > fe80::4d:2cb8:5deb:85d6.50586: Flags [.], cksum 0xd67d (correct), ack 1, win 2048, options [nop,nop,TS val 3189107008 ecr 1176313872], length 0
13:36:28.477627 IP6 (flowlabel 0x0302e, hlim 255, next-header ICMPv6 (58) payload length: 136) fe80::aa70:5dff:feea:b5bd > ff02::1: ICMP6, router advertisement, length 136
	hop limit 64, Flags [managed, other stateful], pref medium, router lifetime 180s, reachable time 0ms, retrans timer 0ms [|icmp6]
13:36:28.763139 IP6 (flowlabel 0xc0600, hlim 64, next-header UDP (17) payload length: 43) 2601:5cf:407e:8160:947e:4e9:57ab:10dd.52360 > 2603:1036:207:458::2.443: quic, protected [|quic]
13:36:28.824934 IP6 (flowlabel 0xb1b11, hlim 110, next-header UDP (17) payload length: 36) 2603:1036:207:458::2.443 > 2601:5cf:407e:8160:947e:4e9:57ab:10dd.52360: [udp sum ok] quic, protected
13:36:29.008604 IP6 (hlim 56, next-header UDP (17) payload length: 45) 2607:f8b0:4004:c17::8a.443 > 2601:5cf:407e:8160:947e:4e9:57ab:10dd.52664: quic, protected [|quic]
13:36:29.012996 IP6 (flowlabel 0xd0500, hlim 64, next-header UDP (17) payload length: 41) 2601:5cf:407e:8160:947e:4e9:57ab:10dd.52664 > 2607:f8b0:4004:c17::8a.443: [udp sum ok] quic, protected
13:36:29.145234 IP6 (flowlabel 0x5fc09, hlim 64, next-header TCP (6) payload length: 71) 2601:5cf:407e:8160:947e:4e9:57ab:10dd.52634 > 2620:149:a41:880::2:8.443: Flags [P.], seq 5277:5316, ack 8132, win 2048, options [nop,nop,TS val 4070526531 ecr 3038408315], length 39
13:36:29.145688 IP6 (flowlabel 0x5fc09, hlim 64, next-header TCP (6) payload length: 56) 2601:5cf:407e:8160:947e:4e9:57ab:10dd.52634 > 2620:149:a41:880::2:8.443: Flags [P.], seq 5316:5340, ack 8132, win 2048, options [nop,nop,TS val 4070526531 ecr 3038408315], length 24
13:36:29.146548 IP6 (flowlabel 0x5fc09, hlim 64, next-header TCP (6) payload length: 32) 2601:5cf:407e:8160:947e:4e9:57ab:10dd.52634 > 2620:149:a41:880::2:8.443: Flags [F.], cksum 0x29eb (correct), seq 5340, ack 8132, win 2048, options [nop,nop,TS val 4070526532 ecr 3038408315], length 0
13:36:29.161147 IP6 (flowlabel 0xccfa0, hlim 49, next-header TCP (6) payload length: 32) 2620:149:a41:880::2:8.443 > 2601:5cf:407e:8160:947e:4e9:57ab:10dd.52634: Flags [.], cksum 0x283c (correct), ack 5316, win 42, options [nop,nop,TS val 3038410778 ecr 4070526531], length 0
13:36:29.167890 IP6 (flowlabel 0xccfa0, hlim 49, next-header TCP (6) payload length: 32) 2620:149:a41:880::2:8.443 > 2601:5cf:407e:8160:947e:4e9:57ab:10dd.52634: Flags [.], cksum 0x281d (correct), ack 5340, win 42, options [nop,nop,TS val 3038410785 ecr 4070526531], length 0
13:36:29.169438 IP6 (flowlabel 0xccfa0, hlim 49, next-header TCP (6) payload length: 32) 2620:149:a41:880::2:8.443 > 2601:5cf:407e:8160:947e:4e9:57ab:10dd.52634: Flags [F.], cksum 0x2819 (correct), seq 8132, ack 5341, win 42, options [nop,nop,TS val 3038410786 ecr 4070526532], length 0
13:36:29.169552 IP6 (flowlabel 0x5fc09, hlim 64, next-header TCP (6) payload length: 32) 2601:5cf:407e:8160:947e:4e9:57ab:10dd.52634 > 2620:149:a41:880::2:8.443: Flags [.], cksum 0x202c (correct), ack 8133, win 2048, options [nop,nop,TS val 4070526555 ecr 3038410786], length 0
13:36:31.548991 IP6 (flowlabel 0x0302e, hlim 255, next-header ICMPv6 (58) payload length: 136) fe80::aa70:5dff:feea:b5bd > ff02::1: ICMP6, router advertisement, length 136
	hop limit 64, Flags [managed, other stateful], pref medium, router lifetime 180s, reachable time 0ms, retrans timer 0ms [|icmp6]
13:36:31.550117 IP6 (class 0x02, flowlabel 0x56784, hlim 64, next-header UDP (17) payload length: 1208) 2601:5cf:407e:8160:947e:4e9:57ab:10dd.57391 > 2620:149:a41:880::2:8.443: quic, initial, dcid 16b49dd0d9cca7d4, length 1182 [|quic]
13:36:31.600366 IP6 (class 0x02, flowlabel 0x56784, hlim 64, next-header UDP (17) payload length: 1208) 2601:5cf:407e:8160:947e:4e9:57ab:10dd.57391 > 2620:149:a41:880::2:8.443: quic, initial, dcid 16b49dd0d9cca7d4, length 1182 [|quic]
13:36:31.656787 IP6 (class 0x02, flowlabel 0xd89e8, hlim 64, next-header UDP (17) payload length: 1208) 2601:5cf:407e:8160:947e:4e9:57ab:10dd.56890 > 2620:149:a41:880::13.443: quic, initial, dcid 46f7a88e472243a6, length 1182 [|quic]
13:36:31.660384 IP6 (flowlabel 0xc25f0, hlim 64, next-header TCP (6) payload length: 44) 2601:5cf:407e:8160:947e:4e9:57ab:10dd.52638 > 2620:149:a41:880::2:8.443: Flags [S], seq 2204798061, win 65535, options [mss 1440,nop,wscale 6,nop,nop,TS val 159282917 ecr 0,sackOK, [|tcp]
13:36:31.674486 IP6 (flowlabel 0x525c2, hlim 49, next-header TCP (6) payload length: 40) 2620:149:a41:880::2:8.443 > 2601:5cf:407e:8160:947e:4e9:57ab:10dd.52638: Flags [S.], cksum 0x5ca8 (correct), seq 2516541775, ack 2204798062, win 64260, options [mss 1440,sackOK,TS val 2791557431 ecr 159282917,nop,wscale 11], length 0
13:36:31.675018 IP6 (flowlabel 0xc25f0, hlim 64, next-header TCP (6) payload length: 32) 2601:5cf:407e:8160:947e:4e9:57ab:10dd.52638 > 2620:149:a41:880::2:8.443: Flags [.], cksum 0x7e55 (correct), ack 1, win 2053, options [nop,nop,TS val 159282932 ecr 2791557431], length 0
13:36:31.675022 IP6 (flowlabel 0xc25f0, hlim 64, next-header TCP (6) payload length: 549) 2601:5cf:407e:8160:947e:4e9:57ab:10dd.52638 > 2620:149:a41:880::2:8.443: Flags [P.], seq 1:518, ack 1, win 2053, options [nop,nop,TS val 159282932 ecr 2791557431], length 517
13:36:31.695277 IP6 (class 0x02, flowlabel 0x56784, hlim 64, next-header UDP (17) payload length: 1208) 2601:5cf:407e:8160:947e:4e9:57ab:10dd.57391 > 2620:149:a41:880::2:8.443: quic, initial, dcid 16b49dd0d9cca7d4, length 1182 [|quic]
13:36:31.702622 IP6 (flowlabel 0x525c2, hlim 49, next-header TCP (6) payload length: 32) 2620:149:a41:880::2:8.443 > 2601:5cf:407e:8160:947e:4e9:57ab:10dd.52638: Flags [.], cksum 0x8419 (correct), ack 518, win 32, options [nop,nop,TS val 2791557459 ecr 159282932], length 0
13:36:31.704209 IP6 (flowlabel 0x525c2, hlim 49, next-header TCP (6) payload length: 1460) 2620:149:a41:880::2:8.443 > 2601:5cf:407e:8160:947e:4e9:57ab:10dd.52638: Flags [.], seq 1:1429, ack 518, win 32, options [nop,nop,TS val 2791557459 ecr 159282932], length 1428
13:36:31.704719 IP6 (flowlabel 0xc25f0, hlim 64, next-header TCP (6) payload length: 32) 2601:5cf:407e:8160:947e:4e9:57ab:10dd.52638 > 2620:149:a41:880::2:8.443: Flags [.], cksum 0x7698 (correct), ack 1429, win 2031, options [nop,nop,TS val 159282962 ecr 2791557459], length 0
13:36:31.705449 IP6 (flowlabel 0x525c2, hlim 49, next-header TCP (6) payload length: 1460) 2620:149:a41:880::2:8.443 > 2601:5cf:407e:8160:947e:4e9:57ab:10dd.52638: Flags [P.], seq 1429:2857, ack 518, win 32, options [nop,nop,TS val 2791557459 ecr 159282932], length 1428
13:36:31.705451 IP6 (flowlabel 0x525c2, hlim 49, next-header TCP (6) payload length: 764) 2620:149:a41:880::2:8.443 > 2601:5cf:407e:8160:947e:4e9:57ab:10dd.52638: Flags [P.], seq 2857:3589, ack 518, win 32, options [nop,nop,TS val 2791557459 ecr 159282932], length 732
13:36:31.705963 IP6 (flowlabel 0xc25f0, hlim 64, next-header TCP (6) payload length: 32) 2601:5cf:407e:8160:947e:4e9:57ab:10dd.52638 > 2620:149:a41:880::2:8.443: Flags [.], cksum 0x6e37 (correct), ack 3589, win 2015, options [nop,nop,TS val 159282963 ecr 2791557459], length 0
13:36:31.721147 IP6 (flowlabel 0xc25f0, hlim 64, next-header TCP (6) payload length: 112) 2601:5cf:407e:8160:947e:4e9:57ab:10dd.52638 > 2620:149:a41:880::2:8.443: Flags [P.], seq 518:598, ack 3589, win 2048, options [nop,nop,TS val 159282979 ecr 2791557459], length 80
13:36:31.732418 IP6 (flowlabel 0xc25f0, hlim 64, next-header TCP (6) payload length: 1393) 2601:5cf:407e:8160:947e:4e9:57ab:10dd.52638 > 2620:149:a41:880::2:8.443: Flags [P.], seq 598:1959, ack 3589, win 2048, options [nop,nop,TS val 159282990 ecr 2791557459], length 1361
13:36:31.732661 IP6 (flowlabel 0xc25f0, hlim 64, next-header TCP (6) payload length: 843) 2601:5cf:407e:8160:947e:4e9:57ab:10dd.52638 > 2620:149:a41:880::2:8.443: Flags [P.], seq 1959:2770, ack 3589, win 2048, options [nop,nop,TS val 159282990 ecr 2791557459], length 811
13:36:31.732773 IP6 (flowlabel 0xc25f0, hlim 64, next-header TCP (6) payload length: 63) 2601:5cf:407e:8160:947e:4e9:57ab:10dd.52638 > 2620:149:a41:880::2:8.443: Flags [P.], seq 2770:2801, ack 3589, win 2048, options [nop,nop,TS val 159282990 ecr 2791557459], length 31
13:36:31.740373 IP6 (flowlabel 0x525c2, hlim 49, next-header TCP (6) payload length: 335) 2620:149:a41:880::2:8.443 > 2601:5cf:407e:8160:947e:4e9:57ab:10dd.52638: Flags [P.], seq 3589:3892, ack 598, win 32, options [nop,nop,TS val 2791557495 ecr 159282979], length 303
13:36:31.740376 IP6 (flowlabel 0x525c2, hlim 49, next-header TCP (6) payload length: 335) 2620:149:a41:880::2:8.443 > 2601:5cf:407e:8160:947e:4e9:57ab:10dd.52638: Flags [P.], seq 3892:4195, ack 598, win 32, options [nop,nop,TS val 2791557495 ecr 159282979], length 303
13:36:31.740377 IP6 (flowlabel 0x525c2, hlim 49, next-header TCP (6) payload length: 94) 2620:149:a41:880::2:8.443 > 2601:5cf:407e:8160:947e:4e9:57ab:10dd.52638: Flags [P.], seq 4195:4257, ack 598, win 32, options [nop,nop,TS val 2791557495 ecr 159282979], length 62
13:36:31.740712 IP6 (flowlabel 0xc25f0, hlim 64, next-header TCP (6) payload length: 32) 2601:5cf:407e:8160:947e:4e9:57ab:10dd.52638 > 2620:149:a41:880::2:8.443: Flags [.], cksum 0x6252 (correct), ack 4257, win 2038, options [nop,nop,TS val 159282998 ecr 2791557495], length 0
13:36:31.740826 IP6 (flowlabel 0xc25f0, hlim 64, next-header TCP (6) payload length: 63) 2601:5cf:407e:8160:947e:4e9:57ab:10dd.52638 > 2620:149:a41:880::2:8.443: Flags [P.], seq 2801:2832, ack 4257, win 2048, options [nop,nop,TS val 159282998 ecr 2791557495], length 31
13:36:31.751392 IP6 (flowlabel 0x525c2, hlim 49, next-header TCP (6) payload length: 63) 2620:149:a41:880::2:8.443 > 2601:5cf:407e:8160:947e:4e9:57ab:10dd.52638: Flags [P.], seq 4257:4288, ack 1959, win 33, options [nop,nop,TS val 2791557507 ecr 159282990], length 31
13:36:31.751507 IP6 (flowlabel 0xc25f0, hlim 64, next-header TCP (6) payload length: 32) 2601:5cf:407e:8160:947e:4e9:57ab:10dd.52638 > 2620:149:a41:880::2:8.443: Flags [.], cksum 0x61f3 (correct), ack 4288, win 2048, options [nop,nop,TS val 159283009 ecr 2791557507], length 0
13:36:31.762875 IP6 (flowlabel 0x525c2, hlim 49, next-header TCP (6) payload length: 32) 2620:149:a41:880::2:8.443 > 2601:5cf:407e:8160:947e:4e9:57ab:10dd.52638: Flags [.], cksum 0x69fc (correct), ack 2801, win 35, options [nop,nop,TS val 2791557513 ecr 159282990], length 0
13:36:31.792066 IP6 (flowlabel 0xc25f0, hlim 64, next-header TCP (6) payload length: 63) 2601:5cf:407e:8160:947e:4e9:57ab:10dd.52638 > 2620:149:a41:880::2:8.443: Flags [P.], seq 2801:2832, ack 4288, win 2048, options [nop,nop,TS val 159283049 ecr 2791557513], length 31
13:36:31.806785 IP6 (flowlabel 0x525c2, hlim 49, next-header TCP (6) payload length: 32) 2620:149:a41:880::2:8.443 > 2601:5cf:407e:8160:947e:4e9:57ab:10dd.52638: Flags [.], cksum 0x69a3 (correct), ack 2832, win 35, options [nop,nop,TS val 2791557563 ecr 159282998], length 0
13:36:31.810304 IP6 (flowlabel 0x525c2, hlim 49, next-header TCP (6) payload length: 44) 2620:149:a41:880::2:8.443 > 2601:5cf:407e:8160:947e:4e9:57ab:10dd.52638: Flags [.], ack 2832, win 35, options [nop,nop,TS val 2791557567 ecr 159283049,nop,nop,sack 1  [|tcp]>
13:36:31.928763 IP6 (flowlabel 0x525c2, hlim 49, next-header TCP (6) payload length: 1460) 2620:149:a41:880::2:8.443 > 2601:5cf:407e:8160:947e:4e9:57ab:10dd.52638: Flags [.], seq 4288:5716, ack 2832, win 35, options [nop,nop,TS val 2791557685 ecr 159283049], length 1428
13:36:31.928940 IP6 (flowlabel 0xc25f0, hlim 64, next-header TCP (6) payload length: 32) 2601:5cf:407e:8160:947e:4e9:57ab:10dd.52638 > 2620:149:a41:880::2:8.443: Flags [.], cksum 0x5b12 (correct), ack 5716, win 2026, options [nop,nop,TS val 159283186 ecr 2791557685], length 0
13:36:31.930201 IP6 (flowlabel 0x525c2, hlim 49, next-header TCP (6) payload length: 1425) 2620:149:a41:880::2:8.443 > 2601:5cf:407e:8160:947e:4e9:57ab:10dd.52638: Flags [P.], seq 5716:7109, ack 2832, win 35, options [nop,nop,TS val 2791557685 ecr 159283049], length 1393
13:36:31.930204 IP6 (flowlabel 0x525c2, hlim 49, next-header TCP (6) payload length: 63) 2620:149:a41:880::2:8.443 > 2601:5cf:407e:8160:947e:4e9:57ab:10dd.52638: Flags [P.], seq 7109:7140, ack 2832, win 35, options [nop,nop,TS val 2791557685 ecr 159283049], length 31
13:36:31.930349 IP6 (flowlabel 0xc25f0, hlim 64, next-header TCP (6) payload length: 32) 2601:5cf:407e:8160:947e:4e9:57ab:10dd.52638 > 2620:149:a41:880::2:8.443: Flags [.], cksum 0x5580 (correct), ack 7140, win 2026, options [nop,nop,TS val 159283188 ecr 2791557685], length 0
13:36:31.958681 IP6 (flowlabel 0xb0000, hlim 64, next-header TCP (6) payload length: 20) 2601:5cf:407e:8160:947e:4e9:57ab:10dd.64219 > 2607:f8b0:4004:c21::bc.5228: Flags [.], cksum 0x9bcc (correct), ack 2603504514, win 2048, length 0
13:36:31.967036 IP6 (class 0x02, flowlabel 0x73c33, hlim 64, next-header UDP (17) payload length: 1208) 2601:5cf:407e:8160:947e:4e9:57ab:10dd.62293 > 2607:f8b0:4004:c07::cf.443: quic, initial, dcid 87a77b2c87e5a05f, length 1182 [|quic]
13:36:31.978554 IP6 (flowlabel 0x22705, hlim 118, next-header TCP (6) payload length: 32) 2607:f8b0:4004:c21::bc.5228 > 2601:5cf:407e:8160:947e:4e9:57ab:10dd.64219: Flags [.], cksum 0xe2ba (correct), ack 1, win 1048, options [nop,nop,TS val 989706480 ecr 3732386171], length 0
13:36:31.984564 IP6 (hlim 55, next-header UDP (17) payload length: 1208) 2607:f8b0:4004:c07::cf.443 > 2601:5cf:407e:8160:947e:4e9:57ab:10dd.62293: quic, initial, scid e7a77b2c87e5a05f, length 1182 [|quic]
13:36:31.985208 IP6 (flowlabel 0x73c33, hlim 64, next-header UDP (17) payload length: 1208) 2601:5cf:407e:8160:947e:4e9:57ab:10dd.62293 > 2607:f8b0:4004:c07::cf.443: quic, initial, dcid e7a77b2c87e5a05f, length 1182 [|quic]
13:36:31.986060 IP6 (hlim 55, next-header UDP (17) payload length: 1208) 2607:f8b0:4004:c07::cf.443 > 2601:5cf:407e:8160:947e:4e9:57ab:10dd.62293: quic, handshake, scid e7a77b2c87e5a05f, length 1183 [|quic]
13:36:31.986153 IP6 (flowlabel 0x73c33, hlim 64, next-header UDP (17) payload length: 47) 2601:5cf:407e:8160:947e:4e9:57ab:10dd.62293 > 2607:f8b0:4004:c07::cf.443: quic, handshake, dcid e7a77b2c87e5a05f, length 22 [|quic]
13:36:31.987593 IP6 (hlim 55, next-header UDP (17) payload length: 1208) 2607:f8b0:4004:c07::cf.443 > 2601:5cf:407e:8160:947e:4e9:57ab:10dd.62293: quic, handshake, scid e7a77b2c87e5a05f, length 1183 [|quic]
13:36:31.987682 IP6 (flowlabel 0x73c33, hlim 64, next-header UDP (17) payload length: 47) 2601:5cf:407e:8160:947e:4e9:57ab:10dd.62293 > 2607:f8b0:4004:c07::cf.443: quic, handshake, dcid e7a77b2c87e5a05f, length 22 [|quic]
13:36:32.002393 IP6 (hlim 55, next-header UDP (17) payload length: 1208) 2607:f8b0:4004:c07::cf.443 > 2601:5cf:407e:8160:947e:4e9:57ab:10dd.62293: quic, handshake, scid e7a77b2c87e5a05f, length 1183 [|quic]
13:36:32.002470 IP6 (flowlabel 0x73c33, hlim 64, next-header UDP (17) payload length: 47) 2601:5cf:407e:8160:947e:4e9:57ab:10dd.62293 > 2607:f8b0:4004:c07::cf.443: quic, handshake, dcid e7a77b2c87e5a05f, length 22 [|quic]
13:36:32.005461 IP6 (hlim 55, next-header UDP (17) payload length: 1208) 2607:f8b0:4004:c07::cf.443 > 2601:5cf:407e:8160:947e:4e9:57ab:10dd.62293: quic, handshake, scid e7a77b2c87e5a05f, length 1114 [|quic]
13:36:32.005933 IP6 (flowlabel 0x73c33, hlim 64, next-header UDP (17) payload length: 47) 2601:5cf:407e:8160:947e:4e9:57ab:10dd.62293 > 2607:f8b0:4004:c07::cf.443: quic, handshake, dcid e7a77b2c87e5a05f, length 22 [|quic]
